2009-09-28,06:04:54,9om7u,687,"There's a huge flood in Manila, Philippines. Had no clue about it... Decided to spread the news to Reddit.",news.yahoo.com,http://news.yahoo.com/s/ap/20090927/ap_on_re_as/as_philippines_flooding
2009-09-27,20:16:33,9oil8,530,"No shame: Israel demands PA drop war crimes suit at The Hague, or else it would not permit a second cellular telephone provider to operate",haaretz.com,http://www.haaretz.com/hasen/spages/1117296.html
2009-09-27,12:02:38,9og5n,199,"""Dead"" baby wakes up for his funeral wake",canada.com,http://www.canada.com/life/Dead+baby+wakes+funeral+wake/1878265/story.html
2009-09-27,13:30:05,9ogml,74,Iranian Protester Flees Country After Telling of Rape and Torture in Prison ,nytimes.com,http://www.nytimes.com/2009/09/27/world/middleeast/27iran.html?ref=world
2009-09-27,22:45:44,9ojb8,62,"""When Obama announced that 'Iran is breaking rules that all nations must follow', he is technically and legally wrong.""",guardian.co.uk,http://www.guardian.co.uk/commentisfree/cifamerica/2009/sep/25/iran-secret-nuclear-plant-inspections?
2009-09-28,02:22:39,9okri,57,"Spontaneous order in action: Holland slashes traffic regulations, laws, eliminates stop lights; rate of traffic accidents plummet.",examiner.com,http://www.examiner.com/x-536-Civil-Liberties-Examiner~y2009m9d18-At-least-with-traffic-fewer-rules-make-for-better-behavior?cid=examiner-email
2009-09-27,13:05:56,9oghw,42,Germans are set to vote in a general election in which Chancellor Angela Merkel is seeking a second term,news.bbc.co.uk,http://news.bbc.co.uk/2/hi/europe/8276965.stm
2009-09-27,23:51:03,9ojpy,42,"typhoon victims in Philippines in dire need of food/clothing. Call the American Red Cross to help 1-800-435-7669. PLEASE REPOST on your twitter, plurk, and facebook to reach as many people as possible. Thanks Reddit!",self.worldnews,https://www.reddit.com/r/worldnews/comments/9ojpy/typhoon_victims_in_philippines_in_dire_need_of/
2009-09-27,16:00:48,9ohdv,34,Iceland plans huge export of whalemeat to Japan,news.bbc.co.uk,http://news.bbc.co.uk/2/hi/science/nature/8275732.stm
2009-09-27,13:16:00,9ogk3,29,"British victims of the credit crunch are offering to sell their kidneys for £25,000 or more to help pay debts",timesonline.co.uk,http://www.timesonline.co.uk/tol/life_and_style/health/article6850879.ece
2009-09-27,10:49:36,9ofsl,26,"Jerusalem ""is solely 'an Arab and Islamic city and it has always been so...' Jews have never lived there, the Temple never existed, and Israeli archaeologists have admitted as much.""",online.wsj.com,http://online.wsj.com/article/SB10001424052970203917304574413811883589676.html
2009-09-28,01:46:19,9okir,23,"First projections: Merkel Wins German Election, Has 
Slim Majority for Center-Right Government",spiegel.de,"http://www.spiegel.de/international/germany/0,1518,651610,00.html"
2009-09-28,02:55:41,9okzt,22,Roman Polanski arrested in Switzerland over sex with underage girl - Telegraph,telegraph.co.uk,http://www.telegraph.co.uk/news/worldnews/europe/switzerland/6236962/Roman-Polanski-arrested-in-Switzerland-over-sex-with-underage-girl.html
2009-09-28,05:06:51,9olve,17,Over 100 children in China diagnosed with lead poisoning,telegraph.co.uk,http://www.telegraph.co.uk/news/worldnews/asia/china/6236999/Over-100-children-in-China-diagnosed-with-lead-poisoning..html
2009-09-28,04:14:52,9oliq,12,Venezuela bans Family Guy cartoon because it promotes the use of marijuana,news.bbc.co.uk,http://news.bbc.co.uk/2/hi/entertainment/8277129.stm
2009-09-28,02:33:37,9oku7,11,Saudis will allow Israel to bomb Iran's nuclear site,sify.com,http://sify.com/news/international/fullstory.php?a=jj1m4jgdicj&title=Saudis_will_allow_Israel_to_bomb_Iran%27s_nuclear_site__
2009-09-27,23:32:10,9ojld,7,Swiss ministry says Polanski to be extradited,rawstory.com,http://rawstory.com/news/afp/Swiss_ministry_says_Polanski_to_be__09272009.html
2009-09-27,19:50:10,9oihd,6,Email communications interception on the rise in South Korea,english.hani.co.kr,http://english.hani.co.kr/arti/english_edition/e_national/378839.html
2009-09-28,05:05:25,9olv8,8,Xinjiang authorities ban online separatist talk,timesofindia.indiatimes.com,http://timesofindia.indiatimes.com/news/world/china/Xinjiang-authorities-ban-online-separatist-talk-State-media/articleshow/5062544.cms
2009-09-27,15:03:39,9oh4k,6,Israel the hypocrite: Israel's Dimona Nuclear Weapons Factory In 3D,youtube.com,http://www.youtube.com/watch?v=bbjgDERSuiI
2009-09-28,06:00:42,9om6w,5,Costa Rica prepares for Nicoya Peninsula earthquake,globalpost.com,http://www.globalpost.com/dispatch/costa-rica/090915/earthquake-prep
2009-09-27,11:01:20,9ofui,6,"Aussie politico attacks social media-savvy Prime Minister for ""spamming everyone on Facebook"" and the premier for ""tweeting with the energy of a 12yo with Tourettes.""",smh.com.au,http://www.smh.com.au/technology/rees-like-12yo-with-tourettes-says-labor-mp-20090926-g73q.html
2009-09-28,05:16:31,9olxm,5,Special radar will detect pirates off Somali coast,theeastafrican.co.ke,http://www.theeastafrican.co.ke/news/-/2558/664024/-/qyc4dlz/-/index.html
2009-09-27,16:10:59,9ohg0,2,Ahmadinejong-il Redux : Iran tests short-range missiles,news.bbc.co.uk,http://news.bbc.co.uk/2/hi/middle_east/8277040.stm
2009-09-27,15:31:36,9oh8w,2,US threatens airstrikes in Pakistan,timesonline.co.uk,http://www.timesonline.co.uk/tol/news/world/Afghanistan/article6850838.ece
2009-09-27,21:28:32,9oiwh,3,Terror laws could be used to force everyone in the UK to carry a passport just to travel around Britain,express.co.uk,http://www.express.co.uk/posts/view/130358/ID-checks-to-travel-across-border
2009-09-27,17:31:34,9ohuh,1,Just because it's on the news doesn't mean it's not real. Pictures of the flooding damage outside of Atlanta.,flickr.com,http://www.flickr.com/photos/willieljackson/sets/72157622338255883/
2009-09-27,09:13:25,9ofbc,3,"In northern India, village elders order 'honor killings' ",latimes.com,"http://www.latimes.com/news/nationworld/world/la-fg-india-honor26-2009sep26,0,1198207.story?track=rss"
2009-09-27,13:32:57,9ogn5,2,'Ahmadinejad has enough uranium to go whole way' -- secret facility is right size to make 'bomb or two a year',independent.co.uk,http://www.independent.co.uk/news/world/middle-east/ahmadinejad-has-enough-uranium-to-go-whole-way-1793483.html
2009-09-27,15:32:29,9oh95,1,Turkish PM said his country would push the Security Council to discuss a report by U.N. investigators accusing Israel and Palestinian militants of war crimes in the Gaza war.,alertnet.org,http://www.alertnet.org/thenews/newsdesk/N26539501.htm
