2009-01-27,17:56:13,7spye,1121,David Attenborough reveals creationist hate mail for not crediting God,guardian.co.uk,http://www.guardian.co.uk/world/2009/jan/27/david-attenborough-science
2009-01-27,08:09:51,7smio,96,"Bolivians yesterday approved a new constitution granting more power to the country's indigenous majority and rolling back half a millennium of colonialism, discrimination and humiliation.",guardian.co.uk,http://www.guardian.co.uk/world/2009/jan/26/bolivia
2009-01-28,02:07:21,7stvg,60, Israeli army rabbi 'gave out hate leaflet to troops entering Gaza',belfasttelegraph.co.uk,http://www.belfasttelegraph.co.uk/news/world-news/israeli-army-rabbi-gave-out-hate-leaflet-to-troops-entering-gaza-14159082.html
2009-01-27,15:03:20,7sp0j,57,Leningrad Siege: Now and Then [PIC],tinyurl.com,http://tinyurl.com/by8wzz
2009-01-27,18:51:07,7sqa1,44,"Jacques Monin: The British are obsessed with money, drowning in debt and morally bankrupt",guardian.co.uk,http://www.guardian.co.uk/business/2009/jan/27/britain-economy-money-debt-morality/print
2009-01-27,22:45:37,7sruj,39,"U.N.: At least 230,000 civilians are trapped ""directly in the path of the fighting"" in Sri Lanka's campaign against the Tamil Tigers.",alertnet.org,http://alertnet.org/thenews/newsdesk/IRIN/c25ea22b0ff5aa4526f7b8a1a47448dd.htm
2009-01-27,20:07:24,7sqqp,42,"Hundreds of ciitzens killed in warzone, but unable to leave as army attacks.  This isn't Gaza so who cares?",nytimes.com,http://www.nytimes.com/aponline/2009/01/27/world/AP-AS-Sri-Lanka-Civil-War.html?scp=3&sq=sri+lanka&st=nyt
2009-01-27,23:52:27,7ssh8,37,Rumor: The word on the street here in Iceland is that Jóhanna Sigurðardóttir will be appointed the next prime minister. If so she will become the first openly homosexual head of government. ,self.worldnews,https://www.reddit.com/r/worldnews/comments/7ssh8/rumor_the_word_on_the_street_here_in_iceland_is/
2009-01-28,01:30:57,7stfs,31,60 Minutes: Is Israel's free ride almost over? | The Smirking Chimp,smirkingchimp.com,http://www.smirkingchimp.com/thread/19978
2009-01-27,10:45:00,7sngw,23,Gaza Horror: Updated Large Photo Gallery of Gaza Massacre by Israel ,globalresearch.ca,http://www.globalresearch.ca/index.php?context=viewArticle&code=20090126&articleId=12012
2009-01-27,13:24:43,7sogo,21,The UN Crime and Drug Watchdog Has Indications That Money Made in Illicit Drug Trade Has Been Used to Keep Banks Afloat in the Global Financial Crisis,iht.com,http://www.iht.com/articles/reuters/2009/01/25/europe/OUKWD-UK-FINANCIAL-UN-DRUGS.php
2009-01-28,04:08:38,7sv1f,18,"Proposed U.K. Legislation ""wipe out the personal privacy of everyone in Britain at a single stroke""",independent.co.uk,http://www.independent.co.uk/news/uk/politics/data-bill-will-wipe-out-privacy-at-a-stroke-1516799.html
2009-01-27,23:05:45,7ss13,23,"War on Gaza is pushing the Mid East, from the Israelis to the Saudis, to extremes. Saudis and Iranians are considering allying in response to the strikes",thenation.com,http://www.thenation.com/blogs/dreyfuss/401599
2009-01-28,00:31:01,7ssvo,18,The Torture Ban that Doesn't Ban Torture,dissidentvoice.org,http://www.dissidentvoice.org/2009/01/the-torture-ban-that-doesnt-ban-torture/
2009-01-27,10:02:10,7sn88,17,London Police Running from Muslim Protesters,youtube.com,http://www.youtube.com/watch?v=97hyDRjdXCE
2009-01-28,01:20:12,7stcf,17,"Border Bombing, Air Strikes Mar Gaza Truce",news.antiwar.com,http://news.antiwar.com/2009/01/27/border-bombing-air-strikes-mar-gaza-truce/
2009-01-27,13:42:24,7sokv,16,"Don’t get taken alive, Israeli soldiers told",russiatoday.com,http://www.russiatoday.com/news/news/36421
2009-01-28,01:59:42,7stsz,17,"Left to die: ""Thai army was operating a dump-at-sea policy"" - one Thai military source, after extensive questioning, on treatment of refugees.",cnn.com,http://www.cnn.com/2009/WORLD/asiapcf/01/27/thailand.refugees/index.html
2009-01-27,11:20:35,7snov,16,i'm not sure if i'm more surprised that 1b people are using the internet or that the other 5b aren't,economist.com,http://www.economist.com/daily/chartgallery/displayStory.cfm?story_id=13007996&source=features_box_main
2009-01-27,17:28:12,7spsd,16,'Two killed' in Gaza border clash,news.bbc.co.uk,http://news.bbc.co.uk/2/hi/middle_east/7852745.stm
2009-01-27,17:25:33,7sprq,14,Auschwitz decays -- Former death camp crumbling away for lack of funding,news.bbc.co.uk,http://news.bbc.co.uk/2/hi/europe/7842671.stm
2009-01-27,08:05:34,7smhd,13,Four generations of an Icelandic family had lost everything and wanted help to build a gallows in front of the parliament building so a member of the family could hang himself in public,independent.co.uk,http://www.independent.co.uk/news/world/europe/meltdown-iceland-on-the-brink-1515753.html
2009-01-28,02:07:44,7stvn,11,Gaza fund donations double after TV channels broadcast appeal,belfasttelegraph.co.uk,http://www.belfasttelegraph.co.uk/news/local-national/gaza-fund-donations-double-after-tv-channels-broadcast-appeal-14159080.html
2009-01-28,07:45:02,7swrr,10,ICRC: 'Crisis unfolding' in Sri Lanka,news.bbc.co.uk,http://news.bbc.co.uk/2/hi/south_asia/7854601.stm
2009-01-28,02:59:49,7sudt,7,How Will Obama Respond to Bolivia's New Constitution,politicalaffairs.net,http://www.politicalaffairs.net/article/articleview/8029/
2009-01-27,23:23:33,7ss6z,9,"Susan Solomon, one of the world's top climate scientists, finds in her new study that global warming is now irreversible",npr.org,http://www.npr.org/templates/story/story.php?storyId=99888903
2009-01-28,04:48:08,7svds,7,What If Israel Were in Your Neighborhood?,counterpunch.org,http://www.counterpunch.org/mokhiber01272009.html
2009-01-27,19:22:40,7sqfz,8,BBC boycott of Gaza appeal actually boosted support for charities,riverscrap.typepad.com,http://riverscrap.typepad.com/home/2009/01/bbc-accused-of-hypocrisy-over-gaza-appeal-boycott.html
2009-01-28,04:44:45,7svcp,8,"SF detectives think that French man stabbed himself to death. ""Red"" stuff on knife turns out to be sauce, so they declare that he washed it after stabbing himself. French police have to come in and investigate.",sfgate.com,http://www.sfgate.com/cgi-bin/article.cgi?f=/c/a/2009/01/27/BA4415H831.DTL
2009-01-27,20:24:58,7squ2,7,Israeli Hero: Violence is Not the Answer,wariscrime.com,http://www.wariscrime.com/2009/01/27/news/israeli-hero-violence-is-not-the-answer/
