2009-07-23,23:11:37,93uno,466,New Jersey mayors and rabbis arrested for involvement in international money-laundering conspiracy,cnn.com,http://www.cnn.com/2009/CRIME/07/23/new.jersey.arrests/index.html
2009-07-23,13:41:12,93q9s,127,"South Korean unions prepare for general strike: ""If media is controlled by large conglomerates and capital, then there is no hope for democracy in the South Korea.""",kctu.org,http://kctu.org/ActionAlerts/3664
2009-07-23,23:45:15,93v0r,70,Four-year-old Samar Abed Rabbu was paralyzed and lost her two sisters during Israel's offensive in Gaza last December and January. Her family claims to have been waving a white flag while IDF shot at them.,news.bbc.co.uk,http://news.bbc.co.uk/2/hi/middle_east/8164582.stm
2009-07-24,00:32:51,93vlu,29,Swine flu:  Country by Country,news.bbc.co.uk,http://news.bbc.co.uk/1/hi/uk/8083179.stm
2009-07-23,13:14:30,93q2o,18,One cleric's legacy of peace,news.bbc.co.uk,http://news.bbc.co.uk/2/hi/south_asia/8152615.stm
2009-07-24,07:14:11,93zvi,17,Dutch return severed head of Ghana chief,msnbc.msn.com,http://www.msnbc.msn.com/id/32106711/ns/world_news-europe/
2009-07-24,00:04:20,93v9i,14,"The new Nepalese government has announced its intent to award $1270 to couples in inter-caste marriages, and $635 to couples when a widow remarries, a plan that has been welcomed by some caste activists, but opposed by women's rights groups.",americanchronicle.com,http://www.americanchronicle.com/articles/view/111168
2009-07-23,22:26:29,93u78,12,Iceland submits EU membership bid,news.bbc.co.uk,http://news.bbc.co.uk/2/hi/europe/8164573.stm
2009-07-24,01:37:50,93we4,13,Israel on 'collision course' with Washington - report,jordantimes.com,http://jordantimes.com/?news=18622
2009-07-23,17:28:32,93rvr,13,"North Korea calls Clinton vulgar, unintelligent",washingtonpost.com,http://www.washingtonpost.com/wp-dyn/content/article/2009/07/23/AR2009072300299.html
2009-07-24,05:56:09,93z71,10,BRUSSELS — Belgian authorities say three inmates made a dramatic escape from prison by helicopter.,google.com,http://www.google.com/hostednews/ap/article/ALeqM5gpAPrUZGp2ExBqqLfh5SMEvXy3eQD99KB5KG0
2009-07-23,19:17:00,93sn4,8,Israel bans the word nakba from Arab children's textbooks. ,guardian.co.uk,http://www.guardian.co.uk/world/2009/jul/22/israel-remove-nakba-from-textbooks
2009-07-24,01:57:16,93wna,8,Palestinian arrested [by Israel] after testifying in Geneva,ynetnews.com,"http://www.ynetnews.com/articles/0,7340,L-3750927,00.html"
2009-07-23,16:45:34,93rl8,8,Gaza Graffiti | The Sitch,thesitch.com,http://www.thesitch.com/viva-palestina/2009/07/graffiti-in-gaza/
2009-07-23,10:35:17,93ozr,7,"Violence in South Africa's townships has spread as residents protest about what they say is a lack of basic services, such as water and housing.",news.bbc.co.uk,http://news.bbc.co.uk/2/hi/africa/8163187.stm
2009-07-23,19:30:04,93sqk,6,Fuzzy Wuzzy Angels officially recognised,abc.net.au,http://www.abc.net.au/news/stories/2009/07/23/2634707.htm?section=justin
2009-07-23,12:20:07,93pou,9,Tokelau aims for 100% renewable energy,rnzi.com,http://www.rnzi.com/pages/news.php?op=read&id=47897
2009-07-24,00:23:00,93vhj,4,"Radio has pushed conflict and genocide in Bosnia, Kenya, Pakistan and -- most notably -- Rwanda, where Radio Mille Collines urged on massacres with phrases like “killing the cockroaches”. But as anybody with experience of the problem confirms, neutralising hate radio is not so simple.",economist.com,http://www.economist.com/world/international/displaystory.cfm?story_id=14098593
2009-07-23,18:50:39,93sg0,4,Moscow under redevelopment - shame about the architectural heritage,independent.co.uk,http://www.independent.co.uk/news/world/europe/the-collapse-of-moscow-architectural-heritage-being-destroyed-1757485.html
2009-07-24,05:44:38,93z39,6,Paralysed girl's story reflects Gaza's plight,news.bbc.co.uk,http://news.bbc.co.uk/1/hi/world/middle_east/8164582.stm
2009-07-23,21:58:22,93txs,5,12 Israelis nabbed for US lottery fraud,jpost.com,http://www.jpost.com/servlet/Satellite?cid=1248277864950&pagename=JPost%2FJPArticle%2FShowFull
2009-07-24,07:10:13,93zup,3,Big turnout expected in hotly contested Iraqi Kurdistan vote,self.worldnews,https://www.reddit.com/r/worldnews/comments/93zup/big_turnout_expected_in_hotly_contested_iraqi/
2009-07-23,22:59:16,93uj6,2,One of Osama Bin Laden's sons is believed to have been killed by a US missile strike in Pakistan earlier this year,news.bbc.co.uk,http://news.bbc.co.uk/2/hi/americas/8164763.stm
2009-07-23,11:08:36,93p88,6,"Murders, rapes and major internal displacement in the Democratic Republic of Congo have been linked to a number of multinational companies ...",huffingtonpost.com,http://www.huffingtonpost.com/2009/07/21/congo-rapes-violence-link_n_242235.html
2009-07-24,07:01:40,93zs7,2,"Saad bin Laden, son of Al-Qaeda leader, likely dead",themajlis.org,http://www.themajlis.org/2009/07/23/saad-bin-laden-son-of-al-qaeda-leader-likely-dead
2009-07-23,14:36:08,93qov,2,Pakistan Unhappy About America Expanding War in Afghanistan  ,crooksandliars.com,http://crooksandliars.com/susie-madrak/pakistan-unhappy-about-america-expand
2009-07-24,06:45:00,93zmq,3,"About 100,000 people caught swine flu in England 
last week - government information website 
overwhelmed",guardian.co.uk,http://www.guardian.co.uk/world/2009/jul/23/swine-flu-website-overwhelmed
2009-07-23,09:18:02,93ofp,3,"Coming soon to an Airline near you - true ""Cattle 
Class"" - pack in the passengers with standing room 
only.",news.com.au,"http://www.news.com.au/travel/story/0,28318,25823181-5014090,00.html"
2009-07-24,04:20:44,93y9y,0,Russia and China start war games aimed at Urumqi-style riots,russiatoday.com,http://www.russiatoday.com/Top_News/2009-07-23/China--Russia-launch-large-scale-war-games.html
2009-07-23,14:39:42,93qpu,2,"Honduras: 1055 human rights violations and compromising with rapists. ""I am proud that he did not die while committing a crime or out of drunkenness, but because he fought against repression.""",wsws.org,http://wsws.org/articles/2009/jul2009/hond-j20.shtml
