2009-01-20,12:52:21,7qzp1,440,"Graffiti by Israeli soldiers in Gaza:  ""Arabs need 2 die"", ""Die you all"", ""Make war not peace"", ""1 is down, 999,999 to go"", and scrawled on an image of a gravestone the words: ""Arabs 1948-2009"".",guardian.co.uk,http://www.guardian.co.uk/world/2009/jan/20/gaza-israel-samouni-family
2009-01-20,20:07:32,7r20a,408,Amnesty International accuses Israel of war crimes in Gaza,guardian.co.uk,http://www.guardian.co.uk/world/2009/jan/20/israel-war-crimes-phosphorus
2009-01-20,21:24:18,7r2fq,278,Vigilante groups in Mexico vow to end the life of a criminal every 24 hours. ,reuters.com,http://www.reuters.com/article/latestCrisis/idUSN19371958
2009-01-20,11:22:11,7qz3n,268,Just when you think it couldn't get worse.... Traces of depleted uranium have been found in Palestinian victims.,news.yahoo.com,http://news.yahoo.com/s/ap/20090119/ap_on_re_eu/eu_nuclear_israel_gaza?date=1192009
2009-01-20,19:05:57,7r1oc,174,"Obama's Chief of Staff is a former Israeli soldier and son of a member of a militant Zionist group.  No softening of the US Pro-Israel line in the new administration, then?",alarabiya.net,http://www.alarabiya.net/articles/2008/11/06/59637.html
2009-01-20,08:50:09,7qya7,120,"BBC: Gaza 'looks like an earthquake zone.'  Over 50K now homeless, 40K without running water.",news.bbc.co.uk,http://news.bbc.co.uk/2/hi/middle_east/7838618.stm?
2009-01-20,12:59:31,7qzqx,89,"Pro Israeli group CPT disseminating defamatory and unsubstantiated accusations about Boston Muslim community members, who are raising money for humanitarian aid to Gaza.",eaazi.blogspot.com,http://eaazi.blogspot.com/2009/01/concerns-raised-about-potentially.html
2009-01-21,04:25:41,7r69h,75,China says will expand its military reach around the Globe,english.aljazeera.net,http://english.aljazeera.net/news/asia-pacific/2009/01/200912092726865304.html
2009-01-20,12:24:19,7qzj1,66,"2 Myanmar fisherman, sunk in Thai fishing boat, found floating in fridge off AUS after 25 days at sea",msnbc.msn.com,http://www.msnbc.msn.com/id/28738808/
2009-01-21,04:41:36,7r6eh,63,"Most senior burns sugeon in Gaza says 60-70 patients in his unit have died of burns unlike anything he's seen before.  Plus, video of apparent white phosphorus in Gaza.",guardian.co.uk,http://www.guardian.co.uk/world/2009/jan/21/gaza-phosphorus-israel
2009-01-20,22:23:13,7r2uu,55,Reports reveal devastation wreaked by Israeli military in Gaza,wsws.org,http://www.wsws.org/articles/2009/jan2009/gaza-j20.shtml
2009-01-20,14:45:31,7r0c7,49,Gaza Strip Damage Assessments from Satellite Images,unosat.web.cern.ch,http://unosat.web.cern.ch/unosat/asp/prod_free.asp?id=120
2009-01-20,08:26:47,7qy5m,40,Israel seeks to control reconstruction of war-torn Gaza ,haaretz.com,http://haaretz.com/hasen/spages/1056791.html
2009-01-21,04:17:26,7r66t,32,"Do not be confused by the ceasefire, the siege of Gaza continues",philipweiss.org,http://www.philipweiss.org/mondoweiss/2009/01/sc.html
2009-01-20,09:59:29,7qyne,30,Uganda's rebel Lord's Resistance Army has reportedly torched a church crowded with worshippers holding a prayer vigil in the Democratic Republic of Congo.,news.bbc.co.uk,http://news.bbc.co.uk/2/hi/africa/7837526.stm
2009-01-20,13:33:07,7qzym,25,Full scale civil war is underway in Mexico,americanchronicle.com,http://www.americanchronicle.com/articles/view/88259
2009-01-20,10:17:36,7qyqd,27,Israel PM Olmert brags about ordering Bush around,iht.com,http://www.iht.com/articles/2009/01/13/america/13olmert.php
2009-01-21,07:18:13,7r7ll,21,Gloomy prognosis predicted for Haiti as misery deepens,seattletimes.nwsource.com,http://seattletimes.nwsource.com/html/nationworld/2008641952_haiti18.html
2009-01-21,07:14:02,7r7kn,16,Violent political protests sweeping parts of formerly Communist Europe spread to Lithuania,moscowtimes.ru,http://www.moscowtimes.ru/article/1010/42/373637.htm
2009-01-21,00:15:14,7r3vd,18,Israle massacre in Gaza; 27 of same family die in Israeli house demolition,english.aljazeera.net,http://english.aljazeera.net/news/middleeast/2009/01/2009118194212986246.html
2009-01-21,04:41:22,7r6ed,18,More Evidence Israel Was Founded By Ruthless Racists-  The Israeli Government Deliberately Exposed Sephardic Children To Massive Doses Of Radiation,web.israelinsider.com,http://web.israelinsider.com/views/3998.htm
2009-01-20,21:18:37,7r2ea,13,Jail for man who raped daughters,news.bbc.co.uk,http://news.bbc.co.uk/1/hi/scotland/tayside_and_central/7839444.stm
2009-01-20,09:44:44,7qyjz,15,An Israeli woman sends an open video letter to Obama,youtube.com,http://www.youtube.com/watch?v=EcGm-gxmxHw&fmt=22
2009-01-20,22:20:24,7r2tu,13,Holocaust: Back then vs. Now,persia1.wordpress.com,http://persia1.wordpress.com/2009/01/19/holocaust-survivors-from-wold-war-ii-make-holocaust-in-gaza-photos/
2009-01-20,13:18:56,7qzvm,10,"Russia to open naval bases in Libya, Syria and Yemen ",hindu.com,http://www.hindu.com/2009/01/18/stories/2009011860681300.htm
2009-01-21,03:00:00,7r5eh,10,"UN refugee agency investigates alleged abuses against Muslim Rohingya boat people in Thailand, including the claim that some were towed out to sea and left to die.",alertnet.org,http://alertnet.org/thenews/newsdesk/UNHCR/74986be9c79cf6479398768cd43e9d21.htm
2009-01-20,16:16:55,7r0t5,9,A Photo Barack Obama May Want To Forget,chicagotribune.com,"http://www.chicagotribune.com/news/nationworld/chi-talk-lawn-19-jan19,0,7332212.story"
2009-01-20,11:54:16,7qzb7,9,Russia's Gazprom company has said it will resume gas supplies to Europe via Ukraine.,news.bbc.co.uk,http://news.bbc.co.uk/2/hi/europe/7839053.stm
2009-01-20,10:56:50,7qyxt,8,Gaza: Demolished in three weeks. Rebuilding it will take years,belfasttelegraph.co.uk,http://www.belfasttelegraph.co.uk/news/world-news/gaza-demolished-in-three-weeks-rebuilding-it-will-take-years-14147408.html
2009-01-20,11:58:07,7qzca,7,Five killed as riot police end Seoul sit-in,news.com.au,"http://www.news.com.au/dailytelegraph/story/0,22049,24937199-5006003,00.html"
