2009-09-20,05:13:08,9m7o3,49,UK labor unions approve Israeli goods boycott in response to the offensive in Gaza,google.com,http://www.google.com/hostednews/ap/article/ALeqM5g6zuIeGt58E-zQ0hp0ZAMpuj_0qgD9AP6QJO0
2009-09-20,00:57:49,9m5yy,43,Russia says it won't deploy missiles near Poland ,news.yahoo.com,http://news.yahoo.com/s/ap/20090919/ap_on_re_eu/eu_russia_missile_defense;_ylt=An0yjQqO9frkKUiQaXuXsltbbBAF;_ylu=X3oDMTJzZXUwa250BGFzc2V0A2FwLzIwMDkwOTE5L2V1X3J1c3NpYV9taXNzaWxlX2RlZmVuc2UEY3BvcwMxBHBvcwMxBHNlYwN5bl90b3Bfc3RvcmllcwRzbGsDbWluaXN0ZXJydXNz
2009-09-19,07:22:15,9lzm4,31,A Moroccan man campaigning to change the law banning eating in public during the Muslim Ramadan fast says he has received 100 death threats this week.,news.bbc.co.uk,http://news.bbc.co.uk/2/hi/africa/8262787.stm
2009-09-19,20:59:53,9m4fn,31,"Why are over 80,000 UK residents being denied the right to vote?",guardian.co.uk,http://www.guardian.co.uk/society/2008/sep/19/prisonsandprobation.civilliberties
2009-09-19,21:04:23,9m4gm,25,Lockerbie bomber puts documents online that he claims prove his innocence,guardian.co.uk,http://www.guardian.co.uk/world/2009/sep/18/megrahi-lockerbie-appeal-documents
2009-09-20,02:46:20,9m6rb,17,CIA Adding Bases in Afghanistan as Taliban Gains,bloomberg.com,http://www.bloomberg.com/apps/news?pid=20601103&sid=aea63RATz1lM
2009-09-20,01:22:53,9m65m,18,Credit crunch signals end of The World for Dubai’s multi-billion dollar property deal,timesonline.co.uk,http://www.timesonline.co.uk/tol/travel/news/article6831481.ece
2009-09-19,17:27:54,9m3c1,14,Hundreds of millions of dollars worth of phone bill rebates coming for Canadian after Supreme Court ruling,cbc.ca,http://www.cbc.ca/canada/ottawa/story/2009/09/17/phone-overbilling-bell-telus-supreme-court.html
2009-09-19,18:05:59,9m3ja,12,Courage in Iran,timesonline.co.uk,http://www.timesonline.co.uk/tol/comment/leading_article/article6840593.ece
2009-09-19,09:42:43,9m0i9,9,Nairobi Kenya begins clearing out its Kibera slum of 1 million people,irinnews.org,http://www.irinnews.org/Report.aspx?ReportId=86203
2009-09-19,11:11:40,9m12r,7,Lockerbie bomber publishes his evidence for innocence.  Is this true or can the net prove it's a lie?,guardian.co.uk,http://www.guardian.co.uk/uk/2009/sep/18/lockerbie-bomber-megrahi-trial-dossier
2009-09-19,07:55:55,9lzu4,4,"Lab tech is charged with Le's murder, still no clear reason for the murder whatsoever",latimes.com,"http://www.latimes.com/news/nationworld/nation/la-na-yale-student18-2009sep18,0,3083836.story"
2009-09-20,06:25:20,9m83i,5,"It is not everyday that a plane full of Australians land in central Russia, but when the passengers are dairy cows, it is seen as history making.",abc.net.au,http://www.abc.net.au/news/stories/2009/09/19/2690848.htm
2009-09-20,06:18:59,9m823,7,Gurkhas to declare independent state in India,telegraph.co.uk,http://www.telegraph.co.uk/news/worldnews/asia/india/6202223/Gurkhas-to-declare-independent-state-in-India.html
2009-09-19,09:53:57,9m0l7,2,"Bolivia - Extremism causes right-wing candidates to drop below 10% support: ""the right-wing opposition has been weakened since violent incidents last year... at least 15 indigenous people were shot to death when a group of Morales supporters were ambushed""",upsidedownworld.org,http://upsidedownworld.org/main/content/view/2108/31/
2009-09-19,18:22:12,9m3mc,3,Vaccine could be 'more dangerous than swine flu',abc.net.au,http://www.abc.net.au/news/stories/2009/09/19/2690820.htm
2009-09-19,08:32:07,9m028,4,Military gets mowed down by bullets by their own police force.  Where's the news coverage?!,google.com,http://www.google.com/hostednews/ap/article/ALeqM5j7k50KHJzJtVePeNnQ0J2U9eOulAD9AGJQN00
2009-09-19,13:48:56,9m21k,4,"Political tensions are on the rise again in Thailand, with tens of thousands of anti-government protesters expected to take to the streets of Bangkok to mark the third anniversary of the military coup which ousted their leader.",abc.net.au,http://www.abc.net.au/news/stories/2009/09/19/2690813.htm?section=justin
2009-09-19,17:48:43,9m3g9,0,Anonymous Blogging guide now available in Arabic,advocacy.globalvoicesonline.org,http://advocacy.globalvoicesonline.org/2009/09/06/anonymous-blogging-guide-available-arabic/
2009-09-19,18:20:35,9m3lw,0,Tax man twists Maradona's ears,abc.net.au,http://www.abc.net.au/news/stories/2009/09/19/2690842.htm
2009-09-20,07:32:25,9m8ha,0,Arctic Sea saga – sources of speculation,bu.edu,http://www.bu.edu/phpbin/news-cms/news/?dept=732&id=54325
2009-09-20,02:02:51,9m6gc,1,China warns of stability threat from H1N1 flu,reuters.com,http://www.reuters.com/article/americasCrisis/idUSSP458744
2009-09-20,05:24:20,9m7q9,0,"At emergency meeting in Venezuela, IAPA pushes for press freedom",knightcenter.utexas.edu,http://knightcenter.utexas.edu/blog/?q=en/node/5248
