2009-06-03,16:57:43,8pdn2,177,Undercover With BNP Campaigners,youtube.com,http://www.youtube.com/watch?v=4nBiCymtchA
2009-06-04,06:33:26,8pkpo,77,"How did this slip by?  ""US Army Confirms Israeli Nukes""",military.com,http://www.military.com/news/article/March/2009/us-army-confirms-israeli-nukes.html
2009-06-04,07:43:45,8pl7x,28,"Scores of Israelis rallied in front of the American Consulate in Jerusalem, labeled Barack Obama “the most anti-Semitic American president.”",news.antiwar.com,http://news.antiwar.com/2009/06/03/obama-wants-new-israeli-position-by-july/
2009-06-04,04:58:50,8pjy9,23,"Air France Flight A447: The Last 4 Minutes. ""The last message received was an advisory regarding cabin vertical speed.""",blogs.news.sky.com,http://blogs.news.sky.com/foreignmatters/Post:0fc148fa-4542-4246-99e7-c0a8824562e6
2009-06-04,04:17:19,8pjl5,21,Cuba's 47-year suspension from the Organization of American States lifted without conditions,miamiherald.com,http://www.miamiherald.com/459/story/1079796.html
2009-06-03,10:56:29,8pb8g,18,Yemeni Prisoner Dies At Guantanamo of Apparent Suicide,pubrecord.org,http://www.pubrecord.org/torture/931-yemeni-prisoner-muhammad-salih-dies-at-guantanamo.html
2009-06-03,09:26:02,8pam5,17,"Hummer, now owned by the Chinese ",money.cnn.com,http://money.cnn.com/2009/06/02/news/companies/gm_hummer/?postversion=2009060216
2009-06-03,15:37:34,8pd28,15,Australia staves off recession,thedaily.com.au,http://www.thedaily.com.au/news/2009/jun/03/aap-australia-staves-off-recession/
2009-06-03,16:11:31,8pdbq,15,"How the BNP has not changed . North West European candidate Nick Griffin speaking beside David Duke , KKK leader",youtube.com,http://www.youtube.com/watch?v=04QolIvfQEw
2009-06-03,12:00:02,8pbnr,11,Was the crash of  Air France 447 caused by a programming error?,time.com,"http://www.time.com/time/world/article/0,8599,1902421,00.html?xid=rss-topstories"
2009-06-03,23:47:05,8pguy,12,"China’s government censors have begun to block access to the Internet services Twitter, Flickr, Hotmail and Live.com, broadening an already extraordinary effort to shield its citizens from any hint of Thursday’s 20th anniversary of the Tiananmen Square pro-democracy movement.",nytimes.com,http://www.nytimes.com/2009/06/03/world/asia/03china.html
2009-06-04,00:35:37,8phcs,11,Canadian Mint Can't Account for Missing Gold,ottawacitizen.com,http://www.ottawacitizen.com/Business/Mint+account+missing+gold/1656084/story.html
2009-06-03,18:05:07,8pe3j,9,Problems much greater than anyone could have imagined |  The financial crisis in Iceland,newsfrettir.com,http://newsfrettir.com/economy-a-finance/national-finance/836-problems-much-greater-than-anyone-could-have-imagined
2009-06-03,13:58:49,8pcem,9,North Korea will test the ICBM and mid-range missiles in a few weeks.,english.chosun.com,http://english.chosun.com/site/data/html_dir/2009/06/03/2009060300329.html
2009-06-04,00:25:54,8ph9l,6,"Uk Redditors - before you vote tomorrow, learn about the real BNP",hopenothate.org.uk,http://www.hopenothate.org.uk/the-real-bnp/
2009-06-04,04:54:56,8pjxf,6,"Air France crash: plane may have broken up in mid-air and likely ""exploded at high altitude""",telegraph.co.uk,http://www.telegraph.co.uk/news/worldnews/europe/france/5437945/Air-France-crash-plane-may-have-broken-up-in-mid-air.html
2009-06-04,04:40:41,8pjsj,7,Both China and the West have distorted the truth about the Tiananmen Square protests and the massacre that followed,thefirstpost.co.uk,"http://www.thefirstpost.co.uk/48304,features,the-tiananmen-square-myth-both-china-and-the-west-distorted-the-truth-about-the-massacre-human-rights-amnesty-deng-xiaoping"
2009-06-03,14:43:09,8pcoq,7,New Zealand named world's most peaceful country,visionofhumanity.org,http://www.visionofhumanity.org/news/140/aotearoa-named-world%92s-most-peaceful-nation/
2009-06-03,21:01:34,8pfbh,6,"U.S. Report Finds Airstrike Errors in Afghan Deaths. ""The Afghan government concluded that about 140 civilians had been killed in the attacks."" ",nytimes.com,http://www.nytimes.com/2009/06/03/world/asia/03military.html?_r=1&partner=rss&emc=rss&src=igw
2009-06-04,01:03:53,8phne,6,Footage of Taliban bombing of security offices in Lahore,youtube.com,http://www.youtube.com/watch?v=VO6-5BqBkIM&eurl
2009-06-03,19:18:41,8pelk,7,Hazel Blears resigns from cabinet,news.bbc.co.uk,http://news.bbc.co.uk/1/hi/uk_politics/8080777.stm
2009-06-03,14:58:19,8pcsi,7,The BNP in Manchester came with loudhailers  playing 'Rule Britannia'  to picket .... a cathedral  service.,manchestereveningnews.co.uk,http://www.manchestereveningnews.co.uk/news/s/1118319_bnp_picket_cathedral
2009-06-03,11:54:12,8pbmb,7,"A 250m-long crop circle of a jellyfish has appeared on farmland causing up to £600,000 worth of damage.",news.bbc.co.uk,http://news.bbc.co.uk/1/hi/england/oxfordshire/8080315.stm
2009-06-03,10:14:20,8paya,5,The World Bank decides to invest $121 million in helping Haiti develop; Bill Clinton named special envoy to the Western Hemisphere's poorest country.,alertnet.org,http://alertnet.org/thenews/newsdesk/N02526174.htm
2009-06-03,13:24:23,8pc5q,5,Brazilian Defense Minister said debris found in the south Atlantic is without a doubt from the Air France flight.,english.chosun.com,http://english.chosun.com/site/data/html_dir/2009/06/03/2009060300291.html
2009-06-04,00:00:00,8ph00,5,"Okay, Sri Lanka!  You've won.  Now stop keeping foreign aid workers from people who need their help!",timesonline.co.uk,http://www.timesonline.co.uk/tol/news/world/asia/article6418015.ece
2009-06-03,10:01:12,8pav2,6,The British Government's £285MILLION Mortgage Rescue Scheme helps just TWO families - but of course it keeps droves of useless ministers in luxury!,dailymail.co.uk,http://www.dailymail.co.uk/news/article-1190439/Mortgage-safety-net-helps-just-TWO-families.html
2009-06-03,12:34:25,8pbuz,5,The war against Taliban,news.bbc.co.uk,http://news.bbc.co.uk/2/hi/south_asia/8078947.stm
2009-06-03,22:34:17,8pg42,5,British hostage in Mali believed killed by Al Qaeda,latimes.com,"http://www.latimes.com/news/nationworld/world/la-fg-british-hostage4-2009june04,0,802677.story"
2009-06-04,04:40:41,8pjsi,4,South Korea to deploy fighter jets if North Korea provokes in Yellow Sea ,english.yonhapnews.co.kr,http://english.yonhapnews.co.kr/news/2009/06/03/0200000000AEN20090603007400315.HTML
