2009-04-22,14:21:30,8ef1o,668,"Israeli FM: ""Believe me, America accepts all our decisions. The Obama Admin will put forth new peace initiatives only if Israel wants it to.""",haaretz.com,http://www.haaretz.com/hasen/spages/1080097.html
2009-04-23,04:59:05,8emkb,434,"Video shows UAE royal setting man's testicles on fire, running him over with an SUV. Welcome to Dubai, have a pleasant stay!",abcnews.go.com,http://www.abcnews.go.com/Blotter/Story?id=7402099
2009-04-22,01:35:53,8e94n,183,China wants citizens with unique names to change them under new ID system,nytimes.com,http://www.nytimes.com/2009/04/21/world/asia/21china.html?ref=world
2009-04-22,22:23:03,8eiet,168,US Freddie Mac chief found dead,news.bbc.co.uk,http://news.bbc.co.uk/1/hi/world/americas/8012527.stm
2009-04-22,20:36:59,8ehil,134,Full Text of President Ahmadinejad's Remarks at U.N. Conference on Racism,foreignpolicyjournal.com,http://www.foreignpolicyjournal.com/2009/04/21/full-text-of-president-ahmadinejads-remarks-at-un-conference-on-racism/
2009-04-23,00:09:27,8ejii,59,"The results indicate that 74% of Palestinians and 78% of Israelis are willing to accept a two-state solution on an option range from ""tolerable"" to ""essential"", while 59% of Palestinians and 66% of Israelis find a single bi-national state ""unacceptable"".",guardian.co.uk,http://www.guardian.co.uk/world/2009/apr/22/israel-palestine-poll
2009-04-23,03:50:47,8elwi,58,"European Prosecutors Are Likely To Investigate CIA And Bush Administration Officials On Suspicion Of Violating An International Ban On Torture If They Are Not Held Legally Accountable At Home, According To U.N. Officials And Human Rights Lawyers.",washingtonpost.com,http://www.washingtonpost.com/wp-dyn/content/article/2009/04/21/AR2009042103742.html
2009-04-23,02:55:51,8elcf,49,"70-euro admission charge for unlimited food, drink and sex between 10 a.m. and 4 p.m",reuters.com,http://www.reuters.com/article/newsOne/idUSTRE53K00G20090421
2009-04-22,19:09:45,8egvn,28,All of 12 men arrested over a suspected bomb plot in the UK two weeks ago have now been released without charge.,news.bbc.co.uk,http://news.bbc.co.uk/1/hi/uk/8011955.stm
2009-04-23,05:38:07,8emyc,28,"Torture tape implicates UAE Royal Sheik; victim is whipped, beaten, electrocuted, run over by SUV: Viewer Discretion is Advised ",abcnews.go.com,http://abcnews.go.com/Blotter/story?id=7402099&page=1
2009-04-22,10:27:12,8edl1,30,WTF?! France trying to pass harsh new law that would cut off internet access for people who download pirated music and films. Gov't agency called HADOPI will police the intrnet on behalf of copyright owners,economist.com,http://www.economist.com/business/displayStory.cfm?story_id=13496729&source=hptextfeature
2009-04-22,14:13:39,8eezo,26,"""The world attends to Palestinian grievances but not Chechen ones for the sole reason that Palestinians are, uniquely, the perceived victims of the Jewish state.""",online.wsj.com,http://online.wsj.com/article/SB124027104509836989.html
2009-04-23,01:11:15,8ek6j,20,DHS Chief Janet Napolitano Says 9/11 Hijackers Came From Canada....,thestar.com,http://www.thestar.com/News/Canada/article/621908
2009-04-22,23:58:52,8eje2,16,Britian unveils plans for 50% tax bracket ,news.bbc.co.uk,http://news.bbc.co.uk/1/hi/uk_politics/8011321.stm
2009-04-23,07:58:41,8eo20,12,Russian SWAT in action while capturing bank robbers! Most viral video in Russia! [VIDEO],englishrussia.com,http://englishrussia.com/?p=2580
2009-04-22,08:01:54,8ecpj,14,Hugo Chávez gives to Barack Obama an island to be transformed into an environmental reserve,english.eluniversal.com,http://english.eluniversal.com/2009/04/21/en_eco_esp_venezuela-gives-the_21A2299365.shtml
2009-04-22,21:51:08,8ei3v,13,Netanyahu again attempts to dictate US foreign policy,washingtonpost.com,http://www.washingtonpost.com/wp-dyn/content/article/2009/04/21/AR2009042103998.html
2009-04-22,15:36:24,8efiz,6,"Finally, I'm in America!!!",nytimes.com,http://www.nytimes.com/imagepages/2009/04/21/nyregion/21pirate2.ready.html
2009-04-22,09:52:48,8edd2,5,Save Steve Irwins Place! Australian Govt allowing Bauxite mine to be built next door. Sign the Petition pls..or I'll get my thumb and....,savestevesplace.com,http://www.savestevesplace.com/
2009-04-22,22:47:56,8ein8,8,Covert Mexican drug agents 'dead',news.bbc.co.uk,http://news.bbc.co.uk/2/hi/americas/8012333.stm
2009-04-22,20:18:45,8ehcx,5,Kiwis confused about the proper names of their islands,news.bbc.co.uk,http://news.bbc.co.uk/2/hi/asia-pacific/8011846.stm
2009-04-23,06:48:44,8enjg,7,A Workers’ Paradise Found Off Japan’s Coast,nytimes.com,http://www.nytimes.com/2009/04/22/world/asia/22japan.html
2009-04-22,12:42:57,8eefz,7,"Earthlike planet ""Gliese 581 e"" discovered, a rocky mass of 1.9 Earth masses!",astronomynow.com,http://www.astronomynow.com/090421lightexoplanet.html
2009-04-22,23:36:07,8ej4l,3,Old Europe investigates whether to pursue Bush officials on torture,americablog.com,http://www.americablog.com/2009/04/old-europe-investigates-whether-to.html
2009-04-23,00:22:46,8ejnf,3,"Catch-22: After Israel's last military offensive in Gaza many groups worldwide called for war crimes investigations. But if the indictment comes from Iran, who will be on board?",upi.com,http://www.upi.com/Top_News/2009/04/22/War-crimes-charges-against-Israel-sought/UPI-53691240412187/
2009-04-22,15:00:36,8efai,4, 'It's a pirate's life for me',news.bbc.co.uk,http://news.bbc.co.uk/2/hi/africa/8010061.stm
2009-04-22,20:21:07,8ehdp,3,The Much Underreported Verbal Lashing Given to Obama by Nicaraguan President Daniel Ortega at the Summit of the Americas,foxnews.com,http://www.foxnews.com/politics/2009/04/18/obama-endures-ortega-diatribe/
2009-04-22,00:41:42,8e8ip,4,Q&A: Sri Lanka crisis ,news.bbc.co.uk,http://news.bbc.co.uk/1/hi/world/south_asia/2405347.stm
2009-04-22,20:56:58,8ehmu,3,Obama opens door to prosecutions on interrogations,reuters.com,http://www.reuters.com/article/topNews/idUSTRE53J6MS20090422
2009-04-23,05:26:57,8emuo,2,Why New York Is No Place to Try Somali Pirates,time.com,"http://www.time.com/time/world/article/0,8599,1892895,00.html?iid=digg_share"
