2009-05-27,13:21:59,8nigt,691,"Fuck: N Korea warns of possible military strike   -- ""No longer bound by the 1953 armistice""",news.smh.com.au,http://news.smh.com.au/breaking-news-world/nkorea-warns-of-possible-military-strike-20090527-bn5r.html
2009-05-28,04:53:13,8npur,363,Australian government admits less than 32% of secret censorship list is related to underage images,secure.wikileaks.org,https://secure.wikileaks.org/wiki/Australian_government_admits_less_than_32%25_of_secret_censorship_list_is_related_to_underage_images
2009-05-27,17:30:35,8nk66,213,Deng Yujiao was an unknown 21-year-old worker in a Chinese provincial town: one of millions quietly scraping a living. Now she is an unwilling hero to tens of thousands of ­compatriots after stabbing to death an official who she says tried to rape her when she rejected his advances.,guardian.co.uk,http://www.guardian.co.uk/world/2009/may/26/china-woman-yujiao-stabs-official-self-defence
2009-05-28,05:03:20,8npxx,122,"Wiwa vs Shell Oil trial postponed. Ken Saro-Wiwa, an acclaimed writer and leader of the Movement for the Survival of the Ogoni People (MOSOP), was hanged along with eight other Ogoni leaders",wiwavshell.org,http://wiwavshell.org/trial-schedule
2009-05-28,03:04:30,8nowj,125,"Twenty years after Tiananmen, China erases the incident by buying off scholars and giving students something to dream about.",chronicle.com,http://chronicle.com/free/v55/i38/38b00601.htm
2009-05-27,22:56:55,8nmib,82,"EU sues Sweden, demands law requiring ISPs to retain data",arstechnica.com,http://arstechnica.com/tech-policy/news/2009/05/eu-sues-sweden-demands-law-requiring-isps-to-retain-data.ars
2009-05-28,06:32:40,8nqp5,57,"Israeli Knesset Approves Initial Bill That Would Make Denial of ""Jewish State"" a Crime Punishable by a Year In Prison",haaretz.com,http://www.haaretz.com/hasen/spages/1088712.html
2009-05-27,08:40:00,8ngoo,57,Netherlands to Close Prisons: Not Enough Criminals,blog.mpp.org,http://blog.mpp.org/uncategorized/netherlands-to-close-prisons-not-enough-criminals/05262009/
2009-05-27,12:19:09,8ni2t,42,"Alien found in Lahore, Pakistan....killed by children.....WTF!!!",youtube.com,http://www.youtube.com/watch?v=tOCbw9sNAd4
2009-05-27,17:56:52,8nkcb,32,Home Secretary to be sued over MI5 torture allegation,thisislondon.co.uk,http://www.thisislondon.co.uk/standard/article-23699781-details/Home+Secretary+to+be+sued+over+MI5+torture+allegation/article.do
2009-05-27,11:46:54,8nhv8,26,"Chevron, Shell and the True Cost of Oil: “It is very clear that Chevron, just like Shell, uses the military to protect its oil activities. They drill and they kill.”",truthdig.com,http://www.truthdig.com/report/item/20090526_chevron_shell_and_the_true_cost_of_oil
2009-05-27,20:47:03,8nlg0,27,UK journalist Suzanne Breen: 'I'll go to jail rather than give up source' ,pressgazette.co.uk,http://www.pressgazette.co.uk/story.asp?sectioncode=1&storycode=43700&c=1
2009-05-27,22:09:47,8nm27,20,North Korea threatens to attack South if ships searched,news.yahoo.com,http://news.yahoo.com/s/nm/20090527/ts_nm/us_korea_north_46
2009-05-28,04:21:27,8npl3,17,Poll: Hugo Chavez is the most popular leader in the Arab world,trueslant.com,http://trueslant.com/joshuakucera/2009/05/27/is-hugo-chavez-the-most-popular-leader-in-the-arab-world/
2009-05-28,02:53:23,8not8,18,Aung San Suu Kyi allowed one witness at trial in Burma,guardian.co.uk,http://www.guardian.co.uk/world/2009/may/27/aung-san-suu-kyi-witness-trial
2009-05-27,21:56:05,8nly6,17,North Korea: No longer bound by 1953 truce,rawstory.com,http://rawstory.com/08/news/2009/05/27/nkorea-warns-of-attack-says-truce-no-longer-valid/
2009-05-27,14:11:58,8nit3,16,"Huge explosions rock city of Lahore, Pakistan",news.bbc.co.uk,http://news.bbc.co.uk/2/hi/south_asia/8069467.stm
2009-05-27,20:05:00,8nl4x,16,UK in the middle of a butterfly invasion - arriving at 50 a minute,guardian.co.uk,http://www.guardian.co.uk/environment/2009/may/27/painted-lady-butterflies-migration-britain
2009-05-28,03:54:13,8npd3,16,North Korea preparing to fire missiles from west coast,english.yonhapnews.co.kr,http://english.yonhapnews.co.kr/national/2009/05/27/8/0301000000AEN20090527011600315F.HTML
2009-05-28,03:34:02,8np6y,14,'He would have found bin Laden' - CNN.com,cnn.com,http://www.cnn.com/2009/WORLD/asiapcf/05/27/massoud.afghanistan/index.html?eref=rss_topstories
2009-05-28,01:14:54,8nnv3,14,Russia fears Korea conflict could go nuclear - taking 'precautionary measures',thestar.com.my,http://thestar.com.my/news/story.asp?file=/2009/5/27/worldupdates/2009-05-27T145636Z_01_NOOTR_RTRMDNC_0_-399131-1&sec=Worldupdates
2009-05-27,23:23:04,8nmqm,9,Climate conference sex boom-Copenhagen’s sex trade did brisk business during the recent business climate conference. ,politiken.dk,http://politiken.dk/newsinenglish/article719339.ece
2009-05-27,21:55:15,8nly0,8,"Canada's governor general, Michaelle Jean, helped butcher and eat seal's heart  as an act of solidarity with hunters",news.bbc.co.uk,http://news.bbc.co.uk/2/hi/europe/8069249.stm
2009-05-27,22:33:41,8nmar,9,North Korea warns it will attack South if ships are intercepted,latimes.com,"http://www.latimes.com/news/nationworld/world/la-fg-korea-nuclear28-2009may28,0,3687439.story"
2009-05-27,14:15:59,8niu5,11,N Korea threatens military action after South Korea joined anti-proliferation exercise to search the North's ships,news.bbc.co.uk,http://news.bbc.co.uk/2/hi/asia-pacific/8069457.stm
2009-05-28,06:40:43,8nqrb,10,Mexico Arrests 27 High-Ranking Officials in Drug Raid,latina.com,http://www.latina.com/lifestyle/news-politics/mexico-arrests-27-high-ranking-officials-drug-raid
2009-05-27,22:34:28,8nmb1,11,"10 mayors, other Mexico officials detained. The sweep targets local officials in the state of Michoacan, home to La Familia, a fast-growing group of drug traffickers.",latimes.com,"http://www.latimes.com/news/nationworld/world/la-fg-mexico-mayors27-2009may27,0,1829460.story"
2009-05-27,12:13:59,8ni1m,8,Putin pens his first work: How to fire people. Chapter One - Six Ways to Disappear Employees. Chapter Two - The FIne Art of Polonium Poisoning ,independent.co.uk,http://www.independent.co.uk/news/world/europe/putin-pens-his-first-work-how-to-fire-people-1691229.html
2009-05-27,11:25:27,8nhpx,7,Iranian presidential elections: Moussavi takes lead in 10 major cities: poll,presstv.ir,http://www.presstv.ir/detail.aspx?id=96057&sectionid=351020101
2009-05-28,03:41:14,8np9d,5,"Academic answers to the question - ""What was the origin of the Arab-Jewish conflict in Palestine?""",israelipalestinian.procon.org,http://israelipalestinian.procon.org/viewanswers.asp?questionID=000500
