2009-05-12,16:43:35,8jrkj,847,"The PirateBay launches a D-DO$ attack. Wonderful, let us all join in and send a few dimes...",blogpirate.org,http://www.blogpirate.org/2009/05/10/pirate-bay-founder-crafts-distributed-denial-of-dollars-attack/
2009-05-12,12:49:14,8jq0g,91,"Israeli academics on the problems with Wikipedia. ""Furthermore, the Wikipedia entry on January's Operation Cast Lead in Gaza describes it as an ""intense bombardment"" by Israel on a civilian population.""  Cause thats what it FUCKING WAS!",haaretz.com,http://www.haaretz.com/hasen/spages/1082777.html
2009-05-12,21:44:15,8jtjb,71,Change:  China overtakes the US as Brazil's largest trading partner,telegraph.co.uk,http://www.telegraph.co.uk/finance/economics/5296515/China-overtakes-the-US-as-Brazils-largest-trading-partner.html
2009-05-13,00:35:41,8jv4w,70,Legalising Drugs: Lessons From Portugal,liberalconspiracy.org,http://www.liberalconspiracy.org/2009/05/12/legalising-drugs-lessons-from-portugal/
2009-05-12,23:14:56,8juc4,61,Video of a Guatemalan lawyer filmed the day before he was assassinated and uploaded to Youtube accuses Guatemalan president Alvaro Colom as his killer,guardian.co.uk,http://www.guardian.co.uk/world/feedarticle/8502195
2009-05-13,06:06:59,8jy6n,45,The World Health Organization is investigating an Australian researcher’s claim that the swine flu virus circling the globe may have been created as a result of human error.,bloomberg.com,http://www.bloomberg.com/apps/news?pid=20601087&sid=afrdATVXPEAk&refer=home
2009-05-12,19:56:25,8jssm,41,"Cocaine Purity down, Prices up",news.bbc.co.uk,http://news.bbc.co.uk/2/hi/uk_news/8044275.stm?
2009-05-12,17:49:58,8jrzu,35,"Guatemala: In YouTube Video Shot Before His Death, Attorney Blames President for His Assasination (With transcript in English)",boingboing.net,http://www.boingboing.net/2009/05/11/guatemala-in-youtube.html
2009-05-12,09:11:03,8jopw,32,"Russian intelligence sources, however, point to a more credible cause of death linked to the fact that Kellermann appeared to have discovered that Freddie Mac had syphoned over 50 billion dollars to Zionist and Israeli interests and organizations, and he was about to become a whistleblower",globalresearch.ca,http://globalresearch.ca/index.php?context=va&aid=13544
2009-05-12,21:50:21,8jtkt,34,'torture tape' sheikh arrested but will probably only get a slap on the wrist,news.bbc.co.uk,http://news.bbc.co.uk/2/hi/middle_east/8045433.stm
2009-05-12,17:25:38,8jrtl,29,"Hersh: Children sodomized at Abu Ghraib, on tape",salon.com,http://www.salon.com/politics/war_room/2004/07/15/hersh/
2009-05-13,01:12:24,8jvh7,30,Inquirer defends the indefensible: A monthly column by torture architect John Yoo,philly.com,http://www.philly.com/philly/blogs/attytood/Inquirer_defends_the_indefensible_Its_contract_with_torture_architect_John_Yoo.html?referrer=reddit
2009-05-12,08:03:26,8job2,24,Released pre recorded video of assassinated guatemalan Lawyer blaming the President of Guatemala for his death (in spanish),youtube.com,http://www.youtube.com/watch?v=qlM_Kga8HhI
2009-05-13,05:02:50,8jxnj,26,Taliban suspected as 86 Afghan girls are hospitalised following THIRD school poisoning,dailymail.co.uk,http://www.dailymail.co.uk/news/worldnews/article-1180573/Taliban-suspected-86-Afghan-girls-hospitalised-following-THIRD-school-poisoning.html
2009-05-12,09:14:23,8joqd,16,4 days of fierce battles between Islamic Militant Groups and forces loyal to the Transitional Somali Government in Mogadishu (Somalia),warsintheworld.com,http://www.warsintheworld.com/?x=entry:entry090512-015557
2009-05-13,05:36:25,8jxy3,14,"It pays to be married ,Where being single costs you most.",economist.com,http://www.economist.com/daily/chartgallery/displayStory.cfm?story_id=13636078
2009-05-13,07:48:35,8jyum,11,"Tamil Tigers have been surrounded by Sri Lanka Army and today, this is the new map of New Safe Zone",warsintheworld.com,http://www.warsintheworld.com/?x=entry:entry090513-000331
2009-05-12,11:00:50,8jpb4,13,"OECD report: World's Happiest Places -- Denmark, Finland and the Netherlands rated tops",forbes.com,http://www.forbes.com/2009/05/05/world-happiest-places-lifestyle-travel-world-happiest.html
2009-05-12,16:11:41,8jrd8,12,Sri Lankan government forces shells hospital - at least 45 dead,news.bbc.co.uk,http://news.bbc.co.uk/2/hi/south_asia/8045135.stm
2009-05-12,23:41:05,8julq,10,Doctor says 49 killed in Sri Lanka hospital attack,news.yahoo.com,http://news.yahoo.com/s/ap/20090512/ap_on_re_as/as_sri_lanka_civil_war
2009-05-13,02:08:35,8jw14,11,49 killed in Sri Lanka hospital attack,cbc.ca,http://www.cbc.ca/world/story/2009/05/12/sri-lanka-hospital-war.html
2009-05-12,10:39:42,8jp6m,9,The man Netanyahu plans to make Israel's new ambassador to the US believes that Israel should unilaterally withdraw from the West Bank and evacuate the settlements.,haaretz.com,http://www.haaretz.com/hasen/pages/ShArt.jhtml?itemNo=1082409
2009-05-12,12:27:50,8jpvz,9,This is London – the capital of Somali pirates' secret intelligence operation,guardian.co.uk,http://www.guardian.co.uk/world/2009/may/11/somalia-pirates-network
2009-05-13,02:29:34,8jw8r,7,Torture: It Was Never Just “Sleep Deprivation”,firedoglake.com,http://firedoglake.com/2009/05/11/torture-whats-in-a-name-it-was-never-just-sleep-deprivation/
2009-05-12,15:05:27,8jqwn,7,"Russia holds Victory Day celebration: rows of tanks and missiles parade through Red Square in ""largest display of military might since Soviet times""",sfgate.com,http://www.sfgate.com/cgi-bin/article.cgi?f=/n/a/2009/05/09/international/i014530D43.DTL&type=politics
2009-05-13,07:20:29,8jyo0,7,"Grand Conspiracy Theory From Pakistan: Pakistani journalist has published an essay called ""Barack Obama Is Lying About Pakistan,""claiming to uncover a vast American conspiracy against Pakistan by the American government and media.",thelede.blogs.nytimes.com,http://thelede.blogs.nytimes.com/2009/05/12/a-grand-conspiracy-theory-from-pakistan/
2009-05-13,00:14:12,8jux6,5,Journalists caught copying Wikipedia,tech.yahoo.com,http://tech.yahoo.com/news/ap/20090512/ap_on_hi_te/eu_ireland_wikipedia_hoaxer
2009-05-12,17:21:08,8jrsp,8,Refugee Crisis Clouds Pakistan's Anti-Taliban War,time.com,"http://www.time.com/time/world/article/0,8599,1897467,00.html"
2009-05-13,07:24:47,8jyop,5,Chinese dissident refused entry into his native country ahead of Tiananmen anniversary,boston.com,http://www.boston.com/news/local/breaking_news/2009/05/chinese_disside.html
2009-05-13,02:26:57,8jw7o,6,Sudan leader denies Darfur crimes,news.bbc.co.uk,http://news.bbc.co.uk/2/hi/africa/8046516.stm
