2009-08-31,17:35:25,9fs6i,538,Thousands call for Turing apology,news.bbc.co.uk,http://news.bbc.co.uk/go/rss/-/2/hi/technology/8226509.stm
2009-08-31,20:12:42,9ftcu,126,"""Nearly 60% of black and African people living in Russia's capital Moscow have been physically assaulted in racially motivated attacks, says a new study.""",news.bbc.co.uk,http://news.bbc.co.uk/2/hi/europe/8230158.stm
2009-08-31,09:51:06,9fono,102,"In Australia, when a political figure goes missing while hiking in the mountains, he actually is missing -- in the mountains",theage.com.au,http://www.theage.com.au/national/water-minister-tim-holding-missing-on-freezing-mountain-20090831-f488.html
2009-08-31,12:33:26,9fppq,60,Lesbians given equal birth rights,news.bbc.co.uk,http://news.bbc.co.uk/2/hi/uk_news/8225158.stm
2009-08-31,13:39:00,9fq8h,53,"Australia closed a chapter in its military history today when the bodies of the last two Australian servicemen missing in Vietnam were returned home, nearly 40 years after their last wartime mission.",abc.net.au,http://www.abc.net.au/news/stories/2009/08/31/2671570.htm
2009-09-01,06:29:30,9fzox,42,"“We have known for many years that Saddam Hussein is seeking and developing weapons of mass destruction” – Sen. Ted Kennedy, September 27, 2002",snopes.com,http://www.snopes.com/politics/war/wmdquotes.asp
2009-08-31,17:30:45,9fs5c,25,A report by the top US general in Afghanistan is expected to admit the current strategy is not working,news.bbc.co.uk,http://news.bbc.co.uk/2/hi/south_asia/8230017.stm
2009-08-31,10:59:49,9fp3a,27,Fly ash pollution from coal-fired power stations: Tests on children living in areas around India's power stations show high levels of uranium in their bodies...ground water show that levels of uranium around the plants are up to 15 times the WHO maximum safe limits,commondreams.org,http://www.commondreams.org/headline/2009/08/30-1
2009-08-31,22:46:28,9fuo3,21,"Effective today, police and councils in U.K. can impose Drinking Banning Orders - dubbed ""booze Asbos"" - on anyone who behave anti-socially while drunk",news.bbc.co.uk,http://news.bbc.co.uk/2/hi/uk_news/8230406.stm
2009-09-01,02:33:11,9fx9f,15,An al-Qaeda terrorist captured in Iraq has confessed to being trained by Syria,news.yahoo.com,http://news.yahoo.com/s/nm/20090830/wl_nm/us_iraq_syria_1
2009-08-31,16:53:01,9frus,11,"A court in Sri Lanka sentences prominent Tamil journalist to 20 years in prison for ""causing communal disharmony"".",news.bbc.co.uk,http://news.bbc.co.uk/2/hi/south_asia/8230067.stm
2009-08-31,17:00:03,9frwk,13,Federal Reserve Made $14 Billion on Turmoil Loans,news.yahoo.com,http://news.yahoo.com/s/nm/20090831/bs_nm/us_fed_profitpickup
2009-09-01,02:50:30,9fxgr,11,Hamas leader denies Nazi genocide of Jews,news.yahoo.com,http://news.yahoo.com/s/ap/20090831/ap_on_re_mi_ea/ml_hamas_holocaust
2009-08-31,14:29:04,9fqn9,9,"""And I think there is nothing that can't be done if it is fundamentally reasonable.""",news.bbc.co.uk,http://news.bbc.co.uk/2/hi/uk_news/8227929.stm
2009-08-31,09:21:12,9foh8,7,B.C. town rallies to stop toxic waste plant,i282.photobucket.com,http://i282.photobucket.com/albums/kk266/Bluzlbee/BCrally.jpg
2009-08-31,20:17:10,9ftdr,5,"

Our thanks go out to John Yettaw, Burma Junta says..

Burma's detained opposition leader Aung San Suu Kyi plans to renovate her crumbling lakeside home to keep out trespassers, her lawyer says.",abc.net.au,http://www.abc.net.au/news/stories/2009/08/31/2672346.htm?section=justin
2009-08-31,16:14:35,9frj3,6,City officials in Tehran have agreed to investigate claims that bodies of protesters were secretly buried in the nation's largest cemetery,edition.cnn.com,http://edition.cnn.com/2009/WORLD/meast/08/30/iran.secret.graves/index.html
2009-08-31,20:09:21,9ftbn,4,A five-day-old wildfire burning out of control in the Los Angeles foothills and forest has claimed its first victims - two firefighters whose vehicle plummeted off the side of a road.,abc.net.au,http://www.abc.net.au/news/stories/2009/08/31/2672095.htm
2009-08-31,22:46:16,9funx,2,Why did Scotland really release Libyan Lockerbie bomber?,blog.foreignpolicy.com,http://blog.foreignpolicy.com/posts/2009/08/27/why_did_scotland_really_release_libyan_lockerbie_bomber
2009-08-31,23:52:56,9fvcv,0,"Dear worldnews readers, if you have a link that only concerns the UK, please consider submitting to uk_news. There are far too much stories about the UK in here.",reddit.com,http://www.reddit.com/r/UK_News
2009-08-31,21:44:24,9fu2o,0,Why 31 August is the worst day of the year to be born in the UK,news.bbc.co.uk,http://news.bbc.co.uk/1/hi/magazine/8227268.stm
2009-09-01,04:40:57,9fynk,1,How Shifts To Smaller Family Sizes Contributed To The Asian Miracle,zunia.org,http://zunia.org/post/how-shifts-to-smaller-family-sizes-contributed-to-the-asian-miracle/
2009-09-01,00:39:56,9fvvt,0,"Claims of Peace in Darfur Disputed by Rebels, Officials",findingdulcinea.com,http://www.findingdulcinea.com/news/Africa/2009/aug/Claims-of-Peace-in-Darfur-Disputed-by-Rebels--Officials.html
2009-08-31,16:06:09,9frgc,0,The future of one of the world’s biggest oil auctions is in jeopardy as Venezuela’s socialist government and oil companies remain at loggerheads over terms to develop a key oil field.,ft.com,http://www.ft.com/cms/s/0/3cf4416a-9585-11de-90e0-00144feabdc0.html
2009-08-31,10:05:46,9for4,0,"Crazy UK government now allows people who aren't parents to be named as parents on a baby's birth certificate.  ""Are you really my dad?"" they may ask when they grow up.",news.bbc.co.uk,http://news.bbc.co.uk/1/hi/uk/8225158.stm
2009-08-31,23:55:14,9fvdu,0,Gabon casts first votes after dictator's death ,news.yahoo.com,http://news.yahoo.com/s/ap/20090830/ap_on_re_af/af_gabon_election
2009-08-31,23:35:01,9fv5d,0,"Could Karzai miss the 50% mark? Analysis shows he might fall 300,000 votes short",themajlis.org,http://www.themajlis.org/2009/08/31/could-karzai-miss-the-50-mark
2009-08-31,17:36:54,9fs6v,0,NHS sorry for dead patient letter ,news.bbc.co.uk,http://news.bbc.co.uk/2/hi/uk_news/england/south_yorkshire/8228544.stm
2009-08-31,23:26:29,9fv27,1,"""Honour"" killings and brutal murders of gay men on the rise in Iraq, as Iraqi authorities look the other way",counterpunch.org,http://www.counterpunch.org/rosen08282009.html
2009-09-01,03:44:01,9fy1e,0,Completely unexpectedly (not) British Muslims threaten Sebastian Faulkes with death after his criticism of the Quran.,islam4uk.com,http://www.islam4uk.com/current-affairs/uk-news/46-uk/340-sebastian-faulkes-on-a-death-wish
