2009-06-02,08:22:18,8p0fv,265,Life expectancy Vs Income/person across the world over 2 centuries [map],graphs.gapminder.org,http://graphs.gapminder.org/world/#$majorMode=chart$is;shi=t;ly=2003;lb=f;il=t;fs=11;al=30;stl=t;st=t;nsl=t;se=t$wst;tts=C$ts;sp=5.35870967741936;ti=2007$zpv;v=0$inc_x;mmid=XCOORDS;iid=phAwcNAVuyj1jiMAkmq1iMg;by=ind$inc_y;mmid=YCOORDS;iid=phAwcNAVuyj2tPLxKvvnNPA;by=ind$inc_s;uniValue=8.21;iid=phAwcNAVuyj0XOoBL_n5tAQ;by=ind$inc_c;uniValue=255;gid=CATID0;by=grp$map_x;scale=log;dataMin=194;dataMax=96846$map_y;scale=lin;dataMin=23;dataMax=86$map_s;sma=49;smi=2.65$cd;bd=0$inds=
2009-06-03,02:29:41,8p738,49,"To understand how North Korea has come up with the money to finance its missile-and-nuclear-weapons program, it's important to realize that Koreans haven't been living in caves for the past 2 decades.",newsweek.com,http://www.newsweek.com/id/200069
2009-06-03,03:19:15,8p7ly,37,"Dutch journalist is kidnapped by Talibans who rape her repeatedly. Her comments about the Taliban: ""They also respected me"", ""They are not monsters"", ""... could not control his testosterone"". A story about Stockholm syndrome and the politically correct.",brusselsjournal.com,http://www.brusselsjournal.com/node/3946
2009-06-03,04:08:47,8p84o,29,"Why the Air France plane crashed: Salon's ""Ask the Pilot"" explains the possibilities",salon.com,http://www.salon.com/tech/col/smith/2009/06/02/askthepilot322/
2009-06-02,12:09:25,8p1vh,27,A quick fix for up to half of all child deaths?,nytimes.com,http://www.nytimes.com/2009/05/24/opinion/24kristof.html
2009-06-02,11:29:25,8p1lv,13,Mexico detains 25 police officers for alleged ties to drug traffickers,chron.com,http://www.chron.com/disp/story.mpl/ap/latinamerica/6453219.html
2009-06-02,18:38:37,8p4jp,14,Public believe politicians are corrupt. In other news: Bears shit in woods,news.bbc.co.uk,http://news.bbc.co.uk/1/hi/uk_politics/8078159.stm
2009-06-02,10:13:39,8p144,14,"Kazakhstan's former head of state nuclear power agency ""stole"" over 60% of the countries Uranium!",news.yahoo.com,http://news.yahoo.com/s/afp/20090601/wl_afp/kazakhstannuclearenergycrime
2009-06-03,06:35:58,8p9h7,12,Brazil Defense Minister confirms that the debris found belong to the missing Air France plane,news.bbc.co.uk,http://news.bbc.co.uk/2/hi/americas/8080290.stm
2009-06-02,09:33:34,8p0up,9,"Denmark finishes first, US 28th, on Global Competitive Stress Test",imd.ch,http://www.imd.ch/news/IMD-WCY-2009.cfm
2009-06-02,11:29:17,8p1ls,8,Zimbabwe may replace worthless currency with South African rand,dailymail.co.uk,http://www.dailymail.co.uk/news/worldnews/article-1190085/Zimbabwe-replace-worthless-currency-South-African-rand.html
2009-06-02,09:57:51,8p10r,10,Rape Crisis in East Congo Tied to Mining Activity,womensenews.org,http://www.womensenews.org/article.cfm/dyn/aid/4027
2009-06-02,11:54:18,8p1rn,7,Kim Jong Il names successor,theage.com.au,http://www.theage.com.au/world/kims-youngest-son-named-successor-reports-20090602-btka.html
2009-06-02,10:01:11,8p11g,9,Red-faced police crack mystery,ananova.com,http://www.ananova.com/news/story/sm_3207484.html?menu=news.quirkies
2009-06-03,03:14:41,8p7k9,6,"There's a new world out there, countries where economic growth continues to power ahead, gov'ts aren't buried under a mountain of debt and citizens remain remarkably optimistic about their future.",newsweek.com,http://www.newsweek.com/id/200049
2009-06-03,07:18:59,8p9ta,4,Wreckage found for AirFrance flight 447,news.yahoo.com,http://news.yahoo.com/s/ap/brazil_plane
2009-06-02,10:33:00,8p184,7,Pakistan's Victories Over the Taliban: Less Than Meets the Eye - TIME,time.com,"http://www.time.com/time/world/article/0,8599,1902204,00.html?xid=rss-topstories"
2009-06-02,16:56:18,8p3v5,4,Hardline Pakistani cleric linked to Mumbai attacks released by Pakistani high court,news.yahoo.com,http://news.yahoo.com/s/ap/20090602/ap_on_re_as/as_pakistan
2009-06-02,19:57:22,8p53s,6,"Obama pledges new realism in ties with Israel  warning the Jewish state of ""profoundly negative trends in the region, not only for Israeli interests but also US interests,""",google.com,http://www.google.com/hostednews/afp/article/ALeqM5jtt1LbNj8F3NHVLI2oRmOpMTBtTQ
2009-06-02,13:44:58,8p2ir,5,Google Earth guide to the palaces of North Korea:  Amateur spies put North Korea on the map,smh.com.au,http://www.smh.com.au/news/technology/kimjongil/2009/06/02/1243708441374.html?page=fullpage#contentSwap1
2009-06-02,11:13:52,8p1hz,4,Israel rejects US demands for settlement freeze: “I have to admire the residents of Iroquois territory for assuming that they have a right to determine where Jews should live in Jerusalem.” - Israeli Government Press Director ,thebulletin.us,http://thebulletin.us/articles/2009/05/29/top_stories/doc4a1f3b3710e19186990802.txt
2009-06-02,08:30:30,8p0hy,4,"A thoughtful obituary for Roh Moo-hyun, former president of South Korea. ""Before he left the house, and before he jumped from a high cliff into a ravine, he had left a note to his family on his computer. He said he had 'made the life of too many people difficult.'""",economist.com,http://www.economist.com/obituary/displaystory.cfm?story_id=13726814
2009-06-03,02:24:55,8p718,4,"Netanyahu: Obama Call For Settlement Freeze ""Unreasonable""",huffingtonpost.com,http://www.huffingtonpost.com/2009/06/01/netanyahu-obama-call-for-_n_209625.html
2009-06-03,04:55:09,8p8li,5,The Dark Side of Plan Colombia: How the U.S. is Subsidizing Death and Drug Trafficking on Stolen Lands,alternet.org,http://www.alternet.org/rights/140408/the_dark_side_of_plan_colombia%3A_how_the_u.s._is_subsidizing_death_and_drug_trafficking_on_stolen_lands/
2009-06-03,06:26:26,8p9e0,4,Tibetans are no worse off than other Chinese,nrc.nl,http://www.nrc.nl/international/opinion/article2258466.ece/Tibetans_are_no_worse_off_than_other_Chinese
2009-06-02,12:24:19,8p1z3,4,The upshot of a nuclear North Korea: It may help curb nuclear proliferation,newscientist.com,http://www.newscientist.com/article/mg20227102.300
2009-06-03,06:00:40,8p96h,5,"Air France wreckage found in Atlantic Ocean, official says - CNN.com",cnn.com,http://www.cnn.com/2009/WORLD/americas/06/02/brazil.france.plane.missing/index.html
2009-06-03,06:45:05,8p9j6,2,"The North Koreans might be stepping up their war rhetoric because ""China wants them to do so.""",slate.com,http://www.slate.com/id/2219517/
2009-06-02,11:57:50,8p1sd,6,Japanese lining up in droves for free diamonds,3news.co.nz,http://www.3news.co.nz/News/BusinessNews/Japanese-lining-up-in-droves-for-free-diamonds/tabid/421/articleID/106837/cat/52/Default.aspx
2009-06-03,02:31:02,8p73u,3,Scotland and Texas: Separated at birth? ,bbc.co.uk,http://www.bbc.co.uk/blogs/thereporters/briantaylor/2009/05/letter_from_texas.html
