2009-12-13,22:17:48,ae6fj,145,"“I’m sorry but we had to blow up your 
laptop. “ What….all my client case 
notes and testimony, writing, pictures, 
music and applications. Years of work. 
(graphic pictures)",lilysussman.wordpress.com,http://lilysussman.wordpress.com/2009/11/30/im-sorry-but-we-blew-up-your-laptop-welcome-to-israel/
2009-12-13,00:19:22,adybo,113,Patrick Stewart: 'People would never believe my father could be responsible for these things',independent.co.uk,http://www.independent.co.uk/news/people/profiles/patrick-stewart-people-would-never-believe-my-father-could-be-responsible-for-these-things-1837135.html
2009-12-14,04:19:57,ae97d,72,"""Tony Blair's admission that Britain would have backed the Iraq war even if he knew it did not have weapons of mass destruction sparked outrage Sunday and calls for his prosecution for war crimes."" (Few calls for Bush to be prosecuted in the US!)",ca.news.yahoo.com,http://ca.news.yahoo.com/s/afp/091213/world/britain_iraq_politics_inquiry_military_blair
2009-12-14,03:10:24,ae8oz,33,"Nearly 1,000 arrested in Copenhagen at protest rally - mostly ""preventative"" arrests.",news.bbc.co.uk,http://news.bbc.co.uk/2/hi/europe/8410414.stm
2009-12-14,00:29:32,ae7h2,30,"""Critics said the 2003 U.S. invasion of Iraq said was driven by oil, but United States oil majors were largely absent from an Iraqi auction of oil deals snapped up instead by Russian, Chinese and other firms.""",reuters.com,http://www.reuters.com/article/idUSTRE5BB18Q20091212
2009-12-13,11:23:34,ae2sw,33,"UK gov't scientist and UN weapons inspector David Kelly, who ppposed Iraq invasion was murdered, say six top doctors",dailykos.com,"http://www.dailykos.com/storyonly/2009/12/12/813556/-BOMBSHELL:-Weapons-Inspector-who-Opposed-Iraq-Invasion-was-Murdered,-say-Six-Top-Doctors"
2009-12-13,22:00:07,ae6b6,28,"Hundreds of Iranian men uploaded facebook pictures of themselves as women, dressed in Hijab, to protest a student's imprisonment.",globalvoicesonline.org,http://globalvoicesonline.org/2009/12/12/iran-men-in-hijab-to-support-jailed-student/
2009-12-14,04:47:07,ae9ep,25,"Berlusconi suffers broken nose, 2 broken teeth after attack at rally in Milan",msnbc.msn.com,http://www.msnbc.msn.com/id/34404732/ns/world_news-europe/
2009-12-14,05:12:13,ae9kl,17,A deterioration of Asian security may force Australia to develop it's first nuclear weapons ever.,au.news.yahoo.com,http://au.news.yahoo.com/queensland/a/-/latest/6581271/asia-unrest-may-spur-aussie-nukes-study/
2009-12-13,23:22:56,ae6wn,16,Italy is to introduce legislation that will make it illegal for girls under 18 to have breast enhancement or other plastic surgery,telegraph.co.uk,http://www.telegraph.co.uk/news/worldnews/europe/italy/6796292/No-more-breast-enlargement-for-girls-under-18-Italian-government-orders.html
2009-12-14,04:16:48,ae969,16,France to resume 'black box' hunt,news.bbc.co.uk,http://news.bbc.co.uk/2/hi/europe/8410375.stm
2009-12-13,14:17:34,ae3vu,14,"Briton Mohammed Ezzouek, a victim of rendition from Kenya to Somalia, says UK agents were complicit in his torture",guardian.co.uk,http://www.guardian.co.uk/world/2009/dec/13/torture-british-agents-somalia-kenya
2009-12-14,03:31:00,ae8v0,13,Zimbabwe President Mugabe re-elected as ZANU-PF leader,google.com,http://www.google.com/hostednews/afp/article/ALeqM5hT_B9bXTIqLLWcPPGtkOiymeTMXQ
2009-12-14,04:04:43,ae93l,15,Anti-Muslim graffiti found on French mosque -Police say assailants have scrawled a Nazi slogan and hung pig feet on a mosque in southern France.,google.com,http://www.google.com/hostednews/ap/article/ALeqM5jpsrZrKYldfsDqg5mNG2btrR3QVwD9CIJJTG0
2009-12-13,10:23:48,ae2gc,13,Learn From Vietnam: No Winning In Afghanistan,articles.sun-sentinel.com,http://articles.sun-sentinel.com/2009-11-01/news/0910290211_1_vietnam-and-iraq-afghanistan-military-force
2009-12-13,21:48:43,ae68d,12,"'The last time I was in the Tardis was in 1966.' There was a slight pause, and he said: 'I wasn't even born then.' ",independent.co.uk,http://www.independent.co.uk/news/people/profiles/bernard-cribbins-i-was-in-the-tardis-before-david-was-born-1839308.html
2009-12-14,02:40:46,ae8hd,12,Italy's PM Silvio Berlusconi punched in the face --about time!!,guardian.co.uk,http://www.guardian.co.uk/world/2009/dec/13/silvio-berlusconi-punched-in-face
2009-12-13,23:51:37,ae75e,9,Widespread oil theft by drug traffickers deals major blow to Mexico's government - washingtonpost.com,washingtonpost.com,http://www.washingtonpost.com/wp-dyn/content/article/2009/12/12/AR2009121202888.html
2009-12-14,01:44:06,ae81b,10,Santa Claus banned from visiting locked-up children in UK asylum detention centre,boingboing.net,http://www.boingboing.net/2009/12/13/santa-claus-banned-f.html
2009-12-14,00:02:44,ae78u,8,Six injured in latest Hong Kong acid attack,theage.com.au,http://www.theage.com.au/world/six-injured-in-latest-hong-kong-acid-attack-20091213-kq7o.html
2009-12-14,04:22:35,ae987,10,"Political turmoil built today over the burning of an image of Iran's revolutionary founder, which was aired, in a controversial move, on state television",latimes.com,"http://www.latimes.com/news/nation-and-world/la-fg-iran14-2009dec14,0,7978239.story"
2009-12-13,11:31:38,ae2uy,7,"Leading British climate skeptic, Monckton, advocated HIV+ internment camps: ""Every member of the population should be blood-tested every month... and all those found to be infected with the virus, even if only as carriers, should be isolated compulsorily, immediately, and permanently.""",rawstory.com,http://rawstory.com/2009/12/climate-skeptic-hiv-camps/
2009-12-14,03:13:09,ae8pm,7,Worldwide water crisis: time is running out for an additional 2.5 billion mouths to feed on earth.,lloyds.com,http://www.lloyds.com/News_Centre/Features_from_Lloyds/News_and_features_2009/360/worldwide_water_crisis_time_is_running_out.htm
2009-12-14,00:29:03,ae7gw,7,An ex-navy captain dubbed the Blond Angel of Death has gone on trial in Argentina with 18 others for kidnap and torture during military rule,news.bbc.co.uk,http://news.bbc.co.uk/2/hi/americas/8408795.stm
2009-12-13,15:20:30,ae49g,6,Honduran coup regime’s claims about 60 percent turnout at free and fair elections is revealed as fraud. Also implicated in the video are the wide array of media outlets and governments that have unquestioningly accepted the electoral data of a regime that overthrew the last elected president.,pubrecord.org,http://pubrecord.org/multimedia/6278/honduran-elections-exposed-fraud/
2009-12-13,09:39:25,ae25k,7,"Historic deal returns islands, land and resource rights, and name back to Canadian aboriginals, who never signed a crown treaty during colonization.",cbc.ca,http://www.cbc.ca/canada/british-columbia/story/2009/12/11/bc-queen-charlottle-islands-renamed-haida-gwaii.html#socialcomments-submit
2009-12-14,02:57:21,ae8lt,7,Billionaire tycoon set to win most votes in Chile's presidential election. Runoff expected.,guardian.co.uk,http://www.guardian.co.uk/world/2009/dec/13/chile-presidential-election
2009-12-14,06:27:22,aea3v,7,COPENHAGEN: a pivotal economic showdown between the U.S. and China,online.wsj.com,http://online.wsj.com/article/SB126074144005789473.html
2009-12-13,11:22:11,ae2sg,7,what fuels the never ending stream of criminals in Brazil?  The unjust imprisonment of petty thieves with hardened killers provides Brazilian gangs with a steady stream of new recruits,guardian.co.uk,http://www.guardian.co.uk/commentisfree/cifamerica/2009/dec/12/brazil-prisons-crime-rio-murder
2009-12-13,08:26:32,ae1qo,8,I Could Use a Job With the US Federal Government! ,usatoday.com,http://www.usatoday.com/printedition/news/20091211/1afedpay11_st.art.htm?loc=interstitialskip
