2009-10-13,18:13:41,9tigl,1297,The report and question that The Guardian is being gagged for - wikileaks to the rescue.,wikileaks.com,"http://www.wikileaks.com/wiki/Minton_report:_Trafigura_Toxic_dumping_along_the_Ivory_Coast_broke_EU_regulations,_14_Sep_2006"
2009-10-13,08:08:20,9tdz9,84,"Guardian gagged from reporting parliament |
				Media |
				The Guardian",guardian.co.uk,http://www.guardian.co.uk/media/2009/oct/12/guardian-gagged-from-reporting-parliament
2009-10-13,10:23:02,9teya,27,"Last surviving members of an ancient Amazonian tribe are a tragic testament to greed and genocide
",belfasttelegraph.co.uk,http://www.belfasttelegraph.co.uk/news/world-news/last-surviving-members-of-an-ancient-amazonian-tribe-are-a-tragic-testament-to-greed-and-genocide-14529107.html
2009-10-14,01:20:00,9tmki,25,"1. claim to be a law firm, 2. threaten people to sue over copyright/filesharing unless they submit 500€, 3. send out lots of mails, 4. ???, 5. profit.",wikileaks.org,http://wikileaks.org/wiki/DigiRights_Solutions_Praesentation_zur_Gewinnverbesserung_durch_Abmahnungverfahren%2C_02_February_2009
2009-10-13,01:52:40,9tadu,22,"41 killed, 45 hurt as bombings continue in Pakistan",latimes.com,"http://www.latimes.com/news/nationworld/world/la-fg-pakistan-bombing13-2009oct13,0,3404507.story"
2009-10-14,04:26:19,9tom3,21,"Black youth worker arrested for watching police wins compensation - 
British Transport Police to pay £22,000 to man handcuffed and held for four hours after witnessing teenager being detained",guardian.co.uk,http://www.guardian.co.uk/world/2009/oct/13/ken-hinds-police-arrest-compensation
2009-10-13,21:55:29,9tk6l,18,UK approve cigarette vending machine ban ,news.bbc.co.uk,http://news.bbc.co.uk/2/hi/uk_news/8303975.stm
2009-10-13,08:44:35,9te9a,20,"Food production will have to increase by 70% over the next 40 years to feed the world's growing population,",news.bbc.co.uk,http://news.bbc.co.uk/2/hi/europe/8303434.stm
2009-10-13,21:04:57,9tjqr,19,Global homicide: murder rates around the world,guardian.co.uk,http://www.guardian.co.uk/news/datablog/2009/oct/13/homicide-rates-country-murder-data
2009-10-14,03:34:34,9to1u,18,"Carter-Ruck the man who's firm tried to gag the Guardian: ""...he did for freedom of speech what the Boston Strangler did for door-to-door salesmen.""",guardian.co.uk,http://www.guardian.co.uk/media/2003/dec/23/pressandpublishing.comment
2009-10-13,13:19:54,9tgai,9,Al-Qaeda 'faces funding crisis',news.bbc.co.uk,http://news.bbc.co.uk/2/hi/south_asia/8303978.stm
2009-10-14,00:13:08,9tlq8,6,Romania plunged deeper into political turmoil: govt falls on no confidence vote,google.com,http://www.google.com/hostednews/afp/article/ALeqM5if73bPzE8CdLsu0SiWsTNvXYA_EA
2009-10-14,06:07:01,9tpmj,6,British pilot diverts pathfinder bomb away from Taleban target and  into desert to save Afghan civilians [vid],express.co.uk,http://www.express.co.uk/posts/view/133842/VIDEO-RAF-pilot-diverts-bomb-into-desert-to-save-Afghan-civilians-
2009-10-13,22:27:16,9tkh1,6,"Iranian Journalists Flee, Fearing Retribution for Covering Protests",nytimes.com,http://www.nytimes.com/2009/10/13/world/middleeast/13emigres.html
2009-10-13,20:20:02,9tjcf,6,Indian Govt says Arunachal integral part of India after Chinese protest,timesofindia.indiatimes.com,http://timesofindia.indiatimes.com/india/Govt-says-Arunachal-integral-part-of-India-after-Chinese-protest/articleshow/5118757.cms
2009-10-13,22:59:42,9tkug,6,"260 asylum seekers from Sri Lanka board a boat headed for Australia.  Aussie PM Kevin Rudd makes a personal plea to Indonesia to intercept the boat. Ladies and gentlemen, welcome to West Java.",news.bbc.co.uk,http://news.bbc.co.uk/2/hi/asia-pacific/8303992.stm
2009-10-14,00:09:51,9tlom,3,"Sri Lanka has announced that it will hold its presidential election two years ahead of schedule. The president and parliament are banking on their popularity in the wake of the LTTE's defeat, and may use that popularity to remove term limits from their constitution.",news.bbc.co.uk,http://news.bbc.co.uk/2/hi/south_asia/8304934.stm
2009-10-13,10:03:01,9tetd,1,"""Nuclear weapons [...] are weapons of the weak.""",salon.com,http://www.salon.com/opinion/feature/2009/10/13/nuclear_weapons/index.html
2009-10-13,20:34:14,9tjgg,3,Afghan leader accused of meddling in fraud probe. Karzai's man Barakzai resigned from the Electoral Complaints Commission to discredit their findings.,google.com,http://www.google.com/hostednews/ap/article/ALeqM5hvWEqwq3CrRvaQCmt21MfoYhjZJQD9BA3I2G0
2009-10-14,06:00:29,9tpk7,3,Amazing picture of an unusual ring that has mysteriously appeared over Moscow,tinyurl.com,http://tinyurl.com/yf2lxs5
2009-10-13,21:47:37,9tk3z,1,Russia and the US have pledged to work together to ensure Iran's nuclear programme is for peaceful purposes,news.bbc.co.uk,http://news.bbc.co.uk/2/hi/europe/8303517.stm
2009-10-13,23:31:49,9tl85,0,"A UN-backed offensive to destroy a Hutu rebel group in eastern Democratic Republic of Congo has had disastrous humanitarian consequences, with more than 1,000 civilians killed, 7,000 raped, and 900,000 forced from their homes.",guardian.co.uk,http://www.guardian.co.uk/world/2009/oct/13/democratic-republic-of-congo-civilian-deaths
2009-10-13,16:08:20,9thlq,0,Living with Osama bin Laden: First wife tells of husband's bid to train his sons as suicide bombers,dailymail.co.uk,http://www.dailymail.co.uk/news/worldnews/article-1219865/Living-Osama-bin-Laden-First-wife-tells-ultra-conservative-household-husbands-bid-train-sons-suicide-bombers.html?ITO=1490
2009-10-13,14:23:48,9tgsi,0,Zionazism made easy in 4 steps,self.worldnews,https://www.reddit.com/r/worldnews/comments/9tgsi/zionazism_made_easy_in_4_steps/
2009-10-13,11:30:00,9tffd,0,bleeding heart liberals exhibiting Stockholm syndrome,jpost.com,http://www.jpost.com/servlet/Satellite?cid=1255204782487&pagename=JPost%2FJPArticle%2FShowFull
2009-10-13,18:44:44,9tio3,0,"The images will be destroyed straight away, say the authorities",news.bbc.co.uk,http://news.bbc.co.uk/2/hi/uk_news/8303983.stm
2009-10-14,01:44:50,9tmw8,0,"Would anyone be interested in region specific news 
subreddits?",self.worldnews,https://www.reddit.com/r/worldnews/comments/9tmw8/would_anyone_be_interested_in_region_specific/
2009-10-13,20:53:37,9tjmy,0,"A W35 million price tag for the Internet connection to transmit a five-minute piece of footage is only one of the endless list of inconveniences that make up daily life in North Korea (US$1=W1,163).",english.chosun.com,http://english.chosun.com/site/data/html_dir/2009/10/12/2009101200400.html
2009-10-14,03:48:41,9to78,0,Gay rights no longer a fringe issue - Rights of homosexuals are being debated in every corner of the world.,globalpost.com,http://www.globalpost.com/dispatch/worldview/090930/gay-rights-no-longer-fringe-issue
2009-10-14,05:28:16,9tp93,0,"Children in Gaza: ""We have a right to go to school"" - schools has been repeatedly interrupted by conflict and streets full of piles of rubble and devastation, leftovers from Israel's war earlier this year. ",news.bbc.co.uk,http://news.bbc.co.uk/2/hi/middle_east/8303532.stm
