2009-06-30,08:08:28,8wslo,612,Iraq currently holding giant GTFO party,google.com,http://www.google.com/hostednews/ap/article/ALeqM5hwK_CSpBxsNuVUEaDuOwmSSCiqGwD994J8MG0
2009-06-30,10:21:11,8wtg7,111,Yemeni airliner crashes in Indian Ocean - 150 people reportedly on board; fate unknown,msnbc.msn.com,http://www.msnbc.msn.com/id/31638822/ns/world_news-africa/
2009-07-01,00:48:45,8x06z,66,"BREAKING - Israel attacks Gaza Freedom Boat, kidnaps human rights workers, steals medicines and toys.",freegaza.org,http://freegaza.org/en/home/hope-fleet-news/976-israel-attacks-justice-boat-kidnaps-human-rights-workers-confiscates-medicine-toys-and-olive-trees
2009-06-30,23:18:43,8wz62,63,"Today Israeli Occupation Forces attacked and boarded the Free Gaza Movement boat, the SPIRIT OF HUMANITY, abducting 21 human rights workers from 11 countries, including Noble laureate Mairead Maguire and former U.S. Congresswoman Cynthia McKinney. ",coari.s3.amazonaws.com,https://coari.s3.amazonaws.com/pub/FreeGaza.html.html
2009-07-01,03:33:16,8x21m,57,"Israel to steal the largest section of Palestinian land since 1967 (nearly 34,345 acres, includes Dead Sea beachside tourist area) ",english.aljazeera.net,http://english.aljazeera.net/news/middleeast/2009/06/20096300295121896.html
2009-07-01,03:31:12,8x20n,53,"100,000 Hondurans strike: ""We don't recognize this new government imposed by the oligarchy""",edition.cnn.com,http://edition.cnn.com/2009/WORLD/americas/06/30/honduras.political.turmoil/
2009-07-01,00:06:42,8wzpn,50,Report: Israeli Drones Killed 29 Civilians in Gaza War,wired.com,http://www.wired.com/dangerroom/2009/06/report-israeli-drones-killed-29-civilians-in-gaza-war/
2009-06-30,09:42:12,8wt7e,53,"URGENT ALERT - Israeli Navy surrounding Free 
Gaza ship and threatening to open fire",freegaza.org,http://freegaza.org/en/home/hope-fleet-news/967-urgent-alert-israeli-navy-surrounding-spirit-and-threatening-to-open-fire
2009-07-01,05:34:50,8x390,39,Shell has *perpetrated* a 'human rights tragedy' in the Niger Delta,news.bbc.co.uk,http://news.bbc.co.uk/2/hi/africa/8126353.stm
2009-07-01,03:11:14,8x1sb,31,‘Business as usual’: Peru approves massive oil project just days after ‘Amazon’s Tiananmen’,survival-international.org,http://www.survival-international.org/news/4706
2009-07-01,04:05:35,8x2eh,27,Jewish Americans surprised they were beaten up in Israel by law abiding god fearing typical Israelis,jpost.com,http://www.jpost.com/servlet/Satellite?cid=1246296531833&pagename=JPost%2FJPArticle%2FShowFull
2009-06-30,08:57:33,8wswl,17,Canadian Mint 'loses' $15 million in Gold - not an accounting error....,thestar.com,http://www.thestar.com/news/canada/article/658290
2009-06-30,11:39:31,8wtyz,15,EPA Comes Clean with List of 44 Coal Ash Facilities,twilightearth.com,http://www.twilightearth.com/2009/06/epa-comes-clean-with-list-of-44-coal-ash-facilities/
2009-07-01,00:57:20,8x0af,14,Cynthia McKinney Reportedly Taken Captive By Israeli Navy,greenpartywatch.org,http://www.greenpartywatch.org/2009/06/30/cynthia-mckinney-reportedly-taken-captive-by-israeli-navy/
2009-07-01,00:55:39,8x09s,18,"ISRAEL ATTACKS JUSTICE BOAT; KIDNAPS HUMAN RIGHTS WORKERS; CONFISCATES MEDICINE, TOYS AND OLIVE TREES",palestinethinktank.com,http://palestinethinktank.com/2009/06/30/israel-attacks-justice-boat-kidnaps-human-rights-workers-confiscates-medicine-toys-and-olive-trees/
2009-07-01,04:16:01,8x2hr,14,"The Complicated Case of Honduras, a detailed post explaining the current situation in Honduras, unbiased.",hondurascrisis.wordpress.com,http://hondurascrisis.wordpress.com/2009/06/30/the-complicated-case-of-honduras/
2009-06-30,15:25:30,8wvit,15,Israeli settlers attack two Nablus villages,maannews.net,http://www.maannews.net/en/index.php?opr=ShowDetails&ID=38905
2009-07-01,01:16:15,8x0io,12,U.K. court: Jewish school's entry policy is racist,haaretz.com,http://haaretz.com/hasen/spages/1096735.html
2009-06-30,09:51:58,8wt9e,9,"The Honduran military is effectively a subsidiary of the United States government. Honduras, as a whole, if any Latin American country is fully owned by the United States, its Honduras.",democracynow.org,http://www.democracynow.org/2009/6/29/coup_in_honduras_military_ousts_president
2009-06-30,15:28:34,8wvjo,10,Israel along with friends like these the US is screwed big time,ipsnews.net,http://www.ipsnews.net/news.asp?idnews=47312
2009-06-30,11:10:04,8wtso,10,Free Gaza ship sets sail from Larnaca,morningstaronline.co.uk,http://www.morningstaronline.co.uk/index.php/world/free_gaza_ship_sets_sail_from_larnaca
2009-06-30,20:28:20,8wxoq,9,Australia broadcaster apologizes to an Israel lobby group for Israel report that is 90% correct,jta.org,http://jta.org/news/article/2009/06/24/1006088/australia-broadcaster-apologizes-over-israel-report
2009-06-30,10:52:50,8wtob,7,"Honduras: ""Protests outside the presidential palace grew from hundreds to thousands""",news.yahoo.com,http://news.yahoo.com/s/ap/20090630/ap_on_re_la_am_ca/lt_honduras_coup
2009-06-30,18:35:26,8wwvk,7,"Over the course of several days in April last year, the boy says he was moved from an army camp to a prison, where he was crammed into a cell with five other children, cursed at and humiliated by the guards and beaten by his interrogator until he confessed to stone-throwing.",news.yahoo.com,http://news.yahoo.com/s/time/20090629/wl_time/08599190666400
2009-07-01,01:05:29,8x0ee,7,"Morocco makes peace with its past, inadvertently becomes a case study for Iran",slate.com,http://www.slate.com/id/2221750/?from=rss
2009-07-01,06:48:31,8x3uw,10,Former CIA officer charged in Algiers rape,breitbart.com,http://www.breitbart.com/article.php?id=D9958E8O0&show_article=1&catnum=0
2009-06-30,22:12:04,8wyi6,8,Changing of the Guard: US Troops Withdraw from Iraqi Cities; Maliki Declares “Sovereignty Day”,firedoglake.com,http://firedoglake.com/2009/06/30/changing-of-the-guard-us-troops-withdraw-from-iraqi-cities-maliki-declares-sovereignty-day/
2009-07-01,01:51:48,8x0xq,9,New Honduran President Warns Former Leader of Arrest,washingtonpost.com,http://www.washingtonpost.com/wp-dyn/content/article/2009/06/30/AR2009063001601.html?wprss=rss_world
2009-07-01,02:12:31,8x15t,8,"It's starting to look like we've spent a trillion 
dollars so China could secure Iraqi oil rights.  See - 
it wasn't about oil!",nytimes.com,http://www.nytimes.com/2009/07/01/business/global/01iraqoil.html?hp
2009-06-30,14:03:35,8wuwr,8,Saudi Arabia Is Going To Behead This Man. Please Help Him.,cbc.ca,http://www.cbc.ca/canada/story/2009/06/27/kohail-harper.html
