2009-09-06,19:59:57,9ht28,980,"In an act of publishing cowardice, Condé Nast has gone to extraordinary lengths to prevent Russians from reading a GQ article criticizing Vladimir Putin.",gawker.com,http://gawker.com/5352827/------gq---
2009-09-06,11:49:40,9hqn8,112,Irish Same-Sex Marriage Ad a Surprise Hit on YouTube,alternet.org,http://www.alternet.org/blogs/peek/142449/video%3A_irish_same-sex_marriage_ad_a_surprise_hit_on_youtube/
2009-09-06,19:31:24,9hsx1,48,Is America ready to admit defeat in its 40-year war on drugs?,guardian.co.uk,http://www.guardian.co.uk/theobserver/2009/sep/06/war-on-drugs-latin-america
2009-09-06,19:20:26,9hsvi,38,Cargo ship that vanished in the Channel was carrying arms to Iran and was being tracked by Mossad,timesonline.co.uk,http://www.timesonline.co.uk/tol/news/world/europe/article6823300.ece
2009-09-06,19:00:51,9hssg,22,Nicaraguan police hand over MS-13 boss to Interpol in Managua,english.people.com.cn,http://english.people.com.cn/90001/90777/90852/6749352.html
2009-09-06,08:01:55,9hpim,15,'Massive' ancient wall uncovered in Jerusalem,cnn.com,http://www.cnn.com/2009/WORLD/meast/09/04/israel.wall.discovered/index.html
2009-09-06,20:00:13,9ht29,12,"Mother fights off cougar during attack on son, 5- using a water bottle.",thestar.com,http://www.thestar.com/article/691625
2009-09-06,14:44:25,9hrlj,8,China's polluters are protected by a 'black box' of secrecy as local governments withhold information,guardian.co.uk,http://www.guardian.co.uk/environment/2009/sep/04/china-pollution-secrecy
2009-09-07,04:07:05,9hw5k,6,"As Anne tried to record the protest, against the opening of a municipal carpark on the Jewish Sabbath, the mob spat on her repeatedly.",abc.net.au,http://www.abc.net.au/news/stories/2009/09/06/2677948.htm
2009-09-06,18:52:18,9hsr6,6,Arctic Sea ghost ship 'was carrying weapons to Iran' ,telegraph.co.uk,http://www.telegraph.co.uk/news/worldnews/europe/russia/6145336/Arctic-Sea-ghost-ship-was-carrying-weapons-to-Iran.html
2009-09-07,05:08:32,9hwkf,5,Canadian legal history could be made this week when a Quebec man finds out whether he will become this country's first drunk driver to be declared a dangerous offender.,ca.news.yahoo.com,http://ca.news.yahoo.com/s/capress/090906/national/drunk_dangerous_offender
2009-09-07,06:49:21,9hx4w,5,Cigarette makers sue over tobacco law,news.smh.com.au,http://news.smh.com.au/breaking-news-world/cigarette-makers-sue-over-tobacco-law-20090907-fd28.html
2009-09-06,23:17:16,9hu4b,6,China Web Sites Seeking Users’ Names,nytimes.com,http://www.nytimes.com/2009/09/06/world/asia/06chinanet.html
2009-09-06,21:23:38,9hthr,2,Ghana: Senior UN official calls for urgent measures to mitigate impact of landslides,modernghana.com,http://www.modernghana.com/news/232870/1/senior-un-official-calls-for-urgent-measures-to-mi.html
2009-09-07,01:20:17,9huzy,2,Mother comes out against Dutch girl's solo sail trip,reuters.com,http://www.reuters.com/article/worldNews/idUSTRE5850N020090906
2009-09-06,19:03:19,9hsss,0,US plotted Zia-ul-Haq’s plane crash: Ex-Pak IB chief,blog.taragana.com,http://blog.taragana.com/n/us-plotted-zia-ul-haqs-plane-crash-ex-pak-ib-chief-160974/
2009-09-06,18:19:10,9hsm0,2,Hong Kong voices concerns over beating up of journalists in Urumqi,earthtimes.org,"http://www.earthtimes.org/articles/show/284431,hong-kong-voices-concerns-over-beating-up-of-journalists-in-urumqi.html"
2009-09-06,10:23:41,9hq7f,2,IMF provides $510m loan for Zimbabwe - its first to the country in a decade,mg.co.za,http://www.mg.co.za/article/2009-09-05-imf-provides-510m-loan-for-zimbabwe
2009-09-07,03:37:13,9hvye,4,China warning to syringe stabbers,news.bbc.co.uk,http://news.bbc.co.uk/2/hi/asia-pacific/8240651.stm
2009-09-07,00:09:55,9huh5,1,North Korea says uranium program near completion,us.lrd.yahoo.com,http://us.lrd.yahoo.com/_ylc=X3oDMTI1dTFpamZuBF9TAzk3MTgwMDM0OARnc3RhdGUDMwRwb3MDMgRzZWMDbndfd29ybGQEc2xrA3RpdGxlBHRhcgNuZXdzLnlhaG9vLmNvbQ--/SIG=13knmopil/**http%3A//us.rd.yahoo.com/dailynews/rss/world/*http%3A//news.yahoo.com/s/ap/20090904/ap_on_re_as/as_nkorea_nuclear
2009-09-06,17:52:18,9hshc,0,"When will it stop being cool to hate the United States, Israel, and Republicans, and instead hate on the real bad guys out there: Mugabe, Al Bashir, al-Qaddafi, Than Shwe, etc.",self.worldnews,https://www.reddit.com/r/worldnews/comments/9hshc/when_will_it_stop_being_cool_to_hate_the_united/
2009-09-06,23:18:19,9hu4k,0,CD taken off Amazon because of the song: There's only one Arsene Wenger / There's only one Arsene Wenger / With a pocket of sweets and a cheeky smile / Wenger is a fucking paedophile.,news.bbc.co.uk,http://news.bbc.co.uk/newsbeat/hi/front_page/newsid_10000000/newsid_10001400/10001422.stm
2009-09-07,06:46:34,9hx4g,0,Bombs will kill women in Afghanistan: The Lies of Women being free in Afghanistan.,rethinkafghanistan.com,http://rethinkafghanistan.com/blog/?p=604
2009-09-07,07:16:51,9hxb6,0,"Gun control laws. No use to carry a weapon when someone pulls up to you and unloads an AK-47 rifle before you can even say: ""FUUUUUUUUUUUUU...""",debate.com.mx,http://www.debate.com.mx/eldebate/Articulos/ArticuloPrimera.asp?IdArt=8693200&IdCat=6087
2009-09-07,01:21:13,9hv05,0,Is there any possibility that FED is going to be audited? Do you believe it??,upollit.blogspot.com,http://upollit.blogspot.com/2009/09/ron-paul-says-audit-fed.html
2009-09-07,05:06:27,9hwk2,1,Vietnam: Nation’s population soars to 85.8m,vietnamnews.vnagency.com.vn,http://vietnamnews.vnagency.com.vn/showarticle.php?num=07SOC140809
2009-09-07,05:10:17,9hwky,0,Afghan officials disqualify votes from 450 polling places,latimes.com,"http://www.latimes.com/news/nationworld/world/afghanistan/la-fg-afghan-election7-2009sep07,0,7124933.story"
2009-09-06,22:55:55,9htzf,0,"100,000 Gaza Children Train In Hamas Camps",dover.idf.il,http://dover.idf.il/IDF/English/News/today/09/08/2901.htm
2009-09-06,23:44:43,9huau,1,China: Syringe-wielding assailants may face death,salon.com,http://www.salon.com/wires/ap/world/2009/09/06/D9AHRQK01_as_china_protest/index.html
