2009-12-08,20:21:40,accmh,392,"Remember Tony Blair's ""45-minute"" WMD claim? He got it from a taxi driver",guardian.co.uk,http://www.guardian.co.uk/politics/2009/dec/08/45-minutes-wmd-taxi-driver
2009-12-08,12:16:35,ac8a4,234,"""...the record industries could use songs as long as 
they pinky swore they would get authorization and 
pay the artist for it eventually."" And yet individual 
downloaders are sued for millions of dollars.",arstechnica.com,http://arstechnica.com/tech-policy/news/2009/12/artists-lawsuit-major-record-labels-are-the-real-pirates.ars
2009-12-08,21:32:30,acdar,190,The US cash behind Israeli extremist settlers: IRS records identified 28 US charitable groups that made a total of $33.4m in tax-exempt contributions,guardian.co.uk,http://www.guardian.co.uk/commentisfree/cifamerica/2009/dec/08/us-settlers-hebron-fund-israeli
2009-12-08,19:48:46,accb7,161,Thieves in Brazil have stolen more than $6m while everybody watched a soccer game,news.bbc.co.uk,http://news.bbc.co.uk/2/hi/americas/8400511.stm
2009-12-08,18:05:33,acbfp,127,Car bombs cause carnage in Baghdad: at least 101 killed and 182 wounded,newsvote.bbc.co.uk,http://newsvote.bbc.co.uk/mpapps/pagetools/print/news.bbc.co.uk/2/hi/middle_east/8400865.stm?ad=1
2009-12-09,01:41:32,acgdv,60,Copenhagen climate conference in disarray following leak of document that would effectively mean 'screw you 3rd world',guardian.co.uk,http://www.guardian.co.uk/environment/copenhagen
2009-12-08,02:22:43,ac2d0,61,"Has Anyone Read the Copenhagen Agreement?  The aim is to give a new as yet unnamed U.N. body the power to directly intervene in the financial, economic, tax and environmental affairs of all the nations that sign the Copenhagen treaty.",online.wsj.com,http://online.wsj.com/article/SB10001424052748703574604574500580285679074.html?mod=googlenews_wsj
2009-12-09,00:50:36,acfpd,43,EU proposes two-capital Jerusalem,news.bbc.co.uk,http://news.bbc.co.uk/2/hi/middle_east/8401913.stm
2009-12-08,22:59:36,aceb4,34,83% of Mexicans support using the Mexican army to fight drug traffickers; only 30% want U.S. forces deployed to Mexico to fight drug traffickers.,pewresearch.org,http://pewresearch.org/databank/dailynumber/?NumberID=865
2009-12-08,18:04:41,acbfd,29,Hacked email climate scientists receive death threats,guardian.co.uk,http://www.guardian.co.uk/environment/2009/dec/08/hacked-climate-emails-death-threats
2009-12-08,18:17:31,acbjt,28,"$100,000 dinosaur robot stolen from Mexico exhibition",news.bbc.co.uk,http://news.bbc.co.uk/2/hi/entertainment/8400962.stm
2009-12-08,18:05:09,acbfl,27,"Four car bombs exploded in Baghdad in quick succession, killing at least 101 and 182 injured",timesonline.co.uk,http://www.timesonline.co.uk/tol/news/world/iraq/article6948382.ece
2009-12-09,00:53:09,acfqk,27,Judge accuses 3 Pinochet associates of poisoning former Chilean president Eduardo Frei with low doses of mustard gas and thallium. ,nytimes.com,http://www.nytimes.com/2009/12/08/world/americas/08chile.html?
2009-12-08,20:01:14,accg0,19,Afghanistan's president has warned that it will take 15 years before it is able to pay for the costs of maintaining its own security forces,news.bbc.co.uk,http://news.bbc.co.uk/2/hi/south_asia/8400806.stm
2009-12-08,11:56:41,ac83e,17,Mongolians Damages Great Wall of China,telegraph.co.uk,http://www.telegraph.co.uk/news/worldnews/asia/china/6652470/Mongolians-destroy-Great-Wall-of-China.html
2009-12-08,21:50:37,acdik,15,Afghanistan 'unable to pay for own troops for 15 years',news.bbc.co.uk,http://news.bbc.co.uk/1/hi/world/south_asia/8400806.stm
2009-12-09,03:26:01,achos,14,"This is number 1,789, or thereabouts, in my long running series, ""What the hell is going on in this country?""",guardian.co.uk,http://www.guardian.co.uk/commentisfree/henryporter/2009/dec/01/children-parents-government
2009-12-09,00:50:06,acfp5,15,"Israel's justice minister starts process of Talibanization: Religious Law Must Become Binding, the Torah contains ''a complete solution to all the things we are dealing with''",nytimes.com,http://www.nytimes.com/aponline/2009/12/08/world/AP-ML-Israel-Justice-Minister.html?pagewanted=print
2009-12-08,21:41:22,acdf0,11,Series of coordinated attacks — including three car-rigged bombs striking near government sites — killing 112 people and wounding 197 in Baghdad.,msnbc.msn.com,http://www.msnbc.msn.com/id/34322986/ns/world_news-mideastn_africa/?gt1=43001
2009-12-08,22:02:29,acdn9,13,Karzai Says Afghan Army Will Need Help Until 2024.,nytimes.com,http://www.nytimes.com/2009/12/09/world/asia/09gates.html?hpw
2009-12-09,03:05:40,achg3,12,"Fundamentalists block entire Paris streets by praying, preventing the inhabitants of the area from going out or returning to their homes, the shopkeepers from working, and ordinary citizens from circulating normally.",gatesofvienna.blogspot.com,http://gatesofvienna.blogspot.com/2009/12/mr-president-give-us-back-our-streets.html
2009-12-09,02:10:11,acgqv,11,"Uganda: Cholera, Yellow Fever, Ebola, Plague On the Rise",allafrica.com,http://allafrica.com/stories/200912071284.html
2009-12-08,23:12:18,acegf,10,"The International Court of Justice (ICJ) is holding hearings examining whether Kosovo's declaration of independence was legal, with Russia and the U.S. arguing from opposite sides of the table.",reuters.com,http://www.reuters.com/article/idUSTRE5B72XP20091208
2009-12-08,09:24:59,ac6on,10,"A Chinese woman managed to enter Japan illegally by having plastic surgery to alter her fingerprints, thus fooling immigration controls, police claim.",news.bbc.co.uk,http://news.bbc.co.uk/2/hi/asia-pacific/8400222.stm
2009-12-08,08:26:22,ac66l,10,"Chilean judge rules ex-president was assassinated in 1982; 6 charged with murder, cover-up.",sun-sentinel.com,"http://www.sun-sentinel.com/news/nationworld/sns-ap-lt-chile-frei,0,7441643.story"
2009-12-08,09:59:32,ac702,12,Afghan Drug Lords and Corrupt Officials Smuggling Millions To Dubai,newspirates.com,http://newspirates.com/?p=6680
2009-12-08,22:14:16,acdsu,11,UK: Spy chief Sir John Scarlett is being questioned about intelligence on Iraq after claims a taxi driver was the source for the most infamous claim.,news.bbc.co.uk,http://news.bbc.co.uk/2/hi/uk_news/8401473.stm
2009-12-08,21:38:17,acddn,9,"The first decade of this century is ""by far"" the warmest since instrumental records began, and a new global temperature record will be set ""in the next one or two years""",newsvote.bbc.co.uk,http://newsvote.bbc.co.uk/mpapps/pagetools/print/news.bbc.co.uk/2/hi/science/nature/8400905.stm?ad=1
2009-12-08,23:40:39,acet8,9,"Iran: More Than 200 Arrested in Student Protests during marches by tens of thousands at universities across the country, the biggest anti-government rallies in months",nytimes.com,http://www.nytimes.com/aponline/2009/12/08/world/AP-ML-Iran.html
2009-12-09,01:44:10,acgf1,8,"""This isn’t the Britain we fought for” say the ‘unknown warriors’ of WW2. ""This Land of Hope and Glory is just a land of yobs and drunks.""",news.ronatvan.com,http://news.ronatvan.com/2009/12/06/united-kingdom-this-isnt-the-britain-we-fought-for-say-the-unknown-warriors-of-ww2/
