2009-04-10,00:11:16,8b8ym,1059,French president humiliated when French Parliment rejects his proposed law that would allow the recording and movie industry to cut off Internet for accused illegal downloaders,timesonline.co.uk,http://www.timesonline.co.uk/tol/news/world/europe/article6067641.ece
2009-04-10,20:22:16,8bgy0,117,"Google Street View Cameraman: ""Don’t you take pictures of me, mate.""",telegraph.co.uk,http://www.telegraph.co.uk/scienceandtechnology/technology/google/5131854/Google-Street-View-cameraman-in-row-with-photographer.html
2009-04-10,11:53:09,8beao,73,Republican Lawmaker Suggests Asians Adopt Easier-to-Pronounce Names,chron.com,http://www.chron.com/disp/story.mpl/front/6365320.html
2009-04-10,15:18:58,8bfgn,72,"""UK, if you think Dubai is bad, just look at your own country""",independent.co.uk,http://www.independent.co.uk/opinion/commentators/sultan-sooud-al-gassemi-if-you-think-dubai-is-bad-just-look-at-your-own-country-1666748.html
2009-04-11,04:48:55,8bky5,66,The One-Child Policy in action: There are 32 million more mainland Chinese males under the age of 20 than females,blogs.wsj.com,http://blogs.wsj.com/chinajournal/2009/04/10/china%E2%80%99s-gender-gap-32-million-extra-boys/?mod=rss_WSJBlog
2009-04-11,00:39:01,8birx,54,"Photographer Steve Back, whose picture of the UK's antiterror chief holding a clearly visible secret document led to his resignation yesterday: ""I’ve told Downing Street before that the quality of lenses means that we can read ministerial papers""",telegraph.co.uk,http://www.telegraph.co.uk/news/newstopics/politics/5127229/Terror-blunder-photographer-who-snapped-Bob-Quick-has-embarrassed-the-Government-before-in-Downing-Street.html
2009-04-10,11:04:37,8be0l,53,"Israel threatens to prevent Northern Ireland leader Gerry Adams from travelling to Gaza.  He goes anyway, and meets with Hamas leaders.",news.bbc.co.uk,http://news.bbc.co.uk/2/hi/uk_news/northern_ireland/7991311.stm
2009-04-10,22:17:39,8bhky,42,Swedish civil servants surfing porn to chase taxable income.,news.bbc.co.uk,http://news.bbc.co.uk/2/hi/europe/7993694.stm
2009-04-10,22:33:00,8bhpi,33,Russia's cosmonauts prepare for letdown,latimes.com,"http://www.latimes.com/news/nationworld/world/la-fg-russia-cosmonauts10-2009apr10,0,624437.story"
2009-04-10,12:03:52,8bect,34,"Israel Cries Wolf - on Iran - again. Roger Cohen, NY Times",nytimes.com,http://www.nytimes.com/2009/04/09/opinion/09iht-edcohen.html
2009-04-10,22:34:28,8bhpu,19,Iraq suicide bombing kills five U.S. soldiers,cnn.com,http://www.cnn.com/2009/WORLD/meast/04/10/iraq.soldiers.killed/index.html
2009-04-10,13:58:48,8bf04,18,Somali pirates surrounded by FBI and US warships in Indian Ocean stand-off,guardian.co.uk,http://www.guardian.co.uk/world/2009/apr/10/somalia-pirates-us-military-hostages
2009-04-10,09:20:40,8bdga,15,Obama asks Congress for extra $83.4 bln for military funding in Iraq and Afghanistan.. ALL money would be spent by SEPTEMBER,reuters.com,http://www.reuters.com/article/marketsNews/idUSN0930196920090409
2009-04-11,02:26:28,8bjr2,15,A Taste of AFRICOM: Somalia did find peace and tried to stop piracy before the US bombed the shit out of it in 2006 ,chycho.com,http://www.chycho.com/?q=Somalia_Pirates_chycho2009
2009-04-10,11:44:26,8be8u,12,Activist Charged for Inciting 'Twitter Revolution' (Updated) | Danger Room from Wired.com,blog.wired.com,http://blog.wired.com/defense/2009/04/activist-charge.html
2009-04-10,22:47:07,8bhtr,10,Underdogs of War: 6 Tiny Nations that Kicked Ass,cracked.com,http://www.cracked.com/article_17232_underdogs-war-6-tiny-nations-that-kicked-ass.html
2009-04-11,03:34:02,8bkbz,9,Interview with Iranian President Ahmadinejad: 'We Are Neither Obstinate nor Gullible' - SPIEGEL ONLINE - News - International,spiegel.de,"http://www.spiegel.de/international/world/0,1518,618559,00.html"
2009-04-11,03:26:05,8bk9v,9,"Lost of  ""hope"" in Gaza aftermath......this is what the war was really out to accomplish.",news.bbc.co.uk,http://news.bbc.co.uk/2/hi/middle_east/7991341.stm
2009-04-10,09:15:15,8bdf1,6,Yay! Obama seeks extra funds for wars ,news.bbc.co.uk,http://news.bbc.co.uk/2/hi/americas/7993177.stm
2009-04-11,00:54:36,8bixa,7,"""U.S. Negotiations With Somali Pirates Continue"" -- I thought it was US policy NOT to negotiate with terrorists. Can someone explain?",washingtonpost.com,http://www.washingtonpost.com/wp-dyn/content/article/2009/04/10/AR2009041000881.html
2009-04-10,10:47:45,8bdxy,6,Democracy loses in Fiji! President abrogates constitution!,fijitimes.com,http://www.fijitimes.com/story.aspx?id=118886
2009-04-11,01:35:38,8bjb4,6,Bolivian president Evo Morales is on a hunger strike for constitutional reform,news.bbc.co.uk,http://news.bbc.co.uk/2/hi/americas/7993274.stm
2009-04-11,03:44:03,8bkew,6,Gunman on Mich Community college campus; gunshot reported,news.yahoo.com,http://news.yahoo.com/s/ap/20090410/ap_on_re_us/michigan_college_gunman
2009-04-10,08:24:45,8bd4l,7,"In the 3rd Poorest Place on the Planet. We have $200m of Reward Money Outstanding, incl. $50m for Osama & No-One has Come Forward to Take a Cent.",news.bbc.co.uk,http://news.bbc.co.uk/2/hi/south_asia/7990538.stm?yello
2009-04-10,22:44:39,8bhsx,5,Russia blamed for pipeline blast ,news.bbc.co.uk,http://news.bbc.co.uk/2/hi/asia-pacific/7993625.stm
2009-04-11,02:45:50,8bjx7,5,Part of Antarctica breaks off,nocameranointervention.wordpress.com,http://nocameranointervention.wordpress.com/2009/04/06/ice-bridge-in-antarctic-breaks/
2009-04-11,02:46:33,8bjxe,4,Pirates want $2 million for American hostage,reuters.com,http://www.reuters.com/article/topNews/idUSTRE53921920090410?feedType=RSS&feedName=topNews&rpc=22&sp=true
2009-04-11,07:17:52,8blx2,6,Exclusive: Somali Pirates' Homemade Hijacking Video,blog.wired.com,http://blog.wired.com/defense/2009/04/exclusive-video.html
2009-04-11,03:52:12,8bkh1,2,Somalian Pirates or Desperate Family Men?,politicsreport.com,http://politicsreport.com/2009/04/09/somalian-pirates-or-desperate-family-men/
2009-04-10,11:55:43,8bebf,6,Dutch TV show exonerates Osama bin Laden: 'Devil's Advocate' jury finds no proof he was behind Sept. 11,hollywoodreporter.com,http://www.hollywoodreporter.com/hr/content_display/television/news/e3ie9cf6d4fe9496d052885db4114f0c656
