2009-10-07,15:49:28,9rllr,327,"The great energy rip-off in UK: Utility companies put up power prices by 42% last year, or £382 per household. Since then, the wholesale cost of gas and electricity has halved but bills have fallen by only 4%...wtf?!",independent.co.uk,http://www.independent.co.uk/news/business/news/the-great-energy-ripoff-and-how-you-can-avoid-it-1798701.html
2009-10-08,00:15:01,9rpzz,202,Piracy: You're doing it wrong,news.bbc.co.uk,http://news.bbc.co.uk/1/hi/world/africa/8294858.stm
2009-10-08,06:56:13,9ru96,144,[Classic War Nerd] The French,exile.ru,http://www.exile.ru/articles/detail.php?ARTICLE_ID=7061&IBLOCK_ID=35
2009-10-07,11:36:41,9rji3,112,Latvia pushes back against the IMF and EU - by threatening to bail out their mortgage holders instead of European banks,online.wsj.com,http://online.wsj.com/article/SB125487100049169169.html
2009-10-07,13:54:09,9rkns,84,"Four RCMP officers lied, Polish lawyer tells Taser inquiry into the death of Robert Dziekanski in incident at Vancouver airport",cbc.ca,http://www.cbc.ca/canada/british-columbia/story/2009/10/06/bc-dziekanski-taser-braidwood-inquiry.html
2009-10-07,16:10:08,9rlrd,75,"For all the recent uproar over Iran's nuclear program, little attention has been paid to the fact that the country which first provided Tehran with nuclear equipment was the US",csmonitor.com,http://www.csmonitor.com/2009/1002/p04s01-usfp.html
2009-10-08,02:29:50,9rrld,45,Italian MPs to consider ban on full Islamic dress for women,inteldaily.com,http://www.inteldaily.com/news/146/ARTICLE/12131/2009-10-07.html
2009-10-08,01:20:19,9rqt2,42,Baha’i Cemetery Ruined for the 18th Time,chrr.us,http://chrr.us/spip.php?article5954
2009-10-08,02:45:23,9rrrb,42,"Teenage girl goes Rambo on homewrecking terrorists - kills leader with a hatchet, steals his gun, and sends his cronies running. ",self.worldnews,https://www.reddit.com/r/worldnews/comments/9rrrb/teenage_girl_goes_rambo_on_homewrecking/
2009-10-07,15:04:56,9rl81,34,Everyone is dead: Four villages in Indonesia may be declared mass graves after earthquake,news.com.au,"http://www.news.com.au/couriermail/story/0,20797,26178256-5003402,00.html?from=public_rss"
2009-10-07,15:05:41,9rl8b,34,"Canada's prostitution laws are puzzling, ill-conceived and contribute to horrific violence against sex workers; calls for prostitution to be decriminalized",cbc.ca,http://www.cbc.ca/canada/toronto/story/2009/10/06/canada-prostitution-decriminalize685.html
2009-10-08,02:08:47,9rrcm,29,"Iran's Revolutionary Guards have bought a controlling stake in the country's telecommunications company, fuelling suspicions that the organisation is quietly staging a military takeover.",guardian.co.uk,http://www.guardian.co.uk/world/2009/oct/07/revolutionary-guards-iran
2009-10-08,04:28:52,9rsuj,27,Somali pirates launch terrifying attack on lone ship in the Indian ocean with Kalashnikov assault rifles. Unfortunately for them it happened to be a French warship,timesonline.co.uk,http://www.timesonline.co.uk/tol/news/world/africa/article6864367.ece
2009-10-07,15:34:46,9rlh8,23,"An Israeli cabinet minister has cancelled a visit to 
Britain for fear he might be arrested on allegations 
he committed war crimes.",upi.com,http://www.upi.com/Emerging_Threats/2009/10/06/Israeli-leaders-run-for-cover/UPI-29851254852378/
2009-10-07,14:56:37,9rl5k,23,Gore Vidal's United States of fury,belfasttelegraph.co.uk,http://www.belfasttelegraph.co.uk/news/world-news/gore-vidals-united-states-of-fury-14523137.html
2009-10-07,17:30:47,9rmcf,22,"Obama's paradox: admits Afghanistan war is doomed to fail without a transparent, corruption-free gov't in place, but can't dodge the fact Karzai's regime is incredibly corrupt, nor explain how to fix it.",motherjones.com,http://www.motherjones.com/mojo/2009/10/obama-and-afghanistan-you-cant-handle-truth
2009-10-07,15:37:23,9rli0,21,Sugar becomes the new oil as prices soar: The price of sugar on global commodity markets has doubled since the beginning of the year and is close to 28-yr high!,guardian.co.uk,http://www.guardian.co.uk/business/2009/oct/06/sugar-prices-soar-new-oil
2009-10-07,19:15:07,9rn4c,17,"Our data in their hands, nowhere near safe. The ID card comedy show trundles on. Security in this country is a joke!",computerweekly.com,http://www.computerweekly.com/Articles/2009/10/06/238017/id-card-officials-back-away-from-scandal-hit-database.htm
2009-10-07,23:02:21,9rp5a,15,"At a demonstration against Guinea's Capt. Moussa Dadis Camara on Sept. 28, witnesses said soldiers opened fire on the crowds and raped and sexually assaulted female protesters. Now the U.S. is insisting Camara take responsibility for the abuses.",nytimes.com,http://www.nytimes.com/2009/10/07/world/africa/07guinea.html?partner=rss&emc=rss
2009-10-07,15:23:11,9rld6,15,"UK doctors pay some psychiatric patients to make them take their medication: In trial, 68 patients with bipolar disorder or schizophrenia will get £15 for every jab of anti-psychotic drug",news.bbc.co.uk,http://news.bbc.co.uk/2/hi/health/8290295.stm
2009-10-08,02:14:00,9rret,11,Louvre museum accused of buying stolen archeological pieces,news.bbc.co.uk,http://news.bbc.co.uk/2/hi/europe/8294821.stm
2009-10-08,04:43:27,9rszb,10,Hamas bans Gaza motorcyclists from giving women rides ,haaretz.com,http://haaretz.com/hasen/spages/1119436.html
2009-10-07,22:30:30,9rose,9,"Obama administration forces Palestinian Authority to drop Demand for Vote on Gaza Report - ""This report would have finally eliminated the impunity Israel enjoys in international law and would have held them accountable for the war crimes that took place in Gaza.”",democracynow.org,http://www.democracynow.org/2009/10/5/headlines
2009-10-07,11:37:28,9rjie,5,"The plan to de-dollarise the oil market, denied by Saudi Arabia being, as expected – reflects a growing resentment in the Middle East, Europe and in China at America's decades-long political as well as economic world dominance.",belfasttelegraph.co.uk,http://www.belfasttelegraph.co.uk/opinion/columnists/robert-fisk/robert-fisk-plan-to-dedollarise-oil-market-is-a-financial-revolution-with-profound-political-implications-14523133.html
2009-10-08,07:17:06,9ruep,4,NATO seeks more Russian help in Afghanistan,alertnet.org,http://www.alertnet.org/thenews/newsdesk/L7615125.htm
2009-10-07,14:15:51,9rktq,5,"""withdrawal of the Goldstone report by the Palestinian Authority aided Abbas' son,Yasser Mahmoud Abbas get a new cellular network in the West Bank"" ",thestar.com,http://www.thestar.com/comment/columnists/article/624798
2009-10-07,19:13:19,9rn3n,4,Pregnancy ends in death for one in eight mothers in Sierra Leone. ,wsws.org,http://www.wsws.org/articles/2009/oct2009/sier-o07.shtml
2009-10-07,22:31:22,9ross,4,"The Electoral Complaints Commission has finally ordered a recount of ballots in the Afghan election to take into account the possibility one candidate may have benefitted from fraud, a finding that could force Karzai to face a second round.",reuters.com,http://www.reuters.com/article/worldNews/idUSTRE59626Z20091007
2009-10-07,15:09:17,9rl9d,4,Ontario's health minister quits before release of report into spending scandals at an agency tasked with creating electronic health records,cbc.ca,http://www.cbc.ca/canada/toronto/story/2009/10/06/caplan-health-minister-resign641.html
2009-10-07,17:57:09,9rmj0,5,"Rival ethnic groups in Kenya who fought after the 2007 election are rearming in readiness for violence at the 2012 poll, a BBC investigation has found",news.bbc.co.uk,http://news.bbc.co.uk/2/hi/africa/8293745.stm
