2009-06-17,19:22:03,8t8en,2355,The man who leaked the real election results from the Interior Ministry - the ones showing Ahmadinejad coming third - was killed in a suspicious car accident (11:00am Posting),guardian.co.uk,http://www.guardian.co.uk/news/blog/2009/jun/17/iran-uprising
2009-06-17,18:04:04,8t7v1,114,A Chinese waitress who stabbed a gov't official to death when he tried to sexually assault her has been freed at the start of her trial ,telegraph.co.uk,http://www.telegraph.co.uk/news/worldnews/asia/china/5549081/Chinese-waitress-freed-after-stabbing-official-to-death-during-sex-assault.html
2009-06-17,11:39:23,8t56h,52,"Grand Ayatollah Hossein Ali Montazeri, Iran's most senior Islamic cleric threw his weight behind opposition charges that Ahmadinejad's re-election was rigged: ""A government not respecting people's vote has no religious or political legitimacy,"" ",mcclatchydc.com,http://www.mcclatchydc.com/iran/story/70155.html
2009-06-18,00:47:07,8tba9,57,"Turnouts of more than 100% were recorded in at least 30 Iranian towns in last week's disputed presidential election, opposition sources have claimed.",guardian.co.uk,http://www.guardian.co.uk/global/2009/jun/17/iran-election-rigging
2009-06-17,19:24:27,8t8f8,44,China+Russia+India+Brazil form bloc intended to challenge US dominance,timesonline.co.uk,http://www.timesonline.co.uk/tol/news/world/us_and_americas/article6514737.ece
2009-06-18,05:56:08,8ted9,39,"""They made signs like they wanted to cut my brother's baby's throat,. They said they wanted to kill us.""  More than 100 Romanian Gypsies chased out of their Belfast homes by thugs armed with bottles and Nazi salutes.",google.com,http://www.google.com/hostednews/ap/article/ALeqM5iDji7_Kp0M1B_ADrZ0T9-dBi-xpwD98SI4HG0
2009-06-18,02:59:38,8tcpm,26,Iranian soccer players wear green for live televised game.,thinkprogress.org,http://thinkprogress.org/2009/06/17/iran-footballers-wear-green/
2009-06-18,00:57:42,8tbe6,22,Turnouts above 100% in 30 Iranian towns,guardian.co.uk,http://www.guardian.co.uk/world/2009/jun/17/iran-election-turnout-figures
2009-06-17,18:27:44,8t80j,21,Green Hope of the Iranian Opposition - Incredible Pics from the People of Iran,demotix.com,http://www.demotix.com/news/mousavi-supporters-go-green
2009-06-18,01:41:50,8tbvo,17,Graphic Picture Warning! 21+ A protester slaughtered in the hands of Ahmadinejad's zombies,twitpic.com,http://twitpic.com/7motl
2009-06-17,09:28:57,8t48r,17,"Essential quote from the protests in Iran: ""140 characters is a novel when you’re being shot at.""",shortformblog.com,http://shortformblog.com/world/this-quote-about-the-iran-protests-pretty-much-says-it-all
2009-06-18,04:31:05,8tdl3,18,Iranians warned not to use sites such as Twitter,telegraph.co.uk,http://www.telegraph.co.uk/news/worldnews/middleeast/iran/5561345/Iranians-warned-not-to-use-sites-such-as-Twitter.html
2009-06-18,01:22:45,8tboo,15,Iran vs USA [comic],mattbors.com,http://www.mattbors.com/archives/530.html
2009-06-18,05:27:17,8te36,17,"The nano home: India's cheap housing boom. (Builders are constucting flats outside of the cities - where land is expensive - and selling living units for as little as US$4,500)",economist.com,http://www.economist.com/businessfinance/displayStory.cfm?story_id=13837400&source=hptextfeature
2009-06-17,22:33:14,8t9v2,18,Iranian protesters report that imported Hamas thugs are helping crush dissent,jpost.com,http://www.jpost.com/servlet/Satellite?cid=1245184851049&pagename=JPost%2FJPArticle%2FShowFull
2009-06-18,04:17:36,8tdh5,15,Beijing stipulates that $586 billion in stimulus funds be spent only on Chinese goods,csmonitor.com,http://www.csmonitor.com/2009/0617/p06s04-woap.html
2009-06-17,08:00:53,8t3mc,14,Cyberwar guide for Iran elections,boingboing.net,http://www.boingboing.net/2009/06/16/cyberwar-guide-for-i.html
2009-06-17,08:54:19,8t40f,13,"A Brutally Honest Film About The Killing of 23,000 Dolphins",adistinctiveworld.net,http://www.adistinctiveworld.net/?p=1289
2009-06-17,20:50:07,8t90p,14,Mass dolphin stranding linked to navy exercises,newscientist.com,http://www.newscientist.com/article/dn17321-mass-dolphin-stranding-linked-to-navy-exercises.html
2009-06-18,02:11:46,8tc7r,13,Ahmadinejad Lying Again With Photoshop,gizmodo.com,http://gizmodo.com/5293878/ahmadinijad-lying-again-with-photoshop
2009-06-18,00:11:04,8tavn,11,Iran widens jamming of BBC as Revolutionary Guard cautions bloggers,guardian.co.uk,http://www.guardian.co.uk/media/2009/jun/17/iran-bbc-jamming-bloggers-revolutionary-guard
2009-06-18,00:57:00,8tbdz,12,"Why hasn't the Iranian govt. blocked Twitter in Iran?  If they can't, why not?  Or is it because they haven't tried?",self.worldnews,https://www.reddit.com/r/worldnews/comments/8tbdz/why_hasnt_the_iranian_govt_blocked_twitter_in/
2009-06-17,14:02:32,8t655,12,Attention Iranian Redditors! Help the Iranian bloggers: spoof your MAC address and tunnel through an SSH account to mask your IP so it looks like you're not in TEHRAN. Security forces hunting for bloggers using IP and MAC searches. If you are all h@x0rz it's much harder to find you.,self.worldnews,https://www.reddit.com/r/worldnews/comments/8t655/attention_iranian_redditors_help_the_iranian/
2009-06-17,22:50:39,8ta16,11,Mousavi calls day of mourning for Iran dead,reuters.com,http://www.reuters.com/article/topNews/idUSTRE55F54520090617?sp=true
2009-06-18,02:25:08,8tccm,10,Memo which proves the fix in Iran? (need translation),flickr.com,http://www.flickr.com/photos/andishehnouraee/3635977616/
2009-06-17,08:20:18,8t3rt,9,British Airways asks staff to work for nothing - [NOT Onion],reuters.com,http://www.reuters.com/article/lifestyleMolt/idUSTRE55F51X20090616
2009-06-17,09:25:28,8t47j,8,Iran: Fear has gone in a land that has tasted freedom,independent.co.uk,http://www.independent.co.uk/opinion/commentators/fisk/robert-fisk-fear-has-gone-in-a-land-that-has-tasted-freedom-1706912.html
2009-06-17,08:02:41,8t3mx,9,"To Iranians: If the govt is closing down the websites or blocking access to twitter, then email your friends with updated using something like HTTPS over gmail. We in the US will tweet them for you.",self.worldnews,https://www.reddit.com/r/worldnews/comments/8t3mx/to_iranians_if_the_govt_is_closing_down_the/
2009-06-18,04:04:25,8tdd0,8,The head of Israel's Mossad says that he wants Ahmedinejad to triumph over the Iranian protestors for reformist candidate Mousavi.,andrewsullivan.theatlantic.com,http://andrewsullivan.theatlantic.com/the_daily_dish/2009/06/the-mossad-wants-ahmadinejad.html
2009-06-17,23:00:56,8ta55,8,"Photographer in Iran: ""while there is a real risk of being caught I feel responsible to keep capturing the scene while I can"" (Photos)",oregonlive.com,http://www.oregonlive.com/news/index.ssf/2009/06/when_robert_hrdinsky_found_him.html
