2009-01-02,00:16:23,7msux,422,Former Army Employee Pleads Guilty to Acting as Israeli Spy,usdoj.gov,http://www.usdoj.gov/opa/pr/2008/December/08-nsd-1154.html
2009-01-01,09:49:28,7mqez,356,Graphic pictures of what the Israeli war machine does to Palestinians.,irishantiwar.org,http://irishantiwar.org/node/149
2009-01-02,02:47:00,7mtl0,237,Icelandic TV program featuring PM forced off the air when a torch-wielding crowd stormed Reykjavik's Hotel Borg in an attempt to get to the studio. A torch-wielding crowd. Sweet.,google.com,http://www.google.com/hostednews/ap/article/ALeqM5htieYqASzIvKOfKAGOO7BvxEjzsgD95DUANO0
2009-01-01,21:29:55,7ms9w,175,Gazprom cuts off Ukraine's gas supply.,cnn.com,http://www.cnn.com/2009/WORLD/europe/01/01/russia.ukraine.gas/index.html
2009-01-01,13:38:37,7mr1x,123,"IDF Claims to have Hit Hamas Truck, Human Rights Group Finds 8 Civilians Dead and No Hamas",guardian.co.uk,http://www.guardian.co.uk/world/2009/jan/01/surgical-strike-israel-human-rights
2009-01-02,01:49:21,7mtbc,41,"Daniel Barenboim: If Hamas is destroyed, a more radical group will replace it. Israel's security depends on wiser action",guardian.co.uk,http://www.guardian.co.uk/commentisfree/2009/jan/01/israel-gaza-bombings-hamas
2009-01-01,08:52:56,7mqa1,42,Israel and Gaza - Pictures,boston.com,http://www.boston.com/bigpicture/2008/12/israel_and_gaza.html
2009-01-02,06:11:09,7muju,36,Greece: The left is full of puppet organizations that defer and defend the right and the existing order. The Greek people have no alternative but starting from scratch. ,wsws.org,http://wsws.org/articles/2008/dec2008/gree-d31.shtml
2009-01-01,23:54:52,7msr1,21,"""The land is fertile, the rain is falling, but the agricultural system has been destroyed by Robert Mugabe""",independent.co.uk,http://www.independent.co.uk/news/world/africa/zimbabwe-doomed-to-another-failed-harvest-1216243.html
2009-01-01,16:46:01,7mrk6,23,UK telecom firm severs ties with Israeli company due to Gaza attacks,belfasttelegraph.co.uk,http://www.belfasttelegraph.co.uk/news/world-news/uk-telecom-firm-severs-ties-with-israeli-company-due-to-gaza-attacks-14125949.html
2009-01-02,00:17:39,7msv3,7,Rotten state of Egypt too powerless and corrupt to act,belfasttelegraph.co.uk,http://www.belfasttelegraph.co.uk/opinion/columnists/robert-fisk/robert-fisk-rotten-state-of-egypt-too-powerless-and-corrupt-to-act-14125900.html
2009-01-02,03:44:58,7mtw3,8,No wonder it burnt to the ground - Cellphone footage shows hundreds of sparklers inside Bangkok club minutes before Deadly fire,liveleak.com,http://www.liveleak.com/view?i=f67_1230832702
2009-01-01,17:17:19,7mrmw,8,In Pictures: Massacre of Gazan Children ,allvoices.com,http://www.allvoices.com/contributed-news/2127173-in-pictures-massacre-of-gazan-children/images
2009-01-01,19:32:05,7mryt,8,Israel stifles free press covering Gaza,thestate.com,http://www.thestate.com/world/story/634467.html
2009-01-01,15:10:31,7mrbg,5,New Norway law bans buying of sex ,news.bbc.co.uk,http://news.bbc.co.uk/2/hi/europe/7806760.stm
2009-01-02,00:33:50,7msxq,6,"Israel kills top Hamas figure, escalating campaign",news.yahoo.com,http://news.yahoo.com/s/ap/20090101/ap_on_re_mi_ea/ml_israel_palestinians_236
2009-01-01,08:03:46,7mq4d,5,Extreme seismic conditions return to yellowstone - Could be a big big bang for the new year!,quake.utah.edu,http://www.quake.utah.edu/helicorder/yml_webi_1d.htm
2009-01-02,02:40:37,7mtjy,3,*warning: may contain shocking images* Full Footage of the fire at Bangkok Nightclub Santika,es.youtube.com,http://es.youtube.com/watch?v=E-d7iaM28BE&feature=related
2009-01-01,09:01:54,7mqap,2,Russia prepares to halt gas supplies to Ukraine,uk.reuters.com,http://uk.reuters.com/article/oilRpt/idUKLV40339620081231
2009-01-02,02:24:00,7mth6,1,"Israelis, Hamas continue bombing reddit. Cease-fire demanded.",self.worldnews,https://www.reddit.com/r/worldnews/comments/7mth6/israelis_hamas_continue_bombing_reddit_ceasefire/
2009-01-01,09:36:08,7mqdv,2,Nothing like a fresh Israeli offensive to bring out the Jew in me,scholarsandrogues.com,http://www.scholarsandrogues.com/2008/12/31/nothing-like-a-fresh-israeli-offensive-to-bring-out-the-jewish-in-me/
2009-01-02,05:44:22,7mufb,0,Gaza crisis - Crisis critical with supplies of food and fuel perilously low,oxfam.org,http://www.oxfam.org/en/pressroom/pressrelease/2008-12-31/gaza-crisis-crisis-critical-supplies-food-and-fuel-perilously-low
2009-01-02,00:03:15,7mssi,0,Dozens die in Thailand nightclub fire,bangkokpost.com,http://www.bangkokpost.com/news/local/135674/dozens-die-in-night-club-fire
2009-01-01,14:29:23,7mr6w,0,Vanity Fair: An Oral History of the Bush White House - an amazing collection of interviews,vanityfair.com,http://www.vanityfair.com/politics/features/2009/02/bush-oral-history200902?printable=true&currentPage=all
2009-01-01,17:05:09,7mrlw,0,"Israel Rejects Cease-Fire, but Offers Gaza Aid",nytimes.com,http://www.nytimes.com/2009/01/02/world/middleeast/02mideast.html?ref=middleeast
2009-01-01,12:54:17,7mqwu,1,Bangkok Disco Inferno Kills 59.,reuters.com,http://www.reuters.com/article/newsOne/idUSTRE4BU49F20090101
2009-01-01,18:52:44,7mrvm,0,At least 59 killed in fire at Bangkok nightclub,guardian.co.uk,http://www.guardian.co.uk/world/2009/jan/01/thailand
2009-01-01,10:02:58,7mqgb,0,Fireworks as world welcomes 2009,news.bbc.co.uk,http://news.bbc.co.uk/1/hi/world/7806219.stm
2009-01-02,01:32:39,7mt8b,0,"Yellowstone Updates!  Over 400 Quakes, Still Going Strong!",vorchester.com,http://vorchester.com/phpbb/viewtopic.php?t=114
2009-01-02,00:14:08,7msum,0,Livni to French: No need for humanitarian truce in Gaza - there is no humanitarian crisis ,haaretz.com,http://www.haaretz.com/hasen/spages/1051909.html
