2009-02-11,05:11:19,7wdo1,285,Saudi judge sentences pregnant gang-rape victim to 100 lashes for committing adultery,dailymail.co.uk,http://www.dailymail.co.uk/news/worldnews/article-1141267/Saudi-judge-sentences-pregnant-gang-rape-victim-100-lashes-committing-adultery.html?ITO=1490
2009-02-11,09:09:26,7wfh8,282,"Ukraine: “Give the workers wages, and control of the factory”, “We no longer expect miracles, we’ll take over the factory ourselves” [with Pics]",socialistworld.net,http://www.socialistworld.net/eng/2009/02/1002.html
2009-02-11,12:46:48,7wgsq,217,Drug Found to Block HIV In Monkeys: 83% effective in preventing HIV when taken 24 hours prior to infection.,washingtonpost.com,http://www.washingtonpost.com/wp-dyn/content/article/2009/02/09/AR2009020902473.html
2009-02-11,13:11:45,7wgyl,67,Fascist candidate number 1 edges out Fascist candidate number 2 in Israeli elections,jpost.com,http://www.jpost.com/servlet/Satellite?cid=1233304745268&pagename=JPost%2FJPArticle%2FShowFull
2009-02-12,01:15:39,7wm5x,61,Israel's Enemy Within (PBS Frontline Video),pbs.org,http://www.pbs.org/wgbh/pages/frontline/story/2009/02/israels-enemy-within.html
2009-02-12,07:05:55,7wpb0,53,Dutch MP and anti-Islam filmmaker banned from entering UK,news.bbc.co.uk,http://news.bbc.co.uk/2/hi/uk_news/politics/7882953.stm?lss
2009-02-11,23:55:35,7wlan,47,"Jennifer Figge did NOT swim across the Atlantic! Figge swam only a fraction of the 2,100-mile journey. The rest of the time, she rested on her crew's westward-sailing catamaran.",google.com,http://www.google.com/hostednews/ap/article/ALeqM5gz5onO54L7F9F4caYnDSM9VgYHyAD9693UO82
2009-02-12,03:52:32,7wnnw,48,"US marine convicted of raping Filipina should be detained in a Philippine-run facility, not the US Embassy.",newsinfo.inquirer.net,http://newsinfo.inquirer.net/inquirerheadlines/nation/view/20090212-188827/SC-Smith-should-be-kept-in-local-jail
2009-02-11,18:52:41,7wizw,48,'Toxic' EU bank assets total £16.3 trillion,blogs.telegraph.co.uk,http://blogs.telegraph.co.uk/bruno_waterfield/blog/2009/02/11/toxic_eu_bank_assets_total_163_trillion
2009-02-12,06:29:41,7wp1v,42,WHAT?!?:  Jordanian gets only 6 months in prison for double murder ‘honor killing’,arabnews.com,http://arabnews.com/?page=4&section=0&article=118686&d=30&m=1&y=2009&pix=world.jpg&category=World
2009-02-12,00:53:48,7wlxi,32,Israeli Arab reporters banned from campaign meet of Lieberman's far-right party (Jewish and foreign journalists who had not been invited were allowed to enter and cover the event),haaretz.com,http://www.haaretz.com/hasen/spages/1062998.html
2009-02-11,20:31:00,7wjl8,25,Azerbaijan air force head killed,news.bbc.co.uk,http://news.bbc.co.uk/1/hi/world/europe/7882911.stm
2009-02-11,23:02:10,7wks0,24,Stunning & Depressing Israeli Election,jeffreygoldberg.theatlantic.com,http://jeffreygoldberg.theatlantic.com/archives/2009/02/a_stunning_and_depressing_isra.php
2009-02-11,14:05:58,7whba,27,Iranian mob attacks moderate ex-president Mohammed Khatami on anniversary,timesonline.co.uk,http://www.timesonline.co.uk/tol/news/world/middle_east/article5702625.ece
2009-02-12,00:43:25,7wlt8,21,Clinton Suggests US Could Abandon Europe Missile Defense System,inteldaily.com,http://www.inteldaily.com/news/162/ARTICLE/9678/2009-02-11.html
2009-02-12,01:44:16,7wmgy,20,"Chilli, turmeric, ginger branded 'hazardous' ?",bangkokpost.com,http://www.bangkokpost.com/news/local/11379/farmers-up-in-arms-at-herb-listing
2009-02-11,13:23:24,7wh16,15,Japan Pledges To Halt Production Of Weirdo Porn,theonion.com,http://www.theonion.com/content/news/japan_pledges_to_halt_production?utm_source=onion_rss_daily
2009-02-11,22:52:08,7wkp4,17,India to Launch Cow Urine as Soft Drink ,timesonline.co.uk,http://www.timesonline.co.uk/tol/life_and_style/food_and_drink/article5707554.ece
2009-02-11,14:52:55,7whm3,15,Australian films his home burning,news.bbc.co.uk,http://news.bbc.co.uk/2/hi/asia-pacific/7880324.stm?lss
2009-02-11,18:17:45,7wisk,10,"Pedophile upset that victim's family would ""likely not think kind thoughts"" about him anymore. Awwww, shucks.",news.com.au,"http://www.news.com.au/adelaidenow/story/0,22606,25034341-5006301,00.html"
2009-02-12,02:55:37,7wn5i,9,Nearly half of those polled said that Jews were more loyal to Israel than to their home country. 23% said that their opinion of Jews was influenced by Israel's military and political activities.,haaretz.com,http://www.haaretz.com/hasen/spages/1063092.html
2009-02-11,18:00:39,7wioo,8,'Bush is dead' broadcast in South Africa,news.bbc.co.uk,http://news.bbc.co.uk/2/hi/world/africa/7880832.stm
2009-02-11,10:37:46,7wfyr,9,Wilders denied entrance to UK,windrosehotel.blogspot.com,http://windrosehotel.blogspot.com/2009/02/wilders-denied-entrance-to-uk.html
2009-02-11,21:15:58,7wjxt,10,AP goofs and says woman swam across the Atlantic...she only swam about 250 miles,wesay.com,http://www.wesay.com/Top_Photos/Sports/112200926457318/1/
2009-02-12,06:26:09,7wp13,8,Dutch MP banned from entering UK,news.bbc.co.uk,http://news.bbc.co.uk/2/hi/uk_news/politics/7882953.stm
2009-02-12,05:09:08,7wodd,6,Indian editor and publisher arrested for offending Islam,news.bbc.co.uk,http://news.bbc.co.uk/2/hi/south_asia/7883612.stm
2009-02-11,08:53:10,7wfdg,6,"Former UK Banking Bosses say ""Sorry""",news.bbc.co.uk,http://news.bbc.co.uk/2/hi/business/7880292.stm
2009-02-11,17:31:57,7wiiy,9,Economics 'masking China rights record',news.bbc.co.uk,http://news.bbc.co.uk/2/hi/asia-pacific/7880915.stm
2009-02-12,07:05:47,7wpaz,7,Ancient mummies revealed in Egypt,news.bbc.co.uk,http://news.bbc.co.uk/2/hi/middle_east/7883914.stm
2009-02-11,20:16:26,7wjha,7,At Least 17 Killed in Kabul Suicide Attacks,voanews.com,http://www.voanews.com/english/2009-02-11-voa6.cfm
