2009-08-22,23:36:10,9d3n8,90,Black Site in Lithuania?: CIA Accused of Third Torture Prison in Europe - SPIEGEL ONLINE - News - International,spiegel.de,"http://www.spiegel.de/international/europe/0,1518,644183,00.html"
2009-08-23,00:35:18,9d42p,81,Controversial Mohammed cartoon images omitted from book by Yale ,boston.com,http://www.boston.com/news/local/massachusetts/articles/2009/08/22/mohammed_images_that_stirred_ire_omitted_from_book_by_brandeis_author/
2009-08-22,08:45:19,9cynw,32,It's amazing what people will do for love. A Palestinian woman has braved the threat of Israeli bombs by crawling more than one kilometre through a dangerous underground tunnel between Egypt and Gaza just to marry her sweetheart.,abc.net.au,http://www.abc.net.au/am/content/2009/s2662648.htm
2009-08-22,08:53:21,9cypt,24,South Africa's statutory research body does an academic study that finds Israel is practicing apartheid and colonialism in Occupied Palestinian Territories.,hsrc.ac.za,http://www.hsrc.ac.za/Media_Release-378.phtml
2009-08-22,10:27:33,9cz9e,19,Iranian boy who defied Tehran hardliners tells of prison rape ordeal,timesonline.co.uk,http://www.timesonline.co.uk/tol/news/world/middle_east/article6805885.ece
2009-08-22,17:51:40,9d1sz,11,How can a graph be so very wrong? Predicting population change is tricky.,news.bbc.co.uk,http://news.bbc.co.uk/2/hi/uk_news/magazine/8000402.stm
2009-08-23,06:25:12,9d68i,6,America's Most Wanted -- The Top 50 US War Criminals. These are men and women who helped to launch wars of aggression or who have been complicit in lesser war crimes.  These are the makers of those policies.,informationclearinghouse.info,http://www.informationclearinghouse.info/article23303.htm
2009-08-22,21:32:30,9d2xb,8,"In row over parking space, Cypriot man aims shotgun at thugs but accidentally shoots his wife. He is beaten up as she lay dying. Police charge him with premeditated murder.",cyprus-mail.com,http://www.cyprus-mail.com/news/main.php?id=47404&archive=1
2009-08-23,07:27:08,9d6l4,8,"Rival accuses Karzai of rigging vote - President dismisses charges of cheating, ballot stuffing in election",msnbc.msn.com,http://www.msnbc.msn.com/id/32521363/ns/world_news-south_and_central_asia/
2009-08-22,12:36:27,9czxn,5,"Afghanistan: ""Go tell the world about our fake election .""",afpak.foreignpolicy.com,http://afpak.foreignpolicy.com/posts/2009/08/21/go_tell_the_world_about_our_fake_election
2009-08-23,03:34:26,9d585,5,His alleged crime? Bribery.  A human rights activist calls the case 'bizarre.' ,latimes.com,"http://www.latimes.com/news/nationworld/washingtondc/la-na-rendition22-2009aug22,0,569241.story"
2009-08-22,12:32:58,9czx7,5,"The US army officer convicted for his part in the My Lai massacre during the Vietnam War has offered his first public apology, a US report says",news.bbc.co.uk,http://news.bbc.co.uk/2/hi/asia-pacific/8215556.stm
2009-08-22,08:04:50,9cyf2,3,"John Yettaw, just back from his Burmese prison odyssey, explains how he unwittingly created an international diplomatic crisis",newsweek.com,http://www.newsweek.com/id/213129
2009-08-23,01:38:13,9d4gq,2,"Uganda: Massive Deforestation Fuelling Drought, Famine in Kibaale",allafrica.com,http://allafrica.com/stories/200907200490.html
2009-08-22,14:17:47,9d0jm,0,"Robert Fisk: For the truth, look to Tehran and 
Damascus � not Tripoli ",independent.co.uk,http://www.independent.co.uk/opinion/commentators/fisk/robert-fisk-for-the-truth-look-to-tehran-and-damascus-ndash-not-tripoli-1775813.html
2009-08-22,16:49:39,9d1g2,4,Former spy Herve Jaubert tells of James Bond-style escape after ‘torture threats’,timesonline.co.uk,http://www.timesonline.co.uk/tol/news/world/europe/article6806165.ece#cid=OTC-RSS&attr=797093
2009-08-22,08:39:40,9cyms,2,Facts on world's water shortage,mb.com.ph,http://mb.com.ph/articles/207233/facts-worlds-water-shortage
2009-08-23,05:46:51,9d604,0,"Libyan prisoner release - nothing to do with justice, all about the oil ",riverscrap.typepad.com,http://riverscrap.typepad.com/home/2009/08/what-mercy-for-lockerbie-victims.html
2009-08-22,19:13:28,9d27y,0,"Why on Earth---Can’t I Sell You My Kidney? I mean that of poor Israeli donors (Palestinians) for $150,000, this is how to defend Israelis",objectivistcenter.org,http://www.objectivistcenter.org/cth-43-2215-WOE-kidney.aspx
2009-08-23,05:48:41,9d60q,0,"Signs of Taliban rift hearten Pakistan, U.S.",reuters.com,http://www.reuters.com/article/latestCrisis/idUSLG242603
2009-08-23,07:58:46,9d6r6,0,Uganda People News: Female Genital Mutilation cause for high population growth rate ,ugpulse.com,http://www.ugpulse.com/articles/daily/news.asp?about=FGM+cause+for+high+population+growth+rate+&ID=11094
2009-08-22,08:54:55,9cyqa,0,China puts people before banks; China hasn't allowed its banking sector to become so powerful. China is one economy where there is no disconnect between the financial and normal world.,english.aljazeera.net,http://english.aljazeera.net/focus/chinabuystheworld/2009/08/200981084418740760.html
2009-08-23,04:39:47,9d5mh,0,FBI Director Robert Mueller  rips release of Lockerbie bomber ,msnbc.msn.com,http://www.msnbc.msn.com/id/32520650/ns/world_news-terrorism/
2009-08-23,03:11:33,9d539,0,A little detail from the dustbin of history: The Soviets were Hitler's best friends until he attacked them and they initially took part in WWII on the Axis side.,news.bbc.co.uk,http://news.bbc.co.uk/2/hi/europe/8212451.stm
2009-08-22,19:49:29,9d2ey,0,"So, this is a great opportunity to get rid of a system which has failed humanity, again and again—the monetary system—and to create an affiliation of nations which are each sovereign, as cooperating sovereign bodies, to agree on common goals, and common means, and common ends.",self.worldnews,https://www.reddit.com/r/worldnews/comments/9d2ey/so_this_is_a_great_opportunity_to_get_rid_of_a/
2009-08-22,17:53:01,9d1t9,0,"For the truth about the Lockerbie bombing, look to Tehran and Damascus – not Tripoli",belfasttelegraph.co.uk,http://www.belfasttelegraph.co.uk/opinion/columnists/robert-fisk/robert-fisk-for-the-truth-about-lockerbie-look-to-tehran-and-damascus-ndash-not-tripoli-14463453.html
2009-08-23,02:06:37,9d4nq,1,Af-Pak Masquerade: The Untold Truths of War,uruknet.info,http://www.uruknet.info/?colonna=m&p=57192
2009-08-23,06:15:20,9d66d,0,"My story, by the mistress of Bernard Madoff",entertainment.timesonline.co.uk,http://entertainment.timesonline.co.uk/tol/arts_and_entertainment/books/article6806254.ece#cid=OTC-RSS&attr=797093
2009-08-23,05:11:05,9d5sr,0,Text of FBI Director Robert Mueller's Letter Blasting Release of Lockerbie Bomber,seminal.firedoglake.com,http://seminal.firedoglake.com/diary/7456
2009-08-22,15:10:26,9d0vg,0,Addressing population problem with greater urgency,thefinancialexpress-bd.com,http://www.thefinancialexpress-bd.com/2009/07/14/72912.html
