2009-05-30,21:33:13,8oggh,342,Nazis unwind at Auschwitz. Reminder: Ordinary people were capable of the atrocities there,news.bbc.co.uk,http://news.bbc.co.uk/1/hi/7014750.stm
2009-05-30,14:43:34,8oein,117,"British town of Luton, members of the Muslim community confronted extremists and drove them from the streets.",dailymail.co.uk,http://www.dailymail.co.uk/news/article-1189577/Muslim-extremists-anti-war-protest-driven-members-community.html
2009-05-31,07:31:41,8ojkj,73,Israeli Spy Networks in Lebanon are Falling Apart: A Major Strategic Blow To Israel. ,news.bbc.co.uk,http://news.bbc.co.uk/2/hi/middle_east/8074848.stm
2009-05-30,21:00:23,8ogbl,36,Russia begins destroying Cold War WMDs.  New $1.45-billion facility in Siberia will eliminate huge stockpile of chemical weapons.,msnbc.msn.com,http://www.msnbc.msn.com/id/31011659/
2009-05-31,05:03:49,8oisw,27,Saudi Arabia puts executed man on a cross for display,voiceofthecopts.org,http://voiceofthecopts.org/en/news/saudi_arabia_puts_executed_on_display_as_deterrent.html
2009-05-30,22:39:26,8ogsl,24,Time lapse videos of the Earth impacted by human driven change,wired.com,http://www.wired.com/wiredscience/2009/05/earthobservatoryvideos/
2009-05-30,10:21:19,8od5t,17,"""US slams recent attacks in Iran"", but the group responsible for it has ties to US ...",english.aljazeera.net,http://english.aljazeera.net/news/middleeast/2009/05/2009529154741926133.html
2009-05-30,04:26:22,8ob1w,13,"Despite the fact that half the world menstruates, most people overlook the serious repercussions of a lack of affordable sanitary supplies in developing countries. The reason? Most people don't know that it is a problem.",truthout.org,http://www.truthout.org/031309WA
2009-05-30,21:05:32,8ogc1,9,Russian human rights activist seeks asylum in Finland,mosnews.com,http://mosnews.com/world/2009/05/30/1997/
2009-05-30,09:23:00,8ocwm,12,Now Germany is cracking down on executive pay too,ft.com,http://www.ft.com/cms/s/0/2b08297a-4c57-11de-a6c5-00144feabdc0.html
2009-05-31,00:39:30,8ohf5,10,Pakistan army 'regains' Swat city,news.bbc.co.uk,http://news.bbc.co.uk/2/hi/south_asia/8075136.stm
2009-05-31,02:41:57,8oi45,10,"Hundreds of demonstrators were trussed and tossed into trucks, where 85 died of suffocation",bangkokpost.com,http://www.bangkokpost.com/news/local/17583/court-clears-military-in-tak-bai-case
2009-05-30,17:55:40,8ofhj,12,North Korea believed to be preparing for ICBM launch: source,english.yonhapnews.co.kr,http://english.yonhapnews.co.kr/northkorea/2009/05/30/55/0401000000AEN20090530003500315F.HTML
2009-05-30,18:32:07,8ofnd,10,"""I thought I was helping the state of Israel without harming the United States.",news.bbc.co.uk,http://news.bbc.co.uk/2/hi/americas/8075029.stm
2009-05-30,16:06:11,8oeyh,9,Slumdog stars 'to get new homes',news.bbc.co.uk,http://news.bbc.co.uk/2/hi/entertainment/8074537.stm
2009-05-31,04:51:51,8oiqy,9,Amnesty International Report 2009: Middle East And North Africa (note what it says about Gaza),thereport.amnesty.org,http://thereport.amnesty.org/en/regions/middle-east-north-africa/
2009-05-30,09:18:14,8ocw1,9,North Korea could opt for devastating land assault - ,news.yahoo.com,http://news.yahoo.com/s/ap/us_us_north_korea_military
2009-05-30,18:34:01,8ofno,7,The Wall of sound is going to be quiet for 19 years..,news.bbc.co.uk,http://news.bbc.co.uk/2/hi/entertainment/8074685.stm
2009-05-31,00:36:45,8ohek,5,Iran’s Presidential Elections: The Hard-Liners in a Panic,politicalaffairs.net,http://www.politicalaffairs.net/article/articleview/8586/
2009-05-30,16:43:12,8of5q,5,Iran executes trio for mosque bombing,news.bbc.co.uk,http://news.bbc.co.uk/1/hi/world/middle_east/8074978.stm
2009-05-31,07:33:52,8ojkq,4,Berlusconi Moves to Block Publication of Photos,abcnews.go.com,http://abcnews.go.com/International/wireStory?id=7715252
2009-05-30,23:10:39,8ogxj,4,US 'Dilettantism' in Opel Negotiations?,spiegel.de,"http://www.spiegel.de/international/business/0,1518,627611,00.html"
2009-05-31,03:14:13,8oiac,4,Iran blames US for preelection violence,boston.com,http://www.boston.com/news/world/middleeast/articles/2009/05/30/iran_blames_us_for_preelection_violence/?s_campaign=8315
2009-05-30,13:02:54,8oe09,3,"Malaria vaccine trial begins in Africa on 16,000 people",online.wsj.com,http://online.wsj.com/article/SB124364038701367907.html
2009-05-31,02:18:40,8oi07,6,Video films made by the Taliban in Pakistan's troubled Swat valley show teenage boys being groomed as suicide bombers for revenge attacks against local security forces,telegraph.co.uk,http://www.telegraph.co.uk/news/worldnews/asia/pakistan/5413052/Taliban-recruits-teenage-suicide-bombers-for-revenge-attacks.html
2009-05-30,23:35:56,8oh1l,3,Humanitarian aid and the power of the media,theroadtothehorizon.org,http://www.theroadtothehorizon.org/2009/05/humanitarian-aid-and-power-of-media.html
2009-05-31,07:30:07,8ojkb,3,Pakistan seeks 'hardcore' Taliban,news.bbc.co.uk,http://news.bbc.co.uk/1/hi/world/south_asia/8075574.stm
2009-05-30,12:00:28,8odn9,3,In pictures: China spouse market,news.bbc.co.uk,http://news.bbc.co.uk/1/hi/world/asia-pacific/8063777.stm
2009-05-31,03:00:47,8oi7r,4,"Despite No Links to Violence, Founders of Muslim Charity Sentenced to Lengthy Terms for Donations to Needy Palestinians in Occupied Territories",democracynow.org,http://www.democracynow.org/2009/5/29/holy_land
2009-05-31,00:22:57,8ohbe,1,Top Islamist insurgent commander gunned down in Somalia,news.xinhuanet.com,http://news.xinhuanet.com/english/2009-05/30/content_11457003.htm
