2010-04-19,18:08:05,bszeo,530,Irish Government in secret talks about internet censorship,digitalrights.ie,http://www.digitalrights.ie/2010/04/16/foi-shows-department-of-justice-planning-internet-blocking-for-ireland/
2010-04-20,02:06:04,bt6c0,207,Nick Clegg's rise could lock Rupert Murdoch and the media elite out of UK politics ,guardian.co.uk,http://www.guardian.co.uk/commentisfree/2010/apr/18/clegg-media-elite-murdoch-lib-dem
2010-04-19,19:29:14,bt0ha,162,Millions stolen from Iraq rebuilding: Special task force is analyzing every transaction and person connected to Iraq reconstruction funding in order to hold people accountable,marinecorpstimes.com,http://www.marinecorpstimes.com/news/2010/04/marine_taskforce_041810w/
2010-04-20,02:39:46,bt6vs,116, two girls living in Northern Ireland have been made the subject of a court order to stop them being forced into marriage in Pakistan,news.bbc.co.uk,http://news.bbc.co.uk/2/hi/uk_news/northern_ireland/8629336.stm
2010-04-20,06:03:42,bt9ti,74,Dramatic footage of ash and lightning above Iceland volcano,telegraph.co.uk,http://www.telegraph.co.uk/news/newsvideo/7606277/Dramatic-footage-of-ash-and-lightning-above-Iceland-volcano.html
2010-04-19,23:48:15,bt3zl,69,"Forget Eyjafjallajokull, Mt. Katla Is Now Getting Ready To Rumble",zerohedge.com,http://www.zerohedge.com/article/forget-eyjafjallajokull-mt-katla-now-getting-ready-rumble
2010-04-20,04:35:30,bt8om,60,"$2 billion wind-energy project in Romania, largest in world, 5x larger than Europe's current largest, 3x proposed offshore Massachusetts project",bloomberg.com,http://www.bloomberg.com/apps/news?sid=azdzDOefNdAs&pid=20601087
2010-04-20,01:42:26,bt5xe,53,Iceland volcano causes fall in carbon emissions as eruption grounds aircraft,guardian.co.uk,http://www.guardian.co.uk/environment/2010/apr/19/eyjafjallajokull-volcano-climate-carbon-emissions
2010-04-19,19:21:00,bt0dg,42,Palestinian state certain - Israeli Defence Minister Ehud Barak says Israel must eventually give Palestinians their independence.,news.bbc.co.uk,http://news.bbc.co.uk/2/hi/middle_east/8629158.stm
2010-04-19,22:15:37,bt2lk,47,"Tibetans need your help in the wake of the recent earthquake, over 100,000 are homeless.",raktrul.org,http://raktrul.org/
2010-04-19,03:38:45,bspwg,31,"TOKYO — Thousands of people rallied on a remote Japanese island Sunday, protesting against a possible government move to relocate a major U.S. air base there.",rawstory.com,http://rawstory.com/rs/2010/0418/japanese-islanders-rally-base-plan/
2010-04-19,17:17:33,bsyuw,30,Lesbian couple becomes first same sex couple to sign joint birth certificate,telegraph.co.uk,http://www.telegraph.co.uk/health/healthnews/7604343/Lesbian-couple-becomes-first-same-sex-couple-to-sign-joint-birth-certificate.html
2010-04-19,15:47:16,bsxvo,25,"The Israeli Embassy reopened in Wellington, New Zealand, today, after an eight-year absence. Apparently the relationship was screwed after two reported Mossad agents were caught and jailed for trying to illegally obtain New Zealand passports in 2004, while 2 others escaped.",stuff.co.nz,http://www.stuff.co.nz/national/politics/3598671/Israeli-Embassy-reveals-location-after-opening
2010-04-19,19:06:56,bt04s,23,BBC News - Nick Clegg brands Labour and Conservatives 'desperate',news.bbc.co.uk,http://news.bbc.co.uk/1/hi/uk_politics/election_2010/8629086.stm
2010-04-20,07:19:50,btasm,26,Military Increasingly Convinced of N.Korean Sub Attack,english.chosun.com,http://english.chosun.com/site/data/html_dir/2010/04/19/2010041901342.html
2010-04-20,02:12:38,bt6fv,23,Britain 'handed over prisoners in Afghanistan to be tortured',telegraph.co.uk,http://www.telegraph.co.uk/news/worldnews/asia/afghanistan/7607442/Britain-handed-over-prisoners-in-Afghanistan-to-be-tortured.html
2010-04-20,07:33:29,btayp,21,Saudi poachers boast of killing endangered animals in YouTube video,observers.france24.com,http://observers.france24.com/en/content/20100419-poachers-boast-killing-endangered-specie-youtube-video-saudi-arabia-gazelles
2010-04-19,19:20:48,bt0da,20,"Afghan children are dying: The government told them it was finally safe to come back - even built them a clinic, a school, a playground. But what good's a playground when you have nothing to eat?",foreignpolicy.com,http://www.foreignpolicy.com/articles/2010/04/16/who_needs_a_playground_when_the_children_are_dying_0
2010-04-19,19:33:43,bt0j3,18,"Defense Minister Ehud Barak said there is no reason for a war to break out this summer: Israel must allow the Palestinians to ""rule themselves""",jpost.com,http://www.jpost.com/Israel/Article.aspx?id=173496
2010-04-19,14:20:01,bswqt,17,"Melbourne Gangland killer Carl Williams, beaten to death in prison.",theage.com.au,http://www.theage.com.au/victoria/carl-williams-dies-in-prison-20100419-soab.html?autostart=1
2010-04-20,00:04:47,bt49u,18,"India's unease about strategic power, and its resemblance to a gigantic European Union united only by the English language, reflects its ongoing search for a new international identity. In this quest, India is impaired by its lack of practice in the exercise of power on a grand scale.",guardian.co.uk,http://www.guardian.co.uk/commentisfree/2010/apr/18/india-china-great-power-role
2010-04-20,05:24:07,bt9b4,15,Should Pope Benedict step down? The case against him for collusion in child sex-abuse is much stronger than the case against a number of Irish bishops who have been forced to resign.,socialistworker.org,http://socialistworker.org/2010/04/19/churchs-web-of-deceit
2010-04-19,08:38:12,bsswc,15,"Catholic Church in Worst Credibility Crisis Since Reformation, Theologian Tells Bishops",irishtimes.com,http://www.irishtimes.com/newspaper/opinion/2010/0416/1224268443283.html
2010-04-19,21:50:54,bt28k,12,"The economic impact of the Iceland volcano cloud: ""European countries wouldn't get any growth this year""",news.bbc.co.uk,http://news.bbc.co.uk/2/hi/business/8629623.stm
2010-04-19,13:42:51,bswaa,10,"List of banned news in China, orders from the Ministry of Truth, updated daily [Google Translate]",translate.google.com,http://translate.google.com/translate?u=http://zhenlibu.wordpress.com/&sl=zh-CN&tl=en
2010-04-20,07:12:04,btaoy,13,"Yemeni lawmaker: Banning child marriage unIslamic, part of Western agenda; also ""imagine a young man of 13 or 14 years of age who wants to have sex. … This is a violation of his rights.""",palibandaily.com,http://www.palibandaily.com/2010/04/19/islamic-lawmaker-banning-child-marriage-unislamic-violates-mens-rights/
2010-04-20,07:03:24,btalj,12,N.Korea issues first statement on Cheonan sinking,english.hani.co.kr,http://english.hani.co.kr/arti/english_edition/e_national/416706.html
2010-04-19,13:39:13,bsw8y,10,"Eyjafjallajökull, Gígjökull, Jökulhlaup, Gosmökkur",scientificblogging.com,http://www.scientificblogging.com/chatter_box/eyjafjallaj%C3%B6kull_g%C3%ADgj%C3%B6kull_j%C3%B6kulhlaup_gosm%C3%B6kkur
2010-04-19,19:47:36,bt0pm,8,"Why South Africa's President couldn't stop corruption, even if he wanted to.",da.org.za,http://www.da.org.za/newsroom.htm?action=view-news-item&id=8189
2010-04-19,18:17:54,bszj9,9,IATA furious at 'theoretical' basis for airspace closures ,flightglobal.com,http://www.flightglobal.com/articles/2010/04/19/340760/iata-furious-at-theoretical-basis-for-airspace-closures.html
