2010-04-15,00:17:29,bqtph,506,Australia is Piiiiiiiissed - Arrests Crew Members of Chinese Coal Ship that trashed the Great Barrier Reef,treehugger.com,http://www.treehugger.com/files/2010/04/updated-australia-arrests-crew-members-of-chinese-coal-ship.php?campaign=th_rss&utm_source=feedburner&utm_medium=feed&utm_campaign=Feed%3A+treehuggersite+%28Treehugger%29&utm_content=Google+Reader
2010-04-14,06:07:05,bqgzo,487,"My friend, Aamir, 17, was murdered in Cardiff on Sunday. [news link]",self.worldnews,https://www.reddit.com/r/worldnews/comments/bqgzo/my_friend_aamir_17_was_murdered_in_cardiff_on/
2010-04-14,19:02:49,bqphq,484,Scientists say they have found clear proof that meat from whales captured under Japan's whaling programme is being sold in US and Korean eateries.,news.bbc.co.uk,http://news.bbc.co.uk/2/hi/asia-pacific/8619051.stm
2010-04-14,03:39:47,bqewc,452,"Anti-rape condom ready for SA World Cup - The Rape-aXe, as it is called, is a condom women can insert themselves. The interior has tiny spines which, in case of rape, attach to the man's penis.",rnw.nl,http://www.rnw.nl/english/article/anti-rape-condom-ready-sa-world-cup
2010-04-14,21:47:13,bqran,211,"Israeli settlers attacked a Palestinian village yesterday in the middle of the night.  Mosque was ransacked, 300 olive trees are uprooted (which serve as income for farmers), 2 cars were set ablaze and racist slogans were spray-painted in Hebrew around town.",haaretz.com,http://www.haaretz.com/hasen/spages/1163045.html
2010-04-14,20:11:32,bqq65,144,"Not all sex workers are victims (UK): We are facing not a feminist measure, but an ideology that sees women as unable to be sexually independent and free of their own actions. ",guardian.co.uk,http://www.guardian.co.uk/commentisfree/2010/apr/14/sex-workers-victims-laws-prostitution
2010-04-14,00:24:38,bqbyh,79,Japan annual whale hunt 'halved by activists': Clashes at sea between Sea Shepherd and the whaling ships paralysed the hunt for days ,news.bbc.co.uk,http://news.bbc.co.uk/2/hi/asia-pacific/8616884.stm
2010-04-14,15:28:40,bqn9e,56,6.9-magnitude earthquake hit western China ,google.com,http://www.google.com/hostednews/ukpress/article/ALeqM5gOaOmaK4C1elOpYrB7GPYJcIwoew
2010-04-14,20:32:40,bqqe1,39,A volcano erupts under a glacier in Iceland. Hundreds evacuated.,news.bbc.co.uk,http://news.bbc.co.uk/2/hi/europe/8619628.stm
2010-04-14,08:20:29,bqigo,34,Vatican comment draws gay anger,news.bbc.co.uk,http://news.bbc.co.uk/2/hi/europe/8618878.stm
2010-04-14,09:01:34,bqivn,29,Polish crash site in Russia [Vid],youtube.com,http://www.youtube.com/watch?v=RkEmHSIVDwE&feature=player_embedded
2010-04-14,22:36:30,bqs07,32,Cleric's support for men and women mingling in public sparks furor in Saudi Arabia: Sheikh Ahmed al-Ghamdi recently declared that nothing in Islam bans men and women from mixing in public places like schools and offices.,csmonitor.com,http://www.csmonitor.com/World/Middle-East/2010/0413/Cleric-s-support-for-men-and-women-mingling-in-public-sparks-furor-in-Saudi-Arabia?utm_source=feedburner&utm_medium=feed&utm_campaign=Feed%3A+feeds%2Ftop+%28Christian+Science+Monitor+|+Top+Stories%29
2010-04-15,07:05:26,bqzx7,26,Israel confiscates ALL visiting iPads,theregister.co.uk,http://www.theregister.co.uk/2010/04/14/ipad_banned_in_israel/
2010-04-14,06:14:55,bqh3m,19,Millions of cellphones off-line in Mexico,latimesblogs.latimes.com,http://latimesblogs.latimes.com/laplaza/2010/04/mexico-cell-phones-update.html
2010-04-14,16:45:17,bqo4x,18,‘Terrible earthquake’ kills hundreds in China - 7.1 magnitude quake. At least 300 estimated dead,news.google.com,http://news.google.com/news/more?pz=1&cf=all&ned=us&ncl=dUfe5yMGQz_fm2MK33ctROIcBaU1M&topic=h
2010-04-14,23:07:24,bqshb,16,"Stern, serious, socialist North Korea has carved out a spot in TV history for having one of the world's longest running comedy shows, despite it being mostly devoid of jokes for the decades it has been on the air.",reuters.com,http://www.reuters.com/article/idUSTRE63B4KQ20100412?feedType=RSS&feedName=oddlyEnoughNews&rpc=22&sp=true
2010-04-14,14:00:27,bqm6o,19,"Iraq Vets: Coverage of Atrocities Is Too Little, Too Late",globalresearch.ca,http://www.globalresearch.ca/index.php?context=viewArticle&code=JAM20100413&articleId=18658
2010-04-15,02:11:16,bqvkm,15,Stephen Colbert's surprisingly-frank interview with Wikileaks' Editor/Co-Founder Julian Assange.,colbertnation.com,http://www.colbertnation.com/the-colbert-report-videos/270712/april-12-2010/julian-assange
2010-04-14,09:32:15,bqj63,14,6.9 earthquake near China/India border. Another correct prediction.,reddit.com,http://www.reddit.com/r/worldnews/comments/bmer4/69_earthquake_just_hit_in_mexico/c0no5c4
2010-04-14,22:41:16,bqs36,11,"Islamic extremists threaten Somali radio stations over ""un-Islamic"" music, make most of them broadcast animal, ocean and gunfire noises",edition.cnn.com,http://edition.cnn.com/2010/WORLD/africa/04/13/somalia.radio/index.html
2010-04-14,19:02:20,bqphl,9, row about how to name the Israeli-occupied Palestinian territories has scuppered a 43-nation scheme for managing Mediterranean water resources.,news.bbc.co.uk,http://news.bbc.co.uk/2/hi/europe/8619322.stm
2010-04-15,00:45:35,bqu62,11,A US priest has urged Pope Benedict XVI to step down,presstv.ir,http://www.presstv.ir/detail.aspx?id=123342&sectionid=3510203
2010-04-14,12:47:55,bqlcr,11,Quake kills 67 people in remote Chinese Qinghai region ,news.bbc.co.uk,http://news.bbc.co.uk/2/hi/asia-pacific/8619046.stm
2010-04-14,20:12:44,bqq6d,7,"China shows of its ""Shock and Awe"" Fighter Jets",news.bbc.co.uk,http://news.bbc.co.uk/2/hi/asia-pacific/8617993.stm?ls
2010-04-14,23:13:54,bqskx,8,Vatican reacts to gay abuse claim,news.bbc.co.uk,http://news.bbc.co.uk/2/hi/europe/8620135.stm
2010-04-15,04:17:55,bqxjk,8,Israel's Defense Minister says that Israel won't be pressured into signing the nuclear Non-Proliferation Treaty ,haaretz.com,http://www.haaretz.com/hasen/spages/1163071.html
2010-04-14,23:45:11,bqt4w,7,A Syrian bid to resurrect Aramaic,csmonitor.com,http://www.csmonitor.com/World/Middle-East/2010/0402/Easter-Sunday-A-Syrian-bid-to-resurrect-Aramaic-the-language-of-Jesus-Christ
2010-04-14,14:25:50,bqmhi,6,"22,700 killed in drug violence in Mexico since 2006 This is more than 4 times as much as all coalition's combat and non-combat related deaths in Iraq and Afghanistan since 2001.",breitbart.com,http://www.breitbart.com/article.php?id=D9F2HMOG0&show_article=1
2010-04-14,15:34:18,bqnbm,7,At least 300 people have died and thousands are feared hurt after a magnitude-6.9 earthquake struck China's Qinghai province,news.bbc.co.uk,http://news.bbc.co.uk/1/hi/world/asia-pacific/8619109.stm
2010-04-14,14:59:08,bqmws,7,Withdraw the troops.  These are not the opioids you're looking for.  This is a failed war.  ,moillusions.com,http://www.moillusions.com/wp-content/uploads/2009/11/bsfc4q676v_2_sharbat_gula_450_Natural_Hallucinogen_ish-s450x390-27627-580.gif
