2010-09-25,13:27:25,dimnt,1002,"Russian botanist Nikolai Vavilov created a preserve outside St. Petersburg that contains one of the world’s largest collections of rare seeds and crops. Now, scientists and conservationists are waging an international campaign to save the reserve’s fields from being bulldozed for housing development",e360.yale.edu,http://e360.yale.edu/feature/new_hope_for_pavlovsk_station_and_russias_rare_plant_reserve___/2320/
2010-09-25,08:06:44,dijip,237,7 elephants killed by a train when they ran on the tracks to protect their young.,aolnews.com,http://www.aolnews.com/world/article/7-elephants-killed-in-indian-train-crash/19646995
2010-09-26,00:49:07,dirq0,174,Greetings from North Korea,economist.com,http://www.economist.com/node/17108750
2010-09-26,07:49:47,diw09,137,"Pakistan erupts after US jailing of 'daughter of the nation' Aafia Siddiqui - Thousands take to the streets to protest as scientist convicted of attempting to kill US soldiers gets 86 years
",guardian.co.uk,http://www.guardian.co.uk/world/2010/sep/24/pakistan-aafia-siddiqui-jailed-protests
2010-09-25,09:16:11,dikar,133,First Black Elected Official Defies Racism In Russia ,npr.org,http://www.npr.org/templates/story/story.php?storyId=130102777
2010-09-25,14:52:07,dindj,117,"Father Jailed for 14,400 years for Raping Teenage Daughter ",iwabs.com,http://www.iwabs.com/content/father-jailed-14400-years-raping-teenage-daughter
2010-09-25,08:49:10,dijzu,85,U.K. mulls breaking up big banks. A government probe in Britain is looking at whether some of the country's biggest banks should be broken up. London bureau chief Stephen Beard talks with Steve Chiotakis about whether this plan is really on the table and what other reforms may happen.,marketplace.publicradio.org,http://marketplace.publicradio.org/display/web/2010/09/24/am-uk-mulls-breaking-up-big-banks/
2010-09-26,02:53:01,dit1y,85,Sex Scandal Threatens a Georgia Pastor’s Empire,nytimes.com,http://www.nytimes.com/2010/09/26/us/26pastor.html
2010-09-26,00:51:55,dirr1,78,And the new British Labour party leader is.......Ed Milliband,guardian.co.uk,http://www.guardian.co.uk/politics/2010/sep/25/labourleadership-edmiliband
2010-09-25,08:17:35,dijnb,78,Journalists often have to tell stories about what is broken in the world. So it comes as a nice divergence to tell a story about something that is functioning well. Enhancing food security is seen in Brazil as a basis of all other poverty initiatives. AJE correspondent explains how it works.,blogs.aljazeera.net,http://blogs.aljazeera.net/americas/2010/09/24/combating-hunger-brazilian-way
2010-09-25,04:42:48,dih03,72,"China is on this “treadmill to hell,” he says, because so much of its GDP growth comes from construction which can’t be sustained. If China were to slow down the construction industry, its GDP growth would go negative very quickly.",alternet.org,http://www.alternet.org/world/148284/the_china_superpower_hoax/?page=2
2010-09-25,09:31:38,dikg0,44,Widespread fraud in Afghan elections may spell end of government's legitimacy,nytimes.com,https://www.nytimes.com/2010/09/25/world/asia/25afghan.html
2010-09-25,14:18:19,din33,39,Nine Storey Apartment Built Of Wood in Nine Weeks By Four Workers,treehugger.com,http://www.treehugger.com/files/2010/09/nine-storey-apartment-built-in-nine-weeks-of-wood.php
2010-09-26,07:44:39,divyg,31,"""Iran would consider ending higher level uranium enrichment, the most crucial part of its controversial nuclear activities, if world powers send Tehran nuclear fuel for a medical research reactor""",news.yahoo.com,http://news.yahoo.com/s/ap/20100924/ap_on_re_us/un_un_ahmadinejad
2010-09-26,02:58:51,dit46,28,Japan rejects apology on China boat row.,edition.cnn.com,http://edition.cnn.com/2010/WORLD/asiapcf/09/25/china.japan.apology/index.html?hpt=T1
2010-09-26,00:41:03,dirmz,28,Learning from China: Cuba’s communist leaders set to roll out new capitalist reforms,nytimes.com,http://www.nytimes.com/aponline/2010/09/24/business/global/AP-CB-Cuba-Economy.html
2010-09-25,21:53:47,diqah,23,"What happens when an Australian Muslim cleric calls for the beheading of a Dutch politician?

Not much.",townhall.com,http://townhall.com/columnists/LarryElder/2010/09/23/australian_muslim_cleric_calls_for_beheading_--_who_cares/page/1
2010-09-25,08:56:03,dik33,19,Perceptions of Drug War Mean Mexican Tourist Destinations See Sharp Downturn In Business,alternet.org,http://www.alternet.org/drugs/148267/perceptions_of_drug_war_mean_mexican_tourist_destinations_see_sharp_downturn_in_business
2010-09-26,04:55:24,diubv,16,How slums can save the world,theglobeandmail.com,http://www.theglobeandmail.com/news/national/how-slums-can-save-the-world/article1724246/singlepage/#articlecontent
2010-09-26,03:10:39,dit95,14,US to seek stronger ties with Somali breakaway regions Somaliland and Puntland,bbc.co.uk,http://www.bbc.co.uk/news/world-africa-11410852
2010-09-25,21:43:25,diq76,16,"""The pilot informed our central control here that he was landing in Stockholm,"" he said.

He added the suspect was ""of Pakistani origin.""",abc.net.au,http://www.abc.net.au/news/stories/2010/09/25/3022046.htm
2010-09-25,21:31:55,diq47,14,"Pakistan erupts after US jailing of 'daughter of the nation' Aafia Siddiqui

-  The Guardian",m.guardian.co.uk,http://m.guardian.co.uk/?id=102202&story=http://www.guardian.co.uk/world/2010/sep/24/pakistan-aafia-siddiqui-jailed-protests
2010-09-26,07:51:31,diw0p,11,Afghan Elections - Evidence is mounting that fraud in last weekend’s parliamentary election was so widespread that it could affect the results in a third of provinces,nytimes.com,http://www.nytimes.com/2010/09/25/world/asia/25afghan.html?_r=1
2010-09-25,12:16:22,dim10,14,"163 Nations Stayed to Hear Ahmadinejad, 27 Did Not",veteranstoday.com,http://www.veteranstoday.com/2010/09/24/gordon-duff-what-ahmadinejad-isnt-telling-us/
2010-09-25,23:03:15,diqs9,11,Police arrest passenger after plane makes emergency landing in Sweden ,edition.cnn.com,http://edition.cnn.com/2010/WORLD/asiapcf/09/25/pakistan.canada.flight/index.html?hpt=T2
2010-09-26,04:41:45,diu70,11,India drops the chili bomb. What has added spice to India's diet for centuries may be the next addition to its defense arsenal.,globalpost.com,http://www.globalpost.com/dispatch/india/100902/chili-pepper-military-army-gandhi
2010-09-25,16:44:10,dio96,8,BBC News - Pakistan plane lands in Sweden because of bomb threat,bbc.co.uk,http://www.bbc.co.uk/news/world-europe-11410881
2010-09-25,16:13:54,dio0r,8,Norway's central bank has sued Citigroup for allegedly providing false financial statements,swedishwire.com,http://www.swedishwire.com/nordic/6388-norway-sues-citigroup-after-massive-losses
2010-09-25,18:26:07,diozd,7,Confirmation from inside Iran that the Stuxnet worm has infected their nuclear facilities?,google.com,http://www.google.com/hostednews/ap/article/ALeqM5jam2yTGb8W1t53gQ6S-RbSquSmiAD9IERDI01
2010-09-25,22:17:43,diqg4,5,Yemen regains southern town as 'Qaeda' ambush bus - But residents from nearby areas were quoted by Amnesty International on Wednesday as saying the militants were not Al-Qaeda members.,sg.news.yahoo.com,http://sg.news.yahoo.com/afp/20100925/twl-yemen-unrest-qaeda-4bdc673.html
