2010-05-11,01:18:37,c26h1,663,BBC News - Gordon Brown 'stepping down as Labour leader',news.bbc.co.uk,http://news.bbc.co.uk/1/hi/uk_politics/election_2010/8672859.stm
2010-05-11,09:00:21,c2c9h,235, New Zealand women are regularly getting drunk and cruising around in packs looking for men to have sex with.,stuff.co.nz,http://www.stuff.co.nz/national/295808
2010-05-11,15:42:55,c2gm2,133,Kosovo Albanian mass grave found under car park in Serbia,guardian.co.uk,http://www.guardian.co.uk/world/2010/may/10/kosovo-albanian-mass-grave-serbia
2010-05-12,03:23:19,c2pp2,129,Gordon Brown Resigns As Prime Minister and Labour Leader With Immediate Effect ,news.bbc.co.uk,http://news.bbc.co.uk/1/hi/uk_politics/election_2010/8675913.stm
2010-05-11,22:46:55,c2lf3,81,"If the only metric of success is to kill members of al-Qaeda and the Taliban, then certainly drone attacks have been successful, but if the objective is to win the global war on terror and to defeat the radicalisation agenda in this part of the world then I think there are a lot of questions.""",english.aljazeera.net,http://english.aljazeera.net/news/asia/2010/05/201051181854906102.html
2010-05-11,18:07:56,c2i6w,75,Samsung sues a British columnist for libel over a satirical spoof.,latimes.com,"http://www.latimes.com/news/nationworld/world/asia/la-fg-korea-samsung-20100510,0,5749941.story"
2010-05-11,13:07:29,c2eww,72,Australian smokers get a rude shock with graphic new cigarette packaging policy,globalpost.com,http://www.globalpost.com/dispatch/asia/100508/smoking-australia-law-packaging-tobacco-tax
2010-05-11,22:27:26,c2l5x,69,A Father saving his Son,digitaljournal.com,http://www.digitaljournal.com/article/291819
2010-05-12,00:14:01,c2mow,64,"4 people are missing after a house in Quebec just 
suddenly sank into a 9-metre deep sinkhole. Holy 
shit.",cbc.ca,http://www.cbc.ca/canada/montreal/story/2010/05/11/quebec-landslide.html?ref=rss
2010-05-11,23:12:36,c2ls6,38,"Red Cross confirms 'second jail' at US Bagram airbase, Afghanistan. Former prisoners tell BBC they were held at this secret jail and subjected to abuse. ",news.bbc.co.uk,http://news.bbc.co.uk/2/hi/south_asia/8674179.stm
2010-05-11,15:35:53,c2gj8,33,"S. Korea plays tough, North won’t get free World Cup coverage",joongangdaily.joins.com,http://joongangdaily.joins.com/article/view.asp?aid=2920283
2010-05-12,03:54:02,c2q7p,24,"Birth Defects in Fallujah’s Children. Up to 15 times as many chronic deformities in infants, compared to a year ago. Cases include include a baby born with two heads, babies with multiple tumors, and others with nervous system problem. Still wondering why they hate us?",youtube.com,http://www.youtube.com/watch?v=pXDTLvsAIvY&fmt=10
2010-05-12,05:47:06,c2rv8,23,"Wanted by Interpol: Sigurður Einarsson, former Chairman of Kaupþing, one of the fallen Icelandic banks.",interpol.int,http://www.interpol.int/public/data/wanted/notices/data/2010/68/2010_21468.asp
2010-05-12,02:21:14,c2op8,20,Amateur Video Of Gulf Oil Slick - Damage Appears To Be Much Worse Than BP Admits,liveleak.com,http://www.liveleak.com/view?i=524_1273510578
2010-05-12,07:22:23,c2t0c,20,"Dear BBC, I hope you survive the latest UK government",mydavidcameron.com,http://mydavidcameron.com/posters/bbdo3
2010-05-11,15:23:22,c2ge2,20,China suffers seventh child stabbing attack in a month,telegraph.co.uk,http://www.telegraph.co.uk/news/worldnews/asia/china/7708748/China-suffers-seventh-child-stabbing-attack-in-a-month.html
2010-05-11,23:50:19,c2mc5,14,"""Legal Highs"" now illegal in Ireland.",rte.ie,http://www.rte.ie/news/2010/0511/headshops.html
2010-05-11,15:54:27,c2gqt,10,The accidental hero. How Cornish sailor saved islanders,independent.co.uk,http://www.independent.co.uk/news/world/australasia/the-accidental-hero-ndash-how-cornish-sailor-saved-islanders-1970540.html
2010-05-11,21:42:25,c2kjw,9,Nothing matters except the church's image,trueslant.com,http://trueslant.com/allisonkilkenny/2010/05/11/nothing-matters-except-the-churchs-image/
2010-05-12,05:40:56,c2rs7,9,French parliament condemns full Islamic face veil,news.bbc.co.uk,http://news.bbc.co.uk/2/hi/europe/8676238.stm
2010-05-11,12:04:14,c2e8x,7,"Iraqi insurgents kill 102 in a series of suicide 
bombings from Mosul to Basra in Iraq, the highest 
number in one day this year, and jeopardizing a 
planned US withdrawal.",timesonline.co.uk,http://www.timesonline.co.uk/tol/news/world/iraq/article7122359.ece
2010-05-12,05:59:41,c2s0u,4,Ireland introduces immediate blanket ban on legal highs.,irishtimes.com,http://www.irishtimes.com/newspaper/breaking/2010/0511/breaking41.html
2010-05-12,07:11:34,c2svy,5,Mexico's Army seizes huge drug-cartel weapons cache,wireupdate.com,http://wireupdate.com/wires/4059/mexicos-army-seizes-huge-drug-cartel-weapons-cache-2/
2010-05-12,03:17:07,c2ple,5,Russia says may build nuclear power plant in Syria,reuters.com,http://www.reuters.com/article/idUSTRE64A3JB20100511?feedType=RSS&feedName=worldNews&utm_source=feedburner&utm_medium=feed&utm_campaign=Feed%3A+reuters%2FworldNews+%28News+%2F+US+%2F+International%29
2010-05-11,19:07:08,c2ius,2,"""Television is easy - radio terrifies me"" Sir David Attenborough",news.bbc.co.uk,http://news.bbc.co.uk/2/hi/entertainment_and_arts/10106403.stm
2010-05-11,12:28:19,c2ein,2,"Toronto 18 ringleader pleads guilty. He organized training camps to prepare recruits to storm Canadian Parliament and behead politicians.  At the time of the initial arrests, the families of the accused were outraged and complaining about discrimination and police harassment",thestar.com,http://www.thestar.com/news/gta/crime/article/807202--toronto-18-ringleader-pleads-guilty-in-terror-trial?bn=1
2010-05-12,05:43:27,c2rti,3,"Why the 'Ndrangheta loves Canada, part 1",newenglandorganizedcrime.com,http://newenglandorganizedcrime.com/why-the-ndrangheta-loves-canada-part-1/
2010-05-11,09:20:46,c2chs,1,"Man wearing ""therapy shoes"" mistaken as a potential shoe bomber at an airport in Pakistan",dawn.com,http://www.dawn.com/wps/wcm/connect/dawn-content-library/dawn/news/pakistan/metropolitan/03-man-held-at-karachi-airport-with-therapy-shoes-ss-09
2010-05-11,14:49:36,c2g0f,3,Amateur Video Of Gulf Oil Slick - Worse Than BP Admits May 7 2010,youtube.com,http://www.youtube.com/watch?v=VqWI6HxigjE
2010-05-11,10:39:12,c2dcx,5,It's official! New meme: Incompetent Terrorists,dailymail.co.uk,http://www.dailymail.co.uk/news/worldnews/article-1275952/Pakistani-air-passenger-caught-electronic-circuits-concealed-shoes.html
