2010-04-04,03:40:52,bm2ly,1003,Legal immunity cannot hold. The Vatican should feel the full weight of international law,guardian.co.uk,http://www.guardian.co.uk/commentisfree/libertycentral/2010/apr/02/pope-legal-immunity-international-law
2010-04-04,19:29:38,bm93o,745,"When scandal hits Israel, the Israeli government muzzles the entire press Iran-style.  A reporter is jailed and Israeli press risks being shut down simply for reporting on the story.  The IDF chose to disobey a court order and Israeli law by killing instead of arresting a Palestinian. ",thedailybeast.com,http://www.thedailybeast.com/blogs-and-stories/2010-04-03/israels-free-press-crackdown/?cid=hp:justposted1
2010-04-04,20:23:15,bm9dk,100,"Pure Racism: ""A group of Swedes who were on their way to Israel for a field trip with a peace initiative was stopped at the airport in Tel Aviv on Friday.3 persons with Palestinian background was interrogated for 8 hours before they were rejected - but the 4 with jewish background were admitted.""",translate.google.com,http://translate.google.com/translate?js=y&prev=_t&hl=sv&ie=UTF-8&layout=1&eotf=1&u=http%3A%2F%2Fwww.svd.se%2Fnyheter%2Finrikes%2Ftre-svenskar-avvisade-fran-israel_4519687.svd&sl=sv&tl=en
2010-04-05,05:47:34,bmdsd,43,India buys $7B in Arms from Russia,articles.latimes.com,http://articles.latimes.com/2010/mar/13/world/la-fg-russia-india13-2010mar13
2010-04-04,10:57:37,bm5x6,32,Japan Indicts Anti-Whaling Activist,nytimes.com,http://www.nytimes.com/2010/04/03/world/asia/03japan.html
2010-04-04,09:37:59,bm5ch,35,S. African white supremecist Afrikaans Resistance Movement leader bludgeoned and hacked to death while taking a nap... by his own employees.,rawstory.com,http://rawstory.com/rs/2010/0403/safrica-farright-leader-eugene-terreblanche-murdered-report/
2010-04-04,23:31:53,bmamt,23,"A top member of a South African white supremacist group said Sunday that the slaying of their leader was ""a declaration of war"" by blacks against whites, as the president appealed for calm amid growing racial tensions in the once white-led country.",news.yahoo.com,http://news.yahoo.com/s/ap/20100404/ap_on_re_af/af_south_africa_white_supremacist;_ylt=Avcqf299ryMdfphL.PAmdjSs0NUE;_ylu=X3oDMTQ1MDJkbDUwBGFzc2V0A2FwLzIwMTAwNDA0L2FmX3NvdXRoX2FmcmljYV93aGl0ZV9zdXByZW1hY2lzdARjY29kZQNtb3N0cG9wdWxhcgRjcG9zAzQEcG9zAzEEcHQDaG9tZV9jb2tlBHNlYwN5bl9oZWFkbGluZV9saXN0BHNsawN3aGl0ZXN1cHJlbWE-
2010-04-05,00:06:43,bmaxb,17,"Catholic Cardinal: the Roman Catholic faithful will not be swayed by ""petty gossip"" about child sex-abuse allegations.",news.bbc.co.uk,http://news.bbc.co.uk/2/hi/europe/8602644.stm
2010-04-04,08:01:09,bm4ms,15,North Korea's Kim may have entered China: report ,globalpost.com,http://www.globalpost.com/breaking-news/general/north-koreas-kim-may-have-entered-china-report
2010-04-05,07:06:22,bmeek,14,Pope's Immunity from Prosecution May Be Challenged,rawstory.com,http://rawstory.com/rs/2010/0404/popes-immunity-prosecution-challenged-britain/
2010-04-04,10:53:19,bm5vu,15,"In a gesture of goodwill to UN Secretary-General Ban Ki-moon, Defense Minister Ehud Barak has approved the rare transfer of large amounts of cement, shoes and clothing to the Gaza Strip",jpost.com,http://www.jpost.com/Israel/Article.aspx?id=172385
2010-04-05,07:19:53,bmeih,12,"Hamid Karzai: 'If you and the international community pressure me more, I swear that I am going to join the Taliban'",nytimes.com,http://www.nytimes.com/2010/04/05/world/asia/05karzai.html
2010-04-04,12:18:37,bm6j9,13,Rise of Hungary's far-Right Jobbik party stirs disturbing echoes of the 1940s,telegraph.co.uk,http://www.telegraph.co.uk/news/worldnews/europe/hungary/7549950/Rise-of-Hungarys-far-Right-Jobbik-party-stirs-disturbing-echoes-of-the-1940s.html
2010-04-04,20:57:05,bm9jv,14,Wall of water could engulf Shangri-La,independent.co.uk,http://www.independent.co.uk/news/world/asia/wall-of-water-could-engulf-shangrila-1935434.html
2010-04-04,09:38:22,bm5cl,10,"Now that India's children have a right to receive at least eight years of education, the gnawing question is whether it will remain on paper or become a reality.",beta.thehindu.com,http://beta.thehindu.com/opinion/lead/article381710.ece?homepage=true
2010-04-04,23:07:40,bmafn,10,Death penalty decreasing worldwide,globalpost.com,http://www.globalpost.com/dispatch/worldview/100402/death-penalty-decreasing-trend
2010-04-05,01:46:18,bmbrp,8,Muslims disrupt Antwerp speech by Flemish/Dutch writer Benno Barnard‏,europenews.dk,http://europenews.dk/en/node/31029
2010-04-04,23:38:45,bmapd,7,A Dubai appeals court  on Sunday upheld a one-month prison sentence for a British couple convicted of kissing in a restaurant.,news.yahoo.com,http://news.yahoo.com/s/ap/20100404/ap_on_re_mi_ea/ml_dubai_kissing_case;_ylt=AoM7rlkAAT.6Cuh1GGO.BUar_aF4;_ylu=X3oDMTNhMmQwazJ1BGFzc2V0A2FwLzIwMTAwNDA0L21sX2R1YmFpX2tpc3NpbmdfY2FzZQRjY29kZQNtb3N0cG9wdWxhcgRjcG9zAzQEcG9zAzQEc2VjA3luX3RvcF9zdG9yaWVzBHNsawNkdWJhaWphaWxzZW4-
2010-04-04,20:36:11,bm9g2,6,Three explosions reported in Baghdad,news.blogs.cnn.com,http://news.blogs.cnn.com/2010/04/04/three-explosions-reported-in-baghdad/
2010-04-05,06:56:56,bmec7,6,"senior cardinal has said the Roman Catholic faithful will not be swayed by ""petty gossip"" about child sex-abuse allegations",news.bbc.co.uk,http://news.bbc.co.uk/1/hi/world/europe/8602644.stm
2010-04-05,00:15:52,bmb00,8,"Public editor rebukes International Herald Tribune for agreeing to restrain news coverage of Lee family, paying damages for a single glancing reference. Suggests pulling out of Singapore",nytimes.com,http://www.nytimes.com/2010/04/04/opinion/04pubed.html
2010-04-04,22:12:35,bma0j,6,At least 30 killed as triple car bomb hits Baghdad,timesonline.co.uk,http://www.timesonline.co.uk/tol/news/world/iraq/article7087230.ece
2010-04-05,06:08:00,bmdyd,2,The iPad Gets Jailbreaked In Less Then 24 hours.,appadvice.com,http://appadvice.com/appnn/2010/04/ipad-jailbreaked-day/
2010-04-05,01:34:49,bmbo9,3,Crucifix banned at hospital where Muslims allowed to wear headscarves,dailycaller.com,http://dailycaller.com/2010/03/30/crucifix-banned-at-hospital-where-muslims-allowed-to-wear-headscarves/
2010-04-04,23:43:26,bmaqp,4,Can the Pope be forced to step down? ,france24.com,http://www.france24.com/en/20100404-pope-benedict-paedophilia-scandal-step-down-papl-infallibility-canon-law-catholic
2010-04-05,05:48:39,bmdsq,3,"Chinese rescue effort 6.25% successful as 9 miners are brought to the surface, leaving 144 trapped below.",english.aljazeera.net,http://english.aljazeera.net//news/asia-pacific/2010/04/201044175911138750.html
2010-04-05,01:12:26,bmbhb,1,"Water experts on Tuesday called for greater coordination and sharing of information among Arab countries to tackle the challenge of water scarcity and the threat of climate change.
",zawya.com,http://www.zawya.com/Story.cfm/sidZAWYA20100331044045/Experts%20say%20more%20cooperation%20needed%20to%20face%20water%20crisis
2010-04-04,10:40:21,bm5rx,3,Senegal has inaugurated a massive $27m (£18m) monument - higher than the Statue of Liberty - that has drawn huge criticism over its cost and symbolism,news.bbc.co.uk,http://news.bbc.co.uk/1/hi/world/africa/8601382.stm
2010-04-04,20:11:24,bm9bn,3,"
Terreblanche death brings Zuma appeal for calm
",news.bbc.co.uk,http://news.bbc.co.uk/2/hi/africa/8602512.stm
2010-04-04,20:14:13,bm9c3,2,Teenagers 'find body on egg hunt',news.bbc.co.uk,http://news.bbc.co.uk/1/hi/world/americas/8602346.stm
