2010-09-28,02:38:34,djkxv,827,"Since 2003, over 200,000 people have died as a result of the Darfur conflict (source: United Nations)",edition.cnn.com,http://edition.cnn.com/2008/WORLD/africa/04/22/darfur.holmes/index.html
2010-09-27,10:51:00,dja1m,472,"Israel allowed its halt in construction in Jewish settlements in the occupied West Bank to expire Monday, defying a U.S. call to extend the moratorium and risking a Palestinian withdrawal from peace talks",reuters.com,http://www.reuters.com/article/idUSTRE68O1RJ20100927
2010-09-28,06:12:37,djo8z,226,Why is the world's worst violence ignored? - Congo: 800 times deadlier than the conflict in Israel-Palestine (video),youtube.com,http://www.youtube.com/watch?v=dCzcrF8C94Y
2010-09-27,10:50:12,dja1a,177,Face to face with the world's most repressive regime - London Independent reporter sneaks into N. Korea,independent.co.uk,http://www.independent.co.uk/news/world/asia/face-to-face-with-the-worlds-most-repressive-regime-2090410.html
2010-09-27,02:57:38,dj532,152,"Georgia is replacing Russian with English as the country's second language, two years after a major war with Moscow.",english.aljazeera.net,http://english.aljazeera.net/video/europe/2010/09/201092614516312607.html
2010-09-28,01:18:18,djjmz,114,Barclays bank bricked up by businessman furious at refusal to lend,dailymail.co.uk,http://www.dailymail.co.uk/news/article-1315340/Bournemouth-Barclays-bank-bricked-businessman-furious-refusal-lend.html
2010-09-27,21:20:37,djgak,102,"Nuclear-armed and non-NPT signer, Pakistan gets the chair of UN IAEA board
",reuters.com,http://www.reuters.com/article/idUSTRE68Q1MN20100927
2010-09-27,23:17:39,djhrx,94,"More Media on BBC Special: Secrets of Scientology-Sweeney has returned to investigate the church again. Mr Shouty and Cruise: The Rematch-Three years ago, while making a Panorama programme about Scientology, I made the mistake of exploding in front of the sect’s own cameras. [more]",offdainnertube.blogspot.com,http://offdainnertube.blogspot.com/2010/09/more-media-on-bbc-special-secrets-of.html
2010-09-27,23:38:18,dji3a,86,Chinese police investigate illegal jails 'where complaining citizens are held': Company allegedly charges local authorities fees to prevent provincial petitioners reaching Beijing officials,guardian.co.uk,http://www.guardian.co.uk/world/2010/sep/27/china-police-investigate-illegal-jails
2010-09-28,03:19:28,djlk5,77,The Pirate Bay Appeal Starts Tomorrow ,torrentfreak.com,http://torrentfreak.com/the-pirate-bay-appeal-starts-tomorrow-100927/
2010-09-28,01:54:47,djk8w,74,Kim Jong Un is exactly what North Korea does not need,globalpost.com,http://www.globalpost.com/dispatch/north-korea/100927/kim-jong-il-un-succession
2010-09-27,09:07:54,dj8xt,62,"NATO helicopters entered Pakistan to kill insurgents
| Top News
| Reuters",ca.reuters.com,http://ca.reuters.com/article/topNews/idCATRE68P1RF20100926
2010-09-27,14:29:32,djci4,48,Three Australian soldiers charged with manslaughter over deaths of 5 Afghan children in 2009,smh.com.au,http://www.smh.com.au/national/special-forces-soldiers-charged-with-manslaughter-over-deaths-in-afghanistan-20100927-15t96.html
2010-09-27,13:58:51,djc6l,46,Australia faces worst plague of locusts in 75 years ,independent.co.uk,http://www.independent.co.uk/environment/nature/australia-faces-worst-plague-of-locusts-in-75-years-2089919.html
2010-09-27,23:15:49,djhr0,44,Merkel Admits She Still Tends to Stockpile - Introspection and nostalgia are rife ahead of the 20th anniversary of German reunification -- and  Merkel has joined the trend explaining how her habits still bear the hallmarks of growing up in communist East Germany.,spiegel.de,"http://www.spiegel.de/international/germany/0,1518,719754,00.html"
2010-09-27,17:43:56,djeax,45,"Homeless Bedouin take on the State of Israel: ""This used to be my home. That's my home now,"" he adds, pointing to one of several dozen makeshift wooden structures which villagers have thrown up in wake of the last police action",ipsnews.net,http://www.ipsnews.net/news.asp?idnews=52968
2010-09-28,01:53:42,djk8c,44,"Israel calls for end to UN Gaza investigations - Israel called on Monday for an end to United Nations Human Rights Council investigations into its actions in the 2008-09 Gaza conflict, insisting that the body was ""obsessively biased"" against it.",arabnews.com,http://arabnews.com/middleeast/article148286.ece
2010-09-28,02:59:11,djl9a,32,'Taxation without Representation' - European Union Up in Arms over US Travel Tax,spiegel.de,"http://www.spiegel.de/international/europe/0,1518,719863,00.html#ref=rss"
2010-09-27,10:40:36,dj9xt,33,Why Kofi Annan's envoy to Africa's last colony resigned in protest,tnr.com,http://www.tnr.com/article/world/77562/justice-undone
2010-09-28,06:54:54,djoul,28,"NATO launches airstrikes into Pakistan, 50 dead",wire.antiwar.com,http://wire.antiwar.com/2010/09/27/nato-launches-airstrikes-into-pakistan-50-dead-2/
2010-09-28,00:11:52,djilg,27,"The seismic activity at the base of Bárðarbunga stratovolcano, which also happens to be the highest mountain in Iceland, has picked up materially over the last 48 hours",zerohedge.com,http://www.zerohedge.com/article/iceland-preparing-blow-again
2010-09-27,15:08:36,djcw0,25,China and India: the great game's new players ,guardian.co.uk,http://www.guardian.co.uk/commentisfree/2010/sep/25/china-india-great-game
2010-09-27,09:01:00,dj8um,24,French minister Rachida Dati mixes up oral sex with inflation,google.com,http://www.google.com/hostednews/afp/article/ALeqM5ib2GkdFHL3YCQDRV338gsmbviwMg
2010-09-27,09:01:27,dj8uz,19,"Roads So Bad in Gulu, Uganda that Residents have taken to Planting Cassava in Them as a form of protest",ugandansabroad.org,http://ugandansabroad.org/2010/09/20/roads-so-bad-in-gulu-residents-plant-cassava-and-other-crops-in-them/
2010-09-27,16:07:14,djdho,17,Chavez foes advance in election,bbc.co.uk,http://www.bbc.co.uk/news/world-latin-america-11416238
2010-09-27,18:35:01,djeq6,19,"An Indonesian fisherman caught with about 25 kilograms of shark fins has been fined $16,000 in the Darwin Magistrates Court.",abc.net.au,http://www.abc.net.au/news/stories/2010/09/27/3023227.htm?section=justin
2010-09-27,19:30:04,djf7v,16,"Germany, together with Japan, India and Brazil, has long harbored a desire for a permanent seat on the UN Security Council. Foreign Minister Guido Westerwelle drove home that message in an address to the UN General Assembly on Saturday.",dw-world.de,"http://www.dw-world.de/dw/article/0,,6044827,00.html"
2010-09-27,11:05:50,dja8f,13,Peace talks in peril as Israeli settlement freeze expires ,theglobeandmail.com,http://www.theglobeandmail.com/news/world/africa-mideast/peace-talks-in-peril-as-israeli-settlement-freeze-expires/article1726963/
2010-09-27,22:19:21,djgzq,12,"North Korea's military has nominated the third son of ailing leader Kim Jong-il as a delegate to a rare meeting of the ruling party, a South Korean newspaper said, supporting reports he is his father's chosen successor",reuters.com,http://www.reuters.com/article/idUSTRE68Q0II20100927
2010-09-28,03:12:40,djlgk,11,Colombian senator Piedad Cordoba has been barred from holding public office for having ties to guerrilla group FARC,colombiareports.com,http://colombiareports.com/colombia-news/news/12060-piedad-cordoba-barred-from-public-office.html
