2010-06-17,11:49:12,cfup7,343,"First Australia wanted the ISP Filter, then ISP data retention on net activity... now they want to link it all to our PASSPORTS!!!",gizmodo.com.au,http://www.gizmodo.com.au/2010/06/the-government-now-wants-isps-to-link-your-online-history-with-your-passport/
2010-06-17,19:16:58,cfyh3,72,£1 buys 1000 litres of tap water. Or one bottle.,independent.co.uk,http://www.independent.co.uk/life-style/food-and-drink/news/1631-buys-1000-litres-of-tap-water-or-one-bottle-of-the-ionised-variety-2002650.html
2010-06-17,15:02:03,cfwfj,56,Afghanistan Through Teenagers's Eyes- What happens when you give cameras to a group of Kabul teens.,foreignpolicy.com,"http://www.foreignpolicy.com/articles/2010/06/16/afghanistan_through_teenagers_eyes?page=0,0"
2010-06-18,01:19:53,cg29m,54,"Manhunt for Wikileaks Founder, and Alleged Leaker of Video Showing Iraq Killings Held for 2 Weeks Without Charge",democracynow.org,http://www.democracynow.org/2010/6/17/wikileaks_whistleblowers
2010-06-17,19:18:01,cfyhe,38,Wondering why there are so many empty seats at World Cup games?,independent.co.uk,http://www.independent.co.uk/news/world/africa/seats-to-spare-ndash-but-fifa-wont-let-south-africans-fill-them-2002630.html
2010-06-17,22:44:15,cg0b0,29,"South Korean media says North Korea's Dear Leader -- Kim Jung-Il -- asked China for J-10s fighters during his recent visit there, but was rebuffed.",aviationweek.com,http://www.aviationweek.com/aw/blogs/defense/index.jsp?plckController=Blog&plckBlogPage=BlogViewPost&newspaperUserId=27ec4a53-dcc8-42d0-bd3a-01329aef79a7&plckPostId=Blog%3a27ec4a53-dcc8-42d0-bd3a-01329aef79a7Post%3a299c99d3-034e-4ec9-95d3-a237dfc37998&plckScript=blogScript&plckElementId=blogDest
2010-06-17,23:06:15,cg0jk,30,Chavez set to nationalize the last opposition TV station.,af.reuters.com,http://af.reuters.com/article/worldNews/idAFTRE65G1MR20100617
2010-06-18,02:27:36,cg35t,29,"Iceland Passes WikiLeaks Law - Truthdig Video- The Icelandic parliament has approved protections for journalists, making the island nation perhaps the safest place in the world to afflict the comfortable and speak truth to power.

",truthdig.com,http://www.truthdig.com/eartotheground/item/iceland_passes_wikileaks_law_20100617/
2010-06-17,12:24:53,cfv1b,31,Kyrgyz violence level 'alarming' ,english.aljazeera.net,http://english.aljazeera.net/news/asia/2010/06/20106164631604263.html
2010-06-17,22:10:39,cfzxl,25,"""Something fundamental has changed in China's legal system.""",nielsenhayden.com,http://nielsenhayden.com/makinglight/archives/012404.html
2010-06-17,03:20:05,cfpgi,24,Mexico's deadly drug violence claims hundreds of lives in past 5 days,washingtonpost.com,http://www.washingtonpost.com/wp-dyn/content/article/2010/06/15/AR2010061503174.html?hpid=topnews
2010-06-18,00:47:51,cg1ud,24,British Muslims spit at British troops,timesofindia.indiatimes.com,http://timesofindia.indiatimes.com/world/uk/Muslim-radicals-spit-at-British-troops-draw-ire/articleshow/6057185.cms
2010-06-18,03:43:51,cg45s,22,Turks infuriated over ban on Google sites: Turkish activists have initiated a legal challenge against the government's controversial move to block Google services,setimes.com,http://www.setimes.com/cocoon/setimes/xhtml/en_GB/features/setimes/features/2010/06/15/feature-03
2010-06-18,01:38:43,cg2jg,18,"100,000 Askenazi protesters come out in support of segregated schools",haaretz.com,http://www.haaretz.com/news/national/100-000-protesters-accompany-parents-on-way-to-jail-over-segregated-school-1.296746
2010-06-17,22:55:07,cg0f3,15,Cuba braces to contend with BP oil spill,guardian.co.uk,http://www.guardian.co.uk/world/2010/jun/16/cuba-braces-bp-oil-spill
2010-06-18,02:04:33,cg2vr,14,Turkey to cut 'all ties' with Israel,presstv.com,http://presstv.com/detail.aspx?id=130863&sectionid=351020204
2010-06-17,20:45:22,cfz5d,13,Israeli police have been placed on high alert in view of protests planned by Ultra-Orthodox Jews against a court order to jail parents who refuse to let their daughters attend a religiously integrated school.,english.aljazeera.net,http://english.aljazeera.net/news/middleeast/2010/06/201061774915915706.html
2010-06-17,22:13:05,cfzye,11,More than 160 children have died of lead poisoning in Nigeriain recent weeks [graphic Vid],english.aljazeera.net,http://english.aljazeera.net/news/africa/2010/06/2010617105848420596.html
2010-06-18,06:52:11,cg6bz,12,"KOREA Seoul warns, North has 180,000 soldiers ready for war",asianews.it,"http://www.asianews.it/news-en/Seoul-warns,-North-has-180,000-soldiers-ready-for-war-18707.html"
2010-06-17,13:48:56,cfvs1,11,Deadly flash floods hit southern France,news.bbc.co.uk,http://news.bbc.co.uk/2/hi/europe/10327034.stm
2010-06-17,22:38:04,cg084,12,Israel says it will ease Gaza land blockade,latimes.com,"http://www.latimes.com/news/nationworld/world/la-fgw-israel-gaza-blockade20100617-20100618,0,5510264.story"
2010-06-18,01:23:31,cg2bo,10,"Syria President: ""Israeli flotilla raid increased chances of war and proved that they are another pyromaniac government that you cannot achieve peace with""",news.bbc.co.uk,http://news.bbc.co.uk/2/hi/world/us_and_canada/10337261.stm
2010-06-18,04:49:44,cg4zz,8,African leaders are meeting in Chad to push the idea of planting a tree belt across Africa from Senegal in the west to Djibouti in the east. ,news.bbc.co.uk,http://news.bbc.co.uk/1/hi/world/africa/10344622.stm
2010-06-17,10:03:35,cftog,8,Jews and Turks: Centuries of Goodwill,religionnerd.com,http://religionnerd.com/2010/06/15/jews-and-turks-centuries-of-goodwill/
2010-06-17,11:13:23,cfudd,7,"Syrian President Bashar al-Assad has told the BBC there is no chance of a peace deal with the current Israeli administration, which he called a ""pyromaniac government"". ",news.bbc.co.uk,http://news.bbc.co.uk/2/hi/world/middle_east/10337041.stm
2010-06-17,20:16:34,cfyxt,9,"European leaders are meeting today amid growing fears that Spain, Europe's fifth-largest economy, is preparing to ask for a bailout which would dwarf the €110bn rescue plan for Greece.",independent.co.uk,http://www.independent.co.uk/news/world/europe/spain-the-new-crisis-in-euroland-2002676.html
2010-06-18,02:22:20,cg33m,9,Russian T-50 Jet fighter makes another test flight. Set to outperform the American F-22 Raptor to become best in the world.,english.ruvr.ru,http://english.ruvr.ru/2010/06/17/10042740.html
2010-06-17,22:49:04,cg0ck,9,"America is Dying - ""Dolphins and sharks are showing up in surprisingly shallow water just off the Florida coast. Mullets, crabs, rays and small fish congregate by the thousands off an Alabama pier... A parallel would be: Why are the wildlife running to the edge of a forest on fire?"" ",antemedius.com,http://www.antemedius.com/content/america-dying
2010-06-18,03:03:34,cg3ne,8,The 'Great Green Wall of Africa',news.bbc.co.uk,http://news.bbc.co.uk/2/hi/world/africa/10344622.stm
2010-06-17,22:24:01,cg01y,6,"Kyrgyzstan – an ethnic battleground: It’s about time the West took an interest in Kyrgyzstan, and help it towards democracy.",politiken.dk,http://politiken.dk/newsinenglish/article997342.ece
