2010-08-13,21:21:03,d0qyn,1024,"Experts call for inquest into the death of David Kelly, the British scientist who was found dead after casting doubt on the government's claim that Iraq had weapons of mass destruction",guardian.co.uk,http://www.guardian.co.uk/politics/2010/aug/13/experts-call-david-kelly-inquest
2010-08-13,02:16:38,d0foq,579,"U.S. marijuana legalization could cause a recession in Canada, where pot is the most profitable agricultural product",guardian.co.uk,http://www.guardian.co.uk/commentisfree/cifamerica/2010/aug/05/marijuana-industry-canada
2010-08-13,02:06:19,d0fjd,379,Al Jazeera investigates fraud and corruption in US pharmaceutical industry,youtube.com,http://www.youtube.com/watch?v=1TwdsYVHjGA
2010-08-13,17:15:52,d0p1x,360,A serving officer in the United States Army is removed from the Omar Khadr's jury after informing the court of his belief that the American-run prison camps in Guantánamo Bay ought to be shut down. ,independent.co.uk,http://www.independent.co.uk/news/world/americas/guantanamo-critic-removed-from-jury-2051286.html
2010-08-13,09:20:02,d0kl5,215,"Record speeding fine of £650,000 ($1 011 920,  €789,163 ) given to motorist in Switzerland, the penalty calculated on basis of his income and speed of 300kph (186mph).",guardian.co.uk,http://www.guardian.co.uk/world/2010/aug/12/record-speeding-fine-switzerland
2010-08-13,23:32:14,d0seg,188,"More than 150 Irish artists have announced that they will not perform or exhibit in Israel, or accept any funding from any institutions connected to the Israeli government",irishcentral.com,http://www.irishcentral.com/news/Irish-artists-and-musicians-boycott-Israel-100615039.html
2010-08-14,04:09:14,d0w1s,125,"‎""What does a Jewish-Israeli man have do to with refurbishing a mosque? The answer is simple: I'm sick and tired of the hatred.""",ynetnews.com,"http://www.ynetnews.com/articles/0,7340,L-3907600,00.html"
2010-08-14,05:36:51,d0x3a,75,"Bollywood Superstar Aamir Khan Shines the Spotlight on What's Caused an Estimated 150,000 Farmer Suicides in India",alternet.org,http://www.alternet.org/world/147825/bollywood_superstar_aamir_khan_shines_the_spotlight_on_what%27s_caused_an_estimated_150%2C000_farmer_suicides_in_india?page=entire
2010-08-13,22:35:36,d0rp3,56,"Iran to gain nuclear power as Russia loads fuel into Bushehr reactor. After years of delay, uranium-packed fuel rods for 1,000-megawatt plant will be installed next week",guardian.co.uk,http://www.guardian.co.uk/world/2010/aug/13/iran-nuclear-power-plant-russia
2010-08-14,07:25:27,d0y8g,54,"Phytoplankton bloom off east coast the size of Newfoundland, visible from space",rapidfire.sci.gsfc.nasa.gov,http://rapidfire.sci.gsfc.nasa.gov/gallery/?2010205-0724/AtlanticOcean.A2010205.1435.250m.jpg
2010-08-13,16:00:23,d0ofs,39,"CIA evidence of an Israeli nuclear test
",guardian.co.uk,http://www.guardian.co.uk/world/2010/aug/13/evidence-of-israeli-nuclear-test
2010-08-13,15:02:55,d0ny9,32,"A war on drugs? No, this is a war on the Mexican people",guardian.co.uk,http://www.guardian.co.uk/commentisfree/cifamerica/2010/aug/12/drugs-war-on-mexican-people
2010-08-13,03:49:44,d0gzc,28,"Henry Kissinger believes that containing Iran will depend on showing its leaders that we're willing to go to war. I mean, it worked so well with Iraq, right?",theatlantic.com,http://www.theatlantic.com/magazine/archive/2010/09/living-with-a-nuclear-iran/8193
2010-08-13,23:08:20,d0s3r,30,"UN: Wartime rape no more inevitable, acceptable than mass murder ",cnn.com,http://www.cnn.com/2010/WORLD/africa/08/12/un.wartime.rape/index.html?hpt=T2
2010-08-13,12:52:43,d0moh,23,New findings suggest that stone tools may have been used up to 3.4 million years ago.,nature.com,http://www.nature.com/news/2010/100811/full/news.2010.399.html
2010-08-13,19:02:31,d0pv3,23,Poland: Fresh evidence regarding CIA rendition flights,statewatch.org,http://www.statewatch.org/news/2010/jul/08poland-cia.htm
2010-08-14,06:53:00,d0xx8,23,Strong 7.2 Quake hits the Mariana Islands Region near Guam.,earthquake.usgs.gov,http://earthquake.usgs.gov/earthquakes/recenteqsww/Quakes/us2010zxcf.php
2010-08-14,05:49:23,d0x88,20,Romania says it will stand by Israel in event of conflict with Iran,haaretz.com,http://www.haaretz.com/news/diplomacy-defense/romania-says-it-will-stand-by-israel-in-event-of-conflict-with-iran-1.307614
2010-08-14,01:31:48,d0u2t,21,"Post-USSR Russian Orthodox revival leads to discrimination, bigotry.  Major employer threatens to fire any woman having abortion, any couple not married in Russian Orthodox church by October.",secularnewsdaily.com,http://www.secularnewsdaily.com/2010/08/13/post-ussr-russian-orthodox-revival-leads-to-discrimination-bigotry/
2010-08-13,22:18:15,d0rim,20,Russia Says It Will Begin Fueling Iran Nuclear Plant,npr.org,http://www.npr.org/templates/story/story.php?storyId=129173702&ft=1&f=1001
2010-08-13,10:05:58,d0l25,15,China's government is investigating reports that a brand of powdered milk caused infant girls to grow breasts. ,bbc.co.uk,http://www.bbc.co.uk/news/world-asia-pacific-10955585
2010-08-13,22:24:17,d0rl2,16,"Pakistan flooding: Aid officials note ""the absence of substantial commitments from the Gulf states""",guardian.co.uk,http://www.guardian.co.uk/world/2010/aug/12/pakistan-president-flood-response-criticised
2010-08-14,00:11:12,d0sx7,15,Iran is not going to stone to death adulterous woman. They are going to hang her.,guardian.co.uk,http://www.guardian.co.uk/world/2010/aug/12/iran-stoning-sentences-commuted-ashtiani
2010-08-13,21:16:20,d0qxd,15,Arab students: We're being kept out of TAU dorms because we didn't serve in IDF,haaretz.com,http://www.haaretz.com/print-edition/news/no-place-in-university-dorms-for-arabs-who-didn-t-serve-in-idf-1.307448?localLinksEnabled=false
2010-08-13,23:47:56,d0sml,15,I return to my country because of the racism in France (Via Google Translate),translate.google.fr,http://translate.google.fr/translate?u=http://www.rue89.com/2010/08/13/je-rentre-dans-mon-pays-a-cause-du-climat-raciste-en-france-162089&sl=fr&tl=en&hl=&ie=UTF-8
2010-08-13,23:06:53,d0s2y,15,Fidel Castro is once again an everyday fixture in Cubas as he warns of a coming nuclear war,globalpost.com,http://www.globalpost.com/dispatch/cuba/100812/fidel-castro-raul-birthday
2010-08-13,16:15:20,d0ojr,13,Flood Disaster in Pakistan: Aid Workers Struggle to Reach Victims,spiegel.de,"http://www.spiegel.de/international/world/0,1518,711474,00.html"
2010-08-13,23:12:41,d0s5l,11,"""Omar Khadr’s Military Lawyer Collapses On First Day Of Trial"" (more WTF news from the Guantanamo Bay Show Trials)",allheadlinenews.com,http://www.allheadlinenews.com/articles/7019580562?Omar%20Khadr%E2%80%99s%20Military%20Lawyer%20Collapses%20On%20First%20Day%20Of%20Trial
2010-08-13,19:38:52,d0q4z,13,India wants to ban Google and Skype as well as Blackberry! ,techeye.net,http://www.techeye.net/security/india-takes-aim-at-skype-google-after-rim
2010-08-13,19:07:56,d0pwn,11,Afghanistan: Anti-US protest over civilian killings,english.cntv.cn,http://english.cntv.cn/program/newsupdate/20100813/100946.shtml
