2010-03-04,02:25:46,b8tea,1340,The silent rebellion begins: 2 women refuse full body scanning at Manchester and give up their flight to retain their right to privacy.,news.bbc.co.uk,http://news.bbc.co.uk/2/hi/uk_news/england/manchester/8547416.stm
2010-03-04,21:33:11,b965v,417,Disturbing story of Falluja's birth defects,news.bbc.co.uk,http://news.bbc.co.uk/1/hi/world/middle_east/8548961.stm
2010-03-05,01:59:41,b9a2b,275,Wow... Amazing pics of Colorful India..,boston.com,http://www.boston.com/bigpicture/2010/03/holi_2010.html
2010-03-04,21:58:35,b96he,208,China’s Human-flesh search engines - a form of online vigilante justice in which Internet users hunt down and punish people who have attracted their wrath.,nytimes.com,http://www.nytimes.com/2010/03/07/magazine/07Human-t.html
2010-03-05,01:30:31,b99n2,106,How 12-year-old girl saved her Chilean island from catastrophe,independent.co.uk,http://www.independent.co.uk/news/world/americas/how-12yearold-girl-saved-her-chilean-island-from-catastrophe-1915821.html
2010-03-04,21:36:14,b9674,101,Dutch anti-Islam leader Geert Wilders is major winner in local elections,rnw.nl,http://www.rnw.nl/english/article/dutch-local-elections-results
2010-03-04,20:18:10,b95c1,80,Can I refuse an electronic strip search at an airport without being detained?,guardian.co.uk,http://www.guardian.co.uk/commentisfree/libertycentral/2010/mar/04/airport-body-scanners-privacy
2010-03-04,23:26:11,b97q8,61,Divorced Before Puberty... wtf? ,nytimes.com,http://www.nytimes.com/2010/03/04/opinion/04kristof.html
2010-03-04,21:42:19,b969q,63,A Saudi woman who filed harassment claims in Saudi Arabia without being accompanied by a male relative has been sentenced to 300 lashes and 18 months in jail.,boston.com,http://www.boston.com/news/world/middleeast/articles/2010/03/04/saudi_woman_gets_300_lashes_jail_for_complaints_group_says/
2010-03-05,04:34:45,b9c5u,54,What it means to go to Ben Gurion airport with an Arab friend,mondoweiss.net,http://mondoweiss.net/2010/03/what-it-means-to-go-to-ben-gurion-airport-with-an-arab-friend.html
2010-03-04,10:03:13,b8ywp,42,Earthquake (6.4) hits Taiwan this time,news.yahoo.com,http://news.yahoo.com/s/nm/20100304/wl_nm/us_quake_taiwan
2010-03-05,02:04:34,b9a45,38,North Korean man executed for making cell phone call,thestar.com,http://www.thestar.com/news/world/article/774850--n-korean-man-executed-for-cell-phone-call
2010-03-04,23:22:43,b97nw,39,"Six years ago, there were claims that the U.S. used white phosphorous and depleted uranium in Fallujah.  Today, there's a disturbingly large number of cases of birth defects there.",news.bbc.co.uk,http://news.bbc.co.uk/2/hi/middle_east/8548961.stm
2010-03-04,16:54:58,b93aw,35,Birth defects 'have risen since US Falluja operation',news.bbc.co.uk,http://news.bbc.co.uk/2/hi/middle_east/8548707.stm
2010-03-04,16:06:14,b92t6,33,Bishop asks parishioners for cash to help to pay abuse claims,timesonline.co.uk,http://www.timesonline.co.uk/tol/news/world/europe/article7048747.ece
2010-03-05,05:53:21,b9d78,32,"A US congressional panel has described the killing of Armenians by Turkish forces during World War I as genocide, despite White House objections.",news.bbc.co.uk,http://news.bbc.co.uk/2/hi/americas/8550765.stm
2010-03-05,06:20:27,b9di7,21,"I always felt bad for thinking this was a scam, but it looks like I was right: Millions of Ethiopian famine aid was used to buy weapons ",telegraph.co.uk,http://www.telegraph.co.uk/news/worldnews/africaandindianocean/ethiopia/7359324/Millions-of-Ethiopian-famine-aid-used-to-buy-weapons.html
2010-03-04,09:50:39,b8yri,20,Backlash from Simon Singh libel case puts chiropractors on ropes: One in four chiropractors in Britain are under investigation as a result of campaign by Singh supporters,guardian.co.uk,http://www.guardian.co.uk/science/2010/mar/01/simon-singh-libel-case-chiropractors
2010-03-05,05:43:44,b9d2v,16,US panel: Armenia killings genocide,english.aljazeera.net,http://english.aljazeera.net/news/americas/2010/03/201034205657248619.html
2010-03-05,07:01:52,b9dya,12,Australian woman 'decapitated during freak lawnmower accident',telegraph.co.uk,http://www.telegraph.co.uk/news/worldnews/australiaandthepacific/australia/7358857/Australian-woman-decapitated-during-freak-lawnmower-accident.html
2010-03-05,06:29:13,b9dlu,12,"Armenia killings called 'genocide': 
House panel angers Turkey, Obama by calling 1915 killings 'genocide.'",msnbc.msn.com,http://www.msnbc.msn.com/id/35705977/ns/world_news-europe
2010-03-04,23:45:38,b9807,13,Iceland's economic and political future hangs in the balance as it heads towards a referendum on how to compensate Britain and the Netherlands for money lost in the collapse of an Icelandic bank.,english.aljazeera.net,http://english.aljazeera.net/news/europe/2010/03/20103453322139912.html
2010-03-04,15:44:59,b92m0,11,"Like the harvesting organs scandal Israel will keep denying this until someone from the Government comes clean in the next 10 years, then they will say it was a practice they stopped 10 years ago",rt.com,http://rt.com/Top_News/2010-02-24/ethiopian-women-contraceptive-infertility.html/print
2010-03-05,07:22:00,b9e5a,10,Death toll from Chilean earthquake sharply revised down from 802 to 279.,news.sky.com,http://news.sky.com/skynews/Home/World-News/Chile-Earthquake-Death-Toll-Revised-Down-As-Mourning-Period-Starts-And-Aftershocks-Continue/Article/201003115566803?lpos=World_News_Second_World_News_Article_Teaser_Region_4&lid=ARTICLE_15566803_Chile_Earthquake:_Death_Toll_Revised_Down_As_Mourning_Period_Starts_And_Aftershocks_Continue
2010-03-05,00:38:05,b98up,9,Mexico City sees gay marriage law,news.bbc.co.uk,http://news.bbc.co.uk/go/rss/-/2/hi/americas/8549400.stm
2010-03-04,16:44:28,b936o,8,"First Australia didn't like video games.  Now, it doesn't like real games.  How far is this going to go?",news.bbc.co.uk,http://news.bbc.co.uk/1/hi/world/asia-pacific/8548800.stm
2010-03-05,00:38:13,b98us,9,Somali pirates seize Saudi tanker: official,news.yahoo.com,http://news.yahoo.com/s/afp/20100303/wl_africa_afp/somalipiracyshippingsaudi_20100303112106
2010-03-04,19:59:38,b9556,10,FIFA Weighs What to Do About the Brazilian Paradinha,online.wsj.com,http://online.wsj.com/article/SB10001424052748704548604575097543305084092.html?mod=WSJ_hpp_MIDDLETopStories
2010-03-04,08:04:33,b8xo7,8,Greece Aid Plea Snubbed by Germany in ‘Historic Moment’ for EU,bloomberg.com,http://www.bloomberg.com/apps/news?pid=20601087&sid=aCPneYIYi0Vs&pos=4
2010-03-05,02:51:51,b9asi,6,How a dentist helped disarm Northern Ireland,globalpost.com,http://www.globalpost.com/dispatch/ireland/100225/martin-mcaleese-northern-ireland-peace
