2010-01-26,14:25:02,au7zy,751,France considers banning the burqa,cnn.com,http://www.cnn.com/2010/WORLD/europe/01/25/france.burqa/index.html?hpt=Sbin
2010-01-26,23:23:47,aucub,276,Turkey's prime minister: Israel Commits War Crimes. Israel Response: You are anti-Semite.,washingtonpost.com,http://www.washingtonpost.com/wp-dyn/content/article/2010/01/26/AR2010012600999.html
2010-01-27,00:43:26,audyk,229,"Airline passengers have 'no right' to refuse naked 
body scanners",guardian.co.uk,http://www.guardian.co.uk/uk/2010/jan/26/new-body-scanners-heathrow
2010-01-26,23:57:36,audbb,126,Haiti's head Voodoo priest question Church of Scientology operation,english.aljazeera.net,http://english.aljazeera.net/news/americas/2010/2010/01/201012681754924191.html
2010-01-26,23:47:26,aud5y,107,"My cousin, who says that she is hungry and has been sleeping in bushes with dead bodies nearby, stops me. “Don’t cry,” she says. “That’s life.” “No, it’s not life,” I say. “Or it should not be.” “It is,” she insists. “That’s what it is. And life, like death, lasts only a little while.",newyorker.com,http://www.newyorker.com/talk/comment/2010/02/01/100201taco_talk_danticat
2010-01-26,21:35:30,aubjf,86,"Israel cracks down on NGO workers: Oxfam, Doctors Without Borders, Save the Children lose work permits",guardian.co.uk,http://www.guardian.co.uk/commentisfree/2010/jan/25/israel-visas-ngo-palestine
2010-01-27,02:24:44,aufes,68,"Canada is quickly turning into a police state! Suggesting that a pie in the face is ""terrorism"" is what's intimidating!",cbc.ca,http://www.cbc.ca/canada/newfoundland-labrador/story/2010/01/26/nl-byrne-terrorism-012610.html
2010-01-27,02:17:39,aufb1,62,US Television is reporting riots in Haiti. What they don't tell you is that their own camera crews started the riots.,swampland.blogs.time.com,http://swampland.blogs.time.com/2010/01/24/are-us-tv-crews-killing-haitians/
2010-01-26,21:20:10,aubdm,52,China to jail people who eat dogs or cats,chinadaily.com.cn,http://www.chinadaily.com.cn/china/2010-01/26/content_9379689.htm
2010-01-26,11:39:57,au6ce,38,The Great Australian Internet Blackout,internetblackout.com.au,http://www.internetblackout.com.au/
2010-01-27,01:25:16,auekr,35,"Markus Reinhardt, head of security for the Davos World Economic Forum which starts tomorrow has been found dead of an apparent suicide.",google.com,http://www.google.com/hostednews/ukpress/article/ALeqM5jDRr9c47gOvV0xf2CjT80ZdboSkg
2010-01-26,19:57:27,auanb,28,"Italian official: ""The Americans are extraordinary, but when you are facing a situation in chaos they tend to confuse military intervention with emergency aid, which cannot be entrusted to the armed forces...it was pathetic""",examiner.com,http://www.examiner.com/x-25803-Natural-Disasters-Examiner~y2010m1d25-Italian-official-calls-earthquake-relief-effort-pathetic
2010-01-26,11:39:32,au6c9,25,"Japan 'May Rethink' US Futenma Air Base After Election: Residents of the Japanese city of Nago, on Okinawa, chose a candidate opposed to the hosting of an American air base",commondreams.org,http://www.commondreams.org/headline/2010/01/25-5
2010-01-26,09:14:51,au4qh,23,"Government ordered police to use all means, including force, to prevent demonstrators across Serbia that blocked roads and railway lines. Both police union of Serbia and Independent Union of Police, announced they will not respect this decision and ""will not fight the hungry workers""",revleft.com,http://www.revleft.com/vb/showpost.php?p=1658334&postcount=1
2010-01-27,05:44:05,auhzv,23,Fox News leaves false report on Haiti uncorrected |  Raw Story,rawstory.com,http://rawstory.com/2010/01/fox-false-report-uncorrected/
2010-01-26,23:39:13,aud1i,21,"Britain awaits Blair's Iraq testimony - London police brace for protests outside Chilcot commission.
",globalpost.com,http://www.globalpost.com/dispatch/united-kingdom/100125/tony-blair-testimony-iraq-war-inquiry
2010-01-27,02:42:24,aufng,18,British film-makers uncover Trajan's hidden Roman aqueduct ,independent.co.uk,http://www.independent.co.uk/news/science/archaeology/news/british-filmmakers-uncover-trajans-hidden-roman-aqueduct-1879540.html
2010-01-26,09:36:21,au4z4,17,Venezuela - Thousands of students marched to protest the government's widely criticized suspension of a TV station opposed to President Hugo Chavez.,reuters.com,http://www.reuters.com/article/idUSN2520473020100125
2010-01-26,13:30:48,au7ho,13,A Jew a Muslim and some Christians ,youtube.com,http://www.youtube.com/watch?v=k47O0bRdSDg&feature=quicklist
2010-01-26,22:51:59,aucfk,13,Trying to tame Tokyo's adult playground,latimes.com,"http://www.latimes.com/news/nation-and-world/la-fg-japan-roppongi26-2010jan26,0,5351097.story"
2010-01-27,06:12:50,auibh,13,"Ministry of Justice lists eco-activists alongside 
terrorists",guardian.co.uk,http://www.guardian.co.uk/environment/2010/jan/26/ministry-justice-environmental-campaigners-terrorism
2010-01-26,19:30:19,auafv,9,"Report: Al Qaeda Weapons of Mass Destruction Threat, Hype or Reality?",boston.com,http://www.boston.com/news/world/worldly_boston/2010/01/warning_from_harvard_study_on.html
2010-01-26,22:54:06,aucgi,7,Just received this short press release from Christian Peacemaker Teams in the West Bank; doubt any news sources will pick up on it,self.worldnews,https://www.reddit.com/r/worldnews/comments/aucgi/just_received_this_short_press_release_from/
2010-01-27,04:46:41,auhax,8,"Worst. Plan. Ever?: Britain and Japan have agreed to head an international fund, expected to total up to $500 million over the next five years, as part of a broad plan to help lure Taliban fighters away from the insurgency.",washingtonpost.com,http://www.washingtonpost.com/wp-dyn/content/article/2010/01/25/AR2010012503761.html?hpid=topnews
2010-01-27,03:40:12,augfh,8,The new Miss England is an Iraqi war veteran who received a commendation for bravery when she disarmed an Iraqi insurgent. She is also very beautiful!. How did we end up with a Carrie Prejean,news.bbc.co.uk,http://news.bbc.co.uk/2/hi/uk_news/england/8479893.stm
2010-01-26,14:51:07,au87w,5,Envoys of Tibet's Dalai Lama in new China talks,news.bbc.co.uk,http://news.bbc.co.uk/2/hi/asia-pacific/8480022.stm
2010-01-26,17:14:20,au9dq,6,European consumers purchasing HP-branded computers will have unlimited access to millions of tracks distributed by the four major record companies and leading independent music labels for a monthly fee.,independent.co.uk,http://www.independent.co.uk/news/media/major-record-labels-team-up-with-hp-to-provide-unlimited-music-for-europeans-1879048.html
2010-01-27,07:35:07,auj6b,4,I read the title and doublechecked for theonion.com in my address bar.,thelede.blogs.nytimes.com,http://thelede.blogs.nytimes.com/2010/01/26/travolta-flies-more-scientologists-to-haiti/
2010-01-26,08:52:01,au4h0,3,"Tony Blair nets £200,000 from bank crisis firm",belfasttelegraph.co.uk,http://www.belfasttelegraph.co.uk/news/local-national/tony-blair-nets-pound200000-from-bank-crisis-firm-14651547.html
2010-01-27,06:55:31,auirl,4,John Travolta is bringing much-needed supplies to Haiti. The problem? He's also bringing L. Ron Hubbard,salon.com,http://www.salon.com/mwt/feature/2010/01/26/travolta_scientology_to_haiti/index.html
