2010-04-24,13:36:49,bvet9,1212,"After Comedy Central cut a portion of a South Park episode following a death threat from a radical Muslim group, Seattle cartoonist Molly Norris wanted to counter the fear. She has declared May 20th ""Everybody Draw Mohammed Day.""",mynorthwest.com,http://www.mynorthwest.com/?nid=11&sid=313170
2010-04-25,01:19:52,bvkmm,151,"Consumer waste from the ""Great Pacific Garbage Patch"" is turning a Hawaiian beach ""into plastic"".
They found more plastic particles than sand, as they dug a hole on what has been described as ""the world's dirtiest beach"".",news.bbc.co.uk,http://news.bbc.co.uk/1/hi/world/8639769.stm
2010-04-25,06:58:34,bvnmy,112," Internal Goldman Sachs e-mails released on Capitol Hill Saturday show firm used bets on mortgage securities in a bid to profit as the housing market began to plummet several years ago.
Documents show that Goldman executives knew their bets would profit the firm.",money.cnn.com,http://money.cnn.com/2010/04/24/news/companies/Goldman_Senate_documents/index.htm?hpt=T2
2010-04-25,02:18:39,bvl7k,81,"UK foreign secretary: ""You've punished us enough 
about Iraq"". Go fuck yourself Milliband. ",guardian.co.uk,http://www.guardian.co.uk/politics/2010/apr/23/liberal-democrat-anti-politics-david-miliband#start-of-comments
2010-04-24,15:01:01,bvfio,62,"Reddit, today is the 95th anniversary of the Armenian Genocide.",self.worldnews,https://www.reddit.com/r/worldnews/comments/bvfio/reddit_today_is_the_95th_anniversary_of_the/
2010-04-24,17:47:47,bvgv0,47,Ocean debris turning Hawaiian beach 'in to plastic',news.bbc.co.uk,http://news.bbc.co.uk/2/hi/in_depth/8639769.stm
2010-04-25,01:17:11,bvklh,45,Long-Hated One-Child Rule May Be Eased in China - New Problem? Not Enough Children.,nytimes.com,http://www.nytimes.com/aponline/2010/04/24/world/AP-AS-FEA-China-More-Than-One.html?_r=1
2010-04-24,11:08:37,bvdjc,43,North Korea seizes South-owned resort,csmonitor.com,http://www.csmonitor.com/World/Global-News/2010/0423/North-Korea-seizes-South-owned-resort-as-warship-tensions-grow
2010-04-25,06:04:29,bvn7e,23,Super-rich 'become richer again',news.bbc.co.uk,http://news.bbc.co.uk/1/hi/business/8642021.stm
2010-04-25,03:32:10,bvlxn,21,Mexico: 7 Mexican Police Officers Killed in Ciudad Juarez,nationalterroralert.com,http://www.nationalterroralert.com/updates/2010/04/24/7-mexican-police-officers-killed-in-ciudad-juarez/
2010-04-24,23:29:19,bvjmo,21,"  Three's A Crowd - 
Historian evokes parallels from 1920s, offers shrewd advice to Nick Clegg: LibDems should refuse alliance with new Labour, present themselves as heirs to libertarian strain in old Labour
",independent.co.uk,http://www.independent.co.uk/news/uk/politics/threes-a-crowd-how-the-unexpected-rise-of-a-third-contender-broke-the-cosy-twoparty-system-1951707.html
2010-04-24,18:06:49,bvgzz,23,Haitians are quitting their jobs and leaving their homes to join tent cities where everything is free. The Haitian government says the aid is ruining the economy and wants it stopped.,cofcc.org,http://cofcc.org/2010/04/haitian-government-to-the-west-please-stop-feeding-the-natives/
2010-04-24,09:26:05,bvcom,22,Israeli Prime Minister Binyamin Netanyahu Rejects U.S. Plea To Stop Illegal Settlements,allheadlinenews.com,http://www.allheadlinenews.com/articles/7018490713
2010-04-25,04:06:46,bvm94,18,N.Korea Announces Seizure of S.Korean Properties,english.chosun.com,http://english.chosun.com/site/data/html_dir/2010/04/24/2010042400382.html
2010-04-25,00:12:02,bvk0a,16,Deadly New Fungus Emerging in Oregon Expected to Spread ,livescience.com,http://www.livescience.com/health/deadly-new-fungus-oregon-100422.html?utm_source=feedburner&utm_medium=feed&utm_campaign=Feed%3A+Livesciencecom+%28LiveScience.com+Science+Headline+Feed%29
2010-04-25,05:56:08,bvn4w,20,How geography and old empires shape today’s Europe,nytimes.com,http://www.nytimes.com/2010/04/25/opinion/25kaplan.html?pagewanted=print
2010-04-24,03:09:31,bv8kk,17,"The bishop of the Belgian city of Bruges, Roger Vangheluwe, has resigned after admitting sexual abuse of a boy earlier in his career.",news.bbc.co.uk,http://news.bbc.co.uk/1/hi/world/europe/8639253.stm
2010-04-24,14:13:51,bvf3w,17,Chinese Military Seeks to Extend Its Naval Power,nytimes.com,http://www.nytimes.com/2010/04/24/world/asia/24navy.html?ref=global-home
2010-04-24,11:22:45,bvdn6,15,"In Nigeria's conservative Islamic north, women are barred from ruling, except in the kingdom of Kumbwada. Here, an ancient curse keeps males off the throne, according to locals. Male pretenders who dare to try will be buried within a week. ",articles.latimes.com,http://articles.latimes.com/2010/apr/06/world/la-fg-nigeria-queen6-2010apr06
2010-04-25,04:21:07,bvmde,13,"Only in Saudi Arabia, could assault, abuse, and defamation be called examples of ""bloopers."" God Bless the Kingdom. ",saudiwoman.wordpress.com,http://saudiwoman.wordpress.com/2010/04/10/some-people-never-change/
2010-04-25,07:50:35,bvo11,11,Venezuela requests banker's extradition from US,finance.yahoo.com,http://finance.yahoo.com/news/Venezuela-requests-bankers-apf-3422789158.html?x=0&.v=1
2010-04-24,13:16:20,bvems,12,The man who filmed a video that appeared to depict gunshots being fired in the immediate aftermath of the Polish plane crash has apparently been stabbed to death in what many are claiming was a deliberate assassination to silence the individual from making public whatever it was he saw.,disinfo.com,http://www.disinfo.com/2010/04/claim-man-who-shot-polish-plane-crash-%e2%80%9cgunshots%e2%80%9d-footage-stabbed-to-death/
2010-04-24,18:54:10,bvhc2,10,German Soldiers in Afghanistan Wear Protest on Their Sleeve,defensetech.org,http://defensetech.org/2010/04/23/german-soldiers-in-afghanistan-wear-their-protest-on-their-sleeve/
2010-04-25,07:55:07,bvo26,11,Greece Welcomes Its New IMF Overlords With Day Of Rioting And National Strikes,zerohedge.com,http://www.zerohedge.com/article/greece-welcomes-its-new-imf-overlords-day-rioting-and-national-strikes
2010-04-24,22:14:06,bvix1,12,South Korea raises bow of sunken warship (must be a giant crane!),news.bbc.co.uk,http://news.bbc.co.uk/1/hi/world/asia-pacific/8641468.stm
2010-04-25,05:40:25,bvn04,8,120000 People protest against nuclear power plants in North Germany,businessweek.com,http://www.businessweek.com/ap/financialnews/D9F9FN400.htm
2010-04-24,23:01:53,bvjdn,11,Rwandan perpetrators living in Europe scot-free,nrc.nl,http://www.nrc.nl/international/article2531537.ece/Rwandan_perpetrators_living_in_Europe_scot-free
2010-04-24,22:25:32,bvj0y,9,Wall St regulators spent hours watching porn...,timesonline.co.uk,http://www.timesonline.co.uk/tol/news/world/us_and_americas/article7106889.ece
2010-04-24,16:08:29,bvg35,10,Afghan ‘Exit Strategy’ Won’t Involve Removing Any Troops,news.antiwar.com,http://news.antiwar.com/2010/04/23/afghan-exit-strategy-wont-involve-removing-any-troops/
2010-04-24,21:38:58,bvilt,8,No Where to Hide: Fears of Arrest and Prosecution by Tony Blair on Charges of War Crimes,globalresearch.ca,http://www.globalresearch.ca/index.php?context=viewArticle&code=CHA20100424&articleId=18835
