2010-06-11,15:52:53,cdujd,742,Abby Sutherland FOUND alive and well. 16 year old sailor found.,msnbc.msn.com,http://www.msnbc.msn.com/id/37621453/ns/us_news/
2010-06-11,06:13:29,cdpb1,308,Video shows the border patrol agent shot the teenager 3 times in Mexico territory....,univision.com,http://www.univision.com/content/videoplayer.jhtml?cid=2433072
2010-06-11,00:38:43,cdksm,294,A moving article on the daily lives of North Koreans.  NYTimes,nytimes.com,http://www.nytimes.com/2010/06/10/world/asia/10koreans.html?pagewanted=all
2010-06-11,03:53:56,cdngv,198,"""Simply put: There was no Twitter Revolution inside Iran.""",foreignpolicy.com,http://www.foreignpolicy.com/articles/2010/06/07/the_twitter_revolution_that_wasnt
2010-06-11,04:56:07,cdob3,184,Video of Israeli commandos executing American,juancole.com,http://www.juancole.com/
2010-06-11,07:53:49,cdqca,36,The company operating the Deepwater Horizon will shortly pay out a total of $1 Billion in dividends to share holders. That company is US company Transocean. ,self.worldnews,https://www.reddit.com/r/worldnews/comments/cdqca/the_company_operating_the_deepwater_horizon_will/
2010-06-12,04:08:38,ce1rm,28,"Pining for a Soviet Paradise - Back in June 1990, I never would have thought that on the eve of the 20th anniversary of the Declaration of State Sovereignty I would witness crowds of people — including young people — eulogizing the Soviet Union and shedding tears over the “fall of a great power.”",themoscowtimes.com,http://www.themoscowtimes.com/opinion/article/pining-for-a-soviet-paradise/407976.html
2010-06-11,19:37:37,cdw8j,23,Gaza flotilla captain: Activists prepared attack against IDF raid - Haaretz,haaretz.com,http://www.haaretz.com/news/diplomacy-defense/gaza-flotilla-captain-activists-prepared-attack-against-idf-raid-1.295591
2010-06-11,11:01:22,cds26,18,"North Korea shows that, in the right circumstances, people will strive under any hardship, tolerate any government lie. ",nytimes.com,http://www.nytimes.com/2010/06/10/world/asia/10koreans.html?src=me&ref=general
2010-06-12,01:20:42,cdzoc,20,Japan's financial collapse is next: Japan PM Naoto Kan warns of 'collapse' under debt pile,news.bbc.co.uk,http://news.bbc.co.uk/2/hi/business/10290933.stm
2010-06-12,02:22:14,ce0h6,23,Pope begs forgiveness for institutional child abuse - world dubious.,news.yahoo.com,http://news.yahoo.com/s/ap/20100611/ap_on_re_eu/eu_vatican_priests
2010-06-12,01:44:37,cdzz7,19,"It's Official: There was No Humanitarian Aid on Mavi Marmara (300 wheelchairs, 300 new mobility scooters, 100 special mobility scooters for the disabled, Hundreds of crutches, 250 hospital beds, Four tons of medicine...) ",israelnationalnews.com,http://www.israelnationalnews.com/News/News.aspx/137997
2010-06-11,11:16:03,cds72,21,Spain seeks EU backing on plan to lift Israeli blockade of Gaza,guardian.co.uk,http://www.guardian.co.uk/world/2010/jun/10/spain-proposals-end-gaza-blockade
2010-06-11,14:24:01,cdts8,18,Looks like we might have to worry more about the effect of Corexit 9500 then the effect of oil on our environment.,sfgate.com,http://www.sfgate.com/cgi-bin/blogs/ybenjamin/detail?%3Fblogid=150&entry_id=65552
2010-06-11,23:58:09,cdyqu,16,Gaza Fishermen Under Siege,vimeo.com,http://vimeo.com/8724223
2010-06-12,00:52:55,cdzcj,14,"UK PM Cameron: No more troops for Afghanistan - British Prime Minister David Cameron on Thursday ruled out sending more troops to Afghanistan, saying Britain's forces should not stay on ""for a day longer"" than necessary.
      
    
	- Arab News",arabnews.com,http://arabnews.com/world/article64070.ece
2010-06-11,09:24:31,cdr8j,12,WTF! Countries have no longer the right to self-defense: The US and Israel are concerned the S-300 missiles might be used to PROTECT Iran's nuclear facilities from possible attack.,news.bbc.co.uk,http://news.bbc.co.uk/2/hi/world/middle_east/10289554.stm
2010-06-12,03:13:44,ce14b,12,IDF-hired driver: 'Why did they kill so few?' - Driver hired by IDF to transport soldiers posts sign on font of bus criticizing commandos who took part in Gaza flotilla takeover for small number of casualties.,ynetnews.com,"http://www.ynetnews.com/articles/0,7340,L-3903747,00.html"
2010-06-11,14:08:05,cdtng,12,Australian billionaires take to the streets for tax protest,independent.co.uk,http://www.independent.co.uk/news/world/australasia/australian-billionaires-take-to-the-streets-for-tax-protest-1997284.html
2010-06-11,08:02:18,cdqfk,12,Bloody Sunday in Northern Ireland killings to be ruled unlawful,guardian.co.uk,http://www.guardian.co.uk/uk/2010/jun/10/bloody-sunday-inquiry-northern-ireland?i=loc
2010-06-11,11:57:34,cdskq,10,Australian government considering retaining everyone's browsing history for up to ten years,zdnet.com.au,http://www.zdnet.com.au/govt-wants-isps-to-record-browsing-history-339303785.htm
2010-06-11,11:24:58,cds9y,9,Another person being charged with Holocaust denial. ,commondreams.org,http://www.commondreams.org/headline/2010/06/04-3
2010-06-11,22:17:28,cdxma,8,First amateur images of Osh riots in Kyrgyzstan,observers.france24.com,http://observers.france24.com/en/content/20100611-osh-flames-first-amateur-images-kyrgyzstan-ethnic-violence-riots
2010-06-11,18:18:54,cdvnx,7,U.S. Fury at BP Stirs Backlash Among British,dealbook.blogs.nytimes.com,http://dealbook.blogs.nytimes.com/2010/06/11/u-s-fury-at-bp-stirs-backlash-among-british/
2010-06-11,23:22:58,cdyd8,7,The 50 Year War: Aussies could be in Afghanistan 'until 2040' - A former high-ranking United States defence official says Australian troops could be in Afghanistan for the next 30 years.,abc.net.au,http://www.abc.net.au/news/stories/2010/06/10/2923407.htm
2010-06-11,11:12:52,cds5w,7,IAEA board focuses on Israeli 'nukes',presstv.ir,http://www.presstv.ir/detail.aspx?id=129905&sectionid=351020202
2010-06-12,07:39:30,ce3t5,7,Are growing tensions in Slovakia creating the conditions for another European conflict? ,youtube.com,http://www.youtube.com/watch?v=QvGClhF-sYo
2010-06-11,09:00:28,cdr02,6,Australian tourist fined 1000 Euros after offering 7 Euros for a fake Louis Vuitton bag in Italy,smh.com.au,http://www.smh.com.au/world/strangebuttrue/fined-1450-for-buying-a-10-fake-louis-vuitton-bag-in-italy-20100609-xu4h.html
2010-06-11,09:57:44,cdrj2,5,Radiohead frontman Thom Yorke is warning the music industry is on the brink of collapse,infowars.com,http://www.infowars.com/music-industry-on-verge-of-total-collapse/
2010-06-12,01:09:13,cdzk1,7,"Drug War Carnage: Four severed heads found in Guatemala City - Messages to the interior minister and the director of prisons were pinned to them, leading police to blame drug gangs for the killings.",news.bbc.co.uk,http://news.bbc.co.uk/2/hi/world/latin_america/10290246.stm
