2010-06-05,00:41:41,cbgbd,847,"An Irish aid ship is headed to Gaza. A Nobel Peace 
Prize laureate and a former-United Nations official 
are among the 11 passengers. Prime Minister 
Benjamin Netanyahu said Israel will not allow the 
aid ship to reach Gaza.",google.com,http://www.google.com/hostednews/ap/article/ALeqM5ju3AAe6-3hF9Nlvh3Df8Ux_CPJzAD9G4F1M00
2010-06-05,07:27:49,cblby,506,"“a 60-year-old man…was shot four times in the temple, chest, hip and back. A 19-year-old…was shot five times from less that 45cm, in the face, in the back of the head, twice in the leg and once in the back…and five of the victims were shot either in the back of the head or in the back” The Guardian",guardian.co.uk,http://www.guardian.co.uk/world/2010/jun/04/gaza-flotilla-activists-autopsy-results
2010-06-05,15:58:37,cbp2e,439,"Israeli navy intercepts Irish aid ship, jams all radar and cuts all communication prior to boarding.",news.xinhuanet.com,http://news.xinhuanet.com/english2010/world/2010-06/05/c_13334649.htm
2010-06-05,04:18:50,cbj5q,334,Fifa blocking condom distribution at World Cup venues: because encouraging safe sex in a country with the highest number of HIV carriers is just stupid,guardian.co.uk,http://www.guardian.co.uk/world/2010/jun/04/condoms-banned-world-cup
2010-06-05,13:28:55,cbo01,305,Israeli navy 'intercepts' Rachel Corrie Gaza aid ship,news.bbc.co.uk,http://news.bbc.co.uk/2/hi/world/middle_east/10244301.stm
2010-06-05,20:13:07,cbqhv,210,Experience: I run a brothel in a country village .,guardian.co.uk,http://www.guardian.co.uk/lifeandstyle/2010/jun/05/brothel-in-country-village-experience
2010-06-06,00:29:31,cbs5k,176,"The Gaza Blockade Is Illegal and the Flotilla Attack Was an Illegal Act of War - ""Gaza is not an independent state at war with Israel. Gaza is occupied by Israel, and, as such, an entirely different set of international laws apply.""",alternet.org,http://www.alternet.org/story/147115/the_gaza_blockade_is_illegal_and_the_flotilla_attack_was_an_illegal_act_of_war?page=entire
2010-06-05,21:44:12,cbr1g,150,"Photographer tries to take pic of controversial building site in Latvia. He's chased away. Using Twitter, a flash mob returns three days later and...",wesay.com,http://www.wesay.com/Top_Photos/News/46201061248735/
2010-06-05,08:33:29,cblvm,100,"The other side of the Gaza blockade - Taysir Al Burai is severely disabled. He requires round-the-clock medical care. If he were allowed to leave Gaza, he could make a full recovery. But Israel won't let him",independent.co.uk,http://www.independent.co.uk/news/world/middle-east/the-other-side-of-the-gaza-blockade-1992076.html
2010-06-05,13:15:09,cbnw2,76,Gaza flotilla: Aussie accent is a surreal sound amid chaos of raid,smh.com.au,http://www.smh.com.au/world/aussie-accent-is-a-surreal-sound-amid-chaos-of-raid-20100604-xkmr.html
2010-06-05,15:30:42,cbouw,39,Report: Israel Willing To Allow Gaza Aid Shipments With International Inspections,crooksandliars.com,http://crooksandliars.com/susie-madrak/report-israel-willing-allow-gaza-aid
2010-06-05,15:35:24,cbow5,38,"IDF Releases Apparently Doctored Flotilla Audio, Press Reports As Fact",maxblumenthal.com,http://maxblumenthal.com/2010/06/idf-releases-apparently-doctored-audio-press-reports-as-fact/
2010-06-05,15:46:18,cboz8,34,"Noam Chomsky lectures on Israel, Palestine and US policy @ Brown University",youtube.com,http://www.youtube.com/watch?v=UdfzC5NNAew#t=2m0s
2010-06-06,03:42:47,cbtjf,29,"Millions of documents stored at the World War II code-breaking centre, Bletchley Park, are set to be digitised and made available online.",news.bbc.co.uk,http://news.bbc.co.uk/1/hi/uk/10239623.stm
2010-06-05,16:04:41,cbp40,28,UFO spotted over eastern Australia. Similar to one seen in Norway,abc.net.au,http://www.abc.net.au/news/stories/2010/06/05/2919095.htm
2010-06-06,01:05:11,cbsex,27,"Days before the first anniversary of the antigovernment protests that rocked Iran, the nation’s supreme religious leader, Ayatollah Ali Khamenei, renewed his attack on opposition leaders on Friday, saying that they had betrayed the values of the 1979 Islamic Revolution.",nytimes.com,http://www.nytimes.com/2010/06/05/world/middleeast/05iran.html?ref=world
2010-06-05,18:40:37,cbpzj,22,BREAKING: The crew of the Rachel Corrie has permitted IDF soldiers to board,self.worldnews,https://www.reddit.com/r/worldnews/comments/cbpzj/breaking_the_crew_of_the_rachel_corrie_has/
2010-06-05,15:57:02,cbp1x,26,"Haaretz opinion: Turkey is not an enemy, should seek to rebuild ties; calls for political courage to lift Gaza blockade",haaretz.com,http://www.haaretz.com/opinion/turkey-is-not-an-enemy-1.294203
2010-06-05,08:43:28,cbly8,24,Israel issues last minute appeal to Rachel Corrie to stop.,independent.co.uk,http://www.independent.co.uk/news/world/middle-east/israel-warns-gazabound-rachel-corrie-to-stop-1992079.html
2010-06-05,13:08:03,cbntw,19,Israeli navy 'intercept' Rachel Corrie Gaza aid ship,news.bbc.co.uk,http://news.bbc.co.uk/2/hi/middle_east/10244301.stm
2010-06-05,21:08:08,cbqu1,16,"Sweden, Norway Act Against Israel",online.wsj.com,http://online.wsj.com/article/SB10001424052748704183204575288222251185504.html
2010-06-06,05:29:26,cbuan,13,China: Journalists and netizens held for referring to 1989 Tiananmen massacre,en.rsf.org,"http://en.rsf.org/china-free-journalists-and-netizens-held-03-06-2010,37659.html"
2010-06-06,04:57:03,cbu2z,13,It should be noted that Hamas has refused to allow any of the aid carried by the other six flotilla ships into the Gaza Strip thus far. Five days have passed since trucks were loaded with cargo and were ready to enter Gaza.,idfspokesperson.com,http://idfspokesperson.com/2010/06/05/ship-attempting-to-break-maritime-closure-of-gaza-strip-boarded-by-israel-naval-forces-with-compliance-of-crew-5-june-2010/
2010-06-05,22:20:40,cbrac,13,Defector's Evidence Indicates Myanmar Has Nuke Program,gsn.nti.org,http://gsn.nti.org/gsn/nw_20100604_5280.php
2010-06-05,18:11:39,cbptx,13,"Fijian dictator: promised return to democracy is unnecessary, the people ""don't want an election""",rnzi.com,http://www.rnzi.com/pages/news.php?op=read&id=53975
2010-06-05,22:11:02,cbr7w,12,WHO swine flu experts 'linked' with drug companies,news.bbc.co.uk,http://news.bbc.co.uk/2/hi/health/10235558.stm
2010-06-05,08:40:39,cblxg,13,Robert Fisk: The truth behind the Israeli propaganda - How dare those terrorists dare to touch our unarmed vessels on the high seas? And how right we are to have our warships there to prevent such terrorist acts.,independent.co.uk,http://www.independent.co.uk/opinion/commentators/fisk/robert-fisk-the-truth-behind-the-israeli-propaganda-1991803.html
2010-06-06,04:19:58,cbtte,11,"Ireland Condemns Today's Israeli Raid on the New Aid Boat, the Rachel Corrie, as ""Completely unacceptable Use of Force""",juancole.com,http://www.juancole.com/2010/06/ireland-condemns-israeli-raid-on-rachel-corrie-completely-unacceptable-use-of-force.html
2010-06-05,16:04:01,cbp3s,11,Israel's Gaza blockade strategy: topple Hamas by immiserating the people who elected them,theatlantic.com,http://www.theatlantic.com/international/archive/2010/06/what-is-israels-blockade-for/57574/
2010-06-06,04:27:48,cbtv8,10,Egypt's supreme court has upheld a decision to strip citizenship from Egyptian men who wed Israeli women if the marriage poses a threat to national security.,english.aljazeera.net,http://english.aljazeera.net/news/middleeast/2010/06/201065162218512205.html
