2010-08-10,10:52:40,czapq,893,"""So, drug consumption is the responsibility of the person who consumes; of the family who is responsible for educating; and of the education system and the socioeconomic context. What we have to do is legalize the production, the sale and the distribution."" - Former Mexican president Vicente Fox",edition.cnn.com,http://edition.cnn.com/2010/WORLD/americas/08/09/mexico.fox.drug.legalization/index.html#fbid=Chpi-Eeux7g&wom=false
2010-08-10,21:55:03,czh1v,151,US tank crew wanted for murder | The Spanish government wants a three-man US army tank crew to stand trial for the death of cameraman Jose Couso in Baghdad in 2003.,morningstaronline.co.uk,http://www.morningstaronline.co.uk/index.php/news/content/view/full/93861
2010-08-10,21:06:22,czgip,150,"Iran to get rid of its dollar and euro reserves in response to the latest U.N. sanctions over its contested nuclear program: ""We consider these currencies dirty and won't sell oil in dollar and euro""",google.com,http://www.google.com/hostednews/ap/article/ALeqM5hEhR845G1QgnUehgXPZUpQtPwK_QD9HG5R284
2010-08-10,16:53:13,czed6,138,Man becomes only person to have ever trekked the 4000 mile length of Amazon river.,bbc.co.uk,http://www.bbc.co.uk/news/uk-10852783
2010-08-10,07:24:49,cz8m8,120,"Former Mexico president supports legalizing drugs to end violence.
",reuters.com,http://www.reuters.com/article/idUSTRE6784R120100809
2010-08-10,19:50:07,czftp,106,The Taliban publicly flogged and then executed a pregnant Afghan widow by firing three shots into her head for alleged adultery.,news.yahoo.com,http://news.yahoo.com/s/afp/20100809/wl_sthasia_afp/afghanistanunrestwomenexecution
2010-08-10,11:05:57,czavn,101,I went to see what was up with Russia burning... and found out that the Congo is burning even worse... ,rapidfire.sci.gsfc.nasa.gov,http://rapidfire.sci.gsfc.nasa.gov/firemaps/firemap.2010191-2010200.8192x4096.jpg
2010-08-10,16:58:59,czeer,94,Japan apologizes to SKorea for colonial rule,sfgate.com,http://www.sfgate.com/cgi-bin/article.cgi?f=/n/a/2010/08/09/international/i211106D75.DTL
2010-08-11,05:19:27,czn8d,96,"600,000 Workers Drop Dead Every Year From Overwork In China’s Factories: We’ll never know the names of all the people who paid with their limbs, their lungs or their lives for the goodies in my home and yours.",infowars.com,http://www.infowars.com/600000-workers-drop-dead-every-year-from-overwork-in-chinas-factories/
2010-08-10,19:29:43,czfnz,84,Redditor posts graph showing the spread of combat in Afghanistan using WikiLeaks's war logs,wired.com,http://www.wired.com/dangerroom/2010/08/open-source-wikileaked-docs-illustrated-afghan-meltdown/
2010-08-11,07:48:54,czp1c,81,French interior minister calls for withdrawal of citizenship for the practice of polygamy or female genital mutilation,telegraph.co.uk,http://www.telegraph.co.uk/news/worldnews/europe/france/7933025/Frances-interior-minister-targets-immigrants-who-practise-polygamy.html
2010-08-10,21:00:40,czgh1,82,Google offices raided by Korean police,bbc.co.uk,http://www.bbc.co.uk/news/technology-10924682
2010-08-10,13:04:54,czc6q,76,"U.N. declares Pakistan floods the worst natural disaster ever:: Number of people suffering exceeds 13 million — more than the combined total of the 2004 Indian Ocean tsunami, the 2005 Kashmir earthquake and the 2010 Haiti earthquake.",nydailynews.com,http://www.nydailynews.com/news/world/2010/08/09/2010-08-09_un_declares_pakistan_floods_the_worst_natural_disaster_ever_as_number_of_people_.html
2010-08-10,19:25:43,czfn1,53,A group of human-rights organizations is pressing WikiLeaks to do a better job of redacting names from thousands of war documents it is publishing: Could jeopardize the safety of Afghans who aided the U.S. military.,online.wsj.com,http://online.wsj.com/article/SB10001424052748703428604575419580947722558.html?mod=WSJ_hpp_MIDDLENexttoWhatsNewsTop
2010-08-11,05:13:12,czn5h,41,China zoos in 'barbaric' animal abuse: report,news.asiaone.com,http://news.asiaone.com/News/Latest%2BNews/Asia/Story/A1Story20100810-231452.html
2010-08-10,21:17:44,czgn1,33,The district commander ordered his body guard to open fire on the afghan civilian. The body guard refused at which time the district commander shot him in front of the civilian,newyorker.com,http://www.newyorker.com/talk/comment/2010/08/09/100809taco_talk_davidson
2010-08-10,19:34:01,czfp7,32,The Geopolitics of Google Earth: Governments are using the images to find tax cheats and illegal pot plantations,foreignpolicy.com,http://www.foreignpolicy.com/articles/2010/08/06/the_geopolitics_of_google_earth?page=full
2010-08-10,10:56:57,czart,22,Pakistan drowns in misery [pics],english.aljazeera.net,http://english.aljazeera.net/photo_galleries/centralsasia/201089161838709557.html
2010-08-10,08:44:05,cz9gj,23,The daily mortality rate in Moscow has doubled and morgues are overflowing amid an acrid smog caused by the worst heatwave in Russia's thousand-year history,uk.news.yahoo.com,http://uk.news.yahoo.com/18/20100809/tsc-moscow-deaths-double-in-russia-s-wor-dd8f3fa.html
2010-08-11,03:07:08,czlg0,24,"Afghanistan civilian deaths up 31% this year, says United Nations.  Report says child victims have risen by 55% as Taliban target more Afghans, while deaths caused by foreign troops fall",guardian.co.uk,http://www.guardian.co.uk/world/2010/aug/10/afghanistan-civilian-deaths-up-un
2010-08-10,15:32:31,czdmf,25,Israel threatens to quit UN probe into flotilla shooting,news.yahoo.com,http://news.yahoo.com/s/ap/20100809/ap_on_re_mi_ea/gaza_blockade
2010-08-11,03:09:43,czlhb,19,Lebanon crisis feared as indictments near in assassination of Rafiq al-Hariri,washingtonpost.com,http://www.washingtonpost.com/wp-dyn/content/article/2010/08/09/AR2010080904862.html
2010-08-11,00:03:36,czirz,22,The Price of an Afghan Life [graphic pic],spiegel.de,"http://www.spiegel.de/international/world/0,1518,710963,00.html"
2010-08-10,23:31:17,czibp,17,"Silvio Berlusconi has easily survived a series of corruption and sex scandals. Now a revolt by a former ally could pose a serious threat to the Italian prime minister, who many feel is on his last legs politically. Berlusconi has the summer recess to plot his survival.",spiegel.de,"http://www.spiegel.de/international/europe/0,1518,710966,00.html"
2010-08-10,19:30:51,czfo9,14,"Israeli police re-raze Bedouin village: ""They destroyed the village for the third time in two weeks""",news.smh.com.au,http://news.smh.com.au/breaking-news-world/israeli-police-reraze-bedouin-village-20100810-11xxp.html
2010-08-10,22:42:08,czho1,13,Fast fashion is driving third world workers into starvation conditions ,guardian.co.uk,http://www.guardian.co.uk/world/2010/aug/08/fashion-sweatshops-lucy-siegle-comment
2010-08-11,04:59:48,czmyw,12,China rescuers search sludge for mudslide survivors (with pictures),reuters.com,http://www.reuters.com/article/idUSTRE67704Q20100809
2010-08-11,03:27:14,czlqc,14,The UK Ministry of Justice is planning to cut £2bn from its £9bn budget,bbc.co.uk,http://www.bbc.co.uk/news/uk-politics-10925989
2010-08-11,00:54:36,czjli,10,Saudi Women Photographers show us their lives in pictures...,bbc.co.uk,http://www.bbc.co.uk/news/world-us-canada-10921963
2010-08-10,20:41:05,czga2,11,"Google, Verizon and net neutrality: reaction from the web. Google and Verizon say they are 'committed to an open internet', but most commentators are suspicious of the deal being done between these two powerful companies.",guardian.co.uk,http://www.guardian.co.uk/technology/2010/aug/10/google-verizon-net-neutrality-reaction
