2011-12-15,01:57:03,nclz4,1632,"Police shave mohawks off punks at Indonesia concert - Police in Indonesia’s most conservative province raided a punk-rock concert and detained 65 fans, buzzing off their spiky mohawks and stripping away body piercings because of the perceived threat to Islamic values.",thestar.com,http://www.thestar.com/news/world/article/1101574--police-shave-mohawks-off-punks-at-indonesia-concert?bn=1
2011-12-15,10:07:14,nd796,1553,"	 Chevron admits it hasn’t been able to stop Brazil oil leak - Last month Chevron spilled over 100,000 gallons of oil off the coast. They tried to plug the well with cement, but Chevron had to admit it didn't work.",treehugger.com,http://www.treehugger.com/energy-disasters/chevron-admits-oil-leak-brazil-continuing.html?
2011-12-15,04:37:03,nct6v,1489,"Canada's environmental minister is called a ""piece of shit"" by an opposition MP after Canada  withdraws from Kyoto",ctv.ca,http://www.ctv.ca/CTVNews/Politics/20111214/trudeau-justin-house-of-commons-insult-111214/
2011-12-15,22:11:49,nds2e,1010,Junkyard Gives Up Secret Accounts of Massacre in Iraq,nytimes.com,http://www.nytimes.com/2011/12/15/world/middleeast/united-states-marines-haditha-interviews-found-in-iraq-junkyard.html?_r=1&nl=todaysheadlines&emc=tha22
2011-12-15,10:41:29,nd8os,754,"The European Union Parliament has made a statement opposing SOPA, particularly in reference to the ability of the US to seize domain names.
",neurope.eu,http://www.neurope.eu/article/us-using-its-longarm-seize-domain-names
2011-12-16,06:50:13,nedp3,495,Iceland just became the first Western European country to recognize Palestine,stream.aljazeera.com,http://stream.aljazeera.com/story/campaign-palestinian-recognition-succeeding-0021909
2011-12-15,19:48:32,ndorf,473,"France's faulty breast implants scandal: More than 30,000 women have had breast implants filled with industrial silicone instead of medical-grade fillers",guardian.co.uk,http://www.guardian.co.uk/lifeandstyle/2011/dec/14/france-faulty-breast-implant-scandal
2011-12-15,23:48:29,ndvdl,424,Vladimir Putin lashes out at America for killing Gaddafi and backing protests ,telegraph.co.uk,http://www.telegraph.co.uk/news/worldnews/europe/russia/8958475/Vladimir-Putin-lashes-out-at-America-for-killing-Gaddafi-and-backing-protests.html
2011-12-15,02:48:42,ncoa3,419,Russia's experiencing its biggest protests since the fall of the Soviet Union. Are we witnessing a political awakening?,stream.aljazeera.com,http://stream.aljazeera.com/story/russia%27s-winter-discontent-0021905
2011-12-15,17:52:02,ndmir,414,BBC News - French ex-President Jacques Chirac guilty of corruption,bbc.co.uk,http://www.bbc.co.uk/news/world-europe-16194089
2011-12-16,00:18:20,ndwiq,365,"Suspected Jewish extremists torch second Palestinian mosque, deface it with Hebrew graffiti",washingtonpost.com,http://www.washingtonpost.com/world/middle-east/another-palestinian-mosque-torched-defaced-with-hebrew-graffiti-in-west-bank/2011/12/15/gIQAd9pNvO_story.html
2011-12-15,16:45:57,ndl25,150,Human Rights Watch says it has identified 74 Syrian commanders and intelligence officials who ordered troops to indiscriminately shoot unarmed protesters,globalpost.com,http://www.globalpost.com/dispatch/news/regions/middle-east/111215/syrian-military-ordered-troops-shoot-unarmed-protesters-hrw/?fullpage
2011-12-15,13:43:15,ndfwt,130,N Korean soldiers flee into China - ABC News (Australian Broadcasting Corporation),abc.net.au,http://www.abc.net.au/news/2011-12-15/north-korean-soldiers-defect-to-china/3733218
2011-12-15,20:14:24,ndp7x,115,Former French president Jacques Chirac found guilty of corruption,theglobeandmail.com,http://www.theglobeandmail.com/news/world/former-french-president-jacques-chirac-found-guilty-of-corruption/article2271881/?utm_medium=feed&utm_source=feedburner&utm_content=Google+Reader&utm_campaign=Feed%3A+TheGlobeAndMail-International+%28The+Globe+and+Mail+-+World+News%29
2011-12-15,21:33:30,ndqye,109,"A Massacre In Jamaica --- 
In 2009 the United States requested the extradition of drug-lord Christopher Dudus Coke from his stronghold in Tivoli Gardens, Kingston. One year later, Prime Minister Golding sanctioned the request. Then all hell broke loose",newyorker.com,http://www.newyorker.com/reporting/2011/12/12/111212fa_fact_schwartz?currentPage=all
2011-12-15,08:20:29,nd2xg,107,China's real estate bubble is bursting -- economy on the verge of collapse.,telegraph.co.uk,http://www.telegraph.co.uk/finance/china-business/8957289/Chinas-epic-hangover-begins.html
2011-12-16,01:30:21,ndzhs,95,The reputation of the Netherlands as the go-to country for a legal joint will begin to vanish like a puff of smoke next year as sales to foreigners of cannabis and hashish in coffee shops are banned.,reuters.com,http://www.reuters.com/article/2011/12/15/us-dutch-cannabis-idUSTRE7BE1JO20111215
2011-12-15,01:44:00,ncley,86,14 bomb-sniffing dogs on way to Afghanistan died in truck,chron.com,http://www.chron.com/news/houston-texas/article/Lawsuit-14-bomb-sniffing-dogs-on-way-to-2402337.php
2011-12-15,20:53:12,ndpzz,79,Chinese village besieged after protests - Police seal off roads and food supplies to village in southern province after rallies against government land seizures.,aljazeera.com,http://www.aljazeera.com/news/asia-pacific/2011/12/2011121522525748843.html
2011-12-15,21:17:57,ndqj3,82,"The German capital's entire local train system broke down on Thursday afternoon, leaving thousands stuck in trains on the tracks.",thelocal.de,http://www.thelocal.de/national/20111215-39535.html
2011-12-16,04:43:48,ne7yx,50,Iran to exhibit US and Israeli drones,guardian.co.uk,http://www.guardian.co.uk/world/2011/dec/15/iran-exhibit-american-spy-drones
2011-12-16,01:31:46,ndzjx,47,French President’s Residence ‘Busted’ For BitTorrent Piracy,torrentfreak.com,https://torrentfreak.com/french-presidents-residence-busted-for-bittorrent-piracy-111215/
2011-12-15,08:52:07,nd45b,47,"Chinese villagers in standoff with riot police call on government to intervene: Wukan village residents have barricaded themselves in over a land dispute in which one person has died
",guardian.co.uk,http://www.guardian.co.uk/world/2011/dec/14/chinese-villagers-standoff-riot-police
2011-12-15,23:27:29,ndul0,42,Syrian rebels kill dozens of Assad's forces in fresh clashes,haaretz.com,http://www.haaretz.com/news/middle-east/syrian-rebels-kill-dozens-of-assad-s-forces-in-fresh-clashes-1.401560
2011-12-15,17:48:41,ndmg2,42,"Netanyahu wants right-wing extremists labeled ""anarchists"" instead of ""terrorists""",globalpost.com,http://www.globalpost.com/dispatches/globalpost-blogs/the-casbah/netanyahu-wants-right-wing-extremists-labeled-anarchists-inst
2011-12-15,22:02:28,ndrsl,39,"Syrian National Council, Syria's rebel government, opens offices in Turkey
",globalpost.com,http://www.globalpost.com/dispatch/news/regions/middle-east/111214/syrian-national-council-syria-rebel-government-turkey
2011-12-16,00:18:06,ndwic,30,"Rise in ""price tag"" attacks on Palestinians across the West Bank and in Israel in recent weeks",bbc.co.uk,http://www.bbc.co.uk/news/world-middle-east-16195605
2011-12-16,00:07:31,ndw3y,33,Authorities ordered the destruction of a dome in the main square of Tehran because its decoration resembled the Jewish symbol.,jpost.com,http://www.jpost.com/JewishWorld/JewishNews/Article.aspx?id=249596
2011-12-15,17:56:01,ndmlr,27,Strike closes airports in Cyprus ,independent.co.uk,http://www.independent.co.uk/news/world/europe/strike-closes-airports-in-cyprus-6277336.html
2011-12-15,10:43:28,nd8ri,30,"Chinese village of 20,000 revolts against communist leaders",nytimes.com,http://www.nytimes.com/2011/12/15/world/asia/chinese-village-locked-in-rebellion-against-authorities.html?_r=1
