2011-06-08,20:07:03,huj80,1315,F1 chief Bernie Ecclestone says Bahrain Grand Prix will be cancelled after 11 F1 teams objected,telegraph.co.uk,http://www.telegraph.co.uk/sport/motorsport/formulaone/f1news/8563372/Bahrain-Grand-Prix-will-be-cancelled-without-support-of-drivers-and-teams-says-Bernie-Ecclestone.html
2011-06-08,08:06:27,hu55l,1124,Germany has been doing well economically: carrot & stick social programs have pushed people back to work; average real wages up 30% since 1985; tougher down payment rules on houses prevented a bubble; taxes hiked and spending cut to reduce deficits.,nytimes.com,http://www.nytimes.com/2011/06/08/business/economy/08leonhardt.html
2011-06-09,01:01:15,hupdm,462,Net neutrality to be added to Dutch telecommunications act,osnews.com,http://www.osnews.com/story/24788/Net_Neutrality_To_Be_Added_to_Dutch_Telecommunications_Act
2011-06-08,09:11:52,hu6rv,347,"Innocent passerby shot dead by cops in... Montreal, Canada!? ",cbc.ca,http://www.cbc.ca/news/canada/montreal/story/2011/06/07/montreal-shooting.html
2011-06-08,00:32:11,htsqu,309,Macedonia erupts after young man beaten to death by special police in public square.,boingboing.net,http://www.boingboing.net/2011/06/07/macedonia-erupts-aft.html
2011-06-09,06:03:04,huy11,136,"Russia defies growing consensus with declaration of 'total war on drugs' - Under new laws being drawn up addicts would be forced into treatment or jailed, and dealers 'treated like serial killers'.",guardian.co.uk,http://www.guardian.co.uk/world/2011/jun/08/russia-total-war-on-drugs
2011-06-08,21:21:02,hukcj,70,TIL North Korea runs state-sponsored restaurants all over Asia...the waitresses come from the upper crust of North Korean society and essentially live like prisoners in their workplaces.,theatlantic.com,http://www.theatlantic.com/international/archive/2011/06/for-north-korean-state-waitresses-abroad-lives-of-rigor-and-temptation/239943/
2011-06-08,15:31:21,huf80,60,"Carbolic acid has spilled into a river that supplies drinking water to Hangzhou in eastern China, knocking out supplies to more than 500,000 people and creating a run on bottled water",chinadaily.com.cn,http://www.chinadaily.com.cn/usa/china/2011-06/08/content_12655388.htm
2011-06-08,08:24:43,hu5mo,38,Japan doubles Fukushima radiation leak estimate,guardian.co.uk,http://www.guardian.co.uk/world/2011/jun/07/japan-doubles-fukushima-radiation-leak-estimate
2011-06-08,18:33:40,huhze,41,BBC News - China aircraft carrier confirmed by general,bbc.co.uk,http://www.bbc.co.uk/news/world-asia-pacific-13692558
2011-06-08,21:45:51,huks6,33,Formula One chief Bernie Ecclestone has said that he believes the Bahrain Grand Prix will not go ahead as planned as the teams and drivers involved did not want to take part,news.yahoo.com,http://news.yahoo.com/s/afp/20110608/wl_mideast_afp/autoprixbrnecclestone
2011-06-08,21:59:08,hul0z,35,David Cameron warns Syria that Britain will not stand silent.,telegraph.co.uk,http://www.telegraph.co.uk/news/politics/david-cameron/8563679/David-Cameron-warns-Syria-that-Britain-will-not-stand-silent.html
2011-06-08,18:44:45,hui4l,33,So Where's Japan's Radiation Going?,motherjones.com,http://motherjones.com/blue-marble/2011/06/so-where-japans-radiation-going
2011-06-08,08:53:37,hu6bq,35,Prime Minister Stephen Harper’s Conservative Party Website Hacked,canadianprogressiveworld.com,http://www.canadianprogressiveworld.com/2011/06/07/643/
2011-06-08,13:33:55,hucxr,32,Australia issues a blanket ban on all live cattle exports to Indonesia after brutality exposed last week,bbc.co.uk,http://www.bbc.co.uk/news/world-asia-pacific-13692211
2011-06-09,00:14:46,huo4z,32,How Greek Protesters See The EU In One Simple Photograph,businessinsider.com,http://www.businessinsider.com/greek-protesters-eu-swastika-2011-6
2011-06-09,05:53:33,huxrf,27,The Big Picture:  Chile's Puyehue volcano.,boston.com,http://www.boston.com/bigpicture/2011/06/volcano_erupts_in_chile.html
2011-06-09,05:23:00,huwvv,28,Ahmadinejad is facing increased political attacks from the supreme leader from continually overstepping his bounds.,theatlantic.com,http://www.theatlantic.com/international/archive/2011/06/ahmadinejad-isolated-by-battle-with-irans-supreme-leader/240098/
2011-06-08,19:06:59,huig2,24,"In Greek Port, Storm Brews Over Chinese-Run Labor",npr.org,http://www.npr.org/2011/06/08/137035251/in-greek-port-storm-brews-over-chinese-run-labor
2011-06-08,10:13:25,hu88g,25,"Wrongly convicted woman freed after 17 years in jail: judge blames pathologist who convicted her, now exposed as a fraudster. “She was an easy target for Smith and she was an easy target, I fear, for the criminal justice system,”",torontosun.com,http://www.torontosun.com/2011/06/07/wrongly-convicted-17-years-ago-woman-finally-freed
2011-06-09,01:35:49,huqbv,24,Japan doubles nuclear radiation leak estimate,news.discovery.com,http://news.discovery.com/earth/japan-nuclear-radiation-risk-110607.html
2011-06-08,22:55:48,hum5k,21,'Farting Camels Must Die to Save the World' Australian carbon plan to unleash kill-choppers against dromedaries,theregister.co.uk,http://www.theregister.co.uk/2011/06/08/farting_carbon_camels/
2011-06-08,09:06:10,hu6n0,20,"Yemenis protests after talks rejected: Thousands gather outside vice-president's residence after government rejects proposed dialogue as ""ridiculous"".",english.aljazeera.net,http://english.aljazeera.net/news/middleeast/2011/06/20116717337139621.html
2011-06-08,12:56:06,huc4x,20,Japan raises spectre of Fukushima 'melt-through' - ABC News (Australian Broadcasting Corporation),abc.net.au,http://www.abc.net.au/news/stories/2011/06/08/3238720.htm?section=world
2011-06-08,08:24:44,hu5mp,15,An explosion occurred at the Egyptian Anshas experimental nuclear reactor.,ireport.cnn.com,http://ireport.cnn.com/docs/DOC-617719
2011-06-08,20:32:28,hujlu,14,Fighter jets intercept Russian bombers after flying into Dutch airspace,wireupdate.com,http://wireupdate.com/wires/18006/fighter-jets-intercept-russian-bombers-after-flying-into-dutch-airspace/
2011-06-08,23:32:49,hun22,15,BBC News - Landmark Hitler letter on Jews unveiled in New York,bbc.co.uk,http://www.bbc.co.uk/news/world-europe-13692755
2011-06-08,16:13:59,hug0j,12,Yemeni president's wounds 'worse than thought': burned on more than 40% of his body and suffered bleeding in the brain from last weekend's attack on his palace.,express.co.uk,http://www.express.co.uk/posts/view/251355/Saleh-s-wounds-worse-than-thought-
2011-06-08,08:55:23,hu6dn,15,WSJ and Al-Jazeera Lure Whistleblowers With False Promises of Anonymity,eff.org,https://www.eff.org/deeplinks/2011/06/wsj-and-al-jazeera-lure-whistleblowers-false
2011-06-08,20:58:28,huk0d,15,"BBC News - Hundreds in Syria flee to Turkey, fearing army assault",bbc.co.uk,http://www.bbc.co.uk/news/world-middle-east-13694802
