2011-10-30,21:25:51,lu271,1583,"Russia has not put its clocks back for winter this year, after President Dmitry Medvedev decided the country would stay permanently in summertime.",bbc.co.uk,http://www.bbc.co.uk/news/world-europe-15512177
2011-10-30,12:13:37,lttzq,1562,"Occupy London could be protected by Christian ring of prayer: Coalition of Christian groups plan to prevent forcible attempts to remove tents outside St Paul's Cathedral
",guardian.co.uk,http://www.guardian.co.uk/uk/2011/oct/29/christians-defend-occupy-london-protest
2011-10-30,01:38:53,ltcf1,1206,Online hackers threaten to expose cartel's secrets - ,chron.com,http://www.chron.com/news/houston-texas/article/Online-hackers-threaten-to-expose-cartel-s-secrets-2242068.php?utm_source=feedburner&utm_medium=feed&utm_campaign=Feed%3A+houstonchronicle%2Ftopheadlines+%28chron.com+-+Top+Stories%29
2011-10-30,19:17:03,lu0gk,712,Work for free – or not at all: the bitter choice for young graduates,guardian.co.uk,http://www.guardian.co.uk/money/2011/oct/30/unpaid-interns-charity-sector
2011-10-30,01:37:06,ltaqq,559,Christmas comes early for Germany after 55-billion-euro accounting error,dw-world.de,"http://www.dw-world.de/dw/article/0,,15497284,00.html"
2011-10-30,15:37:07,ltxq7,488,"The protesters seem more adult than politicians and plutocrats. With a few nylon tents and some amateurish banners, the Occupy movement has rattled the establishment
",guardian.co.uk,http://www.guardian.co.uk/commentisfree/2011/oct/30/andrew-rawnsley-occupy-protesters-grown-up
2011-10-30,02:53:24,lteit,432,"African male rape victims speak, fight shame of war horror",monstersandcritics.com,http://www.monstersandcritics.com/news/africa/features/article_1671907.php/African-male-rape-victims-speak-fight-shame-of-war-horror
2011-10-30,07:17:25,ltmdo,369,"Saudi Prince offers $900,000 to the person who captures an Israeli soldier | Reuters

",reuters.com,http://www.reuters.com/article/2011/10/29/us-saudi-israel-bounty-idUSTRE79S32220111029
2011-10-31,01:24:20,lu7hd,339,Canada Mandatory Minimum Crime Bill Set to Pass: The govt has been trying for years to pass a harsh drug crime bill that includes mandatory minimum sentences for growing as few as six marijuana plants,stopthedrugwar.org,http://stopthedrugwar.org/chronicle/2011/oct/26/canada_mandatory_minimum_crime_b
2011-10-30,13:44:51,ltvum,305,"Spanish Indignados: Millions turned out for Spain's Occupy protests and inspire others abroad; Occupy Wall Street pale in size compared to their Spanish cousin, which may be taking a leading role in an increasingly globalized and coordinated movement",commondreams.org,https://www.commondreams.org/headline/2011/10/29-5
2011-10-31,03:04:29,luao0,216,"Canadian man beaten, jailed by 10-15 religious police in unprovoked attack in Saudi Arabia",ctv.ca,http://www.ctv.ca/CTVNews/TopStories/20111030/canadian-imam-beaten-saudi-arabia-medina-111030/
2011-10-30,07:08:47,ltm4w,192,Occupy Europe: How a generation went from indifferent to indignant - CSMonitor.com,csmonitor.com,http://www.csmonitor.com/World/Global-Issues/2011/1029/Occupy-Europe-How-a-generation-went-from-indifferent-to-indignant
2011-10-31,01:58:59,lu8ku,179,Horror of South Africa's 'corrective rape',cnn.com,http://www.cnn.com/2011/10/27/world/wus-sa-rapes/index.html
2011-10-30,17:58:19,ltzkj,151,Germany's 'Occupy' protesters return to voice anger:  Thousands of people in Germany have rallied again to protest over the gap between rich and poor. Activists camping outside the European Central Bank in Frankfurt have vowed to remain for the next two weeks.,dw-world.de,"http://www.dw-world.de/dw/article/0,,15498212,00.html"
2011-10-31,04:09:47,lucn2,145,Google refuses official requests to take down YouTube video of police brutality,dailymail.co.uk,http://www.dailymail.co.uk/news/article-2055207/Google-refuses-official-requests-YouTube-videos-police-brutality.html#ixzz1cHwbzELy
2011-10-30,03:20:43,ltfbr,123,"U.S. moves to sell attack helicopters to Turkey - ""... an unusual proposal to take three AH-1W ""SuperCobra"" attack helicopters from the U.S. Marine Corps inventory and sell them to Turkey.""
",reuters.com,http://www.reuters.com/article/2011/10/28/us-turkey-usa-helicopter-idUSTRE79R67220111028
2011-10-30,19:34:51,lu0og,120,"London's Metropolitan Police spends millions of pounds on secret spy planes capable of eavesdropping on mobile phone calls
",telegraph.co.uk,http://www.telegraph.co.uk/news/uknews/law-and-order/8857517/Met-Police-spends-millions-of-pounds-on-secret-aircraft.html
2011-10-30,23:33:49,lu4kp,100,"More Egyptians Finding It Difficult to Make Ends Meet --- 
40% of Egyptians say they are “finding it very difficult” to get by, the highest percentage to say so since the overthrow of Mubarak. Fewer than  30% of Egyptians are getting by on their present income, down from 43% in late 2010",gallup.com,http://www.gallup.com/poll/150356/Egyptians-Finding-Difficult-Ends-Meet.aspx?
2011-10-31,00:16:48,lu5n2,90,"Greens Insist Feds Should Override States & Protect Water Supply From Mining, Arguing States are ''Clearly Failing'' to Regulate the Industry - ""The federal government should have a ''regulatory role'' in protecting groundwater & food security from mining.""",smh.com.au,http://www.smh.com.au/environment/water-issues/greens-seek-new-powers-to-protect-water-supply-20111028-1moa6.html
2011-10-31,01:23:06,lu7gc,81,Man slain in central Oslo; 'GOD' written in blood,translate.google.com,http://translate.google.com/translate?sl=auto&tl=en&js=n&prev=_t&hl=en&ie=UTF-8&layout=2&eotf=1&u=http%3A%2F%2Fwww.vg.no%2Fnyheter%2Finnenriks%2Fartikkel.php%3Fartid%3D10023202&act=url
2011-10-30,23:34:44,lu4le,69,There have been violent protests in the central Chinese province of Henan after a policeman suspected of drunk driving crashed his car and killed five people,bbc.co.uk,http://www.bbc.co.uk/news/world-asia-pacific-15512627
2011-10-31,02:12:46,lu92f,64,"Egypt anger erupts after top blogger, activist Alaa detained by military",bikyamasr.com,http://bikyamasr.com/46884/egypt-anger-erupts-after-top-blogger-activist-detained-by-military/?utm_source=twitterfeed&utm_medium=twitter
2011-10-30,16:08:45,lty7g,44,China copes with promise and perils of one-child policy,edition.cnn.com,http://edition.cnn.com/2011/10/28/world/asia/china-one-child/index.html?hpt=wo_c2
2011-10-31,03:27:03,lubcr,48,Arab League warns Assad of foreign intervention if violence continues,english.alarabiya.net,http://english.alarabiya.net/articles/2011/10/30/174460.html
2011-10-30,14:32:27,ltwom,41,Israeli-Palestinian ceasefire reached,english.aljazeera.net,http://english.aljazeera.net/news/middleeast/2011/10/2011103012854318377.html
2011-10-30,02:50:22,ltefj,36,"Three Australian soldiers shot dead in Taliban sleeper agent attack in Afghanistan - A ROGUE Afghan soldier has opened fire and killed three Australian army trainers and wounded six others in the volatile south of Afghanistan, NATO and a local commander have confirmed.",heraldsun.com.au,http://www.heraldsun.com.au/news/more-news/aussie-troops-shot-dead-in-afghanistan/story-fn7x8me2-1226180500371
2011-10-31,00:31:37,lu615,31,New Israeli air strike into Gaza after 'ceasefire',bbc.co.uk,http://www.bbc.co.uk/news/world-middle-east-15511006
2011-10-31,05:06:05,luejv,31,"Nuclear powers plan weapons spending spree, report finds",guardian.co.uk,http://www.guardian.co.uk/world/2011/oct/30/nuclear-powers-weapons-spending-report
2011-10-30,18:25:37,ltzvu,31,Somali piracy: Armed guards to protect UK ships,bbc.co.uk,http://www.bbc.co.uk/news/uk-15510467
2011-10-30,23:37:58,lu4nx,30,"Police investigating allegations that the ship, MV Island Trader, that hit a sandbank & was stranded for 7 days in the world-heritage listed Lord Howe Island lagoon, was responsible for 2 other marine pollution incidents -  It has a monopoly on the route carrying food & fuel from Port Macquarie",smh.com.au,http://www.smh.com.au/environment/police-investigate-ship-for-marine-pollution-20111029-1mp9b.html
