2011-04-02,20:52:46,gh1v5,1326,"Those books found in cave in Jordan labeled ""most important find in Christian history"" are actually forgeries created within the last 50 years",derrenbrown.co.uk,http://derrenbrown.co.uk/blog/2011/04/fake-seventy-metal-books-cave-jordan-labeled-important-find-christian-history/
2011-04-03,07:55:33,ghc87,620,"This is appalling and unacceptable: Father of alleged Libyan rape victim, Eman al-Obeidy, says she is still missing.",edition.cnn.com,http://edition.cnn.com/2011/WORLD/africa/04/02/libya.rape.case/
2011-04-02,15:32:29,ggyrv,308,"Royal Navy medic who 'conscientiously objected' to Afghan war after reading files on WikiLeaks, faces court martial",mirror.co.uk,http://www.mirror.co.uk/news/top-stories/2011/04/02/navy-medic-who-conscientiously-objected-to-afghan-war-faces-court-martial-115875-23031819/
2011-04-03,01:19:38,gh55a,303,Brazil banks sued for Amazon deforestation: Brazil's biggest bank - the state-run Banco do Brasil - is being sued for allegedly funding deforestation in the Amazon. ,bbc.co.uk,http://www.bbc.co.uk/news/world-latin-america-12944239
2011-04-02,11:33:26,ggv7f,209,Protesters return to Egypt's Tahrir square,youtube.com,http://www.youtube.com/watch?v=SmciaHm516I
2011-04-03,02:26:00,gh6cc,205,Japan tsunami dog rescued after three weeks at sea,bbc.co.uk,http://www.bbc.co.uk/news/world-asia-pacific-12944317
2011-04-02,05:00:26,ggnem,204,"In the UK, unemployment centers are tasked with tricking people into losing benefits",guardian.co.uk,http://www.guardian.co.uk/politics/2011/apr/01/jobcentres-tricking-people-benefit-sanctions
2011-04-02,09:59:18,ggtmi,174,"""At least 800"" people were killed in one city alone in Ivory Coast earlier this week, according to the International Red Cross.",telegraph.co.uk,http://www.telegraph.co.uk/news/worldnews/africaandindianocean/cotedivoire/8423039/Ivory-Coast-800-killed-in-one-city-alone.html
2011-04-02,23:52:04,gh3vf,159,"This Attack Is Different --- 
Kabul-based aid worker on what comes next after mob of enraged Afghans kills UN staff in area considered peaceful. ""This is not the beginning of the end for the international community in Afghanistan. This is the end.""",undispatch.com,http://www.undispatch.com/this-attack-is-different
2011-04-03,04:26:42,gh8km,129,"Turkish police raid publishing house, newspaper, to confiscate and erase copies of unpublished book, dubbed an ""illegal organizational document""; mere possession of draft book declared a crime",hurriyetdailynews.com,http://www.hurriyetdailynews.com/n.php?n=meps-sent-a-letter-to-bagis-on-police-raids-for-siks-book-2011-03-25
2011-04-02,09:23:35,ggt16,109,Czech Constitutional Court rejects EU data retention law (that requirs ISPs and telecom companies to store customers' communication data for months),edri.org,http://www.edri.org/czech-decision-data-retention
2011-04-02,00:30:25,ggg8d,101,Workers At Japanese Nuclear Plant Expect to Die.,npr.org,http://www.npr.org/blogs/thetwo-way/2011/04/01/135034931/workers-at-japanese-nuclear-plant-expect-to-die-mother-of-one-says?ft=1&f=1001
2011-04-02,22:34:24,gh2w2,101,Reconsidering the Goldstone Report on Israel and war crimes,washingtonpost.com,http://www.washingtonpost.com/opinions/reconsidering-the-goldstone-report-on-israel-and-war-crimes/2011/04/01/AFg111JC_story.html?hpid=z3
2011-04-02,16:04:09,ggz5v,65,Japan finds radioactive water leaking into the sea at nuclear plant,af.reuters.com,http://af.reuters.com/article/metalsNews/idAFL3E7F203920110402
2011-04-02,08:01:27,ggrhj,50,France ditches carbon tax as social protests mount.,telegraph.co.uk,http://www.telegraph.co.uk/finance/newsbysector/energy/7507015/France-ditches-carbon-tax-as-social-protests-mount.html?sms_ss=facebook&at_xt=4d93afdcdc62d1d4%2C0#
2011-04-02,20:41:57,gh1rk,42,"NATO airstrikes kill Libyan rebels: Coalition jet struck pro-democracy forces in country's east, killing at least seven",english.aljazeera.net,http://english.aljazeera.net/news/africa/2011/04/2011428562838677.html
2011-04-03,07:35:10,ghbwj,44,"
Policeman killed in Northern Ireland car bombing.",bbc.co.uk,http://www.bbc.co.uk/news/uk-northern-ireland-12948992
2011-04-03,07:16:20,ghblf,39,"""Tepco said the water was coming directly from the reactor and the radiation level was 1,000 millisieverts an hour. The annual limit of radiation exposure allowed for Fukushima workers is 250 millisieverts.""",latimes.com,"http://www.latimes.com/news/nationworld/world/la-fg-japan-quake-20110403,0,2146668.story"
2011-04-03,04:26:38,gh8kl,41,The trial of a navy medic who refused to go to war suffered a false-start when the judge was urged to stand down from the case,portsmouth.co.uk,http://www.portsmouth.co.uk/news/local/east-hampshire/court_martial_judge_asked_to_quit_trial_over_anti_war_sailor_1_2559727
2011-04-03,03:44:29,gh7rb,37,"Mass killings in Cote d'Ivoire: UN blames both sides for killing nearly 1,000 people last week in small town of Duekoue",english.aljazeera.net,http://english.aljazeera.net/news/africa/2011/04/20114215401513945.html
2011-04-03,05:21:55,gh9om,31,"Libyan rebels ""receiving covert training"" from US and Egyptian special forces",english.aljazeera.net,http://english.aljazeera.net//news/africa/2011/04/201142172443133798.html
2011-04-02,22:56:37,gh35a,23,"Islamic Radicals in Egypt are now leaping aboard the democracy bandwagon, alarming those who believe that religious radicals are seeking to put in place strict Islamic law through ballots. ",nytimes.com,http://www.nytimes.com/2011/04/02/world/middleeast/02salafi.html?_r=1&ref=global-home
2011-04-02,15:32:24,ggyru,27,Experts: Scrapping Fukushima plant could take decades,asahi.com,http://www.asahi.com/english/TKY201104010160.html
2011-04-03,02:39:53,gh6m2,22,"Nine killed and 81 injured in Kandahar protest against US burning of Qur'an, the day after mob killed seven at UN compound",guardian.co.uk,http://www.guardian.co.uk/world/2011/apr/02/nine-killed-81-injured-kandahar-protest-quran
2011-04-02,16:04:26,ggz61,23,Armenia Sinking into Poverty,iwpr.net,http://iwpr.net/report-news/armenia-sinking-poverty
2011-04-03,00:37:02,gh4h8,20,"Saudi says 5,080 convicted of terrorism crimes",reuters.com,http://www.reuters.com/article/2011/04/02/us-saudi-courts-idUSTRE7311HG20110402?feedType=RSS&feedName=topNews
2011-04-02,18:46:57,gh0tn,19,The trials of Nunavut: Lament for an Arctic nation,theglobeandmail.com,http://www.theglobeandmail.com/news/national/nunavut/the-trials-of-nunavut-lament-for-an-arctic-nation/article1963420/singlepage/#articlecontent
2011-04-02,16:24:37,ggzdy,17,"Highly radioactive water leaking into the ocean, Japanese officials say. ",nytimes.com,http://www.nytimes.com/2011/04/03/world/asia/03japan.html?hp
2011-04-02,12:21:00,ggvxc,16,"Prime Minister Naoto Kan's planned visit to Fukushima may have delayed the venting operation, resulting in the explosion of reactor #1",yomiuri.co.jp,http://www.yomiuri.co.jp/dy/national/T110401005615.htm
2011-04-03,05:22:04,gh9oq,16,"From Far Labs, a Vivid Picture Emerges of Japan Crisis",nytimes.com,http://www.nytimes.com/2011/04/03/science/03meltdown.html?_r=1&hp
