2011-10-04,18:49:26,l0dap,1310,"Nobel Prize in Physics awarded to Saul Permutter, Brian P Schmidt and Adam G Riess for for the discovery of the accelerating expansion of the Universe through observations of distant supernovae",nobelprize.org,http://www.nobelprize.org/nobel_prizes/physics/laureates/2011/press.html
2011-10-04,04:53:49,kzori,757,Amanda Knox acquitted of Murder Charge!!!,longislandpress.com,http://www.longislandpress.com/2011/10/03/amanda-knox-verdict-amanda-knox-acquitted/
2011-10-04,12:29:26,l04k1,287,Germans want absolute ban on drink-driving  ,thelocal.de,http://www.thelocal.de/society/20111002-37961.html
2011-10-04,09:00:15,kzxbo,169,"Hugely embarrassing: Daily Mail jumps gun on ""Amanda Knox guilty""

",malcolmcoles.co.uk,http://www.malcolmcoles.co.uk/blog/daily-mail-guuilt/
2011-10-04,09:33:20,kzyff,123,Spanish fleet accused of illegal catches are receiving multimillion-euro payouts from European Union taxpayers - Commission urged to end corrupted fisheries policy,independent.co.uk,http://www.independent.co.uk/news/world/europe/spanish-fleet-accused-of-lawbreaking-lands-massive-eu-subsidies-2364366.html
2011-10-05,01:39:42,l0nj3,114,Libyan hospital treats an ill BBC journalist - refuses payment and asks for BBC branded souvenirs instead.,bbc.co.uk,http://www.bbc.co.uk/ariel/15168779
2011-10-04,18:56:24,l0de8,81,Huge suicide blast kills many in Mogadishu,bbc.co.uk,http://www.bbc.co.uk/news/world-africa-15166107
2011-10-04,07:26:41,kzu48,65,"Study: Drunken Swedes choose knives to kill - The average murderer in Sweden and neighbouring Finland are drunk men armed with knives who kill on the spur of the moment, according to a new study.",thelocal.se,http://www.thelocal.se/36500/20111003/
2011-10-04,19:14:30,l0dnl,65,"Japan to Go Ahead With Whale Hunt - Commercial whaling has been banned since 1986, but Japan claims to be conducting 'research', counting the whale population. 
Whalers will have heightened security after last year's clashes with activists, says Japanese fisheries minister.",guardian.co.uk,http://www.guardian.co.uk/world/2011/oct/04/japan-whale-hunt
2011-10-04,08:17:35,kzvu5,44,Hostile Crowd Forces Libyan Jew Out Of Synagogue,npr.org,http://www.npr.org/2011/10/03/141014576/hostile-crowd-forces-libyan-jew-out-of-synagogue
2011-10-04,23:36:13,l0jdc,40,The Puppet President: Medvedev's Betrayal of Russian Democracy,spiegel.de,"http://www.spiegel.de/international/world/0,1518,789767,00.html"
2011-10-04,20:41:49,l0f24,36,Japan reveals huge size of Fukushima clean-up area,irishtimes.com,http://www.irishtimes.com/newspaper/world/2011/0929/1224304933758.html
2011-10-04,19:38:42,l0e0w,31,Japan confirms whaling fleet to sail ,bbc.co.uk,http://www.bbc.co.uk/news/world-asia-pacific-15163955
2011-10-05,04:37:42,l0u7x,34,Swiss warn massive ice chunk may break off glacier and fall into Lauterbrunnen valley,google.com,http://www.google.com/hostednews/afp/article/ALeqM5iZA9ch6GgaGPwyvFAX46iI39r7ig?docId=CNG.a9031632fe07479fa0093f4623f141e3.441
2011-10-04,13:12:03,l061w,30,Japan to Hold Whale Hunts Despite Activist Threats,nytimes.com,http://www.nytimes.com/aponline/2011/10/03/world/asia/AP-AS-Japan-Whaling.html?
2011-10-05,02:40:56,l0pqm,33,North Korea's Mass Games: The Pursuit of Perfection [Pics],globalpost.com,http://www.globalpost.com/photo-galleries/planet-pic/5676666/north-koreas-mass-games-the-pursuit-perfection
2011-10-04,14:46:40,l08tv,31,Police beating peaceful protesters on a lovely Amsterdam day,adavies.org,http://www.adavies.org/blog/2011/10/02/police-beating-peaceful-protesters-on-a-lovely-amsterdam-day/
2011-10-04,14:46:29,l08tp,29,"Belgium officials ordered to clock out for smoke, with each minute sliced off their wages.",news.yahoo.com,http://news.yahoo.com/belgium-officials-ordered-clock-smoke-172944786.html
2011-10-04,19:19:03,l0dpz,30,"Water, water everywhere – but this island nation now has barely a drop to drink & has declared a state of emergency",independent.co.uk,http://www.independent.co.uk/news/world/australasia/water-water-everywhere-ndash-but-this-island-has-barely-a-drop-to-drink-2365184.html
2011-10-05,02:27:39,l0p9q,28,Al Shabaab bomb kills 65 in Somalia,globalpost.com,http://www.globalpost.com/dispatch/news/regions/africa/111004/al-shabaab-bomb-kills-65-somalia
2011-10-04,20:06:59,l0ehq,27,Denmark’s Fatty Foods Tax is in Effect,latimes.com,"http://www.latimes.com/health/boostershots/la-heb-fat-tax-denmark-20111013,0,2603132.story"
2011-10-05,06:22:59,l0y8h,23,Moody’s Cuts Italy Rating Following S&P,bloomberg.com,http://www.bloomberg.com/news/2011-10-04/italy-s-rating-cut-by-moody-s-on-concern-country-may-struggle-to-trim-debt.html?cmpid=bit
2011-10-04,20:40:47,l0f1f,25,"The Dalai Lama has cancelled his trip to South Africa, where he had been invited by fellow Nobel Peace laureate Archbishop Desmond Tutu:  South African government had failed to grant him a visa on time.",bbc.co.uk,http://www.bbc.co.uk/news/world-africa-15164383
2011-10-05,06:45:54,l0z2j,20,The Best Countries For Business - Canada claims #1 Spot,forbes.com,http://www.forbes.com/sites/kurtbadenhausen/2011/10/03/the-best-countries-for-business/
2011-10-05,03:59:23,l0sp7,21,"President Assad: 'If NATO attacks Syria, we'll fire missiles at Tel Aviv'",jpost.com,http://www.jpost.com/MiddleEast/Article.aspx?id=240519
2011-10-05,04:56:26,l0ux4,20,Wikipedia shuts down Italian site in protest against Berlusconi's new wiretapping act,businessinsider.com,http://www.businessinsider.com/italy-wikipedia-wiretapping-2011-10
2011-10-04,09:51:22,kzz0g,19,"""Russia's Prime Minister Vladimir Putin said he wants to bring ex-Soviet states into a 'Eurasian Union' in an article which outlined his first foreign policy initiative as he prepares to return to the Kremlin as the country's next president.""",reuters.com,http://www.reuters.com/article/2011/10/03/us-russia-putin-eurasian-idUSTRE7926ZD20111003
2011-10-05,02:59:34,l0qeo,17,"Egyptian blogger's hunger strike turns critical; hearing delayed:  The Egyptian military has postponed by three weeks an appeal hearing for blogger Maikel Nabil Sanad, whose case symbolizes the lack of freedom of expression in Egypt today.",csmonitor.com,http://www.csmonitor.com/World/Middle-East/2011/1004/Egyptian-blogger-s-hunger-strike-turns-critical-hearing-delayed
2011-10-04,10:14:36,kzzu8,16,Comparing India and China: Chasing the dragon ,economist.com,http://www.economist.com/blogs/dailychart/2011/10/comparing-india-and-china?fsrc=scn/tw/te/dc/chasingthedragon
2011-10-04,11:17:50,l021m,18,"40,000 drug users are detained at any one time in Vietnam, and forced labor is their main “treatment.”",hrw.org,http://www.hrw.org/news/2011/10/03/national-cashew-day-more-nuts
