2011-05-29,23:25:39,hmtut,1140,"Hundreds of women report rapes by Qaddafi forces
 --- ""First they tied my husband up,"" the woman wrote. ""Then they raped me in front of my husband and my husband's brother. Then they killed my husband.""",english.alarabiya.net,http://english.alarabiya.net/articles/2011/05/28/150901.html
2011-05-29,10:14:20,hmk07,790,India pledges support for Palestine,thehindu.com,http://www.thehindu.com/news/international/article2057960.ece
2011-05-29,03:15:27,hmcx4,247,Egypt: Hosni Mubarak fined for cutting internet. Let this be a warning for other world leaders.,bbc.co.uk,http://www.bbc.co.uk/news/world-middle-east-13585237
2011-05-29,07:02:28,hmgw0,125,"China drought affecting over 34,000,000 people, leaving farmers & livestock without water & parching their grain",physorg.com,http://www.physorg.com/news/2011-05-china-drought-affects-million-people.html
2011-05-30,00:25:28,hmuqe,119,Leading world politicians urge 'paradigm shift' on drugs policy.,guardian.co.uk,http://www.guardian.co.uk/world/2011/may/29/drugs-trade-drugs
2011-05-29,12:24:24,hmm6l,91,Foxconn workers in China speak out: Workers complained for weeks about dust that led to deadly explosion,globalpost.com,http://www.globalpost.com/dispatch/news/regions/asia-pacific/china/110527/apple-ipad-china-labor-foxconn
2011-05-29,23:14:50,hmtpz,93,Why China Is Really In Big Trouble  ,blogs.forbes.com,http://blogs.forbes.com/greatspeculations/2010/10/18/why-china-is-really-in-big-trouble/
2011-05-29,16:56:34,hmq4u,83,"""I told you the truth, you don’t like the truth"", Omar Khadr shouts at a Canadian Security Intelligence Service agent. The accused, then aged 16, breaks down: ""Ya Ummi! (Mummy!)"", he cries in Arabic",ipsnews.net,http://ipsnews.net/news.asp?idnews=55819
2011-05-29,16:02:07,hmpj7,68,Iran to create its own Internet,neowin.net,http://www.neowin.net/news/iran-to-create-its-own-internet
2011-05-29,08:23:18,hmi9h,58,Dozens arrested in Russian gay rights rally ,abc.net.au,http://www.abc.net.au/news/stories/2011/05/29/3229838.htm
2011-05-29,23:40:25,hmu15,55,"Malta has voted ""Yes"" in a non-binding referendum on legalising divorce, Prime Minister Lawrence Gonzi has conceded, local media report.",bbc.co.uk,http://www.bbc.co.uk/news/world-europe-13588834
2011-05-29,12:07:26,hmlwu,54,Kindergarten teacher sings songs to kids while guns blaze outside,youtube.com,http://www.youtube.com/watch?v=I7vjig6UlFg
2011-05-29,22:59:14,hmtj1,35,Report: Some areas in China under martial law after protests ,edition.cnn.com,http://edition.cnn.com/2011/WORLD/asiapcf/05/28/china.martial.law/
2011-05-29,23:15:19,hmtq4,40,Here's What's Going To Happen When Greece Defaults - it won't be pretty.,businessinsider.com,http://www.businessinsider.com/heres-whats-going-to-happen-when-greece-defaults-2011-5
2011-05-29,16:43:06,hmpzb,40,"The tobacco giants ruthlessly exploits the developing world - its young, poor and uneducated: The West now consumes fewer of the world's cigarettes, but the developing world's share has risen sharply to 76% in 2009",independent.co.uk,http://www.independent.co.uk/life-style/health-and-families/health-news/the-unstoppable-march-of-the-tobacco-giants-2290583.html
2011-05-30,05:42:35,hn0gu,37,Syria protests escalate over apparent torture and killing of a 13-year-old boy by the security services,ft.com,http://www.ft.com/cms/s/0/730f7f62-8a25-11e0-beff-00144feab49a.html
2011-05-30,01:55:35,hmw7i,38,"Gulf Cooperation Council, a shish kebab of hereditary monarchies, emirates and outright theocracies, sitting on oceans of oil, embark on  internal repression all across the Persian Gulf using Erik Prince's mercenaries and western arms.",atimes.com,http://www.atimes.com/atimes/Middle_East/ME28Ak01.html
2011-05-29,09:27:58,hmjbg,35,"Mexico detains 36 members of La Familia cartel & 10 members of the Zetas drug gang, including suspects in armed attack on police helicopter
",guardian.co.uk,http://www.guardian.co.uk/world/feedarticle/9669747
2011-05-29,09:39:33,hmjhr,24,Arab League seeks UN recognition of Palestine,aljazeera.com,http://aljazeera.com/news/middleeast/2011/05/2011528202911144389.html
2011-05-29,09:04:58,hmiye,27,"Taliban suicide bomber injures top NATO general in Afghanistan, kills Afghan police chief",guardian.co.uk,http://www.guardian.co.uk/world/2011/may/29/markus-kneip-daoud-bomb-nato
2011-05-29,22:56:16,hmthg,21,"Mladic's Crimes Have Shaped The World We Live In --- 
""We have the man who ordered the largest mass murder in Europe since the Second World War and now he will face trial."" It may not be a comfortable experience for European countries. But better this than a corpse lying in a compound",guardian.co.uk,http://www.guardian.co.uk/commentisfree/2011/may/29/srebrenica-massacre-ratko-mladic
2011-05-29,00:03:02,hm9c2,27,Air France Crash Explained,guardian.co.uk,http://www.guardian.co.uk/world/2011/may/27/air-france-crash-inquiry
2011-05-29,13:13:32,hmn2b,25,"In Russia, Prisons for Police Thrive",nytimes.com,http://www.nytimes.com/2011/05/29/world/europe/29prisons.html
2011-05-29,08:39:55,hmijd,22,China declares martial law in parts of the northeast's inner Mongolia autonomous region,cnn.com,http://www.cnn.com/2011/WORLD/asiapcf/05/28/china.martial.law/index.html
2011-05-29,08:09:22,hmi0f,25,Air France crash report shows confused cockpit: tilted nose up to gain speed ,online.wsj.com,http://online.wsj.com/article/SB10001424052702304066504576349112775425674.html?mod=WSJ_hp_LEFTWhatsNewsCollection
2011-05-29,16:06:08,hmpku,22,TEPCO has restored the cooling system of the nuclear reactor and fuel pool at the No. 5 after it stopped working late on Saturday.,af.reuters.com,http://af.reuters.com/article/worldNews/idAFTRE74S0AK20110529
2011-05-29,23:56:32,hmu9u,21,"The Planning Commission of India has set the poverty line at Rs 20 a day. Earn more than that and you are not poor. Oh, and if you live in a village, don’t earn more than Rs 15. The ‘Rich’ Indians Respond",tehelka.com,http://www.tehelka.com/story_main49.asp?filename=hub040611FORTUNE.asp
2011-05-30,02:08:32,hmwfz,15,Police in Mexico say they have killed 11 suspected members of the powerful La Familia drug cartel after a shoot-out at a ranch in western Jalisco state. ,bbc.co.uk,http://www.bbc.co.uk/news/world-latin-america-13586444
2011-05-29,10:43:11,hmkhc,16,Murder of Activists Raises Questions of Justice in Amazon,green.blogs.nytimes.com,http://green.blogs.nytimes.com/2011/05/28/murder-of-amazon-activists-raises-justice-questions/
2011-05-29,21:40:23,hmsog,15,"Islamic militants seize Yemen city, locals say",cnn.com,http://www.cnn.com/2011/WORLD/meast/05/29/yemen.unrest/?hpt=T2
