2011-08-03,17:48:09,j7knd,1758,Police in Sydney are trying to defuse a bomb that has been strapped to a teenage girl,dailytelegraph.com.au,http://www.dailytelegraph.com.au/news/police-are-trying-to-defuse-a-bomb-that-has-been-strapped-to-a-teenage-girl-in-sydneys-exclusive-mosman/story-e6freuy9-1226107599334
2011-08-03,18:12:44,j7l1m,695,Greece to decriminalize drugs.,greece.greekreporter.com,http://greece.greekreporter.com/2011/08/02/decriminalization-of-drug-us/
2011-08-03,22:23:34,j7pau,525,"MP who doggedly hunted News Corp execs was warned by Rebekah Brooks she would pursue him ""for the rest of his life""",guardian.co.uk,http://www.guardian.co.uk/politics/2011/aug/02/tom-watson-phone-hacking
2011-08-03,12:21:36,j7d7y,278,Italy approves draft law to ban burqa ,guardian.co.uk,http://www.guardian.co.uk/world/2011/aug/03/italy-draft-law-burqa
2011-08-03,21:47:01,j7ogs,170,"Randi Zuckberg: ""I think anonymity on the Internet has to go away""",eff.org,https://www.eff.org/deeplinks/2011/08/randi-zuckerberg-runs-wrong-direction-pseudonymity
2011-08-03,20:59:52,j7nl5,164, Israel's secular middle class strikes back --- Protest over housing costs starts to turn into confrontation with the government. Could crack open issue of why so much taxpayers' money is spent supporting unproductive ultra-Orthodox,guardian.co.uk,http://www.guardian.co.uk/commentisfree/2011/aug/02/israel-middle-class-uprising
2011-08-03,00:50:02,j6s07,134,Seeing North Korea from the Inside,theatlantic.com,http://www.theatlantic.com/infocus/2011/08/inside-north-korea/100119/
2011-08-03,16:10:31,j7iyo,130,Chinese agency downgrades U.S. credit rating,cnn.com,http://www.cnn.com/2011/BUSINESS/08/02/china.us.rating/index.html
2011-08-03,10:34:00,j7a4w,97,"Ex-soldiers sentenced to 6,000 years in prison for Guatemalan massacre",edition.cnn.com,http://edition.cnn.com/2011/WORLD/americas/08/02/guatemala.human.rights.trial/index.html
2011-08-03,23:43:34,j7rfn,89,"Saudi Arabian lawmakers have put a draft law before the Shura Council that would ""in effect criminalise legitimate dissent.""",economist.com,http://www.economist.com/node/21524853?partner=rss&emc=rss
2011-08-04,05:22:10,j82wu,84,Ukraine to save bears from forced vodka drinking,msnbc.msn.com,http://www.msnbc.msn.com/id/43999740/ns/world_news-europe/
2011-08-04,05:33:31,j83aq,81,FINALLY! U.N. Security Council condemns Syria over crackdown,washingtonpost.com,http://www.washingtonpost.com/world/middle-east/syrian-troops-tanks-push-into-hama/2011/08/03/gIQAoZpsrI_story.html
2011-08-03,08:20:39,j76cz,74,The Audacity of the World Ignoring Somalia,nytimes.com,http://www.nytimes.com/2011/08/02/world/africa/02somalia.html?_r=1&ref=world
2011-08-04,06:00:15,j846z,73,NATO investigates BBC reporter's death in Afghanistan. A local news agency has suggested he was killed by US troops.,bbc.co.uk,http://www.bbc.co.uk/news/world-south-asia-14365228
2011-08-03,23:19:17,j7qqw,56,Paralysed woman's tries to claim £6m damages from friend's father after getting drunk and diving into the shallow end of his pool. Fails.,guardian.co.uk,http://www.guardian.co.uk/uk/2011/aug/03/paralysed-woman-pool-damages-claim
2011-08-03,18:40:38,j7lhy,47,"Deforestation in Brazil's Amazon accelerated in June, with over 300 sq kilometers destroyed, a 17% increase over the previous month",physorg.com,http://www.physorg.com/news/2011-08-amazon-deforestation-brazil.html
2011-08-03,10:10:00,j79h4,34,One of our islands is missing,guardian.co.uk,http://www.guardian.co.uk/artanddesign/2011/aug/02/missing-inflatable-island-secret-garden
2011-08-03,16:36:48,j7jg1,35,Egypt: Trial of ex-President Hosni Mubarak to open,bbc.co.uk,http://www.bbc.co.uk/news/world-middle-east-14382997
2011-08-03,19:06:29,j7lv2,37,"Head of Radioisotope Center at University of Tokyo, Prof. Kodama, testifies on how serious Fukushima fallout really is",youtube.com,http://www.youtube.com/watch?v=Dlf4gOvzxYc
2011-08-04,03:14:49,j7yja,27,"As Italy Crumbles, Berlusconi Hosts Another Bunga Bunga Party",businessinsider.com,http://www.businessinsider.com/italy-berlusconi-bunga-bunga-2011-8
2011-08-03,21:32:14,j7o6s,26,"Syrian tanks occupy main Hama square, shell city-residents and besiege protest hubs --- ""All communications have been cut off. The regime is using the media focus on the Hosni Mubarak trial to finish off Hama,"" one of the residents told Reuters ",english.alarabiya.net,http://english.alarabiya.net/articles/2011/08/03/160648.html
2011-08-03,08:46:21,j772f,26,"Saudi Arabia's Kingdom Holding Co., run by billionaire Prince Alwaleed bin Talal, said its associate firm, Jeddah Economic Co., had signed a 4.6 billion Saudi riyal ($1.23 billion) deal with Bin Laden Group to build the world's tallest tower in Jeddah",online.wsj.com,http://online.wsj.com/article/SB10001424053111903341404576483540742054836.html?mod=googlenews_wsj
2011-08-04,00:57:23,j7trw,19,"Poll: Muslims, atheists most likely to reject violence",rawstory.com,http://www.rawstory.com/rs/2011/08/03/poll-muslims-atheists-most-likely-to-reject-violence/
2011-08-03,23:41:16,j7rda,19,"Cull of 30,000 pet dogs ordered after deadly rabies outbreak in Chinese city of Jiangmen but experts say plan unscientific and inhumane",guardian.co.uk,http://www.guardian.co.uk/world/2011/aug/03/chinese-city-bans-pet-dogs
2011-08-03,21:25:56,j7o2p,20,"Rape as a Weapon of War: Men Suffer, Too - Global Spin - TIME.com",globalspin.blogs.time.com,http://globalspin.blogs.time.com/2011/08/03/rape-as-a-weapon-of-war-men-suffer-too/
2011-08-04,07:13:02,j86jj,17,"Interview with an Utøya survivor - "" 'This is police, you're safe.' That's the trick he used. """,channel4.com,http://www.channel4.com/news/norway-exclusive-i-survived-by-hiding-in-a-tree
2011-08-04,04:24:32,j80xo,19,"Facebook facial recognition software violates privacy laws, says Germany ",guardian.co.uk,http://www.guardian.co.uk/technology/2011/aug/03/facebook-facial-recognition-privacy-germany?utm_source=twitterfeed&utm_medium=twitter
2011-08-04,02:57:45,j7xxf,20,"""I have always been interested in physics and chemistry,"" Handl said, adding he just wanted to ""see if it's possible to split atoms at home.""",hosted.ap.org,http://hosted.ap.org/dynamic/stories/E/EU_SWEDEN_NUCLEAR?SITE=AP&SECTION=HOME&TEMPLATE=DEFAULT&CTIME=2011-08-03-11-33-45
2011-08-03,20:06:02,j7mpx,16,Captured Zeta Leader: We’ve Purchased Weapons From The “U.S. Government Itself”,soaw.org,http://www.soaw.org/category-table/3729-captured-zeta-leader-weve-purchased-weapons-from-the-us-government-itself
2011-08-03,12:31:08,j7dhx,15,Baader-Meinhof terrorist may have worked for the East German secret police Stasi,guardian.co.uk,http://www.guardian.co.uk/world/2011/aug/01/baader-meinhof-gang-founder-stasi
