2011-01-06,09:55:26,ewyt3,1506,Italy becomes the first country to ban plastic bags nationwide!,greenbiz.com,https://www.greenbiz.com/news/2011/01/05/italy-dumps-plastic-bags-world-first-nationwide-ban
2011-01-06,23:18:42,ex9wy,204,Five Myths About the Chinese Communist Party,foreignpolicy.com,http://www.foreignpolicy.com/articles/2011/01/02/5_myths_about_the_chinese_communist_party
2011-01-06,09:34:40,ewyfh,101,The little red book that swept France:  The latest call to (non-violent) arms has turned a 93-year-old war hero into a publishing phenomenon.,independent.co.uk,http://www.independent.co.uk/news/world/europe/the-little-red-book-that-swept-france-2174676.html
2011-01-06,21:16:29,ex80e,87,Furore over 'censored' edition of Huckleberry Finn,bbc.co.uk,http://www.bbc.co.uk/news/world-us-canada-12126700
2011-01-07,07:34:06,exjyo,66,"Together, Slim, Gates, Buffett, and Ambani control more wealth than the world's poorest 57 countries. ",foreignpolicy.com,"http://www.foreignpolicy.com/articles/2011/01/02/unconventional_wisdom?page=0,8"
2011-01-06,23:59:52,exapb,55,China hiding military build-up: WikiLeaks,abc.net.au,http://www.abc.net.au/news/stories/2011/01/07/3107956.htm
2011-01-06,21:48:38,ex8f9,57,Population 7 Billion - By 2045 global population is projected to reach nine billion. Can the planet take the strain?,ngm.nationalgeographic.com,http://ngm.nationalgeographic.com/2011/01/seven-billion/kunzig-text
2011-01-06,23:12:56,ex9tg,51,"Israelis bribed to admit U.S. goods to Gaza: WikiLeaks
| Reuters",r.reuters.com,http://r.reuters.com/myw94r
2011-01-06,21:37:07,ex8a0,45,The slow death of tolerance in Egypt | guardian.co.uk,guardian.co.uk,http://www.guardian.co.uk/commentisfree/2011/jan/05/egypt-coptic-tolerance-alexandria
2011-01-06,18:04:16,ex63m,30,Why Bradley Manning is fighting for his sanity,thefirstpost.co.uk,"http://www.thefirstpost.co.uk/73357,news-comment,news-politics,alexander-cockburn-why-bradley-manning-is-fighting-for-his-sanity-wikileaks-julian-assange"
2011-01-06,22:51:31,ex9ev,27,"The damaged blow out preventer from oil rig
Ripples of Deepwater Horizon are felt around the world. The Presidential panel's report examining Deepwater warns a disaster is likely to happen again without significant change in industry practice and government policies. ",marketplace.publicradio.org,http://marketplace.publicradio.org/display/web/2011/01/06/am-ripples-of-deepwater-horizon-are-felt-around-the-world/
2011-01-06,19:12:49,ex6rs,23,"Doing the terrorists’ dirty work for them --  ""Swedish society itself is pursuing what was surely one of the aims of the failed Islamist militants: to instil a sense of insecurity and paranoia across society""",swedishwire.com,http://www.swedishwire.com/opinion/7979-doing-the-terrorists-dirty-work-for-them
2011-01-07,01:06:12,exc0h,27,The day Julian Assange threatened to sue The Guardian over the US embassy cables story | Media | guardian.co.uk,guardian.co.uk,http://www.guardian.co.uk/media/greenslade/2011/jan/06/wikileaks-julian-assange
2011-01-07,00:40:23,exbjq,22,Romania tries to tackle its recession by forcing its witches to pay income taxes. ,globalpost.com,http://www.globalpost.com/dispatch/europe/110105/romania-witches-must-pay-taxes
2011-01-06,20:11:13,ex7c2,20,"Pakistan's very unhappy new year — Cut off from IMF funding, civil unrest, terrorism, hyper-inflation, daily assassinations of Pakistanis by drones, war.....",bbc.co.uk,http://www.bbc.co.uk/news/world-south-asia-12110235
2011-01-07,07:00:53,exjby,18,"Mossad's new director says that a military attack on Iran's nuclear facilities would be counterproductive and would exact an enormous diplomatic, economic and military price.",jpost.com,http://www.jpost.com/MiddleEast/Article.aspx?id=202562
2011-01-07,03:42:47,exf82,16,"Increased numbers of policemen are being deployed in transport hubs across London, UK amidst fears of a terrorist attack taking place in the next few days.",news.sky.com,http://news.sky.com/skynews/Home/UK-News/Sky-Sources-Say-Increased-Numbers-Of-Police-Deployed-At-Transport-Hubs-In-London-Area/Article/201101115883344
2011-01-07,04:16:44,exfxl,17,Anonymous joins Tunisian activists to call for end to the government's stifling of online dissent,english.aljazeera.net,http://english.aljazeera.net/indepth/features/2011/01/20111614145839362.html
2011-01-06,22:25:46,ex8yb,14,"Food Price Surge Puts Strain On India's Poor
",npr.org,http://www.npr.org/2011/01/06/132684170/food-price-surge-puts-strain-on-indias-poor
2011-01-07,05:36:55,exhmn,14,Ivory Coast: Gbagbo 'expels UK and Canada envoys',bbc.co.uk,http://www.bbc.co.uk/news/world-africa-12132835
2011-01-06,08:20:31,ewx6b,14,UK students to launch new wave of protests ,peoplesworld.org,http://www.peoplesworld.org/uk-students-to-launch-new-wave-of-protests/
2011-01-07,03:16:23,exeoj,13,WikiLeaks XXVIII: Organized Crime Squeezing the Life Out of Bulgaria,fpif.org,http://www.fpif.org/blog/wikileaks_xxviii_organized_crime_squeezing_the_life_out_of_bulgaria
2011-01-06,01:02:50,ewojk,13,Saudi Arabia 'detains' Israeli vulture for spying,bbc.co.uk,http://www.bbc.co.uk/news/world-middle-east-12120259
2011-01-07,02:13:07,exdeb,11,"""Taseer died for the Christians and now we are feeling broke and scared. If they can kill the governor of Punjab then who am I?""",guardian.co.uk,http://www.guardian.co.uk/world/2011/jan/06/aasia-bibi-salmaan-taseer-assassination
2011-01-06,23:12:53,ex9te,13,Pakistan's government nears collapse again,globalpost.com,http://www.globalpost.com/dispatch/pakistan/110105/pakistan-government-crisis-salman-taseer
2011-01-06,20:42:33,ex7n0,12,Iranian customs agents arrest a 55-year-old woman they claim to be an American spy.,cnn.com,http://www.cnn.com/2011/WORLD/meast/01/06/iran.american.arrest/index.html?eref=rss_topstories&utm_source=feedburner&utm_medium=feed&utm_campaign=Feed%3A+rss%2Fcnn_topstories+%28RSS%3A+Top+Stories%29
2011-01-07,03:11:09,exekp,11,Tortured after speaking with U.N. reporter,savetibet.org,http://savetibet.org/media-center/ict-news-reports/fears-life-tibetan-political-prisoner-tortured-after-speaking-un-rapporteur
2011-01-06,23:43:18,exae2,8,The Dubai Job,gq.com,http://www.gq.com/news-politics/big-issues/201101/the-dubai-job-mossad-assassination-hamas?printable=true
2011-01-06,14:52:48,ex3w2,10,Tastes Like Repression: Inside the Global Chain of North Korean Restaurants,takepart.com,http://www.takepart.com/news/2011/01/05/tastes-like-repression-inside-the-global-chain-of-north-korean-restaurants
2011-01-06,12:50:06,ex1wi,8,Pakistan: Death of a liberal  ,economist.com,http://www.economist.com/blogs/newsbook/2011/01/pakistan
