2011-01-29,08:54:24,fb2vl,2550,The most AMAZING video on the internet. Listen to the man at 0:45 seconds.,youtube.com,http://www.youtube.com/watch?v=ThvBJMzmSZI&feature=player_embedded#
2011-01-30,07:36:35,fbjq7,558,Lone Nepali Soldier Defends Potential Rape Victim Against *40* Men,logiccool.com,http://www.logiccool.com/blog/591281-lone-nepali-soldier-defends-potential-rape-victim-against-40-men/
2011-01-29,11:29:24,fb58m,281,"Al Jazeera shines in protest coverage: 
Middle East network applauded for covering protests despite obstacles. ",nytimes.com,http://www.nytimes.com/2011/01/29/world/middleeast/29jazeera.html?_r=1&partner=rss&emc=rss
2011-01-30,00:30:02,fbdak,272,'This is the Arab world's Berlin Wall moment',guardian.co.uk,http://www.guardian.co.uk/world/2011/jan/29/egypt-protests-government-live-blog
2011-01-29,17:56:28,fb9l6,251,Huge anti-government protest in Albania,heraldsun.com.au,http://www.heraldsun.com.au/ipad/anti-government-protest-in-albania/story-fn6s850w-1225996491961
2011-01-29,17:41:17,fb9gh,207,When the former president of Tunisia left he took 1.5 tons of gold with him. That's 58.5 million dollars worth of gold. What a dick.,koreatimes.co.kr,http://www.koreatimes.co.kr/www/news/opinon/2011/01/137_80292.html
2011-01-30,03:36:12,fbg4a,204,"The goal of the protesters in Egypt seems to be to oust dictator Mubarak, and I say we help them by not dropping this issue until he is gone or they give up.  Thanks Reddit World News for being a great source of information on this situation!!",self.worldnews,https://www.reddit.com/r/worldnews/comments/fbg4a/the_goal_of_the_protesters_in_egypt_seems_to_be/
2011-01-29,17:20:04,fb9a1,187,"53 dead in Egypt protests on Saturday, 23 in 
Alexandria, 15 in Suez and 15 in Cairo.",i.imgur.com,http://i.imgur.com/xJqUl.jpg
2011-01-29,22:48:56,fbc2p,179,"Egypt protests: protesters defy curfew in Cairo: Tens of thousands of demonstrators remain on the streets of Egypt's major cities, despite a curfew",bbc.co.uk,http://www.bbc.co.uk/news/world-middle-east-12314799
2011-01-29,14:36:31,fb7s7,176,"Incredible video footage showing Cairo demonstrators taking control of bridge, pushing back police",youtube.com,http://www.youtube.com/watch?v=t4OSMFYc9Mc&feature=player_embedded
2011-01-30,00:14:02,fbd2x,131,"""The oligarchs in the royal palaces of the Arab world have long lost touch with the realities of their countries and are not aware of the needs of their people. And these are, after all, strikingly simple: Can I pay for my bread? Can I find work? What are my personal prospects?""",blog.nj.com,http://blog.nj.com/dr_aref_assaf/2011/01/egypt_awakens.html
2011-01-29,22:20:06,fbbr9,124,"Egypt police open fire on protesters at ministry:  Al Jazeera TV
| Reuters",reuters.com,http://www.reuters.com/article/2011/01/29/us-egypt-ministry-idUSTRE70S1VA20110129
2011-01-29,21:50:04,fbbf6,111,"Without Egypt, Israel will be left with no friends in Mideast",haaretz.com,http://www.haaretz.com/news/diplomacy-defense/without-egypt-israel-will-be-left-with-no-friends-in-mideast-1.339926
2011-01-29,22:04:50,fbbkj,113,"New student protests in England - Nobody rioting, so little coverage...",bbc.co.uk,http://www.bbc.co.uk/news/education-12315841
2011-01-29,10:25:35,fb4b4,80,This is the Wikileaks document revealing the American government is backing protesters behind the Egypt uprising,telegraph.co.uk,http://www.telegraph.co.uk/news/worldnews/africaandindianocean/egypt/8289698/Egypt-protests-secret-US-document-discloses-support-for-protesters.html
2011-01-30,00:06:33,fbczs,59,"""The Israeli-Egyptian peace treaty is the pillar of the structure in the Middle East,"" said Edward P. Djerejian, a former American ambassador to Israel and Syria. ""If the '79 agreement goes asunder, everything falls apart. Everything falls apart.""",nytimes.com,http://www.nytimes.com/2011/01/30/weekinreview/30cooper.html
2011-01-29,11:26:24,fb572,59,"Egypt has arrested over 1000: 
UN human rights chief calls for lifting of emergency law, free use of social networks",af.reuters.com,http://af.reuters.com/article/egyptNews/idAFLDE70R1NG20110128
2011-01-29,00:18:54,fasmy,52,Biden: Mubarak Should Not Step Down - Biden...said President Hosni Mubarak should not step down and downplayed the protests spreading across the Mideast as generally unconnected. ,foxnews.com,http://www.foxnews.com/politics/2011/01/28/biden-mubarak-step/
2011-01-30,01:39:49,fbe9r,51,World Watches Al Jazeera To See What Happens Next In Egypt ,crooksandliars.com,http://crooksandliars.com/susie-madrak/world-watching-al-jazeera-see-what-ha
2011-01-29,19:15:37,fba86,43,Egypt: Mubarak fails to quell riots -- Neither Mubarak's words nor tanks stop angry demonstrators calling for his ouster.,globalpost.com,http://www.globalpost.com/dispatch/egypt/110128/egypt-mubarak-riots-continue
2011-01-29,14:21:50,fb7m4,40,"The Egypt Protests...WARNING: SOME IMAGES ARE GRAPHIC. Images 21-23 depict Mohamad Atef, the man whose death was recorded on video",totallycoolpix.com,http://totallycoolpix.com/2011/01/the-egypt-protests/?sms_ss=facebook&at_xt=4d43a83ce2d138d1%2C0
2011-01-30,00:34:59,fbdd2,35,"White House wobbles on Egyptian tightrope - While the US favours Egyptian political reform in theory, in practice it props up an authoritarian system for pragmatic reasons of national self-interest.",guardian.co.uk,http://www.guardian.co.uk/commentisfree/cifamerica/2011/jan/28/obama-clinton-wobble-egypt-mubarak
2011-01-29,19:55:56,fbaie,33,"France has maintained its ban on gay marriage, with a constitutional court ruling that a lesbian couple with four children do not have the right to tie the knot.",abc.net.au,http://www.abc.net.au/news/stories/2011/01/29/3124802.htm?section=justin
2011-01-29,15:11:45,fb86w,26,China Blocks 'Egypt' on Top Twitter-Like Service - CBS News,cbsnews.com,http://www.cbsnews.com/stories/2011/01/28/tech/main7295643.shtml
2011-01-30,06:05:47,fbica,30,Dutch freeze contacts with Iran over hanging: The Dutch government has frozen all contacts with Iran in protest over the hanging of a Dutch-Iranian woman.,bbc.co.uk,http://www.bbc.co.uk/news/world-middle-east-12317138
2011-01-30,01:50:44,fbefp,23,"ElBaradei says protests 'will continue until Mubarak falls' - ""I will go back into the streets today with my colleagues to contribute to bringing change and to tell President Mubarak that he must go,"" Mr ElBaradei said.",thenational.ae,http://www.thenational.ae/news/worldwide/middle-east/elbaradei-says-protests-will-continue-until-mubarak-falls
2011-01-29,12:10:47,fb5uf,22,No-one is talking about this? Egyptians Protesters  themselves guard their National Museum from would be looters.,msnbc.msn.com,http://www.msnbc.msn.com/id/21134540/vp/41315508#41321626
2011-01-29,08:35:06,fb2l0,23,The U.S. needs to break with Mubarak now,washingtonpost.com,http://www.washingtonpost.com/wp-dyn/content/article/2011/01/28/AR2011012805399.html
2011-01-30,06:09:45,fbiea,21,"""Current revolts destroyed the claim that only the Islamist movement had the power to challenge the state. A spontaneous non-ideological citizen's uprising accomplished in days what Islamist movements have failed to accomplish in decades.""",latimesblogs.latimes.com,http://latimesblogs.latimes.com/babylonbeyond/2011/01/arab-world-how-tunisia-revolution-changed-politics-of-egypt-and-region-.html
2011-01-30,01:24:24,fbe1f,17,Egyptian Museum looted.,australianetworknews.com,http://australianetworknews.com/stories/201101/3124952.htm?desktop
