2011-03-26,02:30:19,gbg3r,1257,"Canadian Non-confidence vote passes, Canadians are headed to the polls",cbc.ca,http://www.cbc.ca/news/politics/story/2011/03/25/pol-defeat.html
2011-03-26,23:44:28,gbz8g,987,"India has allowed the right to euthanasia because of an extreme case where a young girl was strangled into unconsciousness with a dog chain while being raped. She was plunged into a vegetative state from which she never recovered. Thirty-seven years later, the courts say she could be allowed to die.",globalpost.com,http://www.globalpost.com/dispatch/news/regions/asia-pacific/india/110311/india-euthanasia-right-to-die
2011-03-26,16:14:57,gbuhw,777,"Japan: The students and teachers at Ookawa school knew what to do when the tsunami warning sounded. But they never thought it would happen to them, so they didn't go to higher ground and drowned. ",globalpost.com,http://www.globalpost.com/dispatch/news/regions/asia-pacific/japan/110324/japan-ookawa-tsunami-earthquake
2011-03-26,03:46:36,gbhxm,443,"Britons reclaim their common law rights under the Magna Carta, seize courtroom and arrest corrupt judge. FREEEEEDOM!!!",youtube.com,http://www.youtube.com/watch?v=gl5qVTWHf8c
2011-03-26,19:24:34,gbw76,210,"Pro-democracy protests in Jordan turn violent as government-hired thugs and security forces attack the protest camp, leaving over a hundred injured and one dead",globalpost.com,http://www.globalpost.com/dispatch/news/regions/middle-east/jordan/110325/jordan-protests-middle-east-libya-syria-egypt-video
2011-03-27,08:54:14,gc7mi,159,"""... a young Palestinian activist told me that his friends were feeling more positive toward the US than they had in years because of the military action in Libya. ""It's on Al-Jazeera all the time,"" he said""",swampland.blogs.time.com,http://swampland.blogs.time.com/2011/03/26/god-bless-america-jazeera/
2011-03-26,17:41:54,gbv9s,158,Libyan rebels take control of city of Ajdabiya from government after coalition warplanes pound pro-Gaddafi forces,english.aljazeera.net,http://english.aljazeera.net//news/africa/2011/03/201132681812362552.html
2011-03-26,22:06:31,gbxuf,117,"Tons of relief goods have been delivered to victims of Japan's catastrophic earthquake and tsunami from a dark corner of society: the ""yakuza"" organized crime networks.",reuters.com,http://www.reuters.com/article/2011/03/25/us-yakuza-idUSTRE72O6TF20110325
2011-03-26,13:11:05,gbs66,72,Levels of radioactive materials soaring in sea near nuke plant,english.kyodonews.jp,http://english.kyodonews.jp/news/2011/03/81163.html
2011-03-27,06:47:39,gc5ke,67,"""Papers please"" ruled unconstitutional in Ireland",irishtimes.com,http://www.irishtimes.com/newspaper/ireland/2011/0326/1224293137939.html
2011-03-27,00:03:37,gbzjd,54,"200,000 people across Germany take to the streets to protest nuclear power",google.com,http://www.google.com/hostednews/ap/article/ALeqM5gERVTdp3OjRBov_5Gct4pCss1H-g
2011-03-27,08:48:11,gc7ir,52,Hamas states that it will agree to a ceasefire if Israel stops attacking the Gaza Strip. ,bbc.co.uk,http://www.bbc.co.uk/news/world-middle-east-12872588?utm_medium=twitter&utm_source=twitterfeed
2011-03-27,05:26:56,gc48l,52,"Today, an estimated 250k gathered to marched on London to protest against the spending cuts. Right now a hardcore are taking on big business and the police and taking direct action.",youtube.com,http://www.youtube.com/watch?v=sUYrIr_l8UA&feature=player_embedded
2011-03-27,00:58:32,gc0fw,51,"Microsoft Compromises Users’ Privacy: No HTTPS in Arab Countries, Iran",advocacy.globalvoicesonline.org,http://advocacy.globalvoicesonline.org/2011/03/25/microsoft-compromises-users-privacy-no-https-in-arab-countries-iran/
2011-03-26,08:06:42,gbnc5,46,"Now hospitalized Japanese nuclear plant workers were exposed to ""2 to 6 Sievert"" of radiation after stepping in a puddle of radioactive water",nytimes.com,https://www.nytimes.com/2011/03/26/world/asia/26japan.html?_r=1
2011-03-27,08:51:22,gc7l0,41,"The three workers who recently received radiation burns at the Fukushima Daiichi plant were  low-paid and poorly trained temporary employees. Two of them were not wearing high boots, and their feet and ankles sustained radiation burns from the contaminated water.",wsws.org,http://wsws.org/articles/2011/mar2011/japa-m26.shtml
2011-03-26,14:16:34,gbt3d,43,"UN: One million flee Cote d'Ivoire violence - West African country ""close to civil war"", UN hears, while humanitarian officials warn of ""massive displacement"".",english.aljazeera.net,http://english.aljazeera.net/news/africa/2011/03/20113251588449258.html
2011-03-27,02:29:33,gc0yu,40,Is Syria reaching the point of no return?,haaretz.com,http://www.haaretz.com/blogs/mess-report/is-syria-reaching-the-point-of-no-return-1.351893
2011-03-27,06:10:54,gc4zu,39,A gun was pointed at Sky News after a woman tried to tell foreign journalists about being raped and tortured by Libyan officials,news.sky.com,http://news.sky.com/skynews/Home/World-News/Sky-News-Sees-A-Woman-Bundled-Away-By-Minders-From-Tripoli-Hotel-After-Allegedly-Being-Raped/Article/201103415960663?lpos=World_News_Carousel_Region_2&lid=ARTICLE_15960663_Sky_News_Sees_A_Woman_Bundled_Away_By_Minders_From_Tripoli_Hotel_After_Allegedly_Being_Raped
2011-03-26,20:34:31,gbwuz,36,Mass protest against spending cuts breaks out in London,news.xinhuanet.com,http://news.xinhuanet.com/english2010/world/2011-03/26/c_13799529.htm
2011-03-26,20:37:20,gbww5,36,Growing unrest on island of prisoners in Australia,news.xinhuanet.com,http://news.xinhuanet.com/english2010/world/2011-03/26/c_13799521.htm
2011-03-27,08:24:50,gc74v,34,"Canadians Protest in Montreal Demanding Immediate Actions Against The Violation of Human Rights in Bahrain, Libya, Yemen, and Saudi Arabia",youtube.com,http://www.youtube.com/watch?v=z2EMklHlOZ0
2011-03-26,22:48:24,gbyfh,26,Libyan Woman Struggles to Tell Media of Her Rape,nytimes.com,http://www.nytimes.com/2011/03/27/world/middleeast/27tripoli.html?_r=2&partner=rss&emc=rss
2011-03-27,05:46:52,gc4kl,29,March 26 - Libyan rebels reclaim Brega,abc.net.au,http://www.abc.net.au/news/stories/2011/03/27/3174745.htm?section=world
2011-03-26,12:12:50,gbr9e,27,"Japan faces new setback in fight to avert disaster at Fukushima plant: Prime minister urges vigilance after safety officials said break in nuclear reactor may have caused big radiation leak
",guardian.co.uk,http://www.guardian.co.uk/world/2011/mar/25/japan-disaster-fukushima-plant-nuclear
2011-03-26,20:48:06,gbwz8,26,Libya rebels recapture key town,bbc.co.uk,http://www.bbc.co.uk/news/world-africa-12869658
2011-03-26,19:46:48,gbweu,16,"Pro-union, anti-cut protest kicking off now in London! Over 100k so far, 450k expected by police!",bbc.co.uk,http://www.bbc.co.uk/news/uk-12864353
2011-03-26,17:03:59,gbuyo,17,"Crowd-sourced realtime radiation monitoring in Japan - in 3D, requires Google Earth plugin",community.pachube.com,http://community.pachube.com/node/611#3d
2011-03-27,06:28:13,gc59m,13,Researcher warned 2 yrs ago of massive tsunami striking nuke plant,english.kyodonews.jp,http://english.kyodonews.jp/news/2011/03/81265.html
2011-03-26,00:16:19,gbcq2,19,"Japan Virtually Admits MOX Reactor 3 Breached,  Releasing Plutonium",nytimes.com,http://www.nytimes.com/2011/03/26/world/asia/26japan.html
