2011-02-05,05:30:11,fffxg,1225,"Muslim Brotherhood tells Iran’s Islamic Leader Khamenai this is ""People's Revolution"" not an ""Islamic Revolution"" ",enduringamerica.com,http://www.enduringamerica.com/home/2011/2/4/egypt-and-beyond-liveblog-a-big-day-and-not-just-in-cairo.html#
2011-02-05,18:03:09,ffqbb,772,Al Jazeera has tried to leverage its visibility on Twitter with Promoted Tweets and a Promoted Trending Topic to get into one place that's harder to access than Egypt - U.S. TV markets. It wants entrance into a market that has largely shut it out for mostly unspecified reasons.,readwriteweb.com,http://www.readwriteweb.com/archives/how_al_jazeera_is_using_promoted_tweets_trends_to.php
2011-02-05,22:44:01,ffsrf,537,"WikiLeaks cables: millions in overseas aid to Africa 
was embezzled",telegraph.co.uk,http://www.telegraph.co.uk/news/worldnews/wikileaks/8304640/WikiLeaks-cables-millions-in-overseas-aid-to-Africa-was-embezzled.html
2011-02-05,00:38:57,ff9qb,501,Kiev attempts to criminalize underwear exhibition on one's own balcony.  Topless protesters fight back (NSFW),dailypicksandflicks.com,http://dailypicksandflicks.com/2011/02/02/cute-activists-go-topless-to-protest-bizarre-law-video/
2011-02-05,19:47:53,ffr4i,459,"Israel wants to hire PR firms in 10 countries to improve its reputation. Norwegian PR firms have refused.
",theforeigner.no,http://theforeigner.no/pages/news/updated-pr-firms-drop-israeli-image-campaign/
2011-02-05,21:25:46,ffrz6,391,"""American commentators in general, view the revolution as all about the United States and Israel. It's almost as if the Egyptians don't matter.""",youtube.com,http://www.youtube.com/watch?v=62UXBr6wqAA
2011-02-06,07:42:23,fg0pm,322,Egyptian Security Forces Shoot an Unarmed Man in Cold Blood (Warning: Graphic Video) ,frequency.com,http://www.frequency.com/video/x/2451344
2011-02-05,21:35:31,ffs2c,230,2 Detained Reporters in Egypt Witnessed Secret Police’s Methods Firsthand - NYTimes.com,nytimes.com,http://www.nytimes.com/2011/02/06/weekinreview/06held.html/?_r=1&pagewanted=all
2011-02-05,20:56:08,ffrpq,211,"Why the Egyptian Army Won’t Shoot Protesters: ""My monthly wage is 1,100 Egyptian pounds (188 dollars)... No one can afford to live on these wages.""",ipsnews.net,http://www.ipsnews.net/news.asp?idnews=54323
2011-02-05,20:38:34,ffrjl,138,Chevron resorts to intimidation tactics: Its lawyers have threatened the trial judge overseeing the  environmental trial where the company faces a potential judgment in the billions of dollars,prnewswire.com,http://www.prnewswire.com/news-releases/amazon-defense-coalition-chevron-threatened-ecuador-judge-with-prison-time-if-he-failed-to-grant-their-motions-court-papers-say-115208834.html
2011-02-05,12:30:10,ffmg8,116,Drop the Case Against Assange: Prosecution of WikiLeaks would badly damage the US' credibility in claiming to be a vital advocate of an open global Internet,foreignpolicy.com,http://www.foreignpolicy.com/articles/2011/02/04/drop_the_case_against_assange
2011-02-05,15:44:02,ffoz4,97,Natural gas pipeline from Egypt to Israel attacked.,uk.reuters.com,http://uk.reuters.com/article/2011/02/05/egypt-israel-gas-idUKLDE71401720110205
2011-02-06,04:43:27,ffy6d,72,UN condemns Israeli destruction of Palestinian water systems,imemc.org,http://www.imemc.org/article/60580
2011-02-05,22:04:53,ffsbx,56,China has a water shortage due to pollution and population. They're hoping to solve it with massive desalination plants. ,tinygreenbubble.com,http://www.tinygreenbubble.com/eco/environmental/item/1448-china-seeks-to-solve-water-shortage-with-desalination-plant
2011-02-06,00:58:14,ffuk2,48,"Erdogan tells Mubarak to step down, offering Turkey's own political model as a way forward",globalpost.com,http://www.globalpost.com/dispatch/egypt/110204/turkey-egypt-erdogan-mubarak
2011-02-05,12:59:17,ffmvf,40,Pro-Mubarak protestor claims he was recruited from prison by an Egyptian official.,observers.france24.com,http://observers.france24.com/content/20110204-i-was-paid-5000-pounds-wreak-havoc-cairo-protests-egypt-mubarak-baltgias
2011-02-05,15:03:49,ffoj7,43,"""What a pathetic old brute Mubarak has become, telling ABC that he'd love to give up power, really he would, but he's afraid Egypt would collapse into chaos without his steady hand at the wheel..."" ",reason.com,http://reason.com/archives/2011/02/04/go-down-pharaoh
2011-02-05,03:47:26,ffds9,38,"Egypt bans ex-officials from leaving country, freezes bank accounts - Egyptian Attorney General takes measures against several senior businessmen and political figures amid massive protests charging the government with corruption.",haaretz.com,http://www.haaretz.com/news/international/egypt-bans-ex-officials-from-leaving-country-freezes-bank-accounts-1.341313
2011-02-05,21:54:17,ffs8i,31,"Daily Kos: Seriously, Israel. Media. Bloggers. wtf?",dailykos.com,"http://www.dailykos.com/storyonly/2010/8/18/894295/-Seriously,-Israel.Media.Bloggers.wtf"
2011-02-05,11:03:40,ffl97,34,Scott Horton: The reason why Mubarak is trying to squeeze a few more months out of his 3-decade career in office and avowing his intentions to stay in Egypt rather than packing for the Riviera,foreignpolicy.com,http://www.foreignpolicy.com/articles/2011/02/02/gimme_shelter?page=full
2011-02-05,19:51:35,ffr5j,25,Mubarak's Third force terror tactic: unleashing his 'personal' thugs in a failed attempt to silence protestors seeking an end to his regime,english.aljazeera.net,http://english.aljazeera.net/indepth/opinion//2011/02/201123164851963387.html
2011-02-06,00:04:52,fftsl,23,Democracy Now: Live Coverage On Egypt,democracynow.org,http://www.democracynow.org/
2011-02-05,23:09:39,fft2t,15,"List of Human Rights Activist still missing in Egypt, likely in the hands of Secret Police.",arabist.net,http://www.arabist.net/blog/2011/2/5/in-the-hands-of-the-secret-police.html
2011-02-05,08:34:58,ffj17,16,Gaza feeds hungry Egyptian troops in role reversal | Underground tunnels generally used to smuggle goods into Gaza are moving traffic in the opposite direction in the wake of the popular uprising in Egypt.,haaretz.com,http://www.haaretz.com/news/diplomacy-defense/gaza-feeds-hungry-egyptian-troops-in-role-reversal-1.341316
2011-02-06,02:19:45,ffvus,16,BBC News - Egypt unrest: Hosni Mubarak must stay - US envoy,bbc.co.uk,http://www.bbc.co.uk/news/world-us-canada-12374753
2011-02-05,18:41:49,ffqmo,12,Laos Hmong leader Vang Pao denied Arlington burial,bbc.co.uk,http://www.bbc.co.uk/news/world-asia-pacific-12371965
2011-02-05,10:46:05,ffl0q,16,Global Food Prices Hit New Record High: amid fears that the escalating cost of bread and meat is adding to the turmoil in the Middle East. ,telegraph.co.uk,http://www.telegraph.co.uk/finance/economics/8300590/Global-food-prices-hit-new-record-high.html
2011-02-06,02:38:57,ffw7b,13,"Reuters: Al Arabiya television has retracted its report that President Hosni Mubarak had resigned
",examiner.com,http://www.examiner.com/foreign-policy-in-national/breaking-ndp-party-and-mubarak-father-and-son-have-resigned-details
2011-02-05,14:28:21,ffo3f,15,Mubarak sends snipers after protesters,presstv.ir,http://www.presstv.ir/detail/163606.html
2011-02-06,07:02:37,fg05y,12,"After being attacked twice by Mubarak supporters, Anderson Cooper leaves Egypt.",huffingtonpost.com,http://www.huffingtonpost.com/2011/02/05/anderson-cooper-leaves-egypt_n_819140.html
