2011-10-13,02:32:00,l9rop,1408,"Arrest Bush when he visits B.C., Amnesty tells Ottawa  - The rights body says both Canadian and international law oblige Canada to detain Bush and investigate him for war crimes and torture.",theglobeandmail.com,http://www.theglobeandmail.com/news/politics/arrest-bush-when-he-visits-bc-amnesty-tells-ottawa/article2198617/
2011-10-13,22:20:07,las98,1176,New Zealand Oil Spill In Pictures - It's the country's worst ever maritime environmental disaster,guardian.co.uk,http://www.guardian.co.uk/environment/gallery/2011/oct/12/new-zealand-oil-spill-in-pictures?intcmp=122
2011-10-13,16:21:36,lalbg,765,Used-car salesman as Iran proxy? Why Iran assassination plot doesn't add up for experts.,csmonitor.com,http://www.csmonitor.com/World/Middle-East/2011/1012/Used-car-salesman-as-Iran-proxy-Why-assassination-plot-doesn-t-add-up-for-experts
2011-10-13,21:08:09,laqk4,580,Chinese artist Ai Weiwei is named the most powerful person in the art world by an arts magazine - China complains about political bias. ,bbc.co.uk,http://www.bbc.co.uk/news/entertainment-arts-15285939
2011-10-13,19:26:36,laonc,509,'Food insecurity' comes to London - Shoppers at London's Spitalfields market are in for a shock when food prices rocket by up to 800 per cent as part of a British Red Cross campaign highlighting the cost of living in developing countries.,telegraph.co.uk,http://www.telegraph.co.uk/foodanddrink/8823844/Food-insecurity-comes-to-London.html?utm_source=dlvr.it&utm_medium=twitter
2011-10-13,10:42:41,laakc,441,"North Korea has threatened war against South Korea over balloons drifting over the nations' border that contain leaflets denouncing Kim Jong-il's regime.
",australianetworknews.com,http://australianetworknews.com/stories/201110/3338527.htm?desktop
2011-10-13,10:07:19,la9bh,304,19 people arrested in Poland in connection with Anders Breivik mass killing in Norway,washingtonpost.com,http://www.washingtonpost.com/world/europe/19-people-arrested-in-poland-in-investigation-that-began-after-norway-massacre/2011/10/12/gIQANaggfL_story.html
2011-10-13,07:46:21,la436,248,"Bomb explodes at Londonderry City, Northern Ireland",bbc.co.uk,http://www.bbc.co.uk/news/uk-northern-ireland-15284199
2011-10-13,20:08:44,lapf0,234,"Radiation spikes in Tokyo neighborhood. An extraordinarily high level of radiation was detected in one spot in a central Tokyo residential district Thursday, prompting the local government to cordon off the small area.",edition.cnn.com,http://edition.cnn.com/2011/10/13/world/asia/japan-radiation/index.html?hpt=hp_t2
2011-10-13,12:34:35,laer9,221,"6.2 earthquake hits off the coast of Bali, Indonesia",earthquake.usgs.gov,http://earthquake.usgs.gov/earthquakes/recenteqsww/Quakes/usc00068ee.php
2011-10-13,23:04:24,lati2,217,MEXICO CITY — Mexico's Defense Department says troops have captured the No. 3 figure in the Zetas drug cartel,statesman.com,http://www.statesman.com/news/texas/mexico-military-reports-capture-of-cartel-figure-1911383.html
2011-10-14,04:11:45,lb55k,195,"Tremors in the ground beneath an Icelandic volcano could be the first warning signs of a long-awaited eruption that would have the potential to dwarf the chaos caused by Eyjafjallajokul last year, experts say.",telegraph.co.uk,http://www.telegraph.co.uk/news/worldnews/europe/iceland/8824700/Fears-Volcano-will-erupt-in-Iceland-causing-more-chaos.html
2011-10-14,00:32:01,lawop,181,"Germany ready to impose financial transaction tax - Germany is prepared to introduce a tax on financial market transactions on its own if it is unable to bring its European partners on board, according to Finance Minister Wolfgang Schäuble.",thelocal.de,http://www.thelocal.de/money/20111013-38183.html
2011-10-13,08:43:39,la6a6,99,"US Officials concede gaps in U.S. knowledge of Iran plot
| Reuters

",reuters.com,http://www.reuters.com/article/2011/10/12/us-usa-iran-plot-idUSTRE79B7VO20111012
2011-10-13,00:53:23,l9nu8,82,Liberals Are Losing the Battle for Egypt's Future,theatlantic.com,http://www.theatlantic.com/international/archive/2011/10/how-liberals-are-losing-the-battle-for-egypts-future/246401/
2011-10-13,21:42:34,lar9l,80,"US signs free trade deals with South Korea, Panama, Colombia. ",bbc.co.uk,http://www.bbc.co.uk/news/business-15284813
2011-10-13,12:41:14,laezl,80,The Guardian Unearths a Wall Street Journal Scandal ,cjr.org,http://www.cjr.org/the_audit/the_guardian_unearths_a_wall_s.php
2011-10-13,15:08:31,lajk8,75,"BBC News - Children Trafficked for Juju. Over the last four years, at least 400 African children have been abducted and trafficked to the UK",bbc.co.uk,http://www.bbc.co.uk/news/uk-15280776
2011-10-14,04:19:13,lb5g7,56,"Egyptian military junta defends conduct - Public figures, infiltrators and even the Coptic Christian protesters themselves are blamed for Sunday's deadly riots",english.aljazeera.net,http://english.aljazeera.net/video/africa/2011/10/2011101375013459404.html?utm_content=automateplus&utm_campaign=Trial6&utm_source=SocialFlow&utm_term=tweets&utm_medium=MasterAccount
2011-10-13,19:15:39,laogl,55,BlackBerry users cut off for fourth day,english.aljazeera.net,http://english.aljazeera.net/news/americas/2011/10/2011101353531351613.html?utm_content=automateplus&utm_campaign=Trial6&utm_source=SocialFlow&utm_term=tweets&utm_medium=MasterAccount
2011-10-13,22:40:49,lastl,53,Radiation hotspots not linked to Fukushima: Japan's science minister announced Thursday that the radiation has been traced to material stored in a house,globalpost.com,http://www.globalpost.com/dispatch/news/regions/asia-pacific/japan/111013/radiation-hotspot-found-japan-tokyo-fukushima
2011-10-14,07:52:44,lbdm6,47,"Chinese national oil companies are now the biggest beneficiary of Iraq's oil resources, beating the oil majors. ",thestreet.com,http://www.thestreet.com/story/11267956/1/china-outbids-oil-majors-in-iraq.html
2011-10-13,17:22:06,lamgz,45,Robert Fisk: Democratic governments don't deal with terrorists – until they do,independent.co.uk,http://www.independent.co.uk/opinion/commentators/fisk/robert-fisk-democratic-governments-dont-deal-with-terrorists-ndash-until-they-do-2369660.html
2011-10-13,11:58:18,ladeb,43,Container with toxic chemical topples into ocean from crippled New Zealand ship,sbs.com.au,http://www.sbs.com.au/news/article/1596213/Toxic-chemical-in-NZ-ship-toppled-cargo
2011-10-13,19:56:34,lap6o,44,Smuggled Libyan weapons flood into Egypt - The end of the peaceful revolution,washingtonpost.com,http://www.washingtonpost.com/world/libyan-weapons-flooded-egypts-black-weapons-market/2011/10/12/gIQA2YQufL_story.html?hpid=z2
2011-10-14,02:56:23,lb29a,40,"Bride kidnapping happens around the world, from China to Mexico to Russia to southern Africa. In each of these lands, there are communities where it is routine for young women and girls to be plucked from their families, raped and forced into marriage.",nzherald.co.nz,http://www.nzherald.co.nz/lifestyle/news/article.cfm?c_id=6&objectid=10758062
2011-10-14,00:47:17,lax8x,40,"Almost 600,000 Britons sacrificed a foreign holiday this summer in a bid to save money in the face of the economic downturn.",telegraph.co.uk,http://www.telegraph.co.uk/news/uknews/8824973/Hundreds-of-thousands-of-Brits-sacrifice-foreign-holiday.html
2011-10-13,00:20:04,l9mjs,30,"Thousands rally in support of Syria's Assad:  Tens of thousands take to streets of Damascus in solidarity with Syrian president, chanting slogans against US and EU.",english.aljazeera.net,http://english.aljazeera.net/news/middleeast/2011/10/20111012103639234331.html
2011-10-13,22:03:04,larsa,35,Explosion hits restaurant in Brazil; officials say at least 3 killed ,washingtonpost.com,http://www.washingtonpost.com/world/americas/explosion-hits-restaurant-in-brazil-officials-say-at-least-3-killed/2011/10/13/gIQA6QKGhL_story.html
2011-10-13,20:54:27,laqa0,31,"Preventing a Syrian Civil War --- The inability of the Security Council to act has created a dangerous political vacuum, sending a clear message to President Bashar al-Assad that he can continue to kill with impunity and signaling to Syrian protesters that they are on their own",nytimes.com,http://www.nytimes.com/2011/10/13/opinion/preventing-a-syrian-civil-war.html?_r=1
