2011-04-07,23:51:18,gkriy,1869,New 7.4 earthquake in Japan! Tsunami warning issued,bbc.co.uk,http://www.bbc.co.uk/news/world-asia-pacific-13005110
2011-04-07,16:37:38,gkkt8,1018,Mexican protest in over 20 cities -- against the drug-related violence sweeping the country,bbc.co.uk,http://www.bbc.co.uk/news/world-latin-america-12992664?utm_source=twitterfeed&utm_medium=twitter
2011-04-08,01:54:42,gkuts,378,"Former Mexican president urges drug legalization - Legalization of drugs in Mexico would not only lead to lowered violence and drug consumption but also boost its economy, former Mexican President Vicente Fox said Wednesday.",signonsandiego.com,http://www.signonsandiego.com/news/2011/apr/06/former-mexican-president-urges-drug-legalization/
2011-04-07,03:31:15,gk3hy,286,"Tired of violence, Mexicans ready for mass protests",google.com,http://www.google.com/hostednews/afp/article/ALeqM5iHLCD0-_e31TtmkIxOxUu2E5_ruA?docId=CNG.692381365d745fc505df40c97673c9ec.991
2011-04-07,11:31:44,gkep7,277,"Civil war recently broke out in Ivory Coast, where cell phones are one of the main ways of communicating, but people can't get to stores to buy credit.  So one phone company is giving all customers a bunch of free texts and calls.",ethanzuckerman.com,http://www.ethanzuckerman.com/blog/2011/04/06/orange-cote-d’ivoire-sets-a-great-example/
2011-04-07,18:58:27,gkmkx,251,WHO warns of post-antibiotic era,abc.net.au,http://www.abc.net.au/news/stories/2011/04/07/3185138.htm
2011-04-07,10:11:51,gkcxz,112,I.M.F. supports Palestinian bid for state,nytimes.com,http://www.nytimes.com/2011/04/07/world/middleeast/07palestinians.html?hp&gwh=3D39767C88CA4F5C0F33846A52919B78
2011-04-07,01:08:43,gjzqi,91,"Mystery plane bombs Sudan, Israel blamed: Two killed in airstrike on car close to Port Sudan on Red Sea",globalpost.com,http://www.globalpost.com/dispatches/globalpost-blogs/africa-emerges/mystery-plane-bombs-sudan-israel-blamed
2011-04-07,13:48:32,gkhsr,78,The Roots of the Côte d'Ivoire Crisis: How the demand for chocolate helped fuel the country's civil war,thenation.com,http://www.thenation.com/article/159707/roots-cote-divoire-crisis
2011-04-07,13:13:49,gkh0g,66,Japanese City’s Cry Resonates Around the World,nytimes.com,http://www.nytimes.com/2011/04/07/world/asia/07plea.html
2011-04-07,22:50:56,gkq3j,63,"School shooting in Rio de Janeiro leaves at least 13 deads, details still unfolding",translate.google.com,http://translate.google.com/translate?js=n&prev=_t&hl=en&ie=UTF-8&layout=2&eotf=1&sl=auto&tl=en&u=http%3A%2F%2Fg1.globo.com%2Frio-de-janeiro%2Fnoticia%2F2011%2F04%2Fsecretario-de-saude-do-rio-confirma-13-mortes-em-tiroteio-em-escola.html
2011-04-08,06:26:21,gl1rt,58,Inside report from Fukushima nuclear reactor evacuation zone,youtube.com,http://www.youtube.com/watch?v=yp9iJ3pPuL8&feature=player_embedded
2011-04-07,21:56:25,gkozd,48,Saudi Twitter community hears about a child that has gone missing ... groups up to look for him ... finds him after only 3 hours,thenextweb.com,http://thenextweb.com/twitter/2011/04/07/twitter-users-help-find-a-missing-child-in-only-3-hours/
2011-04-07,22:12:47,gkpa5,53,Stone Markers from Japan's past: Tsunami Warnings From Ancestors Were Forgotten,huffingtonpost.com,http://www.huffingtonpost.com/2011/04/06/japan-tsunami-warnings-fr_n_845818.html
2011-04-07,12:00:43,gkfdi,44,"Video tour of Fukushima evacuation zone. Cracked streets, smashed cars, wandering dogs, and dosimeters. (Warning: ear piercing dosimeter alarm beginning @ 2:00 - turn volume down) ",youtube.com,http://www.youtube.com/watch?v=mHWvbisFg0I
2011-04-08,00:32:49,gkso9,48,David Cameron has suggested that Britain and the legacy of its empire was responsible for many of the world's historic problems,bbc.co.uk,http://www.bbc.co.uk/news/magazine-12992540
2011-04-08,02:39:07,gkvzg,45,"Bahrain has taken on the likeness of a police state with mass arrests and reports of torture.  Emergency laws give the security forces the right to search houses at will without a warrant and dissolve any organization, including legal political parties, deemed a danger to the state",nytimes.com,https://www.nytimes.com/2011/04/07/world/middleeast/07bahrain.html?_r=2&partner=rss&emc=rss
2011-04-07,20:13:35,gknhs,45,"The Real Meaning of 'Bunga Bunga' - 
Berlusconi's sex scandal shows a racist, sexist side of Italy",theatlantic.com,http://www.theatlantic.com/international/archive/2011/04/the-berlusconi-in-us-all-bunga-bungas-real-meaning/236871/
2011-04-07,20:56:52,gko2n,40,"""Palestinians in a West Bank town say Israeli troops have rounded up some 200 women as part of a search for the killer of five Israelis in a nearby settlement last month""",news.yahoo.com,http://news.yahoo.com/s/ap/20110407/ap_on_re_mi_ea/ml_israel_palestinians
2011-04-07,19:54:35,gkn9g,40,"Portuguese Prime Minister Jose Socrates has been insisting for months that he would not ask the EU for help. But on Wednesday he announced he was doing just that, after bond yields reached an unsustainable level. The bailout could amount to as much as 80 billion euros.",spiegel.de,"http://www.spiegel.de/international/europe/0,1518,755555,00.html#ref=rss"
2011-04-08,04:28:47,gkyu8,30,"Israeli army invades Palestinian village, kidnaps residents, imposes curfew.",imemc.org,http://www.imemc.org/article/61013
2011-04-08,01:34:19,gku9x,28,"Saudis ‘So Unhappy' With Obama They Sent Emissaries to China, Russia Seeking Enhanced Ties",cnsnews.com,http://www.cnsnews.com/news/article/nbc-s-brokaw-saudis-so-unhappy-obama-adm
2011-04-08,01:32:44,gku8a,27,"GlobalPost correspondent James Foley, and 3 other foreign journalists, have been detained by forces loyal to Libyan leader Muammar Gaddafi",globalpost.com,http://www.globalpost.com/dispatch/news/war/conflict-zones/110407/libya-globalpost-journalist-arrested-gaddafi
2011-04-07,10:49:39,gkdry,29,"Harsh confrontation between IDF soldiers, Israeli leftist protesters",liveleak.com,http://www.liveleak.com/view?i=26b_1301859181
2011-04-07,11:52:16,gkf5z,26,Mau Mau compensation case to begin: Four Kenyans who allege they were tortured during the suppression of the Mau Mau uprising are starting legal proceedings against the UK government.,bbc.co.uk,http://www.bbc.co.uk/news/uk-12994190
2011-04-07,23:50:05,gkrhz,21,7.4 earthquake hits Japan,businessinsider.com,http://www.businessinsider.com/earthquake-hits-tokyo-government-issues-tsunami-alert-2011-4
2011-04-07,10:14:32,gkd05,22,"Libya: US rebuffs letter from Gaddafi, says he must go",bbc.co.uk,http://www.bbc.co.uk/news/world-africa-12993962
2011-04-07,22:44:13,gkpxt,21,Up to 20 children dead in Rio school shooting,guardian.co.uk,http://www.guardian.co.uk/world/2011/apr/07/rio-de-janeiro-school-shooting
2011-04-07,17:48:52,gklpo,17,IDF arrests at least 100 women in West Bank village,jpost.com,http://www.jpost.com/Defense/Article.aspx?id=215514
2011-04-08,06:01:09,gl156,16,"Control Information, not Radiation: TEPCO pulls data from website",climatecrocks.com,http://climatecrocks.com/2011/04/07/control-information-not-radiation-tepco-pulls-data-from-website/
