2011-11-17,10:37:35,mf6ss,2589,"Save the Internet: The US Congress is debating a law that would give them the power to censor the world's internet - creating a blacklist that could target YouTube, WikiLeaks and even groups like Avaaz!",avaaz.org,http://www.avaaz.org/en/save_the_internet_d/?ciSZkcb
2011-11-17,23:29:33,mfql4,698,"The State Wants To Know What You're Up To. But Why Do We Let It? --- Biting commentary on Britain's surveillance society. Now so bad that councils want to film and record all conversations in taxis. This isn't about diminishing evil, it's about a desire to control.",independent.co.uk,http://www.independent.co.uk/opinion/commentators/philip-hensher/philip-hensher-the-state-wants-to-know-what-youre-up-to-but-why-do-we-let-it-6263187.html
2011-11-17,23:19:57,mfq89,623,"The next financial crisis will be hellish, and it’s on its way",news.yahoo.com,http://news.yahoo.com/next-financial-crisis-hellish-way-204303737.html
2011-11-17,01:39:22,mel4v,358,Ultra-Orthodox in Jerusalem fight to remove women from public sphere  ,guardian.co.uk,http://www.guardian.co.uk/world/2011/nov/15/jerusalem-mayor-battle-orthodox-billboards?fb=native&CMP=FBCNETTXT9038
2011-11-17,19:29:53,mfkx3,300,"Belarus, The Land Of No Applause --- 
Economy a wreck, president-for-life a wild-eyed thug. Belarus slews from authoritarianism into totalitarianism. Law prohibits ""action or inaction that has been planned beforehand and is a form of public expression""",worldaffairsjournal.org,http://www.worldaffairsjournal.org/article/belarus-land-no-applause
2011-11-17,21:03:27,mfmkr,255,"Climate change is causing our oceans to become increasingly acidic, threatening to alter life as we know it.",aljazeera.com,http://www.aljazeera.com/indepth/features/2011/11/2011111653856937268.html
2011-11-17,05:22:44,meubh,220,Thousands storm parliament in Kuwait,radionz.co.nz,http://www.radionz.co.nz/news/world/91304/thousands-storm-parliament-in-kuwait
2011-11-18,00:11:37,mfs1t,122,"Hundreds of passengers traveling from India to Britain were stranded Thursday in Amritsar, India, by the charter airline Comtel, which was asking them to kick in money to cover the cost of fuel and fees. Passengers will not be allowed to leave unless they paid 10,000 rupees (about $200) each",theglobeandmail.com,http://www.theglobeandmail.com/news/world/airline-asks-passengers-for-fuel-money-after-theyre-left-stranded-in-vienna/article2239262/
2011-11-17,22:49:38,mfp9m,91,Russia’s military chief: Potential conflicts near Russian borders may grow into nuclear war,washingtonpost.com,http://www.washingtonpost.com/world/europe/russias-military-chief-potential-conflicts-near-russian-borders-may-grow-into-nuclear-war/2011/11/17/gIQAWQTJUN_story.html
2011-11-17,22:07:55,mfo2r,62,"Protests in Italy turn ugly ahead of Monti unveiling crisis plan.In Palermo, Sicily, demonstrators hurled eggs and smoke bombs at a bank, and protesters threw rocks at police who battled back with pepper sprays.",theglobeandmail.com,http://www.theglobeandmail.com/report-on-business/protests-in-italy-turn-ugly-ahead-of-monti-unveiling-crisis-plan/article2239214/
2011-11-17,11:23:49,mf8lc,49,"Eyeing China, India to enter ICBM club in 3 months",timesofindia.indiatimes.com,http://timesofindia.indiatimes.com/india/Eyeing-China-India-to-enter-ICBM-club-in-3-months/articleshow/10761860.cms
2011-11-17,22:07:23,mfo29,47,Mexico's presidential rival has a new answer to the drug war: He would send the army back to their barracks and focus on growing the economy,globalpost.com,http://www.globalpost.com/dispatch/news/regions/americas/mexico/111116/calderon-drug-war-lopez-obrador-pena-nieto
2011-11-17,20:18:35,mflqw,46,"Interest rates have jumped sharply for France, Belgium, Austria, Finland and the Netherlands. This has fueled fears that the eurozone's sovereign debt crisis could be about to spread even further.",dw-world.de,"http://www.dw-world.de/dw/article/0,,15537529,00.html"
2011-11-17,20:41:48,mfm5o,45,"Eurogroup head Jean-Claude Juncker: ""Germany has higher debts than Spain, the only thing is that no one wants to know about that""",reuters.com,http://www.reuters.com/article/2011/11/16/us-eurozone-germany-juncker-idUSTRE7AF1RK20111116
2011-11-18,01:39:39,mfvai,37,India minister says Funds meant to provide work to India's rural poor have been diverted by corrupt officials spent on toys.,bbc.co.uk,http://www.bbc.co.uk/news/world-asia-15771064
2011-11-17,22:41:33,mfp0b,33,"""You can take our balls, but you can't take our freedom"" - Students at Earl Beatty School in Toronto protest the ball ban. ",keswickpinhead.deviantart.com,http://keswickpinhead.deviantart.com/journal/Give-me-balls-or-give-me-death-269485172
2011-11-17,17:50:24,mfjc4,30,Radioactive caesium has been detected above the safety level in rice for the first time in Japan since the nuclear crisis began at the Fukushima plant.,blogs.wsj.com,http://blogs.wsj.com/japanrealtime/2011/11/17/staple-scare-radioactive-rice-in-fukushima/
2011-11-17,20:46:40,mfm8w,34,"France needs to upgrade all nuclear reactors

",reuters.com,http://www.reuters.com/article/2011/11/17/us-france-nuclear-tests-idUSTRE7AG0HQ20111117
2011-11-17,21:08:23,mfmoh,30,"Plane passengers 'held to ransom' and forced into £20,000 whip-round for fuel",dailymail.co.uk,http://www.dailymail.co.uk/travel/article-2062649/Comtel-Air-passengers-held-ransom-forced-20k-whip-round-fuel.html
2011-11-17,11:38:41,mf95x,26,"The book was banned and the author jailed before it was published, but on Wednesday a group of fellow journalists and writers in Turkey launched Ahmet Sik’s “The Army of Imam” at an annual book fair",blogs.wsj.com,http://blogs.wsj.com/emergingeurope/2011/11/16/jailed-author’s-banned-book-launched
2011-11-18,00:25:30,mfsgz,26,Vatican takes legal action over pope-imam kissing ad,bbc.co.uk,http://www.bbc.co.uk/news/world-europe-15778377
2011-11-17,11:31:03,mf8v6,26,"Brazil 2010 census shows changing race balance, for the first time, non-white people make up the majority of Brazil's population, according to preliminary results of the 2010 census. ",bbc.co.uk,http://www.bbc.co.uk/news/world-latin-america-15766840
2011-11-18,03:09:52,mfyuz,20,"The Pakistan Telecommunications Authority sends mobile phone operators a list of hundreds of ""obscene"" words to be banned from text messages.",bbc.co.uk,http://www.bbc.co.uk/go/rss/int/news/-/news/world-asia-15772292
2011-11-17,08:33:15,mf253,19,"Tunisian TV boss faces trial over showing film on Iran’s 1979 revolution.  Broadcast of “Persepolis” sparked violent protests ; accused of “violating sacred values, good morals and disturbing public order”",english.alarabiya.net,http://english.alarabiya.net/articles/2011/11/16/177570.html
2011-11-17,09:53:33,mf576,20,"Comtel plane passengers pony up roughly $31,500 for fuel as airline goes broke.",huffingtonpost.com,http://www.huffingtonpost.com/2011/11/16/plane-passengers-pony-up-_n_1098073.html?icid=maing-grid7%7Cmain5%7Cdl1%7Csec3_lnk2%7C113480
2011-11-17,10:16:25,mf60g,18,Benetton pulls photo of pope kissing imam from campaign,france24.com,http://www.france24.com/en/20111116-benetton-pulls-photo-pope-kissing-imam-campaign-vatican-outrage-italy
2011-11-17,08:16:04,mf1gt,18,"Central Banker Takes Over Greece; Demands Tax Hikes, More EU Control",thenewamerican.com,http://thenewamerican.com/world-mainmenu-26/europe-mainmenu-35/9807-central-banker-takes-over-greece-demands-tax-hikes-more-eu-control
2011-11-17,12:13:13,mfagp,17,UK: A million young people unemployed as jobless figure hits 15-year high,telegraph.co.uk,http://www.telegraph.co.uk/finance/jobs/8893342/A-million-young-people-unemployed-as-jobless-figure-hits-15-year-high.html
2011-11-17,22:50:28,mfpag,19,Iraq Cabinet OKs $17.2 Billion Shell Gas Deal,dowjones.de,http://www.dowjones.de/site/2011/11/iraq-cabinet-oks-172-billion-shell-gas-deal-spokesman.html
2011-11-17,23:25:41,mfqfm,17,Greek police fire teargas at protesters in Athens,reuters.com,http://www.reuters.com/article/2011/09/25/us-greece-unrest-idUSTRE78O2D620110925
