2011-08-20,02:45:51,jo2dm,1171,Monsanto sued by Indian government for releasing GMO eggplant without authorization from traditional varieties. Le Monde article and India News,lemonde.fr,http://www.lemonde.fr/planete/article/2011/08/17/monsanto-poursuivi-pour-biopiraterie-par-l-inde_1560365_3244.html
2011-08-20,22:21:49,jotk4,946,Iran sentences American hikers to 8 years in prison for illegal entry and espionage,dailystar.com.lb,http://www.dailystar.com.lb/News/Middle-East/2011/Aug-20/Iran-sentences-US-hikers-to-eight-years-for-spying-state-TV.ashx#axzz1VZhSBCOO
2011-08-20,22:04:28,jotbb,863,'Gadhafi is finished': Rebels advance in Libya,msnbc.msn.com,http://www.msnbc.msn.com/id/44212588/ns/world_news-mideast_n_africa/
2011-08-20,21:48:33,jot3w,868,"Corruption in India: ""You pay for a birth certificate, a death certificate,"" said a 30-year-old software engineer and one of thousands who marched in Delhi to support Hazare. ""All your life you pay. And for what? For things that should be free.""",guardian.co.uk,http://www.guardian.co.uk/world/2011/aug/19/corruption-india-anna-hazare
2011-08-20,02:35:56,jo211,412,"Two Chechen teens responsible for saving 23 at Utoya, and hitting A B Breivik with rocks before being fired upon.",balkanchronicle.com,http://www.balkanchronicle.com/index.php?option=com_content&view=article&id=1334:chechen-boys-saved-many-from-the-norwegian-killer-&catid=82:europe&Itemid=458
2011-08-20,14:27:48,jomh9,153,Wirklich? Germany declares Facebook ‘Like’ button illegal,venturebeat.com,http://venturebeat.com/2011/08/19/facebook-like-button-illegal-in-germany/
2011-08-20,22:44:01,jotx2,154,"Shell finally stops North Sea leak after 10 days - 
Scottish government launches investigation into safety procedures ",guardian.co.uk,http://www.guardian.co.uk/environment/2011/aug/19/shell-stops-second-oil-leak
2011-08-21,06:43:48,jp54l,129,Qaddafi and Two Sons Rumored To Have Fled Libya,theatlanticwire.com,http://www.theatlanticwire.com/global/2011/08/report-qaddafi-and-two-sons-have-fled-libya/41523/
2011-08-20,22:24:22,jotls,128,British police issue warning on Twitter to anyone considering supporting internet attacks against companies and governments,nakedsecurity.sophos.com,http://nakedsecurity.sophos.com/2011/08/03/british-police-issue-warning-to-internet-hacktivists/
2011-08-20,19:38:44,jorin,93,5 southern African countries have agreed to create a giant conservation zone in the Okavango & Zambezi river basins that stretches over an area 1/2 the size of France,independent.co.uk,http://www.independent.co.uk/environment/giant-okavangozambezi-conservation-zone-launched-in-africa-2341014.html
2011-08-20,23:26:16,jouqz,75,"For far too long, the Germans have allowed the Europe debate to be led by a small number of experts, meaning they bear partial responsibility for the current chaos. But there is still a way to achieve a better Europe and get ordinary people to care about the EU -- through direct elections.",spiegel.de,"http://www.spiegel.de/international/germany/0,1518,781303,00.html"
2011-08-20,22:02:44,jotak,71,"German privacy watchdog declares Facebook's ""like"" button illegal",dw-world.de,"http://www.dw-world.de/dw/article/0,,15331909,00.html"
2011-08-20,23:15:56,jouiz,60,Bodies found in Mexico might be kidnapped marines,news.yahoo.com,http://news.yahoo.com/bodies-found-mexico-might-kidnapped-marines-191619710.html
2011-08-20,08:25:50,jodd1,53,OPEC states that Venezuela has world’s largest oil reserves,oilprice.com,http://oilprice.com/Latest-Energy-News/World-News/OPEC-States-that-Venezuela-has-Worlds-Largest-Oil-Reserves.html
2011-08-21,06:35:09,jp4xr,45,"Rebels claim to take 'revolution' inside Tripoli, clashes reported",cnn.com,http://www.cnn.com/2011/WORLD/africa/08/20/libya.war/index.html?hpt=hp_t1
2011-08-21,00:11:48,jovos,42,The cost of revolution --- Facts and figures of the Arab Spring,nowlebanon.com,http://www.nowlebanon.com/NewsArticleDetails.aspx?ID=302711
2011-08-21,06:35:35,jp4y3,39,Fukushima: Radiation reports overshadow progress at plant - 45 percent of children living up to 30 miles from the Fukushima plant tested positive for radiation exposure.,globalpost.com,http://www.globalpost.com/dispatch/news/regions/asia-pacific/japan/110820/fukushima-japan-tsunami-earthquake-radiation-fears
2011-08-20,03:46:00,jo4kn,37,Libyan Rebels Say They Control Zlitan ,voanews.com,http://www.voanews.com/english/news/Bombs-Target-Gadhafis-Main-Compound-in-Libyan-Capital-128072648.html
2011-08-20,23:32:29,jouvq,31,10 Most Corrupt Indian Politicians,in.lifestyle.yahoo.com,http://in.lifestyle.yahoo.com/10-corrupt-indian-politicians-134933044.html
2011-08-20,18:21:50,joqj6,33,High food prices driving unrest: The waves of social unrest and political instability seen recently around the world have coincided with large peaks in global food prices,abc.net.au,http://www.abc.net.au/science/articles/2011/08/18/3295848.htm
2011-08-20,15:18:34,jonic,30,"Environmental activism in China: Poison protests draw 12,000",economist.com,http://www.economist.com/node/21526417?fsrc=scn/tw/te/ar/poisonprotests
2011-08-20,23:21:53,jouns,19,"Burning Cars In Berlin Again --- 
35 cars were torched in Berlin this week. It's hard to say why. But something is going on in Germany. There is a crisis of identity. ",translate.google.com,http://translate.google.com/translate?js=n&prev=_t&hl=en&ie=UTF-8&layout=2&eotf=1&sl=de&tl=en&u=http://www.berlinonline.de/berliner-zeitung/berlin/detail_dpa_31972218.php
2011-08-20,21:47:01,jot38,21,Rocket salvo hits south of Israel,ynetnews.com,"http://www.ynetnews.com/articles/0,7340,L-4111254,00.html"
2011-08-21,07:07:09,jp5oy,22,Doorstep rubbish collections have been scrapped in Britain for the first time since they were introduced more than 130 years ago.  - Telegraph,telegraph.co.uk,http://www.telegraph.co.uk/earth/countryside/8712998/Doorstep-rubbish-collections-scrapped-after-130-years.html
2011-08-20,19:31:55,jorfi,22,Europe's Turn to the Right: What is the link between the Norway killer’s actions and the ideas he espoused? ,thenation.com,http://www.thenation.com/article/162698/europes-turn-right
2011-08-21,03:48:40,jp0rt,15,Libya rebels capture coastal city of Zawiya,news.yahoo.com,http://news.yahoo.com/libya-rebels-capture-coastal-city-zawiya-134049314.html
2011-08-20,19:56:36,jorr2,14,"As NATO scales back in Libya, pressure mounts to end war soon",latimes.com,"http://www.latimes.com/news/nationworld/world/la-fg-libya-nato-20110820,0,6089174.story"
2011-08-21,03:06:16,jozqi,15,UK to lead international rhino horn clampdown,bbc.co.uk,http://www.bbc.co.uk/news/science-environment-14603905
2011-08-20,22:35:01,jotrn,13,Red Arrow in Display Crash,bbc.co.uk,http://www.bbc.co.uk/news/uk-england-14602900
2011-08-20,22:52:28,jou2r,14,Argentine ISPs Use Bazooka to Kill Fly,eff.org,https://www.eff.org/deeplinks/2011/08/argentina-isps-ip-overblocking
