2012-06-04,15:00:21,ujt71,2800,"Eduard Khil ('Trololo Guy') dies in St. Petersburg, aged 77",en.ria.ru,http://en.ria.ru/world/20120604/173831212.html
2012-06-04,01:02:43,uiozx,2705,"Copyright Board of Canada recently approved new fees to play recorded music at large gatherings, including weddings - fewer than one hundred people, the fees start at $9.25 per day - 400 guests will cost them $27.76. If dancing is involved, that fee doubles to $55.52


",ctv.ca,http://www.ctv.ca/CTVNews/Canada/20120602/couple-to-wed-balk-at-extra-music-fees-120602/#ixzz1wkLDLgEi
2012-06-04,19:22:43,uk06z,1435,"Brazilian farmers sue Monsanto: Five million farmers are locked in a lawsuit with US-based biotech giant, suing for as much as 6.2 billion euros",rt.com,http://www.rt.com/news/monsanto-brazil-seed-soy-908/
2012-06-04,23:45:53,uk8tp,1352,Luka Magnotta arrested in Berlin: German Police,news.nationalpost.com,http://news.nationalpost.com/2012/06/04/luka-rocco-magnotta-arrested-in-berlin-german-report-says/
2012-06-04,00:46:07,uioin,900,A passenger plane with at least 150 on board has crashed into a two-story building in the Nigerian city of Lagos,rt.com,http://www.rt.com/news/passenger-plane-crash-lagos-881/
2012-06-04,09:23:06,ujc99,448,"Quebec bangs pots and pans in growing protests:  What started as a march against university tuition hikes has grown beyond students as the government moves to muzzle protest. Now even saucepan-wielding grannies are up in arms.
",globalpost.com,http://www.globalpost.com/dispatch/news/regions/americas/canada/120531/quebec-bangs-pots-and-pans-growing-protests
2012-06-04,20:57:23,uk2kd,433,"China arrests activists to prevent commemoration of 
the Tiananmen Square anniversary.",bbc.co.uk,http://www.bbc.co.uk/news/world-asia-18321426
2012-06-04,20:21:20,uk1ku,385,"Chevron still refusing to pay for Ecuador spill: 'The company's Ecuadorean opponents has moved the case to Canada, a country whose court system enjoys a rock-solid reputation.'",americablog.com,http://www.americablog.com/2012/06/chevron-still-refusing-to-pay-for.html
2012-06-04,18:31:40,ujz44,239,US drone strike 'kills 15' in Pakistan,bbc.co.uk,http://www.bbc.co.uk/news/world-asia-18320431
2012-06-04,23:46:10,uk8u4,203,Breivik judge caught playing cards during trial,thelocal.no,http://www.thelocal.no/page/view/breivik-judge-caught-playing-cards-during-trial
2012-06-04,23:52:40,uk950,138,"Luka Magnotta, the Canadian body-parts suspect, has been arrested in Berlin.",cbc.ca,http://www.cbc.ca/news/canada/montreal/story/2012/06/04/montreal-magnotta-search.html
2012-06-04,22:03:11,uk4n2,135,"Vatican criticizes American nun's book on sexuality, says she has ""defective understanding.""",hosted.ap.org,http://hosted.ap.org/dynamic/stories/E/EU_VATICAN_NUN_CRITIQUE?SITE=AP&SECTION=HOME&TEMPLATE=DEFAULT
2012-06-04,15:41:12,ujuoc,109,"North Korea's 'open ultimatum' to blow up Seoul |
			News.com",news.com.au,http://www.news.com.au/world/north-korea-threatens-to-attack-skorea-media/story-e6frfkyi-1226383266058
2012-06-04,22:29:12,uk5ll,94,Kuwaiti gets 10 years in prison for insulting the Prophet Mohammad and the Sunni Muslim rulers of Saudi Arabia and Bahrain on Twitter,af.reuters.com,http://af.reuters.com/article/worldNews/idAFBRE8530DI20120604
2012-06-04,22:01:10,uk4l0,87,"ACTA lives or dies with the vote in the European Parliament: After rejections by the three first committees in the European Parliament, things are looking hopeful to prevent this middlemen-regime treaty from ever becoming reality. But we’re not there yet",falkvinge.net,http://falkvinge.net/2012/06/02/the-game-of-acta-mid-battle-analysis-next-actions/
2012-06-04,21:46:57,uk43u,81,"Bomb hits Shi'ite site in Baghdad, 23 killed",reuters.com,http://www.reuters.com/article/2012/06/04/us-iraq-violence-idUSBRE85308O20120604
2012-06-04,18:39:13,ujzao,69,Tokyo gas attack suspect arrested after 17 years on run,cnn.com,http://www.cnn.com/2012/06/04/world/asia/japan-cult-arrest/index.html?hpt=hp_t2
2012-06-04,22:36:29,uk5ve,65,Jerusalem apartment housing migrants firebombed amid rising Israeli sentiment against 'illegal infiltrators',guardian.co.uk,http://www.guardian.co.uk/world/2012/jun/04/jerusalem-apartment-housing-migrants-firebombed
2012-06-04,23:20:40,uk7pa,48,Thousands flee Mexico's epicenter of marijuana and poppy production ,csmonitor.com,http://www.csmonitor.com/World/Americas/Latin-America-Monitor/2012/0604/Thousands-flee-Mexico-s-epicenter-of-marijuana-and-poppy-production
2012-06-04,09:19:42,ujc32,44,"""No debt repayments, higher salaries and freedom from EU-IMF tutelage: Greece under the radical leftists, who are poised to win a June 17 [2012] election, seems a world removed from its current recession nightmare.""",france24.com,http://www.france24.com/en/20120603-debt-free-proud-greece-under-leftists
2012-06-04,00:21:38,uinmj,46,Syria's Assad says he's like a surgeon saving patient.,google.com,http://www.google.com/hostednews/ap/article/ALeqM5guZ8CdbKnr1647QBHcZ9Oe-so2qA?docId=c2efd58d873346378cb6f996fb612233
2012-06-04,23:08:13,uk75u,38,8 killed in attack at Mexico rehab center,cnn.com,http://www.cnn.com/2012/06/04/world/americas/mexico-attack/index.html?hpt=hp_t2
2012-06-05,02:53:18,ukj0n,30,"23 years ago today, the Chinese People's Liberation Army (PLA) violently cleared Beijing's Tiananmen Square of protesters. Here are 50 pictures from The Atlantic's ""In Focus"" photojournalism site documenting it.",theatlantic.com,http://www.theatlantic.com/infocus/2012/06/tiananmen-square-then-and-now/100311/
2012-06-04,00:30:04,uinxp,28,"Syrian air force officer defects, tells horrors of Houla massacre",english.alarabiya.net,http://english.alarabiya.net/articles/2012/06/03/218366.html
2012-06-05,04:50:54,ukq4n,27,Solar-powered plane attempts first intercontinental flight ,news.yahoo.com,http://news.yahoo.com/solar-powered-plane-attempts-first-intercontinental-flight-191424220.html
2012-06-04,01:42:35,uiqij,23,"147 Dead as Plane in Crashes Into Building in Lagos, Nigeria",aljazeera.com,http://www.aljazeera.com/news/africa/2012/06/20126315420678422.html
2012-06-05,03:00:33,ukjh7,22,"Many have wondered for years about the exact capabilities of the submarines Germany exports to Israel. Now, experts in Germany and Israel have confirmed that nuclear-tipped missiles have been deployed on the vessels. And the German government has long known about it.",spiegel.de,http://www.spiegel.de/international/world/israel-deploys-nuclear-weapons-on-german-built-submarines-a-836784.html
2012-06-04,13:52:48,ujqe5,20,"As United States and Western nations pull out, China seeks role in Afghanistan",msnbc.msn.com,http://www.msnbc.msn.com/id/47662955/ns/world_news-asia_pacific/t/united-states-western-nations-pull-out-china-seeks-role-afghanistan/#.T8w_BqnuqpA.reddit
2012-06-05,02:55:10,ukj50,15,"Thousands Continue Protest in Montreal after Government, Student Talks Fail",commondreams.org,https://www.commondreams.org/headline/2012/06/03
2012-06-04,13:55:37,ujqhr,13,Leaked documents show UK plan to dilute EU green energy targets,guardian.co.uk,http://www.guardian.co.uk/environment/2012/jun/03/coalition-dilute-eu-green-energy-targets
