2012-12-26,03:27:01,15fj8g,2818,"Mexico Bishop Inspires, Infuriates by Telling 1,000s Gathered in Stadium That Politicians are Tied to Organized Crime, Lawmakers' Attempts to Curb Money Laundering are Intentionally Weak, & New Labor Reforms are a Way to Enslave Mexican Workers",news.yahoo.com,http://news.yahoo.com/mexico-bishop-inspires-infuriates-activism-162210371.html
2012-12-26,23:12:49,15gx1y,2365,"British Create Petition to Keep Piers Morgan in US - After a petition to deport the pro-gun control CNN host gains momentum, a counter-petition emerges",salon.com,http://www.salon.com/2012/12/26/british_create_a_petition_to_keep_piers_morgan_in_u_s/
2012-12-26,11:06:03,15g67l,1530,Defense Department of Canada removes report on killing of Canadian soldier by Israeli forces,ottawacitizen.com,http://www.ottawacitizen.com/news/story.html?id=7742746
2012-12-26,04:04:16,15fl5j,1473,"When U.S. drones kill civilians, Yemen’s government tries to conceal it - The Washington Post",washingtonpost.com,http://www.washingtonpost.com/world/middle_east/when-us-drones-kill-civilians-yemens-government-tries-to-conceal-it/2012/12/24/bd4d7ac2-486d-11e2-8af9-9b50cb4605a7_story.html?tid=pm_world_pop
2012-12-26,03:19:33,15fiv7,1114,Dig Finds Evidence of Real Bethlehem - There's strong evidence Jesus was born in a Galilee village once celebrated as his birthplace. Emperor Justinian built a wall around it. It makes more sense Mary rode 7 km on a donkey rather than 150 km.  West Bank's Bethlehem likely wasn't inhabited then.,npr.org,http://www.npr.org/2012/12/25/168010065/dig-finds-evidence-of-pre-jesus-bethlehem
2012-12-26,14:24:49,15ggew,717,Majority of Britons support fox hunting ban leaving the hunters none too pleased.,guardian.co.uk,http://www.guardian.co.uk/uk/2012/dec/25/britons-fox-hunting-ban-survey
2012-12-26,21:55:09,15guaj,484,Facebook Funneled Nearly Half A Billion Pounds In The Cayman Islands Last Year,businessinsider.com,http://www.businessinsider.com/facebook-funneled-nearly-half-a-billion-pounds-in-the-cayman-islands-last-year-2012-12
2012-12-26,10:38:02,15g4r4,392,"""Faced with the threat of horse-mounted Sudanese elephant poachers armed with machine guns, the central African nation [Cameroon] has deployed military helicopters and 600 soldiers to try to protect the park [Bouba Ndjida National Park] and its animals.""",reuters.com,http://www.reuters.com/article/2012/12/24/uk-cameroon-elephants-idUSLNE8BN00V20121224
2012-12-26,23:52:15,15gyo7,224,Iranian lawmaker is complaining that Russian women technicians at the Bushehr nuclear power plant are violating the Islamic dress code,rferl.org,http://www.rferl.org/content/iranian-mp-says-russian-women-not-wearing-hijab-at-bushehr-nuclear-plant/24808409.html
2012-12-26,02:53:41,15fhh8,214,"China's Finless Porpoises Now Rarer than Wild Pandas - Fishing, pollution, etc in Yangtze River   driving another species to extinction. It's one of world’s few remaining freshwater cetaceans.   “Losing these top carnivores is an indication of the terrible state of the river ecosystem.""  . ",nature.com,http://www.nature.com/news/yangtze-finless-porpoises-in-peril-1.12125
2012-12-26,01:04:08,15fc17,191,The men who would save Mali's manuscripts - Islamist militants in Timbuktu destroyed graves & shrines associated with Sufism this year. Some fear the ancient manuscripts  are next.,csmonitor.com,http://www.csmonitor.com/World/Africa/2012/1225/The-men-who-would-save-Mali-s-manuscripts?nav=87-frontpage-entryNineItem
2012-12-26,01:48:06,15fe81,172,"Russia’s Brutal Early Winter Claims 123 Lives in Past 10 Days - In the past 24 hours, 201 people were hospitalized for hypothermia & frostbite, including 14 children.  Since the cold snap, 1,745 people were affected & over 800 hospitalized.",rawstory.com,http://www.rawstory.com/rs/2012/12/25/russias-brutal-early-winter-claims-123-lives/
2012-12-26,03:41:14,15fjyj,164,Netanyahu: I'll strengthen settlements during next 4 years,jpost.com,http://www.jpost.com/DiplomacyAndPolitics/Article.aspx?ID=297289&R=R1&utm_source=twitterfeed&utm_medium=twitter
2012-12-26,10:04:15,15g30k,132,China says it is on alert after Japan dispatched fighter jets over the East China Sea.  Japanese media report Japan sent F15 fighter aircraft after detecting a Chinese marine surveillance plane in disputed airspace near contested islands in the East China Sea.,voanews.com,http://www.voanews.com/content/cihna-on-alert-after-japan-scrambles-jets-over-east-china-sea/1571985.html
2012-12-26,13:57:40,15gf2i,121,"8 dead, 5,000 homeless in Christmas Day fires followed by riot in Philippine capital
",washingtonpost.com,http://www.washingtonpost.com/world/asia_pacific/8-dead-5000-homeless-in-christmas-day-fires-followed-by-riot-in-philippine-capital/2012/12/26/48f69eea-4f1d-11e2-835b-02f92c0daa43_story.html?tid=sm_btn_reddit
2012-12-26,00:59:55,15fbts,111,Group of Indian Jews said to be from ‘Lost Tribe’ move to Israel,washingtonpost.com,http://www.washingtonpost.com/world/asia_pacific/group-of-indian-jews-said-to-be-from-lost-tribe-move-to-israel/2012/12/20/3d2a7b5a-4abc-11e2-8758-b64a2997a921_singlePage.html?tid=obnetwork
2012-12-26,00:25:45,15fa9a,107,"In majority-Muslim Senegal, Christmas is flourishing -- Even the Grande Mosquee that dominates the city’s skyline, is aglow in holiday lights.  ",washingtontimes.com,http://www.washingtontimes.com/news/2012/dec/24/in-majority-muslim-senegal-christmas-is-flourishin/
2012-12-26,01:07:07,15fc6s,105,President Vladimir Putin is facing growing opposition to new legislation that would ban US citizens from adopting Russian children. ,telegraph.co.uk,http://www.telegraph.co.uk/news/worldnews/vladimir-putin/9765693/Vladimir-Putin-facing-growing-opposition-to-ban-US-citizens-adopting-Russian-children.html
2012-12-26,01:46:48,15fe5p,94,Policewoman who killed US aide in Kabul 'is Iranian',bbc.co.uk,http://www.bbc.co.uk/news/world-asia-20842028
2012-12-26,02:44:53,15fh0v,70,China cracks down on child-trafficking gangs. National operation spanning nine provinces leads to arrest of 355 suspects and the rescue of 89 abducted children.,aljazeera.com,http://www.aljazeera.com/news/asia-pacific/2012/12/2012122515111277481.html
2012-12-26,05:06:19,15foa9,68,"An Iranian lawmaker has complained that female Russian technicians working at the Bushehr nuclear power plant are not respecting the country’s dress code despite that they are being paid to wear the Islamic headscarf, known as the hijab.",english.alarabiya.net,http://english.alarabiya.net/articles/2012/12/25/257081.html
2012-12-26,22:48:23,15gw46,67,"Canada's Food Safety Rules Not Much Good if Not Followed - Veteran cattleman has  simple solution to prevent E. coli outbreak making people sick, throwing 1,000s out of work & smearing the Canadian beef brand.  Industry officials  must do their jobs.",huffingtonpost.ca,http://www.huffingtonpost.ca/2012/12/26/food-safety-canada-xl-foods_n_2364490.html?utm_hp_ref=canada-politics&ir=Canada%20Politics
2012-12-26,11:01:55,15g601,68,China opens world's longest high-speed rail route,bbc.co.uk,http://www.bbc.co.uk/news/world-asia-china-20842836
2012-12-26,02:35:34,15fgk4,67, Egyptian voters back new constitution,bbc.co.uk,http://www.bbc.co.uk/news/world-middle-east-20842487
2012-12-26,02:42:57,15fgxd,59,"Egypt constitution approved with 63.8 percent: election committee
",reuters.com,http://www.reuters.com/article/2012/12/25/us-egypt-politics-idUSBRE8BL03X20121225
2012-12-26,12:42:20,15gb9f,59,"Facebook paid £2.9m tax on £840m profits made outside US, figures show ",guardian.co.uk,http://www.guardian.co.uk/technology/2012/dec/23/facebook-tax-profits-outside-us
2012-12-26,11:01:29,15g5za,59,"Corrupt Chinese Officials Draw Unusual Publicity - These have been nerve-racking times for Chinese officials who once were able to cheat, lie and steal with the expectation that no one would write about it.",nytimes.com,http://www.nytimes.com/2012/12/26/world/asia/corrupt-chinese-officials-draw-unusual-publicity.html
2012-12-26,03:41:23,15fjyw,44,Catholic Church urges Irish to oppose abortion law,timesofindia.indiatimes.com,http://timesofindia.indiatimes.com/world/uk/Catholic-Church-urges-Irish-to-oppose-abortion-law/articleshow/17750852.cms
2012-12-26,16:26:30,15glci,38,"Disenchanted with peace process, EU may try to force Israel, PA into agreement ",haaretz.com,http://www.haaretz.com/news/diplomacy-defense/disenchanted-with-peace-process-eu-may-try-to-force-israel-pa-into-agreement.premium-1.490010
2012-12-26,23:52:33,15gyol,35,China Scholars Demand Ruling Party Relax Its Grip on Government- Bloomberg,mobile.bloomberg.com,http://mobile.bloomberg.com/news/2012-12-26/china-scholars-demand-ruling-party-relax-its-grip-on-government.html
