2012-10-22,03:40:12,11urak,3219,Soldier sacked by the army 72 hours before he gets his full pension,mirror.co.uk,http://www.mirror.co.uk/news/uk-news/soldier-sacked-by-army-72-hours-1389909
2012-10-22,19:49:47,11w1ze,2905,Pussy Riot band members sent to remote prison camps. Maria Alyokhina and Nadezhda Tolokonnikova to serve sentences in Russia's 'harshest prisons' in Perm and Mordovia.,guardian.co.uk,http://www.guardian.co.uk/world/2012/oct/22/pussy-riot-remote-prison-camps
2012-10-22,20:47:40,11w3m7,574,"Scientists await verdict in Italy quake trial:  Seismologists face four years in jail if found guilty, in a case that has sparked outrage in the scientific community.",aljazeera.com,http://www.aljazeera.com/news/europe/2012/10/201210226325512930.html
2012-10-22,00:22:06,11ugop,455,"Police protection or citizen censorship? Spain to ban photos and videos of cops, ""just at a time when the streets are boiling"".",rt.com,http://rt.com/news/spain-ban-photos-police-794/
2012-10-22,02:22:20,11umsh,426,"Voters in Iceland back new constitution, more control of natural resources such as fish and geothermal energy.
",reuters.com,http://www.reuters.com/article/2012/10/21/us-iceland-referendum-idUSBRE89K09C20121021
2012-10-22,20:52:19,11w3qm,295,"WWF brings Russian bison back:  WWF brings Europe’s largest land mammal, nearly extinct, back to woodlands of North Caucasus.",washingtonpost.com,http://www.washingtonpost.com/world/europe/wwf-brings-russian-bison-back/2012/10/21/43c40a2e-149a-11e2-ba83-a7a396e6b2a7_story.html
2012-10-22,16:10:44,11vwjc,271,A Pakistani man who was acquitted of a blasphemy charge has been shot dead by two men in Punjab province,hindustantimes.com,http://www.hindustantimes.com/world-news/Pakistan/Pak-man-shot-dead-after-being-acquitted-of-blasphemy/Article1-947643.aspx
2012-10-22,01:30:02,11uk0a,200,"Czech Pirate Libor Michálek wins first Senator's seat, Czech win International race to national-level legislatures",falkvinge.net,http://falkvinge.net/2012/10/21/pirate-parties-win-first-senators-seat-czech-win-international-race/
2012-10-22,01:12:57,11uj5o,153,Morocco denies destruction by Salafi Muslims of pagan rock carving,msnbc.msn.com,http://www.msnbc.msn.com/id/49492550/ns/world_news-mideast_n_africa/#.UIQeu91lSfk
2012-10-22,11:09:36,11vhld,136,Rhino slaughter in South Africa sets savage pace: Poachers have killed 455 rhinos so far this year in South Africa -- more than half in a single national park -- topping last year’s mark of 448,worldnews.nbcnews.com,http://worldnews.nbcnews.com/_news/2012/10/17/14508622-rhino-slaughter-in-south-africa-sets-savage-pace-455-so-far-this-year
2012-10-22,18:54:48,11w0o2,114,Former banker Greg Smith says focus at bank [Goldman’s] was to sell the most complex product to the least sophisticated investor.,telegraph.co.uk,http://www.telegraph.co.uk/finance/newsbysector/banksandfinance/9624360/Unsophisticated-investors-were-the-golden-prize-at-Goldman-says-Greg-Smith-in-memoir.html
2012-10-22,11:25:59,11vim5,115,"As world helps shot Pakistani girl, Afghans ask ""what about us?"": The global attention bestowed on a Pakistani schoolgirl shot by the Taliban has sparked outcry amongst many Afghans dismayed by what they say is the unequal response to the plight of their women and children",reuters.com,http://www.reuters.com/article/2012/10/21/us-pakistan-girl-afghanistan-idUSBRE89K0JY20121021
2012-10-22,14:42:34,11vt8z,83,"Europe's lost generation costs €153bn a year, study finds: EU agency estimates cost in state welfare and lost production of 14 million young adults not in employment, education or training",guardian.co.uk,http://www.guardian.co.uk/society/2012/oct/22/europe-lost-generation-costs-study
2012-10-23,00:18:34,11wcpy,82,BBC News - L'Aquila quake: Italy scientists face trial verdict,bbc.co.uk,http://www.bbc.co.uk/news/world-europe-20025626
2012-10-22,03:36:55,11ur33,76,Large majority of Germans back govt's decision to phase out nuclear power -  Germany's grid operators announced  that a surcharge on households' electricity prices financing the expansion of renewable energies will increase by 47% starting in January. ,news.yahoo.com,http://news.yahoo.com/poll-germans-accept-nuke-exit-despite-rising-bill-140141332.html
2012-10-22,21:46:38,11w5jr,69,"Iran's judiciary has blocked a request by Mahmoud Ahmadinejad to visit Tehran's Evin prison, where a top presidential aide is being held",guardian.co.uk,http://www.guardian.co.uk/world/2012/oct/22/mahmoud-ahmadinejad-prison-visit-blocked
2012-10-22,08:46:38,11v923,73,"Northern Ghana has six witch camps that have been in existence for more than 100 years, accommodating 800 accused witches — almost all of them women.",thestar.com,http://www.thestar.com/news/world/article/1273638--ghana-s-witch-camps-places-of-shame-with-no-escape
2012-10-22,18:20:37,11vzus,65,"Scientists link deep wells to deadly Spain quake
",google.com,http://www.google.com/hostednews/ap/article/ALeqM5g6q0SuXHb2DbLeNaDlVvAgjBklOA?docId=6a02abeecff845e9ab4c23050b2de9b4
2012-10-22,21:33:15,11w52e,57,Men accused of rucksack bomb plot. Three Birmingham men have gone on trial accused of planning a bomb campaign prosecutors say may have been bigger than the 7 July London attacks. ,bbc.co.uk,http://www.bbc.co.uk/news/uk-20007532
2012-10-22,21:58:39,11w616,53,Okinawa legislators protest alleged rape by US sailors.,aljazeera.com,http://www.aljazeera.com/news/asia-pacific/2012/10/2012102282736909598.html
2012-10-22,04:05:31,11usta,51,Separatists win Basque election in Spain - exit polls.,bbc.co.uk,http://www.bbc.co.uk/news/world-europe-20022218
2012-10-22,18:07:53,11vzka,43,Canada: XL Foods dumps E.coli tainted meat at landfill,cbc.ca,http://www.cbc.ca/news/canada/calgary/story/2012/10/21/calgary-brooks-xlfoods-dumping.html
2012-10-22,09:21:46,11vb5z,42,S. Korea Prepares to Evacuate DMZ Citizens,businessweek.com,http://www.businessweek.com/news/2012-10-21/south-korea-prepares-to-evacuate-citizens-as-north-threatens
2012-10-22,02:52:20,11uoft,33,"UK risks undermining human rights legislation, Europe's top judge warns",guardian.co.uk,http://www.guardian.co.uk/law/2012/oct/21/uk-undermining-human-rights-legislation
2012-10-23,00:56:15,11werk,30,Italy scientists found guilty in quake trial - Al Jazeera English,aljazeera.com,http://www.aljazeera.com/news/europe/2012/10/20121022151851442575.html
2012-10-22,03:48:47,11urs5,22,French President Proposes Banning Homework,abcnews.go.com,http://abcnews.go.com/blogs/headlines/2012/10/french-president-proposes-banning-homework/
2012-10-22,06:22:16,11v0se,20,Life in Uruguay: legal abortion and pot dealing,news.yahoo.com,http://news.yahoo.com/life-uruguay-legal-abortion-pot-dealing-204424950.html
2012-10-22,06:14:00,11v0cx,20,Gadhafi's son reported slain in militia fighting in Libya,ottawacitizen.com,http://www.ottawacitizen.com/news/Gadhafi+reported+slain+militia+fighting+Libya/7422878/story.html
2012-10-22,09:09:59,11vafk,18,Western policy on Syria is failing on a monumental scale,guardian.co.uk,http://www.guardian.co.uk/commentisfree/2012/oct/21/west-policy-syria-failure-russia-iran
2012-10-22,22:02:28,11w66s,20,UK intelligence officers knew of CIA's rendition plans within days of 9/11,guardian.co.uk,http://www.guardian.co.uk/world/2012/oct/22/british-cia-rendition-9-11
