2012-08-29,07:18:33,yzib5,2610,"Poor in India Starve as Politicians Steal $14.5 Billion of Food -- ""The theft blunted the country’s only weapon against widespread starvation -- a five-decade-old public distribution system that has failed to deliver record harvests to the plates of India’s hungriest.""",bloomberg.com,http://www.bloomberg.com/news/2012-08-28/poor-in-india-starve-as-politicians-steal-14-5-billion-of-food.html
2012-08-29,22:17:51,z0ntx,2316,"Shenzhen, where some of China's largest electronics manufacturers are located, looks set to hike its minimum wage by 13.3%, in a move that could cause a ripple effect across the world's major technology companies.",wired.co.uk,http://www.wired.co.uk/news/archive/2012-08/28/shenzhen-pay-increase
2012-08-29,18:27:55,z0gac,1937,Bill for gay marriage passes first reading in New Zealand,stuff.co.nz,http://www.stuff.co.nz/national/politics/7575137/Bill-passes-first-reading
2012-08-29,19:43:50,z0i7f,1794,Russia’s volleyball coach commits suicide after Olympic failure – report,rt.com,http://rt.com/sport/ovchinnikov-russia-volleyball-suicide-832/
2012-08-29,22:00:09,z0n1r,901,Hundreds Of Websites Go Dark In Jordan In SOPA-Style #BlackoutJo Protest Over Internet Freedom,techcrunch.com,http://techcrunch.com/2012/08/29/150-websites-go-dark-in-jordan-in-sopa-style-blackoutjo-protest-over-internet-freedom/
2012-08-29,14:47:36,z099o,881,"Desmond Tutu quits summit with Blair over invasion of Iraq. Nobel peace winner says he won't share platform with 'morally indefensible' former PM
",independent.co.uk,http://www.independent.co.uk/news/world/politics/desmond-tutu-quits-summit-with-blair-over-invasion-of-iraq-8084805.html
2012-08-29,04:25:09,yz6ey,367,Blizzard cuts off Iranian Access to WoW because of 'U.S. trade sanctions',bbc.com,http://www.bbc.com/news/technology-19399375
2012-08-29,00:49:08,yysdx,299,Father blows up daughter's boyfriend.,cp24.com,http://www.cp24.com/world/angry-father-blew-up-daughter-s-boyfriend-police-1.932921
2012-08-29,04:56:40,yz8jo,295,"Russian President Vladimir Putin is spending billions of taxpayers' rubles on 20 luxurious residences, 43 jets and four yachts, a top opposition leader claimed Tuesday. It's estimated that the maintenance of Putin's residences, jets and cars alone costs $2.5 billion a year.",hosted.ap.org,http://hosted.ap.org/dynamic/stories/E/EU_RUSSIA_PUTINS_LIFESTYLE?SITE=RIPAW&SECTION=HOME&TEMPLATE=DEFAULT
2012-08-29,21:15:25,z0l77,257,"Possible Malaria cure found at the University of Cape Town, South Africa.",news24.com,http://www.news24.com/SouthAfrica/News/UCT-in-malaria-cure-breakthrough-20120829
2012-08-29,21:00:19,z0klm,249,"CIA balked at chance to kill bin Laden in ‘99, Polish ex-spy says",miamiherald.com,http://www.miamiherald.com/2012/08/28/2972685/cia-balked-at-chance-to-kill-bin.html
2012-08-29,19:31:48,z0hvq,179,"IBM and MS deciding New Zealand legislation: In 2010, Microsoft and IBM convinced the Ministry of Economic Dev to abandon plans to exclude software from patentability, as seen in the new version of the text published on Aug 2012",en.swpat.org,http://en.swpat.org/wiki/IBM_and_MS_deciding_New_Zealand_legislation
2012-08-29,10:29:54,yzu98,136,"Bolivian police seize 2 tons of uranium...that was being stored at a building in central La Paz located near the U.S. and Spanish embassies.
",latino.foxnews.com,http://latino.foxnews.com/latino/news/2012/08/28/bolivian-police-seize-2-tons-uranium/
2012-08-29,01:03:43,yyt8n,124,China test-fires new nuclear-capable ICBM,hindustantimes.com,http://www.hindustantimes.com/world-news/China/China-test-fires-new-nuclear-capable-ICBM/Article1-920808.aspx
2012-08-29,05:26:30,yzalj,105,Multiple roofs on fire after planned WW2 Bomb detonation in Munich ,translate.google.com,http://translate.google.com/translate?hl=de&sl=de&tl=en&u=http%3A%2F%2Fwww.abendzeitung-muenchen.de%2Finhalt.bombenfund-in-schwabing-az-liveticker%3A-helis-kreisen-ueber-schwabing.0db9be54-42ba-48a5-a7ad-3e7584954b17.html
2012-08-29,22:34:35,z0ooq,99,"Is ABC Starting to Understand BitTorrent Demand? In an attempt to dissuade Aussie punters from torrenting the show, ABC announced it will offer this weekend’s new Doctor Who episode on its iView service as soon as it finishes airing in the UK",torrentfreak.com,https://torrentfreak.com/is-abc-starting-to-understand-bittorrent-demand-120829/
2012-08-29,02:13:19,yyxhv,97,France opens murder inquiry' into Yasser Arafat death ,bbc.co.uk,http://www.bbc.co.uk/news/world-europe-19402767
2012-08-29,22:11:02,z0nio,86,China Aims High From the Bottom of the World - Country plans 2 world-class telescopes for its Antarctic observatory.  The pair will be among the biggest & most significant telescopes in Antarctica. Astronomers have long thought Dome A is the best place on Earth to gaze at the Universe.,nature.com,http://www.nature.com/news/china-aims-high-from-the-bottom-of-the-world-1.11291
2012-08-29,21:42:49,z0mak,76,UK's Deputy PM demands an emergency tax on the rich to cope with downturn,telegraph.co.uk,http://www.telegraph.co.uk/news/politics/9504926/Nick-Clegg-demands-an-emergency-tax-on-the-rich-to-cope-with-downturn.html
2012-08-29,06:29:05,yzf0k,75,"A little bit of WWII just came back to Munich: An American bomb was found; disarming impossible; now it was detonated, setting nearby houses on fire",sueddeutsche.de,http://www.sueddeutsche.de/muenchen/ausnahmezustand-in-schwabing-bombe-in-muenchner-innenstadt-detoniert-1.1451909
2012-08-29,07:47:32,yzk4t,76,Three-person civil union sparks controversy in Brazil,bbc.co.uk,http://www.bbc.co.uk/news/world-latin-america-19402508
2012-08-29,15:02:56,z09xj,70,"Archbishop Tutu refuses platform with Blair.
Nobel Peace laureate pulls out of leadership conference in protest against ex-UK PM's role in US-led Iraq invasion.",aljazeera.com,http://www.aljazeera.com/news/africa/2012/08/20128295214839374.html?utm_content=automate&utm_campaign=Trial6&utm_source=NewSocialFlow&utm_term=plustweets&utm_medium=MasterAccount
2012-08-29,07:29:47,yzj0u,61,Red Cross halts most Pakistan aid after beheading,mobile.reuters.com,http://mobile.reuters.com/article/idUSBRE87R18O20120828?irpc=932
2012-08-29,04:20:39,yz64p,61,France opens murder inquiry into Arafat death,reuters.com,http://www.reuters.com/article/2012/08/28/us-france-arafat-idUSBRE87R0VY20120828
2012-08-29,15:39:43,z0bc7,56,Three people enter into civil union in Brazil,telegraph.co.uk,http://www.telegraph.co.uk/news/worldnews/southamerica/brazil/9504746/Three-people-enter-into-civil-union-in-Brazil.html
2012-08-29,14:15:26,z07v4,50,New Zealand to vote on same-sex marriage tonight,stuff.co.nz,http://www.stuff.co.nz/dominion-post/news/politics/7566696/Historic-same-sex-marriage-vote-today
2012-08-29,22:29:44,z0of3,45,Pitcher irrigation brings vegetables to Pakistani desert:  Pitcher irrigation – in which buried clay pots release water into the soil – delivers water directly to plant roots rather than spreading it more widely across fields.,csmonitor.com,http://www.csmonitor.com/World/Making-a-difference/Change-Agent/2012/0829/Pitcher-irrigation-brings-vegetables-to-Pakistani-desert
2012-08-29,21:52:18,z0moy,39,"Kim Dotcom Wins Release of $4.83m, Some Lawyers Set To Get Paid: NZ High Court frees $4.83 million from a govt bond seized when he was arrested; cash will go towards Dotcom’s legal expenses to date and contribute to his future fighting fund",torrentfreak.com,https://torrentfreak.com/kim-dotcom-wins-release-of-4-83m-some-lawyers-set-to-get-paid-290812/
2012-08-29,18:29:50,z0gbt,37,Marriage equality bill passes first reading and goes to select committee in New Zealand,nzherald.co.nz,http://www.nzherald.co.nz/nz/news/article.cfm?c_id=1&objectid=10830345
2012-08-29,10:59:41,yzw6g,38,"Argentinian politicians unveil plan to shoot seagulls that attack whales:  Birds regularly peck the mammals, then feed on the open wounds – behaviour environmentalists have blamed on humans ",guardian.co.uk,http://www.guardian.co.uk/environment/2012/aug/29/shoot-seagulls-that-attack-whales
