2012-03-22,23:14:47,r8g19,3355,"“Pirating” UK Student to be Extradited to the US: 'Despite public outrage Home Secretary Theresa May approved the extradition order today. The 23-yr-old student has never visited US, but now faces several years in a US prison.'",torrentfreak.com,https://torrentfreak.com/pirating-uk-student-to-be-extradited-to-the-us-120313/
2012-03-22,18:35:20,r872n,1187,"23 years old shooter in Toulouse, France, killed during assault, according to police.",lemonde.fr,http://www.lemonde.fr/societe/live/2012/03/19/direct-la-fusillade-a-toulouse_1671851_3224.html
2012-03-22,22:01:55,r8cxb,1076,Over 308'000 Post-Secondary Students (out of 450'000) in Canadian Province of Quebec On Strike Today To Protest Austerity of 75% Tuition Increase. Over 100'000 Expected In The Streets Of Montreal Today. 200'000 On Unlimited General Strike.,cbc.ca,http://www.cbc.ca/news/canada/montreal/story/2012/03/21/f-tuitionfees.html
2012-03-22,20:33:23,r89ut,721,"Australia's most-wanted man caught after 7 years hiding in bush, eating kangaroos",worldnews.msnbc.msn.com,http://worldnews.msnbc.msn.com/_news/2012/03/22/10806319-australias-most-wanted-man-caught-after-seven-years-hiding-in-bushland
2012-03-22,00:57:12,r6yea,481,"Baffling Illness Strikes Africa, Turns Children Into Violent ""Zombies""",dailytech.com,http://www.dailytech.com/article.aspx?newsid=24276
2012-03-22,12:52:49,r7yed,451,Official: Coup d'etat underway in Mali,cbsnews.com,http://www.cbsnews.com/8301-202_162-57402077/official-coup-detat-underway-in-mali/?tag=thisMorningLatest
2012-03-22,20:27:48,r89p0,298,"Contamination Time Bomb:  Chevron, TransOcean Executives Face Criminal Charge for Brazilian Oil Spill - Prosecutors say 'crime against nature' could land imprudent company's employees in jail",commondreams.org,http://www.commondreams.org/headline/2012/03/22
2012-03-22,20:17:13,r89fc,250,"Gangs of women in Zimbabwe have been picking up male travellers to have sexual intercourse and harvest their sperm, according to reports.",telegraph.co.uk,http://www.telegraph.co.uk/news/newstopics/howaboutthat/9159992/Zimbabwe-sperm-hunters-picking-up-male-travellers.html
2012-03-22,10:38:16,r7s5e,189,"Alberta colleges, universities made illegal donations to Canada's ruling Conservative party during the last few years - CBC",cbc.ca,http://www.cbc.ca/news/canada/calgary/story/2012/03/20/edmonton-college-donations-conservatives.html
2012-03-22,20:01:59,r8915,172,Muslim envoys walk out in protests at U.N. gay rights debate,english.alarabiya.net,http://english.alarabiya.net/articles/2012/03/07/199224.html
2012-03-22,23:17:52,r8g5v,145,"Kim DotCom to get monthly living expenses of $48,000: New Zealand court rules that the MegaUpload founder and alleged pirate will see more monthly cash and also be allowed the use of one of his cars",news.cnet.com,http://news.cnet.com/8301-31001_3-57402255-261/kim-dotcom-to-get-monthly-living-expenses-of-$48000/?tag=mncol
2012-03-23,00:54:18,r8kp2,97,Indian government may have lost $210 billion in 'mother of all scams',worldnews.msnbc.msn.com,http://worldnews.msnbc.msn.com/_news/2012/03/22/10811013-auditor-indian-government-may-have-lost-210-billion-in-mother-of-all-scams?ocid=twitter
2012-03-22,23:07:04,r8fop,73,Anti-piracy outfit BREIN is trying to stop the massive influx of Pirate Bay proxy sites that circumvent a court-ordered blockade in the Netherlands,torrentfreak.com,https://torrentfreak.com/anti-piracy-group-shuts-down-pirate-bay-proxies-120322/
2012-03-23,07:38:37,r957x,54,Syrian rebels running out of ammunition as government presses offensive,washingtonpost.com,http://www.washingtonpost.com/world/middle_east/syrian-rebels-running-out-of-ammunition-as-government-presses-offensive/2012/03/22/gIQA05CNUS_story.html
2012-03-23,02:40:40,r8pzj,45,Marijuana Must Be Legalized ,huffingtonpost.com,http://www.huffingtonpost.com/robert-corry/marijuana-legalization_b_1340273.html
2012-03-22,12:38:45,r7xt1,40,"Massive fire sweeps through one of the oldest markets in Calcutta, destroying most of the shops - 30 fire engines fought the blaze for over 4 hours ",bbc.co.uk,http://www.bbc.co.uk/news/world-asia-india-17470994
2012-03-22,20:40:20,r8a2i,39,"Why the World Should Keep Destructive Men Out of the World Bank:  ""Just between you and me, shouldn't the World Bank be encouraging more migration of the dirty industries to the Lesser Developed Countries?"" (quote from banker Larry Summers, leading nominee to head the World Bank) ",commondreams.org,http://www.commondreams.org/view/2012/03/21
2012-03-22,19:36:13,r88dt,31,Toulouse shooting suspect Mohamed Merah dies jumping from his apartment window with gun in hand,hosted.ap.org,http://hosted.ap.org/dynamic/stories/E/EU_FRANCE_TERROR_SUSPECT?SITE=AP&SECTION=HOME&TEMPLATE=DEFAULT&CTIME=2012-03-22-07-14-25
2012-03-23,03:11:24,r8ric,37,IMF Banksters worst fear: Egyptians launch campaign to repudiate Mubarak's debt's,islamist.com,http://www.islamist.com/index.php/revolution/2092-egyptians-launch-campaign-to-repudiate-mubaraks-debts
2012-03-23,07:45:10,r95k5,27,"Magna Carta to get modern makeover for 800th birthday
| Reuters",reuters.com,http://www.reuters.com/article/2012/03/22/us-britain-magnacarta-idUSBRE82L0RB20120322
2012-03-22,18:00:10,r86cy,25,Soldiers stage coup in Mali ,independent.co.uk,http://www.independent.co.uk/news/world/africa/soldiers-stage-coup-in-mali-7581081.html
2012-03-22,23:22:04,r8gc4,24,The Brazilian who wants to jail Chevron oilmen,reuters.com,http://www.reuters.com/article/2012/03/22/us-chevron-brazil-prosecutor-idUSBRE82K1MV20120322
2012-03-22,19:44:14,r88kc,26,Iraqi Kurdistan threatens to declare independence,presstv.com,http://www.presstv.com/detail/232718.html
2012-03-23,04:57:58,r8wzb,24,"Leaked documents show 9,000 Nazi war criminals fled to South America after World War 2",in.news.yahoo.com,http://in.news.yahoo.com/leaked-documents-show-9-000-nazi-war-criminals-084124057.html
2012-03-22,16:30:51,r84qi,19,"(Telegraph) — Suspected al Qaeda militants unleashed a wave of terror across Baghdad and 11 other Iraqi cities on Thursday, killing at least 60 people in a series of attacks on government buildings, security targets, restaurants and a primary school",telegraph.co.uk,http://www.telegraph.co.uk/news/worldnews/middleeast/iraq/9100067/Dozens-killed-in-Iraq-bombings.html
2012-03-23,05:24:23,r8yck,20,Dutch filmmaker admits faking viral 'human bird wing' video,foxnews.com,http://www.foxnews.com/scitech/2012/03/22/viral-human-bird-wings-video-fake-probably-ad-expert-says/
2012-03-23,07:34:18,r9507,17,"Protesting Natives, Supported by Opponents of President Rafael Correa, Shut Down Ecuador Capital ",france24.com,http://www.france24.com/en/20120322-protesting-natives-shut-down-ecuador-capital
2012-03-22,10:58:49,r7t5z,13,Lawyers in China to swear allegiance to Communist Party,bbc.co.uk,http://www.bbc.co.uk/news/world-asia-china-17470818
2012-03-22,22:57:24,r8f9l,13,"Bizarre Combo Rulings From EU Court Of Justice: Dentists Don't Have To Pay Music Royalties, But Hotels Do",techdirt.com,http://www.techdirt.com/articles/20120319/04441818156/bizarre-combo-rulings-eu-court-justice-dentists-dont-have-to-pay-music-royalties-hotels-do.shtml
2012-03-23,03:48:19,r8tem,12,Former Goldman Sachs employees form union in Japan to demand their jobs back,dealbook.nytimes.com,http://dealbook.nytimes.com/2012/03/22/former-goldman-employees-form-union-in-japan/
