2012-01-26,02:14:38,owbqo,2224,"Fidel Castro lambasted the Republican presidential race as the greatest competition of ""idiocy and ignorance"" the world has ever seen",realclearpolitics.com,http://www.realclearpolitics.com/news/ap/politics/2012/Jan/25/castro_lambasts_us_republican_primary_as_idiotic.html
2012-01-27,03:08:05,oxxsp,543,How Swedes and Norwegians Broke the Power of the ‘1 Percent’,commondreams.org,https://www.commondreams.org/view/2012/01/26-3
2012-01-26,22:38:36,oxlhh,427,"Doctors Without Borders is halting its work in detention centers in the Libyan city of Misrata because detainees are ""tortured and denied urgent medical care."" ",edition.cnn.com,http://edition.cnn.com/2012/01/26/world/africa/libya-msf-torture/index.html?hpt=hp_t1
2012-01-26,17:56:17,oxfcr,421,"SOPA coming to Canada, warns Michael Geist ",business.financialpost.com,http://business.financialpost.com/2012/01/24/sopa-like-laws-could-be-coming-to-canada-expert-warns/
2012-01-26,18:15:48,oxfoh,405,"Europe proposes a ""right to be forgotten"" - 

The European Commission proposes new set of data protection rules that'd give EU citizens a much greater say over how their personal data is collected & stored—including the right to have it deleted entirely. The response from businesses has been mixed.",arstechnica.com,http://arstechnica.com/tech-policy/news/2012/01/eu-proposes-a-right-to-be-forgotten.ars
2012-01-26,23:52:36,oxocu,367,"Clooney satellite project shows the Sudan army is preparing a major assault
",globalpost.com,http://www.globalpost.com/dispatches/globalpost-blogs/africa-emerges/sudan-news-clooney-satellite-project-shows-preparations-a
2012-01-26,20:58:18,oxinx,361,"The 'Human Costs' of an iPad -- ""Oddly, it is Apple's own internal reports that reveal most of these problems to Western observers, but attempts to correct the issues and improve the fortunes of laborers have a tendency to clash with the company's own insistence on low costs and high volume.""",theatlanticwire.com,http://www.theatlanticwire.com/business/2012/01/human-costs-ipad/47886/
2012-01-27,00:52:07,oxr2n,327,ACTA: The International Treaty You've Never Heard of That Could Affect Internet Freedom,commondreams.org,https://www.commondreams.org/headline/2012/01/25-3
2012-01-26,02:25:53,owca8,310,"'Strict Muslim' raped four women at knifepoint to 'punish them for being on the streets at night'

",dailymail.co.uk,http://www.dailymail.co.uk/news/article-2091669/Sunny-Islam-Strict-Muslim-raped-4-women-knifepoint-punish-them.html
2012-01-27,05:05:59,oy3x8,248,"A mentally insane bus driver in India ran over people and vehicles and continued speeding, a college student chased him down with his motorcycle, jumped in the bus, and dragged the bus driver out.",timesofindia.indiatimes.com,http://timesofindia.indiatimes.com/city/pune/21-year-old-stops-Pune-rogue-driver-prevents-more-damage/articleshow/11634763.cms
2012-01-26,21:25:19,oxjaf,211,The EU signs up to Acta (Wired UK),wired.co.uk,http://www.wired.co.uk/news/archive/2012-01/26/eu-signs-up-to-acta
2012-01-26,13:09:09,ox7i8,189,"200 Aboriginals storm building, Australian Prime minister rushed out by police and security",dailytelegraph.com.au,http://www.dailytelegraph.com.au/news/pm-julia-gillard-and-opposition-leader-tony-abbott-trapped-in-aboriginal-protest-on-australia-day/story-e6freuy9-1226254391578
2012-01-26,03:09:58,owedw,187,Chinese forces open fire on Tibetan protesters. Deadly clashes between ethnic Tibetans and Chinese security forces have spread to a second area in southwestern China.,usatoday.com,http://www.usatoday.com/news/world/story/2012-01-25/china-tibet-open-fire/52788902/1
2012-01-27,05:41:59,oy5s6,108,"Chevron to face criminal charges over Brazil spill.
",reuters.com,http://www.reuters.com/article/2012/01/26/us-chevron-brazil-idUSTRE80P22M20120126
2012-01-26,11:52:05,ox40d,99,Iran won't move toward nuclear weapon in 2012 - ISIS report,uk.reuters.com,http://uk.reuters.com/article/2012/01/26/uk-usa-iran-nuclear-idUKTRE80P06120120126?feedType=RSS&feedName=worldNews&utm_source=feedburner&utm_medium=feed&utm_campaign=Feed%3A+Reuters%2FUKWorldNews+%28News+%2F+UK+%2F+World+News%29
2012-01-26,22:32:00,oxl9l,87,The head of the Syrian Arab Red Crescent has been shot dead on the road to Damascus,euronews.net,http://www.euronews.net/2012/01/26/red-crescent-chief-is-shot-dead-in-syria/
2012-01-26,16:46:00,oxe2m,77,"One in three children tested in Fukushima have been found to have lumps in their thyroid. This corresponds to 1,143 children.",enenews.com,http://enenews.com/1143-fukushima-children-lumps-thyroid-gland-26-1-every-3-kids-tested
2012-01-26,23:50:42,oxoaf,73,Schoolchildren at a school in South Africa's northern Limpopo province are boycotting classes over claims that their teachers are pestering female pupils for sex.,telegraph.co.uk,http://www.telegraph.co.uk/news/worldnews/africaandindianocean/southafrica/9041810/Children-boycott-South-African-school-over-teacher-sex-pest-claims.html
2012-01-27,02:05:34,oxunu,70,North Korea threatens to punish mobile-phone users as 'war criminals',telegraph.co.uk,http://www.telegraph.co.uk/news/worldnews/asia/northkorea/9040152/North-Korea-threatens-to-punish-mobile-phone-users-as-war-criminals.html
2012-01-26,23:19:35,oxn0e,69,"China says EU ban on Iran oil not ""constructive"":  China on Thursday criticized the European Union for banning oil imports from Iran, Beijing's third biggest crude supplier and a major trading partner.",reuters.com,http://www.reuters.com/article/2012/01/26/us-china-iran-idUSTRE80P0FJ20120126
2012-01-26,11:40:01,ox3g6,67,"The Devastating Costs of the Amazon Gold Rush - 
Spurred by rising global demand for the metal, miners are destroying invaluable rainforest in Peru's Amazon basin",smithsonianmag.com,http://www.smithsonianmag.com/people-places/The-Devastating-Costs-of-the-Amazon-Gold-Rush.html
2012-01-26,21:41:26,oxjqi,63,Ahmadinejad: Iran ready for nuclear talks - CBS News,cbsnews.com,http://www.cbsnews.com/8301-202_162-57366508/ahmadinejad-iran-ready-for-nuclear-talks/
2012-01-26,11:50:36,ox3xj,56,Sexy interracial poster sparks furor in South Africa ,theglobeandmail.com,http://www.theglobeandmail.com/news/world/sexy-interracial-poster-sparks-furor-in-south-africa/article2315134/
2012-01-27,00:53:21,oxr4s,56,"Revenge for EU Sanctions:
Iran Set to Turn Off Oil Supply to Europe",spiegel.de,"http://www.spiegel.de/international/world/0,1518,811507,00.html"
2012-01-26,19:57:36,oxhdw,52,Chávez's daughter posts picture of herself posing with dollars,guardian.co.uk,http://www.guardian.co.uk/world/2012/jan/26/chavez-daughter-instagram-picture-dollars
2012-01-26,04:30:25,owidm,50,Credible intel suggests that Israel may strike Iran within this year,guardian.co.uk,http://www.guardian.co.uk/world/julian-borger-global-security-blog/2012/jan/25/israel-iran
2012-01-26,11:59:21,ox4b9,29,Two buildings in Rio collapse - CNN.com,cnn.com,http://www.cnn.com/2012/01/25/world/americas/brazil-building-collapse/index.html?hpt=hp_t2
2012-01-26,19:16:06,oxgo4,29,"Can a New Kind of Rice Revive Japan's Tsunami-Ravaged Paddies? - Over 58,000 acres of rice paddies were completely saturated with saltwater. Now, a rice plant is being formulated to thrive in the salt-soaked fields.",motherjones.com,http://motherjones.com/blue-marble/2012/01/genomic-rice-breeding-Japan-tsunami-salt
2012-01-26,08:22:12,owtzn,28,"Farmers on red alert over outbreaks of new livestock disease -  
Identified in Britain for 1st time, it causes birth deformities in sheep, cattle & goats.  It's believed the disease was carried across the Channel by infected midges during the late summer & autumn.",independent.co.uk,http://www.independent.co.uk/environment/nature/farmers-on-red-alert-over-outbreaks-of-new-livestock-disease-6293705.html
2012-01-27,02:41:47,oxwh3,26,"Mexico is next stop for US security contractors. ""10,000 [firms] operating without proper authorization."" ",washingtonpost.com,http://www.washingtonpost.com/world/americas/security-contractors-see-new-opportunities-in-mexico/2012/01/03/gIQAUj3wSQ_print.html
