2012-02-04,20:09:36,pakb6,2498,"Marietje Schaake: ""As a Member of the European Parliament, I very much welcome the increased attention ACTA has received in the past weeks. It has taken a while for massive outcry to emerge, but we are seeing protest voices getting louder and louder"" -- We Need Copyright Reform, Not ACTA!

    
    ",torrentfreak.com,https://torrentfreak.com/we-need-copyright-reform-not-acta-120204/
2012-02-04,21:03:48,pal8c,1907,European Commission inadvertently reveals that ACTA will indeed bring censorship to the Internet,falkvinge.net,http://falkvinge.net/2012/02/03/european-commission-slip-reveals-censorship-in-acta/
2012-02-04,01:57:21,p9i74,1858,Poland freezes acta ratification,google.com,http://www.google.com/hostednews/afp/article/ALeqM5gUzE-5YkRY50hVqPpcBVy6hYZDOQ?docId=CNG.700849e3f913fe85bcfa4ab200e6f620.01
2012-02-04,08:11:44,p9zqp,987,"Muslim family jailed for life after 'despicable' honour killing of three teen daughters who dared to date boys.
",dailymail.co.uk,http://www.dailymail.co.uk/news/article-2093513/Afghan-family-guilty-honour-killing-Canada.html
2012-02-04,20:59:38,pal4l,977,Swedes out in force to protest ACTA ,thelocal.se,http://www.thelocal.se/38920/20120204/
2012-02-04,09:03:35,pa1st,820,Syria: Over 200 dead  after 'massacre' in Homs.  Friday evening shelling by security forces on eve of UN vote on removal of Bashar al-Assadr,guardian.co.uk,http://www.guardian.co.uk/world/2012/feb/04/syria-report-homs-killings
2012-02-04,19:27:28,pajnf,643,Tens of thousands of people are marching in Russia's capital Moscow in protest at Prime Minister Vladimir Putin's grip on power,bbc.co.uk,http://www.bbc.co.uk/news/world-europe-16885446
2012-02-04,20:40:17,paksr,567,"Following the growing ACTA protests in Europe and signs of US meddling, Poland's PM makes it clear that Poland will not ratify ACTA for the time being, leading to speculation that the EU may not actually join ACTA ",techdirt.com,http://www.techdirt.com/articles/20120203/11115017653/poland-prime-minister-suspends-any-effort-to-ratify-acta-may-kill-acta-eu.shtml
2012-02-04,09:59:58,pa3xz,300,Jerusalem's Armenians outraged as city approves Jews-only parking lot in Old City,haaretz.com,http://www.haaretz.com/print-edition/news/jerusalem-s-armenians-outraged-as-city-approves-jews-only-parking-lot-in-old-city-1.410694
2012-02-04,09:59:18,pa3x2,277,"Isotopes hint at North Korean nuclear test. Data 
suggest that the country has experimented with a 
fusion boost to its fission weapons",nature.com,http://www.nature.com/news/isotopes-hint-at-north-korean-nuclear-test-1.9972
2012-02-04,10:22:32,pa4td,179,At least 217 Syrian protesters killed in Homs,jpost.com,http://www.jpost.com/MiddleEast/Article.aspx?id=256394
2012-02-04,00:41:27,p9er5,174,"Europe is too emotional about fracking, says Shell chief ",independent.co.uk,http://www.independent.co.uk/news/business/news/europe-is-too-emotional-about-fracking-says-shell-chief-6316129.html
2012-02-05,01:06:37,parbx,176,China and Russia veto UN resolution condemning Syria,nytimes.com,http://www.nytimes.com/2011/10/06/world/middleeast/with-united-nations-veto-russia-and-china-help-syria.html?pagewanted=all
2012-02-04,15:44:23,pafmc,171,"Canadian Muslim jailed for using the words ""blow away"" in a text message",google.com,http://www.google.com/hostednews/afp/article/ALeqM5hGXdxC9Jx55AcZMrhWfzs5u9lAIA?docId=CNG.c65bebdffb33578a1d35aa9b986d32b0.3c1
2012-02-04,06:25:41,p9v69,132,Expert claims that 16 million Chinese women are married to gay men,chinadaily.com.cn,http://www.chinadaily.com.cn/china/2012-02/03/content_14528838.htm
2012-02-04,08:54:01,pa1fj,122,Japanese Government wages war against Yakuza,nytimes.com,http://www.nytimes.com/2012/02/03/world/asia/with-risk-japanese-city-takes-on-once-accepted-fact-of-life-its-gangsters.html?_r=1&ref=asia
2012-02-04,07:50:44,p9yuf,112,Fox Flub: Russian Vostok Lake Scientists Safe,usnews.com,http://www.usnews.com/news/articles/2012/02/03/fox-flub-russian-vostok-lake-scientists-safe
2012-02-05,01:25:54,pas0z,111,"Tunisia plans to expel Syrian ambassador, end recognition of Assad’s regime",english.alarabiya.net,http://english.alarabiya.net/articles/2012/02/04/192554.html
2012-02-04,20:15:43,pakem,110,BBC News - Oldest woman in Cuba celebrates her 127th birthday,bbc.co.uk,http://www.bbc.co.uk/news/world-latin-america-16860667
2012-02-05,04:31:31,pazbf,99,Unrest in Tibet leads China to cut off internet and mobile phone service in a 30 sq mile radius. ,guardian.co.uk,http://www.guardian.co.uk/world/2012/feb/03/china-internet-links-tibetan-unrest
2012-02-04,10:26:17,pa4ym,78,"'Scores dead' in fighting in Syria's Homs: Activists say ""hundreds"" killed or injured as government forces use tanks and machine guns in central city.",aljazeera.com,http://www.aljazeera.com/news/middleeast/2012/02/201223231333768854.html
2012-02-04,18:46:10,paj09,70,"Ahmadinejad: Iran to increase military spending ""by more than two fold""",english.ruvr.ru,http://english.ruvr.ru/2012/02/03/65251124.html
2012-02-04,18:32:38,paisj,67,"Petrodollar pumping US policy on Iran, backfire looms.",rt.com,http://rt.com/news/iran-attack-us-allegations-243/
2012-02-05,04:40:28,pazoa,59,US 'disgust' as Russia and China veto UN Syria resolution,bbc.co.uk,http://www.bbc.co.uk/news/world-middle-east-16890434
2012-02-04,08:03:53,p9zff,54,"At least 105 people killed in Syria's Homs-rights group
| Agricultural Commodities
| Reuters",af.reuters.com,http://af.reuters.com/article/commoditiesNews/idAFL5E8D34QQ20120203
2012-02-04,23:29:40,paod9,56,UN: Famine conditions in Somalia/East Africa have ended,bbc.co.uk,http://www.bbc.co.uk/news/world-africa-16866913
2012-02-04,18:37:14,paiv4,51,"100,000 Protesters at Anti-Putin Rally say Organizers, Police say 33,000",en.rian.ru,http://en.rian.ru/society/20120204/171134854.html
2012-02-04,22:03:47,pambo,48,India is set to clamp-down on lavish weddings and cap the amount poor families can spend on them in an attempt to reduce rising debt and dowry-related crimes,telegraph.co.uk,http://www.telegraph.co.uk/news/worldnews/asia/india/9059436/India-to-clamp-down-on-lavish-weddings.html#.Ty06tk8H8LY.reddit
2012-02-05,04:31:31,pazbe,45,"Hackers apparently hit Swedish government site,
A group associated with Anonymous claims to protest an anti-piracy trade agreement",msnbc.msn.com,http://www.msnbc.msn.com/id/46263937/ns/technology_and_science-security/#.Ty2XDuNSSFg
2012-02-04,09:59:20,pa3x3,45,"Tibetan activists continue protests:  China has ratcheted up security in Tibetan region, cutting internet and phone service.",globalpost.com,http://www.globalpost.com/dispatches/globalpost-blogs/china/tibet-activists-protests-dalai-lama
