2012-03-04,20:03:18,qh3h3,1928,"In one of India's poorest states, 2 entrepreneurs build and operate solar-powered micro grids to provide low-cost lighting and mobile phone charging to village houses, giving many rural people access to both light and power for the first time in their lives",treehugger.com,http://www.treehugger.com/renewable-energy/solar-powered-micro-grids-light-indian-villages.html
2012-03-04,00:18:39,qfzsp,1676,"Kill the Messenger --- What Russia taught Syria: When you destroy a city, make sure no one -- not even the story -- gets out alive.",foreignpolicy.com,http://www.foreignpolicy.com/articles/2012/03/02/kill_the_messenger
2012-03-04,22:27:25,qh627,1565,Canadian Senate Passes Harsh Crime Bill: ... that includes mandatory minimum prison sentences for growing as few as six marijuana plants',stopthedrugwar.org,http://stopthedrugwar.org/chronicle/2012/mar/02/canadian_senate_passes_harsh_cri
2012-03-04,11:53:42,qgr2z,1196,"Costa Rican President Laura Chinchilla adds her voice to the rising clamor for discussions on drug legalization as an alternative to the current state of affairs, in which Central American nations see themselves as increasingly threatened by the illicit drug trade",stopthedrugwar.org,http://stopthedrugwar.org/chronicle/2012/mar/02/costa_rica_joins_call_drug_legal
2012-03-04,06:25:49,qgedj,1137,"Two trains crash in Poland, many are wounded, some have been killed. (happend two hours ago)",bbc.co.uk,http://www.bbc.co.uk/news/world-europe-17248735
2012-03-04,16:56:51,qh0bg,580,China military budget tops $100bn; rise by 11.2% in 2012,bbc.co.uk,http://www.bbc.co.uk/news/world-asia-china-17249476
2012-03-04,17:15:57,qh0p1,418,How a Gold Mining Boom is Killing the Children of Nigeria: 'More than 400 children have died and thousands more have been severely poisoned by exposure to lead dust.',e360.yale.edu,http://e360.yale.edu/feature/how_a_gold_mining_boom_is_killing_the_children_of_nigeria/2500/
2012-03-04,15:21:02,qgy3t,377,"About 600,000 Russians to Monitor Presidential Elections Online",en.ria.ru,http://en.ria.ru/russia/20120303/171703448.html
2012-03-04,22:24:44,qh605,325,"Thief steals heart of saint, making off with 800-year-old relic that had been on display at cathedral in Ireland",hosted.ap.org,http://hosted.ap.org/dynamic/stories/E/EU_ODD_IRELAND_RELIC_STOLEN?SITE=AP&SECTION=HOME&TEMPLATE=DEFAULT&CTIME=2012-03-04-08-08-08
2012-03-04,06:42:21,qgf19,316,Israel to sell $1.6 billion in arms to Iran's neighbor Azerbaijan,seattletimes.nwsource.com,http://seattletimes.nwsource.com/html/nationworld/2017606201_azerbaijan27.html
2012-03-04,06:43:19,qgf2i,250,Sarkozy nixes halal meat in schools for Muslims,abcnews.go.com,http://abcnews.go.com/International/wireStory/campaigning-sarkozy-nixes-halal-meat-schools-15841075#.T1KeaPGmhX0
2012-03-04,08:55:16,qgke5,236, the North Korean government has said that anyone caught defecting during the period of mourning for Kim Jong Il’s death would have three generations of family members executed.,businessinsider.com,http://www.businessinsider.com/anyone-caught-defecting-from-north-korea-will-have-three-generations-of-family-members-executed-2012-3?utm_source=feedburner&utm_medium=feed&utm_campaign=Feed%3A+businessinsider+%28Business+Insider%29
2012-03-04,16:55:17,qh0a2,166,Libyan authorities issue apology after British WWII graves attacked pledging to catch those responsible and to restore graves to a standard befitting the sacrifice,bbc.co.uk,http://www.bbc.co.uk/news/uk-17244211
2012-03-04,19:56:12,qh3cu,163,"Almost a year after the Fukushima disaster, 52 of Japan's 54 nuclear power plants have been shut down. The reactor explosion destroyed the population's trust in nuclear energy. But the atomic lobby -- and the country's industrial needs -- could block a possible phase-out.",spiegel.de,"http://www.spiegel.de/international/world/0,1518,818567,00.html"
2012-03-04,09:17:10,qgl9h,149,"""Not only has the number of UK adults calling themselves Christian dropped dramatically since the 2001 Census – our research suggests that it is now only 54% – even those who still think of themselves as Christian show very low levels of religious commitment.""",richarddawkins.net,http://richarddawkins.net/articles/644941-rdfrs-uk-ipsos-mori-poll-1-how-religious-are-uk-christians
2012-03-05,00:30:38,qh9ga,149,A matter of time before the US tires of Israel,haaretz.com,http://www.haaretz.com/print-edition/opinion/it-s-just-a-matter-of-time-before-u-s-tires-of-israel-1.416297
2012-03-04,10:20:16,qgnn2,144,"Israel has legalized one of the oldest and largest of the unsanctioned settler enclaves dotting the West Bank, a step denounced by the Palestinians and Israeli activists as a show of bad faith ahead of talks next week between the Israeli leader and President Barack Obama.",hosted.ap.org,http://hosted.ap.org/dynamic/stories/M/ML_ISRAEL_HOLDING_THE_HEARTLAND?SITE=RIPAW&SECTION=HOME&TEMPLATE=DEFAULT
2012-03-04,22:40:42,qh6c0,134,"Around 200 people have been killed and many more injured in a series of explosions in Brazzaville, the capital of Republic of the Congo.",theglobeandmail.com,https://www.theglobeandmail.com/news/world/200-killed-in-explosions-in-the-republic-of-congo/article2358082/
2012-03-04,00:25:56,qg00x,88,"Island of Guernsey, Channel Islands moots becoming a ""libel haven"" where rich and powerful can sue and silence critics",boingboing.net,http://boingboing.net/2012/03/03/island-of-guersney-moots-becom.html
2012-03-04,22:32:02,qh65e,80,Dutch mobile euthanasia units to make house calls,guardian.co.uk,http://www.guardian.co.uk/world/2012/mar/01/dutch-mobile-euthanasia-units
2012-03-04,19:55:51,qh3ci,76,Assad's air force pounds population centers in Syria's Rastan,haaretz.com,http://www.haaretz.com/news/middle-east/report-assad-s-air-force-pounds-population-centers-in-syria-s-rastan-1.416357#.T1NYJ-O0be0.reddit
2012-03-04,23:41:20,qh7w3,68,"Belarus leader : ""Better a dictator than gay""",montrealgazette.com,http://www.montrealgazette.com/news/Better+dictator+than+Belarus+leader/6248799/story.html
2012-03-04,23:35:12,qh7q1,69,"Putin's Power Grab and the Russian Awakening -- The Russian leader's flagrant abuses are inspiring many Russians, long indifferent, to start fighting back.",theatlantic.com,http://www.theatlantic.com/international/archive/2012/03/putins-power-grab-and-the-russian-awakening/253918/#.T1OLqR1NBXo.reddit
2012-03-05,06:32:52,qhok0,65,"New EU laws on hen cages blamed for forcing farms out of business, price of eggs quadrupled.",guardian.co.uk,http://www.guardian.co.uk/environment/2012/mar/04/supermarkets-fear-egg-shortages
2012-03-04,12:33:28,qgsko,45,China demands end to Syria violence,news.smh.com.au,http://news.smh.com.au/breaking-news-world/china-demands-end-to-syria-violence-20120304-1uak7.html
2012-03-04,11:47:40,qgqv2,41,Syria hands over bodies of 2 foreign journalists,hosted.ap.org,http://hosted.ap.org/dynamic/stories/S/SYRIA_JOURNALISTS?SITE=AP&SECTION=HOME&TEMPLATE=DEFAULT&CTIME=2012-03-03-08-26-32
2012-03-05,05:33:05,qhlya,37,"Turkey would consider annexing northern Cyprus if talks between Greek and Turkish Cypriots failed to reach a deal on reunification of the island, Turkey's European Affairs Minister Egemen Bagis told a Turkish Cypriot newspaper.
",reuters.com,http://www.reuters.com/article/2012/03/04/us-turkey-cyprus-idUSTRE8230IR20120304
2012-03-04,02:20:59,qg480,36,"Syria: Bodies of slain journalists returned to embassy officials
",hosted.ap.org,http://hosted.ap.org/dynamic/stories/S/SYRIA_JOURNALISTS?SITE=AP&SECTION=HOME&TEMPLATE=DEFAULT
2012-03-05,01:31:21,qhbmn,28,Tibetan woman dies after setting herself on fire in protest at Chinese rule,guardian.co.uk,http://www.guardian.co.uk/world/2012/mar/04/tibetan-woman-fire-protest-chinese
2012-03-05,01:56:31,qhckl,23,Syrian rebels in Idlib bide their time:  They know they aren't equipped for a full-on fight with Assad's army. They stage guerrilla attacks and dream of outside help.,latimes.com,"http://www.latimes.com/news/nationworld/world/la-fg-syria-rebels-20120304,0,101365,full.story"
