2012-02-12,16:25:59,plvgd,2122,"Drug War Revolt in Central America - ""Guatemalan President Otto Perez Molina said Saturday he will propose legalizing drugs in Central America in an upcoming meeting with the region’s leaders.""",drugwarrant.com,http://www.drugwarrant.com/2012/02/drug-war-revolt-in-central-america/
2012-02-12,20:12:14,plz9k,1026,"Eight arrests as Murdoch 'throws staff to the wolves'. Five senior 'Sun' journalists, two MoD staff and a police officer taken in dawn swoop as new front opens in bribery scandal
",independent.co.uk,http://www.independent.co.uk/news/uk/crime/eight-arrests-as-murdoch-throws-staff-to-the-wolves-6795254.html
2012-02-12,14:52:08,plt4e,460,"Canada ISPs not subject to content rules, Supreme Court says",business.financialpost.com,http://business.financialpost.com/2012/02/09/canada-isps-not-subject-to-content-rules-court-says/
2012-02-12,18:44:51,plxzp,314,I fear for a social explosion: Greeks can't take any more punishment. EU policy of forced austerity is driving country to economic collapse.,guardian.co.uk,http://www.guardian.co.uk/world/2012/feb/12/greece-cant-take-any-more
2012-02-12,05:27:59,pl709,246,Murdoch media empire engulfed in scandal as Scotland Yard's net spreads,guardian.co.uk,http://www.guardian.co.uk/media/2012/feb/11/rupert-murdoch-media-empire-scrutiny
2012-02-13,04:16:36,pme9o,207,"Protests in Greece: Historic cinemas, cafes and shops went up in flames in central Athens on Sunday as black-masked protesters fought Greek police outside parliament, while inside lawmakers looked set to defy the public rage by endorsing a new EU/IMF austerity deal.",chicagotribune.com,"http://www.chicagotribune.com/news/sns-rt-us-greecetre8120hi-20120203,0,5910796.story"
2012-02-12,20:15:04,plzb8,209,"Pig-Farm Breaches Human Rights - Plans to build a US-style mega farm, housing 25,000 pigs with over a 1,000 a week slaughtered, poses health risks to those in historic Foston & to imprisoned women nearby - ""Objections are mounting, because of new evidence of risks to the health of people.""",guardian.co.uk,http://www.guardian.co.uk/environment/2012/feb/10/mega-pig-farm-human-rights?intcmp=122
2012-02-12,21:22:30,pm0dn,188,"The temperature in a reactor at the crippled Fukushima No. 1 nuclear plant may have risen to 82 degrees on Feb. 12, a situation that could force the government to revoke the declaration of “an equivalent of cold shutdown.”",ajw.asahi.com,http://ajw.asahi.com/article/0311disaster/fukushima/AJ201202120020
2012-02-12,08:05:30,plddk,184,Human rights abuses could be covered up under new justice bill proposals in the UK,guardian.co.uk,http://www.guardian.co.uk/law/2012/feb/11/human-rights-justice-courts
2012-02-12,08:05:42,plddr,147,"British police arrest five at Murdoch's Sun newspaper





",news.yahoo.com,http://news.yahoo.com/police-arrest-five-sun-newspaper-news-corp-111943053.html
2012-02-12,23:17:40,pm2xl,144," As e-waste becomes more valuable, the German Post Office enters the recycling game - Post offices will collect old mobile phones, household electronic devices, used printer cartridges, & any other e-waste that's small enough to fit in an A4-size envelop  ",treehugger.com,http://www.treehugger.com/gadgets/german-post-offices-cash-e-waste-recycling.html
2012-02-12,22:35:54,pm1x5,125,Syrian government forces are using detained civilians as human shields on tanks.,cnn.com,http://www.cnn.com/2012/02/12/world/meast/syria-unrest/
2012-02-12,17:47:39,plx0z,128,"A mysterious epidemic is devastating the Pacific coast of Central America, killing more than 24,000 people in El Salvador and Nicaragua since 2000 and striking thousands of others with chronic kidney disease at rates unseen virtually anywhere else",abcnews.go.com,http://abcnews.go.com/International/wireStory/mystery-disease-kills-thousands-central-america-15566219#.TzeJhVu9Ftg
2012-02-12,18:55:54,ply5g,118,Saudi Arabia threatens to go nuclear 'in weeks' if Iran gets bomb --- SAUDI Arabia would launch a military nuclear program immediately if Iran successfully developed atomic weapons. ,theaustralian.com.au,http://www.theaustralian.com.au/news/breaking-news/saudi-arabia-threatens-to-go-nuclear-in-weeks-if-iran-gets-bomb/story-fn3dxity-1226267920647
2012-02-13,07:07:50,pmm1h,93,Greek parliament approves new austerity bill,bbc.co.uk,http://www.bbc.co.uk/news/world-europe-17007761
2012-02-13,03:11:46,pmbcy,94,"About 24,000 people will be displaced from towns in the Amazon to make way for the world's third biggest dam.""Belo Monte is finishing our community. We had no option. For me, the saddest part of this story is to know that everything I helped create here I'm now seeing it all be destroyed.""",aljazeera.com,http://www.aljazeera.com/indepth/features/2012/01/201212015366764400.html#.TxnjsI8Y1Yw.reddit
2012-02-13,07:34:55,pmnb6,90,Photos of Greece in turmoil.,news.nationalpost.com,http://news.nationalpost.com/2012/02/12/photos-from-riots-in-greece-over-unpopular-austerity-measures/
2012-02-12,19:45:54,plywb,76,"Australia under pressure again to tighten slaughterhouse regulations after the airing of secretly filmed footage of animals being clubbed with iron bars & repeatedly shocked in the face with electrical prods - An official called it ''gross mistreatment''.  ''Strict measures will be ramped up.'' 


",smh.com.au,http://www.smh.com.au/environment/animals/atrocity-abattoir-had-passed-many-audits-20120210-1sksk.html
2012-02-13,05:56:39,pmis0,76, Iran prepares suicide bomb boats in Gulf,reuters.com,http://www.reuters.com/article/2012/02/12/us-gulf-usa-iran-idUSTRE81B0V220120212
2012-02-13,02:10:55,pm8ux,70,"Fukushima reactor readings raise reheating concern: Temperature inside No 2 reactor may have risen to 82C, and Tepco reportedly steps up cooling efforts
",guardian.co.uk,http://www.guardian.co.uk/world/2012/feb/12/fukushima-reactor-reheating-concern
2012-02-12,10:14:10,plj2h,65,Nun sets herself on fire in China,nst.com.my,http://www.nst.com.my/latest/nun-sets-herself-on-fire-in-china-1.45484
2012-02-12,21:28:09,pm0hr,55,"Over 100,000 rally in Lisbon against austerity",reuters.com,http://www.reuters.com/article/2012/02/11/portugal-protest-idUSL5E8DB0UP20120211
2012-02-12,10:50:07,plkln,56,"A Jerusalem court has started debating the meaning of ""Fascism"" as the right wing group ""Im Tirtzu"" sues activists",haaretz.com,http://www.haaretz.com/print-edition/news/jerusalem-court-starts-debating-meaning-of-fascism-as-im-tirtzu-sues-activists-1.412357
2012-02-12,08:21:17,ple04,46,Younger Castro steers Cuba to a new revolution,independent.co.uk,http://www.independent.co.uk/news/world/americas/younger-castro-steers-cuba-to-a-new-revolution-6792209.html
2012-02-12,20:56:00,plzxn,47,"From Mexico to Patagonia mega-projects to mine precious minerals are being put on hold or canceled because of a wave of violent protests, strikes & rallies in opposition over water, extensions of mining rights, river pollution, & displacement of populations. ""But above it's all over water.""  




",france24.com,http://www.france24.com/en/20120211-latin-america-mining-boom-clashes-with-conservation
2012-02-12,06:20:05,pl94x,41,"Bahrain police break up peaceful protest - Police fire tear gas and stun grenades on march in Manama, also arresting two US rights monitors who face deportation.",aljazeera.com,http://www.aljazeera.com/news/middleeast/2012/02/2012211144559680830.html#.TzbpfFhsF9E.reddit
2012-02-12,08:56:36,plfcq,35,"Greek leader claims country is ""just a breath away from Ground Zero"" if it doesn't pass austerity reforms",bbc.co.uk,http://www.bbc.co.uk/news/world-europe-16998157
2012-02-12,18:09:45,plxf4,34,Al Qaeda leader backs Syrian revolt against Assad,news.yahoo.com,http://news.yahoo.com/al-qaeda-leader-backs-syrian-revolt-against-assad-070506698.html
2012-02-12,14:23:30,plsbc,30,Malaysia deports Saudi journalist – official,newsinfo.inquirer.net,http://newsinfo.inquirer.net/144303/malaysia-deports-saudi-journalist---official
2012-02-12,04:00:06,pl3bh,31,Free Syrian Army is all that stands between civilians and tanks,telegraph.co.uk,http://www.telegraph.co.uk/news/worldnews/middleeast/syria/9076596/Free-Syrian-Army-is-all-that-stands-between-civilians-and-tanks.html
