2012-05-30,01:46:55,uajhi,3538,"Dutch Parliament kills ACTA by unanimous vote, 'no similar agreement will be ever signed by the government'",rt.com,http://rt.com/news/dutch-parliament-rejects-acta-518/
2012-05-30,22:52:04,uc3bf,2892,"Rookie Toronto cop ""harassed and berated"" by fellow officers for arresting off-duty constable on DUI charge",thestar.com,http://www.thestar.com/news/crime/article/1202587--rookie-cop-takes-heat-for-arresting-off-duty-officer
2012-05-30,21:35:39,uc0id,1178,"Google wins YouTube copyright battle: While German and U.S. courts say YouTube is responsible for pirated material, a French court backs Google saying, ""It has no obligation to police the content.""",news.cnet.com,http://news.cnet.com/8301-1023_3-57443355-93/google-wins-youtube-copyright-battle-in-french-court/
2012-05-30,04:08:55,uar34,466,"IMF's Christine Lagarde, who chastised Greek tax evaders, pays no taxes herself; she makes $467,940 a year in salary and is given a $83,760 yearly allowance, both tax-free",npr.org,http://www.npr.org/blogs/thetwo-way/2012/05/29/153919300/imf-chief-christine-lagarde-who-chastised-greek-tax-evaders-pays-no-taxes
2012-05-31,00:38:34,uc7rz,452,Trololo man in critical health condition,rt.com,https://rt.com/art-and-culture/news/trololo-man-critical-health-condition-eduard-hil-466/
2012-05-30,06:45:05,ub056,329,"Greeks voted themselves the hardest-working country in Europe, with most others saying they were laziest. By hours worked, the Greeks were right.",theatlantic.com,http://www.theatlantic.com/business/archive/2012/05/why-does-the-laziest-country-in-europe-work-the-most/257792/
2012-05-30,23:25:05,uc4n3,155,Mexico finds cartels making fake military uniforms,brownsvilleherald.com,http://www.brownsvilleherald.com/articles/mexico-140606-finds-making.html
2012-05-31,04:18:13,ucj3m,154,"Quebec's Bill 78 threatens freedom of expression: 'Its penalties are draconian, designed more to stifle free expression than protect public order. Legislatively, it's the equivalent of using a sledgehammer to crack a nut'",newswire.ca,http://www.newswire.ca/en/story/983567/quebec-s-bill-78-threatens-freedom-of-expression
2012-05-30,20:27:14,ubymw,144,"""Pope Benedict on Wednesday [30 May 2012] angrily denounced media coverage of a leaks scandal shaking the Roman Catholic Church, saying it presented a false image of the Holy See.""",reuters.com,http://www.reuters.com/article/2012/05/30/cnews-us-vatican-butler-idCABRE84T0I920120530
2012-05-30,05:00:09,uatwc,147,Human foot sent to Conservative Party of Canada headquarters,cbc.ca,http://www.cbc.ca/news/canada/ottawa/story/2012/05/29/ottawa-suspicious-package-cpc-hq.html
2012-05-30,17:25:17,ubuho,129,Julian Assange loses appeal against extradition to Sweden,guardian.co.uk,http://www.guardian.co.uk/media/blog/2012/may/30/julian-assange-extradition-verdict-live-coverage?cat=media&type=article
2012-05-30,00:58:03,uah2h,100,"NATO Kills Senior al-Qaeda Leader 
",time.com,"http://www.time.com/time/world/article/0,8599,2115931,00.html"
2012-05-30,04:27:44,uas2j,94,Christine Lagarde - IMF head who told the Greeks to pay taxes - pays no tax on her $1/2M salary,guardian.co.uk,http://www.guardian.co.uk/business/2012/may/29/christine-lagarde-pays-no-tax?CMP=SOCNETTXT8763I
2012-05-30,23:26:24,uc4oz,84,"Germany's renewable energy revolution leaves UK in the shade:  The country expects renewables to contribute 35% electricity by 2020 – no matter what the cost
",guardian.co.uk,http://www.guardian.co.uk/environment/2012/may/30/germany-renewable-energy-revolution
2012-05-30,03:37:41,uapev,62,One policeman sent to the hospital in Spain after being bitten by 3 women,ultimahora.es,http://ultimahora.es/mallorca/noticia/sucesos/ultimas/policia-hospitalizado-tras-ser-mordido-por-tres-mujeres-palma.html
2012-05-30,22:11:43,uc1pz,43,13 found slain in Syria as world anger mounts - CNN.com,edition.cnn.com,http://edition.cnn.com/2012/05/30/world/meast/syria-unrest/?hpt=hp_t2
2012-05-30,17:32:59,ubuou,34,BBC News - Julian Assange loses extradition appeal at Supreme Court,bbc.co.uk,http://www.bbc.co.uk/news/uk-18260914
2012-05-30,22:53:48,uc3dw,34,Spain woes drag euro to 23-month low vs dollar,reuters.com,http://www.reuters.com/article/2012/05/30/markets-forex-idUSL5E8GU9TR20120530
2012-05-30,04:35:03,uasfk,25,Discovery of bones at B.C. lake resurrects one of darkest tales in Canadian history,vancouversun.com,http://www.vancouversun.com/touch/news/story.html?id=6690494
2012-05-30,01:39:21,uaj43,18,Robert Mugabe appointed as UN international envoy for tourism,guardian.co.uk,http://www.guardian.co.uk/world/2012/may/29/robert-mugabe-un-international-envoy-tourism?CMP=twt_gu
2012-05-30,03:41:51,uapn8,16,Iranian Officer: Tehran Sent Troops to Syria,en.rian.ru,http://en.rian.ru/world/20120529/173732559.html
2012-05-30,11:31:28,ubgdh,13,"BBC:  ""Increase"" in West Bank demolitions of Palestinian homes, say United Nations. ""Ethnic cleaning,"" say Palestinians. ",bbc.co.uk,http://www.bbc.co.uk/news/world-middle-east-18246322
2012-05-30,03:50:19,uaq3k,12,"India to open super highway to Burma and Thailand: India is to open a new four lane motorway to allow traders and tourists to drive from its eastern tea state of Assam into Burma, Thailand and eventually Cambodia and Vietnam. ",telegraph.co.uk,http://www.telegraph.co.uk/news/worldnews/asia/india/9297354/India-to-open-super-highway-to-Burma-and-Thailand.html
2012-05-30,04:41:37,uasu3,10,Unprecedented Wave Of Railway Suicides Hits France,france24.com,http://www.france24.com/en/20120529-unprecedented-wave-railway-suicides-france-trains-sncf-copycat-police
2012-05-31,00:22:21,uc78a,11,"Former ""News of the World"" editor held, accused of perjury",cnn.com,http://www.cnn.com/2012/05/30/world/europe/uk-phone-hacking/index.html
2012-05-30,09:55:40,ubb12,8,What Rupert hath wrought: most frightening of all is what we have learned about the almost symbiotically intimate relationship between Rupert Murdoch and successive British governments.,nybooks.com,http://www.nybooks.com/articles/archives/2012/jun/21/what-rupert-hath-wrought
2012-05-30,17:32:35,ubuof,9,"Julian Assange loses Sweden extradition appeal, given fourteen days to appeal to the European Court of Human Rights.",thelocal.se,http://www.thelocal.se/41128/20120530/
2012-05-31,00:40:26,uc7u3,10,"Life inside North Korea, as told by 2 western journalists",thesun.co.uk,http://www.thesun.co.uk/sol/homepage/news/4345619/Sun-men-trick-way-into-North-Korea.html
2012-05-30,23:21:29,uc4hy,8,Julian Assange given 14 days to challenge extradition ruling,guardian.co.uk,http://www.guardian.co.uk/media/2012/may/30/julian-assange-challenge-extradition
2012-05-30,22:22:14,uc24a,7,Mubarak sons to face new trial for stock market corruption: Alaa and Gamal Mubarak will stand trial with seven others on fresh charges of profiteering,english.ahram.org.eg,http://english.ahram.org.eg/NewsContent/3/12/43281/Business/Economy/Mubarak-sons-to-face-new-trial-for-stock-market-co.aspx
