2012-07-09,21:48:04,w9o0i,2178,"Nearly 25% of all adults in Botswana are infected with the HIV. But the response against the disease has been stunning with the government providing free, life-saving AIDS drugs to almost all of its citizens who need them.  ",npr.org,http://www.npr.org/2012/07/09/156375781/botswanas-stunning-achievement-against-aids?ps=cprs
2012-07-09,10:47:05,w8xrm,2040,Higgs boson physicist shunned in Pakistan. Man whose work made discovery of elusive particle possible scorned in homeland because of his religious affiliation,guardian.co.uk,http://www.guardian.co.uk/science/2012/jul/08/higgs-boson-pakistan-scientist
2012-07-09,23:21:18,w9r9k,2005,"Dozens of women who attended a high school run by the Legion of Christ have urged the Vatican to close the program, saying the psychological abuse they endured trying to live like teenage nuns led to multiple cases of anorexia, stress-induced migraines, depression & suicidal thoughts.",bigstory.ap.org,http://bigstory.ap.org/article/ap-exclusive-abuses-surface-legion-school
2012-07-09,03:47:56,w8ax1,1930,Mexico urges U.S. to join drug policy ‘review’,rawstory.com,http://www.rawstory.com/rs/2012/07/08/mexico-urges-u-s-to-join-drug-policy-review/
2012-07-09,09:30:18,w8tgi,988,7 Americans (including US cops) at Colombian drug lord's party ,colombiareports.com,http://colombiareports.com/colombia-news/news/24971-americans-colombia-drug-lords-party.html
2012-07-09,21:13:30,w9msj,939,German government slammed over controversial data law that allows government offices to sell people's private information to marketing companies.,spiegel.de,http://www.spiegel.de/international/germany/massive-criticism-over-changes-to-registration-law-a-843372.html#ref=rss?utm_source=twitterfeed&utm_medium=twitter
2012-07-09,17:31:36,w9gus,862,"Two Israeli police officer were convicted of leaving a wounded Palestinian man on the roadside, where he died of dehydration. 2.5 yrs sentence. ",jpost.com,http://www.jpost.com/LandedPages/PrintArticle.aspx?id=276759
2012-07-09,23:13:28,w9qve,567,"The Bank of England had almost daily contact with Barclays over inter-bank lending at the end of October 2008, newly released emails show.",bbc.co.uk,http://www.bbc.co.uk/news/business-18759479
2012-07-08,23:43:39,w80a7,255,Drugs use map of the world: The World Drugs report for 2012 shows that 230 million people around the world - 1 in 20 of us - took illicit drugs in the last year.,guardian.co.uk,http://www.guardian.co.uk/news/datablog/interactive/2012/jul/02/drug-use-map-world?CMP=twt_gu
2012-07-09,11:22:26,w8zug,188,"'We cannot forgive her, God tells us to finish her': video shows public execution of woman, 22, in Afghanistan after adultery allegations",theage.com.au,http://www.theage.com.au/world/we-cannot-forgive-her-god-tells-us-to-finish-her-video-shows-public-execution-of-woman-22-in-afghanistan-after-adultery-allegations-20120709-21pzy.html
2012-07-09,01:33:09,w84lw,155,'Big five' bank customers vent anger by taking their money elsewhere,guardian.co.uk,http://www.guardian.co.uk/money/2012/jul/07/big-five-bank-customers-anger
2012-07-09,20:41:19,w9lui,144,Israeli government panel finds that Israeli isn't occupying the Palestinian West Bank and that all Israeli settlements should be declared legal.,haaretz.com,http://www.haaretz.com/news/diplomacy-defense/report-on-outposts-legality-states-israel-isn-t-an-occupying-force-in-west-bank-1.449895
2012-07-09,22:21:28,w9p9b,137,U.S. anti-drug agency admits killing pilot in Honduras,cbc.ca,http://www.cbc.ca/news/world/story/2012/07/08/us-dea-agents-kill-narcotraffickers-in-honduras.html
2012-07-09,23:49:30,w9srv,126,"Bolivia to consider nationalizing Canadian miner's silver property, President Evo Morales said, following violent indigenous protests against the mining project",reuters.com,http://www.reuters.com/article/2012/07/09/bolivia-southamerican-silver-idUSL2E8I90EZ20120709?rpc=401&feedType=RSS&feedName=rbssFinancialServicesAndRealEstateNews&rpc=401
2012-07-09,03:01:17,w88nx,105,"Alberta, Canada: ‘Priceless’ skeleton destroyed in latest fossil attack",edmontonjournal.com,http://www.edmontonjournal.com/technology/Priceless+skeleton+destroyed+latest+fossil+attack/6896947/story.html
2012-07-09,21:43:09,w9nul,105,"Tajikistan tells Russia, ""get out"" welcomes US and PRC",english.pravda.ru,http://english.pravda.ru/russia/politics/06-07-2012/121580-tajikistan_russia-0/
2012-07-10,01:42:35,w9zc4,95,"New York Times, Gretchen Morgenson Applaud British, Issue Challenge To American Regulators Over LIBOR Scandal | Matt Taibbi | Rolling Stone",rollingstone.com,http://www.rollingstone.com/politics/blogs/taibblog/new-york-times-gretchen-morgenson-applaud-british-issue-challenge-to-american-regulators-20120709
2012-07-09,20:32:37,w9lla,91,"Is the LIBOR Scandal The Crime of the Century?
",business.time.com,http://business.time.com/2012/07/09/libor-scandal-the-crime-of-the-century/
2012-07-09,10:41:14,w8xfb,88,"Charity condemns tourists' use of fresh water in developing countries. Study finds visitors to Bali, the Gambia and Goa use 16 times as much water as locals, causing conflict and disease.",guardian.co.uk,http://www.guardian.co.uk/global-development/2012/jul/08/fresh-water-tourist-developing
2012-07-09,21:33:01,w9ng4,83,UK Ministry of Defence Close To Gaining Patent On Key GPS Technology; US Not Amused,techdirt.com,http://www.techdirt.com/articles/20120706/12332419607/uk-ministry-defence-close-to-gaining-patent-key-gps-technology-us-not-amused.shtml
2012-07-10,00:19:38,w9ufi,78,"Russia will not deliver fighter planes or other new weapons to Syria while the situation there remains unresolved, the deputy director of a body that supervises the country's arms trade was quoted as saying on Monday.",chicagotribune.com,"http://www.chicagotribune.com/news/sns-rt-us-syria-crisis-russia-jetsbre8680hp-20120709,0,4081552.story"
2012-07-09,13:05:14,w95s6,70,Assad: U.S. trying to destabilize Syria ,cnn.com,http://www.cnn.com/2012/07/08/world/meast/syria-unrest/index.html
2012-07-09,01:48:28,w858h,70,Tens of thousands protest 'vote-buying' in Mexico,csmonitor.com,http://www.csmonitor.com/World/Latest-News-Wires/2012/0708/Tens-of-thousands-protest-vote-buying-in-Mexico
2012-07-09,21:07:18,w9mks,67,'Unspeakable cruelty': Outrage grows after Afghan woman's execution caught on video,worldnews.msnbc.msn.com,http://worldnews.msnbc.msn.com/_news/2012/07/09/12639235-unspeakable-cruelty-outrage-grows-after-afghan-womans-execution-caught-on-video?lite
2012-07-08,23:13:18,w7zbl,66,"In Canada, banks are closing customer accounts as part of Iran sanctions",o.canada.com,http://o.canada.com/2012/07/06/td-bank-closing-customer-accounts-as-part-of-iran-sanctions/
2012-07-09,00:23:01,w81nz,65,Egyptian President Mursi reverses parliament dissolution - BBC,bbc.co.uk,http://www.bbc.co.uk/news/world-middle-east-18761403
2012-07-10,01:31:13,w9yno,67,France sells bonds at negative interest rate ,hosted.ap.org,http://hosted.ap.org/dynamic/stories/E/EU_FRANCE_FINANCIAL_CRISIS?SITE=AP&SECTION=HOME&TEMPLATE=DEFAULT&CTIME=2012-07-09-10-45-53
2012-07-09,22:12:20,w9ox3,60,Mysterious fatal crash provides rare glimpse of U.S. commandos in Mali,washingtonpost.com,http://www.washingtonpost.com/world/national-security/mysterious-fatal-crash-provides-rare-glimpse-of-us-commandos-in-mali/2012/07/08/gJQAGO71WW_story.html?hpid=z1
2012-07-10,00:00:47,w9tez,37,"Between 2008 and 2009, 35 employees at France Telecom took their own lives. On Wednesday the operator’s former CEO Didier Lombard was placed under formal investigation for psychological harassment.",france24.com,http://www.france24.com/en/20120705-former-france-telecom-ceo-investigated-over-staff-suicides-lombard
2012-07-10,01:49:51,w9zsb,37,"Father of Australian Internet Warns of Address Crunch: ""IPv6 will supply many more addresses, but Huston says telecoms have little incentive to invest in adopting it, since an address shortage would give companies the power to ration internet traffic and charge a premium for easier access."" ",wired.com,http://www.wired.com/business/2012/07/father-of-australian-internet-warns-of-address-crunch/?utm_source=feedburner&utm_medium=feed&utm_campaign=Feed%3A+wired%2Findex+%28Wired%3A+Top+Stories%29
