2012-04-25,01:12:57,sq4ns,2676,"Drug maker Novartis takes legal action in UK to make hospitals use $1,000 eye drug over $97 alternative",hosted.ap.org,http://hosted.ap.org/dynamic/stories/E/EU_MED_NOVARTIS_DRUG_LAWSUIT?SITE=AP&SECTION=HOME&TEMPLATE=DEFAULT
2012-04-25,21:24:40,srngc,1491,Unimaginable horror as helicopter-borne poachers massacre 22 elephants before hacking off their tusks and genitals,dailymail.co.uk,http://www.dailymail.co.uk/news/article-2134696/Scene-unimaginable-horror-helicopter-borne-poachers-massacre-22-elephants.html
2012-04-25,00:15:38,sq1ph,1031,Kazakhstan thanks Borat for 'boosting tourism',bbc.co.uk,http://www.bbc.co.uk/newsbeat/17826000
2012-04-25,14:18:08,srbmb,458,"For first time since Depression, more Mexicans leave U.S. than enter",washingtonpost.com,http://www.washingtonpost.com/local/for-first-time-since-depression-more-mexicans-leave-us-than-enter/2012/04/23/gIQApyiDdT_story.html?hpid=z1
2012-04-25,02:10:56,sq7s1,392,New Zealand considers $100-a-pack cigarettes to curb smoking,thestar.com,http://www.thestar.com/news/world/article/1167014--new-zealand-considers-100-a-pack-cigarettes-to-curb-smoking
2012-04-25,19:21:22,srkbr,310,"Iran not building a nuclear bomb, says Israeli Chief of Staff",bbc.co.uk,http://www.bbc.co.uk/news/world-middle-east-17837768
2012-04-25,04:39:23,sqfw5,283,"Russell Brand to UK MPs: Consider decriminalisation of drugs so money is spent on treatment, not punishment",thisislondon.co.uk,http://www.thisislondon.co.uk/news/politics/the-day-russell-brand-addressed-mps-on-drugs-and-amy-winehouse-in-his-usual-attire-7674872.html
2012-04-25,23:20:39,srrtx,274,Alliance of Liberals and Democrats in EU parliament rejects ACTA,rt.com,http://rt.com/news/acta-eu-parliament-internet-freedom-969/
2012-04-25,09:46:11,sqx1h,232,"The terrible price of defecting to North Korea, and later defecting from North Korea.",bbc.co.uk,http://www.bbc.co.uk/news/magazine-17767626
2012-04-25,20:49:21,srmea,205,The Grand Experiment: German Pirate Party Attempts to Reinvent Politics,spiegel.de,"http://www.spiegel.de/international/germany/0,1518,829451,00.html"
2012-04-25,17:46:02,sri5u,102,UK slides back into recession in first double dip since 1970s,reuters.com,http://www.reuters.com/article/2012/04/25/us-recession-britain-idUSBRE83O0C320120425
2012-04-26,06:35:10,ssfy7,100,"Internet freedom ‘must be protected’, TD tells Council of Europe",thejournal.ie,http://www.thejournal.ie/internet-freedom-must-be-protected-td-tells-council-of-europe-429810-Apr2012/
2012-04-25,03:58:59,sqdnm,97,Knesset members celebrate latest E. Jerusalem settlement by posing on evicted Palestinian family's sofa,mondoweiss.net,http://mondoweiss.net/2012/04/knesset-members-celebrate-latest-e-jerusalem-settlement-by-posing-on-evicted-palestinian-familys-sofa.html
2012-04-25,16:48:12,srgsb,88,"Over 1,000 Palestinian inmates on hunger strike in Israel",bbc.co.uk,http://www.bbc.co.uk/news/world-middle-east-17836395
2012-04-25,10:37:50,sr01j,81,"German high jumper Ariane Friedrich posts stalker's name, hometown, and parts of his alleged e-mail on her Facebook account.  Privacy debate ensues.",huffingtonpost.com,http://www.huffingtonpost.com/2012/04/24/ariane-friedrich-german-high-jumper_n_1449001.html
2012-04-26,01:58:08,srzwk,62,Mein Kampf to be re-released with notes countering Hitler's arguments,guardian.co.uk,http://www.guardian.co.uk/world/2012/apr/25/mein-kampf-released-notes-hitler
2012-04-25,11:32:01,sr33w,58,Kenya's High Court Rules Anti-Counterfeiting Law Is Unconstitutional Because It Threatens Access To Generic Drugs,techdirt.com,http://www.techdirt.com/articles/20120421/04274218595/kenyas-high-court-rules-anti-counterfeiting-law-is-unconstitutional-because-it-threatens-access-to-generic-drugs.shtml
2012-04-25,17:43:15,sri3e,55,The UK is now officially in a double-dip recession.,guardian.co.uk,http://www.guardian.co.uk/business/2012/apr/25/eurozone-crisis-live-uk-double-dip-recession
2012-04-25,23:56:38,srtj4,45,"Why is North Korea threatening to conduct a nuclear test? - First, to make up for the embarrassment of the failed missile; second, the regime's past nuclear tests didn't go very well.",csmonitor.com,http://www.csmonitor.com/World/Asia-Pacific/2012/0425/Why-is-North-Korea-threatening-to-conduct-a-nuclear-test
2012-04-25,13:19:56,sr8xt,27,Murdoch turns heat on UK government  ,ft.com,http://www.ft.com/intl/cms/s/0/91763e6a-8dfc-11e1-bbae-00144feab49a.html#axzz1t1SkAUSB
2012-04-26,00:37:11,srvm5,32,N. Korea vows to turn South's leadership to ashes,chinapost.com.tw,http://www.chinapost.com.tw/asia/korea/2012/04/25/338983/N-Korea.htm/
2012-04-25,07:09:34,sqogy,26,"North Korean nuclear test could happen as early as Tuesday night, NBC reports",openchannel.msnbc.msn.com,http://openchannel.msnbc.msn.com/_news/2012/04/24/11376100-nbc-north-korean-nuclear-test-could-happen-as-early-as-tuesday-night
2012-04-26,01:03:18,srwyt,21,Israel army chief contradicts Netanyahu on Iran,guardian.co.uk,http://www.guardian.co.uk/world/julian-borger-global-security-blog/2012/apr/25/israel-iran
2012-04-25,03:25:52,sqbso,25,"Mexican refugee claimant murdered after deportation:  Veronica Castro, a Mexican woman who sought to stay in Canada, was murdered five weeks after being deported",cbc.ca,http://www.cbc.ca/news/world/story/2012/04/19/veronica-mexico-refugee.html
2012-04-25,23:16:08,srrmg,22,"Libyan authorities ban the formation of political parties based on religious principles, tribe or ethnicity ahead of elections scheduled for June.",bbc.co.uk,http://www.bbc.co.uk/news/world-africa-17844280
2012-04-25,11:45:18,sr3uq,17,Khartoum has declared war on South Sudan,dw.de,"http://www.dw.de/dw/article/0,,15907365,00.html"
2012-04-25,21:29:45,srnlu,15,"North Korea Vice Marshal Ri Yong Ho: ""The Korean People's Army is armed with powerful modern weapons ... that can defeat the (U.S.) imperialists at a single blow""",seattlepi.com,http://www.seattlepi.com/news/article/N-Korea-Mobile-weapons-capable-of-striking-US-3507829.php
2012-04-26,01:47:41,srzdc,15,"Germany's Calculated Decision to Republish 'Mein Kampf' - 
By letting its old ban lapse, the country is defanging a once dangerous book.",theatlantic.com,http://www.theatlantic.com/international/archive/2012/04/mein-kampf-is-being-republished-and-thats-good-news-for-germany/256338/
2012-04-25,20:40:20,srm59,13,Wells to be built near damaged Fukushima reactors,upi.com,http://www.upi.com/Top_News/World-News/2012/04/24/Wells-to-be-built-near-damaged-reactors/UPI-29881335292137/
2012-04-25,21:00:08,srmp8,12,"The ""winds of populism"" are threatening the EU's Schengen Treaty on open borders, European Council President Herman Van Rompuy has warned.",bbc.co.uk,http://www.bbc.co.uk/news/world-europe-17837098
