2013-07-03,10:05:21,1hjbtg,3933,Bolivia furious its president's plane was forced to make an emergency landing in Austria because of rumour US fugitive Edward Snowden was on board.,sbs.com.au,http://www.sbs.com.au/news/article/1784988/US-'hopeful'-Snowden-will-return-home
2013-07-03,18:57:26,1hk4kq,3337,‘Act of aggression’: Bolivia to file UN complaint over airspace blockade,rt.com,http://rt.com/news/bolivia-un-complaint-plane-601/
2013-07-03,02:29:50,1hiby9,2810,German government refuses asylum for Snowden,spiegel.de,http://www.spiegel.de/politik/deutschland/bundesregierung-lehnt-aufnahme-von-edward-snowden-in-deutschland-ab-a-909090.html
2013-07-03,19:55:35,1hk6ev,2771,US spying row: France wants suspension of trade talks between EU and US over spying claims,thelocal.fr,http://www.thelocal.fr/20130703/france-wants-eu-us-trade-talks-suspended-over-spying
2013-07-03,01:50:47,1hi8ov,2696,Egypt's army threatens to march with protesters and take over government if demands aren't met by tomorrow.,edition.cnn.com,http://edition.cnn.com/2013/07/02/world/meast/egypt-protests/index.html?hpt=hp_t1
2013-07-03,03:00:23,1hiehl,2418,Iran's incoming president says Facebook should be unblocked and the Islamic dress code should be softened,guardian.co.uk,http://www.guardian.co.uk/world/2013/jul/02/iran-president-hassan-rouhani-progressive-views?CMP=twt_fd
2013-07-03,05:08:16,1hip7a,1856,"Canadian Lotto Winner Leaves $10,000 Tip for Diner Owner With Sick Daughter - just had burger and fries",ottawacitizen.com,http://www.ottawacitizen.com/news/lotto+winner+tips+burger+fries/8584259/story.html
2013-07-03,22:29:07,1hkd12,1805,"Hidden microphone found at Ecuador's embassy in UK, says foreign minister - Microphone was found last month inside office of Ecuadorean ambassador, in building where Julian Assange resides",guardian.co.uk,http://www.guardian.co.uk/world/2013/jul/03/hidden-microphone-ecuador-embassy-assange
2013-07-03,03:15:53,1hifs8,1534,"For more than two and a half weeks now, Bulgarians have been taking to the streets daily. Is the world watching?",euronews.com,http://www.euronews.com/2013/07/02/bulgaria-protests-continue-is-the-world-listening/
2013-07-03,01:28:07,1hi6xa,1139,Police State Canada: Communications Security Establishment Canada (CSEC) Runs Massive Domestic Spying Program,globalresearch.ca,http://www.globalresearch.ca/police-state-canada-communications-security-establishment-canada-csec-runs-massive-domestic-spying-program/5339250
2013-07-03,21:50:24,1hkayd,1119,"Live coverage: Crisis in Egypt. Latest: Muslim Brotherhood refused to meet army commanders. ""Everyone in Egypt holding their breath these 2 hrs when deadline for pres Morsi ends -- Army in meetings, both sides ready for the streets""",bbc.co.uk,http://www.bbc.co.uk/news/world-middle-east-23159066
2013-07-03,20:30:40,1hk7ns,896,Julian Assange calls on Europe to 'welcome' fugitive Edward Snowden,ndtv.com,http://www.ndtv.com/article/world/julian-assange-calls-on-europe-to-welcome-fugitive-edward-snowden-387503
2013-07-03,22:01:25,1hkbji,789,Ecuador says it found a hidden microphone at its London embassy - Reuters,ca.reuters.com,http://ca.reuters.com/article/topNews/idCABRE9620JS20130703
2013-07-03,02:29:28,1hibx6,614,Norway will reconsider asylum for Snowden,translate.google.com,http://translate.google.com/translate?sl=no&tl=en&js=n&prev=_t&hl=no&ie=UTF-8&u=http%3A%2F%2Fwww.tv2.no%2Fnyheter%2Finnenriks%2Fsnowden-faar-asylsoeknaden-til-norge-behandlet-paa-nytt-4082022.html
2013-07-03,19:05:49,1hk4uh,459,"Spain has opened its airspace to Bolivian president Evo Morales' plane, after it was diverted to Austria amid suspicions Edward Snowden was on board",bbc.co.uk,http://www.bbc.co.uk/news/world-latin-america-23158242
2013-07-03,00:23:17,1hi1uz,457,"China has a new rule that children must visit their parents over age 60 ""frequently"" and make sure their financial and spiritual needs are met.",cnn.com,http://www.cnn.com/2013/07/02/world/asia/china-elderly-law/index.html?hpt=hp_t3
2013-07-03,22:05:21,1hkbr7,428,Bug found at Ecuador's embassy in London,aljazeera.com,http://www.aljazeera.com/news/europe/2013/07/20137383834271630.html
2013-07-03,22:13:50,1hkc6n,289,"Missing man, 43, is rescued after being forced to work as a slave for 13 years in Wales",dailymail.co.uk,http://www.dailymail.co.uk/news/article-2352283/Darrell-Simester-Man-43-vanished-holiday-reunited-family-spending-13-years-SLAVE.html
2013-07-03,18:19:43,1hk3fv,279,Snowden case: France denies blocking Bolivia plane - Two officials with the French Foreign Ministry said Wednesday that Morales' plane had authorization to fly over France. They would not comment on why Bolivian officials said otherwise.,mercurynews.com,http://www.mercurynews.com/breaking-news/ci_23590259/snowden-france-denies-blocking-bolivian-plane
2013-07-03,11:51:08,1hjj6a,259,Bug is found in Ecuador Embassy in London,translate.google.com,http://translate.google.com/translate?js=n&tl=en&u=http%3A%2F%2Fwww.telegrafo.com.ec%2Factualidad%2Fitem%2Fmicrofono-oculto-es-hallado-en-embajada-de-ecuador-en-londres.html&hl=en&sl=auto&prev=_t&ie=UTF-8
2013-07-03,12:30:40,1hjm0w,163,"Judge OKs deal for HSBC bank to pay $1.9 billion penalty for helping Mexican drug traffickers, Iran, Libya and others",belfasttelegraph.co.uk,http://www.belfasttelegraph.co.uk/news/world-news/judge-oks-hsbc-laundering-penalty-29390921.html
2013-07-03,04:14:32,1hikl6,153,Guantanamo Bay Detainees to Be Force-Fed at Night Out of Respect for Ramadan,theatlanticwire.com,http://www.theatlanticwire.com/politics/2013/07/gitmo-detainees-ramadan/66783/
2013-07-03,22:09:31,1hkbyk,128,Indian movie banned in Pakistan because it shows a Muslim girl falling in love with a Hindu boy,tribune.com.pk,http://tribune.com.pk/story/571382/censor-board-bans-raanjhanaa-in-pakistan/
2013-07-03,05:07:38,1hip56,126,"Another lie from James Clapper. He says he ""forgot about the Patriot Act"".",guardian.co.uk,http://www.guardian.co.uk/world/2013/jul/02/james-clapper-senate-erroneous
2013-07-03,03:31:26,1hih21,115,Germany denies asylum for Snowden,sueddeutsche.de,http://www.sueddeutsche.de/politik/fluechtiger-prism-enthueller-deutschland-verweigert-snowden-asyl-1.1711129
2013-07-03,15:50:02,1hjx8w,110,"“Shock & outrage” from sustainable food & environmental advocates across the world as 2013 'World Food Prize' goes to 3 scientists turned chemical company executives who pioneered GMOs - Thing is, Monsanto is a sponsor of the 'World Food Prize'.",ens-newswire.com,http://ens-newswire.com/2013/07/02/gmo-battle-marks-choice-of-2013-world-food-prize-winners/
2013-07-03,13:47:43,1hjr4u,105,Dutch female reporter gang-raped by 5 men in violent Egyptian protests. A Granmother and her 7 year old granddaughter were also sexually assaulted along with 41 other women.,nypost.com,http://www.nypost.com/p/news/international/dutch_female_reporter_raped_in_violent_1i3XjASFKD5HjybnAJ2b2L?utm_source=SFnewyorkpost&utm_medium=SFnewyorkpost
2013-07-03,17:57:01,1hk2qx,87,Activists warn trade pact will keep out generics. A free trade pact being negotiated by the U.S. and 11 Asia-Pacific nations will impose aggressive intellectual property rules that will restrict access to affordable medicines in developing nations,guardian.co.uk,http://www.guardian.co.uk/world/feedarticle/10866600
2013-07-03,05:57:08,1hit7v,86,Canada foils al-Qaida-inspired plot to bomb Canada Day event,jpost.com,http://www.jpost.com/International/Canada-foils-al-Qaida-inspired-plot-to-bomb-Canada-Day-event-318487
2013-07-03,11:02:44,1hjfr5,82,"Venezuela ready to help Snowden, but final decision with people",rt.com,http://rt.com/news/maduro-snowden-asylum-venezuela-565/
