2013-05-02,21:10:54,1djo7y,3162,"The world's most widely used insecticide is devastating dragonflies, snails and other water-based species, a groundbreaking Dutch study has revealed.",guardian.co.uk,http://www.guardian.co.uk/environment/2013/may/01/study-links-insecticide-invertebrate-die-off
2013-05-02,02:14:29,1dhptu,2165,40 Chinese troops erect 5 tents 19 Km inside Indian territory and have a banner which reads you are in Chinese territory,timesofindia.indiatimes.com,http://timesofindia.indiatimes.com/india/Chinese-troops-reinforce-position-adopt-aggressive-posturing-get-regular-supplies/articleshow/19822794.cms
2013-05-02,02:48:10,1dhsl5,2153,"64 percent of Muslims in Egypt, Pakistan support death penalty for leaving Islam",washingtonpost.com,http://www.washingtonpost.com/blogs/worldviews/wp/2013/05/01/64-percent-of-muslims-in-egypt-and-pakistan-support-the-death-penalty-for-leaving-islam/
2013-05-02,00:08:06,1dhg51,2093,"Split up or son will be expelled, school tells lesbian couple: Legally married South African couple said they were called to a meeting with the principal of Secunda Highveld Christian School and were told their homosexuality was problematic",citypress.co.za,http://www.citypress.co.za/news/split-up-or-son-will-be-expelled-school-tells-lesbian-couple/
2013-05-02,22:29:56,1djs65,1742,"Bankers ""struggle to live"" on £1million a year",huffingtonpost.com,http://www.huffingtonpost.com/mobileweb/2013/04/30/bankers-1-million-pay_n_3188177.html?icid=hp_front_popular_art
2013-05-02,19:13:52,1djk9e,1643,"Italy’s First Black Cabinet Member Bombarded With Racial Slurs, Insults From Far Right: “Congolese monkey"", ""Zulu"" and ""the black anti-Italian""",huffingtonpost.com,http://www.huffingtonpost.com/2013/05/01/cecile-kyenge-italy-racism_n_3193206.html
2013-05-02,01:48:14,1dhnri,1437,Brazil Catholic Priest Excommunicated For Defending Gay Rights,huffingtonpost.com,http://www.huffingtonpost.com/2013/04/30/brazil-priest-excommunicated_n_3187812.html
2013-05-02,21:47:41,1djpxl,1272,Brazilian President Dilma Rousseff: All oil royalties collected by the state should go into public education funding,reuters.com,http://www.reuters.com/article/2013/05/02/us-brazil-oil-royalties-idUSBRE94101020130502
2013-05-02,18:24:57,1djivr,983,The FBI's role in 'manufacturing' terrorism,cbc.ca,http://www.cbc.ca/news/story/2013/05/01/f-q-a-trevor-aaronson.html
2013-05-02,00:59:59,1dhk2h,935,Pew Study: Muslims across the globe tend to be deeply committed to their faith and believe that it should shape not only their personal lives but the societies they live in,npr.org,http://www.npr.org/blogs/thetwo-way/2013/05/01/180293705/pew-study-many-muslims-believe-in-mixing-mosque-and-state?ft=1&f=1014
2013-05-02,22:30:00,1djs6a,675,"Egyptian newspaper claims ""Jews drink Egyptian blood""",thecommentator.com,http://www.thecommentator.com/article/3427/egyptian_newspaper_claims_jews_drink_egyptian_blood
2013-05-02,19:30:54,1djksj,366,"Conman James McCormick jailed for 10 years over fake bomb detectors - He sold the models to Iraq, Belgium and the UN",google.co.uk,"http://www.google.co.uk/url?sa=t&rct=j&q=&esrc=s&source=newssearch&cd=1&cad=rja&ved=0CCwQqQIoADAA&url=http%3A%2F%2Fwww.independent.co.uk%2Fnews%2Fuk%2Fcrime%2Fconman-james-mccormick-jailed-for-10-years-over-fake-bomb-detectors-8600654.html&ei=NkCCUc6fAuK90QX31IGIBQ&usg=AFQjCNGLqEsy8CW2mQ3NnIdQMczToVQ0Iw&sig2=LsMpsla8EhHHf07CmRmTYQ&bvm=bv.45921128,d.d2k"
2013-05-02,02:50:07,1dhsrh,263,Pope Francis Condemns 'Slave Labor' In Bangladesh: 'Goes Against God',bbc.co.uk,http://www.bbc.co.uk/news/world-asia-22370487
2013-05-02,12:06:52,1dj10r,240,Guantanamo Attorney Found Dead in Apparent Suicide,truth-out.org,http://www.truth-out.org/news/item/16119-guantanamo-attorney-found-dead-in-apparent-suicide
2013-05-02,18:33:55,1djj51,219,"Police in the Greek capital Athens have stopped the far-right Golden Dawn party from handing out free food only to Greeks on the city's main square. Riot police used tear gas to prevent activists distributing food from a lorry on Syntagma Square, where the country's parliament is located.",bbc.co.uk,http://www.bbc.co.uk/news/world-europe-22379744
2013-05-02,17:35:50,1djhgw,172,Poll: 40% of Palestinians support suicide bombing,jpost.com,http://www.jpost.com/LandedPages/PrintArticle.aspx?id=311779
2013-05-02,08:42:52,1dil7h,173,Why are Buddhist monks attacking Muslims?,bbc.co.uk,http://www.bbc.co.uk/news/magazine-22356306
2013-05-02,19:18:34,1djke5,158,"Bolivian President Evo Morales orders expulsion of USAID: ""We may be a small country, but we deserve respect""",cnn.com,http://www.cnn.com/2013/05/01/world/americas/bolivia-usaid-expelled/index.html
2013-05-02,00:01:56,1dhfp2,155,Third of children born in UK have foreign-born parent; white Britons will be a minority by 2066,telegraph.co.uk,http://www.telegraph.co.uk/news/uknews/10029547/Third-of-children-born-in-England-has-foreign-born-parent.html
2013-05-02,03:27:10,1dhvvs,154,Turkey is testing blood samples taken from Syrian casualties brought over the border from fighting in recent days to determine whether they were victims of a chemical weapons attack.,reuters.com,http://www.reuters.com/article/2013/05/01/us-syria-crisis-chemical-idUSBRE9400SY20130501
2013-05-02,01:47:12,1dhno5,135,Many in Muslim world want sharia as law of land: survey,news.yahoo.com,http://news.yahoo.com/many-muslim-world-want-sharia-law-land-survey-160939872.html
2013-05-02,22:51:29,1djth2,132,Israel welcomes Arab League's 'land swap' position,telegraph.co.uk,http://www.telegraph.co.uk/news/worldnews/middleeast/israel/10027869/Israel-welcomes-Arab-Leagues-land-swap-position.html
2013-05-02,04:07:24,1dhz5q,117,"Sohel Rana Most Hated Man in Bangladesh - To build Rana Plaza, he bullied landowners & ultimately took their property by force. His political allies gave him a construction permit, despite his dubious claims of title to the land, & a 2nd permit to add upper floors, likely destabilizing the building.",motherjones.com,http://www.motherjones.com/kevin-drum/2013/05/sohel-rana-now-most-hated-man-bangladesh
2013-05-02,22:30:15,1djs6s,112,Disgruntled Arab states look to strip Canada of UN agency,theglobeandmail.com,http://www.theglobeandmail.com/news/world/disgruntled-arab-states-look-to-strip-canada-of-un-agency/article11672346/
2013-05-02,23:54:21,1djxn0,110,Bombers turn up too late for rally: A murderous plot by radical Islamists to launch a gun and bomb attack on hundreds of people attending a right-wing rally in the UK failed after they turned up too late,nzherald.co.nz,http://www.nzherald.co.nz/world/news/article.cfm?c_id=2&objectid=10880993
2013-05-02,00:17:42,1dhgtd,102,"Mexico's Congress has passed a major reform, in an attempt to make the country's telecommunications industry more open and competitive.",bbc.co.uk,http://www.bbc.co.uk/news/world-latin-america-22362326
2013-05-02,23:57:24,1djxu2,109,Lawyer who drafted White House drone policy says US would rather kill suspects than send them to Cuban detention centre,guardian.co.uk,http://www.guardian.co.uk/world/2013/may/02/us-drone-strikes-guantanamo
2013-05-02,02:44:35,1dhsa2,95,US Labor Department Website is being Operated by Chinese Hackers and serving Malware,hackersnewsbulletin.com,http://www.hackersnewsbulletin.com/2013/05/us-labor-department-website-is-being.html
2013-05-02,19:44:10,1djl7h,68,Syria’s Opposition Hopes to Win the War by Selling Oil: European companies can now legally begin importing barrels of oil directly from rebel groups,world.time.com,http://world.time.com/2013/05/01/can-syrias-rebellion-win-the-war-by-selling-oil/
2013-05-02,11:35:32,1diykw,66,Poll Shows 72% In “Moderate” Indonesia Want Sharia Law,thejakartaglobe.com,http://www.thejakartaglobe.com/news/seventy-two-percent-of-indonesians-favor-shariah-law-pew-forum/
