2013-09-22,23:55:19,1mw942,3164,"""More workers will die building World Cup infrastructure than players will take to the field,"": an article on the mistreatment of migrant workers in the run-up to the 2022 FIFA World Cup in Qatar",theguardian.com,http://www.theguardian.com/commentisfree/2013/sep/21/qatar-human-rights-sport-cohen
2013-09-22,19:34:26,1mvzy1,2457,"Chinese law criminalizes online posts that are read by more than 5,000 people or reblogged more than 500 times",dailydot.com,http://www.dailydot.com/news/china-teen-arrested-rumors-500-retweets/
2013-09-22,03:02:31,1mukam,2442,'All Muslims leave... we only want to kill non-Muslims': Gunmen massacre at least 22 in Kenyan shopping mall after releasing anyone who could prove they were Islamic by reciting a prayer,dailymail.co.uk,http://www.dailymail.co.uk/news/article-2427892/Nairobi-mall-Gunmen-massacred-22-Kenyan-shopping-centre-targeted-non-Islamics.html
2013-09-22,23:05:26,1mw6pa,1620,Pope attacks global economics for worshipping 'god of money',reuters.com,http://www.reuters.com/article/2013/09/22/us-pope-economy-idUSBRE98L04H20130922
2013-09-22,06:30:20,1muych,1069,NSA Fallout: Officials are now talking about laying fibre-optic cables to Latin American countries and Europe so that Brazil’s international online traffic bypasses the United States,economist.com,http://www.economist.com/news/americas/21586559-cancellation-dilma-rousseffs-state-visit-washington-has-short-term-cost
2013-09-22,06:31:29,1muyfq,1057,"North Korean collapse ""inevitable"", according to new report. A collapse would risk ""civil war, a humanitarian crisis or even war with China"" when China moves to annex territory.",globalpost.com,http://www.globalpost.com/dispatch/news/regions/asia-pacific/north-korea/130920/north-korea-collapse-inevitable-rand-report
2013-09-22,18:49:45,1mvyrs,775,Uruguay First To Fully Legalize Marijuana,exposingthetruth.co,http://www.exposingthetruth.co/uruguay-first-legalize-marijuana/#axzz2fc5nNXTk
2013-09-22,23:42:54,1mw8ie,689,Saudi Arabian women call new day of defiance against driving ban,rawstory.com,http://www.rawstory.com/rs/2013/09/22/saudi-arabian-women-call-new-day-of-defiance-against-driving-ban/
2013-09-22,12:42:32,1mvkzf,591,"Israeli troops attack EU diplomats, seize West Bank aid material",news.antiwar.com,http://news.antiwar.com/2013/09/20/israeli-troops-attack-eu-diplomats-seize-west-bank-aid/
2013-09-22,21:08:21,1mw2hd,589,Israeli forces join Kenya battle to end deadly mall siege,google.com,http://www.google.com/hostednews/afp/article/ALeqM5iyAFJNyuh0zS2zHl_XUTGOPw7vLg?docId=CNG.e527f74fddbe16c857c7c4904b2ed4f2.621
2013-09-22,23:58:41,1mw9be,530,India’s Mars Mission to be launched on Oct 28,hindustantimes.com,http://www.hindustantimes.com/HTNext/ZanyScience/India-s-Mars-Mission-will-now-be-launched-on-Oct-28/Article1-1125600.aspx
2013-09-22,08:50:19,1mv7ey,480,"When the terrorist attack started at a Nairobi mall, photographer Tyler Hicks from the NY Times was right next door. Here's his report",lens.blogs.nytimes.com,http://lens.blogs.nytimes.com/2013/09/21/witness-to-a-massacre-in-a-nairobi-mall/
2013-09-22,22:06:54,1mw4er,378,France will introduce a levy on nuclear energy as well as a tax on carbon emissions from fossil fuels to raise billions needed to boost renewable power and improve energy efficiency,bloomberg.com,http://www.bloomberg.com/news/2013-09-21/france-to-tax-edf-nuclear-output-for-energy-shift-to-renewables.html
2013-09-22,09:55:11,1mvbd0,359,Muslim groups oppose ban on child marriage,m.thehindu.com,http://m.thehindu.com/news/national/kerala/muslim-groups-oppose-ban-on-child-marriage/article5155367.ece
2013-09-22,12:48:06,1mvl9f,280,"64 people were killed and 143 others wounded in car bomb attacks in the Iraqi capital of Baghdad on Saturday, police said.",iguang.tw,http://iguang.tw/t/1pw#baghdad-car-bomb-attacks
2013-09-22,02:59:57,1muk42,286,Major US security company warns over NSA-subverted encryption protocol; RSA sends email to global customers over default random number generator which uses weak formula,theguardian.com,http://www.theguardian.com/world/2013/sep/21/rsa-emc-warning-encryption-system-nsa
2013-09-22,04:21:28,1muplg,247,"A Berlin judge has banned a Muslim lawyer from wearing a headscarf in his courtroom stating she should show religious neutrality. The lawyer, who has not been named, was told by a judge three times that she was not allowed to wear a headscarf in court.",thelocal.de,http://www.thelocal.de/society/20130917-51949.html
2013-09-22,00:47:56,1mublw,222,"Israeli soldier, missing for 24 hours, found murdered in West Bank.Palestinian admitted that he lured the soldier into the West Bank and murdered him in order to trade his body for the release of his incarcerated brother.",haaretz.com,http://www.haaretz.com/news/diplomacy-defense/1.548075
2013-09-22,12:58:43,1mvlrf,202,China’s Fallen Politician Bo Xilai Sentenced to Life Imprisonment,world.time.com,http://world.time.com/2013/09/21/chinas-fallen-politician-bo-xilai-sentenced-to-life-imprisonment/
2013-09-22,00:28:28,1muage,134,"Tunisian women have traveled to Syria to have sex with rebel fighters, a practice known as ""sexual jihad.""",m.huffpost.com,http://m.huffpost.com/us/entry/3961904
2013-09-22,23:01:35,1mw6jk,132,Ancient Woodland in Kent to be Uprooted for Quarry - Ruling comes despite allegations of political & legal bullying & outburst of foul language by minister Eric Pickles. 80 acres of woodland was condemned to be turned into a quarry to supply Kentish ragstone to a company.,theguardian.com,http://www.theguardian.com/education/2013/sep/22/oaken-wood-kent-uprooted-quarry
2013-09-22,14:00:42,1mvovz,106,"Latest Snowden Leaks Show GCHQ Gleefully Hacking Belgian Telco: ...the British wanted to use this access for complex attacks (""Man in the Middle"" attacks) on smartphone users. The head of GCHQ's NAC described Operation Socialist in the presentation as a ""success.""",techdirt.com,http://www.techdirt.com/articles/20130920/16112724595/latest-snowden-leaks-show-gchq-gleefully-hacking-belgian-telco.shtml
2013-09-22,15:29:29,1mvsow,100,Muslim groups oppose ban on child marriage,thehindu.com,http://www.thehindu.com/news/national/kerala/muslim-groups-oppose-ban-on-child-marriage/article5155367.ece
2013-09-22,08:50:45,1mv7fw,105,JP Morgan Slammed with $920 Million Fine Over Trading Loss - But Where Are the Charges Against Senior Bankers?,alternet.org,http://www.alternet.org/news-amp-politics/jp-morgan-slammed-920-million-fine-over-trading-loss-where-are-charges-against
2013-09-22,02:29:14,1mui0x,99,800 Feet Tall Deep Sea Waves Discovered In Pacific Ocean,telegraph.co.uk,http://www.telegraph.co.uk/science/science-news/10300388/800-feet-tall-deep-sea-waves-discovered-in-Pacific-Ocean.html
2013-09-22,04:39:06,1muqs4,97,A small village in Albania generates over $6Billion a year from the sale of marijuana. worth about half the country's GDP,live.huffingtonpost.com,http://live.huffingtonpost.com/r/archive/segment/europes-real-marijuana-capital/520e55ebfe34442034000530
2013-09-22,23:00:18,1mw6i1,93,Israeli Soldier is Lured to West Bank and Killed,nytimes.com,http://www.nytimes.com/2013/09/22/world/middleeast/israeli-soldier-is-kidnapped-and-killed.html?_r=0
2013-09-22,00:11:08,1mu9g3,90,"Danish engineers plan to send astronaut into space in homemade rocket made from cork, duct tape",edmontonjournal.com,http://www.edmontonjournal.com/technology/space/Danish+engineers+plan+send+astronaut+into+space/8923420/story.html
2013-09-22,13:02:09,1mvlz7,87,"50,000 Bangladesh garment workers stage biggest wage hike protest",reuters.com,http://www.reuters.com/article/2013/09/21/us-bangladesh-garment-protest-idUSBRE98K06J20130921
2013-09-22,04:22:05,1mupmz,62,"Finland citizen's initiative to legalise gay marriage draws 162,000 signatures, more than 3 times than needed to be considered by parliament",yle.fi,http://yle.fi/uutiset/gay_marriage_initiative_proceeds_to_parliament_with_162000_backers/6838641
