2013-09-08,17:15:34,1lyn92,3333,Germany's retailers want to pay farmers directly for keeping their animals in better conditions than legally required.,translate.google.com,http://translate.google.com/translate?sl=de&tl=en&js=n&prev=_t&hl=en&ie=UTF-8&u=http%3A%2F%2Fwww.stern.de%2Fnews2%2Faktuell%2Fhandel-will-bauern-fuer-bessere-tierhaltung-bezahlen-2055904.html&act=url
2013-09-08,23:18:31,1lyyxh,2933,An eight-year-old girl died of internal injuries on the first night of her arranged marriage to a man more than five times her age,gulfnews.com,http://gulfnews.com/news/gulf/yemen/outrage-at-8-year-old-s-marriage-and-death-1.1228706
2013-09-08,03:19:23,1lxc50,2791,Japanese professor pushes for Hide and Seek at the Olympics,telegraph.co.uk,http://www.telegraph.co.uk/news/worldnews/asia/japan/10290138/Japanese-professor-pushes-for-Hide-and-Seek-at-the-Olympics.html
2013-09-08,17:08:12,1lyn1g,2604,"No attack on Syria, no matter what, say voters",telegraph.co.uk,http://www.telegraph.co.uk/news/worldnews/middleeast/syria/10293825/No-attack-on-Syria-no-matter-what-say-voters.html
2013-09-08,15:28:31,1lyjmi,1193,"US intelligence agency has the capability of tapping user data from the iPhone, devices using Android as well as BlackBerry, a system previously believed to be highly secure",spiegel.de,http://www.spiegel.de/international/world/a-920971.html
2013-09-08,16:56:02,1lymnw,827,Bank of America Blocked Donations to the Wikileaks Party,atomicscroll.com,http://atomicscroll.com/php/story.php?context=30&story=30
2013-09-08,12:18:48,1lyadv,829,"Damascus repeatedly rejected commanders requests to be allowed to use chemical weapons, radio transmissions captured by a ship of the German Navy crossing off the Syrian coast shows.",translate.googleusercontent.com,http://translate.googleusercontent.com/translate_c?depth=3&nv=1&rurl=translate.google.com&sl=de&tl=en&u=http://www.n-tv.de/politik/Kommandeure-draengten-auf-C-Waffen-Einsatz-article11324591.html%3Fmobile%3Dfalse&usg=ALkJrhhzYPKnJjbvnhZVatgi8yuMyvQZXQ
2013-09-08,06:00:40,1lxn1d,717,Reuters confirms that the U.S. Government doesn’t know who ordered the CW attack in Syria on August 21.,emptywheel.net,http://www.emptywheel.net/2013/09/07/syria-the-administrations-attribution-failure/#more-37942
2013-09-08,23:27:50,1lyzdt,647,Russian lesbian author Masha Gessen pleads 'Get us the hell out of here'. Says Kremlin has unleashed an 'all-out war' on gay people,huffingtonpost.com,http://www.huffingtonpost.com/michelangelo-signorile/russian-gay-activists-plea-get-us-the-hell-out-of-here_b_3881059.html
2013-09-08,01:33:00,1lx5bz,604,A Wall Street Journal op-ed cited this week by both Secretary of State John Kerry and Sen. John McCain has drawn scrutiny for not disclosing writer Elizabeth O'Bagy's ties to a Syrian rebel advocacy group.,m.huffpost.com,http://m.huffpost.com/us/entry/3881477?1378494556
2013-09-08,13:41:02,1lyeuz,562,French consulate worker arrested at Israeli border with 334 pounds of gold and $2 million in checks,rawstory.com,http://www.rawstory.com/rs/2013/09/07/french-consulate-worker-arrested-at-israeli-border-with-69-pounds-of-gold-and-2-million-in-checks/
2013-09-08,23:35:40,1lyzs3,399,Today's middle class feel oppressed in the same way as Marx’s 19th-century working class,independent.co.uk,http://www.independent.co.uk/voices/comment/todays-middle-class-feel-oppressed-in-the-same-way-as-marxs-19thcentury-working-class-8802230.html
2013-09-08,16:29:32,1lyluc,381,‘We say no war’: Protesters across the world rally against military strike on Syria,rt.com,http://rt.com/news/worldwide-protests-syria-strike-564/
2013-09-08,14:29:52,1lyh5j,375,Church of England has £10m invested in arms firm.,independent.co.uk,http://www.independent.co.uk/news/uk/home-news/church-of-england-has-10m-invested-in-arms-firm-8803469.html
2013-09-08,12:39:15,1lybji,344,"Children removed from Christian sect after German police raids -- ""rods used were soaked in oil to make them more pliable during a beating, when children were allegedly struck on their bare feet, arms and backs...as the children were removed [by police] they showed no emotion towards their parents""",theguardian.com,http://www.theguardian.com/world/2013/sep/06/children-christian-sect-police-raids-twelve-tribes
2013-09-08,02:31:51,1lx91j,320,"Dubai police have intercepted a shipment of over half a ton of ivory. Found at Dubai International Airport, the haul was described by police as being one of the largest found in the emirate.",thenational.ae,http://www.thenational.ae/news/uae-news/dubai-police-intercept-half-a-ton-of-smuggled-ivory
2013-09-08,02:47:13,1lxa2p,233,Syria: western activists volunteer to become 'human shields',telegraph.co.uk,http://www.telegraph.co.uk/news/worldnews/middleeast/syria/10292367/Syria-western-activists-volunteer-to-become-human-shields.html
2013-09-08,04:00:10,1lxewu,205,90% of the condom vending machines installed at public places in India have gone missing,news.outlookindia.com,http://news.outlookindia.com/items.aspx?artid=809236
2013-09-08,14:46:59,1lyhwk,194,"Afghans say NATO airstrike kills 15, including women and children; NATO says 10 insurgents die",hosted.ap.org,http://hosted.ap.org/dynamic/stories/A/AS_AFGHANISTAN?SITE=AP&SECTION=HOME&TEMPLATE=DEFAULT&CTIME=2013-09-08-01-30-15
2013-09-08,00:21:36,1lx12p,140,EU agrees that all indications on Syria chemical attack points to Assad - 'but that any potential military attack against it should wait for a U.N. inspectors’ report.',washingtonpost.com,http://www.washingtonpost.com/world/middle_east/eu-agrees-that-all-indications-regarding-syria-chemical-attack-points-to-assad/2013/09/07/ffe30420-17b0-11e3-961c-f22d3aaf19ab_story.html
2013-09-08,08:47:10,1lxxuk,91,"Police used teargas to contain street protests on Saturday in several Brazilian cities, stopping demonstrators from disrupting Independence Day military parades and an international soccer game between Brazil and Australia.",reuters.com,http://www.reuters.com/article/2013/09/07/us-brazil-protests-idUSBRE9860FB20130907?feedType=RSS&feedName=topNews
2013-09-08,22:40:04,1lyx4q,87,Pakistani president becomes first democratically elected leader to finish a full term.,theglobeandmail.com,http://www.theglobeandmail.com/news/world/pakistani-president-becomes-first-democratically-elected-leader-to-finish-a-full-term/article14179598/?cmpid=rss1
2013-09-08,09:04:10,1lxyu1,76,Protests Fill City Streets Across Brazil,nytimes.com,http://www.nytimes.com/2013/09/08/world/americas/protests-fill-city-streets-across-brazil.html?partner=rss&emc=rss&smid=tw-nytimes&_r=0
2013-09-08,14:54:32,1lyi87,69,"Afghans say NATO airstrike kills 15, including women and children; NATO says 10 insurgents die",montrealgazette.com,http://www.montrealgazette.com/news/world/Afghans+NATO+airstrike+kills+including+women+children+NATO/8884028/story.html
2013-09-08,11:52:38,1ly8vw,56,"Why ""Made In China"" Is Still Synonymous With Low Quality: Chinese companies justify shoddy products because of fierce competition. One businessman explains why this approach is nothing but a dead end.",worldcrunch.com,http://www.worldcrunch.com/default/why-quot-made-in-china-quot-is-still-synonymous-with-low-quality/manufacturers-made-in-china-environment-ethics-profit/c0s13295/
2013-09-08,08:12:58,1lxvqj,55,Tens of thousands of Tunisians took to the streets on Saturday to renew their demands that the Islamist-led government step down and end a political deadlock threatening the North African country's fledgling democracy.,reuters.com,http://www.reuters.com/article/2013/09/07/us-tunis-crisis-idUSBRE9860IW20130907
2013-09-08,21:20:35,1lyu4a,52,Syria crisis: Obama urges Americans to back strikes - live updates,theguardian.com,http://www.theguardian.com/world/2013/sep/08/syria-crisis-obama-urges-americans-to-back-strikes
2013-09-08,04:24:55,1lxgj1,47,"Two years after Libya’s revolution, government struggles to control hundreds of armed militias",washingtonpost.com,http://www.washingtonpost.com/world/middle_east/two-years-after-libyas-revolution-government-struggles-to-control-hundreds-of-armed-militias/2013/09/06/6f32c4c0-13ae-11e3-880b-7503237cc69d_story.html
2013-09-08,20:11:43,1lyrzh,45,International Criticism Escalates Against TPP as Negotiations Go Further Underground,eff.org,https://www.eff.org/deeplinks/2013/09/international-criticism-escalates-against-tpp-negotiations-go-further-underground
2013-09-08,00:57:31,1lx37c,43,Syrian Anarchist Challenges the Rebel/Regime Binary View of Resistance,truth-out.org,http://truth-out.org/news/item/18617-syrian-anarchist-challenges-the-rebel-regime-binary-view-of-resistance
