2013-06-06,22:01:00,1fscvd,2743,Turkish Prime Minister Recep Tayyip Erdogan has said plans to redevelop a park in Istanbul will go ahead despite mass protests now in their seventh day.,bbc.co.uk,http://bbc.co.uk/news/world-europe-22801548
2013-06-06,12:44:16,1frp93,2551,Church of England gives up fight against gay marriage: The Church of England has effectively accepted defeat over gay marriage signalling that it will no longer fight against a change in the law.,telegraph.co.uk,http://www.telegraph.co.uk/news/religion/10101900/Church-of-England-gives-up-fight-against-gay-marriage.html
2013-06-06,05:31:13,1fqtib,2367,"Turkish Protests Are About Democracy, Not Religion",thenation.com,http://www.thenation.com/article/174677/turkish-protests-are-about-democracy-not-religion
2013-06-06,16:56:48,1fs1sw,1774,18-year-old Paris student left brain dead after brutal attack by far-right skinheads,thelocal.fr,http://www.thelocal.fr/20130606/paris-student-left-brain-dead-by-far-right-attack
2013-06-06,20:38:46,1fs9bk,1743,Girl Gang Raped in Pakistan: Dares to Fight for Justice,clarionproject.org,http://www.clarionproject.org/news/outlawed-pakistan-daring-fight-justice
2013-06-06,10:09:13,1fre0l,1737,Pope Francis says wasting food is like stealing from the poor,telegraph.co.uk,http://www.telegraph.co.uk/news/religion/the-pope/10101375/Pope-Francis-says-wasting-food-is-like-stealing-from-the-poor.html
2013-06-06,01:44:58,1fqavw,1491,Israeli judge resigns after commenting some girls 'enjoy being raped' | CTV News,ctvnews.ca,http://www.ctvnews.ca/world/israeli-judge-resigns-after-commenting-some-girls-enjoy-being-raped-1.1312134#.Ua9q-w_qU-A.reddit
2013-06-06,19:44:34,1fs7c8,1276,"UN: Countries that engage in bulk, warrantless Internet surveillance are violating human rights",boingboing.net,http://boingboing.net/2013/06/05/un-makes-the-connection-betwee.html
2013-06-06,00:38:35,1fq5om,1149,"Russian police uncover subterranean migrant city: The city contained a factory complete with sewing machines and tables where the illegal migrants were kept to sew clothes... The underground complex was also equipped with a market, cafe, cinema and casino.",euronews.com,http://www.euronews.com/2013/06/05/russian-police-uncover-subterranean-migrant-city/
2013-06-06,17:10:44,1fs28x,1122,Turkish police arrest 25 people for using social media to call for protest,guardian.co.uk,http://www.guardian.co.uk/world/2013/jun/05/turkish-police-arrests-social-media-protest
2013-06-06,07:17:57,1fr212,1106,"BBC: Crowds in Taksim Square ""bigger than ever"" tonight.",bbc.co.uk,http://www.bbc.co.uk/news/world-middle-east-22791322
2013-06-06,17:05:05,1fs22w,703,Teacher who had over 200 child porn pictures on his computer is allowed to return to work.,bbc.co.uk,http://www.bbc.co.uk/news/uk-england-22793239
2013-06-06,22:44:20,1fsfdh,665,Former Mexico president calls for marijuana legalization,rawstory.com,http://www.rawstory.com/rs/2013/06/05/former-mexico-president-calls-for-marijuana-legalization/
2013-06-06,03:24:09,1fqj07,602,IMF 'to admit mistakes' in handling Greek debt crisis and bailout.,guardian.co.uk,http://www.guardian.co.uk/business/2013/jun/05/imf-admit-mistakes-greek-crisis-austerity
2013-06-06,19:59:48,1fs7vw,571,Hamas Orders Christian Schools In Gaza To Enforce Sharia Gender Separation Rules Or Face Closure,catholicherald.co.uk,http://www.catholicherald.co.uk/news/2013/06/04/five-church-schools-in-gaza-face-closure-after-hamas-order/#.Ua3PqEFhZzA.email
2013-06-06,16:44:29,1fs1eg,495,North and South Korea Agree to First Dialogue in Years,nytimes.com,http://www.nytimes.com/2013/06/07/world/asia/north-and-south-korea-agree-to-dialogue.html
2013-06-06,02:31:51,1fqeoy,450,"Spanish MPs abolish subsidised alcoholic drinks in parliament bars after public outcry. ‘There’s no money for school lunches, but there is some for gin and tonics’",independent.co.uk,http://www.independent.co.uk/news/world/europe/theres-no-money-for-school-lunches-but-there-is-some-for-gin-and-tonics-spanish-mps-abolish-subsidised-alcoholic-drinks-in-parliament-bars-after-public-outcry-8646356.html
2013-06-06,10:07:31,1frdw9,363,"In Nigeria, “They are killing people without asking who they are. When they see young men in traditional robes, they shoot them on the spot.”",nytimes.com,http://www.nytimes.com/2013/06/06/world/africa/nigerian-refugees-accuse-army-of-excess-force.html?_r=0
2013-06-06,23:12:22,1fsh5j,341,German High Court Supports Equal Tax Privileges for Gay Couples,spiegel.de,http://www.spiegel.de/international/germany/german-high-court-supports-equal-tax-privileges-for-gay-couples-a-904111.html
2013-06-06,12:04:52,1frmgk,251,Brilliant! Spanish town mailing un-scooped poop to the dog owners who leave it behind.,ca.news.yahoo.com,http://ca.news.yahoo.com/blogs/sideshow/town-mails-discarded-dog-poop-back-errant-pet-195451973.html
2013-06-06,04:37:57,1fqp1c,224,"Fake farm concealed underground grow-op in Langley, B.C. Sheep and pig help disguise grow-op bunker as hobby farm",cbc.ca,http://www.cbc.ca/news/canada/british-columbia/story/2013/06/04/bc-langley-underground-grow-op.html
2013-06-06,04:10:14,1fqmp3,209,Turkish trade unions join protests against PM Erdogan,reuters.com,http://www.reuters.com/article/2013/06/05/us-turkey-protests-idUSBRE94U0J920130605?feedType=RSS&feedName=worldNews
2013-06-06,23:49:36,1fsjto,174,Iran bans dog-walking in public and warn animals could be 'arrested' if caught outside,dailymail.co.uk,http://www.dailymail.co.uk/news/article-2336773/Iran-bans-dog-walking-public-warn-animals-arrested-caught-outside.html
2013-06-06,19:39:24,1fs76c,176,Police slash ankles and arms of more than 70 men in Papua New Guinea,abc.net.au,http://www.abc.net.au/news/2013-06-06/an-png-police-charged-after-slashing-ankles/4737476
2013-06-06,08:13:52,1fr60h,155,"A mouse-sized fossil from China has provided remarkable new insights into the origin of primates. At 55 million years old, Archicebus, which roughly translates as ""ancient monkey,"" represents the earliest known member of this broad group of animals that includes humans",bbc.co.uk,http://www.bbc.co.uk/news/science-environment-22770646#FBM247554
2013-06-06,02:53:40,1fqghd,145,Internal IMF reports to suggest Fund underestimated the damage austerity would cause to Greece,guardian.co.uk,http://www.guardian.co.uk/business/2013/jun/05/imf-admit-mistakes-greek-crisis-austerity?guni=Network%20front:network-front%20main-3%20Main%20trailblock:Network%20front%20-%20main%20trailblock:Position1
2013-06-06,20:22:08,1fs8nx,134,Turkish policeman dead after falling from bridge while pursuing protesters,rt.com,http://rt.com/news/turkish-police-officer-bridge-309/
2013-06-06,22:41:47,1fsf7m,108,"30 lashes, jail for Saudi who slapped wife",beta.dawn.com,http://beta.dawn.com/news/1016290/30-lashes-jail-for-saudi-who-slapped-wife
2013-06-06,01:12:04,1fq888,101,Bilderberg 2013: welcome to 1984,guardian.co.uk,http://www.guardian.co.uk/world/2013/jun/05/bilderberg-2013-goldman-sachs-watford
2013-06-06,12:24:55,1frnue,91,"Mayor of Canadian city ""sorry"" for using manure to drive out homeless",cbc.ca,http://www.cbc.ca/news/canada/british-columbia/story/2013/06/05/bc-abbotsford-homeless-manure.html?cmp=rss
