2013-10-17,03:49:43,1ol8i5,3228,German filmmaker imprisoned for exposing dire Qatar World Cup worker conditions,rt.com,http://rt.com/news/qatar-german-cup-workers-265/
2013-10-17,21:17:48,1on0on,3051,Scotland Now Receives 40 Percent of its Power from Renewables,oilprice.com,http://oilprice.com/Alternative-Energy/Renewable-Energy/Scotland-Now-Receives-40-Percent-of-its-Power-from-Renewables.html
2013-10-17,08:49:17,1olx0e,2596,Pope Francis to Auction his Harley Davidson Motorcycle to Benefit Homeless,ncregister.com,http://www.ncregister.com/daily-news/pope-to-auction-harley-davidson-motorcycle-to-benefit-homeless/?utm_source=dlvr.it&utm_medium=twitter
2013-10-17,02:02:10,1okzwq,2378,Kenya to microchip all rhinos' horns to beat poachers,phys.org,http://phys.org/news/2013-10-kenya-microchip-rhinos-horns-poachers.html
2013-10-17,18:39:39,1omukn,2000,Documents reveal NSA’s extensive involvement in targeted killing program,washingtonpost.com,http://www.washingtonpost.com/world/national-security/documents-reveal-nsas-extensive-involvement-in-targeted-killing-program/2013/10/16/29775278-3674-11e3-8a0e-4e2cf80831fc_story.html
2013-10-17,05:51:12,1oliu3,1721,Largest Star ever found in the universe about to go supernova 16000 ly from Earth,space.com,http://www.space.com/23227-biggest-star-universe-death-throes.html
2013-10-17,21:37:29,1on1q7,1398,Brazil's biggest drug cartel promises a 'World Cup of terror' as violent demonstrations take over the streets... The threat was issued by the First Capital of the Command in Sao Paulo... Gang was behind the murder of more than a hundred of the city's police,dailymail.co.uk,http://www.dailymail.co.uk/news/article-2462638/Brazils-biggest-drug-cartel-promises-World-Cup-terror.html
2013-10-17,11:06:38,1om7cs,1095,"""Some 30 million people are enslaved worldwide, trafficked into brothels, forced into manual labor, victims of debt bondage or even born into servitude, a global index on modern slavery showed on Thursday [17 October 2013]. Almost half are in India""",ca.news.yahoo.com,http://ca.news.yahoo.com/thirty-million-people-slaves-half-india-survey-231710875.html
2013-10-17,23:26:43,1on8d5,925,"New EU rules to curb transfer of data to US after Edward Snowden revelations - Regulations will make it harder to move European data to third countries, with fines running into billions for failure to comply",theguardian.com,http://www.theguardian.com/world/2013/oct/17/eu-rules-data-us-edward-snowden
2013-10-17,00:14:41,1okra7,724,"Germany’s Bishop of Bling : Pope Francis has summoned a spendthrift German bishop to Rome to answer for his excesses, including a $3 million marble courtyard at his new headquarters with fountains spouting holy water.",thedailybeast.com,http://www.thedailybeast.com/articles/2013/10/16/germany-s-bishop-of-bling.html
2013-10-17,09:02:33,1oly09,672,"Deaf 10-year-old girl trafficked to UK, kept in cellar and raped by pensioner",belfasttelegraph.co.uk,http://www.belfasttelegraph.co.uk/news/local-national/uk/deaf-10yearold-girl-trafficked-to-uk-kept-in-cellar-and-raped-by-pensioner-29666785.html
2013-10-17,00:25:11,1oks2l,573,BP oil spill: Ex-Halliburton manager pleads guilty to destroying evidence,theguardian.com,http://www.theguardian.com/environment/2013/oct/15/bp-oil-spill-halliburton-manager-guilty-destroying-evidence
2013-10-17,21:57:27,1on2r4,578,Romanian villagers occupy site to prevent Chevron 'fracking'. Chevron decides to suspend its activities (update in comments),rawstory.com,http://www.rawstory.com/rs/2013/10/16/romanian-villagers-and-priests-occupy-chevron-fracking-site-in-protest/
2013-10-17,03:51:35,1ol8ok,454,10 reasons not to trust claims UK national security is being threatened by media covering whistleblower leaks,theguardian.com,http://www.theguardian.com/uk-news/2013/oct/16/national-security-leaks-gchq-nsa-intelligence-agencies
2013-10-17,20:03:39,1omxia,406,"British Gas hikes prices by 9.2% - with customers' annual bills set to rise by over £120 - It'll leave average annual bills at a record high, forcing many more hard-up households into fuel poverty. Energy giant denies accusations of profiteering, blames external factors.",independent.co.uk,http://www.independent.co.uk/news/uk/home-news/british-gas-hikes-prices-by-92--with--customers-annual-bills-set-to-rise-by-more-than-120-8885944.html
2013-10-17,11:25:39,1om8t3,361,2% of China's public consumes one-third of world's luxury goods,wantchinatimes.com,http://www.wantchinatimes.com/news-subclass-cnt.aspx?MainCatID=11&cid=1102&id=20131008000095
2013-10-17,17:05:45,1omrfh,350,"95 Bushfires burning throughout New South Wales, Australia. Hundreds of homes lost.",abc.net.au,http://abc.net.au/news/2013-10-17/live-blog3a-nsw-bushfire-emergency/5028762
2013-10-17,19:52:04,1omx1u,246,Amnesty has urged Iran not to go ahead with a repeat execution for a drug smuggler who survived a botched hanging. The condemned man was found alive in a morgue after being hanged at a jail in the city of Bojnord last week. He is now being nursed to recovery in preparation for his repeat execution.,bbc.co.uk,http://www.bbc.co.uk/news/world-middle-east-24563453
2013-10-17,10:56:05,1om6ku,244,Man from Kiribati Applying to High Court of New Zealand to be Granted Asylum as Climate Change Refugee - has three children who will live long enough to see Kiribati disappear under the Pacific Ocean,businessspectator.com.au,http://www.businessspectator.com.au/news/2013/10/17/policy-politics/pacific-man-seeks-climate-change-asylum
2013-10-17,05:50:48,1olisw,204,National study suggests Finland is the first country in the world to start to get fitter - a reduction in obesity rates,yle.fi,http://yle.fi/uutiset/thl_study_national_weight_gains_stop_fewer_smoking_diets_more_healthy/6883732?origin=rss&utm_medium=referral&utm_source=pulsenews
2013-10-17,10:55:40,1om6jq,183,Turkey blows Israel’s cover for Iranian spy ring,washingtonpost.com,http://www.washingtonpost.com/opinions/david-ignatius-turkey-blows-israels-cover-for-iranian-spy-ring/2013/10/16/7d9c1eb2-3686-11e3-be86-6aeaa439845b_story.html
2013-10-17,14:03:26,1omjdk,171,"5 major bush fires are still burning in NSW, Australia; spreading towards houses and has already shut down Newcastle Airport",theaustralian.com.au,http://www.theaustralian.com.au/news/nation/bushfire-menaces-homes-near-lithgow-in-nsw/story-e6frg6nf-1226741566330
2013-10-17,16:22:23,1ompvd,164,White House says Iran sounds serious in nuclear talks,worldnews.nbcnews.com,http://worldnews.nbcnews.com/_news/2013/10/16/20992503-white-house-says-iran-sounds-serious-in-nuclear-talks?lite
2013-10-17,02:43:40,1ol39k,155,EU says Palestinian Authority lost 2.5 billion euros of aid over the last four years,middleeastmonitor.com,http://www.middleeastmonitor.com/news/europe/7814-eu-says-palestinian-authority-lost-25-billion-euros-of-aid
2013-10-17,13:09:50,1omg44,154,"Bishop Christopher Senyonjo, Excommunicated Ugandan Priest, Says American Missionaries Feed LGBT Hate",huffingtonpost.com,http://www.huffingtonpost.com/2013/10/16/bishop-christopher-senyon_n_4109520.html
2013-10-17,21:18:01,1on0p2,124,"North Korea’s imports of luxury goods, including pets, watches and alcohol, have soared under Kim Jong Un, exceeding the extravagance of even his father, South Korean statistics showed.",ajw.asahi.com,http://ajw.asahi.com/article/asia/korean_peninsula/AJ201310160062
2013-10-17,00:57:28,1okuof,95,Man Survives Public Hanging in Iran; Will be Hanged Again,ora.tv,http://www.ora.tv/newsbreaker/executed-twice-man-survives-public-hanging-iran-hanged-0_n6tbfmv0
2013-10-17,22:27:39,1on4gk,81,Turkish Prime Minister Recep Tayyip Erdoğan disclosed information to Iranian intelligence about the identities of up to 10 Iranians meeting with Mossad case officers,hurriyetdailynews.com,http://www.hurriyetdailynews.com/turkish-pm-disclosed-iran-israel-spy-ring-washington-post-columnist-claims.aspx?pageID=238&nID=56360&NewsCatID=338
2013-10-17,23:18:40,1on7sf,72,World Health Organization: Outdoor air pollution a leading cause of cancer,rawstory.com,http://www.rawstory.com/rs/2013/10/17/world-health-organization-outdoor-air-pollution-a-leading-cause-of-cancer/
2013-10-17,09:11:48,1olynt,67,Documents reveal NSA’s extensive involvement in Drone program,washingtonpost.com,http://www.washingtonpost.com/world/national-security/documents-reveal-nsas-extensive-involvement-in-targeted-killing-program/2013/10/16/29775278-3674-11e3-8a0e-4e2cf80831fc_story.html?Post+generic=%3Ftid%3Dsm_twitter_washingtonpost
