2013-05-17,03:20:06,1egr1w,2436,Christianity could be facing a catastrophic collapse in Britain according to official figures suggesting it is declining 50 percent faster than previously thought.,telegraph.co.uk,http://www.telegraph.co.uk/news/religion/10062745/Christianity-declining-50pc-faster-than-thought-as-one-in-10-under-25s-is-a-Muslim.html
2013-05-17,04:16:06,1egvfk,2015,Pro-Life activists threaten to slit throat of Irish member of Parliament over proposed abortion legislation. They have also threatened to burn down her house.,irishexaminer.com,http://www.irishexaminer.com/ireland/pro-life-activists-threaten-to-slit-throat-of-td-231358.html
2013-05-17,10:15:11,1ehmub,1823,Syria is not breaking apart - It is already broken apart and is now a collection of armed fiefs loyal to 3 groups,nytimes.com,http://www.nytimes.com/2013/05/17/world/middleeast/pressure-of-war-is-causing-syria-to-break-apart.html
2013-05-17,08:10:14,1ehdwd,1340,Life-saving drugs prices set to fall by up to 80 per cent in India,m.timesofindia.com,http://m.timesofindia.com/india/Life-saving-drugs-prices-set-to-fall-by-up-to-80-per-cent/articleshow/20089541.cms
2013-05-17,23:19:29,1eio0l,964,"OECD: The widest gaps between rich and poor were registered in Chile, Mexico, Turkey and the United States.",wsws.org,http://www.wsws.org/en/articles/2013/05/17/oecd-m17.html
2013-05-17,21:12:56,1eih9b,965,"Author Who Chronicled Mexico’s Drugs War Forced to Flee - ""He said 'run', then hung up"". She tells how colleague's disappearance meant she had to escape. Her blog partner is still missing.",texasobserver.org,http://www.texasobserver.org/blog-del-narco-author-who-chronicled-mexicos-drugs-war-forced-to-flee/
2013-05-17,20:22:53,1eif7z,700,"Russia's foreign minister 'does not understand' uproar over Syria arms sales: ""We have not hidden that we supply weapons to Syria under signed contracts, without violating any international agreements, or our own legislation""",telegraph.co.uk,http://www.telegraph.co.uk/news/worldnews/middleeast/syria/10063624/Russia-does-not-understand-uproar-over-Syria-arms-sales.html
2013-05-17,19:37:19,1eido5,672,Golden Dawn Member Of Parliament Yells 'Heil Hitler' In The Middle Of A Debate,businessinsider.com,http://www.businessinsider.com/golden-dawn-member-of-parliament-yells-heil-hitler-2013-5
2013-05-17,14:41:40,1ei3nt,444,An Australian man who raped and strangled his Indian student neighbour and threw her body into a canal in a suitcase was jailed Friday for 45 years for the ‘horrifying’ murder.,khaleejtimes.com,http://www.khaleejtimes.com/kt-article-display-1.asp?xfile=data/international/2013/May/international_May541.xml&section=international
2013-05-17,10:54:31,1ehpj0,413,Fifteen killed by suicide bomber in Kabul: Dead included two Nato soldiers and four contractors,irishtimes.com,http://www.irishtimes.com/news/world/asia-pacific/fifteen-killed-by-suicide-bomber-in-kabul-1.1396556
2013-05-17,21:49:11,1eiiyx,358,"UK MP to Google: 'you do do evil' when it comes to tax ""You are a company that says you do no evil. I think that you do do evil in that you use smoke and mirrors to avoid paying tax.""",wired.co.uk,http://www.wired.co.uk/news/archive/2013-05/17/google-amazon-tax
2013-05-17,06:33:04,1eh6hj,332,"US slams Japanese mayor's sex-slave comments - State Department says comments by mayor that sex slaves were ""necessary"" during World War II were ""outrageous""",aljazeera.com,http://www.aljazeera.com/news/asia-pacific/2013/05/2013516202015195744.html
2013-05-17,23:40:23,1eipig,319,The Head of King Richard III Has Been 3D-Printed From His Exhumed Skull,theatlantic.com,http://www.theatlantic.com/technology/archive/2013/05/the-uncanny-face-model-they-made-with-richard-iiis-skull/275965/
2013-05-17,05:31:50,1eh1ln,282,"Unmoved by Israel, Russia will send top air-defense system to Assad [x-post /r/syriancivilwar]",timesofisrael.com,http://www.timesofisrael.com/unmoved-by-israel-russia-will-deliver-top-air-defense-system-to-assad/
2013-05-17,13:04:46,1ehybs,263,Toronto Star reporters have seen video of Toronto Mayor Rob Ford smoking crack,thestar.com,http://www.thestar.com/news/city_hall/2013/05/16/toronto_mayor_rob_ford_in_crack_cocaine_video_scandal.html?app=noRedirect
2013-05-17,01:53:06,1egkdl,221,US seizes top Bitcoin exchange as crackdown begins,rt.com,http://rt.com/usa/bitcoin-exchange-seized-crackdown-begins-334/
2013-05-17,22:08:42,1eijwf,198,Former Argentine dictator Videla dead,jpost.com,http://www.jpost.com/Breaking-News/Former-Argentine-dictator-Videla-dead-87-313484
2013-05-17,19:59:33,1eieev,196,"At least 13 killed, 45 wounded as bombs go off in two Pakistani mosques",nytimes.com,http://www.nytimes.com/aponline/2013/05/17/world/asia/ap-as-pakistan.html?hp&_r=0
2013-05-17,04:52:34,1egye9,185,"New, poisonous, meth-like drug ""sisa"" is sweeping through Athens. Many addicts live for only a few months.",vice.com,http://www.vice.com/en_uk/vice-news/sisa-cocaine-of-the-poor-part-1#ooid=BnMjhkYjp7fWp7Evouj9czB5DVsUP2bI
2013-05-17,23:22:13,1eio7p,141,"Earthquake felt in Toronto, Canada, reported as Magnitude 5.0",earthquake.usgs.gov,http://earthquake.usgs.gov/earthquakes/eventpage/usb000gxna#summary
2013-05-17,00:26:43,1ege9x,125,"""Pope Francis on Thursday [16 May 2013] called on world leaders to put an end to the 'cult of money' and to do more to help the poor, warning that insecurity was rising in many regions of the world and the 'joy of life' was diminishing in developed countries.""",france24.com,http://www.france24.com/en/20130516-pope-urges-global-leaders-end-tyranny-money
2013-05-17,19:04:07,1eicpr,116,"Russia has sent advanced antiship cruise missiles to Syria, a move that illustrates the depth of its support for the Syrian government. Russia has previously provided a version of the missiles, but those delivered recently are outfitted with an advanced radar that makes them more effective.",nytimes.com,http://www.nytimes.com/2013/05/17/world/middleeast/russia-provides-syria-with-advanced-missiles.html?hp&pagewanted=all
2013-05-17,22:44:07,1eilv8,90,Argentina's ex-military leader Jorge Rafael Videla has died aged 87 while serving a life sentence for crimes against humanity,bbc.co.uk,http://www.bbc.co.uk/news/world-latin-america-22570888
2013-05-17,18:39:04,1eibzs,89,"Massive solar flares, some of the largest ever seen, could potentially disable many communications and electrically operating systems on Earth.",science.nbcnews.com,http://science.nbcnews.com/_news/2013/05/15/18276085-latest-big-solar-flare-could-give-earth-a-glancing-blow?lite
2013-05-17,12:45:19,1ehx5l,85,"Russia Sends More Advanced Missiles to Aid Assad in Syria: Antiship cruise missiles could make it more difficult for the United States and its allies to impose a naval embargo, establish a no-fly zone or carry out airstrikes in support of Syria’s rebels",nytimes.com,http://www.nytimes.com/2013/05/17/world/middleeast/russia-provides-syria-with-advanced-missiles.html
2013-05-17,04:31:57,1egwpj,82,"Court papers chart breakdown of Saudi princes' relations with business partner. """"Even your King [of Jordan] does not raise a question... You agreed to obey us and in return you get our protection. Yet, be sure that if we remove our protection, you and all your family are dead within a second""",guardian.co.uk,http://www.guardian.co.uk/world/2013/may/16/court-papers-saudi-princes-relations?
2013-05-17,08:44:26,1ehggs,77,"Swedish Air Force Fails To Counter Mock Russian Attack: ""The Swedish Air Force reportedly failed to monitor exercises ostensibly aimed at Swedish targets, because no planes or pilots were available.""",alaskadispatch.com,http://www.alaskadispatch.com/article/20130422/swedish-air-force-fails-counter-mock-russian-attack
2013-05-17,20:41:19,1eifx7,76,"Banking Privacy More Important than Copyright Enforcement, Court Rules: Dutch anti-piracy group BREIN pressured one of the largest banks in the Netherlands to hand over the details of an owner of a file-sharing site. The Court said the bank has more responsibility to protect its customers’ privacy",torrentfreak.com,http://torrentfreak.com/banking-privacy-more-important-than-copyright-enforcement-court-rules-130517/
2013-05-17,16:58:37,1ei924,71,Four British Lulzsec members convicted for cyber attacks,wired.co.uk,http://www.wired.co.uk/news/archive/2013-05/16/lulzsec-hacking-conviction
2013-05-17,01:35:21,1egj3o,62,'Space was too good not to share it' - Canadian astronaut Chris Hadfield has said his life in space had to be shared on social media,bbc.co.uk,http://www.bbc.co.uk/news/world-us-canada-22558062
