2013-01-24,20:58:15,176qp9,2451,Two former Scientology members sue church claiming it 'duped' people into donating  millions to misrepresented causes,telegraph.co.uk,http://www.telegraph.co.uk/news/worldnews/northamerica/usa/9822948/Scientology-members-duped-into-donating-millions.html
2013-01-24,19:50:44,176oi2,1897,Don't buy South African wines: striking workers' plea to foreign consumers,guardian.co.uk,http://www.guardian.co.uk/world/2013/jan/24/south-africa-wine-farms-strike?CMP=twt_gu
2013-01-24,18:14:15,176m00,1190,"A renegade band of Solomon Islanders is responsible for the slaughter this week of about 900 bottlenose dolphins, says a group that was paying for the killing to stop. Villagers claim they were promised $2.4 million and only received $700,000.",stuff.co.nz,http://www.stuff.co.nz/world/south-pacific/8218747/Row-leads-to-dolphin-slaughter
2013-01-24,20:42:11,176q5k,995,"The rise in drug resistant infections is comparable to the threat of global warming, according to the chief medical officer for England.",bbc.co.uk,http://www.bbc.co.uk/news/health-21178718
2013-01-24,19:59:37,176orb,930,Spain unemployment rate hit a record: youth rate at 55%,bbc.co.uk,http://www.bbc.co.uk/news/business-21180371
2013-01-24,21:38:09,176s9y,837,"A growing number of university students in Toronto are looking for “sugar daddies” to help pay down their tuition fees and living expenses, says the founder of a U.S. website that helps them do just that.",metronews.ca,http://metronews.ca/news/toronto/521964/toronto-students-seek-love-with-a-price-tag-on-sugar-daddy-website/
2013-01-24,03:56:21,1752tm,564,"
George Soros backs Guatemalan president's call to end war on drugs: says the war on drugs had endangered political stability and security in many countries
",guardian.co.uk,http://www.guardian.co.uk/business/2013/jan/23/george-soros-guatemala-war-on-drugs
2013-01-24,02:58:11,174xqj,334,Catalonia declares itself a sovereign entity,bigstory.ap.org,http://bigstory.ap.org/article/catalonia-declares-itself-sovereign-entity
2013-01-24,01:58:41,174tb9,329,"""The filmmaker Roger Ross Williams reveals how money donated by American evangelicals helps to finance a violent antigay movement in Uganda.""",nytimes.com,http://www.nytimes.com/2013/01/23/opinion/gospel-of-intolerance.html
2013-01-24,21:46:12,176slf,294,"The UN is launching an inquiry into the impact on civilians of drone strikes and other targeted killings. Twenty-five attacks will be examined - in Pakistan, Afghanistan, Yemen, the Palestinian territories and Somalia.",bbc.co.uk,http://www.bbc.co.uk/news/world-21176279
2013-01-24,18:29:25,176md3,237,UK: Firearms offences are 40 per cent down in less than a decade,independent.co.uk,http://www.independent.co.uk/news/uk/crime/police-winning-battle-against-inner-city-gun-crime-8463957.html
2013-01-24,02:52:40,174xcj,209,"“On a daily basis, groups of heavily armed men attack local officials, police, soldiers, teachers and any Muslim they believe is not adhering strictly enough to Islamic values"": Islamist terrorism worsening in Thailand",rendezvous.blogs.nytimes.com,http://rendezvous.blogs.nytimes.com/2013/01/22/islamist-violence-in-mali-algeria-and-thailand/?gwh=F5F2AF3BBBA467333252B4500959BAF7
2013-01-24,18:15:03,176m0s,149,"15,000 crocodiles escape from South African farm  - Telegraph",telegraph.co.uk,http://www.telegraph.co.uk/news/worldnews/africaandindianocean/southafrica/9823009/15000-crocodiles-escape-from-South-African-farm.html
2013-01-24,16:21:39,176it0,141,Palestinians threaten to take Israel to ICC - Middle East - Al Jazeera English,aljazeera.com,http://www.aljazeera.com/news/middleeast/2013/01/201312454114299269.html#.UQDu-BR_h_U.reddit
2013-01-24,23:03:09,176wjk,139,German Supreme Court defines internet access as 'minimum subsistence means',spiegel.de,http://www.spiegel.de/netzwelt/netzpolitik/bgh-urteil-schadensersatz-bei-internet-ausfall-vom-provider-a-879481.html
2013-01-24,07:06:09,175ilf,138,"UBS study heralds age of unsubsidized, profitable solar: ”Purely based on economics, we believe almost every family home and every commercial rooftop in Germany, Italy and Spain should be equipped with a solar system by the end of this decade.”",reneweconomy.com.au,http://reneweconomy.com.au/2013/ubs-boom-in-unsubsidised-solar-pv-flags-energy-revolution-60218
2013-01-24,08:53:32,175qrd,123,Three Canadians Missing in Antarctica,boston.com,http://www.boston.com/news/world/asia/2013/01/23/canadians-missing-antarctic-flight/oqsfLyEiRSH3AmnLlicUSJ/story.html
2013-01-24,23:58:58,176zyc,112,Witchcraft claims against children in Congo DRC reflect curse of poverty. Sorcery charges are increasingly being used by poverty-stricken Congolese families as an excuse to abandon their children,guardian.co.uk,http://www.guardian.co.uk/global-development/2013/jan/24/witchcraft-children-congo-drc-poverty
2013-01-24,08:05:18,175n0l,71,Burger King has said says it is no longer sourcing food from an Irish supplier linked to horsemeat.,bbc.co.uk,http://www.bbc.co.uk/news/world-europe-21174664
2013-01-24,12:00:39,176517,48,"North Korea to target U.S. with nuclear, rocket tests
",reuters.com,http://www.reuters.com/article/2013/01/24/us-korea-north-nuclear-idUSBRE90N03I20130124
2013-01-24,08:51:28,175qlb,50,The Moroccan government has said it plans to change a law that allows rapists to avoid charges if they marry their victims. The move comes nearly a year after 16-year-old girl committed suicide after being forced to marry her alleged rapist.,aljazeera.com,http://www.aljazeera.com/news/africa/2013/01/2013123225637555571.html
2013-01-24,19:53:21,176okq,43,China’s latest restriction for Tibetans: no passports,washingtonpost.com,http://www.washingtonpost.com/blogs/worldviews/wp/2013/01/23/chinas-latest-restriction-for-tibetans-no-passports/
2013-01-24,22:28:16,176umf,39,"
How Britain Enthusiastically Teamed Up with Bush's Horrific Torture and Rendition Agenda",alternet.org,http://www.alternet.org/news-amp-politics/how-britain-enthusiastically-teamed-bushs-horrific-torture-and-rendition-agenda
2013-01-24,12:34:55,1767il,37,"$20 trillion valuation of Australian oil greatly exaggerated, says the company that holds the exploration permits. ",smh.com.au,http://www.smh.com.au/business/20-trillion--not-reality-check-for-linc-oil-find-20130124-2d8zf.html
2013-01-24,08:49:18,175qf3,25,Antibiotic-resistant diseases pose 'apocalyptic' threat.,guardian.co.uk,http://www.guardian.co.uk/society/2013/jan/23/antibiotic-resistant-diseases-apocalyptic-threat
2013-01-24,21:35:19,176s5b,25,"Pakistan admits to holding 700 militants without charge
",reuters.com,http://www.reuters.com/article/2013/01/24/us-pakistan-detainees-idUSBRE90N0HD20130124
2013-01-24,02:43:11,174wn1,24,Iran's morality police crack down on coffee shops: Popular hangout for Tehrani intellectuals closes after refusing to install surveillance cameras to monitor customers,guardian.co.uk,http://www.guardian.co.uk/world/iran-blog/2013/jan/23/iran-camera-coffee-shops?CMP=twt_gu
2013-01-24,02:34:35,174vzr,24,Pacific island nations band together to protect only remaining healthy population as overfishing takes toll on global tuna supply,pri.org,http://www.pri.org/stories/science/environment/pacific-island-nations-band-together-as-overfishing-takes-toll-one-global-tuna-supply-12762.html
2013-01-24,11:05:13,1760vm,23,"Assange hits out at WikiLeaks film: ""Assange said Dreamworks was spending millions of dollars on the film, which he said was ""fanning the flames"" of war against Iran""",independent.ie,http://www.independent.ie/breaking-news/world-news/assange-hits-out-at-wikileaks-film-3363349.html
2013-01-24,18:11:07,176lwr,23,"Egypt: Polio Virus Is Found in Cairo’s Sewers
",nytimes.com,http://www.nytimes.com/2013/01/24/health/egypt-polio-virus-is-found-in-cairos-sewers.html?_r=0
