2013-02-22,02:15:06,18yt1h,2754,"Japanese are beginning to turn against the whaling industry. According to a new report, ""Whaling is an unprofitable business that can survive only with substantial subsidies and one that caters to an increasingly shrinking and aging market.”",globalpost.com,http://www.globalpost.com/dispatch/news/regions/asia-pacific/japan/130214/whaling-whalemeat-japanese-food
2013-02-22,14:56:29,190ckq,2553,"China officially admits the existence of ""Cancer Villages"" for the first time.",france24.com,http://www.france24.com/en/20130222-china-admits-pollution-linked-cancer-villages
2013-02-22,04:57:02,18z5u0,1825,German Catholics allow morning-after pill in rape cases,calgarysun.com,http://www.calgarysun.com/2013/02/21/german-catholics-allow-morning-after-pill-in-rape-cases
2013-02-22,10:29:33,18zvf1,1645,Univision reporting rumors of the death of Joaquín El Chapo Guzmán (world's #1 drug lord) after a gun battle in Guatemala. This comes one day after Wikileaks publishes emails saying he is in Guatemala. (story in spanish),noticias.univision.com,http://noticias.univision.com/narcotrafico/reportajes/article/2013-02-21/fuertes-rumores-indican-que-el-chapo-fue-abatido-en-guatemala#axzz2LabzFczG
2013-02-22,03:50:40,18z0jg,1446,Canadian School teachers prank students with Disneyworld trip causing anger by parents and tears by students the next day.,canada.com,http://www2.canada.com/windsorstar/news/story.html?id=ee3a5397-ed26-42a3-936e-a79a0644b2ff
2013-02-22,20:26:16,190n6c,1048,Bangladesh protests demanding execution of atheist bloggers turn deadly.,tribune.com.pk,http://tribune.com.pk/story/511088/deadly-bangladesh-clashes-over-atheist-bloggers/
2013-02-22,03:38:20,18yzkz,1026,Police ban radios in Zimbabwe to prevent those in rural areas without access to mainstream media from getting the latest updates ahead of elections.,thezimbabwean.co.uk,http://www.thezimbabwean.co.uk/news/zimbabwe/63835/police-ban-radios.html?utm_source=thezim&utm_medium=homepage&utm_campaign=listarticle&utm_content=readmorelink
2013-02-22,02:06:02,18ysdm,1023,"Pope Benedict retired after inquiry into ""Vatican gay bishops""",guardian.co.uk,http://www.guardian.co.uk/world/2013/feb/21/pope-retired-amid-gay-bishop-blackmail-inquiry
2013-02-22,03:24:59,18yyh6,881,Heavily armed Islamic Militants from the Philippines invade Northern Malaysia ,economist.com,http://www.economist.com/news/asia/21572251-chaotic-south-philippines-muslims-launch-foreign-policy-sultans-sabah-swing
2013-02-22,21:01:36,190obi,671,"The world's most powerful drug lord, Joaquín 'El Chapo' Guzman, has been killed in a gun battle between drug gangs, Guatemalan authorities suspect.",news.sky.com,http://news.sky.com/story/1055480/el-chapo-mexican-drug-lord-shot-dead
2013-02-22,21:14:58,190ou4,514,"Egypt imports 140,000 teargas canisters from US.",egyptindependent.com,http://www.egyptindependent.com/news/egypt-imports-140000-teargas-canisters-us
2013-02-22,04:04:44,18z1p0,371,South Korea calls for development of nuclear weapons,globalpost.com,http://www.globalpost.com/dispatch/news/regions/asia-pacific/south-korea/130221/south-korea-nuclear-weapons
2013-02-22,21:01:23,190ob4,269,Parent calls to remove 'religious observance' in non-denominational schools in Scotland,bbc.co.uk,http://www.bbc.co.uk/news/uk-scotland-edinburgh-east-fife-21542417
2013-02-22,11:51:19,1901gj,204,Toronto declared ‘sanctuary city’ to non-status migrants: Toronto has become the first Canadian city with a formal policy allowing undocumented migrants to access services regardless of immigration status,thestar.com,http://www.thestar.com/news/gta/2013/02/21/cisanctuarycity21.html
2013-02-22,03:28:02,18yypl,160,Al Qaeda Tips On Evading Unmanned Aircraft Found In Mali,huffingtonpost.com,http://www.huffingtonpost.com/2013/02/21/how-to-avoid-drones-al-qaeda-tips-mali_n_2734347.html
2013-02-22,02:58:44,18ywce,148,"To Block Gaza Tunnels, Egypt Lets Sewage Flow",nytimes.com,http://www.nytimes.com/2013/02/21/world/middleeast/egypts-floods-smuggling-tunnels-to-gaza-with-sewage.html?_r=2&
2013-02-22,08:42:24,18znkl,151,Mexican Drug Cartels Eye Spain As Their New Home,newamericamedia.org,http://newamericamedia.org/2013/02/mexican-drug-cartels-eye-spain-as-their-new-home.php?utm_source=Daily+Headlines+2%2F21%2F2013&utm_campaign=Monday+Headlines+11%2F26%2F12&utm_medium=email
2013-02-22,02:22:37,18ytjw,151,Syria conflict: Many dead in huge Damascus bombing,bbc.co.uk,http://www.bbc.co.uk/news/world-middle-east-21529634
2013-02-22,22:00:38,190qsq,143,China holds general’s son for gang rape ,rawstory.com,http://www.rawstory.com/rs/2013/02/22/china-holds-generals-son-for-gang-rape/#.USd5-Vr14tM.reddit
2013-02-22,21:26:45,190pbh,135,$2.5 billion in lost income for Egyptian tourism since 2011. Tourism ministry prepares new campaign to promote Egypt by live-streaming images of the country around the world.,english.ahram.org.eg,http://english.ahram.org.eg/NewsContent/3/12/65304/Business/Economy/-bn-lost-income-for-Egyptian-tourism-since-.aspx
2013-02-22,11:51:07,1901fn,117,"Three British Islamists convicted of plotting ""another 9/11""",uk.reuters.com,http://uk.reuters.com/article/2013/02/21/uk-britain-bombers-idUKBRE91K0SK20130221
2013-02-22,13:00:29,19065r,88,Life expectancy increased by 11 years in South Africa by new HIV combating treatment,latimes.com,"http://www.latimes.com/news/science/la-sci-hiv-treatment-costs-20130222,0,3026251.story"
2013-02-22,19:36:52,190lme,89,"Egyptian opposition tries to get Morsi blasted into space - You can vote for him, too.",telegraph.co.uk,http://www.telegraph.co.uk/news/worldnews/africaandindianocean/egypt/9887134/Egyptian-opposition-tries-to-get-Morsi-blasted-into-space.html
2013-02-22,20:35:45,190ngu,85,North Korea to launch 3G network,bbc.co.uk,http://www.bbc.co.uk/news/technology-21546877
2013-02-22,18:49:27,190k95,73,Switzerland's only bear killed amid threat fears,goodplanet.info,http://www.goodplanet.info/eng/Contenu/News/Switzerland-s-only-bear-killed-amid-threat-fears
2013-02-22,06:42:46,18zehp,51,Al-Qaeda's 22 tips for dodging drone attacks: the list in full,telegraph.co.uk,http://www.telegraph.co.uk/news/worldnews/al-qaeda/9886673/Al-Qaedas-22-tips-for-dodging-drone-attacks-the-list-in-full.html
2013-02-22,02:46:34,18yvf2,49,"The war that will shape the face of the Mideast is happening within Islam, not a specific country.",foreignpolicy.com,http://www.foreignpolicy.com/articles/2013/02/20/its_not_about_us
2013-02-22,13:14:20,19074y,45,"The most prolific drug dealer of all time, Chapo Guzman, presumed dead after gun battle.",latimes.com,"http://www.latimes.com/news/world/worldnow/la-fg-wn-guatemala-guzman-20130221,0,7165393.story"
2013-02-22,14:48:14,190c6t,43,"North Korea readies mobile Net service, but not for residents: A month after getting cell phone access, foreigners inside the country will soon get 3G mobile access to the Internet, a privilege not afforded to residents",news.cnet.com,http://news.cnet.com/8301-1023_3-57570659-93/north-korea-readies-mobile-net-service-but-not-for-residents/?tag=reddit
2013-02-22,20:20:21,190myv,42,After Facebook plea 200 strangers attend ex marine funeral,independent.ie,http://www.independent.ie/world-news/europe/200-strangers-turn-up-at-pensioners-funeral-following-facebook-plea-29086065.html
