2013-08-05,21:15:17,1jqhps,3700,Feds are Suspects in New Malware That Attacks Tor Anonymity,wired.com,http://www.wired.com/threatlevel/2013/08/freedom-hosting/
2013-08-05,22:58:28,1jqmxa,2774,Costa Rica announced Monday that it will transform its two zoos into botanical gardens or urban parks in order to eliminate the practice of displaying caged animals,globalpost.com,http://www.globalpost.com/dispatch/news/agencia-efe/130722/costa-rica-aims-zoos-without-cages
2013-08-05,06:47:26,1jp9sh,2659,Two scientists think we can safeguard the world's knowledge against an apocalypse if we store it in DNA,bbc.com,http://www.bbc.com/future/story/20130724-saving-civilisation-in-one-room/all
2013-08-05,08:24:06,1jpg51,1100,"Pakistan, one of the most water-stressed countries in the world, is on the brink of crisis. A recent report from the Asian Development Bank states that the country’s emergency water reserve only has enough supply for 30 days.",salon.com,http://www.salon.com/2013/08/04/global_water_shortage_is_getting_worse_partner/
2013-08-05,22:10:54,1jqkbi,792,"Accused by plotting a ""coup"", Pro-Government Turkey court sentences 254 with prison, including journalists, professors, politicians and significant figures in the army with secular views.",euronews.com,http://www.euronews.com/2013/08/05/turkish-ex-army-boss-basbug-sentenced-to-life-for-ergenekon-overthrow-plot/
2013-08-05,21:36:05,1jqinc,657,Foreigners buy nearly 75% of new homes in inner London,cnbc.com,http://www.cnbc.com/id/100936450
2013-08-05,21:31:18,1jqifh,544,Saving The Earth Is A Very Dangerous Job: Two environmentalists are killed on average every week as land struggles intensify violence against green activists worldwide.,worldcrunch.com,http://www.worldcrunch.com/default/saving-the-earth-is-a-very-dangerous-job/environment-activists-danger-prison-brazil/c0s12931/
2013-08-05,14:17:58,1jq24o,515,Chinese tourists appall North Koreans by throwing candy at their kids,qz.com,http://qz.com/111634/north-korea-is-the-latest-country-to-be-appalled-by-chinese-tourists/
2013-08-05,08:44:07,1jphga,439,US threatens sanctions if energy-starved Pakistan pursues a gas pipeline deal with Iran,tribune.com.pk,http://tribune.com.pk/story/586623/ip-project-in-jeopardy-us-threatens-curbs-if-pakistan-pursues-iran-deal-says-pm/
2013-08-05,21:38:15,1jqir0,342,Japan nuclear body says radioactive water at Fukushima an 'emergency',reuters.com,http://www.reuters.com/article/2013/08/05/us-japan-fukushima-panel-idUSBRE97408V20130805
2013-08-05,02:06:55,1jor8z,305,Julian Assange announces WikiLeaks Party's federal election candidates,abc.net.au,http://www.abc.net.au/news/2013-07-25/assange-announces-wikileaks-party-election-candidates/4843582
2013-08-05,20:24:09,1jqfve,288,"South Korea says concerned about U.S. decision on some Apple models. The move was vehemently criticized by the South Korean media as ""protectionism.",news.yahoo.com,http://news.yahoo.com/south-korea-says-concerned-u-decision-apple-models-060733159.html
2013-08-05,18:23:35,1jqbys,240,Spain accused of acting like North Korea as tensions escalation over Gibraltar - Spain has threatened to close its airspace to flights heading to the British territory,theguardian.com,http://www.theguardian.com/world/2013/aug/05/gibraltar-chief-minister-spain-sabre-rattling
2013-08-05,06:47:08,1jp9rp,177,Pakistan on red alert for possible attack.,cnn.com,http://www.cnn.com/2013/08/04/world/asia/pakistan-alert/index.html?hpt=hp_t2
2013-08-05,00:47:36,1jomin,166,"Iran’s new president takes oath of office, asks West to abandon ‘language of sanctions’",washingtonpost.com,http://www.washingtonpost.com/world/middle_east/irans-new-president-names-us-educated-businessman-as-his-chief-staff-in-his-first-appointment/2013/08/04/b8a6b5fc-fcd0-11e2-89f7-8599e3f77a67_story.html?hpid=z1
2013-08-05,14:43:31,1jq3ga,164,India considers world's largest welfare program through a subsidized food program that would provide 5kg of cheap grain every month to nearly 800 million poor,bbc.co.uk,http://www.bbc.co.uk/news/world-asia-india-23571297
2013-08-05,08:14:55,1jpfl8,140,US band Bloodhound Gang ejected from Russia after flag stunt,independent.co.uk,http://www.independent.co.uk/news/world/europe/us-band-bloodhound-gang-ejected-from-russia-after-flag-stunt-8745678.html
2013-08-05,07:30:43,1jpcpa,139,Bahrain using IP tracking to harass democracy advocates,techweekeurope.co.uk,http://www.techweekeurope.co.uk/news/cyber-repression-attack-of-the-fake-activists-123239
2013-08-05,21:28:13,1jqiaf,119,Latvia blocking extradition of Gozi writer due to disproportionate US sentencing,nakedsecurity.sophos.com,http://nakedsecurity.sophos.com/2013/08/05/latvia-blocking-extradition-of-gozi-writer-thanks-to-disproportionate-us-sentencing/?utm_source=feedburner&utm_medium=feed&utm_campaign=Feed%3A+nakedsecurity+%28Naked+Security+-+Sophos%29
2013-08-05,19:48:14,1jqemo,100,Turkey court clears 21 over Ergenekon 'coup plot',bbc.co.uk,http://www.bbc.co.uk/news/world-europe-23571739
2013-08-05,10:35:49,1jpoke,86,Murdoch sends trusted general 'Col Pot' to bring down Australian government over their National Broadband Network.,theage.com.au,http://www.theage.com.au/comment/murdoch-sends-trusted-general-col-pot-to-bring-down-rudd-over-nbn-20130803-2r6fk.html
2013-08-05,08:17:14,1jpfqd,79,"More than two years into Syria's civil war, the once highly-centralized authoritarian state has effectively split into three distinct parts, each boasting its own flags, security agencies and judicial system.",hosted.ap.org,http://hosted.ap.org/dynamic/stories/M/ML_SYRIA_BREAKING_APART?SITE=RIPAW&SECTION=HOME&TEMPLATE=DEFAULT
2013-08-05,04:45:11,1jp1mt,62,"Fleeing Syria, Palestinians find little support from their brethren in Lebanon",news.yahoo.com,http://news.yahoo.com/fleeing-syria-palestinians-little-support-brethren-lebanon-120005511.html
2013-08-05,13:09:30,1jpycw,63,"In Germany, Union Culture Clashes With Amazon’s Labor Practices",nytimes.com,http://www.nytimes.com/2013/08/05/business/workers-of-amazon-divergent.html?hpw&_r=0
2013-08-05,11:14:17,1jpr0m,60,Same-sex marriages begin in Uruguay,bbc.co.uk,http://www.bbc.co.uk/news/world-latin-america-23571197
2013-08-05,22:40:17,1jqlvd,54,Over half Russians approve of Snowdens activities - poll,rt.com,http://rt.com/politics/rissia-snowden-usa-poll-945/
2013-08-05,13:02:04,1jpxxr,52,JACKIE CHAN IS NOT DEAD (again) - Vows to announce it himself if he dies for real.,news.msn.com,http://news.msn.com/rumors/rumor-action-star-jackie-chan-is-dead
2013-08-05,02:33:20,1josvk,52,Israel expands West Bank settlement subsidies. Cabinet approves funding for dozens of illegal settlements just days after resumption of talks with Palestinians.,aljazeera.com,http://www.aljazeera.com/news/middleeast/2013/08/201384153417243957.html
2013-08-05,22:52:18,1jqmke,47,French President Confirms Ban on Monsanto's GMO Maize MON810,sustainablepulse.com,http://sustainablepulse.com/2013/08/02/french-president-confirms-moratorium-on-monsantos-gm-maize-mon810/#.Uf9UV23pwdA
2013-08-05,18:30:07,1jqc6t,45,Revealed: ‘Big lie’ behind the bedroom tax as families trapped with nowhere to move so cannot avoid new penalty for having spare room - 96% of benefit claimants who will be penalised cannot be rehoused,independent.co.uk,http://www.independent.co.uk/news/uk/politics/revealed-big-lie-behind-the-bedroom-tax-as-families-trapped-with-nowhere-to-move-so-cannot-avoid-new-penalty-for-having-spare-room-8745597.html
