2013-03-12,08:28:48,1a47di,3786,"N. Korea ready to “fight a real war” with the U.S, its media report. ",nwww.koreaherald.com,http://nwww.koreaherald.com/view.php?ud=20130310000009
2013-03-12,01:45:48,1a3d5u,3173,EU bans sale of all animal-tested cosmetics [BBC],bbc.co.uk,http://www.bbc.co.uk/news/world-europe-21740745
2013-03-12,20:46:26,1a57ck,2399,"Japan says it has successfully extracted natural gas from frozen methane hydrate off its central coast, in a world first.",bbc.co.uk,http://www.bbc.co.uk/news/business-21752441
2013-03-12,23:00:07,1a5eea,2281,"Ukrainian military has apparently lost three of its trained dolphins in the Black Sea. ""these dolphins have been trained to attack enemy combat swimmers using special knives or pistols fixed to their heads.""",theatlantic.com,http://www.theatlantic.com/technology/archive/2013/03/ukrainian-attack-dolphins-on-the-loose/273943/
2013-03-12,11:08:38,1a4j55,2228,"Falklands vote in favour of staying British: 98.8% vote ""yes"" with 92% turnout",aljazeera.com,http://www.aljazeera.com/news/americas/2013/03/201331222038905763.html
2013-03-12,22:33:34,1a5ctl,1948,EU votes to reject 'porn ban' proposals,news.cnet.com,http://news.cnet.com/8301-1023_3-57573771-93/eu-votes-to-reject-porn-ban-proposals/?tag=reddit
2013-03-12,18:02:17,1a529k,1501,"Chopsticks Killing Trees, Chinese Lawmaker Says - Legislator, a forestry firm head, urges China to save trees by reducing 80bn pairs of chopsticks  a yr.    ""We urge people to carry their own tableware.""  Rising  wood demand, at least 1/10  illegal, means ""fate of world's forests in China's hands"".",timesofindia.indiatimes.com,http://timesofindia.indiatimes.com/home/environment/flora-fauna/Demand-for-chopsticks-killing-trees-Chinese-lawmaker-says/articleshow/18911758.cms
2013-03-12,05:41:43,1a3u6c,1346,US sends clear warning to North Korea after Pyongyang declares armistice void,guardian.co.uk,http://www.guardian.co.uk/world/2013/mar/11/us-warning-north-korea-truce-nuclear
2013-03-12,09:57:38,1a4dza,1106,"Despite war threats, North Korean border units hit by growing AWOLs",english.yonhapnews.co.kr,http://english.yonhapnews.co.kr/northkorea/2013/03/12/0401000000AEN20130312002600315.HTML
2013-03-12,09:48:56,1a4daf,999,BBC News - Falklands referendum: Islanders vote to remain British,bbc.co.uk,http://www.bbc.co.uk/news/uk-21750909
2013-03-12,23:46:15,1a5gqo,973,[Korea Times] Frontier NK soldiers deserting in large numbers ,koreatimes.co.kr,http://koreatimes.co.kr/www/news/nation/2013/03/485_131958.html
2013-03-12,22:16:30,1a5btm,810,"The Vatican, Iran, and Russia are blocking progress in the UN's Commission on the Status of Women.",nytimes.com,http://www.nytimes.com/2013/03/12/opinion/concerns-at-un-conference-on-violence-against-women.html?nl=todaysheadlines&emc=edit_th_20130312
2013-03-12,01:36:06,1a3cgy,688,"As cardinals gather to elect Pope, Catholic officials break into a sweat over news that €23m investment includes gay sauna ",independent.co.uk,http://www.independent.co.uk/news/world/europe/as-cardinals-gather-to-elect-pope-catholic-officials-break-into-a-sweat-over-news-that-23m-investment-includes-gay-sauna-8529670.html
2013-03-12,06:11:26,1a3wki,657,"An Ugly Truth in the War on Drugs: ""human rights abuses in the war on drugs are widespread and systematic""",nytimes.com,http://www.nytimes.com/2013/03/11/opinion/11iht-edcardoso11.html?smid=tw-share&_r=4&
2013-03-12,22:28:31,1a5cjo,550,"Iran's Ahmadinejad commits grave sin, behaves in a way inappropriate for the president of an Islamic state. His crime? Consoling Hugo Chávez's mother at Chávez's funeral. ",npr.org,http://www.npr.org/blogs/thetwo-way/2013/03/12/174090074/ahmadinejad-touched-and-consoled-ch-vezs-mother-to-clerics-dismay?ft=1&f=1004
2013-03-12,18:20:52,1a52rh,495,"5 Shark Species Win Protection Against Fin Trade in Historic Turnaround - Millions of sharks killed each yr  for shark-fin soup  now have greater protection after world's biggest wildlife summit votes to crack down.  Some nations now see  sharks more valuable alive, as a source of tourism.  ",guardian.co.uk,http://www.guardian.co.uk/environment/2013/mar/11/shark-species-greater-protection-finning
2013-03-12,19:27:00,1a54eq,346," Paranoid Dictator's Communist-Era Bunkers Now a National Nuisance - In Albania, 750,000 Communist-era bunkers populate the landscape, relics of the paranoia & skewed priorities of former dictator Enver Hoxha.  The peculiar bunkerization resulted in 1 bunker for every 4 citizens.",wired.com,http://www.wired.com/rawfile/2013/03/david-galjaard-albanian-bunkers/
2013-03-12,09:23:26,1a4beb,335,"Researchers in China are randomly disabling mouse genes one at a time, in order to identify the function of each gene. By essentially throwing darts at a genetic dartboard to see what happens, the researchers have filled 45,000 mouse cages with mutant mice.",npr.org,http://www.npr.org/2013/03/11/173514863/frankensteins-cat-bioengineering-the-animals-of-the-future
2013-03-12,16:44:48,1a503d,339,Second Korean War Is Unavoidable (x-post from r/Pyongyang),kcna.co.jp,http://kcna.co.jp/item/2013/201303/news11/20130311-24ee.html
2013-03-12,10:48:41,1a4hld,293,New Zealand Condemns Argo,tvnz.co.nz,http://tvnz.co.nz/entertainment-news/argo-condemned-nz-parliament-5366879
2013-03-12,02:04:47,1a3ekz,253,UN Says Korean War Armistice Still in Force,abcnews.go.com,http://abcnews.go.com/US/wireStory/korean-war-armistice-force-18702626#.UT4cr9C_iQU.reddit
2013-03-12,03:40:21,1a3jo7,219,Soviet soldier missing since 1980 found in Afghanistan,cnn.com,http://www.cnn.com/2013/03/06/world/asia/missing-russian-soldier-found-afghanistan/index.html?iref=obinsite
2013-03-12,19:54:27,1a55b3,201,UN asks North Korea's Kim Jong-un to tone down war talk as he rallies troop,standard.co.uk,http://www.standard.co.uk/news/world/un-asks-north-koreas-kim-jongun-to-tone-down-war-talk-as-he-rallies-troops-8530952.html
2013-03-12,23:55:13,1a5hin,198,"Sex Abuse Cover-Up Claims Disturb Conclave: A plain clothes policeman watches Francesco Zanardi. As he waits for his moment just outside the Vatican in St Peter's Square, Zanardi's intention is clear. So is the policeman's. ",cnn.com,http://www.cnn.com/2013/03/11/world/europe/vatican-conclave-priest-abuse/index.html?hpt=hp_t2
2013-03-12,07:11:09,1a41bl,146,North Korean bombast and war games? Seoul residents take it in stride:   South Koreans appeared more focused on protesting the new president and chatting about K-Pop than the prospect of imminent attack from North Korea.,csmonitor.com,http://www.csmonitor.com/World/Asia-Pacific/2013/0311/North-Korean-bombast-and-war-games-Seoul-residents-take-it-in-stride
2013-03-12,01:28:29,1a3bw3,134,U.S. warns health officials to be alert for deadly new virus,reuters.com,http://www.reuters.com/article/2013/03/07/us-virus-warning-idUSBRE9261E820130307
2013-03-12,09:23:49,1a4bfe,123,Rodman: I'm going on vacation with Kim in August,edition.cnn.com,http://edition.cnn.com/2013/03/11/world/asia/north-korea-kim-rodman/index.html?
2013-03-12,15:27:02,1a4xol,118,Breakthrough in Australian hunt for Tasmanian Devil vaccine,au.news.yahoo.com,http://au.news.yahoo.com/thewest/a/-/world/16348670/breakthrough-in-australian-hunt-for-devil-vaccine/
2013-03-12,10:55:06,1a4i2k,111,N. Korean leader threatens strike on South island,channelnewsasia.com,http://www.channelnewsasia.com/stories/afp_asiapacific/view/1259371/1/.html
2013-03-12,05:24:04,1a3ssu,111,New polls in S. Korea show 70% support the country developing its own nuclear weapons.,usatoday.com,http://www.usatoday.com/story/news/world/2013/03/11/south-korea-thinks-nuclear/1979051/
