2013-07-13,23:37:02,1i7vsd,3284,UN human rights chief says whistleblowers need protection,rt.com,http://rt.com/news/un-chief-snowden-protection-048/
2013-07-13,01:48:10,1i5uym,3126,"One step forward, two steps backward: Egypt's new constitution declares Islam state religion, and Shariah as the basis for law.",english.ahram.org.eg,http://english.ahram.org.eg/NewsContent/1/64/76182/Egypt/Politics-/Egypts-Maspero-Youth-Union-says-constitutional-dec.aspx
2013-07-13,15:59:44,1i7h3x,2852,"A 20-year-old college student was gangraped and set on fire in India. Shockingly, the police not only refused to register the case but also blames victim of setting herself ablaze and lying",indiatoday.intoday.in,http://indiatoday.intoday.in/story/college-girl-gangraped-and-burnt-alive-etawah-ekdil-police-stationuttar-pradesh/1/291083.html
2013-07-13,04:58:01,1i6b49,2231,S. American states to withdraw ambassadors from Europe over Bolivian plane incident,rt.com,http://rt.com/news/mercosur-countries-ambassadors-europe-030/
2013-07-13,04:33:37,1i695l,1858,"Malala Yousafzai, teen shot by Taliban to U.N.: ""The extremists were afraid of education. That is why they're blasting schools every day. Because they're afraid of progress, afraid of change. Let us pick up our books and our pens. They are our most powerful weapons. Education is the only solution.""",latimes.com,"http://www.latimes.com/news/world/worldnow/la-fg-wn-pakistani-girl-malala-taliban-un-20130712,0,486044.story"
2013-07-13,02:47:45,1i605n,1817,"In her first speech since Taliban tried to kill her for advocating education for girls, Malala Yousafzai celebrated her 16th birthday at the UN, appealing for compulsory free schooling for all children. ""One child, one teacher, one pen and one book can change the world...""",aljazeera.com,http://www.aljazeera.com/video/asia/2013/07/20137126351897418.html
2013-07-13,10:51:23,1i70mn,1264,Container ship breaks in two in the Indian Ocean. 7000 containers lost.,gcaptain.com,http://gcaptain.com/mol-comfort-incident-photos
2013-07-13,00:27:04,1i5oiu,1045,"Amnesty International: Having seen the evidence, the US should immediately drop the ""Aiding the Enemy"" charge against WikiLeaks source Bradley Manning",amnesty.org,http://www.amnesty.org/en/news/bradley-manning-us-must-drop-aiding-enemy-charge-2013-07-12
2013-07-13,21:30:36,1i7qt4,972,Turkey redefines armed forces' duties - only to defend against external threats.,bigstory.ap.org,http://bigstory.ap.org/article/turkey-redefines-armed-forces-duties
2013-07-13,22:08:50,1i7s3c,697,Wikipedia Fears That Russian Anti-Piracy Law Could Shut Them Down -- The new legislation allows copyright holders to have websites blocked if they link to infringing material. Wikipedia has millions of hyperlinks to content that may or may not be authorized.,torrentfreak.com,http://torrentfreak.com/wikipedia-fears-that-russian-anti-piracy-law-could-shut-them-down-130710/
2013-07-13,22:52:50,1i7tsj,622,Snowden Affair Dampens US-Latin American Ties,nytimes.com,http://www.nytimes.com/aponline/2013/07/13/us/politics/ap-us-nsa-surveillance-latin-america.html?ref=aponline
2013-07-13,05:11:10,1i6c8y,588,Colombia demands answers on U.S. spying as Latin America seethes,reuters.com,http://www.reuters.com/article/2013/07/10/us-usa-security-snowden-latinamerica-idUSBRE9690TQ20130710
2013-07-13,01:13:36,1i5s5r,441,'Many hurt' in France train crash,bbc.co.uk,http://www.bbc.co.uk/news/world-europe-23294630
2013-07-13,23:00:01,1i7u4c,322,"Australian chief scientist: act now, or expect deadly 'post-antibiotics era'",wired.co.uk,http://www.wired.co.uk/news/archive/2013-07/12/antibiotics-crisis
2013-07-13,02:44:53,1i5zwp,301,"Egypt Punishes the Palestinians - Egypt is allowed to strangle the entire Gaza Strip and deny its people food and fuel, especially on the eve of the holy fasting month of Ramadan, but one hardly hears about these anti-Palestinian measures: they are being carried out by an Arab country, not by Israel",gatestoneinstitute.org,http://www.gatestoneinstitute.org/3847/egypt-punishes-palestinians
2013-07-13,04:22:10,1i687d,291,"Obama Administration Accuses Russia of Giving Snowden ""Propaganda Platform""",en.ria.ru,http://en.ria.ru/world/20130712/182210002/US-Accuses-Russia-of-Giving-Snowden-Propaganda-Platform.html
2013-07-13,15:36:35,1i7g61,246,Two Saudis sentenced to eight and nine years in prison for protesting monarchy,english.al-akhbar.com,http://english.al-akhbar.com/content/two-saudis-sentenced-prison-protesting-monarchy
2013-07-13,23:15:20,1i7utm,212,"80 Acres of Ancient Woodland in Kent to be Destroyed for Quarry Site - Hermitage quarry to extend into Oaken Wood, the subject of a fierce planning battle. ""With just 2% ancient woodland cover remaining, we can not afford to lose any more.""",guardian.co.uk,http://www.guardian.co.uk/environment/2013/jul/12/ancient-woodland-kent-quarry-site-hermitage
2013-07-13,22:12:38,1i7s85,182,"Rail boss scapegoats Lac-Mégantic, Quebec train driver. Chairman Ed Burkhardt was met by a public outraged by MMA’s negligence and its efforts to blame others for Canada’s worst railway disaster in more than a century.",wsws.org,https://www.wsws.org/en/articles/2013/07/13/queb-j13.html
2013-07-13,14:31:21,1i7d52,155,Mayor in Quebec admitted to killing kittens [translation in comments],quebec.huffingtonpost.ca,http://quebec.huffingtonpost.ca/2013/07/12/le-maire-gendron-admet-tuer-des-chats_n_3588376.html
2013-07-13,12:06:09,1i7550,148,"Obama speaks with Putin on Snowden, but no sign of movement",reuters.com,http://www.reuters.com/article/2013/07/13/us-usa-security-snowden-obama-idUSBRE96B0RE20130713
2013-07-13,14:38:40,1i7dif,145,75% of the World's Mining Companies Are Based in Canada,vice.com,http://www.vice.com/en_ca/read/75-of-the-worlds-mining-companies-are-based-in-canada
2013-07-13,23:28:14,1i7vfn,138,U.S. to buy Russian-made choppers for Afghanistan despite Assad ties,japantimes.co.jp,http://www.japantimes.co.jp/news/2013/07/13/world/u-s-to-buy-russian-made-choppers-for-afghanistan-despite-assad-ties/#.UeFj0m3AGCg
2013-07-13,18:42:02,1i7m2v,123,Malala's Forgotten Sisters; Girls as young as 5 are still being sold into marriage in Pakistan. And no one will stop it.,foreignpolicy.com,http://www.foreignpolicy.com/articles/2013/07/12/malalas_forgotten_sisters_girls_marriage_pakistan
2013-07-13,23:37:52,1i7vtc,109,Suicide bomber kills 33 as Iraqis play Ramadan game in Kirkuk cafe,edition.cnn.com,http://edition.cnn.com/2013/07/12/world/meast/iraq-suicide-bomber/index.html?hpt=hp_t3
2013-07-13,23:59:26,1i7wsc,90,"Can the ISI be tamed? - The bin Laden report has embarrassed Pakistan's all-powerful ISI. Is the time ripe for PM Sharif to tame the military's spy agency? In the past, efforts to put the ISI under civilian control were blocked by the generals.",dw.de,http://www.dw.de/can-the-isi-be-tamed/a-16947678
2013-07-13,16:29:08,1i7i85,68,Arrest of 5-year-old Palestinian child causes outrage around globe,presstv.ir,http://www.presstv.ir/detail/2013/07/13/313551/arrest-of-5yearold-palestinian-child-causes-outrage-around-globe/
2013-07-13,21:48:33,1i7rex,61,"Hundreds of thousands join Islamist rallies to protest military coup in Egypt. On Friday, the army maintained a large and highly visible presence, fearing the potential for a violent clash between pro- and anti-Muslim Brotherhood demonstrators and the outbreak of civil war.",wsws.org,https://www.wsws.org/en/articles/2013/07/13/egyp-j13.html
2013-07-13,13:17:27,1i7987,60,Luxembourg Government Forced To Resign Over GLADIO False Flag Attack Linked Scandal,wideshut.co.uk,http://wideshut.co.uk/luxembourg-government-forced-to-resign-over-gladio-false-flag-attack-linked-scandal/
2013-07-13,08:31:46,1i6rrk,52,S. Korea court orders US firms to pay up over Agent Orange,breitbart.com,http://www.breitbart.com/system/wire/CNG---62e4537b94ee793d11f8fad9fe27d82b---691
