2013-06-02,22:59:02,1fiogq,3194,"Based on requests, the pictures of the protests going on in Turkey. You will see how big the protest is. It is believed it has reached 1 million people througout Turkey. You will also see how brutally violent the police is.",imgur.com,http://imgur.com/a/wOrZR#0
2013-06-02,02:11:20,1fgzcj,3152,"Turkey Prime Minister, Erdogan says protestors should go home, ""If you bring 100,000, I'll bring out a million.""",npr.org,http://www.npr.org/blogs/thetwo-way/2013/06/01/187792103/on-second-day-anti-government-protests-swell-in-turkey
2013-06-02,10:29:00,1fhuqw,2684,"Youth unemployment in Greece and Spain above 50 percent, could hit 70 percent in early 2014",russellbulletin.com,http://russellbulletin.com/2013/06/01/youth-unemployment-greece-spain/
2013-06-02,18:13:58,1fifz0,2572,Egypt's top court rules that Islamist-dominated Senate and the panel that drafted constitution are illegal,aljazeera.com,http://www.aljazeera.com/news/middleeast/2013/06/20136285723520621.html
2013-06-02,23:32:11,1fiq04,2371,13yrold student reprimanded for stopping a knife-weilding bully at school.,news.nationalpost.com,http://news.nationalpost.com/2013/05/31/briar-maclean-reprimanded-for-stopping-a-knife-wielding-bully-at-school/
2013-06-02,13:48:43,1fi687,2122,"Say what you will about Greenpeace, their office is in the middle of the chaos in Turkey. They're treating the injured -- this is their update.",greenpeace.org,http://www.greenpeace.org/international/en/high/news/Blogs/makingwaves/the-last-tree-or-the-final-straw/blog/45380/
2013-06-02,23:06:11,1fiota,1773,Monsanto shares fall as South Korea joins pause in wheat imports from the US,washingtonpost.com,http://www.washingtonpost.com/business/economy/monsanto-shares-fall-as-south-korea-joins-pause-in-wheat-imports/2013/05/31/5df79a3a-ca2c-11e2-8da7-d274bc611a47_story.html
2013-06-02,01:20:49,1fgwd2,1546,An Oxford University researcher and author specializing in neuroscience has suggested that one day religious fundamentalism may be treated as a curable mental illness,huffingtonpost.com,http://www.huffingtonpost.com/2013/05/31/kathleen-taylor-religious-fundamentalism-mental-illness_n_3365896.html
2013-06-02,03:51:03,1fh5oz,1094,Canadian relief for Oklahoma tornado victims denied at border,cbc.ca,http://www.cbc.ca/news/world/story/2013/05/31/wdr-moore-tornado-relief-us-border.html
2013-06-02,01:47:38,1fgxvq,912,The new suffragettes: The Kurdish woman fighting against female genital mutilation,independent.co.uk,http://www.independent.co.uk/news/people/profiles/the-new-suffragettes-the-kurdish-woman-fighting-against-female-genital-mutilation-8640310.html
2013-06-02,20:52:08,1fik0z,869,A stunning 90-sec video of Turkey’s protests: It started over the govt’s plan to turn a park into a mall but have since “become a broad rebuke to the 10-year leadership of Mr. Erdogan and his Islamist-rooted Justice and Development Party...which has adopted authoritarian tactics.”,washingtonpost.com,http://www.washingtonpost.com/blogs/worldviews/wp/2013/06/01/a-stunning-90-second-video-of-turkeys-protests/
2013-06-02,10:00:31,1fht5i,733,Russia Is Upping The Ante By Sending Its Only Aircraft Carrier To The Mediterranean,businessinsider.com,http://www.businessinsider.com/russia-deploys-admiral-kuznetsov-carrier-2013-6
2013-06-02,07:50:10,1fhl6q,555,US call for full Tiananmen massacre disclosure angers China,bbc.co.uk,http://www.bbc.co.uk/news/world-asia-china-22744242
2013-06-02,11:54:51,1fhzqs,523,Update on the Turkey situation from Al Jazeera. Interesting read.,aljazeera.com,http://www.aljazeera.com/news/europe/2013/06/20136205646707974.html
2013-06-02,05:46:46,1fhd1b,416,"'Begging Mafia' in Pakistan is kidnapping children, inflicting them with disabilities, and then forcing them to beg for money, already thousands of children are kidnapped every year",bbc.co.uk,http://www.bbc.co.uk/news/magazine-22729351
2013-06-02,01:49:24,1fgxzf,338,Syria Rebukes Erdogan Over Turkish Protest Violence,nytimes.com,http://www.nytimes.com/reuters/2013/06/01/world/middleeast/01reuters-turkey-protests-syria.html
2013-06-02,02:32:21,1fh0oj,257,Al-Qaeda poison gas cell busted in Baghdad: Iraq’s defense ministry,english.alarabiya.net,http://english.alarabiya.net/en/News/middle-east/2013/06/01/Iraq-says-Qaeda-poison-gas-cell-busted-in-Baghdad-.html
2013-06-02,19:03:22,1fih8d,198,Iraq captures suspected Al Qaeda cell that planned to make chemical weapons,abc.net.au,http://www.abc.net.au/news/2013-06-02/iraq-captures-suspected-chemical-weapons-team/4727750
2013-06-02,03:32:37,1fh4jg,189,U.S. company allegedly caught aiding Syria and Iran in censorship efforts,dailydot.com,http://www.dailydot.com/news/blue-coat-syria-iran-spying-software/
2013-06-02,07:02:15,1fhi0j,171,"""The American embassy in Cairo has bad news for anyone traveling to Egypt: For now, the pyramids in Giza should be considered off limits -- at least if you're visiting without a trusted guide.""",blog.foreignpolicy.com,http://blog.foreignpolicy.com/posts/2013/05/30/us_embassy_to_americans_stay_away_from_the_pyramids_at_giza
2013-06-02,22:41:26,1finr4,135,Mentally-ill patients were 'Tasered' more than 50 times in three years: Freedom of Information request reveals extent of stun-gun use by UK police in psychiatric ward,independent.co.uk,http://www.independent.co.uk/life-style/health-and-families/health-news/mentallyill-patients-were-tasered-more-than-50-times-in-three-years-8606726.html
2013-06-02,15:46:12,1fibg9,127,New web censorship rule bans gay content in Singapore,gaystarnews.com,http://www.gaystarnews.com/article/new-web-censorship-rule-bans-gay-content-singapore300513
2013-06-02,04:06:32,1fh6ot,122,"In Somalia, polio vaccines rejected over rumours spread by Islamic extremists | CTV News",ctvnews.ca,http://www.ctvnews.ca/health/in-somalia-polio-vaccines-rejected-over-rumours-spread-by-islamic-extremists-1.1306774#.UapGKHGNSl0.reddit
2013-06-02,11:52:31,1fhzme,115,China accuses US of prejudice after it calls for a full account of 1989 Tiananmen crackdown,washingtonpost.com,http://www.washingtonpost.com/world/asia_pacific/china-accuses-us-of-prejudice-after-it-calls-for-full-account-of-1989-tiananmen-crackdown/2013/06/01/51c749a8-cb27-11e2-9cd9-3b9a22a4000a_story.html?
2013-06-02,22:16:13,1fimrf,88,"Extensive rains have caused massive floods over the weekend in parts of central and western Europe, causing death and damage",novinite.com,http://www.novinite.com/view_news.php?id=150896
2013-06-02,10:38:32,1fhvaz,85,China Will Soon Be Drilling A Third Of Iraq's Oil,businessinsider.com,http://www.businessinsider.com/chinese-iraq-oil-production-2013-3
2013-06-02,14:20:39,1fi7ti,85,BBC News - Turkey assesses damage done by protests,bbc.co.uk,http://www.bbc.co.uk/news/world-europe-22744728
2013-06-02,18:18:21,1fig39,75,BBC News - Egypt court rules Senate and constitution invalid.,bbc.co.uk,http://www.bbc.co.uk/news/world-middle-east-22745568
2013-06-02,00:11:01,1fgse8,68,Russia to send nuclear submarines to southern seas,reuters.com,http://www.reuters.com/article/2013/06/01/us-russia-submarines-patrol-idUSBRE95007V20130601
2013-06-02,01:46:10,1fgxt7,60,"Germany has 1,5 million fewer inhabitants than previously assumed",nytimes.com,http://www.nytimes.com/2013/06/01/world/europe/census-shows-new-drop-in-germanys-population.html?_r=0
