2013-06-09,00:17:14,1fxg0d,3563,NSA Prism: Why I'm boycotting US cloud tech - and you should too. 'Not subject to American law' - the next desirable IT feature,theregister.co.uk,http://www.theregister.co.uk/2013/06/08/what_about_a_us_tech_boycott/
2013-06-09,18:45:19,1fz43f,3257,Turkish game show host breaks self-censorship by making answers about ongoing unrest: 70 times.,thelede.blogs.nytimes.com,http://thelede.blogs.nytimes.com/2013/06/05/civil-disobedience-on-a-turkish-game-show/?ref=world
2013-06-09,03:30:33,1fxrox,2211,The real story in the NSA scandal is the collapse of journalism,zdnet.com,http://www.zdnet.com/the-real-story-in-the-nsa-scandal-is-the-collapse-of-journalism-7000016570/
2013-06-09,17:01:07,1fz1a2,1526,"Bradley Manning Nobel Peace Prize Petition Gains 65,000 Signatures (VIDEO)",huffingtonpost.com,http://www.huffingtonpost.com/2013/06/08/bradley-manning-nobel-peace-prize-petition_n_3404852.html
2013-06-09,02:44:09,1fxoqu,1005,"New NSA slide released by Guardian: Prism takes data ""directly"" from servers, 4 other programs take data from cables",guardian.co.uk,http://www.guardian.co.uk/world/2013/jun/08/nsa-surveillance-prism-obama-live?guni=Network%20front:network-front%20full-width-1%20bento-box:Bento%20box:Position2#block-51b36893e4b0cc6424372292
2013-06-09,21:50:11,1fz932,633,"Egyptian government holds secret meeting on preventing/destroying Ethiopian dam. Unbeknownst to them, the ""secret"" meeting was being broadcast on live television.",thelede.blogs.nytimes.com,http://thelede.blogs.nytimes.com/2013/06/06/with-cameras-rolling-egyptian-politicians-threaten-ethiopia-over-dam/
2013-06-09,10:34:19,1fyi0o,485,"A man in an Afghan uniform turned his weapon on American trainers working with him in the eastern province of Paktika, killing three of them, while an attacker with a grenade killed an Italian soldier in the west, officials have said.",aljazeera.com,http://www.aljazeera.com/news/asia/2013/06/201368123315741177.html?utm_source=feedly
2013-06-09,05:53:47,1fy10c,426,Ankara police disperse protesters with tear gas as Turkish officials say 'process is under control',rt.com,http://rt.com/news/ankara-police-tear-cannon-421/
2013-06-09,21:10:43,1fz7u1,404,Turks tango in their gas masks as they defy orders of Prime Minister and carry on with protests,dailymail.co.uk,http://www.dailymail.co.uk/news/article-2337922/Turkey-protests-Anti-government-demonstrations-continue-despite-Recep-Tayyip-Erdogans-orders.html
2013-06-09,20:44:40,1fz741,374,UK Police visit piratebay proxy PirateSniper's owner’s home demanding a shutdown - was reportedly handed a letter and ordered to shutter the site or face criminal action.,torrentfreak.com,http://torrentfreak.com/police-visit-pirate-bay-proxy-owners-home-demanding-a-shutdown-130609/
2013-06-09,20:57:32,1fz7fp,342,Russian TV show taken off air over joke on Putin divorce,timesofindia.indiatimes.com,http://timesofindia.indiatimes.com/world/rest-of-world/Russian-TV-show-taken-off-air-over-joke-on-Putin-divorce/articleshow/20500493.cms
2013-06-09,01:21:27,1fxjn3,339,"NASA's Mars rover Opportunity has made perhaps the biggest discovery of its nearly 10-year career, finding evidence that life may have been able to get a foothold on the Red Planet long ago",huffingtonpost.com,http://www.huffingtonpost.com/2013/06/08/water-on-mars-nasa-opportunity-rover-life_n_3404901.html
2013-06-09,06:43:50,1fy463,256,Angry Pakistan summons envoy after U.S. drone strike kills nine,reuters.com,http://reuters.com/article/2013/06/08/us-pakistan-drone-idUSBRE95707520130608
2013-06-09,21:18:14,1fz836,189,Gardeners To Be Deprived Of Heirloom Seeds Under E.U. New Directive,news.sciencemag.org,http://news.sciencemag.org/scienceinsider/2013/05/overhaul-of-eu-seed-regulations-.html
2013-06-09,01:31:55,1fxk9b,178,"Truck carrying fireworks hits moose, shuts down Trans-Canada Highway for five hours and lights up the sky",news.nationalpost.com,http://news.nationalpost.com/2013/06/07/truck-carrying-fireworks-hits-moose-on-trans-canada-highway-shuts-down-road-for-5-5-hours-and-lights-up-the-sky/
2013-06-09,14:24:35,1fyvbu,167,Many dead as asylum boat sinks off Australia,aljazeera.com,http://www.aljazeera.com/news/asia-pacific/2013/06/20136943813401306.html?utm_content=automate&utm_campaign=Trial6&utm_source=NewSocialFlow&utm_term=plustweets&utm_medium=MasterAccount
2013-06-09,10:32:57,1fyhxe,165,"Recep Tayyip Erdogan, on Friday abandoned his plan to build a new shopping mall on one of the few green patches in central Istanbul, but he insisted on razing the park nevertheless, a mixed signal that could prolong weeklong protests here and in other cities.",omantribune.com,http://www.omantribune.com/index.php?page=news&id=145909&heading=Europe
2013-06-09,08:11:23,1fy9oy,150,Afghanistan: Women in parliament receive threats - from fellow lawmakers,csmonitor.com,http://www.csmonitor.com/World/Asia-South-Central/2013/0608/Afghanistan-Women-in-parliament-receive-threats-from-fellow-lawmakers?nav=87-frontpage-entryNineItem
2013-06-09,21:19:18,1fz842,144,"The Singapore way of censorship: blogs must be licensed, license costs $39500",rt.com,http://rt.com/news/singapore-website-protest-bloggers-419/
2013-06-09,07:28:17,1fy728,141,Widespread dumping of asbestos in Australia: Experts are warning that there is widespread illegal dumping of asbestos waste around the country and it's costing tens of millions of dollars each year and exposing thousands of Australians to deadly health risks.,abc.net.au,http://www.abc.net.au/lateline/content/2013/s3776613.htm
2013-06-09,00:37:36,1fxh2p,145,"The last rebel stronghold near the strategic town of Qusair, western Syria, has fallen to government forces, Syrian state TV says.",bbc.co.uk,http://www.bbc.co.uk/news/world-middle-east-22828142
2013-06-09,06:53:50,1fy4tq,117,Islamic Extremists Kill 13 in Northeast Nigeria,abcnews.go.com,http://abcnews.go.com/International/wireStory/islamic-extremists-kill-13-northeast-nigeria-19355803#.UbOnzvHzsUR
2013-06-09,07:51:28,1fy8h1,107,US waives human rights condition on $1.3B in aid to Egypt,hosted.ap.org,http://hosted.ap.org/dynamic/stories/U/US_US_EGYPT?SITE=AP&SECTION=HOME&TEMPLATE=DEFAULT&CTIME=2013-06-07-11-45-11
2013-06-09,12:04:46,1fynjz,101,North and South Korea hold official talks on restoring commercial cooperation,aljazeera.com,http://www.aljazeera.com/news/asia-pacific/2013/06/20136914653947578.html?utm_content=automate&utm_campaign=Trial6&utm_source=NewSocialFlow&utm_term=plustweets&utm_medium=MasterAccount
2013-06-09,23:35:02,1fzd89,98,"German report: Berlin a hub of Hezbollah activity; 950 members in Germany, 250 in Berlin; Hezbollah-run orphanage used to fund-raise for suicide bombers targeting Israelis.",jpost.com,http://www.jpost.com/LandedPages/PrintArticle.aspx?id=315885
2013-06-09,03:40:40,1fxscn,69,British police arrest 21-year-old undergraduate student for 'extremist' tweet,guardian.co.uk,http://www.guardian.co.uk/uk/2013/jun/07/student-tweet-lee-rigby
2013-06-09,17:38:00,1fz2d9,54,Bigots' Island becomes gay rights central: Tasmania is undergoing a remarkable cultural conversion,independent.co.uk,http://www.independent.co.uk/news/world/australasia/bigots-island-becomes-gay-rights-central-tasmania-is-undergoing-a-remarkable-cultural-conversion-8650749.html
2013-06-09,00:38:00,1fxh3g,49,"A suicidal man started a fire on a packed commuter bus in south-eastern China that killed 47 people, state media report.",bbc.co.uk,http://www.bbc.co.uk/news/world-asia-china-22827043
2013-06-09,17:39:46,1fz2eh,38,"Thousands have rallied in Dublin against the Irish Government’s proposed legislation on abortion. Organised by the Pro Life Campaign, the large and colourful demonstration called on the Coalition to “scrap the bill”.",irishtimes.com,http://www.irishtimes.com/news/politics/thousands-attend-dublin-abortion-rally-1.1422065
2013-06-09,21:23:23,1fz88j,36,"Rein in the terror drones, Pakistani PM tells US",presstv.ir,http://www.presstv.ir/detail/2013/06/09/307906/rein-in-terror-drones-pakistan-tells-us/
