2014-03-04,08:17:22,1zhd6i,4772,David Cameron's aide on child internet policy has been arrested for child pornography,dailymail.co.uk,http://www.dailymail.co.uk/news/article-2572495/No-10-aide-arrested-child-porn-Police-quiz-man-advised-Cameron-web-filters.html
2014-03-04,21:50:30,1zj0qg,2427,"""A Kremlin aide was quoted on Tuesday [4 March 2014] as saying that if the United States were to impose sanctions on Russia over Ukraine, Moscow might be forced to drop the dollar as a reserve currency and refuse to pay off any loans to U.S. banks.""",reuters.com,http://www.reuters.com/article/2014/03/04/us-ukraine-crisis-glazyev-idUSBREA230DS20140304
2014-03-04,03:16:46,1zgg7m,2288,Obama promises to protect Poland against Russian invasion,dr.dk,http://www.dr.dk/Nyheder/Udland/2014/03/03/03152357.htm
2014-03-04,07:35:28,1zh8tz,2098,"US Anti-gay evangelist Scott Lively to stand trial for 'crimes against humanity', is being sued by the organization Sexual Minorities Uganda, which alleges that his actions in Uganda over the past ten years led to the persecution, torture, arrest and murder of gay people in the country.",pinknews.co.uk,http://www.pinknews.co.uk/2013/01/04/us-anti-gay-evangelist-to-stand-trial-for-crimes-against-humanity/?fb_action_ids=10152260837924400&fb_action_types=og.recommends&fb_source=other_multiline&action_object_map=%5B542730855744634%5D&action_type_map=%5B%22og.recommends%22%5D&action_ref_map=%5B%5D
2014-03-04,22:21:17,1zj34q,1509,Turkey scrambles jets after Russian plane flies near its Black Sea coast,reuters.com,http://www.reuters.com/article/2014/03/04/us-turkey-russia-idUSBREA2314I20140304
2014-03-04,03:46:31,1zgjg8,537,Poland requests NATO consultations under Article 4,news.yahoo.com,http://news.yahoo.com/poland-requests-nato-consultations-under-article-4-192129502.html
2014-03-04,01:32:17,1zg4u6,514,"""Chancellor Angela Merkel of Germany told Mr. Obama by telephone on Sunday that after speaking with Mr. Putin she was not sure he was in touch with reality, people briefed on the call said. “In another world,” she said.""",nytimes.com,http://www.nytimes.com/2014/03/03/world/europe/pressure-rising-as-obama-works-to-rein-in-russia.html?hp
2014-03-04,21:32:14,1zizhl,437,"A far-right candidate for Paris elections says France's Roma population should be ""concentrated"" in ""camps""",thelocal.fr,http://www.thelocal.fr/20140304/far-right-candidates-proposes-con
2014-03-04,04:05:49,1zglhx,409,"President Barack Obama has said that Russia is ""on the wrong side of history"" and in violation of international law for sending troops into the Ukranian region of Crimea. He also promised America will make Russia face consequences for its actions.",businessinsider.com,http://www.businessinsider.com/obama-a-costly-proposition-for-russia-2014-3
2014-03-04,13:46:30,1zi90z,350,"Chinese baby-trafficking ring busted wide open, leads to rescue of 382 babies and arrest of over 1,000",usnews.com,http://www.usnews.com/news/newsgram/articles/2014/02/28/chinese-babies-saved-from-human-trafficking-ring
2014-03-04,06:29:03,1zh1ow,253,"Ukraine tells UN Russia has 16,000 troops in Crimea; Russia says Yanukovych requested them (3/3/14 5:22 pm)",therepublic.com,http://www.therepublic.com/view/story/2808cff84f9641b58f582180aa74b666/UN-UN-Ukraine
2014-03-04,05:11:47,1zgswr,228,"‘Russia is Looking for a Hot War,’ Says Georgia’s Former President",thedailybeast.com,http://www.thedailybeast.com/articles/2014/03/03/russia-is-looking-for-a-hot-war-says-georgia-s-former-president.html
2014-03-04,14:46:30,1zidez,229,Ukraine and Russia: the military imbalance [infographic],abc.net.au,http://www.abc.net.au/news/2014-03-04/ukraine-and-russia-the-military-imbalance/5298234
2014-03-04,05:37:25,1zgvw8,225,"Russia use the same group of ""protesters"" in different regions of Ukraine",translate.google.com,http://translate.google.com/translate?hl=ru&sl=uk&tl=en&u=http%3A%2F%2Fespreso.tv%2Fnew%2F2014%2F03%2F03%2Fukrayinoyu_hastrolyuye_odna_y_ta_sama_trupa_rosiyskykh_patriotiv
2014-03-04,08:26:34,1zhe2s,153,Ukraine loses it's 204th Tactical Aviation Brigade To The Autonomous Republic of Crimea,rbth.co.uk,http://rbth.co.uk/news/2014/03/03/crimean_army_gets_49_fighter_jets_from_ukrainian_air_bases_-_official_34740.html
2014-03-04,05:58:29,1zgy9h,148,Secret document suggests UK will not support trade sanctions against Russia,buzzfeed.com,http://www.buzzfeed.com/jimwaterson/secret-document-suggests-uk-government-will-not-support-trad
2014-03-04,20:31:11,1zivrv,124,"French scientists revive 30,000-year-old virus, say it ""serves as a warning that unknown pathogens entombed in frozen soil may be roused by global warming""",news24.com,http://www.news24.com/Green/News/30-000-year-old-virus-reborn-20140303
2014-03-04,10:58:59,1zhtlx,124,"Moscow intends to discuss the Ukraine crisis with the West on two key conditions. The source says the 21 February agreement - signed by ousted President Yanukovych and the Ukrainian opposition - must be implemented, and that all Ukrainian political forces must take part in negotiations.",bbc.co.uk,http://www.bbc.co.uk/news/world-europe-26428296
2014-03-04,05:41:47,1zgwd5,110,US urges N Korea restraint after two more test missiles,bbc.com,http://www.bbc.com/news/world-us-canada-26427245
2014-03-04,06:09:58,1zgzkr,103,Former Ukraine PM Yulia Tymoshenko urges superpowers to use force against Russia,nzherald.co.nz,http://www.nzherald.co.nz/world/news/article.cfm?c_id=2&objectid=11213619
2014-03-04,13:06:15,1zi5pz,92,"Ukraine crisis: Russia stands firm despite rebukes, sanctions threats",cnn.com,http://www.cnn.com/2014/03/03/world/europe/ukraine-tensions/index.html?sr=fb030314ukraine4p
2014-03-04,04:53:02,1zgquj,92,Two women who represented 'opressed citizens of Odessa' in Sevastopol were previously seen during the storm of Kharkiv Regional Government,translate.google.com,http://translate.google.com/translate?sl=uk&tl=en&js=n&prev=_t&hl=ru&ie=UTF-8&u=http%3A%2F%2Fwww.pravda.com.ua%2Fnews%2F2014%2F03%2F3%2F7017384%2F%3Fattempt%3D1&act=url
2014-03-04,20:40:54,1ziwb2,87,Putin: Russia has no plans to annex Ukraine's Crimea region,cnn.com,http://www.cnn.com/2014/03/04/world/europe/ukraine-russia-tensions/
2014-03-04,03:58:14,1zgknq,86,Keystone pipeline protests get silenced,cbc.ca,http://www.cbc.ca/news/world/keystone-xl-pipeline-protesters-arrested-at-white-house-1.2557124
2014-03-04,00:02:18,1zfw08,83,Ukraine financial fall-out exposes Russia's economic weakness,reuters.com,http://www.reuters.com/article/2014/03/03/us-urkaine-crisis-russia-economy-analysi-idUSBREA221D020140303
2014-03-04,03:34:35,1zgi4u,75,Dozens Arrested At Moscow Antiwar Protest,rferl.org,http://www.rferl.org/content/dozens-arrested-at-moscow-antiwar-protest/25282578.html
2014-03-04,10:29:27,1zhqja,75,"BBC News - 30,000-year-old virus 'comes back to life'",bbc.com,http://www.bbc.com/news/science-environment-26387276
2014-03-04,05:19:26,1zgtum,75,Russian envoy to UN claims Yanukovych has asked Putin for troops to restore lawfulness in Ukraine. (Ukrainian),pravda.com.ua,http://www.pravda.com.ua/news/2014/03/3/7017396/
2014-03-04,17:12:10,1zilgj,70,Russia warns of economic retaliation if sanctions are placed on the country,in.reuters.com,http://in.reuters.com/article/2014/03/04/ukraine-crisis-russia-us-idINDEEA2305J20140304
2014-03-04,09:47:51,1zhmbf,72,EU not seen matching U.S. threat of sanctions against Russia,news.yahoo.com,http://news.yahoo.com/eu-not-seen-matching-u-threat-sanctions-against-233915027.html
