2014-03-31,18:48:14,21tf9m,3734,The UN's International Court of Justice has ruled that Japan's Antarctic whaling programme is not for scientific purposes,bbc.com,http://www.bbc.com/news/world-asia-26818863
2014-03-31,13:22:55,21sxxe,3273,BBC News - North and South Korea exchange fire across western sea border,bbc.co.uk,http://www.bbc.co.uk/news/world-asia-26815041#TWEET1086222
2014-03-31,10:14:33,21si0n,2659,"10,000-year-old settlement found in Cork",irishcentral.com,http://www.irishcentral.com/news/10000-year-old-settlement-found-in-cork-234224381-237790471.html
2014-03-31,22:25:54,21tqoj,2483,NSA Infiltrated RSA Security More Deeply Than Thought,reuters.com,http://www.reuters.com/article/2014/03/31/us-usa-security-nsa-rsa-idUSBREA2U0TY20140331
2014-03-31,23:02:28,21tti1,2305,Germany ready to reinforce Nato-Russia borders,euobserver.com,http://euobserver.com/foreign/123685
2014-03-31,18:48:43,21tfac,1465,World court says Japan's Antarctic whaling program is not for scientific purposes,utsandiego.com,http://www.utsandiego.com/news/2014/mar/30/un-court-to-rule-on-japanese-whaling/
2014-03-31,23:53:05,21txwf,1309,"No proof torture helped US find Osama bin Laden, Senate report concludes",theguardian.com,http://www.theguardian.com/world/2014/mar/31/senate-report-osama-bin-laden-torture
2014-03-31,02:13:58,21ra5u,1215,"Israel bulldozes Palestinian homes, mosque",english.al-akhbar.com,http://english.al-akhbar.com/node/19158
2014-03-31,05:33:45,21rsla,1080,"Silk Road closure fails to dampen illegal drug sales online, experts say",abc.net.au,http://www.abc.net.au/news/2014-03-31/online-drug-trade-soaring-experts-say/5354930
2014-03-31,09:22:14,21sden,874,Members of the UN's climate panel say that their report provides overwhelming evidence of the scale of global warming,bbc.com,http://www.bbc.com/news/science-environment-26810559
2014-03-31,18:47:17,21tf8c,779,UN court rules against Japan whaling,bbc.co.uk,http://www.bbc.co.uk/news/world-asia-26818863
2014-03-31,05:33:43,21rsl6,721,Obama weighs sending shoulder-fired missiles to Syrian rebels,latimes.com,"http://www.latimes.com/world/worldnow/la-fg-wn-obama-saudi-arabia-syria-manpads-20140328,0,3143330.story#axzz2xTpwsbfS"
2014-03-31,20:13:22,21tiz3,543,South African President Jacob Zuma refuses to pay back hundreds of millions on upgraded personal residence,news24.com,http://www.news24.com/SouthAfrica/Politics/Zumas-Nkandla-comments-an-insult-20140331-2
2014-03-31,22:05:35,21tpbe,480,Poland seeks to avoid Russian 'gas blackmail',thenews.pl,"http://www.thenews.pl/1/12/Artykul/166897,Poland-seeks-to-avoid-Russian-gas-blackmail"
2014-03-31,08:51:14,21sao0,423,"Russia returns captured submarine to Ukraine, says that sub stopped being relevant on the battlefield since the 80-s. Sub will have to be towed to Ukraninan side by tugboat.",gazeta.ru,http://www.gazeta.ru/politics/news/2014/03/30/n_6048373.shtml
2014-03-31,20:21:50,21tjdi,419,"Russian Deputy Prime Minister tweets photo in Crimea saying, ""Crimea is ours, and thats that.""",bigstory.ap.org,http://bigstory.ap.org/article/russian-premier-crimea-offer-federal-aid
2014-03-31,01:06:04,21r48y,412,2 Morsi supporters sentenced to death. They are accused of throwing a kid and a young man off a building in Alexandria.,huffingtonpost.com,http://www.huffingtonpost.com/2014/03/29/egypt-court-sentences_n_5055946.html
2014-03-31,19:32:59,21th6d,275,Pilot’s daughter says UK tabloid ‘made up’ MH370 report,themalaymailonline.com,http://www.themalaymailonline.com/malaysia/article/pilots-daughter-says-uk-tabloid-made-up-mh370-report
2014-03-31,23:03:46,21ttlt,261,"India, Russia sign Rs 2,600 crore (USD 430 million) deal for anti-tank ammunition",dnaindia.com,http://www.dnaindia.com/india/report-india-russia-sign-rs-2600-crore-deal-for-anti-tank-ammunition-1973934
2014-03-31,14:15:33,21t1pc,253,Ebola outbreak spreads to Liberia after killing 70 in Guinea,theverge.com,http://www.theverge.com/us-world/2014/3/31/5565482/ebola-kills-70-in-guinea-spreads-to-liberia-west-africa?utm_medium=referral&utm_source=pulsenews
2014-03-31,01:15:47,21r517,227,Germany Mulls Military Support for NATO's Eastern European States,nytimes.com,http://www.nytimes.com/reuters/2014/03/30/world/europe/30reuters-ukraine-crisis-germany-nato.html
2014-03-31,18:04:38,21tdfu,202,MH370: Hopes dashed as orange objects turn out to be fishing equipment,cnn.com,http://www.cnn.com/2014/03/31/world/asia/malaysia-airlines-plane/index.html?hpt=hp_t1
2014-03-31,10:19:18,21sifb,182,"Former Cisco Execs Allege Vast Kickback Scheme In Russia -- As the United States confronts Putin over Crimea, federal investigators probe whether an American company enriched Russian officials.",buzzfeed.com,http://www.buzzfeed.com/aramroston/cisco-kickbacks-russia
2014-03-31,20:18:11,21tj7f,166,"New Silk Route railway line links China, Europe",deccanchronicle.com,http://www.deccanchronicle.com/140330/world-asia/article/new-silk-route-links-china-europe
2014-03-31,22:28:13,21tqv8,120,Turkey accused of sending fighters to Syria,aljazeera.com,http://www.aljazeera.com/news/middleeast/2014/03/turkey-accused-sending-fighters-syria-201433110314185295.html
2014-03-31,04:23:10,21rlzw,101,HK's anti-corruption body raids JPMorgan CEO's office,business-standard.com,http://www.business-standard.com/article/international/hk-s-anti-corruption-body-raids-jpmorgan-ceo-s-office-114033100012_1.html
2014-03-31,06:29:01,21rxul,100,Russia and US end Ukraine talks with no sign of whether progress has been made,bbc.co.uk,http://www.bbc.co.uk/news/world-europe-26809625
2014-03-31,23:27:07,21tvlo,87,"North Korea denounces UN, US for denouncing North Korea; says that denouncing was ""an illegal provocative act"" that is ""intolerable"". North Korea also said that its actions are ""sincere efforts to prevent a new war and ensure peace and security"" and claimed that the US wants to ""occupy Pyongyang"".",kcna.co.jp,http://www.kcna.co.jp/item/2014/201403/news30/20140330-15ee.html
2014-03-31,07:15:36,21s28d,82,"John Kerry announces no new deal on Ukraine, following four hours of ""frank"" talks with Sergei Lavrov",bbc.com,http://www.bbc.com/news/world-europe-26814651#TWEET1085961
2014-03-31,09:07:24,21sc2z,77,"Syria: Christian town attacked by Islamists, 80 dead, thousands displaced",barnabasfund.org,http://barnabasfund.org/UK/News/News-analysis/Christian-town-in-Syria-attacked-by-Islamists-80-dead-thousands-displaced.html
