2014-08-14,03:46:21,2dgnbz,13920,A group of North Korean defectors held by China on the Laos border is released to South Korea rather than repatriated in sign of a Chinese policy change,news.sky.com,http://news.sky.com/story/1317909/detainee-release-marks-china-policy-shift
2014-08-14,17:17:19,2dirwd,9684,"A Russian convoy carrying ""humanitarian aid"" has turned away from its route towards a confrontation with government officials at the Ukrainian border - and is now heading straight for rebel-held areas.",independent.co.uk,http://www.independent.co.uk/news/world/europe/ukraine-crisis-russian-aid-convoy-heads-straight-for-rebels-in-luhansk-as-fears-intensify-of-direct-invasion-9667836.html
2014-08-14,21:14:16,2dj5nc,7467,"Malaysia Airlines Flight MH370: Passengers’ Bank Accounts Being Accessed Unknowingly, Money Goes Missing- Report",au.ibtimes.com,http://au.ibtimes.com/articles/562648/20140814/malaysia-airlines-flight-mh-370-missing-search.htm#.U-ynf8nD_qA
2014-08-14,17:56:45,2diu07,5466,4 Billion Gallons of Mining Waste Pour Into Pristine B.C. Waterways,indiancountrytodaymedianetwork.com,http://indiancountrytodaymedianetwork.com/2014/08/07/video-watch-4-billion-gallons-mining-waste-pour-pristine-bc-waterways-156295
2014-08-14,22:21:26,2djaz8,4151,Coal generation down as Germany breaks yet another renewables record. Green electricity meets 28 per cent of demand in first half of 2014,businessgreen.com,http://www.businessgreen.com/bg/news/2360089/coal-generation-down-as-germany-breaks-yet-another-renewables-record
2014-08-14,00:39:48,2dg1jl,2110,Brazil presidential candidate Campos in plane crash: source,reuters.com,http://www.reuters.com/article/2014/08/13/us-brazil-crash-idUSKBN0GD1GY20140813
2014-08-14,04:15:41,2dgqrt,1994,"Two hours before ceasefire set to end, and with parties still working in Cairo to extend lull, Gaza militants break truce, fire rockets at Israel.",ynetnews.com,"http://www.ynetnews.com/articles/0,7340,L-4558497,00.html"
2014-08-14,18:43:09,2diwjj,1847,"Pesticide Ban Call to Save Bees - 'Scottish Wildlife Trust' reports 60% decline in bumblebees. Hoverflies & butterflies also at threat. Govt says it's ""committed to taking a precautionary approach on the use of neonicotinoids"".",bbc.com,http://www.bbc.com/news/uk-scotland-scotland-politics-28781983
2014-08-14,03:59:54,2dgow5,1379,US ground troops land on Iraq's Mt Sinjar to evacuate trapped Yazidis,theguardian.com,http://www.theguardian.com/world/2014/aug/13/us-ground-troops-direct-role-evacuate-yazidis-iraq
2014-08-14,12:13:01,2di52f,1067,"The Australian government's chief business adviser says too much time has been spent focusing on global warming and as a result Australians are ""ill prepared"" to deal with the prospect of global cooling. He also states that global warming only persists because science has been made a religion.",smh.com.au,http://www.smh.com.au/federal-politics/political-news/climate-change-measures-like-primitive-civilisations-offering-up-sacrifices-to-appease-the-gods-says-maurice-newman-20140814-3do0v.html
2014-08-14,23:30:22,2djhs7,991,"Polish Defense Minister Tomasz Siemoniak welcomes family of US soldier who died shielding a Pole from suicide bomber in Afghanistan. Father of US soldier: ""“I feel that he is not only a Polish soldier, but my brother and part of our family.""",thenews.pl,"http://www.thenews.pl/1/10/Artykul/178850,Minister-welcomes-family-of-US-soldier-who-saved-Pole"
2014-08-14,18:13:49,2diuxg,664,German public debt falls for first time in post-war era,reuters.com,http://www.reuters.com/article/2014/08/14/germany-economy-debt-idUSL6N0QK1PN20140814
2014-08-14,22:17:05,2djal5,461,Israeli official confirms US nixed arms sale to Israel,timesofisrael.com,http://www.timesofisrael.com/israeli-official-confirms-us-nixed-missile-sale-pm-blamed-for-soured-ties/
2014-08-14,06:13:03,2dh4d2,348,"ISIS Shifts Tactics As US Bombings Begin, 'Blend Into' Population",foxnews.com,http://www.foxnews.com/politics/2014/08/12/iraq-militants-changing-tactics-complicating-us-airstrike-mission/
2014-08-14,21:39:15,2dj7gx,350,"Israeli Finance Minister Yair Lapid in apparent shot at Netanyahu: ""Crisis in US-Israel relations is a very concerning trend... Sometimes, you just have to know how to say thank you.""",jpost.com,http://www.jpost.com/Breaking-News/Lapid-Crisis-in-US-Israel-relations-is-a-very-concerning-trend-that-cant-continue-371108
2014-08-14,22:56:58,2djeac,309,Pro-ISIS leaflets handed out on Oxford Street (London),london24.com,http://www.london24.com/news/crime/pro_isis_leaflets_handed_out_on_oxford_street_1_3724436
2014-08-14,14:48:54,2diikw,289,Seoul: N. Korea fires projectiles as pope visits,news.yahoo.com,http://news.yahoo.com/seoul-n-korea-fires-projectiles-pope-visits-053855859.html
2014-08-14,23:33:56,2dji5d,249,"Restrictions on gay men donating blood outdated, says Tory MP",theguardian.com,http://www.theguardian.com/society/2014/aug/14/blood-donation-gay-men-ban-michael-fabricant
2014-08-14,23:19:01,2djglt,245,SAS sent in to Iraq as US troops land on Mount Sinjar,telegraph.co.uk,http://www.telegraph.co.uk/news/worldnews/middleeast/iraq/11032684/SAS-sent-in-to-Iraq-as-US-troops-land-on-Mount-Sinjar.html
2014-08-14,05:10:40,2dgx4w,246,UPDATE 1-One child killed and two wounded in Sinai rocket attack,af.reuters.com,http://af.reuters.com/article/egyptNews/idAFL6N0QJ50F20140813
2014-08-14,23:06:30,2djfas,221,"Hello Kitty, Japan's ambassador of cute, is on a government-funded mission to space: The project to launch Sanrio Co Ltd's white cat with a pink bow into orbit is part of Prime Minister Shinzo Abe's push to promote Japan's high-tech industry and engineer economic growth.",reuters.com,http://www.reuters.com/article/2014/08/14/us-japan-hellokitty-idUSKBN0GE0LX20140814
2014-08-14,16:59:12,2diqyb,214,"Nigeria fears Ebola spread to east by infected nurse who ""disobeyed medical instructions""",news.yahoo.com,http://news.yahoo.com/nigeria-fears-ebola-spread-east-infected-nurse-232441108.html
2014-08-14,00:48:54,2dg2la,221,"Islamic State seizes towns near Turkish border -- ""a significant expansion.""",bbc.com,http://www.bbc.com/news/world-middle-east-28770786
2014-08-14,22:11:21,2dja3o,204,Putin says Russia Should Aim to Sell Energy in Roubles,uk.reuters.com,http://uk.reuters.com/article/2014/08/14/ukraine-crisis-putin-dollar-idUKL6N0QK3BP20140814
2014-08-14,15:27:41,2dil8s,200,Norwegian Journalist: Hamas Expels Reporters Over Critical Coverage,algemeiner.com,http://www.algemeiner.com/2014/08/13/norwegian-journalist-hamas-expels-reporters-over-critical-coverage/
2014-08-14,08:14:02,2dhhol,186,Gaza conflict: Israel and Hamas agree to extend ceasefire by five days,theguardian.com,http://www.theguardian.com/world/2014/aug/13/gaza-conflict-israel-hamas-extend-ceasefire
2014-08-14,05:38:33,2dh097,177,Africa's last polar bear dies,aljazeera.com,http://www.aljazeera.com/news/africa/2014/08/africa-last-polar-bear-dies-201481317419348671.html
2014-08-14,02:39:12,2dgfk8,180,"Israel’s annihilation has begun, says PLO envoy to Tehran",timesofisrael.com,http://www.timesofisrael.com/israels-annihilation-has-begun-says-official-plo-envoy-to-tehran/
2014-08-14,00:19:25,2dfz9l,161,"In an effort to raise awareness on Japan’s sexual enslavement of Korean and other Asian women during World War II, Korea’s Gender Equality Ministry will hold an academic forum on wartime sexual violence against women on Thursday in Seoul.",koreaherald.com,http://www.koreaherald.com/view.php?ud=20140813000907
2014-08-14,10:48:28,2dhx8k,160,Criminal investigation launched in response to claims of illegal means being used to gain 'dirt' on opposition parties by New Zealand government,3news.co.nz,http://www.3news.co.nz/Dirty-Politics-Greens-lay-complaint-with-police/tabid/1607/articleID/356799/Default.aspx
