2014-06-12,20:37:00,27yg8m,3857,"Australian government grabs $360 million from idle household bank accounts that have been dormant for just three years, prompting outrage in some quarters amid complaints that pensioners and retirees have lost deposits.",moneysaverhq.heraldsun.com.au,http://moneysaverhq.heraldsun.com.au/news/government-grabs-360-million-from-idle-household-bank-accounts/story-fnkrnsiy-1226950657835
2014-06-12,13:08:49,27xsfv,2944,Brazil airports go on Strike.... hours before World Cup...,rt.com,http://rt.com/news/165448-rio-airports-workers-strike/
2014-06-12,08:27:59,27x4gn,2778,Rich got 14.6% richer in 2013,cbc.ca,http://www.cbc.ca/news/business/rich-got-14-6-richer-in-2013-1.2672352
2014-06-12,03:31:34,27wauk,2479,"Uber sees an 850 percent jump in sign-ups, while cab drivers across Europe protest the taxi-hailing app by going on strike. Experts call the strike against Uber ""PR gold"" for the app.",csmonitor.com,http://www.csmonitor.com/Business/Latest-News-Wires/2014/0611/Uber-sign-ups-soar-by-850-percent-as-cab-drivers-protest
2014-06-12,23:07:06,27yqry,1690,Ukraine: Tanks 'cross from Russia',bbc.co.uk,http://www.bbc.co.uk/news/world-europe-27815441
2014-06-12,18:10:32,27y9ab,1634,ISIS just stole $425 million and became the ‘world’s richest terrorist group’,washingtonpost.com,http://www.washingtonpost.com/news/morning-mix/wp/2014/06/12/isis-just-stole-425-million-and-became-the-worlds-richest-terrorist-group/
2014-06-12,21:43:11,27yk9i,1479,Activists Poured Concrete All Over Some 'Anti-Homeless' Spikes This Morning,vice.com,http://www.vice.com/en_uk/read/activists-vandalised-the-anti-homeless-spikes-this-morning
2014-06-12,18:25:40,27y9wf,1449,An unprecedented attempt to hold the first ever completely secret criminal trial in the UK has been blocked by the Court of Appeal.,bbc.co.uk,http://www.bbc.co.uk/news/uk-27806814
2014-06-12,05:05:23,27wkhw,1309,Crisis in Iraq - open discussion thread (sticky #10),self.worldnews,https://www.reddit.com/r/worldnews/comments/27wkhw/crisis_in_iraq_open_discussion_thread_sticky_10/
2014-06-12,01:25:05,27vxx8,1207,Clinton reveals how Obama forcibly prevented China's 'secret' meeting with India to isolate US,timesofindia.indiatimes.com,http://timesofindia.indiatimes.com/world/us/Clinton-reveals-how-Obama-forcibly-prevented-Chinas-secret-meeting-with-India-to-isolate-US/articleshow/36394480.cms
2014-06-12,22:08:26,27ym1w,1127,Australia to sue FIFA over corruption surrounding 2022 World Cup,smh.com.au,http://www.smh.com.au/national/canberra-looks-to-get-back-40m-from-qatar-bid-20140612-3a0d6.html
2014-06-12,02:27:59,27w47a,702,Turkey calls for emergency Nato meeting on security situation in Iraq,dailystar.com.lb,http://www.dailystar.com.lb/News/Middle-East/2014/Jun-11/259753-turkey-calls-for-emergency-nato-meeting-on-security-situation-in-iraq.ashx
2014-06-12,06:58:58,27ww6n,684,The extinct influenza virus that caused the worst flu pandemic in history has been recreated from fragments of avian flu found in wild ducks in a controversial experiment to show how easy it would be for the deadly flu strain to reemerge today.,independent.co.uk,http://www.independent.co.uk/news/science/american-scientists-controversially-recreate-deadly-spanish-flu-virus-9529707.html
2014-06-12,01:43:04,27vzow,677,"500,000 People Reportedly Flee Mosul After Iraqi City Falls",npr.org,http://www.npr.org/blogs/thetwo-way/2014/06/11/320932929/500-000-people-reportedly-flee-mosul-after-iraqi-city-falls
2014-06-12,21:19:57,27yitq,539,"214 mile long traffic jam in Brazil, a day ahead of the World Cup. Transit protests are expected again for opening day.",indiatoday.intoday.in,http://indiatoday.intoday.in/story/brazil-world-cup-special-344-km-traffic-jams-dengue-incomplete-stadia/1/366466.html
2014-06-12,22:58:06,27ypzl,502,Britain and New Zealand reject Australian PM Tony Abbott's idea for a centre-right alliance to block action on climate change,smh.com.au,http://www.smh.com.au/federal-politics/political-news/britain-new-zealand-reject-tony-abbotts-idea-for-alliance-to-block-action-on-climate-change-20140612-39yws.html
2014-06-12,01:42:04,27vzla,463,Blackwater on trial over killing of 14 Iraqi civilians in 2007 | Prosecutors plan to call dozens of Iraqis to testify over bloodshed in Baghdad that inflamed anti-US sentiment around the world,theguardian.com,http://www.theguardian.com/world/2014/jun/11/blackwater-trial-iraq-civilians-2007
2014-06-12,04:51:36,27wj4b,404,"Australian PM Tony Abbott to UN: ""Count me out of climate change summit""",theaustralian.com.au,http://www.theaustralian.com.au/national-affairs/policy/count-me-out-of-climate-change-summit-says-tony-abbott/story-e6frg6xf-1226951212337#
2014-06-12,13:52:32,27xvuh,353,"Recession 'led to 10,000 suicides': The economic crisis in Europe and North America led to more than 10,000 extra suicides",bbc.com,http://www.bbc.com/news/health-27796628
2014-06-12,23:22:16,27ys45,353,ISIS militants extend control to 90 kms from Baghdad as Iraqi army melts away,euronews.com,http://www.euronews.com/2014/06/12/isis-militants-extend-control-to-90-kms-from-baghdad-as-iraqi-army-melts-away/
2014-06-12,21:43:03,27yk93,273,Insurgents vow to take Baghdad as U.S. mulls action,usatoday.com,http://www.usatoday.com/story/news/world/2014/06/12/militants-vow-seize-baghdad/10360831/
2014-06-12,17:15:29,27y6w7,225,Palestinians: autopsy shows live bullet killed teen during anti-Israel protest,reuters.com,http://www.reuters.com/article/2014/06/12/us-palestinian-israel-autopsy-idUSKBN0EN0JN20140612
2014-06-12,04:27:14,27wgjm,216,"Congo mines no longer in grip of warlords and militias, Enough Project finds 2010 US law requiring companies like Apple and Intel to prove products are conflct-free has worked",theguardian.com,http://www.theguardian.com/world/2014/jun/11/congo-mines-no-longer-grip-warlords-militias-report-enough-project
2014-06-12,07:06:26,27wwwt,209,Iraq’s Terrorists Are Becoming a Full-Blown Army,thedailybeast.com,http://www.thedailybeast.com/articles/2014/06/11/iraq-s-terrorists-are-becoming-a-full-blown-army.html
2014-06-12,10:30:08,27xf68,164,"Syrian woman survives 700 day blockade leaving home only six times, emerging weighing only 75 pounds",news.nationalpost.com,http://news.nationalpost.com/2014/06/11/syrian-woman-survives-700-day-blockade-leaving-home-only-six-times-emerging-weighing-only-75-pounds/
2014-06-12,09:25:38,27x9jo,142,"Iraq Asked U.S. for Strikes, Officials Say",nytimes.com,http://www.nytimes.com/2014/06/12/world/middleeast/iraq-asked-us-for-airstrikes-on-militants-officials-say.html?hp&_r=0
2014-06-12,08:40:04,27x5iq,105,"Adidas has agreed to phase out 99% of all polyflourinated chemicals (PFCs) by the end of 2017, building up to 100% by 2020 after a Greenpeace campaign",greenpeace.org,http://www.greenpeace.org/international/en/news/Blogs/makingwaves/adidas-is-back-onside/blog/49596/
2014-06-12,02:51:08,27w6lr,85,A Canadian Law School President Won’t Allow Gays in His College,news.vice.com,https://news.vice.com/article/a-canadian-law-school-president-wont-allow-gays-in-his-college
2014-06-12,11:33:42,27xkop,59,"Rio airport workers strike ahead of World Cup | Airport workers' strike will begin at midnight on Wednesday, as the World Cup's opening match is about to kick off.",aljazeera.com,http://www.aljazeera.com/news/americas/2014/06/rio-airport-workers-strike-ahead-world-cup-201461202626869462.html
2014-06-12,20:55:45,27yhbu,52,Iraq disintegrating as insurgents advance; Kurds seize Kirkuk,washingtonpost.com,http://www.washingtonpost.com/world/middle_east/iraq-disintegrating-as-insurgents-advance-kurds-seize-kirkuk/2014/06/12/22e79e2b-f793-4120-8161-36f17c287e5f_story.html
