2014-06-04,06:44:19,278kzt,3744,Relatives of Chinese citizens gunned down during the 1989 Tiananmen massacre have defied unprecedented Communist Party attempts to silence them to demand the truth about their loved-ones’ deaths ahead of today’s 25th anniversary of the crackdown.,telegraph.co.uk,http://www.telegraph.co.uk/news/worldnews/asia/china/10873738/I-will-not-be-silenced.-I-want-truth-behind-Tiananmen.html
2014-06-04,18:47:57,27a2tn,2503,David Cameron's house 'fracked' by protestors,telegraph.co.uk,http://www.telegraph.co.uk/news/politics/david-cameron/10874055/David-Camerons-house-fracked-by-protestors.html
2014-06-04,08:06:27,278t43,1456,"Nigerian military court-martials 15, including 10 generals, for aiding Boko Haram",dailyzone.com,http://www.dailyzone.com/articles/735/20140603/nigerian-military-court-martials-15-including-10-generals-aiding-boko.htm
2014-06-04,18:18:48,27a1k0,1295,The mayor of Venice is among 35 people arrested in Italy over alleged corruption in connection with new flood barriers built to protect the city.,bbc.co.uk,http://www.bbc.co.uk/news/world-latin-america-27692334
2014-06-04,06:01:53,278gnz,1247,"Poll: Australians’ concern about climate change & a desire for the government to take action is on the rise. 45% want action now 'whatever the cost', as survey reveals a 9-point rise in the strongest response since 2012",theguardian.com,http://www.theguardian.com/environment/2014/jun/03/lowy-poll-more-australians-seriously-concerned-about-climate
2014-06-04,11:38:57,279ca4,1131,Obama expected to ask Abbott to put climate change back on G20 agenda,abc.net.au,http://www.abc.net.au/worldtoday/content/2014/s4017645.htm
2014-06-04,17:09:02,279yjf,903,US coastguard releases Chinese boat accused of illegal fishing in North Pacific. Vessel caught with half a tonne of salmon and high-seas net widely condemned as highly destructive to marine life,scmp.com,http://www.scmp.com/news/china/article/1525111/us-coastguard-releases-chinese-boat-accused-illegal-fishing-north-pacific
2014-06-04,16:44:43,279xe6,764,North Korea asked Japan for food and medical aid,globalpost.com,http://www.globalpost.com/dispatch/news/kyodo-news-international/140603/n-korea-asked-japan-food-medical-aid-talks-may
2014-06-04,05:51:27,278fky,651,Anti-marijuana candidate loses in Uruguay primary,news.yahoo.com,https://news.yahoo.com/anti-marijuana-candidate-loses-uruguay-105907414.html
2014-06-04,13:04:27,279jn7,493,People 'more negative about Russia': People's views of Russia have strongly deteriorated since last year,bbc.com,http://www.bbc.com/news/27685494
2014-06-04,09:14:58,278zd9,464,"The world's leading industrialized nations meet without Russia for the first time in 17 years on Wednesday, leaving President Vladimir Putin out of the talks in retaliation for his seizure of Crimea and Russia's part in destabilizing eastern Ukraine.",reuters.com,http://www.reuters.com/article/2014/06/03/us-g-idUSKBN0EE2FG20140603?feedType=RSS&feedName=topNews
2014-06-04,09:08:43,278ytz,451,Protests for kidnapped girls banned in Nigerian capital,cnn.com,http://www.cnn.com/2014/06/02/world/africa/nigeria-protests-ban/
2014-06-04,01:25:53,277ns4,427,"OSCE confirms that deadly explosion at Lugansk HQ which killed civilians was indeed a ""non-guided missiles launched from an aircraft.” While Ukraine military confirmed they fired 150 missiles in Lugansk area that day",rt.com,http://rt.com/news/163352-ukraine-airstrike-lugansk-missiles/
2014-06-04,00:49:11,277jy2,266,"Survey finds broad discontent in World Cup host Brazil | People take the view that the billions of dollars poured into the soccer tournament would be better spent on services such as healthcare, schools and public transportation.",trust.org,http://www.trust.org/item/20140603135803-yx59i/
2014-06-04,05:29:28,278d6s,267,"Rouhani: ""We shouldn't interfere in people's lives to such an extent, even out of compassion. Let them choose their own path to heaven.""",theguardian.com,http://www.theguardian.com/world/iran-blog/2014/jun/03/iran-rouhani-locks-horns-hardliners-path-paradise?CMP=twt_gu#comments
2014-06-04,05:13:42,278bfk,218,Heavy fighting is taking place in and around the rebel-held city of Sloviansk in eastern Ukraine,bbc.com,http://www.bbc.com/news/world-europe-27679626
2014-06-04,22:52:54,27ahck,219,"Lithuania is set to adopt the euro on 1 January 2015, after the European Commission said it had met the criteria for joining the single currency.",bbc.co.uk,http://www.bbc.co.uk/news/world-europe-27697611
2014-06-04,17:25:57,279z9s,218,"Finland’s Foreign Ministry has adopted a ""corruption trigger"" for reporting the misuse of development aid. The online service is the first of its kind to be used by the Finnish public service and is available in Finnish, Swedish and English.",yle.fi,http://yle.fi/uutiset/foreign_ministry_adopts_online_corruption_trigger_to_prevent_aid_misuse/7276307
2014-06-04,19:45:24,27a5et,193,"Protestors in Spain Don't Want to Have a King Anymore: Thousands of Spaniards & Mexicans are welcoming new king by chanting pro-Republican slogans like “Monarchy Out!,” “Up With the Third Republic!,” & “Referendum Now!”",news.vice.com,https://news.vice.com/article/spaniards-across-spain-and-in-mexico-city-call-for-a-referendum-on-the-monarchy
2014-06-04,20:33:46,27a7u8,169,Germany investigates alleged NSA Merkel phone tap: Germany’s chief federal prosecutor says he has opened an investigation into the alleged monitoring of Chancellor Angela Merkel’s cell phone by the U.S. National Security Agency.,washingtonpost.com,http://www.washingtonpost.com/world/europe/germany-investigates-alleged-nsa-merkel-phone-tap/2014/06/04/71bc0200-ebdb-11e3-b10e-5090cf3b5958_story.html?tid=rssfeed
2014-06-04,05:04:41,278ai7,137,Sweden considers making programming an alternative to shop class,sydsvenskan.se,http://www.sydsvenskan.se/sverige/programmering-kan-bli-alternativ-till-slojd/
2014-06-04,03:45:23,27825l,79,"China, once the manual labour “workshop of the world”, has become the largest buyer of industrial robots",ft.com,http://www.ft.com/intl/cms/s/0/a5cca8c0-e70c-11e3-aa93-00144feabdc0.html
2014-06-04,06:55:25,278m54,79,An Uproar in Australia Over Proposal to Deregulate Tuition,nytimes.com,http://www.nytimes.com/2014/06/02/world/asia/an-uproar-in-australia-over-proposal-to-deregulate-tuition.html?hpw&rref=education&_r=0
2014-06-04,07:03:43,278n0t,60,"Major explosion, fire at Shell plant in the Netherlands",rt.com,http://rt.com/news/163436-shell-explosion-moerdijk-netherlands/
2014-06-04,19:47:13,27a5ic,57,Australia’s one hundred days of truth-telling: Operation Blame the Victims was in full swing again today as Scott Morrison insisted that it was the unarmed men who received the beating who are to blame,opendemocracy.net,http://www.opendemocracy.net/nicola-hill/australia%E2%80%99s-one-hundred-days-of-truthtelling#.U47470On-mY.reddit
2014-06-04,21:50:08,27acjo,54,Activists stage fracking protest at David Cameron's home: Signs to drill under PM's cottage in Cotswold put up to protest against tresspass law changes expected in Queen's speech,theguardian.com,http://www.theguardian.com/environment/2014/jun/04/fracking-protest-david-cameron-home-queens-speech
2014-06-04,19:36:22,27a4zs,45,Iraq F-16s: Lockheed will deliver the first of 36 fighter jets to Iraq this week,csmonitor.com,http://www.csmonitor.com/USA/Latest-News-Wires/2014/0603/Iraq-F-16s-Lockheed-will-deliver-the-first-of-36-fighter-jets-to-Iraq-this-week
2014-06-04,02:39:45,277vef,44,Israel 'deeply disappointed' with US,thehill.com,http://thehill.com/policy/international/208017-israeli-ambassador-slams-state-department
2014-06-04,22:40:49,27agc9,41,"Renewable energy capacity grew 8.3% in 2013. Developing countries such as China and India were the main drivers in the expansion of renewable energy last year, and 95 developing countries now provide government support for renewables, a six-fold increase from almost a decade ago.",rtcc.org,http://www.rtcc.org/2014/06/03/renewable-energy-capacity-grew-8-3-in-2013/
2014-06-04,06:02:19,278gpi,42,"India, China and Turkey endorse Palestinian unity government",haaretz.com,http://www.haaretz.com/news/diplomacy-defense/1.596914
