2014-07-06,03:30:38,29wvcm,7576,Germany arrests double agent recruited by U.S. to reveal details of Berlin's NSA inquiry,news.nationalpost.com,http://news.nationalpost.com/2014/07/04/germany-arrests-alleged-double-agent-accused-of-spying-on-berlins-nsa-inquiry-for-the-u-s/
2014-07-06,21:29:01,29ypkg,8838,6 Arrested For Burning Palestinian Teen To Death,nytimes.com,http://www.nytimes.com/aponline/2014/07/06/world/middleeast/ap-ml-israel-palestinians.html?partner=rss&emc=rss&smid=tw-nytimes&_r=0
2014-07-06,08:34:51,29xj4v,5327,About 40 politicians on UK pedophile ring: Report,presstv.ir,http://www.presstv.ir/detail/2014/07/05/369998/over-40-officials-in-uk-pedophile-ring/
2014-07-06,23:00:37,29yu61,2669,"Germany demands full explanation from US on arrested spy. President Joachim Gauck accuses the US of “playing games with our friendship” and says if allegations are proven Germany must “say enough is enough, for once”.",telegraph.co.uk,http://www.telegraph.co.uk/news/worldnews/europe/germany/10949568/Germany-demands-full-explanation-from-US-on-arrested-spy.html
2014-07-06,07:26:43,29xdyn,2541,British student jailed for failing to provide password,chroniclelive.co.uk,http://www.chroniclelive.co.uk/news/computer-whizzkid-jailed-failing-provide-7375293
2014-07-06,08:23:44,29xia0,1074,U.S. ‘profoundly troubled’ by American’s beating in Israeli custody - Al Arabiya News,english.alarabiya.net,http://english.alarabiya.net/en/News/2014/07/06/U-S-profoundly-troubled-by-American-s-beating-in-Israeli-custody-.html#.U7iIwRSK59I.reddit
2014-07-06,13:56:32,29y5np,365,"ISIS chief Abu Bakr al-Baghdadi injured, flees to Syria",thenews.com.pk,http://www.thenews.com.pk/Todays-News-13-31421-ISIS-chief-Abu-Bakr-al-Baghdadi-injured-flees-to-Syria
2014-07-06,00:01:31,29wfi0,311,US company signs $1.175bn Iran energy deal in a rare joint commercial project to turn rubbish and human waste into electricity.,timesofindia.indiatimes.com,http://timesofindia.indiatimes.com/business/international-business/US-company-signs-1-175bn-Iran-energy-deal-Report/articleshow/37846594.cms
2014-07-06,06:42:37,29xan1,309,Eleven dead in Poland parachute club plane crash,bbc.com,http://www.bbc.com/news/world-europe-28181091
2014-07-06,11:56:04,29xxkw,287,Taliban torch 200 trucks carrying fuel for NATO forces in Afghanistan,america.aljazeera.com,http://america.aljazeera.com/articles/2014/7/5/taliban-insurgentssetoiltankersablazeinafghanistan.html
2014-07-06,21:22:59,29yp9t,290,Uber Gets a Green Light to Operate in London,slate.com,http://www.slate.com/blogs/moneybox/2014/07/03/uber_london_transport_regulator_gives_car_service_the_green_light.html
2014-07-06,23:12:26,29yuwl,258,Home Office ‘child abuse cover-up’: Michael Gove rules out public inquiry into claims of paedophile politicians at Westminster,independent.co.uk,http://www.independent.co.uk/news/uk/crime/home-office-child-abuse-coverup-michael-gove-rules-out-public-inquiry-into-claims-of-paedophile-politicians-at-top-of-westminster-9587642.html
2014-07-06,03:07:09,29wtf7,259,Isis leader 'Caliph Ibrahim' makes first ever public video appearance,telegraph.co.uk,http://www.telegraph.co.uk/news/worldnews/middleeast/10948492/Isis-leader-Caliph-Ibrahim-makes-first-ever-public-video-appearance.html
2014-07-06,23:05:11,29yufl,241,Dalai Lama celebrates 79 years,mnn.com,http://www.mnn.com/lifestyle/arts-culture/blogs/dalai-lama-celebrates-79-years-in-this-lifetime-anyway
2014-07-06,20:46:33,29ynne,200,"17 coal miners trapped underground in west China - China has world's deadliest mines, although safety record has been improving lately",news.yahoo.com,http://news.yahoo.com/17-coal-miners-trapped-underground-west-china-110334468.html
2014-07-06,09:53:38,29xp0s,178,Australian officials made a visit to the Refugee Detention Centre on Manus Island centre two weeks ago saying: ''You will be here a very long time. You will never get to Australia. You should strongly consider going back to where you came from.'',smh.com.au,http://www.smh.com.au/federal-politics/political-news/payouts-only-after-asylum-seekers-return-home-20140705-3bfb7.html
2014-07-06,20:18:49,29ymic,179,Ukraine crisis: Rebels abandon Sloviansk stronghold,bbc.com,http://www.bbc.com/news/world-europe-28174104
2014-07-06,00:18:14,29wgmx,167,Ukraine pushes rebels from eastern stronghold: Defence minister says national flag is flying over Slovyansk after the retreat of outnumbered pro-Russian separatists.,aljazeera.com,http://www.aljazeera.com/news/europe/2014/07/ukraine-rebels-flee-eastern-stronghold-2014758423591191.html
2014-07-06,06:11:05,29x886,140,Two Suspected Al-Qaeda militants blow themselves up in southern Saudi Arabia,in.reuters.com,http://in.reuters.com/article/2014/07/05/saudi-border-idINL6N0PG03I20140705
2014-07-06,09:19:48,29xmlf,130,"World Bank Email Leaks Show More Money Available for Power & Mining Projects - Environmentalists & human rights campaigners sound alarm at radical plans to ease conditions for loans, making over $50bn (£29bn) of public money a yr available for big power, mining, transport & farming projects.",theguardian.com,http://www.theguardian.com/business/2014/jul/06/activists-alarm-world-bank-leak-easier-loans
2014-07-06,02:57:21,29wsob,126,"Egypt fuel prices soar up to 70%, exasperating the public",latimes.com,http://www.latimes.com/world/middleeast/la-fg-egypt-gas-prices-soar-egyptian-public-exasperated-20140705-story.html
2014-07-06,11:56:07,29xxl0,109,'More than 10' politicians on list held by police investigating Westminster 'paedophile ring',telegraph.co.uk,http://www.telegraph.co.uk/news/uknews/crime/10947561/More-than-10-politicians-on-list-held-by-police-investigating-Westminster-paedophile-ring.html
2014-07-06,08:23:30,29xi9d,96,"A ""profoundly troubled"" United States condemned reports Saturday that an American teenager detained in Israel was ""severely beaten"" while in police custody, amid heightened tensions with Palestinians",news.yahoo.com,http://news.yahoo.com/us-profoundly-troubled-americans-beating-israeli-custody-204629191.html;_ylt=AwrBJR6TaLhT63gAweTQtDMD
2014-07-06,20:24:45,29ymq9,93,American IRA supporters sent weapons used for Orangemen murders - The Order yesterday demanded an explanation from the US authorities after information was passed to the institution by the PSNI's Historical Enquiries Team.,belfasttelegraph.co.uk,http://www.belfasttelegraph.co.uk/tablet/news/american-ira-supporters-sent-weapons-used-for-orangemen-murders-30149057.html
2014-07-06,02:41:19,29wrg5,78,"Dubai is planning on building world's largest shopping mall in a temperature-controlled ""city""",businessinsider.com,http://www.businessinsider.com/worlds-largest-mall-opening-in-dubai-2014-7?utm_content=buffer80593&utm_medium=social&utm_source=facebook.com&utm_campaign=buffer
2014-07-06,12:41:24,29y0nm,61,Air New Zealand has stood down two pilots after a mid-air drama in which the airline said the first officer was locked out of the cockpit during a trans-Tasman flight,channelnewsasia.com,http://www.channelnewsasia.com/news/asiapacific/air-new-zealand-pilots/1240934.html
2014-07-06,02:50:52,29ws79,58,Fifa World Cup 2014: Algeria National Team Donates £5m Prize Money to Gaza,ibtimes.co.uk,http://www.ibtimes.co.uk/fifa-world-cup-2014-algeria-national-team-donates-5m-prize-money-gaza-1455163
2014-07-06,01:37:44,29wmhr,51,Western-backed Syrian rebels warn of ‘humanitarian disaster’ if Islamic militants not stopped,news.nationalpost.com,http://news.nationalpost.com/2014/07/05/western-backed-syrian-rebels-warn-of-humanitarian-disaster-if-islamic-militants-not-stopped/
2014-07-06,00:50:26,29wixw,38,"Egyptian court sentences Muslim Brotherhood members to life: A court in Egypt has sentenced Muslim Brotherhood leader, Mohammed Badie, and 36 other members to life in prison. Death sentences have been confirmed for ten others.",dw.de,http://www.dw.de/egyptian-court-sentences-muslim-brotherhood-members-to-life/a-17760287
2014-07-06,01:17:21,29wkxb,35,"Fukushima's radioactive soil sparks fights, exposes the enormity and hopelessness of clean-up task",straight.com,http://www.straight.com/news/680196/fukushimas-radioactive-soil-sparks-fights-exposes-enormity-and-hopelessness-clean-task
