2014-04-12,01:26:58,22se2a,3674,CIA and White House under pressure after Senate torture report leaks.,theguardian.com,http://www.theguardian.com/world/2014/apr/11/cia-white-house-pressure-leaked-senate-report
2014-04-12,18:07:21,22uekz,3067,"Armed men dressed in camouflage clothing have seized a police station in eastern Ukraine, officials say.",bbc.co.uk,http://www.bbc.co.uk/news/world-europe-27000700
2014-04-12,01:38:59,22sf5w,3043,UN to summon Kim Jong Un before international court; China says it will veto any action against its ally and may block the summoning.,telegraph.co.uk,http://www.telegraph.co.uk/news/worldnews/asia/northkorea/10759762/UN-panel-to-pursue-Kim-Jong-un-on-human-rights-abuses.html
2014-04-12,03:04:59,22smzq,2897,"Malaysian military withheld radar data on Flight MH370 as nations searched wrong area, sources say",news.nationalpost.com,http://news.nationalpost.com/2014/04/11/malaysian-military-withheld-radar-data-on-flight-mh370-as-nations-searched-wrong-area-sources-say/
2014-04-12,18:14:05,22uet4,2510,"Around 1,000 Christian and Hindu women in Pakistan are forcibly converted to Islam and married to Muslim men every year, says a report released by Movement for Solidarity and Peace (MSP) on Monday",pakistantoday.com.pk,http://www.pakistantoday.com.pk/2014/04/08/national/1000-christian-hindu-girls-forced-to-convert-to-islam-report/
2014-04-12,23:04:18,22ur3r,1333,"For Crimea, Google Shows Different Borders Based on Your Location",mashable.com,http://mashable.com/2014/04/11/crimea-google/
2014-04-12,18:18:57,22ueyk,907,"BEIJING (Reuters) – The governor of China’s restive far western region of Xinjiang wrote on Monday that Islamist militants were trying to ban laughter at weddings and crying at funerals, as he appealed to people to stamp out the “tumor” of extremism",news.yahoo.com,http://news.yahoo.com/china-official-says-islamists-seek-ban-laughter-crying-095238913.html
2014-04-12,22:43:23,22upvp,883,Mexico Marches Against New Internet Censorship Laws,revolution-news.com,http://revolution-news.com/mexico-marches-new-internet-censorship-laws/
2014-04-12,02:02:42,22shbm,875,Russia aims to have permanent moon base up and running by 2040,dailymail.co.uk,http://www.dailymail.co.uk/news/article-2602291/We-coming-Moon-FOREVER-Russia-sets-plans-conquer-colonise-space-including-permanent-manned-moon-base.html
2014-04-12,04:19:14,22stve,526,Japanese railway operator to offer maglev tech to US for free- Nikkei Asian Review,asia.nikkei.com,http://asia.nikkei.com/Business/Companies/Japanese-railway-operator-to-offer-maglev-tech-to-US-for-free
2014-04-12,22:32:26,22upa8,415,Experimental Hepatitis Drug Cures 95% Patients in Clinical Trial: German Researchers | News Tonight Africa,newstonight.co.za,http://newstonight.co.za/content/experimental-hepatitis-drug-cures-95-patients-clinical-trial-german-researchers
2014-04-12,21:38:44,22uml4,399,"UN voices ""deep concerns"" about Brunei implementing death by stoning for adultery, sodomy, extramarital sexual relations, insulting verses of the Quran and Hadith, blasphemy, declaring oneself a prophet or non-Muslim starting from 22nd of April",un.org,http://www.un.org/apps/news/story.asp?NewsID=47552
2014-04-12,23:45:18,22utp6,377,Russian oil firm says Asian buyers willing to use euros,reuters.com,http://www.reuters.com/article/2014/04/10/us-russia-gazpromneft-euros-idUSBREA390UF20140410
2014-04-12,12:17:18,22tx68,293,Lithuania Dispatches Warship After Claiming Russian Disturbance,bloomberg.com,http://www.bloomberg.com/news/2014-04-11/lithuania-dispatches-warship-after-claiming-russian-disturbance.html
2014-04-12,02:48:47,22slj3,276,Workers in Samsung semiconductor plants who have developed cancer while working in dangerous conditions are fighting their former employer—and their government—for compensation.,arstechnica.com,http://arstechnica.com/tech-policy/2014/04/samsungs-cancer-stricken-workers-are-focus-of-new-debate-in-south-korea/
2014-04-12,02:46:57,22sldj,236,Pope Assumes Responsibility for Priest Sex Abuse,huffingtonpost.com,http://www.huffingtonpost.com/huff-wires/20140411/eu-rel--vatican-church-abuse/
2014-04-12,23:17:02,22urvv,207,"IPCC report: world must urgently switch to clean sources of energy. Clean energy will have to at least treble in output and dominate world energy supplies by 2050 in order to avoid catastrophic climate change, a UN report is set to conclude on Sunday.",theguardian.com,http://www.theguardian.com/environment/2014/apr/12/ipcc-report-world-must-switch-clean-sources-energy
2014-04-12,02:07:34,22shr1,206,"BBC News - US refuses visa for Iran's pick for UN Ambassador, due to his involvement in the 1979 U.S. Embassy Raid.",m.bbc.com,http://m.bbc.com/news/world-us-canada-26994936#TWEET1098374
2014-04-12,12:31:21,22ty5n,194,Ukraine commandos refuse to storm buildings,thehindu.com,http://www.thehindu.com/news/international/world/ukraine-commandos-refuse-to-storm-buildings/article5900787.ece
2014-04-12,11:26:44,22ttjj,191,"The National Security Agency flatly refuted a report that it has been aware for at least two years about the Heartbleed computer glitch, one of the most significant security flaws in Internet history. ""Reports that say otherwise are wrong,” a NSA spokesperson told TIME",time.com,http://time.com/60082/nsa-heartbleed-bug-denial/?utm_source=feedburner&utm_medium=feed&utm_campaign=Feed:%20time/topstories%20%28TIME:%20Top%20Stories%29
2014-04-12,03:58:02,22srvy,171,"Russia's Foreign Ministry is warning that Russians should refrain from traveling abroad because they could be entrapped by US secret services who are actively ""hunting"" for Russians to persecute in punishment for Moscow's recent annexation of Crimea.",csmonitor.com,http://www.csmonitor.com/World/Europe/2014/0411/Russians-warned-if-they-go-abroad-US-might-snatch-them
2014-04-12,20:11:18,22uj23,159,"Former Chief Economist of the BIS: ""I see speculative bubbles like in 2007""",fuw.ch,http://www.fuw.ch/article/i-see-speculative-bubbles-like-in-2007/
2014-04-12,08:17:03,22tf2a,153,"Israeli Hackers Strike Back at Anonymous OpIsrael, Expose Participants With Their Own Webcams",algemeiner.com,http://www.algemeiner.com/2014/04/10/israeli-hackers-strike-back-at-anonymous-opisrael-expose-participants-with-their-own-webcams-photos/
2014-04-12,10:29:21,22tpel,138,"The IMF and World Bank on Friday urged finance ministers to impose a price on carbon, warning that time was running out for the planet to avoid worst-case climate change.",france24.com,http://www.france24.com/en/20140411-imf-world-bank-push-price-carbon/
2014-04-12,22:51:46,22uqd5,129,"Syria rebels, government confirm poison gas attack: The Syrian government and rebel forces say poison gas has been used in a central village, killing two people and injuring more than 100, while blaming each other for the attack.",washingtonpost.com,http://www.washingtonpost.com/world/middle_east/syria-rebels-government-confirm-poison-gas-attack/2014/04/12/4662d4d4-c247-11e3-9ee7-02c1e10a03f0_story.html?tid=rssfeed
2014-04-12,12:17:33,22tx6r,90,General Strike Grips Argentina: Over one million turn out for action to denounce government policies,commondreams.org,https://www.commondreams.org/headline/2014/04/11-6
2014-04-12,23:33:50,22usz8,81,Armed men seize more buildings in Eastern Ukraine: a police station in Krasny Lyman and a second building in Sloviansk have been taken over by pro-Russian separatists.,en.interfax.com.ua,http://en.interfax.com.ua/news/general/200416.html
2014-04-12,06:35:46,22t6hh,65,G20 gives U.S. year-end deadline for IMF reforms,news.yahoo.com,http://news.yahoo.com/g20-gives-u-end-deadline-imf-reforms-203508152--sector.html?.tsrc=attmp
2014-04-12,03:39:58,22sq85,68,Global approval of US rebounds,gallup.com,http://www.gallup.com/poll/168425/global-image-leadership-rebounds.aspx
2014-04-12,03:00:24,22smkt,49,Lithuanian Ambassador: ‘Putin Is Not Finished’,thetrumpet.com,http://www.thetrumpet.com/article/11553.18.0.0/world/lithuanian-ambassador-putin-is-not-finished
