2014-08-09,20:18:52,2d29dt,19144,French MPs propose forcing supermarkets to hand over all unsold food to charity,telegraph.co.uk,http://www.telegraph.co.uk/news/worldnews/europe/france/11018960/French-MPs-propose-forcing-supermarkets-to-hand-over-all-unsold-food-to-charity.html
2014-08-09,01:45:10,2czrfw,10968,China Will Install More Solar This Year Than The U.S. Ever Has,thinkprogress.org,http://thinkprogress.org/climate/2014/08/08/3468974/china-solar-capacity-booming/
2014-08-09,11:51:59,2d1gfb,5304,"Isis persecution of Iraqi Christians has become genocide, says religious leaders",theguardian.com,http://www.theguardian.com/world/2014/aug/08/isis-persecution-iraqi-christians-genocide-asylum
2014-08-09,18:15:06,2d23yl,2116,The Islamic flag that was raised at a council estate in London has now been taken down by a Catholic nun and Muslims from the local area: 'There is no place for hate in Tower Hamlets',theguardian.com,http://www.theguardian.com/uk-news/2014/aug/08/islamist-black-flag-taken-down-tower-hamlet-london
2014-08-09,21:55:18,2d2e9n,2086,"'If demands not met by Sunday, we will attack Tel Aviv,' says Hamas",jpost.com,http://www.jpost.com/Operation-Protective-Edge/If-demands-not-met-by-Sunday-we-will-attack-Tel-Aviv-says-Hamas-370557
2014-08-09,01:09:56,2cznqy,1609,"Turkish warplanes set to join US, bomb ISIS in Northern Iraq",basnews.com,http://basnews.com/en/News/Details/Turkish-Aircrafts-to-Help-KRG-in-Shelling-IS-Militants/29579
2014-08-09,06:12:16,2d0lyg,1488,Government computers used to alter Wikipedia entries on high profile killings,telegraph.co.uk,http://www.telegraph.co.uk/technology/wikipedia/11017597/Government-computers-used-to-alter-Wikipedia-entries-on-high-profile-killings.html
2014-08-09,02:40:35,2czxvw,1232,Nick Clegg (British Deputy Prime Minister) Calls for ending imprisonment for the possession of drugs for personal use,libdems.org.uk,http://www.libdems.org.uk/ending_imprisonment_for_the_possession_of_drugs_for_personal_use
2014-08-09,08:28:20,2d0zit,863,A suspected case of Ebola has made it to Toronto,nytimes.com,http://www.nytimes.com/reuters/2014/08/08/world/africa/08reuters-health-ebola-canada.html?ref=world&_r=0&referrer=
2014-08-09,19:53:40,2d289n,764,"Four new Ebola cases in Nigeria, all related to American who brought virus there",wapo.st,http://wapo.st/X6OHcB
2014-08-09,05:18:56,2d0gbb,723,"Kurdish ground forces had opened a pathway off of Mt. Sinjar and helped some 10,000 people trapped there to safety",rudaw.net,http://rudaw.net/english/kurdistan/080820141
2014-08-09,13:29:54,2d1nqt,638,US warns Russia against Ukraine invasion: US official says any Russian intervention under the guise of providing humanitarian aid will be viewed as invasion.,aljazeera.com,http://www.aljazeera.com/news/europe/2014/08/us-warns-russia-against-ukraine-invasion-2014890432988615.html
2014-08-09,05:02:03,2d0ejv,559,U.S. launches second round of air strikes against IS targets in Iraq.,cnn.com,http://www.cnn.com/2014/08/08/world/iraq-options/index.html
2014-08-09,13:26:00,2d1ng9,432,Ottawa refuses to let injured Gaza children into Canada for treatment,globalnews.ca,http://globalnews.ca/news/1500138/ottawa-wont-let-injured-gaza-children-come-to-canada-for-treatment/
2014-08-09,12:18:53,2d1ifa,413,"Iraq supplies Kurds with ammunition in unprecedented move, U.S. says",reuters.com,http://www.reuters.com/article/2014/08/09/us-iraq-security-usa-ammunition-idUSKBN0G82BP20140809
2014-08-09,11:08:28,2d1cum,377,"Islamic State persecution of Yazidi minority amounts to genocide, UN says ( video)",csmonitor.com,http://www.csmonitor.com/World/Middle-East/2014/0807/Islamic-State-persecution-of-Yazidi-minority-amounts-to-genocide-UN-says-video?cmpid=addthis_reddit#.U-WClA7inf4.reddit
2014-08-09,01:24:31,2czpaq,317,Russia and China agree on currency swaps so that international trade between the two countries can be carried out without the dollar,in.rbth.com,http://in.rbth.com/news/2014/08/08/russia_china_agree_on_national_currency_swaps_37293.html
2014-08-09,06:02:16,2d0kw2,304,"New Ukrainian rebel leader gives Moscow distance: The Russian commanders ""are fleeing like rats,"" said Andrei, a 27-year-old rebel in Donetsk. ""We had hoped for help from Moscow, we had expected Russian troops, but Russia betrayed us.""",businessweek.com,http://www.businessweek.com/ap/2014-08-08/2-killed-by-shelling-in-rebel-held-ukraine-city
2014-08-09,13:11:11,2d1mcy,289,"U.S. jet fighters, drones strike ISIS fighters, convoys in Iraq",cnn.com,http://www.cnn.com/2014/08/08/world/iraq-options/index.html?sr=reddit
2014-08-09,00:08:49,2czh8d,285,"Ebola scare reaches Delhi, India - 3 under watch in Dwarka",hindustantimes.com,http://www.hindustantimes.com/india-news/ebola-scare-in-delhi-turns-out-to-be-a-false-alarm/article1-1249391.aspx
2014-08-09,08:53:02,2d11om,229,Russia to 'restrict' US-run GPS satellites,bbc.com,http://www.bbc.com/news/technology-27662580
2014-08-09,23:33:39,2d2khc,222,Ghana May Now Have Recorded Her First Case of Ebola,accrareport.com,http://accrareport.com/news/ghana-may-now-have-recorded-her-first-case-of-ebola/
2014-08-09,19:45:08,2d27wj,178,Israel Destroyed 60 Gaza Mosques: Ministry,dailysabah.com,http://www.dailysabah.com/mideast/2014/08/08/israel-destroyed-60-gaza-mosques-ministry
2014-08-09,19:45:49,2d27xk,178,"Palestinians death toll rises to at least 1,898",thenews.com.pk,"http://www.thenews.com.pk/article-156328-5-Palestinians-killed,-3-Gaza-mosques-destroyed-in-Israeli-air-strikes"
2014-08-09,11:40:31,2d1fik,138,Iraq: Muslim Jihadis Vow to Take Revenge on US Infidels for Isis Bombing Campaign,ibtimes.co.uk,http://www.ibtimes.co.uk/iraq-muslim-jihadis-vow-take-revenge-us-infidels-isis-bombing-campaign-1460411
2014-08-09,03:54:59,2d073g,136,Venice: large ships and cruises have finally been banned from entering the canals.,ansamed.info,http://www.ansamed.info/ansamed/en/news/nations/italy/2014/08/08/large-ships-banned-from-venice-st-marks-basin_73ddb0cf-806a-4ad5-8b7f-dd4cb908671f.html
2014-08-09,23:32:46,2d2kff,112,Palestine will not withdraw their complaint to the ICC,middleeastmonitor.com,https://www.middleeastmonitor.com/news/middle-east/13348-palestine-will-not-withdraw-their-complaint-to-the-icc
2014-08-09,10:41:48,2d1ao0,114,Anglican Vicar of Baghdad: ‘Child I baptized cut in half by ISIS’,episcopaldigitalnetwork.com,http://episcopaldigitalnetwork.com/ens/2014/08/08/anglican-vicar-of-baghdad-child-i-baptized-cut-in-half-by-isis/
2014-08-09,00:31:21,2czjij,113,Weak Russian business causes shares of Adidas to fall nearly 40% since the start of the year.,money.cnn.com,http://money.cnn.com/2014/08/08/investing/germany-russia-stocks-correction/index.html?hpt=hp_t2
2014-08-09,03:54:07,2d0704,106,Malaysia wants the ‘missing’ Ukrainian ATC tapes,nst.com.my,http://www.nst.com.my/node/21260
