2014-02-26,02:18:20,1ywspe,4865,"New Snowden Doc Reveals How GCHQ/NSA Use The Internet To 'Manipulate, Deceive And Destroy Reputations' of activists.",techdirt.com,http://www.techdirt.com/articles/20140224/17054826340/new-snowden-doc-reveals-how-gchqnsa-use-internet-to-manipulate-deceive-destroy-reputations.shtml
2014-02-26,16:09:28,1yz2xp,3014,An Italian woman with cancer is suing health authorities after she was subjected to grueling radiotherapy 22 times - on the wrong breast,thelocal.it,http://www.thelocal.it/20140225/woman-has-months-of-cancer-treatment-on-wrong-breast
2014-02-26,18:47:07,1yzamn,2984,"Switzerland could soon have the world's highest minimum wage - at $24.80 per hour, or $4,505 a month.",thelocal.ch,http://www.thelocal.ch/20140226/no-to-worlds-highest-minimum-wage-swiss-economy-chief
2014-02-26,02:57:27,1ywwz6,2562,"China's air pollution has reached the level of a ""nuclear winter"", with even crops and agriculture facing problems. Beijing's pollution concentration is at 505 micrograms, 20 times the World Health limit. The Shanghai Academy of Social Sciences says that the city is ""uninhabitable for human beings"".",theguardian.com,http://www.theguardian.com/world/2014/feb/25/china-toxic-air-pollution-nuclear-winter-scientists
2014-02-26,02:09:40,1ywrpf,1588,"Norway, Denmark, Netherlands halt millions of dollars in aid to Uganda",upi.com,http://www.upi.com/Top_News/World-News/2014/02/25/Norway-Denmark-Netherlands-halt-millions-of-dollars-in-aid-to-Uganda/UPI-44021393344691/
2014-02-26,11:57:45,1yyjek,1450,Bush cyberczar: NSA created ‘the potential for a police state’,rt.com,http://rt.com/usa/clarke-summit-encryption-standards-711/
2014-02-26,23:59:47,1yzwnr,788,IMF study finds inequality is damaging to economic growth: The International Monetary Fund has backed economists who argue that inequality is a drag on growth in a discussion paper that has also dismissed rightwing theories that efforts to redistribute incomes are self-defeating.,theguardian.com,http://www.theguardian.com/business/2014/feb/26/imf-inequality-economic-growth
2014-02-26,15:39:17,1yz1a2,624,UK shells out over $8m to monitor Julian Assange — RT News,rt.com,http://rt.com/news/assange-cost-uk-8m-765/?utm_source=browser&utm_medium=aplication_chrome&utm_campaign=chrome
2014-02-26,15:31:58,1yz0un,455,Brazil champions undersea cable to bypass US,euobserver.com,http://euobserver.com/justice/123260
2014-02-26,22:07:43,1yzm5c,284,Tepco Says Fukushima Radiation ‘Significantly’ Undercounted,bloomberg.com,http://www.bloomberg.com/news/2014-02-25/tepco-says-fukushima-radiation-significantly-undercounted.html
2014-02-26,05:48:16,1yxgft,269,Ugandan Minister for Ethics & Integrity says men raping girls is natural,patheos.com,http://www.patheos.com/blogs/progressivesecularhumanist/2014/02/ugandan-minister-for-ethics-integrity-says-men-raping-girls-is-natural/?utm_content=buffer68f37&utm_medium=social&utm_source=facebook.com&utm_campaign=buffer#sthash.WUEvYTZf.dpuf
2014-02-26,20:38:51,1yzgd1,258,Scale of suffering at Syrian refugee camp is revealed by photo of huge queue for food,theguardian.com,http://www.theguardian.com/world/picture/2014/feb/26/yarmouk-refugee-camp-damascus-syria
2014-02-26,00:44:25,1ywinh,218,"Greek police enter schools, quiz children on political activities",wsws.org,http://www.wsws.org/en/articles/2014/02/25/scho-f25.html
2014-02-26,15:59:52,1yz2f5,217,Ukraine's new rulers disband riot police,reuters.com,http://www.reuters.com/article/2014/02/26/us-ukraine-crisis-berkut-idUSBREA1P0AK20140226
2014-02-26,09:47:15,1yy5xj,188,"Israel Guilty of 'Apartheid', Says Falk in Final Report",israelnationalnews.com,http://www.israelnationalnews.com/wap/Item.aspx?type=0&item=177832
2014-02-26,12:33:34,1yyn0i,172,Soviet monument in Bulgaria vandalized...again,bbc.co.uk,http://www.bbc.co.uk/news/world-europe-26346901
2014-02-26,08:07:10,1yxvey,129,Couple finds $10million in gold coins while walking their dog,independent.co.uk,http://www.independent.co.uk/news/world/americas/couple-finds-10million-in-gold-coins-while-walking-their-dog-9153126.html
2014-02-26,17:29:41,1yz6z7,125,Spanish Flamenco guitarist Paco de Lucia dies at 66,bbc.co.uk,http://www.bbc.co.uk/news/world-europe-26351251
2014-02-26,03:43:24,1yx23r,99,White House Clears Way For Complete Withdrawal From Afghanistan,buzzfeed.com,http://www.buzzfeed.com/carlomunoz/white-house-clears-way-for-complete-withdrawal-from-afghanis
2014-02-26,23:15:34,1yzs0v,97,"Geoengineering side effects could be potentially disastrous, research shows. Comparison of five proposed methods shows they are ineffective, alter weather systems or could not be safely stopped.",theguardian.com,http://www.theguardian.com/environment/2014/feb/25/geoengineering-side-effects-potentially-disastrous-scientists?CMP=twt_gu
2014-02-26,16:55:27,1yz59s,80,"Former Hong Kong Newspaper Editor Kevin Lau, who investigated the offshore companies maintained by mainland officials, Stabbed",blogs.wsj.com,http://blogs.wsj.com/chinarealtime/2014/02/26/former-hong-kong-paper-editor-stabbed/
2014-02-26,15:23:00,1yz0b3,73,'Outernet' Project Seeks Free Internet Access For Earth : Discovery News,news.discovery.com,http://news.discovery.com/tech/gear-and-gadgets/outernet-project-seeks-free-internet-access-for-earth-140225.htm?utm_source=TW&utm_medium=DNews&utm_campaign=DNewsSocial
2014-02-26,21:13:08,1yzich,65,"Killer climate: tens of thousands of flying foxes dead in a day. This summer we have seen one of the most dramatic animal die-offs ever recorded in Australia: at least 45,500 flying foxes dead on just one extremely hot day in southeast Queensland",theconversation.com,https://theconversation.com/killer-climate-tens-of-thousands-of-flying-foxes-dead-in-a-day-23227
2014-02-26,21:06:18,1yzhzg,61,"World begins 2014 with unusual number of extreme weather events. ""Next month we will publish a major report showing the likelihood of extreme heatwaves is increased 500% [with climate change].""",theguardian.com,http://www.theguardian.com/environment/2014/feb/25/world-2014-extreme-weather-events
2014-02-26,23:46:52,1yzvd6,57,"'A Perfect Storm': The Failure of Venezuela's New President - He was hand-picked by Hugo Chávez, but Nicolás Maduro has lost control of the country's economy. Vast protests are the result, but the govt in Caracas shows no signs of bending.",spiegel.de,http://www.spiegel.de/international/world/venezuela-president-maduro-faces-economic-distress-and-protests-a-955820.html
2014-02-26,01:28:14,1ywn9y,35,Ukraine synagogue hit by firebombs,timesofisrael.com,http://www.timesofisrael.com/ukraine-synagogue-hit-by-firebombs/
2014-02-26,03:20:09,1ywzms,34,"""Two photos 20 years apart show how time stood still in North Korea""",blogs.marketwatch.com,http://blogs.marketwatch.com/themargin/2014/02/25/two-photos-20-years-apart-show-how-time-stood-still-in-north-korea/
2014-02-26,04:58:02,1yxalq,26,Tin cans filled with $10 million in gold coins dating from gold rush era found buried in California,news.com.au,http://www.news.com.au/world/tin-cans-filled-with-10-million-in-gold-coins-dating-from-gold-rush-era-found-buried-in-california/story-fndir2ev-1226837801851
2014-02-26,18:56:43,1yzb1v,27,"Japan’s Lawmakers Launch Campaign Against ‘Comfort Women’ Memorial in Glendale, California",world.time.com,http://world.time.com/2014/02/25/japan-comfort-women-memorials/
2014-02-26,16:30:48,1yz42q,28,Beijing Smog Compared to Nuclear Winter,world.time.com,http://world.time.com/2014/02/26/beijing-air-pollution-nuclear-winter/
