2014-02-02,06:49:23,1wre23,2983,"Egyptian belly dancer and actress Sama Al Masry has just announced that she would run in Egypt’s upcoming parliamentary elections, and in doing so, she vowed to exact revenge on the Muslim Brotherhood.",gulfnews.com,http://gulfnews.com/news/region/egypt/belly-dancer-to-run-for-egypt-parliament-1.1284873
2014-02-02,09:46:05,1wrtrt,2677,Kangaroo court orders Indian woman to be gang-raped by 13 men for having a relationship with a man from another village,dailyrecord.co.uk,http://www.dailyrecord.co.uk/news/uk-world-news/india-gang-rape-13-men-3053392
2014-02-02,03:59:51,1wqyby,1731,"Tens of thousands of people have marched to Spain's parliament to protest against the government's new law that aims to restrict abortion, allowing the practice only in cases of rape or serious risk to health.",theguardian.com,http://www.theguardian.com/world/2014/feb/01/madrid-spain-protest-march-restrict-abortion-bill
2014-02-02,06:02:43,1wr9px,1375,$395 billion global 2012 arms sales: US dominates list of top 10 global arms sellers.,tribune.com.pk,http://tribune.com.pk/story/665877/global-2012-arms-sales-largest-arms-companies-slump-but-russia-records-jump/
2014-02-02,04:39:31,1wr23k,939,Number of men claiming to have been sexually assaulted in New Zealand rising steeply,stuff.co.nz,http://www.stuff.co.nz/national/crime/9673689/Male-sex-abuse-reporting-soars
2014-02-02,07:45:40,1wrj7k,712,How Russia is Fighting to Regain Control of Ukraine,world.time.com,http://world.time.com/2014/02/01/how-russia-is-fighting-to-regain-control-of-ukraine/
2014-02-02,02:19:58,1wqp5l,593,Boys 'rented out' for abuse at Salvation Army boys' home at Bexley in Sydney's south,abc.net.au,http://www.abc.net.au/news/2014-01-30/boys-rented-out-for-abuse-at-salvos-boys-home/5227854
2014-02-02,12:09:40,1ws5sx,537,Chief economist’s apparent suicide is the latest in a series of bizarre deaths in the financial world this week,business.financialpost.com,http://business.financialpost.com/2014/01/31/chief-economists-apparent-suicide-is-the-latest-in-a-series-of-bizarre-deaths-in-the-financial-world-this-week/
2014-02-02,21:12:52,1wsz2v,511,Palestinian workers back Scarlett Johansson's opposition to SodaStream boycott,csmonitor.com,http://www.csmonitor.com/World/Security-Watch/2014/0130/Palestinian-workers-back-Scarlett-Johansson-s-opposition-to-SodaStream-boycott-video
2014-02-02,22:44:16,1wt3zg,354,Goldman Deal Threatens Danish Government,dealbook.nytimes.com,http://dealbook.nytimes.com/2014/01/30/goldman-deal-threatens-danish-government/
2014-02-02,22:21:11,1wt2nr,350,"Australia Claims ""Substantial"" Progress on Reef Protection in Attempt to Stave Off a 'World Heritage' Downgrade, Despite Govt Approving a Massive Coal Port Expansion & the Reef's Governing Body — Under Investigation for its Links to Mining —Okaying the Dumping of Dredge Waste Within its Waters.",phys.org,http://phys.org/news/2014-02-australia-substantial-reef.html
2014-02-02,00:04:18,1wqdul,263,"Beijing Smog Contains Witches' Brew of Microbes - For people racked by dreaded ‘Beijing cough’, it's clear that particles are a health problem. But less clear is the impact — or even identity — of microbes also in the brown haze. Study reveals pathogens & allergens in city’s air.",nature.com,http://www.nature.com/news/beijing-smog-contains-witches-brew-of-microbes-1.14640
2014-02-02,20:58:34,1wsyf6,201,"Volcanic ash smothers part of Indonesia, kills 15",cnn.com,http://www.cnn.com/2014/02/01/world/asia/indonesia-volcano/index.html?sr=reddit
2014-02-02,06:40:10,1wrd5z,180,David Cameron has been accused of secretly plotting to pack public bodies with Tory supporters | The Prime Minister came under fire after Labour peer Baroness Morgan was effectively sacked as the chairwoman of schools inspectors Ofsted.,mirror.co.uk,http://www.mirror.co.uk/news/uk-news/david-cameron-accused-plot-pack-3103499
2014-02-02,22:30:31,1wt36f,141,UK’s January Flooding Surpasses All 247 Yrs of Data on the Books - Last month's seasonal total was higher than any since 1767 & 3 times the average level,theguardian.com,http://www.theguardian.com/uk-news/2014/feb/01/january-uk-wettest-winter-month-250-years
2014-02-02,21:50:08,1wt0yb,127,"Israeli security minister slams Kerry over boycott, threatens to invade Gaza",rt.com,http://rt.com/news/israel-invade-gaza-minister-540/
2014-02-02,13:02:21,1wsa1p,131,Sochi Culling Stray Dogs Ahead of the Olympics,abcnews.go.com,http://abcnews.go.com/blogs/headlines/2014/01/sochi-culling-stray-dogs-ahead-of-the-olympics/
2014-02-02,20:09:15,1wsw55,115,BBC News welcomes Chinese New Year with the message “Welcome to the year of the whores. People around the globe celebrate”,independent.co.uk,http://www.independent.co.uk/news/weird-news/chinese-new-year-bbc-blunder-welcome-to-the-year-of-the-whores-9102117.html
2014-02-02,14:34:36,1wsgkt,94,White House official urges Japan to respect history,chinadaily.com.cn,http://www.chinadaily.com.cn/world/2014-01/30/content_17266380.htm
2014-02-02,18:50:38,1wssw8,71,Teck smelter spills chemical solution into Columbia River in Canada,cbc.ca,http://www.cbc.ca/news/canada/british-columbia/teck-smelter-spills-chemical-solution-into-columbia-river-1.2519646
2014-02-02,08:51:29,1wrp2n,71,American Photojournalist James Nachtwey Shot In Thai Violence,world.time.com,http://world.time.com/2014/02/01/american-photojournalist-shot-in-thai-violence/
2014-02-02,13:56:53,1wse1j,64,Syrian Electronic Army hacks eBay and PayPal,zdnet.com,http://www.zdnet.com/ebay-and-paypal-uk-domains-hacked-by-syrian-electronic-army-7000025854/
2014-02-02,06:11:00,1wragl,65,"UK: Bullying in armed forces on rise, MoD figures reveal | Call for urgent overhaul of military justice as MP highlights plight of servicewomen alleging sexual offences",theguardian.com,http://www.theguardian.com/uk-news/2014/feb/01/bullying-on-rise-armed-forces
2014-02-02,21:50:02,1wt0xx,66,"A court in Egypt has dropped charges against more than 60 supporters of the ousted President Mohammed Morsi, who were arrested last summer",bbc.co.uk,http://www.bbc.co.uk/news/world-middle-east-26005571
2014-02-02,20:40:57,1wsxll,51,French cities brace for protests defending 'family values',france24.com,http://www.france24.com/en/20140202-france-paris-lyon-protest-manif-pour-tous-family-values/
2014-02-02,10:11:27,1wrvxn,49,Renewed rocket attack from Sinai on southern Israel,en.trend.az,http://en.trend.az/regions/met/arabicr/2236872.html
2014-02-02,18:59:03,1wst7w,45,A car belonging to a staff member of the Canadian Embassy in Ukraine was set ablaze Friday in what appeared to be retribution for her attendance at anti-government rallies in Kiev.,theglobeandmail.com,http://www.theglobeandmail.com/news/world/the-globe-in-kiev-canadian-embassy-staffers-car-torched/article16650810/
2014-02-02,23:11:39,1wt5oh,45,The Water Levels of the Middle East’s Biggest Lake Have Dropped 95% in 2 Decades,thinkprogress.org,http://thinkprogress.org/climate/2014/01/31/3234381/iran-lake-unsalvageable/
2014-02-02,04:10:41,1wqzc8,46,Ukraine and the growing number of disappeared,telegraph.co.uk,http://www.telegraph.co.uk/news/worldnews/europe/ukraine/10611822/Ukraine-and-the-growing-number-of-disappeared.html
2014-02-02,00:29:18,1wqfp6,38,Breastfeeding Is Now Required By Law In The United Arab Emirates,huffingtonpost.com,http://www.huffingtonpost.com/2014/01/30/united-arab-emirates-breastfeeding-law_n_4689740.html?utm_hp_ref=mostpopular
