2014-03-10,22:19:51,201r2d,2972,Russian troops fire at Ukraine military post,english.alarabiya.net,http://english.alarabiya.net/en/News/middle-east/2014/03/10/Russian-troops-fire-at-Ukraine-military-post.html
2014-03-10,13:07:12,200xlq,2736,The man who witnessed Steve Irwin's dying moments has described for the first time how a massive stingray wildly stabbed the conservationist 'hundreds of times'.,smh.com.au,http://www.smh.com.au/entertainment/tv-and-radio/cameraman-justin-lyons-reveals-steve-irwins-last-moments-im-dying-20140310-34h3b.html
2014-03-10,01:26:51,1zz6tr,2670,Kim Jong-un calls for execution of 33 Christians,washingtontimes.com,http://www.washingtontimes.com/news/2014/mar/6/kim-jong-un-calls-execution-33-christians/
2014-03-10,23:08:55,201v59,2221,"Ukraine may have to go nuclear, says Kiev lawmaker",usatoday.com,http://www.usatoday.com/story/news/world/2014/03/10/ukraine-nuclear/6250815/
2014-03-10,21:15:11,201m94,2115,"Ukraine crisis: US will not recognise Crimea referendum, says ambassador: Washington threatens further action against Russia if Vladimir Putin uses poll to legitimise military occupation, says Kiev envoy",theguardian.com,http://www.theguardian.com/world/2014/mar/10/ukraine-crisis-us-crimea-referendum-putin-ambassador
2014-03-10,00:11:30,1zz0hh,1765,Ukraine Sticky Post,self.worldnews,https://www.reddit.com/r/worldnews/comments/1zz0hh/ukraine_sticky_post/
2014-03-10,23:56:23,201zdp,1575,Missing Malaysia Airlines Flight MH370: Passengers' Mobile Phones Ring But Not Answered,au.news.yahoo.com,http://au.news.yahoo.com/world/a/21903251/family-phoned-passengers-on-missing-malaysia-airlines-flight/
2014-03-10,08:43:02,200ayw,1568,Mexico kills drug kingpin reported dead years ago: official,reuters.com,http://www.reuters.com/article/2014/03/09/us-mexico-drugs-idUSBREA280TS20140309
2014-03-10,21:22:19,201mrl,1358,26 Disquieting Photos Of Armed Russians Still Surrounding Ukrainian Soldiers In Crimea.,businessinsider.com,http://www.businessinsider.com/photos-of-russians-in-crimea-2014-3
2014-03-10,23:55:17,201zah,1288,Desmond Tutu: Israel guilty of apartheid in treatment of Palestinians | JPost,jpost.com,http://www.jpost.com/Diplomacy-and-Politics/Desmond-Tutu-Israel-guilty-of-apartheid-in-treatment-of-Palestinians-344874
2014-03-10,03:31:32,1zzi6z,1155,[Ukraine] A hotel and two cars belonging to Crimean Tatars have been burned down in Russian-occupied Crimea [Photos + Video],censor.net.ua,http://censor.net.ua/photo_news/274950/bandity_sojgli_dom_i_mashiny_tatarskoyi_semi_v_krymu_fotoreportajvideo
2014-03-10,16:34:08,201999,1148,"Russia ‘Welcomes’ the US Destroyer Truxtun, by Moving Bastion Anti-Ship Missiles to Crimea",defense-update.com,http://defense-update.com/20140309_russia-welcomes-us-destroyer-truxtun-moving-bastion-anti-ship-missiles-crimea.html
2014-03-10,19:44:53,201h2q,784,"Chinese courts acquitted a total of 825 people out of almost 1.16 million verdicts last year, a conviction rate of 99.93 percent.",globalpost.com,http://www.globalpost.com/dispatch/news/afp/140310/china-has-9993-percent-conviction-rate-top-court
2014-03-10,05:56:26,1zzvqj,712,"Limbs broken, forced to eat feces, Chinese officials say they were tortured into false graft confessions",bigstory.ap.org,http://bigstory.ap.org/article/china-brutality-yields-confessions-graft-2
2014-03-10,00:03:56,1zyzyd,592,Kenya's President declares to cut his salary by 20% and to cut cabinet ministers’ salaries by 10%,forbes.com,http://www.forbes.com/sites/mfonobongnsehe/2014/03/09/kenyas-wealthy-president-uhuru-kenyatta-to-take-pay-cut/
2014-03-10,13:31:23,200zb6,563,"Abuse Victims Should Be Able To Sue Catholic Church, Says Cardinal Pell",newsfeeds.com.au,http://newsfeeds.com.au/national/abuse-victims-should-be-able-to-sue-catholic-church-says-cardinal-pell/
2014-03-10,15:50:46,20179j,531,Massive Bombing near Baghdad; 97 Killed 237 Wounded Across Iraq -- Antiwar.com,original.antiwar.com,http://original.antiwar.com/updates/2014/03/09/massive-bombing-near-baghdad-97-killed-237-wounded-across-iraq/
2014-03-10,23:06:23,201ux6,331,"Sex Workers Have Labor Rights Just Like Any Other Employee, Confirms NZ Court",my.firedoglake.com,http://my.firedoglake.com/meeshellchen/2014/03/09/sex-workers-have-labor-rights-just-like-any-other-employee-confirms-nz-court/
2014-03-10,09:33:41,200fln,270,"Low levels of radiation from the Fukushima nuclear disaster likely will reach ocean waters along the U.S. West Coast next month, scientists are reporting.",usatoday.com,http://www.usatoday.com/story/news/nation/2014/03/09/scientists-test-west-coast-for-fukushima-radiation/6213849/
2014-03-10,08:14:07,2008es,154,UN warns of genocide in Central African Republic,presstv.ir,http://www.presstv.ir/detail/2014/03/09/353977/un-warns-of-muslim-genocide-in-car/
2014-03-10,10:19:55,200jtl,148,Forty-two African migrants have drowned when their boat capsized off the coast of Yemen,bbc.com,http://www.bbc.com/news/world-africa-26510160
2014-03-10,04:02:30,1zzl36,145,"Global Debt Exceeds $100 Trillion as Governments Binge, BIS Says",bloomberg.com,http://www.bloomberg.com/news/2014-03-09/global-debt-exceeds-100-trillion-as-governments-binge-bis-says.html
2014-03-10,19:06:51,201f81,145,Taiwanese Intelligence received warnings of possible terrorist attacks on Beijing's airport days prior to the disappearance of Malaysia Airlines 307,scmp.com,http://www.scmp.com/news/asia/article/1445314/warning-possible-terrorist-attack-china-received-taiwan-days-malaysia
2014-03-10,20:37:36,201jv2,140,"Malaysia’s civil aviation chief clarifies the stolen passport passengers looking like ""Mario Balotelli""",theguardian.com,http://www.theguardian.com/world/blog/2014/mar/10/malaysia-airlines-flight-370-search-continues-live-updates
2014-03-10,22:52:27,201tri,135,US transfers $429m to Israel for Iron Dome - Globes English,globes.co.il,http://www.globes.co.il/en/article-us-transfers-429m-for-iron-dome-1000923229
2014-03-10,17:57:12,201c5p,115,"Missing Malaysia Airlines plane: Police has identified one of the two suspects with stolen passports, but is not revealing his nationality. Both suspects had no record of entering Malaysia.",straitstimes.com,http://www.straitstimes.com/breaking-news/se-asia/story/missing-malaysia-airlines-plane-one-two-suspects-stolen-passports-identi
2014-03-10,00:06:00,1zz03o,116,"Five of Europe’s largest lenders (Barclays, Deutsche Bank, UBS, Royal Bank of Scotland, and HSBC) face up to another €10bn in litigation costs in the next two years due to alleged foreign exchange manipulation and other legal issues, underscoring how past misbehaviour continues to drag down profits.",ft.com,http://ft.com/cms/s/0/46f950f2-a76d-11e3-9c7d-00144feab7de.html
2014-03-10,05:02:44,1zzqos,107,"Four well preserved tombs found in Aswan, Egypt",english.ahram.org.eg,http://english.ahram.org.eg/NewsContent/9/40/95767/Heritage/Ancient-Egypt/New-Kingdom-tombs-discovered-in-Egypts-Aswan.aspx
2014-03-10,02:26:57,1zzc7y,100,BBC News - Ukraine crisis: Journalists attacked in Crimea,bbc.com,http://www.bbc.com/news/world-europe-26502356
2014-03-10,14:44:51,2013rm,99,MISSING MH370: Man Claims Possible Sighting of Airliner,nst.com.my,http://www.nst.com.my/latest/font-color-red-missing-mh370-font-man-claims-possible-sighting-of-airliner-1.505683
