2014-03-19,22:11:28,20t8e7,4401,"More Than 900 Workers Have Already Died Building Qatar’s World Cup Facilities | The International Trade Union Confederation says that if conditions don’t improve, at least 4,000 migrants will die before kick-off",smithsonianmag.com,http://www.smithsonianmag.com/smart-news/over-900-workers-have-already-died-building-qatars-world-cup-facilities-180950088/?no-ist
2014-03-19,01:08:46,20qc02,3429,"Putin's top aide mocks US sanctions: 'The only thing that interests me about the US is Tupac, and I don't need a visa for that'.",independent.co.uk,http://www.independent.co.uk/news/world/europe/vladimir-putins-top-aide-vladislav-surkov-mocks-us-sanctions-the-only-thing-that-interests-me-about-the-us-is-tupac-and-i-dont-need-a-visa-for-that-9200170.html
2014-03-19,13:28:40,20seo3,3050,"Putin on Western criticism: ""They tell us that we are violating the norms of international law. First of all, it's good that they at least remember that international law exists""",aol.com,http://www.aol.com/article/2014/03/18/putin-signs-treaty-to-add-crimea-to-map-of-russia/20852268/?icid=maing-grid7%7Cmain5%7Cdl7%7Csec1_lnk3%26pLid%3D455332
2014-03-19,23:52:58,20ticv,2678,"TED Prize winner: Rip veil off corporate criminals - Charmian Gooch, the anti-corruption crusader who co-founded Global Witness, called Tuesday night for action to lift the veil on who owns corporations around the world.",cnn.com,http://www.cnn.com/2014/03/18/opinion/ted-prize-gooch-anonymous-companies/index.html?hpt=hp_t4
2014-03-19,22:10:15,20t89q,2100,MH370 families dragged away from press conference amid claims they are being imprisoned in hotel rooms,news.ninemsn.com.au,http://news.ninemsn.com.au/world/2014/03/19/21/08/dramatic-scenes-as-mh370-families-dragged-away
2014-03-19,02:18:42,20qj9n,2080,Ukrainian Defense Ministry: military allowed to use arms to protect their lives after serviceman killed in Simferopol,kyivpost.com,http://www.kyivpost.com/content/ukraine/defense-ministry-ukrainian-military-allowed-to-use-arms-to-protect-their-lives-after-serviceman-killed-in-simferopol-339900.html
2014-03-19,12:43:04,20sbdh,1962,"Russia has told the US that Western sanctions over the Crimea dispute are unacceptable, and has threatened consequences.",bbc.com,http://www.bbc.com/news/world-europe-26641217
2014-03-19,09:58:04,20rwdy,1518,Ex-dolphin fisherman says Japan’s hunt and slaughter not age old tradition,japandailypress.com,http://japandailypress.com/ex-dolphin-fisherman-says-japans-hunt-and-slaughter-not-age-old-tradition-1845951/
2014-03-19,05:12:18,20r2fn,1440,China cuts power to North Korean island (X-post /r/NorthKoreaNews),nknews.org,http://www.nknews.org/2014/03/china-cuts-power-to-north-korean-island/
2014-03-19,22:41:05,20tb5g,1270,A man once believed to be one of Sweden's worst serial killers has been freed after spending two decades confined in a mental institution after a string of false murder confessions.,reuters.com,http://www.reuters.com/article/2014/03/19/us-sweden-murder-release-idUSBREA2I13720140319
2014-03-19,15:12:42,20skts,1248,Crimean Tatars Will Have to Vacate Land,en.ria.ru,http://en.ria.ru/world/20140319/188544777/Crimean-Tatars-Will-Have-to-Vacate-Land--Official.html
2014-03-19,23:16:15,20teis,1173,Russians reportedly attack two Ukrainian naval units in Crimea,latimes.com,"http://www.latimes.com/world/worldnow/la-fg-wn-ukraine-russia-crimea-attacks-20140319,0,800215.story"
2014-03-19,06:22:18,20ra3q,1008,Taiwan's Parliament Building now occupied by citizens (xpost from r/taiwan),reddit.com,http://www.reddit.com/r/taiwan/comments/20q7ka/taiwans_parliament_building_now_occupied_by/
2014-03-19,21:15:56,20t3nt,919,Israel’s defense minister (Moshe Ya’alon) has signaled that his country has abandoned any hope that the United States will solve the Iranian nuclear crisis diplomatically and that he – in a reported reversal – would now support Israel taking unilateral military action against the Islamic Republic.,thinkprogress.org,http://thinkprogress.org/world/2014/03/19/3416033/moshe-yaalon-iran/
2014-03-19,16:15:23,20snqv,892,"Canadian Govt is Forcing Medical Marijuana Patients to Destroy Their Weed - Starting April 1, Canada's 40,000 medical marijuana patients will no longer be able to grow their own weed. Instead, they'll have to turn to the big-time grow ops that are being built & regulated all across the country.",vice.com,http://www.vice.com/read/health-canada-is-forcing-medical-marijuana-patients-to-destroy-their-weed
2014-03-19,00:38:03,20q93x,833,German high-speed trains to be be delivered to five US states - German conglomerate Siemens has won a multi-million-dollar US contract to build high-speed locomotives. Siemens outbid major US rivals in a tender aimed at establishing the first high-speed train services in the US.,dw.de,http://www.dw.de/siemens-wins-us-high-speed-train-contract-outbids-rivals-caterpillar-ge/a-17503466
2014-03-19,00:19:47,20q7fq,748,"Ukrainian Prime Minister Yatseniuk has said the conflict in Crimea has moved from political to military stage. He has asked the defence minister to organize urgent meeting with Russian, British, US counterparts.",dw.de,http://www.dw.de/troops-near-crimean-capital-simferopol-storm-base/a-17504202
2014-03-19,03:05:47,20qofb,721,"Britain halts military cooperation and arms exports to Russia. In related news, Britain was selling arms to Russia",google.com,http://www.google.com/hostednews/afp/article/ALeqM5iejlQ3s4bNWKsLWf3WXlNvhKfdmw?docId=d3006fd7-be0d-4fc9-b322-9be18c14481e&hl=en
2014-03-19,09:01:31,20rqnu,705,American Film Crew Escapes Death in Ukraine (with video),readrussia.com,http://readrussia.com/2014/03/16/american-film-crew-escapes-death-in-mariupol/
2014-03-19,23:12:28,20te5b,633,London hospitals have treated 4000 patients for female genital mutilation since 2009,m.bbc.co.uk,http://m.bbc.co.uk/news/uk-england-london-26639542
2014-03-19,00:05:06,20q5y0,494,Moldova tells Russia: don't eye annexation here,in.reuters.com,http://in.reuters.com/article/2014/03/18/ukraine-crisis-moldova-idINDEEA2H09V20140318
2014-03-19,19:06:48,20svk1,472,Full EU Net Neutrality Proposal [pdf],dl.dropboxusercontent.com,https://dl.dropboxusercontent.com/u/7682/RegulationoftheEuropeanParliamentandoftheCouncillayingdownmeasuresconcerningtheEuropeansinglemarketforelectroniccommunicationsandtoachieveaConnectedContinent.pdf
2014-03-19,06:12:30,20r913,453,Kazakhstan recognizes Crimean independence,mfa.gov.kz,http://mfa.gov.kz/en/#!/news/article/13803
2014-03-19,07:58:54,20rkbi,410,"Turkish Airlines allegedly ships arms to Nigeria, tape reveals. An assistant executive of the airline is allegedly heard saying ""I do not know whether these (weapons) will kill Muslims or Christians. I feel sinful"" to Prime Minister Erdogan's advisor.",news.yahoo.com,http://news.yahoo.com/turkish-airlines-allegedly-ships-arms-nigeria-tape-reveals-202353840.html?soc_src=mediacontentstory
2014-03-19,22:53:57,20tcak,365,The Great War is still killing: two people dead and another two wounded in Ieper (Belgium) when a WW I shell explodes.,deredactie.be,http://www.deredactie.be/cm/vrtnieuws.english/News/140319_ieper
2014-03-19,22:24:24,20t9lu,353,China is using drones to spy on polluting industries in its attempts to battle the lung-choking smog that frequently engulfs many of its cities.,theguardian.com,http://www.theguardian.com/environment/2014/mar/19/china-drones-pollution-smog-beijing
2014-03-19,05:43:49,20r5u1,343,"Obama administration orders Syrian embassy closed, tells government to suspend its diplomatic mission in US and requires all non-US resident diplomats to leave",wjla.com,http://www.wjla.com/articles/2014/03/state-department-orders-syrian-embassy-closed-diplomats-to-leave-101271.html
2014-03-19,09:41:53,20rurl,317,Aksyonov Says Crimeans Will Face Mandatory Conscription into Russian Military in Spring,ukrainianpolicy.com,http://ukrainianpolicy.com/aksyonov-says-crimeans-will-face-mandatory-conscription-into-russian-military/
2014-03-19,01:43:39,20qfd6,261,"Malaysia Flight 370 Broke Record for Longest Disappearance In Modern Aviation, Some Experts Say Wreckage May Never Be Found",time.com,http://time.com/28960/malaysia-airlines-flight-370-search-widens-record/
2014-03-19,09:58:32,20rwfw,250,Kremlin says Crimea is now officially part of Russia after treaty signing,washingtonpost.com,http://www.washingtonpost.com/world/russias-putin-prepares-to-annex-crimea/2014/03/18/933183b2-654e-45ce-920e-4d18c0ffec73_story.html
