2014-05-15,04:56:53,25kcf2,3929,Alberta government is planning to sell off crucial caribou habitat to the energy industry just days after a federal scientific panel said the herds were in immediate danger of vanishing completely,ctvnews.ca,http://www.ctvnews.ca/canada/alberta-to-sell-off-land-that-serves-as-crucial-caribou-habitat-1.1819926#.U3KoBBAdErw.reddit
2014-05-15,18:54:35,25m4ev,3436,"Sudan woman sentenced to be hanged for apostasy for refusing to return to Islam, after marrying a Christian man",news.yahoo.com,http://news.yahoo.com/sudan-judge-sentences-christian-woman-death-apostasy-090757071.html
2014-05-15,22:31:09,25mgmx,2258,The biggest fast food strike in the history is happening around the world today,news.vice.com,https://news.vice.com/article/the-biggest-fast-food-strike-in-the-worlds-history-is-coming-tomorrow
2014-05-15,15:14:39,25lu6y,728,"Saudi Arabia: Farmers flout Mers warning by kissing camels - People are taking photos and videos of themselves kissing camels in defiance of a warning from Saudi health authorities not to go near the animals, which have been linked to the deadly Mers virus.",bbc.com,http://www.bbc.com/news/blogs-news-from-elsewhere-27393045
2014-05-15,14:49:41,25lsvb,651,US plans nearly $1 billion arms deal with Iraq,news.yahoo.com,http://news.yahoo.com/us-plans-nearly-1-billion-arms-deal-iraq-042627423.html
2014-05-15,17:27:03,25m0pi,595,Turkish PM Erdoğan’s adviser sparks outrage for kicking mourner amid Soma protests,hurriyetdailynews.com,http://www.hurriyetdailynews.com/pm-erdogans-adviser-sparks-outrage-for-kicking-mourner-amid-soma-protests.aspx?PageID=238&NID=66495&NewsCatID=341
2014-05-15,01:23:54,25jqjm,524,"Google ruling 'astonishing', says Wikipedia founder Wales",bbc.com,http://www.bbc.com/news/technology-27407017
2014-05-15,16:24:30,25lxtg,451,Australia's Minister For Education Just Called The Opposition Leader A Cunt In Parliament,buzzfeed.com,https://www.buzzfeed.com/bradesposito/c-u-next-tuesday?bffb
2014-05-15,05:34:45,25kghp,435,"Train from Kaliningrad, Russia Halted at Lithuanian Border for Bearing Soviet Symbols",thetrumpet.com,https://www.thetrumpet.com/article/11759.19.0.0/europe/russian-train-bearing-soviet-symbols-halted-in-lithuania
2014-05-15,17:37:40,25m14u,346,Turkish mine disaster: PM Erdogan's car attacked,bbc.com,http://www.bbc.com/news/world-europe-27415296
2014-05-15,14:11:38,25lqfv,326,South Korea Officials Enact De Facto SOPA Regime to Block Foreign Websites -- Its takedown system mirrors the SOPA provision on copyright holders being empowered to compel ISPs to block foreign sites through a simple allegation of copyright infringement,eff.org,https://www.eff.org/deeplinks/2014/05/south-korea-officials-enact-de-facto-sopa-regime-block-foreign-websites
2014-05-15,19:16:56,25m5ez,313,Russia Scores Massive Gas Pipeline Deal With China,businessinsider.com,http://www.businessinsider.com/russia-scores-massive-gas-pipeline-deal-with-china-2014-5
2014-05-15,14:26:12,25lrfq,306,Anti-China riots turn deadly in Vietnam | 20 or more killed,theguardian.com,http://www.theguardian.com/world/2014/may/15/anti-china-riots-turn-deadly-in-vietnam
2014-05-15,00:20:11,25jkfq,267,Turkish PM cites 19th-century Britain to prove mine accidents are ‘typical’,hurriyetdailynews.com,http://www.hurriyetdailynews.com/turkish-pm-cites-19th-century-britain-to-prove-mine-accidents-are-typical.aspx?pageID=517&nID=66472&NewsCatID=338
2014-05-15,00:00:50,25jimz,242,238 dead in Turkey coal mine explosion,news.msn.com,http://news.msn.com/world/238-dead-in-turkey-coal-mine-explosion
2014-05-15,19:19:19,25m5is,224,"Brazil laundering illegal timber on a 'massive and growing scale': Greenpeace investigation uncovers evidence that illegally logged timber is being sold on to buyers in the UK, US, Europe and China",theguardian.com,http://www.theguardian.com/environment/2014/may/15/brazil-laundering-illegal-timber-on-a-massive-and-growing-scale
2014-05-15,23:30:26,25mlnl,216,German undercover agent dies in mysterious circumstances: “Corelli” was due to appear in the Munich court to give evidence on the workings of the neo-Nazi National Socialist Underground.,wsws.org,https://www.wsws.org/en/articles/2014/05/15/core-m15.html
2014-05-15,23:29:44,25mlln,196,Fast food workers strike for higher wages: Protesters in several dozen countries join in a united call for wages of $15 an hour and the right to form a union,battlecreekenquirer.com,http://www.battlecreekenquirer.com/usatoday/article/9114245
2014-05-15,05:20:21,25keyf,185,"Road Work Reveals Ancient Treasure Trove of 9,000 Years of Scottish History",scotsman.com,http://www.scotsman.com/lifestyle/heritage/dunragit-road-works-unearth-ancient-treasure-trove-1-3410720
2014-05-15,19:32:35,25m65h,187,Turkish miners who took shelter inside the only refuge chamber available at the Soma mine used oxygen masks in turns before perishing,hurriyetdailynews.com,http://www.hurriyetdailynews.com/miners-used-their-last-breath-in-turns-in-somas-sole-refuge-chamber-rescuers-say.aspx?pageID=238&nID=66505&NewsCatID=341
2014-05-15,19:19:50,25m5jo,175,"Kuwait, a U.S. ally on Syria, is also the leading funder of extremist rebels",spondasud.it,http://spondasud.it/2014/04/kuwait-a-u-s-ally-on-syria-is-also-the-leading-funder-of-extremist-rebels-646
2014-05-15,06:51:20,25kob1,154,"Atlantic Current Strength Declines - The Atlantic Meridional Overturning Circulation (AMOC) is part of the great ocean ‘conveyor belt’ that ceaselessly circulates sea water, heat and nutrients around the globe.",scientificamerican.com,http://www.scientificamerican.com/article/atlantic-current-strength-declines/
2014-05-15,02:29:39,25jx8k,152,Afghan Taliban commander linked to Pakistani spy agency,thewarstreetjournal.com,http://www.thewarstreetjournal.com/2014/05/14/new-taliban-commander-isi/
2014-05-15,01:14:41,25jpoz,147,News of the World royal editor: I hacked Kate Middleton 155 times,theguardian.com,http://www.theguardian.com/uk-news/2014/may/14/news-world-kate-middleton-phone-hacking-trial
2014-05-15,09:03:25,25l0qy,131,Trade unions in Turkey have announced a one-day strike in protest at the country's worst ever mine disaster which has claimed at least 274 lives.,bbc.co.uk,http://www.bbc.co.uk/news/world-europe-27415822
2014-05-15,23:21:18,25mku5,129,China and Russia beat US in new corporate transparency report,icij.org,http://www.icij.org/blog/2014/05/china-russia-beat-us-new-corporate-transparency-report
2014-05-15,20:42:47,25m9k0,86,"Ecuador's Plan to Drill in the Amazon Is Moving Ahead, Despite Opposition",motherboard.vice.com,http://motherboard.vice.com/read/ecuador-is-ignoring-citizens-pleas-to-stop-oil-drilling-in-the-amazon
2014-05-15,14:18:10,25lqwj,87,Russian missile ship barred from Israeli port over Ukraine crisis. Official said Israel strives to maintain neutrality in the big powers’ confrontation over Ukraine,haaretz.com,http://www.haaretz.com/mobile/.premium-1.590482?v=3A23FF11932F39F3E2B19AEE531F4DE8
2014-05-15,15:19:35,25lugp,48,IPCC reports 'diluted' under 'political pressure' to protect fossil fuel interests,theguardian.com,http://www.theguardian.com/environment/earth-insight/2014/may/15/ipcc-un-climate-reports-diluted-protect-fossil-fuel-interests
2014-05-15,18:34:01,25m3hv,41,"Hundreds of Chinese enter Cambodia, fleeing Vietnam violence: police | Reuters",reuters.com,http://www.reuters.com/article/2014/05/15/us-vietnam-china-border-idUSBREA4E05520140515
