2014-08-24,03:00:52,2edq27,18068,IS threatens to destroy world's largest buddhist temple. Indonesia - the world's largest Muslim country - pledges to protect the temple.,pangeatoday.com,http://www.pangeatoday.com/isis-threatens-to-destroy-worlds-largest-buddhist-temple/?orderBy=popular
2014-08-24,22:41:02,2efyjg,12763,"The president of Indonesia, the world's most populous Muslim-majority country, has called the ISIS militants ""embarrassing"" to the religion and urged Islamic leaders to unite in tackling extremism.",channelnewsasia.com,http://www.channelnewsasia.com/news/asiapacific/indonesia-president-says/1322874.html
2014-08-24,00:35:31,2edd0o,2166,London rapper turned jihadist believed to be under investigation for murder of American journalist in Syria,independent.co.uk,http://www.independent.co.uk/news/world/middle-east/james-foley-beheading-london-rapper-turned-jihadist-believed-to-be-under-investigation-for-murder-of-american-journalist-in-syria-9687216.html
2014-08-24,22:58:06,2efzlq,1822,Iran 'shoots down Israeli drone',bbc.com,http://www.bbc.com/news/world-middle-east-28920361
2014-08-24,12:04:19,2eeztq,1395,Indian Army rushes more troops to the border as Pakistan intensifies cross-border shelling,timesofindia.indiatimes.com,http://timesofindia.indiatimes.com/india/Army-rushes-more-troops-as-Pakistan-intensifies-cross-border-shelling-in-Jammu-Kashmir/articleshow/40793688.cms
2014-08-24,13:39:19,2ef771,1175,US Gives Intelligence To Assad For Targetting ISIS Commanders,ibtimes.co.uk,http://www.ibtimes.co.uk/us-gives-intelligence-assad-targetting-isis-commanders-1462375
2014-08-24,22:21:29,2efxbw,959,"German kidnapped in Syria by ISIS militants has been released after a ""substantial consideration""",dailystar.com.lb,http://www.dailystar.com.lb/News/Middle-East/2014/Aug-24/268289-kidnapped-german-released-in-syria-report.ashx
2014-08-24,20:29:55,2efrrq,773,Unidentified jets attack targets in Tripoli,aljazeera.com,http://www.aljazeera.com/news/middleeast/2014/08/unidentified-jets-attack-targets-tripoli-20148241186235559.html
2014-08-24,04:27:56,2edxzy,757,"'Thanks, Putin!': Finland flooded with cut-price 'Putin cheese' as Russia turns away European exports",independent.co.uk,http://www.independent.co.uk/news/world/europe/thanks-putin-finland-flooded-with-cutprice-putin-cheese-as-russia-turns-away-european-exports-9686238.html
2014-08-24,04:41:08,2edz71,577,Rocket fired from Lebanon at northern Israel,haaretz.com,http://www.haaretz.com/news/diplomacy-defense/1.612036
2014-08-24,23:00:07,2efzqq,489,Separatists put Ukrainian captives on show in Donetsk,af.reuters.com,http://af.reuters.com/article/energyOilNews/idAFL5N0QU0FA20140824
2014-08-24,00:08:57,2edaus,470,"Swedish Nationalists Rise as Influx of Syrian Refugees Grows: The Sweden Democrats, a nationalist party that targets deep cuts to immigration, is poised to double its support in elections next month as Swedes prepare for a change of government.",bloomberg.com,http://www.bloomberg.com/news/2014-08-20/swedish-nationalists-rise-as-record-immigration-stirs-backlash.html
2014-08-24,11:58:41,2eezck,456,Isis surges towards the borders of Turkey,theguardian.com,http://www.theguardian.com/world/2014/aug/23/isis-islamic-state-surges-to-turkish-border
2014-08-24,19:13:35,2efocy,458,"Italy finds 19 boat migrants dead, saves over 3,500 since Friday: navy",reuters.com,http://www.reuters.com/article/2014/08/24/us-italy-migrants-idUSKBN0GO08C20140824?feedType=RSS&feedName=worldNews
2014-08-24,22:08:48,2efwn6,363,"Briton infected with Ebola in Sierra Leone is being evacuated to the UK, the African country's health ministry says",bbc.co.uk,http://www.bbc.co.uk/news/uk-28919831
2014-08-24,01:10:13,2edg00,324,Fleeing Iraqi Christians reveal horror of Islamic State,news.yahoo.com,http://news.yahoo.com/fleeing-iraqi-christians-reveal-horror-islamic-state-191611943.html;_ylt=AwrBJSCdofdT9nAAyZHQtDMD
2014-08-24,02:48:01,2edowy,316,Iranian Kurds Joining Fight Against IS,rudaw.net,http://rudaw.net/english/kurdistan/230820142
2014-08-24,15:29:56,2efe4u,307,Rice Bucket Challenge to help the poor in India,thehindu.com,http://www.thehindu.com/news/national/now-rice-bucket-challenge-goes-viral/article6345407.ece
2014-08-24,20:15:24,2efr44,298,Three wounded by mortar attack on Erez border crossing between Israel and Gaza,ynetnews.com,"http://www.ynetnews.com/articles/0,7340,L-4562669,00.html"
2014-08-24,23:52:50,2eg3jn,281,Ten injured at Malmö anti-Nazi demonstration: A planned manifestation against the neo-Nazi Party of the Swedes spiralled out of control on Saturday in Malmö as police and protesters clashed leading to several injuries.,thelocal.se,http://www.thelocal.se/20140823/ten-injured-at-malm-anti-nazi-demonstration
2014-08-24,19:53:43,2efq40,268,"Iceland's Bardarbunga Volcano Update: Eruption in Progress, Airspace Over Volcano Closed",weather.com,http://www.weather.com/news/icelands-bardarbunga-volcano-update-eruption-progress-20140823
2014-08-24,07:48:07,2eefi2,254,"China shuts down the Beijing Independent Film Festival, seizing documents and films from organizers' office and hauling away two event officials",cnsnews.com,http://www.cnsnews.com/news/article/china-shuts-down-beijing-independent-film-festival
2014-08-24,04:20:36,2edxci,229,"Hundreds of Iranian troops crossed border to join battle against Islamic State group, sources tell Al Jazeera.",aljazeera.com,http://www.aljazeera.com/news/middleeast/2014/08/iran-soldiers-iraq-islamic-state-2014823161322258630.html
2014-08-24,10:38:18,2eet64,218,PA slams Hamas executions of alleged collaborators,maannews.net,http://www.maannews.net/eng/ViewDetails.aspx?ID=722656
2014-08-24,22:11:41,2efwrz,184,"""Terrorists"" seized Tripoli airport: Libya's parliament",english.al-akhbar.com,http://english.al-akhbar.com/content/terrorists-seized-tripoli-airport-libyas-parliament
2014-08-24,06:32:19,2ee940,169,Hamas executes four more in Gaza in warning to spies,business-standard.com,http://www.business-standard.com/article/pti-stories/hamas-executes-four-more-in-gaza-in-warning-to-spies-114082400022_1.html#.U_kISVQ7vSA.reddit
2014-08-24,03:11:50,2edr26,160,LiveLeak Bans Islamic State Beheading Videos After James Foley Murder,usnews.com,http://www.usnews.com/news/articles/2014/08/22/liveleak-bans-islamic-state-beheading-videos-after-james-foley-murder
2014-08-24,21:13:31,2eftuy,159,Developers Installed 'Poor Doors' and 'Rich Doors' On a Block of London Flats | VICE United Kingdom,vice.com,http://www.vice.com/en_uk/read/one-commercial-street-poor-door-protest-101
2014-08-24,14:48:02,2efbq0,154,Strong 6.4-magnitude quake jolts central Chile,indianexpress.com,http://indianexpress.com/article/world/americas/strong-6-4-magnitude-quake-jolts-central-chile/
2014-08-24,06:03:38,2ee6le,148,China Denies Confrontation With U.S. Surveillance Plane,nytimes.com,http://www.nytimes.com/2014/08/24/world/asia/china-denies-confrontation-with-us-surveillance-plane-.html?smid=re-share
