2014-04-13,09:35:29,22w37z,3172,"Journalists who broke NSA story in Guardian, accept, dedicate their George Polk award to Edward Snowden",theguardian.com,http://www.theguardian.com/world/2014/apr/11/journalists-nsa-guardian-polk-award-snowden
2014-04-13,18:59:17,22wy2n,2600,1 Ukraine officer killed and 4 others injured as Ukraine begins Anti-Terrorist operations in East Ukraine,washingtonpost.com,http://www.washingtonpost.com/world/europe/uniformed-men-occupy-donetsk-police-hq/2014/04/12/1547324c-c2a0-11e3-9ee7-02c1e10a03f0_story.html
2014-04-13,10:34:07,22w7fg,1865,"Obama Lets N.S.A. Exploit Some Internet Flaws, Officials Say",nytimes.com,http://www.nytimes.com/2014/04/13/us/politics/after-heartbleed-bug-obama-decides-us-should-reveal-internet-security-flaws.html?ref=world
2014-04-13,03:42:13,22vbpz,1452,"Women who have sex before marriage should be hanged, says senior politician in India's Socialist Party",telegraph.co.uk,http://www.telegraph.co.uk/news/worldnews/asia/india/10762531/Women-who-have-sex-before-marriage-should-be-hanged-says-senior-politician-in-Indias-Socialist-Party.html
2014-04-13,23:36:16,22xanm,1431,Canadian mail service to scrap all home deliveries - Older residents angered over cost-cutting decision by Canada Post to make first G20 country without door-to-door service,theguardian.com,http://www.theguardian.com/world/2014/apr/13/canada-mail-service-scrap-home-deliveries
2014-04-13,07:03:38,22vrry,1266,"If China invaded the Japan-held Senkaku Islands, U.S. Marines in the Pacific would swiftly recapture them, the commander of marines deployed in Japan assured.",japantimes.co.jp,http://www.japantimes.co.jp/news/2014/04/12/world/if-china-grabs-senkakus-u-s-military-would-snatch-them-back-top-marine-commander/
2014-04-13,19:50:36,22wzvl,856,Major Climate Change Report: averting catastrophe is affordable - Landmark UN analysis concludes catastrophic climate change can be averted without sacrificing living standards. Dismisses fears that slashing carbon emissions would wreck the world economy.,theguardian.com,http://www.theguardian.com/environment/2014/apr/13/averting-climate-change-catastrophe-is-affordable-says-ipcc-report-un
2014-04-13,04:47:58,22vgzq,789,Ukraine open discussion thread (Sticky post #8),self.worldnews,https://www.reddit.com/r/worldnews/comments/22vgzq/ukraine_open_discussion_thread_sticky_post_8/
2014-04-13,02:53:57,22v7ow,356,Risk of 'gas war' grows as Ukraine halts payments to Russia,theglobeandmail.com,http://www.theglobeandmail.com/news/world/armed-protesters-seize-police-station-in-eastern-ukrainian-town/article17949421/
2014-04-13,23:11:03,22x91o,349,"Japan orders slaughter of 112,000 chickens after H5 strain of bird flu detected",newsonjapan.com,http://newsonjapan.com/html/newsdesk/article/107226.php
2014-04-13,01:59:12,22v3gp,258,​US corn exports to China drop 85 percent after ban on GMO strains – industry report,rt.com,http://rt.com/usa/china-gmo-corn-ban-120/
2014-04-13,00:39:38,22uxgf,248,Spanish village called ‘kill Jews’ mulls name change,timesofisrael.com,http://www.timesofisrael.com/spanish-village-called-kill-jews-mulls-name-change/
2014-04-13,14:29:16,22wn43,245,Mexico prepares 1st illegal drug financing blacklist. Mexico is preparing to implement new regulations that will allow the government to identify individuals and businesses linked to drug trafficking and ban financial firms from doing business with them.,reuters.com,http://www.reuters.com/article/2014/04/13/us-mexico-drugs-idUSBREA3C02T20140413
2014-04-13,21:14:10,22x31n,246,Egyptian police 'using rape as a weapon' against dissident groups,theguardian.com,http://www.theguardian.com/world/2014/apr/12/egypt-police-rape-dissidents-crackdown-16000-arrested?CMP=fb_gu
2014-04-13,23:50:29,22xbqj,220,"Gerhard Schroeder has admitted that ""like the situation in Crimea,"" the NATO attack on Serbia in 1999 was also a violation of international law.",b92.net,http://www.b92.net/eng/news/world.php?yyyy=2014&mm=03&dd=10&nav_id=89568
2014-04-13,08:48:06,22vzqb,199,Israel's seizure of EU-funded aid projects prompts compensation calls,theguardian.com,http://www.theguardian.com/global-development/2014/apr/12/israel-seizure-eu-aid-projects-compensation-calls
2014-04-13,11:39:04,22wc3a,163,South Korea And United States Hold Largest Ever Joint Air Drill,thediplomat.com,http://thediplomat.com/2014/04/south-korea-united-states-hold-largest-ever-joint-air-drill/
2014-04-13,11:00:29,22w9e1,144,"Eike Batista, who was Brazil's richest man for most of the past decade, is under investigation by securities industry watchdog CVM for allegedly engaging in insider trading while he chaired his now-bankrupt oil-producing and shipbuilding firms.",reuters.com,http://www.reuters.com/article/2014/04/11/us-brazil-batista-cvm-idUSBREA3A1W120140411
2014-04-13,02:53:13,22v7ms,101,JPMorgan profits fall 19% as mortgage business fades,bbc.co.uk,http://www.bbc.co.uk/news/business-26987382#sa-ns_mchannel=rss&ns_source=PublicRSS20-sa
2014-04-13,22:20:36,22x63j,96,Second strong earthquake hits Solomon Islands,ctvnews.ca,http://www.ctvnews.ca/world/second-strong-earthquake-hits-solomon-islands-1.1773822#.U0qPEdAcZGU.reddit
2014-04-13,14:01:03,22wlhh,89,"IDF officer dismissed for approving soldiers' anti-Arab T-shirts: Shirts featured the slogan 'Nablus, we are coming!’ and warned Arab mothers that their sons’ fates lay in Israeli soldiers’ hands.",haaretz.com,http://www.haaretz.com/news/diplomacy-defense/1.585281
2014-04-13,05:42:27,22vlce,87,Ukraine prepares armed response as city seized by pro-Russia forces,reuters.com,http://reuters.com/article/idUSBREA3A1B520140412?irpc=932&irpc=932
2014-04-13,03:24:28,22va98,84,Ukraine crisis: Kramatorsk shooting reported,bbc.com,http://www.bbc.com/news/world-europe-27005783
2014-04-13,01:33:31,22v1kq,79,"Just two months before Brazil is to host the World Cup soccer tournament in Rio de Janeiro and other cities, police officers used tear gas and rubber bullets to disperse thousands of families, squatting in a complex of abandoned commercial buildings.",nytimes.com,http://www.nytimes.com/2014/04/12/world/americas/clashes-in-rio-de-janeiro-as-police-evict-squatters.html?hp&_r=0
2014-04-13,08:53:33,22w04o,73,Joe Biden to travel to Ukraine,politico.com,http://www.politico.com/story/2014/04/joe-biden-ukraine-travel-105655.html?hp=l4
2014-04-13,07:26:32,22vtir,65,Ukraine Links New Attacks in East to 'External Aggression' by Russia,voanews.com,http://www.voanews.com/content/ukraine-links-new-attacks-in-east-to-external-aggression-by-russia/1892223.html
2014-04-13,22:13:26,22x5q9,56,Turkish jets scramble Russian intel plane,hurriyetdailynews.com,http://www.hurriyetdailynews.com/turkish-jets-scramble-russian-intel-plane.aspx?pageID=238&nID=64984&NewsCatID=341
2014-04-13,20:22:50,22x11r,56,"Incredible Photos of Fukushima's Post-Apocalyptic Abandoned Landscape--Taken by Drone - 3 yrs after the vicious tsunami devastated Japan, University of Tokyo researchers are using UAVs to map the radioactive cleanup progress.",fastcoexist.com,http://www.fastcoexist.com/3028872/world-changing-ideas/incredible-photos-of-fukushimas-abandoned-post-apocalyptic-landscape-ta
2014-04-13,12:15:32,22wenf,50,Russia won't import genetically-modified food - PM Medvedev,voiceofrussia.com,http://voiceofrussia.com/news/2014_04_06/Russia-wont-import-genetically-modified-food-PM-Medvedev-2668/
2014-04-13,21:42:47,22x4b0,45,25 countries attend secretive anti-BDS meeting in London,middleeastmonitor.com,https://www.middleeastmonitor.com/news/europe/10855-25-countries-attend-london-anti-bds-meeting
