2015-08-24,21:57:59,3i73px,77473,"Twitter has forced 30 websites that archive politician's deleted tweets to shut down, removing an effective tool to keep politicians honest",theverge.com,http://www.theverge.com/2015/8/24/9196969/twitter-shuts-down-politwoops-diplotwoops
2015-08-24,07:09:28,3i4lst,62146,"The police officer who leaked the footage of the surfers paradise police brutality, where the victims blood was washed away by officers, has been criminally charged for bringing it to the publics view. Officers who did the bashing get nothing.",sydneycriminallawyers.com.au,http://www.sydneycriminallawyers.com.au/blog/honest-cop-charged-with-misconduct/
2015-08-24,11:31:02,3i5izh,11798,"The Australian Stock Market has plunged 2.5% in the first 20 minutes of opening for the week, losing $20 billion. The Chinese Stock Market has dropped 7% just an hour after opening, and the ripple effects are starting to be seen worldwide as markets open",9news.com.au,http://www.9news.com.au/national/2015/08/24/12/02/australian-share-market-tumbles-losing-billions-of-dollars-within-an-hour-of-opening
2015-08-24,05:10:00,3i45o7,12633,Chinese troops head to border with North Korea,wantchinatimes.com,http://www.wantchinatimes.com/news-subclass-cnt.aspx?id=20150823000133&cid=1101
2015-08-24,23:22:56,3i7dpk,9836,Two Ashley Madison clients reported to have taken their lives after hackers published their details - Canada police,bbc.com,http://www.bbc.com/news/technology-34044506?ns_mchannel=social&ns_campaign=bbc_breaking&ns_source=twitter&ns_linkname=news_central
2015-08-24,19:06:03,3i6o7p,8461,South Korea vows not to turn off its loudspeakers at the border unless North Korea apologizes,nytimes.com,http://www.nytimes.com/2015/08/25/world/asia/south-korea-vows-not-to-back-down-in-military-standoff-with-north.html?smid=tw-nytimesworld&smtyp=cur
2015-08-24,03:44:55,3i3ui1,5257,S. Korea Detects Unusual Submarine Activity From North as Envoys Meet,nbcnews.com,http://www.nbcnews.com/news/world/s-korea-detects-unusual-submarine-activity-north-envoys-meet-n414446
2015-08-24,11:59:50,3i5m9y,4574,"Twitter has killed Politwoops, which monitored politicians’ deleted tweets in 30 countries",thenextweb.com,http://thenextweb.com/twitter/2015/08/23/speak-truth-to-power-just-not-on-twitter/
2015-08-24,02:00:08,3i3gqd,3578,Multiple explosions reported at US military facility in Japan,wsoctv.com,http://www.wsoctv.com/news/news/national/reports-explosions-near-military-facility-japan/nnPrQ/
2015-08-24,22:57:27,3i7akx,2540,Earth is on track to lose an India-sized chunk of its tropical forests by mid-century,washingtonpost.com,http://www.washingtonpost.com/news/energy-environment/wp/2015/08/24/earth-is-on-track-to-lose-an-india-sized-chunk-of-its-tropical-forests-by-mid-century/
2015-08-24,01:31:03,3i3czw,1887,"Train gunman's lawyer: He only meant to rob people, found Kalashnikov in a park near train station",nbcnews.com,http://www.nbcnews.com/news/world/what-terror-train-gunman-wanted-rob-people-lawyer-says-n414451
2015-08-24,20:05:34,3i6sz4,1796,"Boy stumbles, leaves hole in valuable painting at Da Vinci exhibit in Taipei.",m.focustaiwan.tw,http://m.focustaiwan.tw/news/aedu/201508240015.aspx
2015-08-24,21:13:15,3i6z4p,1635,Pokemon World Championship: Police seize firearms and arrest two men who promised to 'kill the competition',independent.co.uk,http://www.independent.co.uk/news/world/americas/police-seize-firearms-arrest-two-men-who-promised-to-kill-the-competition-at-pokmon-world-championship-10468759.html
2015-08-24,10:23:06,3i5atg,1573,South Korea resumes loudspeaker operations Moday morning,world.kbs.co.kr,http://world.kbs.co.kr/english/news/news_IK_detail.htm?No=112866&id=IK
2015-08-24,01:02:36,3i39jd,1486,No Sign of End to Korea Talks as Kim Steps Up Force Mobilization,bloomberg.com,http://www.bloomberg.com/news/articles/2015-08-23/koreas-resume-high-level-talks-as-kim-keeps-army-on-war-footing
2015-08-24,21:37:05,3i71fn,1335,"World's fastest-melting glacier loses massive chunk in 2 days. ""This glacier alone could contribute more to sea level rise than any other single feature in the Northern Hemisphere,"" NASA stated on its website.",mashable.com,http://mashable.com/2015/08/23/greenland-glacier-massive-loss/
2015-08-24,23:23:24,3i7drq,1279,Protests reject TPP as corporate power grab,greenleft.org.au,https://www.greenleft.org.au/node/59842
2015-08-24,04:16:22,3i3yp1,1151,U.K. Orders Google To Forget 9 News Articles About The “Right To Be Forgotten”,consumerist.com,http://consumerist.com/2015/08/21/u-k-orders-google-to-forget-9-news-articles-about-the-right-to-be-forgotten/
2015-08-24,20:59:24,3i6xsb,1034,Russian ruble collapses to 7-month low on weak oil prices,usnews.com,http://www.usnews.com/news/business/articles/2015/08/24/russian-ruble-collapses-to-7-month-low-on-weak-oil-prices
2015-08-24,21:52:11,3i732q,979,"'I'm very scared': Russians brace for a ban on medical imports - The proposed ban has sparked dismay in Russia, where many hospitals are woefully underequipped",businessinsider.com,http://www.businessinsider.com/im-very-scared-russians-brace-for-a-ban-on-medical-imports-2015-8
2015-08-24,03:36:23,3i3tec,772,Tension grows over 'lost' North Korean submarines as South Korea searches for vessels,independent.co.uk,http://www.independent.co.uk/news/world/asia/tension-grows-over-lost-north-korean-submarines-as-south-korea-searches-for-vessels-10468417.html
2015-08-24,15:19:39,3i66pm,660,Kim Jong-un snubs China's invitation to military parade,english.yonhapnews.co.kr,http://english.yonhapnews.co.kr/national/2015/08/24/0301000000AEN20150824006800315.html
2015-08-24,04:03:46,3i3x0v,579,U.S. confirms that Islamic State used mustard gas in a mortar attack on Kurdish forces in Makhmour on August 11th,militarytimes.com,http://www.militarytimes.com/story/military/2015/08/21/isis-used-mustard-gas-makhmour-against-kurds/32116637
2015-08-24,06:28:11,3i4g74,572,"‘Chances Of Agreement From Inter-Korean Talks Not High’, S. Korea, US Raise WATCHCON to Level 2",investmentwatchblog.com,http://investmentwatchblog.com/urgent-chances-of-agreement-from-inter-korean-talks-not-high-s-korea-us-raise-watchcon-to-level-2/
2015-08-24,02:45:46,3i3mpj,510,ISIS Offers Reward for Killing Al Qaeda Leader,israelnationalnews.com,http://www.israelnationalnews.com/News/News.aspx/199812
2015-08-24,20:34:47,3i6vfh,491,"WWII Shipwreck ""Still Bleeding Oil"" - Oceanliner that hit German mine poses as big an environmental threat as the Rena - RMS Niagara could hold a store of oil that ""is an ecological time bomb. It's out of sight, out of mind. We know it's bunker oil that's coming up, we've taken samples.""",m.nzherald.co.nz,http://m.nzherald.co.nz/northern-advocate/news/article.cfm?c_id=1503450&objectid=11501886
2015-08-24,21:50:07,3i72uw,478,Ukraine's Poroshenko: 'New Russia' is like 'Mordor',bbc.com,http://www.bbc.com/news/world-europe-34037743
2015-08-24,11:53:07,3i5lic,468,Park urges N. Korea to apologize for provocations,english.yonhapnews.co.kr,http://english.yonhapnews.co.kr/northkorea/2015/08/24/0401000000AEN20150824001652315.html
2015-08-24,02:03:09,3i3h6g,450,"Train gunman 'dumbfounded' by terrorist tag, says was hungry",reuters.com,http://www.reuters.com/article/2015/08/23/us-france-train-shots-lawyer-idUSKCN0QS0HF20150823
2015-08-24,17:13:08,3i6fps,412,(2nd LD) N. Korea deploys about 20 air-cushion landing crafts in Yellow Sea border,english.yonhapnews.co.kr,http://english.yonhapnews.co.kr/news/2015/08/24/0200000000AEN20150824009000315.html
