2015-11-08,03:56:53,3rx90m,15797,A new report suggests that the marriage of AI and robotics could replace so many jobs that the era of mass employment could come to an end,theguardian.com,http://www.theguardian.com/business/2015/nov/07/artificial-intelligence-homo-sapiens-split-handful-gods
2015-11-08,22:44:15,3s0bj1,2179,‘Muslims are dangerous’: Myanmar Buddhist monks threaten democracy with support for anti-Muslim laws,news.nationalpost.com,http://news.nationalpost.com/news/muslims-are-dangerous-myanmar-buddhist-monks-threaten-democracy-with-support-for-anti-muslim-laws
2015-11-08,22:19:24,3s092w,2166,France lifts ban on gay men as blood donors - CNN.com,edition.cnn.com,http://edition.cnn.com/2015/11/04/europe/france-gay-blood-donors/index.html
2015-11-08,21:59:46,3s075k,1891,India sues the Queen for return of 'stolen' £100m Koh-i-Noor diamond,independent.co.uk,http://www.independent.co.uk/news/uk/home-news/india-sues-the-queen-for-return-of-stolen-100m-koh-i-noor-diamond-a6725951.html
2015-11-08,20:00:09,3rzxrh,1884,Pakistani college hires transgender staff in an effort to promote acceptance,en.dailypakistan.com.pk,http://en.dailypakistan.com.pk/pakistan/nca-hires-transgender-staff-in-an-effort-to-promote-acceptance-389/
2015-11-08,07:39:05,3ry2wd,1456,Peru is creating a national park to protect a vast territory in the Amazon basin that is vulnerable to drug trafficking and illegal logging and mining,france24.com,http://www.france24.com/en/20151107-peru-creates-huge-national-park-amazon-basin
2015-11-08,23:45:43,3s0iiw,1430,"VW engineers have admitted manipulating CO2 emissions data -- ""VW engineers tampered with tyre pressure and mixed diesel with their motor oil to make them use less fuel, a deception that began in 2013 and carried on until the spring of this year""",reuters.com,http://www.reuters.com/article/2015/11/08/volkswagen-emissions-idUSL8N1320KD20151108#VXAscFfJVB3tZdZm.97
2015-11-08,16:56:09,3rzm2t,1271,First women to stand for election in Saudi Arabia,dailylife.com.au,http://www.dailylife.com.au/news-and-views/news-features/first-women-to-stand-for-election-in-saudi-arabia-20151106-gkt6ra.html
2015-11-08,04:35:55,3rxe9s,1201,"""Germany 'systematically spied' on own allies on grand scale""",rt.com,https://www.rt.com/news/321183-germany-spying-surveillance-bnd/
2015-11-08,19:19:32,3rzv3o,988,"Russia has returned 11,000 of its tourists from Egypt in the last 24 hours in response to the plane crash in the Sinai Peninsula a week ago, RIA news agency said on Sunday, but tens of thousands more are waiting for flights home.",reuters.com,http://www.reuters.com/article/2015/11/08/us-egypt-crash-russia-flights-tourists-idUSKCN0SX07D20151108?feedType=RSS&feedName=topNews
2015-11-08,21:08:20,3s02it,767,'Nazi gold train' investigators start excavating site in Poland,theguardian.com,http://www.theguardian.com/world/2015/nov/08/nazi-gold-train-investigators-start-excavating-poland
2015-11-08,13:09:25,3rz4tl,710,U.S. official: '99.9% certain' bomb felled Metrojet flight,edition.cnn.com,http://edition.cnn.com/2015/11/07/middleeast/russian-plane-crash-egypt-sinai/index.html
2015-11-08,07:34:45,3ry2cg,560,"A report into claims of doping cover-ups, extortion and money-laundering in athletics will show ""a whole different scale of corruption"" even compared to FIFA",bbc.com,http://www.bbc.com/sport/0/athletics/34752212
2015-11-08,07:56:27,3ry54t,481,"Thousands march in Berlin anti-refugee demo: Some 5,000 supporters of the right-wing Alternative for Germany (AfD) have protested in Berlin against Germany's refugee policy. The demonstrators called for Chancellor Angela Merkel to step down",dw.com,http://www.dw.com/en/thousands-march-in-berlin-anti-refugee-demo/a-18834499
2015-11-08,18:42:22,3rzssa,410,South African president says political party comes before country...,news24.com,http://www.news24.com/SouthAfrica/News/the-anc-comes-first-not-the-country-zuma-20151108
2015-11-08,10:35:47,3ryo9r,399,"Volkswagen (VOWG_p.DE) managers are worried about traveling to the United States, a German newspaper reported on Saturday, saying U.S. investigators have confiscated the passport of an employee who is there on a visit.",reuters.com,http://www.reuters.com/article/2015/11/07/us-volkswagen-emissions-idUSKCN0SW0QB20151107?feedType=RSS&feedName=topNews
2015-11-08,08:43:17,3ryb3g,396,"Day Before Deadly Bombing, U.S. Official Asked if Any Taliban Were “Holed Up” At MSF Hospital | A report released today by the medical aid group Doctors Without Borders says a U.S. gunship killed doctors and medical staff as they fled from a burning hospital",theintercept.com,https://theintercept.com/2015/11/05/day-before-deadly-bombing-u-s-official-asked-if-any-taliban-were-holed-up-at-msf-hospital/
2015-11-08,22:52:28,3s0cdr,334,"The Moment This Orangutan Knew She And Her Baby Would Be OK: Volunteers recently came to the rescue of a desperate orangutan and her baby — victims not only of the blaze, but of human cruelty as well",thedodo.com,https://www.thedodo.com/orangutan-with-baby-rescue-photo-1442053034.html
2015-11-08,18:04:50,3rzqi5,299,Iraqi Army Killed Over 900 ISIS Terrorists During the Liberation of Baiji,almasdarnews.com,http://www.almasdarnews.com/article/iraqi-army-killed-over-900-isis-terrorists-during-the-liberation-of-baiji/
2015-11-08,01:04:19,3rwl9u,284,Russia sending 44 planes to Egypt to repatriate tourists,news.yahoo.com,http://news.yahoo.com/no-emergency-evacuation-80-000-russians-still-egypt-100814890.html
2015-11-08,17:28:42,3rzo7q,264,Street celebrations as Sierra Leone declared Ebola-free,aljazeera.com,http://www.aljazeera.com/news/2015/11/street-celebrations-sierra-leone-declared-ebola-free-151108014858540.html
2015-11-08,08:40:26,3ryaqt,263,New Zealand Spy Watchdog Investigating Country’s Ties to CIA Torture,theintercept.com,https://theintercept.com/2015/11/05/new-zealand-spy-watchdog-investigating-countrys-ties-to-cia-torture/
2015-11-08,07:40:43,3ry33k,257,"Sharm el-Sheikh airport officials reveal porous security; faulty scanner, bribes for guards",usnews.com,http://www.usnews.com/news/world/articles/2015/11/07/sharm-el-sheikh-airport-officials-reveal-porous-security
2015-11-08,19:26:22,3rzvja,226,"More than 50 people were killed in Yemen in the past two days in fighting pitting an Arab coalition against Houthi fighters backed by troops loyal to former president Ali Abdullah Saleh, medical sources and residents said on Sunday.",reuters.com,http://www.reuters.com/article/2015/11/08/us-yemen-security-fighting-idUSKCN0SX06O20151108?feedType=RSS&feedName=topNews
2015-11-08,03:35:43,3rx62w,227,Chemical weapons watchdog believes Syrian insurgents used mustard gas,globalnews.ca,http://globalnews.ca/news/2322261/chemical-weapons-watchdog-believes-syrian-insurgents-used-mustard-gas/
2015-11-08,09:27:30,3rygd3,185,German intelligence agency BND spying on allies and Vatican,spiegel.de,http://www.spiegel.de/international/germany/german-bnd-intelligence-spied-on-friends-and-vatican-a-1061588.html
2015-11-08,01:35:08,3rwpfy,150,Lufthansa cancels 290 flights due to strike,dw.com,http://www.dw.com/en/lufthansa-cancels-290-flights-due-to-strike/a-18831420
2015-11-08,20:22:03,3rzzak,143,"European Union ministers have devised a dramatic plan to solve the migration crisis, offering a series of sweeteners in exchange for sending migrants back to Africa. They will provide cash and visas to persuade African countries to take back some of the 800,000 asylum seekers.",smh.com.au,http://www.smh.com.au/world/eu-plan-to-open-door-to-skilled-africans-labelled-madness-20151107-gkthzf.html
2015-11-08,21:28:19,3s045i,132,"Mustard gas was used in August attack on Syrian town, says weapons group: This is the first official confirmation of mustard gas use in Syria since the country agreed to destroy its stockpile of chemical weapons in 2013.",csmonitor.com,http://www.csmonitor.com/World/Global-News/2015/1106/Mustard-gas-was-used-in-August-attack-on-Syrian-town-says-weapons-group
2015-11-08,14:19:44,3rzb22,104,Report: VW engineer told bosses about CO2 manipulation - A German newspaper says revelations over VW's latest emissions scandal came to light because one of the company's engineers broke his silence. Technicians reportedly tampered with CO2 values over a two-year period.,dw.com,http://www.dw.com/en/report-vw-engineer-told-bosses-about-co2-manipulation/a-18834783
