2015-03-04,06:52:44,2xuaf5,7789,"UK should begin decriminalising drugs, say Richard Branson and Nick Clegg",theguardian.com,http://www.theguardian.com/politics/2015/mar/03/uk-should-begin-decriminalising-drugs-richard-branson-nick-clegg
2015-03-04,19:14:56,2xward,9212,Black Sabbath guitarist Tony Iommi asks Indonesian President and heavy metal fan Joko Widodo to stop execution of Australian drug smugglers,jakarta.coconuts.co,http://jakarta.coconuts.co/2015/03/04/black-sabbath-guitarist-tony-iommi-asks-president-jokowi-stop-execution-bali-nine-duo
2015-03-04,02:03:28,2xt5lg,5661,Paraguay Next to Legalize Marijuana Says President of Congress,panampost.com,http://panampost.com/panam-staff/2015/03/03/paraguay-next-to-legalize-marijuana-says-president-of-congress/
2015-03-04,19:20:26,2xwb2u,5191,"Putin has called for an end to ""shameful"" political killings in Russia",bbc.com,http://www.bbc.com/news/world-europe-31728623
2015-03-04,19:52:36,2xwd4f,4009,"UK: Sex gangs may have abused hundreds of girls; children have suffered on an ""industrial scale"" says PM",news.sky.com,http://news.sky.com/story/1437596/sex-gangs-may-have-abused-hundreds-of-girls
2015-03-04,08:19:44,2xult7,4110,"Some 12,000 Russian soldiers in Ukraine supporting rebels: U.S. commander",reuters.com,http://www.reuters.com/article/2015/03/03/us-ukraine-russia-soldiers-idUSKBN0LZ2FV20150303
2015-03-04,18:26:24,2xw7vb,3651,"American billionaire Paul Allen has announced the discovery of the famous World War Two Japanese battleship, the Musashi, more than 70 years after it was sunk by US forces",m.bbc.com,http://m.bbc.com/news/world-asia-31724995
2015-03-04,03:55:10,2xtlcr,2296,Benjamin Netanyahu didn't offer 'viable alternatives' during Iran speech: Obama,cbc.ca,http://www.cbc.ca/news/world/benjamin-netanyahu-didn-t-offer-viable-alternatives-during-iran-speech-obama-1.2979672
2015-03-04,14:32:15,2xvs9r,2109,"Harper government won't let former Prime Ministers testify on ""anti-terror"" bill C-51 in Canada, but will hear from US Homeland Security's Jeh Johnson.",theglobeandmail.com,http://www.theglobeandmail.com/news/politics/committee-wont-hear-from-former-prime-ministers-on-anti-terror-bill/article23262577/
2015-03-04,01:35:59,2xt1pl,1850,"An ancient tomb belonging to Amenhotep, guard of the temple of Egyptian deity Amun, has been discovered in the southern city of Luxor, the Egypt's antiquities ministry said on Tuesday. The ministry said the tomb probably dates to the New Kingdom's 18th Dynasty (1543–1292 BC).",reuters.com,http://www.reuters.com/article/2015/03/03/egypt-antiquites-idINKBN0LZ1Z820150303?feedType=RSS&feedName=worldNews
2015-03-04,06:07:00,2xu4bq,1388,A European first: Ireland passes laws banning branded cigarette packets,independent.ie,http://www.independent.ie/irish-news/health/a-european-first-ireland-passes-laws-banning-branded-cigarette-packets-31038349.html
2015-03-04,16:51:25,2xw25m,1246,A sign of the times: References to Stalin's crimes removed from Soviet Gulag prison museum,m.bbc.com,http://m.bbc.com/news/world-europe-31711287
2015-03-04,22:04:38,2xwnlx,915,"The leader of one of Mexico's most notorious drugs gang, the Zetas cartel, has been captured by security forces, officials say",bbc.co.uk,http://www.bbc.co.uk/news/world-latin-america-31731842
2015-03-04,16:07:30,2xvzh4,593,A Delhi court has banned a documentary film about the December 2012 fatal gang rape of a woman over concerns about derogatory comments made by one of the rapists but its filmmaker has said it will be released as planned.,hindustantimes.com,http://www.hindustantimes.com/india-news/court-bans-dec-16-documentary-filmmaker-says-will-release-it-anyway/article1-1322886.aspx
2015-03-04,18:30:50,2xw86i,591,"German NSA inquiry chief's phone hacked, then interfered with in transit by 'persons unknown'",thelocal.de,http://www.thelocal.de/20150304/snowden-nsa-inquiry-bundestag-chief-suspects-phone-hacking
2015-03-04,06:46:34,2xu9mz,585,A former Royal Marine has become the first Briton to be killed while fighting alongside Kurdish forces against Islamic State in Syria,bbc.co.uk,http://www.bbc.co.uk/news/uk-31720274
2015-03-04,22:32:45,2xwqkc,552,"US Soldiers Readying for Ukraine Deployment: The US Army is preparing to send approximately 300 troops at a time to train Ukrainian forces in western Ukraine, according to documents posted on a government contracting site.",defensenews.com,http://www.defensenews.com/story/defense-news/blog/intercepts/2015/03/03/ukraine-russia-putin-war/24327263/
2015-03-04,17:48:29,2xw5la,538,TASS: Russia - Car tied to Nemtsov killing belongs to enterprise serving government bodies,tass.ru,http://tass.ru/en/russia/780906?update
2015-03-04,01:47:35,2xt3cc,523,"An Al Jazeera journalist has been fined €1,000 (£725;$1,120) for flying a drone in Paris last week in the midst of a security alert sparked by unexplained drone sightings across the city.",bbc.com,http://www.bbc.com/news/world-europe-31717604
2015-03-04,06:38:18,2xu8k4,357,Afghan Army lost 40000 personnel to desertions and casualties in first year after NATO left,news.yahoo.com,http://news.yahoo.com/afghan-army-suffers-heavy-combat-losses-us-192222871.html
2015-03-04,13:24:01,2xvlsf,284,Canadian government pushing First Nations to give up land rights for oil and gas profits,theguardian.com,http://www.theguardian.com/environment/true-north/2015/mar/03/documents-harper-pushing-first-nations-to-shelve-rights-buy-into-resource-rush
2015-03-04,07:48:31,2xuhse,286,Illegal elephant tusk vendor convicted with help of radiocarbon dating: Toronto company fined after dating technique used for 1st time.,cbc.ca,http://www.cbc.ca/news/technology/illegal-elephant-tusk-vendor-convicted-with-help-of-radiocarbon-dating-1.2980338
2015-03-04,19:34:32,2xwc0b,282,509 essential drugs get cheaper in India,businesstoday.intoday.in,http://businesstoday.intoday.in/story/essential-drugs-cheaper-national-pharmaceutical-pricing-authority/1/216482.html
2015-03-04,01:43:37,2xt2sw,267,"Indian state bans the possession and sale of beef, imposing fines and up to five years in prison for violations.",nytimes.com,http://www.nytimes.com/2015/03/04/world/asia/indian-state-passes-ban-on-beef-championed-by-right-wing-hindus.html?ref=asia
2015-03-04,05:50:01,2xu1zo,234,Afghan army suffers heavy combat losses: US,news.yahoo.com,http://news.yahoo.com/afghan-army-suffers-heavy-combat-losses-us-192222871.html
2015-03-04,08:09:37,2xukjc,218,Canadian military predicted chaos in Libya if NATO helped overthrow Gadhafi,ottawacitizen.com,http://ottawacitizen.com/news/national/canadian-military-predicted-chaos-in-libya-if-nato-helped-overthrow-gadhafi
2015-03-04,12:34:02,2xvg8o,185,Jihad John's family on benefits for 20 years,dailymail.co.uk,http://www.dailymail.co.uk/news/article-2978334/Jihadi-John-family-s-20-years-benefits-s-cost-taxpayers-400k-house-fanatic-relatives-upmarket-areas.html
2015-03-04,23:16:32,2xwvpa,148,Court order shows Turkey censoring more atheist content online than previously beleived,dailydot.com,http://www.dailydot.com/politics/turkey-secret-ban-atheist-content/
2015-03-04,21:40:55,2xwlea,120,Inflation-hit Russia sees fruit and vegetable prices rise 22% in January,news.yahoo.com,http://news.yahoo.com/inflation-hit-russia-sees-fruit-veg-prices-jump-104709627.html
2015-03-04,19:49:05,2xwcvm,111,Amnesty International says Saudi Arabia has carried out an unprecedented number of executions since the start of the year.,presstv.ir,http://www.presstv.ir/Detail/2015/03/04/400205/Saudi-executions-at-unprecedented-rate
