2015-07-24,01:05:21,3ec4g0,38263,"NASA discovers another Earth like planet in the Milky Way galaxy - Planet Kepler-452b, the first near-Earth-size world to be found in the habitable zone of star that is similar to our sun.",nasa.gov,http://www.nasa.gov/keplerbriefing0723
2015-07-24,23:12:23,3eg3ih,22041,World's first malaria vaccination approved,aljazeera.com,http://www.aljazeera.com/news/2015/07/world-malaria-vaccination-approved-150724055510421.html
2015-07-24,14:51:09,3eey9p,15573,Indian court rules that 14-year-old who was raped by her doctor is not allowed to terminate pregnancy.,huffingtonpost.in,http://www.huffingtonpost.in/2015/07/24/gujarat-high-court-pregnancy_n_7862000.html
2015-07-24,19:14:35,3efhq6,3643,French court backs mass surveillance: France's top court has given the green light for security services to hack people's computers and phones even if they aren't suspected of any crime.,euobserver.com,https://euobserver.com/justice/129760
2015-07-24,13:49:34,3eesoz,2753,"NASA: Returning To The Moon Is Ten Times Cheaper Than Thought, And It Could Lead To Mars - In 10 to 12 years, it says that a four-person industrial base on the Moon could be operational, costing $40 billion (£26 billion), less than $4 billion (£2.6 billion) a year.",iflscience.com,http://www.iflscience.com/space/returning-moon-ten-times-cheaper-thought-and-could-lead-mars
2015-07-24,08:51:48,3edw2c,2049,"Shell Just Got the Green Light to Drill in the Arctic | The Obama administration gave Shell the go-ahead to drill in the Arctic, but put limits on how deep the company can drill until better spill response technology arrives.",news.vice.com,https://news.vice.com/article/shell-just-got-the-green-light-to-drill-in-the-arctic
2015-07-24,23:11:01,3eg3da,2019,Moscow's highest court has sentenced a leader of a militant neo-Nazi group to life in prison after he was convicted of ordering five brutal killings including that of a prominent human rights lawyer,bigstory.ap.org,http://bigstory.ap.org/article/d4f9cada56f54cd3b48f354293b2e15e/leader-russian-neo-nazi-group-sentenced-life
2015-07-24,23:32:46,3eg5zf,1921,"Ukraine bars Communist Party from elections, political party which regularly got >10% of the votes in national elections",rferl.org,http://www.rferl.org/content/ukraine-communist-party-barred-from-local-elections/27150657.html
2015-07-24,23:36:02,3eg6ee,1682,"China has started assembling the world's largest radio telescope, which will have a dish the size of 30 football pitches when completed, state media reported as Beijing steps up its ambitions in outer space",france24.com,http://www.france24.com/en/20150724-china-starts-assembling-worlds-biggest-radio-telescope
2015-07-24,00:36:32,3ec0gv,1241,Turkish tanks on Thursday opened fire on targets controlled by Islamic State (IS) jihadists in Syria after a Turkish soldier was killed by shots from the Syrian side of the border,france24.com,http://www.france24.com/en/20150723-turkish-tanks-fire-syria-after-soldier-killed-tv?ns_campaign=reseaux_sociaux&ns_source=twitter&ns_mchannel=social&ns_linkname=editorial&aef_campaign_ref=partage_aef&aef_campaign_date=2015-07-23&dlvrit=66745
2015-07-24,19:26:31,3efiln,982,India earns $100 million launching 45 foreign satellites,thehindu.com,http://www.thehindu.com/sci-tech/science/india-earns-100-million-launching-45-foreign-satellites/article7452376.ece
2015-07-24,05:31:09,3ed5us,903,"Iran falsified the number of executions in the country to hide the fact that in the last six months, it killed as many as 694 people, Amnesty has claimed in its latest report",ibtimes.co.in,http://www.ibtimes.co.in/iran-falsified-number-executions-country-amnesty-640286
2015-07-24,13:47:29,3eeshk,866,"Rep. Rosa DeLauro: ""[The] legitimacy and moral authority on the issue of human trafficking is being undermined in an effort to smooth the path for the TPP""",thehill.com,http://thehill.com/policy/international/asia-pacific/247763-new-trade-fight-brews-for-obama-dems
2015-07-24,21:15:49,3efr8a,769,Turkish warplanes pound Islamic State in Syria as Ankara steps up to front-line,reuters.com,http://www.reuters.com/article/2015/07/24/us-mideast-crisis-turkey-islamicstate-idUSKCN0PY0AU20150724
2015-07-24,21:17:51,3efrfd,700,Massive Pod of Pilot Whales Slaughtered in the Faroe Islands - Footage shows bloody slaughter,westernmorningnews.co.uk,http://www.westernmorningnews.co.uk/WARNING-8211-GRAPHIC-CONTENT-Footage-shows-pilot/story-27477514-detail/story.html
2015-07-24,02:53:17,3ecjml,696,Report: Israel Gave Jordan 26 Cobra Choppers to Fight ISIS,israelnationalnews.com,http://www.israelnationalnews.com/News/News.aspx/198547
2015-07-24,03:04:12,3ecl7h,515,Russia bans Jehovah's Witness literature and website,jw.org,http://www.jw.org/en/news/legal/by-region/russia/russia-blocks-bibles-20150721/
2015-07-24,12:39:42,3eelrp,480,"Submarine volcano near Grenada going active, may erupt within hours and pose tsunami threat for Caribbean",bnonews.com,http://bnonews.com/news/index.php/news/id967#.VbGguOIkYak.google_plusone_share
2015-07-24,03:28:02,3ecoor,368,Oil price collapse warning issued by Morgan Stanley,vancouversun.com,http://www.vancouversun.com/business/energy/price+collapse+warning+issued+Morgan+Stanley/11236987/story.html
2015-07-24,04:25:07,3ecwp5,337,Turkey to Allow Use of Key Air Base for U.S. Warplanes to Bomb ISIS,nytimes.com,http://www.nytimes.com/2015/07/24/world/europe/turkey-isis-us-airstrikes-syria.html
2015-07-24,23:30:46,3eg5q5,277,The UK wants online pirates to face 10 years in prison,sursazilei.ro,http://www.sursazilei.ro/uk-wants-online-pirates-face-10-years-prison/
2015-07-24,21:35:59,3efta0,277,Sweden to Introduce Meat Tax,eaglereporters.com,http://eaglereporters.com/2015/07/23/sweden-to-introduce-meat-tax/
2015-07-24,20:22:12,3efmnz,245,Top Al Qaeda Commander Killed In US Airstrike,news.sky.com,http://news.sky.com/story/1524627/top-al-qaeda-commander-killed-in-us-airstrike
2015-07-24,00:35:29,3ec0b7,242,"Chile's salmon farmers are using record levels of antibiotics to treat a virulent and pervasive bacteria, driving away some U.S. retailers including Costco Wholesale Corp, which is turning to antibiotic-free Norwegian salmon",reuters.com,http://www.reuters.com/article/2015/07/23/us-chile-salmon-antibiotics-feature-idUSKCN0PX1IG20150723
2015-07-24,05:16:05,3ed3su,224,The Harper government's controversial Bill C-51 not in keeping with Canada’s international obligations: UN,theglobeandmail.com,http://www.theglobeandmail.com/news/politics/bill-c-51-not-in-keeping-with-canadas-international-obligations-un/article25642360/
2015-07-24,10:59:21,3eeapp,220,"A Honduran journalist has taken refuge in the country's human rights commission in Tegucigalpa, claiming the government is plotting to assassinate him for exposing a corruption scandal",france24.com,http://www.france24.com/en/20150724-journalist-takes-refuge-honduras-human-rights-commission
2015-07-24,23:18:17,3eg47p,194,Human rights in Canada are under assault under PM Stephen Harper: right groups,dailysabah.com,http://www.dailysabah.com/americas/2015/07/24/human-rights-in-canada-are-under-assault-under-pm-stephen-harper-right-groups
2015-07-24,12:14:21,3eej4p,171,"Chemotherapy may worsen end-of-life quality, study finds",seattletimes.com,http://www.seattletimes.com/nation-world/chemotherapy-may-worsen-end-of-life-quality-study-finds/
2015-07-24,20:07:28,3eflk0,153,"Malaysian Home Ministry suspends printing permit for The Edge, a local financial newspaper who have been reporting on alleged siphoning of money from a government investment vehicle.",thestar.com.my,http://www.thestar.com.my/News/Nation/2015/07/24/The-Edge-suspended/
2015-07-24,23:13:14,3eg3lh,136,Spain raises minimum age of marriage to 16 to stop forced marriage and exploitation,independent.co.uk,http://www.independent.co.uk/news/world/europe/spain-raises-minimum-marriage-age-from-14-to-16-to-stop-forced-unions-and-sexual-exploitation-10412632.html
