2015-08-06,19:33:59,3fzmhq,30028,"iTunes is illegal under UK copyright law - The Intellectual Property Office today explains that ripping a CD in iTunes is no longer permitted, and neither is backing up your computer if it contains copyrighted content.",torrentfreak.com,https://torrentfreak.com/itunes-is-illegal-under-uk-copyright-law-150805/
2015-08-06,20:13:34,3fzphs,12508,"Turkish couple feed 4,000 Syrian refugees on wedding day instead of wedding",i100.independent.co.uk,http://i100.independent.co.uk/article/a-turkish-couple-spent-their-wedding-day-feeding-4000-syrian-refugees--ZJKtZfieVl
2015-08-06,14:35:41,3fyz4y,9590,"TPP Copyright Chapter Leaks: Website Blocking, New Criminal Rules On the Way",politics.slashdot.org,http://politics.slashdot.org/story/15/08/06/0012217/tpp-copyright-chapter-leaks-website-blocking-new-criminal-rules-on-the-way
2015-08-06,02:50:42,3fwg5o,20377,Debris found from Reunion Island confirmed to be from MH370,cnbc.com,http://www.cnbc.com/2015/08/05/experts-examine-wing-debris-for-links-to-missing-malaysian-jet.html
2015-08-06,02:06:52,3fw9wr,3133,"Sea animals are dying off in massive numbers along the Pacific Coastline from Baja, Mexico all the way to Alaska.A combination of man-made and natural causes are killing off bottlenose dolphins, sardines, sea birds, plankton, krill, salmon, sea lions, starfish, and brown pelicans in record numbers.",inquisitr.com,http://www.inquisitr.com/2302738/massive-die-off-of-ocean-animals-turning-pacific-ocean-into-desert-go-see-them-now-before-theyre-extinct/
2015-08-06,22:58:40,3g06k5,2480,"Russia marks 1 year of sanctions by destroying Western food - despite 250,000 signatures on a petition to donate that food to the poor. The lower supply of food also serves to drive consumer prices up, pushing more citizens below the poverty line.",finance.yahoo.com,http://finance.yahoo.com/news/russia-marks-1-sanctions-destroying-115354665.html
2015-08-06,01:58:32,3fw8oy,2279,"Rejecting Iran nuclear deal is a vote for war, Obama says",bbc.com,http://www.bbc.com/news/world-us-canada-33792567
2015-08-06,18:37:04,3fzicj,988,"Pharmaceutical firms Pfizer and Flynn Pharma have been accused by the UK's competition watchdog of charging ""excessive and unfair"" prices for an anti-epilepsy drug.",bbc.com,http://www.bbc.com/news/business-33799495
2015-08-06,18:40:34,3fzil0,890,"China willing to work with US to contribute to world peace, stability.China is ready to step up cooperation with the United States in the fields of investment, military, climate change, finance, economy and trade, energy, hunt of corrupt officials, justice and public health.",chinadaily.com.cn,http://www.chinadaily.com.cn/world/2015-08/06/content_21516393.htm?
2015-08-06,12:02:55,3fyiti,851,Australian spy agency says a junior Defence staffer allegedly took home a secret intelligence report and posted it on 4Chan,canberratimes.com.au,http://www.canberratimes.com.au/act-news/a-junior-defence-staffer-allegedly-took-home-an-intelligence-report-and-posted-it-online-20150804-gir4rq.html#ixzz3hzzabkbc
2015-08-06,11:30:40,3fyexe,742,"Pope Francis says even after divorce, you can remain in the church",cnn.com,http://www.cnn.com/2015/08/05/world/pope-divorced-catholics/
2015-08-06,00:32:04,3fvw8x,698,"'I came to kill Hindus, it's fun doing this,' says captured Pakistani terrorist Naved",zeenews.india.com,http://zeenews.india.com/news/india/i-came-to-kill-hindus-its-fun-doing-this-says-captured-pakistan-terrorist-naved_1642138.html
2015-08-06,17:52:29,3fzeyy,472,Norway feared terrorism in Oslo after security guard claimed he was shot and a suspected bomb was found at University of Oslo. Now the security guard admits that he was behind the shooting and the fake bomb himself.,osloby.no,http://www.osloby.no/nyheter/Security-guard-admits-shooting-and-placing-a-fake-bomb-at-the-University-of-Oslo-8116544.html
2015-08-06,21:59:14,3fzzgl,371,"Windfarm 'wing nuts': Public health expert takes aim at activists. ""Infrasound generated by mere walking has been shown to be louder than the noise of wind turbines ... I assume your committee is not concerned about walking noise health impacts?""",smh.com.au,http://smh.com.au/federal-politics/political-news/windfarm-wing-nuts-public-health-expert-takes-aim-at-activists-20150805-girzqj
2015-08-06,10:56:23,3fyaq5,339,Nasa says Congress cuts mean $490m is needed to buy rides on Russian rockets,theguardian.com,http://www.theguardian.com/science/2015/aug/06/nasa-says-congress-cuts-mean-490m-is-needed-to-buy-rides-on-russian-rockets?CMP=twt_gu
2015-08-06,01:22:02,3fw3dw,334,More Dutch cities may join in 'basic income' experiment,dutchnews.nl,http://www.dutchnews.nl/news/archives/2015/08/more-dutch-cities-may-join-in-basic-income-experiment/
2015-08-06,18:23:30,3fzhd3,312,"You taught our students, so we are releasing you: Islamic State to Indians abducted in Libya",firstpost.com,http://www.firstpost.com/india/you-taught-our-students-so-we-are-releasing-you-islamic-state-to-indians-abducted-in-libya-2379386.html
2015-08-06,05:50:34,3fx72r,287,Survey suggests strong popular support for ‘Jew-free’ Romania,jpost.com,http://www.jpost.com/Diaspora/Survey-suggests-strong-popular-support-for-Jew-free-Romania-411213
2015-08-06,18:38:36,3fzigk,264,British truck driver radios international space station from garden shed,independent.co.uk,http://www.independent.co.uk/news/science/gloucestershire-radio-ham-manages-to-contact-international-space-station-10441887.html
2015-08-06,00:45:32,3fvy1g,235,ISIS has threatened to kill a Croatian hostage if Egypt does not meet its demands in 48 hours,egyptianstreets.com,http://egyptianstreets.com/2015/08/05/isis-threatens-to-kill-a-croatian-hostage-if-egypt-does-not-meet-its-demands-in-48-hours/
2015-08-06,19:49:45,3fznnh,203,Loss of world's rarest ape charted - Decline of the Hainan gibbon - worlds rarest primate - has been revealed by a trawl through historical Chinese documents. There are only 26-28 left in the wild. Old govt documents helping reveal when & how the numbers fell.,bbc.com,http://www.bbc.com/news/science-environment-33776466?9
2015-08-06,05:02:10,3fwzzh,194,"Scientists in Iran clone endangered mouflon – born to domestic sheep: Poaching has driven the Isfahan mouflon close to extinction in Iran, where scientists are hailing the rare successful example of interspecies cloning.",theguardian.com,http://www.theguardian.com/science/2015/aug/05/iran-scientists-clone-endangered-mouflon-domestic-sheep
2015-08-06,23:22:22,3g09d6,140,Hamas warns of new violence unless Israel lifts blockade,news.yahoo.com,http://news.yahoo.com/hamas-warns-violence-unless-israel-lifts-blockade-192214603.html
2015-08-06,23:47:04,3g0cog,109,Newfoundland and Labrador eliminates student loans,ctvnews.ca,http://www.ctvnews.ca/canada/newfoundland-and-labrador-eliminates-student-loans-1.2502948
2015-08-06,19:50:02,3fzno0,109,MH370: Debris Of Malaysia Airlines Boeing 777 'Was Faked' Claim Relatives Of Victims,huffingtonpost.co.uk,http://www.huffingtonpost.co.uk/2015/08/06/mh370-debris-of-malaysia-airlines-boeing-777-faked-claim-relatives-victims_n_7946290.html?1438854398
2015-08-06,05:18:33,3fx2e4,105,Rare tiger cub 'shot by loggers' at point blank range in eastern Russia,siberiantimes.com,http://siberiantimes.com/ecology/others/news/n0338-rare-tiger-cub-shot-by-loggers-at-point-blank-range-in-eastern-russia/#.VcE3fXTNxho.twitter
2015-08-06,08:14:54,3fxqtn,103,The United States and Russia have reached agreement on a draft United Nations resolution aimed at identifying the perpetrators of chemical weapons attacks in Syria so they can be brought to justice,bigstory.ap.org,http://bigstory.ap.org/article/7d17b35abb504aeaad9f3b58734adb42/diplomat-us-russia-agree-act-syria-chemical-attacks
2015-08-06,22:30:54,3g039c,105,U.S. and Russia to Back U.N. Resolution to Identify Who Used Chemical Weapons in Syria,nytimes.com,http://www.nytimes.com/2015/08/07/world/asia/syria-chemical-attacks-un-resolution.html?referrer=
2015-08-06,00:05:46,3fvspp,92,"Russia, Putin Held in Low Regard around the World: Outside its own borders, neither Russia nor its president, Vladimir Putin, receives much respect or support",pewglobal.org,http://www.pewglobal.org/2015/08/05/russia-putin-held-in-low-regard-around-the-world/
2015-08-06,23:10:25,3g07zf,88,"From Puerto Rico to Cuba to the eastern Caribbean island of St. Lucia, crops are withering, reservoirs are drying up and cattle are dying while forecasters worry that the situation could only grow worse in the coming months.",washingtontimes.com,http://www.washingtontimes.com/news/2015/aug/5/parched-caribbean-faces-widespread-drought-water-s/?
