2015-04-08,06:11:54,31sml1,21567,US Officials say Russians have hacked the White House,newsweek.com,http://www.newsweek.com/report-russians-hacked-white-house-320522
2015-04-08,19:58:49,31uzfa,4765,"India Pulls Off Great Escape in Yemen, 4000 Evacuated From War Zone",ndtv.com,http://www.ndtv.com/india-news/government-expected-to-wrap-up-yemen-evacuation-operation-today-4000-indians-rescued-so-far-753135?pfrom=home-lateststories
2015-04-08,00:46:56,31rc7g,3496,U.S. expected to remove Cuba from state sponsors of terrorism list.,erietvnews.com,http://www.erietvnews.com/story/28739879/urgent-cuba-expected-to-be-removed-from-state-sponsors-of-terrorism-list-official-says
2015-04-08,02:42:19,31rsjx,2950,Judge orders Prince Andrew sex allegations struck from court record | UK news,theguardian.com,http://www.theguardian.com/uk-news/2015/apr/07/prince-andrew-jeffrey-epstein-florida
2015-04-08,19:44:27,31uyf2,2181,"North sea cod stocks bounce back - The fish that was once one of the most disastrous examples of overfishing could be certified as sustainable within five years, according to new research.",theguardian.com,http://www.theguardian.com/environment/2015/apr/08/north-sea-cod-stocks-bounce-back-analysis-shows
2015-04-08,07:05:30,31su2o,1930,U.S. secretly tracked billions of calls for decades,usatoday.com,http://www.usatoday.com/story/news/2015/04/07/dea-bulk-telephone-surveillance-operation/70808616/
2015-04-08,10:21:35,31tjur,1905,Thousands of Turkish Students Demand Jedi Temples On Campus,newsweek.com,http://www.newsweek.com/thousands-turkish-students-demand-jedi-and-buddhist-temples-campus-320413
2015-04-08,19:45:46,31uyib,1448,"The United States and Japan are close to concluding a set of bilateral defense rules that if finalized would give Japan’s military new powers to act when U.S. forces are threatened by a third country, U.S. officials said Wednesday.",washingtonpost.com,http://www.washingtonpost.com/world/new-defense-rules-would-give-japan-new-powers-to-aid-us-military/2015/04/08/419c0678-dda8-11e4-a500-1c5bb1d8ff6a_story.html
2015-04-08,21:25:03,31v6k3,895,"The Saudi budget deficit will be more than twice its own forecast, a leading research firm has said, forcing the kingdom into the debt market for the first time in more than a decade",france24.com,http://www.france24.com/en/20150408-saudi-borrow-finance-soaring-deficit-says-report/
2015-04-08,18:05:40,31us19,799,"Archaeologists defy Isis by finding new antiquities in Iraq - They're making discoveries despite efforts by Isis to 'culturally cleanse' it. ""If the militants think they can 'erase history' we are helping to make sure that can't happen: it is the information that is important & not the objects.""",phys.org,http://phys.org/news/2015-04-archaeologists-defy-isis-militants-antiquities.html
2015-04-08,15:24:25,31uh4e,611,Australian Treasurer steps in to protect suspected tax dodger multinationals from being identified,smh.com.au,http://www.smh.com.au/federal-politics/political-news/joe-hockey-steps-in-to-protect-suspected-tax-dodger-multinationals-from-being-identified-20150408-1mgfix.html
2015-04-08,23:41:10,31vm5u,615,"""I must tell you the individuals who say this deal provides a pathway for Iran to a bomb are being wholly disingenuous..."", says CIA director John Brennan",dailystar.com.lb,http://www.dailystar.com.lb/News/World/2015/Apr-08/293703-cia-chief-says-criticism-of-iran-deal-disingenuous.ashx
2015-04-08,11:37:30,31ttkk,509,"Sydney Water has been revealed as the nation's biggest dumper of mercury into Australian waters, pumping 40 kilograms of the toxic metal out of its deep ocean outfall pipes at Manly and Malabar in the past financial year.",smh.com.au,http://www.smh.com.au/nsw/sydney-water-revealed-as-nations-biggest-dumper-of-mercury-20150404-1md9lb.html
2015-04-08,01:20:35,31rgwh,516,Iraqi Prime Minister and Iraqi Kurdistan Region President agree on joint operation to liberate Mosul from ISIS,almasdarnews.com,http://www.almasdarnews.com/article/abadi-barzani-agree-on-joint-operation-to-liberate-mosul/
2015-04-08,19:51:23,31uywg,482,An exhibition in Iran will mock the Holocaust.,washingtonpost.com,http://www.washingtonpost.com/blogs/worldviews/wp/2015/04/07/an-exhibition-in-iran-will-mock-the-holocaust/?tid=pm_world_pop_b
2015-04-08,06:54:02,31ssgq,459,"U.S. Sanctions Block Crimeans From World of Warcraft, Diablo III",themoscowtimes.com,http://www.themoscowtimes.com/business/article/us-sanctions-block-crimeans-from-world-of-warcraft-diablo-iii/518781.html
2015-04-08,01:29:11,31ri36,456,"Russian deputy who voted against reunification with Crimea stripped of immunity, faces embezzlement charges in Russia",dailystar.com.lb,http://www.dailystar.com.lb/News/World/2015/Apr-07/293622-russian-deputy-who-opposed-crimea-seizure-stripped-of-immunity.ashx
2015-04-08,00:49:30,31rcj7,312,"Iraqi teams start exhuming mass grave of soldiers in Tikrit. Last year, ISIS captured around 1,700 soldiers as they were trying to flee Camp Speicher and killed them.",news.yahoo.com,http://news.yahoo.com/iraqi-teams-start-exhuming-mass-grave-soldiers-tikrit-075659764.html
2015-04-08,15:09:26,31ufyb,285,$1 billion disappears -- and Moldova looks for answers,france24.com,http://www.france24.com/en/20150408-1-billion-disappears-moldova-looks-answers/?aef_campaign_date=2015-04-08&aef_campaign_ref=partage_aef&dlvrit=66745&ns_campaign=reseaux_sociaux&ns_linkname=editorial&ns_mchannel=social&ns_source=twitter
2015-04-08,01:06:34,31rexh,208,Germany dismisses Greek demand for billions in WW2 reparations,ca.reuters.com,http://ca.reuters.com/article/topNews/idCAKBN0MY1JR20150407
2015-04-08,21:37:51,31v7qm,186,Shark Fins Being Shipped From Costa Rica to China Via the USA,costaricantimes.com,http://www.costaricantimes.com/proof-of-shark-fins-being-shipped-from-costa-rica-to-hong-kong-via-the-usa/36867
2015-04-08,14:32:11,31ucss,148,Iran’s Leaders Fall Into Line Behind Nuclear Accord,nytimes.com,http://www.nytimes.com/2015/04/08/world/middleeast/irans-establishment-closes-ranks-in-support-of-nuclear-accord.html
2015-04-08,17:43:40,31uqpw,100,Hundreds of flights cancelled over French air traffic strike,dailysabah.com,http://www.dailysabah.com/world/2015/04/08/hundreds-of-flights-including-turkish-airlines-cancelled-over-french-air-traffic-strike
2015-04-08,08:26:40,31t4se,97,Indian police kill 20 sandalwood smugglers,america.aljazeera.com,http://america.aljazeera.com/articles/2015/4/7/indian-police-kill-20-sandalwood-smugglers.html
2015-04-08,21:17:18,31v5uz,71,Indonesian man survives hour-long flight to Jakarta clinging to landing gear,theguardian.com,http://www.theguardian.com/world/2015/apr/08/indonesian-man-survives-hour-long-flight-to-jakarta-clinging-to-landing-gear
2015-04-08,01:13:06,31rfvt,71,Twenty red-sandalwood smugglers shot dead in India Andhra Pradesh's Chittoor forest,zeenews.india.com,http://zeenews.india.com/news/andhra-pradesh/twenty-red-sandalwood-smugglers-shot-dead-in-andhra-pradeshs-chittoor-forest_1574600.html
2015-04-08,22:21:21,31vcby,69,Round table talks about the possibility of Cannabis being legalised in South Africa,timeslive.co.za,http://www.timeslive.co.za/politics/2015/04/08/medicinal-use-of-dagga-up-for-debate
2015-04-08,23:20:08,31vjdf,69,"Health Canada: ADHD Drugs To Come With Suicide Warning, Includes Adderall XR, Ritalin, Concerta",inquisitr.com,http://www.inquisitr.com/1959642/health-canada-adhd-drugs-to-come-with-suicide-warning-includes-adderall-xr-ritalin-concerta/
2015-04-08,03:22:39,31ry9o,68,France's Hollande to declassify Rwanda genocide documents: source,ca.reuters.com,http://ca.reuters.com/article/topNews/idCAKBN0MY1S820150407
2015-04-08,23:37:57,31vlrb,66,China’s communist youth movement plans to recruit 10.5 million volunteers to help promote socialist values and counter “wrong” ideas online.,ejinsight.com,http://www.ejinsight.com/20150408-young-communists-to-recruit-10-mln-new-volunteers/
