2015-10-19,17:43:58,3pbxpy,15315,"Japan furious at UNESCO listing Nanjing Massacre documents | Japan may halt funding for UNESCO over the organization's decision to include documents relating to the 1937 Nanjing Massacre in the latest listing for its ""Memory of the World"" program.",dw.com,http://www.dw.com/en/japan-furious-at-unesco-listing-nanjing-massacre-documents/a-18790477
2015-10-19,23:31:47,3pcvfb,9845,"Saudi Arabia Hajj Disaster Death Toll at Least 2,110",abcnews.go.com,http://abcnews.go.com/International/wireStory/saudi-arabia-hajj-disaster-death-toll-2110-34571621
2015-10-19,19:51:43,3pc7gk,5009,"TTIP Already 'Rewriting the Rule Book' for EU Food Standards, New Report Finds: Campaigners say that corporate lobbyists, buoyed by the pending trade agreement, are already lobbying against key food safety measures",commondreams.org,http://www.commondreams.org/news/2015/10/18/ttip-already-rewriting-rule-book-eu-food-standards-new-report-finds
2015-10-19,02:04:24,3p8ucy,5251,"5 hurt in terror attack at Beersheba, Israel central bus station",jpost.com,http://www.jpost.com/Arab-Israeli-Conflict/Suspected-terror-attack-near-central-bus-station-in-Beersheba-426325
2015-10-19,00:52:51,3p8kp7,4087,70 Tunisia hotels closed since attacks on tourists. Unemployment in Tunisia is almost 30 percent as the country suffers from the impact of deadly militant attacks on tourists.,middleeasteye.net,http://www.middleeasteye.net/news/70-tunisia-hotels-closed-attacks-tourists-1294132608
2015-10-19,10:42:05,3paslo,3035,Swiss Anti-Immigration Party Wins Big in Elections,nytimes.com,http://www.nytimes.com/2015/10/19/world/europe/swiss-anti-immigration-party-wins-big-in-elections.html?ref=world
2015-10-19,02:31:06,3p8y36,2848,Report: Taliban at their strongest since 2001,thehill.com,http://thehill.com/policy/defense/256650-report-taliban-at-strongest-point-since-2001
2015-10-19,17:28:03,3pbwkt,2039,Eritrean mistaken for Palestinian shot; beaten by mob in Israel,aljazeera.com,http://www.aljazeera.com/news/2015/10/eritrean-mistakenly-shot-israel-attack-dies-151019064200199.html
2015-10-19,19:19:22,3pc4xu,1771,Japan rejects international court jurisidiction over whaling,smh.com.au,http://www.smh.com.au/federal-politics/political-news/japan-rejects-international-court-jurisidiction-over-whaling-20151018-gkc7rm
2015-10-19,02:15:04,3p8vue,1599,"Court rules Uber's app legal in London: The ruling is a victory for the ride-hailing service, which has faced significant opposition from London's established cab trade, but taxi drivers already are challenging the decision.",cnet.com,http://www.cnet.com/news/court-rules-uber-car-service-app-legal-in-london/
2015-10-19,06:34:26,3p9wiq,1422,"‘When we told them we were Jews from Israel, they kissed us’:Amid tragic circumstances, Israeli boaters save 11 Syrian and Iraqi refugees.",timesofisrael.com,http://www.timesofisrael.com/when-we-told-them-we-were-jews-from-israel-they-kissed-us/
2015-10-19,08:13:34,3pa9xf,1169,India is planting trees along it's railway system across the country to combat environmental issues,newindianexpress.com,http://www.newindianexpress.com/nation/Railways-Continues-to-Go-Green-Plant-Trees-Along-Tracks/2015/10/15/article3081621.ece
2015-10-19,20:02:39,3pc8e2,1033,Australia Approves Coal Mine That Environmentalists Call ‘A Complete Disaster’ For Coral Reef,thinkprogress.org,http://thinkprogress.org/climate/2015/10/18/3712632/australia-approves-massive-coal-mine/
2015-10-19,17:48:33,3pby1m,801,"British journalist who worked for BBC found dead at airport in Istanbul | It is not yet known how Ms Sutton, 50, died. Friends questioned Turkish media reports that she killed herself after missing a connecting flight to Erbil and not having the money to buy another ticket.",independent.co.uk,http://www.independent.co.uk/news/uk/home-news/jacky-sutton-british-journalist-who-worked-for-bbc-found-dead-at-airport-in-istanbul-turkey-a6699326.html
2015-10-19,09:01:08,3pafzo,741,'Convert or die' ISIS graffiti jihadis declare first European 'caliphate',dailystar.co.uk,http://www.dailystar.co.uk/news/latest-news/470396/ISIS-Islamic-State-Sweden-Europe-threat
2015-10-19,15:13:47,3pblx9,729,"Women working for international aid agencies are facing a hidden threat of sexual violence and harassment which their employers routinely ignore or sweep under the carpet, according to testimonies gathered by the Guardian.",theguardian.com,http://www.theguardian.com/world/2015/oct/19/aid-agencies-accused-of-hiding-scale-of-sexual-assaults-on-employees
2015-10-19,01:54:20,3p8sxx,647,Colombian government has acknowledged that crime and smuggling have gone down since Venezuela deployed thousands of troops along their common border two months ago,bbc.com,http://www.bbc.com/news/world-latin-america-34565042
2015-10-19,21:15:54,3pcf37,595,"'My cousin made me do it,' 13-year-old Palestinian stabber tells police",jpost.com,http://www.jpost.com/Arab-Israeli-Conflict/My-cousin-made-me-do-it-13-year-old-Palestinian-stabber-tells-police-427398
2015-10-19,00:23:47,3p8gyh,410,"Israel and the United States signaled on Sunday they were putting disputes over the Iran nuclear deal behind them, announcing resumed talks on U.S. defense aid for Israel as it hosted Washington's top general and a joint air force drill",reuters.com,http://www.reuters.com/article/2015/10/18/us-usa-israel-idUSKCN0SC04Y20151018
2015-10-19,19:26:31,3pc5hr,402,ISIS Media Blitz Urges Palestinians To Slaughter Jews,vocativ.com,http://www.vocativ.com/news/240849/isis-media-blitz-incites-palestinians-to-kill-jews
2015-10-19,10:25:40,3paqks,367,Russia aims to increase missions in Syria by '300 a day',independent.co.uk,http://www.independent.co.uk/news/world/middle-east/russia-in-syria-moscow-to-increase-missions-in-syria-to-300-a-day-a6698876.html
2015-10-19,18:56:17,3pc35b,317,"Hamas making efforts to carry out suicide attacks against Israel, officials say",jpost.com,http://www.jpost.com/Arab-Israeli-Conflict/Hamas-making-efforts-to-carry-out-suicide-attacks-against-Israel-officials-say-427381
2015-10-19,00:32:14,3p8i2m,291,Germany offers Turkey $3.4 billion to stem migrant tide,cbsnews.com,http://www.cbsnews.com/news/germany-offers-turkey-3-4-billion-to-stem-migrant-tide/
2015-10-19,12:50:20,3pb81o,266,"China economy grows 6.9 percent in Q3, weakest since 2009",uk.reuters.com,http://uk.reuters.com/article/2015/10/19/uk-china-economy-gdp-idUKKCN0SD04720151019
2015-10-19,11:45:21,3pb0cg,236,"Indigenous Canadians take leading role in battle against tar sands pipeline: As Canada’s election approaches, First Nations join environmental groups in an effort to prevent the building of the country’s largest proposed pipeline",theguardian.com,http://www.theguardian.com/world/2015/oct/18/canada-indigenous-first-nations-tar-sands-pipeline-oil
2015-10-19,21:56:21,3pcjkt,210,Walmart paid millions of dollars in bribes in India: report: The Hindu,m.thehindu.com,http://m.thehindu.com/business/Industry/walmart-paid-millions-of-dollars-in-bribes-in-india-report/article7779884.ece
2015-10-19,00:44:59,3p8joy,203,Nuke deal between Iran and world powers takes effect,usatoday.com,http://www.usatoday.com/story/news/world/2015/10/18/iran-nuclear-deal-takes-effect/74169530/
2015-10-19,21:34:24,3pch0x,157,"Hunt for Israelis who shot, kicked, spat on and ultimately killed Eritrean man",theguardian.com,http://www.theguardian.com/world/2015/oct/19/hunt-for-israelis-who-killed-eritrean-man-falsely-implicated-in-bus-attack
2015-10-19,14:56:37,3pbkej,125,Maldives court sentences woman to death by stoning for giving birth out of wedlock,maldivesindependent.com,http://maldivesindependent.com/crime-2/maldives-court-sentences-woman-to-death-by-stoning-118541
2015-10-19,23:51:47,3pcy6i,115,"Thousands rally for Israel in Paris, Rome and Madrid",ynetnews.com,"http://www.ynetnews.com/articles/0,7340,L-4713080,00.html"
