2015-11-25,23:38:57,3u85x1,22862,“I gave the order myself” − Turkish PM on downing Russian plane,thinkpol.ca,http://thinkpol.ca/2015/11/25/i-gave-the-order-myself-%e2%88%92-turkish-pm-on-downing-russian-plane/
2015-11-25,02:29:05,3u3x5q,24258,'Severe blow': Al Qaeda suicide bomber takes out leadership of key ISIS brigade,foxnews.com,http://www.foxnews.com/world/2015/11/24/severe-blow-al-qaeda-suicide-bomber-takes-out-leadership-key-isis-brigade/?intcmp=hpbt3
2015-11-25,19:06:29,3u7bot,17711,Depressed Elephant Has Been Living In A Concrete Cell For 61 Years,thedodo.com,https://www.thedodo.com/hanako-japan-elephant-61-years-1473985023.html
2015-11-25,02:51:09,3u40l8,11521,Hackers knock out ISIS's Dark Net propaganda site,dailydot.com,http://www.dailydot.com/politics/isis-tor-hidden-service-down/
2015-11-25,22:41:26,3u7y12,7429,BBC: Downed plane pilot denies Turkey warning,bbc.com,http://www.bbc.com/news/world-europe-34925229
2015-11-25,00:44:28,3u3gid,6270,"Iranian Authorities Overrule Husband, Allow Female Soccer Captain To Travel To World Cup Event",thinkprogress.org,http://thinkprogress.org/sports/2015/11/24/3725423/iran-overrules-husband-of-football-captain/
2015-11-25,21:24:50,3u7oqv,6432,"All Russian tourist agencies stop selling Turkey trips, cancel charter flights",meduza.io,https://meduza.io/en/news/2015/11/25/following-government-warning-all-tourist-agencies-in-russia-suspend-the-sale-of-trips-to-turkey
2015-11-25,05:29:01,3u4q5w,5973,Turkey downed Russian fighter jet to protect ISIS oil sales: Putin,thinkpol.ca,http://thinkpol.ca/2015/11/24/turkey-downed-russian-fighter-jet-to-protect-isis-oil-sales-putin/
2015-11-25,22:44:05,3u7ye2,5836,Russian lawmakers submit bill to hold to account anyone who denies Armenian genocide: RIA,dailystar.com.lb,http://www.dailystar.com.lb/News/World/2015/Nov-25/324583-russian-lawmakers-submit-bill-to-hold-to-account-anyone-who-denies-armenian-genocide-ria.ashx
2015-11-25,18:15:40,3u77ez,5615,Syrian and Russian special forces have rescued the second pilot of a Russian warplane shot down by Turkey and he is now at a Russian air base in Syria,finance.yahoo.com,http://finance.yahoo.com/news/second-pilot-downed-russian-plane-rescued-defence-minister-091827535.html;_ylt=AwrC1C7GhFVWd1EABDHQtDMD;_ylu=X3oDMTByOHZyb21tBGNvbG8DYmYxBHBvcwMxBHZ0aWQDBHNlYwNzcg--
2015-11-25,05:00:06,3u4ll2,5364,Turkish military release radar image tracking Russian fighter jet over Turkish territory before attack. Radar shows Russian jet only over Turkey for 10 seconds.,smh.com.au,http://www.smh.com.au/world/turkish-military-release-radar-image-tracking-russian-fighter-jet-over-turkish-territory-before-attack-20151124-gl751g.html
2015-11-25,12:57:26,3u6d5k,4338,All Russian bombers in Syria will now be escorted by fighters.,dailymail.co.uk,http://www.dailymail.co.uk/wires/afp/article-3331943/Downing-Russia-jet-stab-Putin.html
2015-11-25,21:07:54,3u7mwl,4342,Russia bombards Syrian rebels near site of downed Russian jet,news.yahoo.com,http://news.yahoo.com/russia-bombards-syrian-rebels-near-downed-russian-jet-122428258.html
2015-11-25,18:16:58,3u77jo,2355,Greece Agrees With Russian Assessment of Turkey's 'Unfriendly' Actions,sputniknews.com,http://sputniknews.com/world/20151125/1030720678/greece-russia-turkey.html
2015-11-25,23:25:22,3u83yd,2267,"""No war with Turkey"" - Russia condemns ""planned provocation"" and expresses disappointment over Ankara prioritizing contact with NATO",aljazeera.com,http://www.aljazeera.com/news/2015/11/russia-war-turkey-planned-provocation-151125134605630.html
2015-11-25,21:22:24,3u7og7,1980,Syrian military source says rebels making heavy use of U.S.-made anti-tank missiles paid for by Saudi Arabia and supplied via Turkey,trust.org,http://www.trust.org/item/20151125131312-5mltc
2015-11-25,05:55:03,3u4u6f,1119,Flight data released by Russian Ministry of Defense shows that the ‪‎Su24‬ never entered ‎Turkey‬.,sputniknews.com,http://sputniknews.com/military/20151124/1030695406/mod-su-24-flight-path.html#ixzz3sRbBWsbD
2015-11-25,21:50:19,3u7rqe,1079,Erdogan: We didn't know warplane was Russian,b92.net,http://www.b92.net/eng/news/world.php?yyyy=2015&mm=11&dd=25&nav_id=96154
2015-11-25,20:23:33,3u7im0,840,US says it cannot coordinate with Russia until they stop killing so many civilians and moderate rebels.,mobile.reuters.com,http://mobile.reuters.com/article/idUSKBN0TE0E620151125
2015-11-25,01:25:44,3u3n17,812,Russia to stop air communication with Turkey,pravdareport.com,http://www.pravdareport.com/news/russia/24-11-2015/132695-russia_turkey_reaction-0/
2015-11-25,08:14:17,3u5ed9,740,"Europe should take no more refugees, says French prime minister",irishtimes.com,http://www.irishtimes.com/news/world/europe/europe-should-take-no-more-refugees-says-french-prime-minister-1.2442503
2015-11-25,04:00:56,3u4byg,524,NATO backs Turkey over Russian aircraft,reuters.com,http://www.reuters.com/article/2015/11/24/mideast-crisis-syria-stoltenberg-idUSB5N13J00120151124#wtY54ijJuddu44yd.97
2015-11-25,12:59:01,3u6dbi,446,Over 1/2 the world's primates on brink of extinction - International experts call for urgent action to protect mankind's closest living relatives. Highlight threat to lesser-known apes & monkeys from large-scale habitat destruction & illegal wildlife trade,news.yahoo.com,http://news.yahoo.com/over-half-worlds-primates-brink-extinction-experts-095227180.html
2015-11-25,21:47:06,3u7rce,435,"Archeologists in Croatia announced their discovery of a 3,500-year-old sunken town in Adriatic Sea near Zadar, a southern coastal city.",techtimes.com,http://www.techtimes.com/articles/110019/20151125/3-500-year-old-sunken-town-discovered-in-croatia.htm
2015-11-25,21:40:20,3u7qkb,421,"Protesters throw stones, eggs at Turkish embassy in Moscow",todayszaman.com,http://www.todayszaman.com/latest-news_protesters-throw-stones-eggs-at-turkish-embassy-in-moscow_405250.html
2015-11-25,02:36:10,3u3yab,365,Statement by the NATO Secretary General after the extraordinary NAC meeting.,nato.int,http://www.nato.int/cps/en/natohq/news_125052.htm?utm_source=fb&utm_medium=smc&utm_campaign=20151124%2Bsg%2Bturkey%2Brussia
2015-11-25,02:28:00,3u3x00,353,"Russian jet was in Turkish airspace for seconds: U.S., NATO officials",ctvnews.ca,http://www.ctvnews.ca/world/russian-jet-was-in-turkish-airspace-for-seconds-u-s-nato-officials-1.2671908
2015-11-25,11:27:42,3u62s0,341,"Putin calls Turkey's downing of Russian jet 'stab in the back': if IS militants earned hundreds of millions of dollars from trading oil and enjoyed the protection of the armed forces ""of entire governments"" no wonder they behaved so boldly",mobile.reuters.com,http://mobile.reuters.com/article/idUSKBN0TD1J420151124
2015-11-25,01:11:40,3u3kqy,309,Footage shows Syrian rebels fire 'US-made' missile at Russian rescue helicopter,mirror.co.uk,http://www.mirror.co.uk/news/world-news/footage-shows-syrian-rebels-fire-6892118?
2015-11-25,14:25:07,3u6n48,292,"New Zealand Police force academics to sign contract giving officers the power to ""improve"" research which shows ""negative results"" and then ""veto"" its publication",nzherald.co.nz,http://www.nzherald.co.nz/nz/news/article.cfm?c_id=1&objectid=11550677
