2015-09-26,06:15:35,3mdvtn,23097,NASA Will Announce A Major Mars Discovery On Monday,iflscience.com,http://www.iflscience.com/space/nasa-announce-major-discovery-regarding-mars-monday
2015-09-26,23:09:43,3mgrv2,12520,Poles furious after Russia blames them for starting WWII (from @AP),bigstory.ap.org,http://bigstory.ap.org/urn:publicid:ap.org:43af9cc8c7a8478fb24295179aae77ee
2015-09-26,20:32:33,3mgcyi,9867,German nurse shocked after being forced out of flat to make way for refugees,rt.com,http://www.rt.com/news/316568-germany-nurse-eviction-refugees/
2015-09-26,06:29:49,3mdy0j,3776,US and China ban ivory trade,wildaid.org,http://www.wildaid.org/news/us-and-china-agree-ban-ivory-trade
2015-09-26,00:59:57,3mclqf,1991,GCHQ surveillance has been tracking browsing history of every web user from porn visited websites to mobile locations,techti.me,http://techti.me/2015/09/25/gchq-surveillance-has-been-tracking-browsing-history-of-every-web-user-from-visited-websites-to-mobile-locations/
2015-09-26,15:41:11,3mfqnl,1779,"Fukushima, Up to 100% of No. 2 reactor fuel may have melted",nhk.or.jp,http://www3.nhk.or.jp/nhkworld/english/news/20150926_07.html
2015-09-26,18:12:15,3mg285,1713,"German Chancellor Angela Merkel called on world leaders to tackle the root causes of a global surge in refugees by pushing back on war and terror.""We have to work against the source that causes people to flee or be driven out.”",bloomberg.com,http://www.bloomberg.com/news/articles/2015-09-25/merkel-calls-on-world-leaders-to-tackle-source-of-refugee-surge?
2015-09-26,00:24:01,3mcge8,811,Finland demonstrators attack refugees with stones and fireworks,timesofindia.com,http://www.timesofindia.com/world/europe/Finland-demonstrators-attack-refugees-with-stones-and-fireworks/articleshow/49105128.cms
2015-09-26,21:55:56,3mgk7k,778,TPP talks to resume in Atlanta this weekend,channelnewsasia.com,http://www.channelnewsasia.com/news/business/singapore/tpp-talks-to-resume-in/2150858.html
2015-09-26,15:32:58,3mfpx7,713,U.S.-trained Rebel Surrenders Ammunition to Al Qaeda Affiliate in Syria,nytimes.com,http://www.nytimes.com/2015/09/26/world/middleeast/us-says-rebel-it-trained-surrendered-materiel-in-syria.html?action=click&pgtype=Homepage&module=first-column-region&region=top-news&WT.nav=top-news&hp
2015-09-26,19:04:47,3mg64f,668,"Fearing loss of TTIP deal, car industry buried U.S. safety report",digitaljournal.com,http://www.digitaljournal.com/life/driving/fearing-loss-of-ttip-deal-car-industry-buried-us-safety-report/article/444820
2015-09-26,19:25:40,3mg7rm,421,"The Thai captain of a seized cargo ship carrying an estimated $2 million worth of seafood has been arrested in Indonesia on suspicion of illegal fishing, in the latest development linked to an Associated Press investigation that uncovered a slave island earlier this year.",hosted.ap.org,http://hosted.ap.org/dynamic/stories/A/AS_SEAFOOD_FROM_SLAVES_ARREST?SITE=AP&SECTION=HOME&TEMPLATE=DEFAULT&CTIME=2015-09-26-00-16-08
2015-09-26,15:30:08,3mfpod,404,Switzerland bans sale of Volkswagen models,aljazeera.com,http://www.aljazeera.com/news/2015/09/switzerland-bans-sale-volkswagen-models-150926052308019.html
2015-09-26,23:47:12,3mgw7f,380,Anonymous leaks another high-level federal document as part of vendetta against government,news.nationalpost.com,http://news.nationalpost.com/news/canada/anonymous-leaks-another-high-level-federal-document-as-part-of-vendetta-against-government
2015-09-26,01:04:53,3mcmhi,378,Germany's Giessen asylum centre rife in rape and child abuse as refugee crisis grows,dailymail.co.uk,http://www.dailymail.co.uk/news/article-3247831/Rape-child-abuse-rife-overcrowded-asylum-centres-huge-surge-migrants-pushes-Germany-s-services-breaking-point-claim-womens-rights-groups-politicians.html
2015-09-26,11:32:04,3mf1ab,295,"CENTCOM Admits US-Trained Syrian Rebels Gave Their Supplies, Ammunition and Trucks to Al Qaeda Affiliate",news.vice.com,https://news.vice.com/article/centcom-admits-us-trained-syrian-rebels-gave-a-bunch-of-supplies-to-al-qaeda-affiliate
2015-09-26,16:14:24,3mftff,286,Islamic State gaining ground in Afghanistan: UN,al-monitor.com,http://www.al-monitor.com/pulse/contents/afp/2015/09/afghanistan-unrest-is-taliban-un.html
2015-09-26,22:25:08,3mgn1m,276,"Saudi Mufti: Hajj stampede beyond human control. Says authorities not responsible for deadly crush, adding that ""fate and destiny are inevitable"".",aljazeera.com,http://www.aljazeera.com/news/2015/09/saudi-grand-mufti-hajj-stampede-human-control-150926080554917.html
2015-09-26,20:09:22,3mgb36,173,Hajj stampede: Saudi mufti says deaths 'beyond human control',bbc.com,http://www.bbc.com/news/world-middle-east-34368387
2015-09-26,11:11:38,3meyui,155,"'New activity' detected at N. Korean nuclear test site: Amid concerns that Pyongyang may conduct a nuclear test to mark the 70th anniversary of the ruling party, US analysts say they have spotted a greater number of trucks and excavation activity at the Punggye-ri test site",dw.com,http://www.dw.com/en/new-activity-detected-at-n-korean-nuclear-test-site/a-18741571
2015-09-26,20:05:30,3mgaso,157,Australia set to abandon opposition to Assad as part of Syria settlement,theguardian.com,http://www.theguardian.com/australia-news/2015/sep/26/australia-set-to-abandon-opposition-to-assad-as-part-of-syria-settlement
2015-09-26,00:12:04,3mcek3,152,Judge Rules Sea Shepherd Wrongfully Sank Crippled 'Whale Wars' Vessel,ecorazzi.com,http://www.ecorazzi.com/2015/09/25/judge-rules-sea-shepherd-wrongfully-sank-whale-wars-vessel/
2015-09-26,23:37:24,3mgv1d,135,Student union blocks speech by 'inflammatory' anti-sharia activist,theguardian.com,http://www.theguardian.com/education/2015/sep/26/student-union-blocks-speech-activist-maryam-namazie-warwick?CMP=fb_gu
2015-09-26,07:59:33,3meaop,119,Switzerland Becomes First Country to Ban Sales of Certain VW Car Models,abcnews.go.com,http://abcnews.go.com/International/wireStory/latest-german-car-shares-rise-vw-board-meets-34029842
2015-09-26,07:43:10,3me8h8,112,Canadian mining company who spilled 1mn litres of cyanide resumes operations after 2 days.,reuters.com,http://www.reuters.com/article/2015/09/24/argentina-barrick-idUSL5N11U4G520150924
2015-09-26,03:46:31,3mdavj,108,China Will Pony Up $3.1 Billion to Help Poor Countries Fight Climate Change,motherjones.com,http://motherjones.com/environment/2015/09/china-climate-change-finance-obama-xi-pledge
2015-09-26,01:42:36,3mcs1f,108,GCHQ debuted a program called Karma Police seven years ago to track the browsing habits and communications of “every visible user on the Internet”,theintercept.com,https://theintercept.com/2015/09/25/gchq-radio-porn-spies-track-web-users-online-identities/
2015-09-26,18:32:03,3mg3r3,101,Millions of fingerprints stolen in US government hack,bbc.co.uk,http://www.bbc.co.uk/news/technology-34346802
2015-09-26,11:06:38,3mey96,98,Israeli soldiers assault AFP journalists at West Bank. Israeli soldiers seized and destroyed their equipment,uk.news.yahoo.com,https://uk.news.yahoo.com/israeli-soldiers-assault-afp-team-west-bank-demo-174542111.html
2015-09-26,19:11:04,3mg6np,76,"U.N. expert says migrants' rights inquiry thwarted by Australia | An independent U.N. investigator into the human rights of migrants has postponed an official visit to Australia that was due to begin on Sunday, citing a lack of government cooperation and ""unacceptable"" legal restrictions.",reuters.com,http://www.reuters.com/article/2015/09/25/us-australia-un-migrants-idUSKCN0RP1WN20150925
