2015-02-16,20:03:51,2w2i16,27875,64 ISIS Members Killed As Egypt Launches First Foreign Strikes In 24 Years,egyptianstreets.com,http://egyptianstreets.com/2015/02/16/64-isis-members-killed-as-egypt-launches-first-foreign-strikes-in-24-years/
2015-02-16,03:31:09,2vzw6k,12111,ISIS in Libya releases a video of beheading 21 Egyptian Christians.,reuters.com,http://www.reuters.com/article/2015/02/15/us-mideast-crisis-libya-egypt-idUSKBN0LJ10D20150215
2015-02-16,22:33:20,2w2toc,4327,Croatia Has Its First Female President,slavorum.org,http://www.slavorum.org/croatia-has-its-first-female-president/
2015-02-16,13:01:04,2w1okd,3209,"Former intelligence officer says PM Harper of Canada is using ""fascist"" techniques to fast track his anti-terror bill, and it will cause more terrorism, not less.",news.nationalpost.com,http://news.nationalpost.com/2015/02/13/former-csis-officer-warns-new-federal-anti-terror-bill-will-lead-to-lawsuits-embarrassment/?yep
2015-02-16,03:03:33,2vzswe,1955,Bill Clinton Apologizes To Mexico For War On Drugs,huffingtonpost.com,http://www.huffingtonpost.com/2015/02/13/bill-clinton-apology-drug-war-mexico_n_6680412.html?utm_hp_ref=politics
2015-02-16,04:13:03,2w01bm,1688,Hundreds of Jewish tombs damaged in northern France,reuters.com,http://www.reuters.com/article/2015/02/15/us-france-tombs-idUSKBN0LJ11820150215?feedType=RSS&feedName=worldNews
2015-02-16,07:30:07,2w0p7y,1645,"MI5 is facing allegations it was complicit in the sexual abuse of children, the high court in Northern Ireland will hear on Tuesday. Victims of the abuse are taking legal action to force a full independent inquiry with the power to compel witnesses to testify",theguardian.com,http://www.theguardian.com/society/2015/feb/15/mi5-kincora-childrens-home-northwen-ireland-sexual-abuse
2015-02-16,08:49:06,2w0yad,1141,Poland kicks off unprecedented military spending spree,yahoo.com,https://www.yahoo.com/news/poland-kicks-off-unprecedented-military-spending-spree-005930875.html
2015-02-16,19:59:42,2w2hri,1095,Heavy shelling hits Ukraine town where rebels reject ceasefire,reuters.com,http://www.reuters.com/article/2015/02/16/us-ukraine-crisis-shelling-idUSKBN0LK0LH20150216?feedType=RSS&feedName=topNews
2015-02-16,02:59:19,2vzsbm,1094,"The United States has stopped updating Israel about developments in nuclear negotiations with Iran in response to Netanyahu's planned congress speech, after Boehner admits he failed to tell administration he had invited PM.",ynetnews.com,"http://www.ynetnews.com/articles/0,7340,L-4626919,00.html"
2015-02-16,08:57:32,2w0z8j,877,India to build world’s largest solar power plant,timesofindia.indiatimes.com,http://timesofindia.indiatimes.com/india/At-750MW-Madhya-Pradesh-to-get-worlds-largest-solar-power-plant/articleshow/46257281.cms
2015-02-16,22:27:01,2w2t0t,506,EU acknowledges 'Russian forces in Ukraine',euobserver.com,https://euobserver.com/tickers/127661#.VOHt7VF4MKc.facebook
2015-02-16,02:30:24,2vzoro,435,"The man who is suspected of having shot two people dead in Copenhagen was 22 years old and born in Denmark, Copenhagen Police said on Sunday.",thelocal.dk,http://www.thelocal.dk/20150215/suspected-gunman-born-and-raised-in-denmark
2015-02-16,02:27:45,2vzofn,369,"Egypt says they have found a 2.5-kilometer smuggling tunnel leading into the Gaza Strip, the longest such passageway discovered in their crackdown on cross-border smuggling. The tunnel was operated by the military wing of the Palestinian Hamas movement, which Egypt says is a terrorist organization.",ynetnews.com,"http://www.ynetnews.com/articles/0,7340,L-4626930,00.html"
2015-02-16,19:44:41,2w2gv7,364,Experts call for ‘return to human intelligence’ after Snowden,theguardian.com,http://www.theguardian.com/technology/2014/nov/14/human-intelligence-snowden-surveillance-nsa-gchq
2015-02-16,21:31:10,2w2o75,345,Israeli hospital rebuilds injured Syrian man's face,bbc.com,http://www.bbc.com/news/world-middle-east-31449362
2015-02-16,14:31:18,2w1wxn,286,Egypt 'bombs IS targets in Libya',bbc.com,http://www.bbc.com/news/world-middle-east-31483631
2015-02-16,10:48:12,2w1av9,267,Thai officials tell teens to buy smaller condoms -- A Ministry of Public Health spokesman said teenagers feel pressured to buy larger condoms to avoid being mocked by their friends for having a small penis,upi.com,http://www.upi.com/Odd_News/2015/02/13/Thai-officials-tell-teens-to-buy-smaller-condoms/7981423852229/?spt=sec&or=on
2015-02-16,17:37:04,2w29bn,240,"Spy agencies fund climate research in hunt for weather weapon, scientist fears - Alan Robock raises concern over who'd control climate-altering technologies if research is paid for by intelligence agencies. “I think this should be out in the open & it has to be international...”",theguardian.com,http://www.theguardian.com/environment/2015/feb/15/spy-agencies-fund-climate-research-weather-weapon-claim
2015-02-16,20:33:53,2w2k03,201,Ukraine says won't pull back heavy weapons because of rebel fire.,news.yahoo.com,http://news.yahoo.com/two-civilians-killed-start-ukraine-ceasefire-095847883.html;_ylt=AwrBJR5Tv.FUQAcAyi3QtDMD
2015-02-16,12:15:19,2w1k04,185,Air France jet makes emergency landing in Russia -- Boeing 777 bound for Paris lands safely in Yekaterinburg in the Urals,cbc.ca,http://www.cbc.ca/news/world/air-france-jet-makes-emergency-landing-in-russia-1.2958468
2015-02-16,14:07:29,2w1uzg,188,Moscow Ready to Squeeze Out Migrants If Unemployment Surges,themoscowtimes.com,http://www.themoscowtimes.com/news/article/moscow-ready-to-squeeze-out-migrants-if-unemployment-surges/515946.html
2015-02-16,19:47:50,2w2h1w,159,Nicaraguans demand action over illness killing thousands of sugar cane workers: Families say government failing to address concerns that harsh working conditions are behind chronic kidney disease epidemic.,theguardian.com,http://www.theguardian.com/world/2015/feb/16/-sp-nicaragua-kidney-disease-killing-sugar-cane-workers
2015-02-16,16:14:00,2w24fr,149,A trafficker who raped and attacked young migrant girls he had led through the desert to Libya to make the perilous crossing to Italy was sentenced to 30 years by an Italian court.,thelocal.it,http://www.thelocal.it/20150216/trafficker-jailed-for-30-years-for-raping-migrants
2015-02-16,16:25:41,2w254t,88,"Two men charged with helping gunman suspected of carrying out Copenhagen attacks, Danish police say",bbc.com,http://www.bbc.com/news/world-europe-31485086
2015-02-16,00:38:55,2vzc63,70,"US to Send More than 4,000 Troops to Kuwait",telesurtv.net,http://www.telesurtv.net/english/news/US-to-Send-More-than-4000-Troops-to-Kuwait-20150214-0023.html
2015-02-16,23:20:58,2w2ypc,67,"Rebels offer corridor for Ukraine troops out of key town -- the number of encircled Ukrainian soldiers could be as high as 7,000",reuters.com,http://www.reuters.com/article/2015/02/16/us-ukraine-crisis-corridor-idUSKBN0LK12F20150216
2015-02-16,21:22:42,2w2ni5,68,Sweden has agreed to Russian demands not to land fighter jets in Estonia during a coming military exercise in the Baltic region.,thelocal.se,http://www.thelocal.se/20150216/cweden-agreed-to-russiand-emands
2015-02-16,02:39:45,2vzpx5,68,Palestinian Authority President Mahmoud Abbas warned on Friday that he would be “forced to take harsh steps” if Israel does not release the tax revenues belonging to the Palestinians.,jpost.com,http://www.jpost.com/Israel-News/Abbas-warns-Israel-over-held-Palestinian-tax-revenues-391022
2015-02-16,19:17:31,2w2f79,64,"On Saturday, a jury in Calgary found Gary Sorenson, 71, and Milowe Brost, 61, guilty of fraud and theft in what the RCMP has characterized as the largest Ponzi scheme in Canadian history.",theglobeandmail.com,http://www.theglobeandmail.com/news/national/largest-ponzi-scheme-in-canadian-history-exploited-boom-time-alberta/article23010870/
