2015-04-04,05:16:38,31cjqb,8502,Hackers leak messages between Kremlin and France’s far-right party Front National,newsweek.com,http://www.newsweek.com/hackers-claim-leak-messages-between-kremlin-and-frances-front-national-319442
2015-04-04,18:03:30,31el1p,4725,"Saudi-led airstrike in Yemen kills family of nine, including 6 children",haaretz.com,http://www.haaretz.com/news/middle-east/1.650467
2015-04-04,19:46:40,31eqnu,4074,"Warning over thousands of unqualified teachers 'jeopardising' children's education in Britain - The latest government figures show that 17,100 unqualified teachers are working in publicly funded schools across England",independent.co.uk,http://www.independent.co.uk/news/education/education-news/warning-over-thousands-of-unqualified-teachers-jeopardising-childrens-education-in-britain-10155503.html
2015-04-04,20:39:07,31etn2,2709,Survivor from Kenya massacre emerges after two days in wardrobe,timeslive.co.za,http://www.timeslive.co.za/africa/2015/04/04/survivor-from-kenya-massacre-emerges-after-two-days-in-wardrobe
2015-04-04,17:49:02,31ek9n,1992,"Al-Shabab, the Somali armed group that carried out a deadly attack on a Kenyan university killing 148 people on Thursday, has threatened to stage more attacks in the country. In a statement issued on Saturday, the group warned Kenyans that their cities will ""run red with blood"".",aljazeera.com,http://www.aljazeera.com/news/2015/04/kenya-garissa-al-shabab-150404064958471.html
2015-04-04,18:04:40,31el3x,1519,Cocaine instead of bananas found in Prague supermarket,praguepost.com,http://praguepost.com/the-big-story/46546-bananas-contained-1-billion-kc-of-cocaine
2015-04-04,10:50:00,31dmdn,1413,"After Obama's cybersecurity order threatens Snowden fund, bitcoin donations spike",zdnet.com,http://www.zdnet.com/article/snowden-donations-rocket-after-obamas-cybersecurity-order-outlaws-fund/
2015-04-04,03:14:05,31c38x,1400,"Poland thanks Russia, China for help in Yemen evacuation",thenews.pl,"http://www.thenews.pl/1/10/Artykul/202480,Poland-thanks-Russia-China-for-help-in-Yemen-evacuation"
2015-04-04,19:46:28,31eqn9,1287,"Hundreds rally against Islamic extremism in Australia - Organizers claim they are not anti-Muslim, while counter demonstrators say event motivated by racism",timesofisrael.com,http://www.timesofisrael.com/hundreds-rally-against-islamic-extremism-in-australia/
2015-04-04,03:59:41,31c9j3,961,Venezuelan hotels are asking tourists to bring their own toilet paper due to shortage,fusion.net,http://fusion.net/story/113448/venezuelan-hotels-are-asking-tourists-to-bring-their-own-toilet-paper/?utm_source=twitter&utm_medium=social&utm_campaign=socialshare&utm_content=sticky+nav
2015-04-04,16:04:46,31edz8,746,State Department rejects Netanyahu's call for Iran deal to affirm Israel's 'right to exist',foxnews.com,http://www.foxnews.com/politics/2015/04/03/state-department-rejects-call-for-iran-deal-to-affirm-israel-right-to-exist/
2015-04-04,05:50:25,31co5l,693,"(Reuters) - A Chinese naval frigate has evacuated 225 foreign citizens from strife-torn Yemen, its foreign ministry said, marking the first time that China's military has helped other countries evacuate their people during an international crisis.",reuters.com,http://www.reuters.com/article/2015/04/03/us-yemen-security-china-idUSKBN0MU09M20150403
2015-04-04,23:10:15,31f4s0,538,"Islamic State has taken control of 90 percent of a Palestinian refugee camp on the Damascus outskirts where 18,000 civilians have suffered years of bombing, army siege and militia control, a monitoring group said on Saturday.",reuters.com,http://www.reuters.com/article/2015/04/04/us-mideast-crisis-syria-yarmouk-idUSKBN0MV08520150404
2015-04-04,05:15:28,31cjkv,471,"After Iraqi forces take Tikrit from ISIS, a wave of looting and lynching occurs.",reuters.com,http://www.reuters.com/article/2015/04/03/us-mideast-crisis-iraq-tikrit-special-re-idUSKBN0MU1DP20150403
2015-04-04,11:26:28,31dq1w,423,The Russian Government Runs a Troll Agency to Flood the Internet With Propaganda,yahoo.com,https://www.yahoo.com/tech/the-russian-government-runs-a-troll-agency-to-115389567389.html
2015-04-04,19:36:04,31eq14,414,Romania will expel seven foreign nationals accused of recruiting members for the Islamic State group and Al-Qaeda and propagating their ideas in the eastern European country,france24.com,http://www.france24.com/en/20150404-romania-expel-seven-recruiting-al-qaeda/
2015-04-04,20:42:04,31ettu,371,"Now, drones to be used to disperse mobs in Lucknow",timesofindia.indiatimes.com,http://timesofindia.indiatimes.com/city/lucknow/Now-drones-to-be-used-to-disperse-mobs-in-Lucknow/articleshow/46794530.cms
2015-04-04,05:01:08,31chmn,359,Kim Jong-un Assembles New ‘Pleasure Squad’ of Young Women,newsweek.com,http://www.newsweek.com/kim-jong-un-assembles-new-pleasure-squad-young-women-319030
2015-04-04,02:03:42,31bt95,355,Benjamin Netanyahu Says Final Nuclear Deal Must Include Iran’s Recognition of Israel,nytimes.com,http://www.nytimes.com/2015/04/04/world/middleeast/benjamin-netanyahu-says-final-nuclear-deal-must-include-irans-recognition-of-israel.html
2015-04-04,05:06:08,31ci8g,303,Russian ships in old Arctic NATO base set alarms bells ringing,news.yahoo.com,http://news.yahoo.com/russian-ships-old-arctic-nato-set-alarms-bells-050008186.html
2015-04-04,01:17:49,31bmup,273,President Rouhani: Iran Will Honor Framework For Nuclear Agreement If World Powers Do,huffingtonpost.com,http://www.huffingtonpost.com/2015/04/03/iran-rouhani-nuclear-agreement-_n_6999762.html
2015-04-04,01:45:01,31bqk3,217,US forces to hold exercises in Ukraine,stripes.com,http://www.stripes.com/us-forces-to-hold-exercises-in-ukraine-1.337639
2015-04-04,00:28:47,31bg44,179,"Kenya: Religious leaders in Garissa disown attackers - ""We the Muslim Community of Garissa County condemn the heinous acts committed against innocents of Garissa University College; we sincerely send our heartfelt condolences to the families and friends of those killed.""",standardmedia.co.ke,http://www.standardmedia.co.ke/article/2000157158/religious-leaders-in-garissa-disown-attackers/
2015-04-04,20:49:06,31eu80,170,Pakistanis campaign against new laws that may limit internet freedom,techinasia.com,https://www.techinasia.com/pakistanis-campaign-cyber-laws-severely-curb-internet-freedom/
2015-04-04,05:11:20,31cize,162,"Massive Gas Reserves Found in Tanzania by Statoil, Economy Expected to Boom",air.exile.is,http://air.exile.is/tanzania-economy-projected-to-accelerate-following-statoil-natural-gas-discovery/198
2015-04-04,10:37:57,31dl5h,143,China objects after US fighter planes land in Taiwan,ph.news.yahoo.com,https://ph.news.yahoo.com/china-objects-us-fighter-planes-land-taiwan-110734993.html
2015-04-04,19:48:26,31eqrc,122,"Porn sites must have age checks, say UK Conservatives",bbc.co.uk,http://www.bbc.co.uk/news/uk-32180744?ocid=socialflow_facebook
2015-04-04,13:43:04,31e321,110,Egypt Kills 100 Militants in the Sinai Peninsula in Retribution for Previous Attacks,presstv.ir,http://www.presstv.ir/Detail/2015/04/03/404564/Egypt-kills-100-terrorists-in-Sinai
2015-04-04,21:20:33,31ew8q,88,Yemen conflict: Saudi Arabia considers pause in intervention,bbc.com,http://www.bbc.com/news/world-middle-east-32180847
2015-04-04,20:02:10,31ergm,81,Reclaim Australia group takes out rallies against Islamic law - World,dawn.com,http://www.dawn.com/news/1173902/
