2015-08-03,12:15:11,3fkten,22010,'Ultimate Frisbee' recognised by International Olympic Committee,bbc.com,http://www.bbc.com/news/world-us-canada-33752105
2015-08-03,02:33:57,3fiye5,3118,Israel approves use of harsher measures against 'Jewish terrorists',jpost.com,http://www.jpost.com/Arab-Israeli-Conflict/Israel-approves-use-of-harsher-measures-for-Jewish-terrorists-410916
2015-08-03,00:13:55,3fiiqk,3011,Uproar as India 'bans' porn sites,tribune.com.pk,http://tribune.com.pk/story/930919/indians-shocked-as-porn-sites-become-inaccessible/
2015-08-03,13:18:27,3fl03e,2740,2000 year old termite mounds in Africa confirm that insects can sustain a millennia in the same home,bbc.com,http://www.bbc.com/earth/story/20150729-2000-year-old-termite-mound-found
2015-08-03,08:44:15,3fk693,2455,"Photojournalist found dead in Mexico City after he fled harassment in his home state Veracruz, where 11 journalists have been killed there since 2010",theguardian.com,http://www.theguardian.com/world/2015/aug/02/mexican-photojournalist-killed-ruben-espinosa-tortured
2015-08-03,02:26:56,3fixki,2184,"Japanese Heat Wave Kills Six, Leaves Over 3,000 Hospitalized - A heat wave in Japan caused the deaths of six people over the weekend, almost 40 Japanese nationals were killed by heatstroke since June.",sputniknews.com,http://sputniknews.com/asia/20150802/1025329484.html
2015-08-03,06:49:08,3fjsyz,1784,"Colombia aims to buy land from private owners and redistribute it among the poor after its 50-year-old war ends, the government said Sunday, addressing the root cause of the conflict.The conflict has left more than 200,000 dead and forced some six million people from their homes.",digitaljournal.com,http://www.digitaljournal.com/news/world/colombia-to-buy-land-for-poor-in-post-war-period/article/440008?
2015-08-03,02:28:06,3fixpp,1427,"Canadian PM Stephen Harper dissolves Parliament, calls general election for October 19",indianexpress.com,http://indianexpress.com/article/world/americas/canadian-pm-stephen-harper-dissolves-parliament-calls-general-election-for-october-19/
2015-08-03,09:39:48,3fkcg3,1131,Nigeria's military has rescued 71 girls and women in firefights that killed several Boko Haram fighters,aljazeera.com,http://www.aljazeera.com/news/2015/07/nigeria-frees-dozens-boko-haram-captivity-150730194223142.html
2015-08-03,23:41:18,3fmh25,1116,Former City trader Tom Hayes has been found guilty at a London court of rigging global Libor interest rates.,bbc.com,http://www.bbc.com/news/business-33763628
2015-08-03,23:00:26,3fmc05,1076,Ex-British prime minister named in child sex abuse investigation,candydirectnews.com,http://candydirectnews.com/ex-british-prime-minister-named-in-child-sex-abuse-investigation/
2015-08-03,05:54:08,3fjmdt,850,"Drugmaker GlaxoSmithKline , which was fined a record 3 billion yuan ($483 million) for corruption in China last year and is examining possible staff misconduct elsewhere, faces new allegations of bribery in Romania.",financialexpress.com,http://www.financialexpress.com/article/companies/glaxosmithkline-faces-new-corruption-allegations-this-time-in-romania/110554/
2015-08-03,22:48:45,3fmao6,816,Indonesian foundation defends awarding Kim Jong-un peace prize,jakarta.coconuts.co,http://jakarta.coconuts.co/2015/08/03/sukarno-education-foundation-defends-awarding-kim-jong-un-peace-prize
2015-08-03,19:06:58,3flr1h,790,Illegal immigrants to UK face eviction without court order under new plans - Landlords who fail to check tenants’ immigration status face five-year jail terms as part of government crackdown to reduce UK’s appeal as a migrant destination,theguardian.com,http://www.theguardian.com/uk-news/2015/aug/03/illegal-immigrants-face-eviction-without-court-order-under-plans-to-discourage-migrants
2015-08-03,13:26:28,3fl0w3,695,Landlords who fail to evict migrants who do not have the right to live in Britain could be jailed for up to five years under measures to be included in the Immigration Bill.,news.sky.com,http://news.sky.com/story/1529362/landlords-who-rent-to-illegal-migrants-face-jail
2015-08-03,19:22:03,3fls3y,667,Japan calls US spying allegations 'deeply regrettable',economictimes.indiatimes.com,http://economictimes.indiatimes.com/news/international/world-news/japan-calls-us-spying-allegations-deeply-regrettable/articleshow/48324623.cms
2015-08-03,00:46:12,3fim4h,546,Israeli President Rivlin receives death threats from Jewish extremists following his plea for peace in light of Palestinian baby's murder,haaretz.com,http://www.haaretz.com/news/israel/1.669104
2015-08-03,06:28:55,3fjqjw,544,Saudi king cuts short controversial holiday in France - BBC News,bbc.com,http://www.bbc.com/news/world-europe-33754508
2015-08-03,22:00:21,3fm5hl,542,Al-Qaeda Militants Accuse Islamic State Of Being A Con,rferl.org,http://www.rferl.org/content/militants-warn-recruits-against-is-mirage-and-illusion/27167204.html
2015-08-03,05:28:02,3fjjbd,273,Vladimir Putin's Deputy Prime Minister owns a secret £12million apartment just a short walk from Downing Street,dailymail.co.uk,http://www.dailymail.co.uk/news/article-3182636/Vladimir-Putin-s-Deputy-Prime-Minister-owns-secret-12million-apartment-just-short-walk-Downing-Street.html
2015-08-03,07:49:20,3fk002,230,"Venezuela supermarket looting leaves one dead, dozens detained",reuters.com,http://www.reuters.com/article/2015/08/01/us-venezuela-violence-idUSKCN0Q52GV20150801
2015-08-03,14:28:53,3fl6nr,214,"Clinton mails reveal US impression that UK PM David Cameron was 'unsure, inexperienced, oblique, and largely uncommitted' while London Mayor Boris Johnson was 'clown prince'",ibtimes.co.uk,http://www.ibtimes.co.uk/clinton-mails-reveal-us-impression-inexperienced-david-cameron-clown-prince-boris-johnson-1513768
2015-08-03,11:38:57,3fkpjq,213,Danish architecture firm BIG has a plan to turn four 300-foot smokestacks atop London's Battersea Power Station into the world's tallest Tesla coils,weburbanist.com,http://weburbanist.com/2015/08/02/big-plans-to-turn-4-london-power-plant-chimneys-into-tesla-coils/
2015-08-03,23:41:54,3fmh5f,193,Two alleged 'IS' returnees to Germany go on trial,dw.com,http://www.dw.com/en/two-alleged-is-returnees-to-germany-go-on-trial/a-18624312
2015-08-03,05:45:05,3fjlax,165,French police spray chemical irritant on migrants trying to storm tunnel,ctvnews.ca,http://www.ctvnews.ca/world/french-police-spray-chemical-irritant-on-migrants-trying-to-storm-tunnel-1.2498794
2015-08-03,07:30:24,3fjxvi,164,Israeli leaders propose harsh new measures to fight ‘Jewish terrorism’,washingtonpost.com,https://www.washingtonpost.com/world/israelis-hold-anti-violence-rallies-after-attacks-against-palestinians-gays/2015/08/02/c3df0fdc-9a6a-4922-ae60-7d2e2ecd5214_story.html
2015-08-03,22:27:25,3fm8ah,150,UK police investigated over alleged child sex abuse cover up involving former Prime Minister,euronews.com,http://www.euronews.com/2015/08/03/uk-police-investigated-over-alleged-child-sex-abuse-cover-up-involving-former
2015-08-03,01:03:09,3finzk,111,Germany halts treason inquiry into journalists after protests,theguardian.com,http://www.theguardian.com/world/2015/jul/31/germany-halts-treason-inquiry-journalists-surveillance-protests
2015-08-03,15:28:27,3flbnl,109,"'Breasts are not weapons,' say Hong Kong protesters",edition.cnn.com,http://edition.cnn.com/2015/08/02/asia/hong-kong-breast-assault-protest/index.html
2015-08-03,20:44:44,3flyd8,97,"Ebola vaccine works, offering 100% protection in African trial: A highly unusual clinical trial in Guinea has shown for the first time that an Ebola vaccine protects people from the deadly virus.",news.sciencemag.org,http://news.sciencemag.org/health/2015/07/ebola-vaccine-works-offering-100-protection-african-trial
