2015-08-14,04:00:06,3gvs88,14570,"CNN & CBC Sued For Pirating 31 Second YouTube Video - In addition to claims of copyright infringement, the media giants face allegations that they breached the anti-circumvention measures of the DMCA.",torrentfreak.com,https://torrentfreak.com/cnn-cbc-sued-for-pirating-31-second-youtube-video-150813/
2015-08-14,14:39:57,3gy06e,24747,Ireland Refuses to Extradite Man to US Because Prison System is Too Inhumane,theantimedia.org,http://theantimedia.org/cassius-methyl-ireland-refuses-extradite-man-inhumane-us-prison-system/
2015-08-14,23:46:43,3gzcld,15703,American flag raised in Havana for first time in 54 years,usatoday.com,http://www.usatoday.com/story/news/world/2015/08/14/american-flag-set-raised-havana-first-time-54-years/31702553/
2015-08-14,20:22:08,3gyqb8,5669,"Humans definitely killed off mammoths, giant armadillo, sabretooth tiger, scientists claim - New research settles argument about whether whether humans or climate change was responsible for the end of ‘megafauna’, it is claimed, and ‘debunks the myth of early humans living in harmony with nature’",independent.co.uk,http://www.independent.co.uk/news/science/humans-definitely-killed-off-woolly-mammoths-giant-armadillo-and-sabretooth-tiger-scientists-claim-10455447.html
2015-08-14,16:41:30,3gya97,2876,Facebook cancelled a student's internship after he highlighted a massive privacy issue,businessinsider.in,http://www.businessinsider.in/Facebook-cancelled-a-students-internship-after-he-highlighted-a-massive-privacy-issue/articleshow/48467251.cms
2015-08-14,15:43:54,3gy5mb,2409,"Australia’s federal court rejects US studio’s claims for piracy damages, saying it may invoice downloaders for the cost of a legitimate copy only",theguardian.com,http://www.theguardian.com/film/2015/aug/14/dallas-buyers-club-piracy-case-court-dismisses-many-of-studios-surreal-claims
2015-08-14,05:58:36,3gw9da,1911,John Kerry: I write emails assuming that Russia and China are 'very likely' reading them,businessinsider.com,http://www.businessinsider.com/john-kerry-i-write-emails-assuming-that-russia-and-china-are-very-likely-reading-them-2015-8#ixzz3ijNTdLcj
2015-08-14,22:26:55,3gz2pk,1701,US warns citizens not to attend Auckland TPP rally,radionz.co.nz,http://www.radionz.co.nz/news/national/281375/us-warns-citizens-not-to-attend-akl-tpp-rally
2015-08-14,16:59:12,3gybi7,1295,"25,000 Farmers Seek President’s Permission To Hang Themselves On Independence Day (Aug 15)",thelogicalindian.com,http://thelogicalindian.com/news/25000-farmers-seek-presidents-permission-to-hang-themselves-on-independence-day/
2015-08-14,07:56:47,3gwpj1,1146,Reports: ISIL used mustard gas against Kurds,usatoday.com,http://www.usatoday.com/story/news/world/2015/08/13/reports-isil-used-mustard-gas-against-kurds/31665149/
2015-08-14,20:14:14,3gypnb,902,Gene therapy cures blindness by replacing vision cells in eyes.,newscientist.com,https://www.newscientist.com/article/dn28047-gene-therapy-cures-blindness-by-replacing-vision-cells-in-eyes/?utm_source=NSNS&utm_medium=SOC&utm_campaign=twitter&cmpid=SOC%7CNSNS%7C2015-GLOBAL-twitter
2015-08-14,03:23:54,3gvn0b,863,"Jimmy Carter: Zero chance for Israeli-Palestinian two-state solution - Netanyahu decided 'early on to adopt a one-state solution, but without giving the Palestinians equal rights,'",haaretz.com,http://www.haaretz.com/news/diplomacy-defense/1.671056
2015-08-14,04:52:42,3gvztd,782,"Russian Foreign Minister Lavrov mutters ""fucking morons"" as Saudi counterpart talks during press conference",upi.com,http://www.upi.com/Top_News/World-News/2015/08/13/Russian-FM-Lavrov-mutters-salty-language-during-press-conference-with-Saudi-counterpart/1251439476808/?src=r
2015-08-14,11:33:59,3gxgj3,585,"Air pollution in China is killing 4,000 people every day, a new study finds",theguardian.com,http://www.theguardian.com/world/2015/aug/14/air-pollution-in-china-is-killing-4000-people-every-day-a-new-study-finds
2015-08-14,09:01:48,3gwxwb,575,"Sea creature called ""Flying Spaghetti Monster"" found beneath ocean.",mirror.co.uk,http://www.mirror.co.uk/news/world-news/flying-spaghetti-monster-sea-creature-6243890
2015-08-14,05:26:01,3gw4pr,379,Marines who removed flag from U.S. embassy in Cuba return 54 years later to raise it again,latino.foxnews.com,http://latino.foxnews.com/latino/lifestyle/2015/08/13/marines-who-removed-flag-from-us-embassy-in-cuba-return-54-years-later-to-raise/?intcmp=hplnws
2015-08-14,23:39:22,3gzbno,349,PM: Japan can't keep apologizing,cnn.com,http://www.cnn.com/2015/08/14/asia/japan-wwii-abe-apology/index.html
2015-08-14,18:00:02,3gyfof,270,Tianjin explosions so huge they were visible from space,theguardian.com,http://www.theguardian.com/world/2015/aug/13/tianjin-explosions-visible-from-space-china
2015-08-14,03:15:07,3gvlpy,253,"China silences netizens critical of ""disgraceful"" blast coverage. Posts suggesting that authorities restricted international media reporting on the incident removed.",bbc.co.uk,http://www.bbc.co.uk/news/world-asia-china-33908168
2015-08-14,03:16:14,3gvlwm,213,Fidel Castro to US: you owe us millions,news.yahoo.com,http://news.yahoo.com/fidel-castro-us-owe-us-millions-133858731.html
2015-08-14,07:48:18,3gwofy,195,Team from International Atomic Energy Agency has been sent to scene of blast in China,pzfeed.com,http://pzfeed.com/team-from-international-atomic-energy-agency-has-been-sent-to-scene-of-blast-in-china/
2015-08-14,16:28:02,3gy98d,192,Calais mayor threats to open France's borders and allow thousands of migrants into Britain,msn.com,http://www.msn.com/en-gb/news/world/calais-mayor-threats-to-open-frances-borders-and-allow-thousands-of-migrants-into-britain/ar-BBlII6Z?ocid=iehp
2015-08-14,10:32:07,3gx930,174,"The United States believes Islamic State militants likely used mustard agent in an attack on Kurdish forces in Iraq earlier this week, the first indication the militant group has obtained a banned chemical weapon, the Wall Street Journal reported on Thursday.",reuters.com,http://www.reuters.com/article/2015/08/14/us-mideast-crisis-chemicalweapons-idUSKCN0QI2GT20150814?feedType=RSS&feedName=topNews
2015-08-14,20:15:16,3gypq8,145,A-level results 2015: UK exam board OCR admits it 'estimates' hundreds of pupils' grades after papers 'go missing',independent.co.uk,http://www.independent.co.uk/news/education/education-news/alevel-results-2015-uk-exam-board-ocr-admits-it-estimates-hundreds-of-pupils-grades-after-papers-go-missing-10434417.html
2015-08-14,15:46:09,3gy5sr,130,"A group of scientists from the Autonomous University of Mexico has discovered a sacred sinkhole cave, known as a cenote, under Chichen Itza’s grand Kukulkan Castle Pyramid, which could shed new light on the ancient Maya civilisation.",euronews.com,http://www.euronews.com/2015/08/14/scientists-find-sinkhole-cave-under-mexico-s-kukulkan-castle-pyramid/
2015-08-14,02:02:54,3gvb9o,121,"Scientists have created a ‘mother’ robot that can build babies out of mechanised blocks, and then create new ones that evolve from the previous generation. The findings show that robots could be able to evolve on their own, in the same way that animals and humans have.",independent.co.uk,http://www.independent.co.uk/life-style/gadgets-and-tech/news/robot-mother-builds-babies-that-can-evolve-on-their-own-10453196.html
2015-08-14,02:36:23,3gvg7m,117,"Uzbekistan Airlines will begin to weigh passengers for ""flight safety""",time.com,http://time.com/3995936/airline-passenger-weight/
2015-08-14,00:11:04,3guvin,96,Afghans carry 100 meter tricolor to thank India for reconstructing the Salma Dam.,indiatimes.com,http://www.indiatimes.com/news/world/afghans-carry-100-metre-tricolour-to-thank-india-for-reconstructing-the-salma-dam-244102.html
2015-08-14,12:21:51,3gxm62,79,"Illegal immigrants storm Police station and riot, several injured in Greece",eutimes.net,http://www.eutimes.net/2015/08/illegal-immigrants-storm-police-station-several-injured-on-greek-island/?utm_source=feedburner&utm_medium=feed&utm_campaign=Feed%3A+TheEuropeanUnionTimes+%28The+European+Union+Times%29
2015-08-14,14:12:01,3gxxnk,67,US calls on China to improve human rights record; Beijing rakes up Ferguson shooting,indianexpress.com,http://indianexpress.com/article/world/asia/us-presses-china-on-human-rights-ahead-of-xis-visit-beijing-brings-up-ferguson-shooting/
