2015-11-01,22:54:30,3r31uv,25077,"Report: UN Staff Transported 380 Pounds of Weed, Watched and Shared Child Porn, and Tried to Bring a Chainsaw onto a Plane",news.vice.com,https://news.vice.com/article/the-uns-weirdest-crimes-380-pounds-of-weed-child-porn-and-a-chainsaw-on-a-plane
2015-11-01,04:55:11,3r0bmt,9875,A man held for 14 years without being charged at Guantanamo wants an independent UK inquiry,globalnews.ca,http://globalnews.ca/news/2311139/lawyers-says-freed-guantanamo-prisoner-wants-independent-uk-inquiry/
2015-11-01,09:37:36,3r1afu,12070,"Denmark's Prime Minister says ""I know that some people in the US associate the Nordic model with some sort of socialism, ... therefore I would like to make one thing clear. Denmark is far from a socialist planned economy. Denmark is a market economy""",vox.com,http://www.vox.com/2015/10/31/9650030/denmark-prime-minister-bernie-sanders
2015-11-01,22:54:16,3r31tr,3785,Burger King could become the first fast food chain to sell alcohol in the UK,independent.co.uk,http://www.independent.co.uk/news/uk/home-news/burger-king-launches-bid-to-become-first-fast-food-chain-to-sell-alcohol-in-the-uk-a6716946.html
2015-11-01,20:08:28,3r2m3x,3624,"Germany is about to start up a monster machine that could revolutionize the way we use energy: the Max Planck Institute has completed the world’s largest nuclear fusion machine of its kind, called a stellarator",businessinsider.my,http://www.businessinsider.my/germany-is-turning-on-its-monster-stellarator-2015-10/#wXRyPL4IpHtc9hG7.97
2015-11-01,12:23:48,3r1r0d,3431,A rare intense tropical cyclone has formed in the Arabian Sea and is forecast to dump eight years of rain in about 48 hours on typically arid regions of the Arabian Peninsula.,stuff.co.nz,http://www.stuff.co.nz/world/middle-east/73553618/rare-tropical-cyclone-to-bring-eight-years-of-rain-in-two-days-in-arabia
2015-11-01,03:46:31,3r02cy,2207,Seized Turkish Media Outlets Turn Pro-government Overnight,voanews.com,http://www.voanews.com/content/seized-turkish-media-outlets-turn-pro-government-overnight/3030392.html
2015-11-01,06:19:33,3r0ms9,1902,Controversial plans to allow the police and security services full access to everyone’s internet browsing history have been abandoned by ministers in UK.,theguardian.com,http://www.theguardian.com/world/2015/oct/31/theresa-may-backtracks-on-internet-snooping?CMP=Share_iOSApp_Other
2015-11-01,14:52:35,3r22q9,815,Venezuela is running out of cash and selling its gold,money.cnn.com,http://money.cnn.com/2015/10/29/news/economy/venezuela-selling-gold/index.html?iid=surge-story-summary
2015-11-01,10:08:59,3r1dqp,728,German frustration builds over TTIP secrecy from US: German parliamentarians are demanding access to documents that contain the US position on transatlantic trade negotiations. TTIP supporters in the US argue that Washington shouldn't lay all of its cards on the table,dw.com,http://www.dw.com/en/german-frustration-builds-over-ttip-secrecy-from-us/a-18819097
2015-11-01,14:38:37,3r21sm,644,"Muslim children should not be forced to sing national anthem, says Hizb ut-Tahrir",smh.com.au,http://www.smh.com.au/national/muslim-children-should-not-be-forced-to-sing-national-anthem-says-hizb-uttahrir-20151101-gknwy9.html
2015-11-01,06:32:16,3r0oh2,589,Co-Pilot's Wife: He Complained About Plane - Says that daughter called co-pilot of the Russian plane that crashed & he complained before the flight that the technical condition of the aircraft left much to be desired.,nytimes.com,http://www.nytimes.com/aponline/2015/10/31/world/middleeast/ap-egypt-russian-plane-the-latest.html
2015-11-01,21:53:07,3r2v6y,569,"Scientists and nuclear experts from around the world gathered in southwestern Japan on Sunday to push for the abolition of nuclear weapons and other weapons of mass destruction, with this year marking the 70th anniversary of the U.S. atomic bombings of Japanese cities.",mainichi.jp,http://mainichi.jp/english/english/newsselect/news/20151101p2g00m0dm008000c.html
2015-11-01,19:42:24,3r2k9i,492,"At least 129 refugees have been found in a refrigerated truck on the Bulgarian border with Turkey, according to a Bulgarian state news agency report. The refrigerated truck driven by a Turkish citizen attempted to enter Bulgaria at the Kapitan Andreevo border checkpoint with Turkey",aljazeera.com,http://www.aljazeera.com/news/2015/11/refugees-refrigerated-truck-bulgaria-151101071930851.html
2015-11-01,05:58:46,3r0jzi,426,Cambridge chemists make breakthrough with “ultimate” battery which can power a car from London to Edinburgh,independent.co.uk,http://www.independent.co.uk/news/uk/cambridge-chemists-make-breakthrough-with-ultimate-battery-which-can-power-a-car-from-london-to-a6716046.html
2015-11-01,08:36:54,3r13ra,325,Saddam-style: ISIS oil exports worth $500m a year 'conducted through Turkey',rt.com,https://www.rt.com/news/320190-isis-oil-saddam-turkey/
2015-11-01,19:49:11,3r2kpy,302,Blair denies ministers were told to 'burn' Iraq war legal advice,theguardian.com,http://www.theguardian.com/uk-news/2015/nov/01/tony-blair-denies-ministers-told-burn-iraq-war-legal-advice
2015-11-01,01:35:34,3qzjiv,297,"Lufthansa, Air France avoid flying over Sinai after crash",reuters.com,http://www.reuters.com/article/2015/10/31/us-egypt-crash-airlines-idUSKCN0SP0W220151031
2015-11-01,07:30:45,3r0vwo,269,"UN & Red Cross issue rare joint rebuke, scold world leaders over 'conflict paralysis' - Urge immediate concrete steps to ease plight of civilians in places like Afghanistan, Nigeria & Syria. 1st time they've issued a joint warning. ""Instability is spreading. Suffering is growing.""",bbc.com,http://www.bbc.com/news/world-europe-34690546
2015-11-01,21:57:25,3r2vm0,243,"Sinai plane ""broke up in mid air""",bbc.co.uk,http://www.bbc.co.uk/news/world-middle-east-34691763
2015-11-01,03:16:29,3qzy1n,235,Greek Banks Face $15.9 Billion Bill After Economic Debacle,bloomberg.com,http://www.bloomberg.com/news/articles/2015-10-31/greek-banks-must-raise-14-4-billion-euros-after-ecb-stress-test
2015-11-01,22:59:57,3r32fv,227,"Small, dim stars could still support life",news.sciencemag.org,http://news.sciencemag.org/space/2015/10/small-dim-stars-could-still-support-life
2015-11-01,15:16:32,3r24d0,192,"Somalia threatened by illegal fishermen after west chases away pirates | “Nato came because of the piracy, but the cause of piracy is the illegal fishing,” says Wa’is, the Eyl official. “If Nato can chase away the pirates, then why not the illegal fishermen?”",theguardian.com,http://www.theguardian.com/world/2015/oct/31/somalia-fishing-flotillas-pirates-comeback
2015-11-01,03:42:11,3r01qm,182,"Afghan Soldiers, Besieged by Taliban, Say They Are Outgunned",nytimes.com,http://www.nytimes.com/2015/10/31/world/asia/afghanistan-security-forces-taliban.html?smid=re-share
2015-11-01,20:13:30,3r2mh1,103,Elderly South Korean man kidnapped by extremists found dead in a sack,independent.co.uk,http://www.independent.co.uk/news/world/asia/elderly-south-korean-man-kidnapped-by-abu-sayyaf-militants-10-months-ago-found-dead-in-a-sack-a6716761.html
2015-11-01,06:36:38,3r0p1t,102,"4 UK bird species including puffins 'face extinction' - ""Erosion of UK's wildlife is staggering & this is reinforced when you talk about puffin & turtle dove now facing the same level of threat as African elephant & lion & being more endangered than the humpback whale.""",bbc.com,http://www.bbc.com/news/uk-34664385
2015-11-01,16:20:29,3r28bj,98,Mass Gains Of Antarctic Ice Sheet Greater Than Losses,eurasiareview.com,http://www.eurasiareview.com/01112015-mass-gains-of-antarctic-ice-sheet-greater-than-losses/
2015-11-01,16:01:02,3r2747,87,"Japan PM Abe, Canada PM-designate Trudeau agree to promote Trans-Pacific Partnership",reuters.com,http://www.reuters.com/article/2015/11/01/us-trade-tpp-japan-canada-idUSKCN0SQ1BS20151101
2015-11-01,02:26:52,3qzqzo,82,Russia Announces Permanent Lunar Base,fromquarkstoquasars.com,http://www.fromquarkstoquasars.com/russia-shoots-moon-announces-permanent-lunar-base/
2015-11-01,13:02:50,3r1udf,81,"China, India, Iran and Turkey have offered to use the barter system with Russia for agricultural products to avoid transactions in dollars",rbth.com,http://rbth.com/business/2015/10/29/china-india-offer-rusia-barter-system-for-agricultural-products_534973
