2015-07-21,15:44:36,3e1lfv,6110,Cecil the lion was skinned and his head removed. Hwange - A well-known and much-photographed black-maned lion affectionately named Cecil was killed by sport hunters just outside Hwange in Zimbabwe last week.,m.news24.com,http://m.news24.com/news24/Green/News/Sport-hunters-killed-Cecil-Zimbabwes-best-loved-lion-20150720
2015-07-21,22:23:58,3e2hlu,6153,"5,000 naked anti-gay protesters to greet Obama in Kenya",upi.com,http://www.upi.com/Top_News/World-News/2015/07/21/5000-naked-anti-gay-protesters-to-greet-President-Obama-in-Kenya/9511437473622/?src=r
2015-07-21,15:44:01,3e1ldk,4405,‘Bankers the real terrorists’: Occupy attacks London police for labeling protesters ‘extremists’,rt.com,http://www.rt.com/uk/310266-bankers-real-terrorists-occupy-attacks/
2015-07-21,19:57:12,3e243e,4064,"NSA whistleblower Edward Snowden has urged the world's leading group of internet engineers to design a future 'net that puts the user in the center, and so protects people's privacy.",theregister.co.uk,http://www.theregister.co.uk/2015/07/20/edward_snowden_to_the_ietf_please_design_an_internet_for_the_user_not_the_spy/
2015-07-21,03:42:32,3dz615,3229,"Monster El Niño Makes Record-Hot Year Look Inevitable.In more than 135 years of global temperature data, four of the five hottest months on record all happened in 2015: February, March, May, and now June.",bloomberg.com,http://www.bloomberg.com/news/features/2015-07-20/monster-el-ni-o-makes-record-hot-year-look-inevitable?
2015-07-21,12:23:36,3e11uj,2947,Binyamin Netanyahu's household spending under criminal investigation,theguardian.com,http://www.theguardian.com/world/2015/jul/21/binyamin-netanyahus-household-spending-under-criminal-investigation
2015-07-21,04:01:00,3dz8oi,2148,An 18-year-old French woman is in remission from HIV - despite not having taken any drugs against the virus for 12 years.,bbc.com,http://www.bbc.com/news/health-33542749
2015-07-21,13:43:05,3e1adj,1909,A village in Kazakhstan is being evacuated as scientists grapple with the cause of a mysterious sleeping sickness.,au.news.yahoo.com,https://au.news.yahoo.com/thewest/wa/a/28948775/village-evacuated-as-sleeing-sickness-rages/
2015-07-21,13:30:38,3e1922,885,Huge crude oil spill in Siberia.,siberiantimes.com,http://siberiantimes.com/ecology/casestudy/news/n0311-new-oil-spill-in-siberia/
2015-07-21,21:05:26,3e29n2,818,"New study shows King Phillip II of Macedon—father of Alexander the Great, is buried in Tomb I - Most striking evidence comes from a leg bone—an upper thigh fused to a shin at the knee with a hole in it—it aligns with historical texts that describe Philip as suffering a wound from a lance.",phys.org,http://phys.org/news/2015-07-effort-king-phillip-ii-tomb.html
2015-07-21,15:11:05,3e1il4,770,Isis Executed German Kickboxing Champion Valdet Gashi for Trying to Flee: Monitoring Group,ibtimes.co.in,http://www.ibtimes.co.in/isis-executed-german-kickboxing-champion-valdet-gashi-trying-flee-monitoring-group-639840
2015-07-21,21:54:04,3e2eft,587,"Romania, a country where only 1.7% of people donate blood, is offering free concert tickets in exchange for their blood",newser.com,http://www.newser.com/story/210090/want-free-music-give-blood-in-transylvania.html
2015-07-21,18:16:33,3e1wqx,589,"Rhinos With Spy Cams in Their Horns Will Catch Poachers in the Act - A big problem has been that anti-poaching teams find out about incidents too late, leading to low arrest & conviction rates at the scene of the crime. ""All this tech has existed for a long time, we’ve just put it together.""",motherboard.vice.com,http://motherboard.vice.com/read/the-internet-of-rhinos-is-here
2015-07-21,05:56:05,3dzosy,428,Russian sports club airbrushes Putin critic and chess great Kasparov from history book,rferl.org,http://www.rferl.org/content/russia-club-airbrushes-kasparov-from-history-book/27139684.html
2015-07-21,03:39:54,3dz5nd,397,2 Giant Israeli Solar Plants Will Soon Provide Nearly 2% Of The Country’s Electricity,thinkprogress.org,http://thinkprogress.org/climate/2015/07/20/3682323/israel-getting-two-giant-solar-parks-in-desert/
2015-07-21,21:13:29,3e2aga,316,EU member states agree to ban toxic substance widely found in clothing because it poses an “unacceptable risk” to the environment - Hormone disrupting chemicals found in imported clothing,theguardian.com,http://www.theguardian.com/environment/2015/jul/21/eu-countries-agree-textile-chemical-ban
2015-07-21,07:52:12,3e04n0,234,Russia makes rival U.N. move on MH17 probe after dismissing tribunal bid,reuters.com,http://www.reuters.com/article/2015/07/20/us-ukraine-crisis-mh17-un-idUSKCN0PU24L20150720
2015-07-21,22:53:36,3e2kyh,202,John Kerry 'disturbed' by Iranian leader's criticism after deal,ca.news.yahoo.com,https://ca.news.yahoo.com/u-disturbed-iranian-leaders-criticism-deal-121454843--finance.html
2015-07-21,11:58:14,3e0yw7,184,"Former President Hu Jintao's top aide has been arrested on corruption charges, stripped of his party membership and removed from all government positions",bigstory.ap.org,http://bigstory.ap.org/article/0c406773833c4eefb6e3cb9a8647c16b/top-aide-chinas-former-president-expelled-party
2015-07-21,08:54:17,3e0ch0,178,The Philippines and Vietnam are refurbishing key military bases used during the Cold War and bolstering cooperation with Washington to counter Beijing’s maritime expansion in the South China Sea.,ajw.asahi.com,http://ajw.asahi.com/article/asia/around_asia/AJ201507200055
2015-07-21,10:29:00,3e0o1j,177,Australia to earn $1.5bn a year from China cattle exports,bbc.com,http://www.bbc.com/news/world-australia-33605075
2015-07-21,09:00:36,3e0d9l,171,"Israel halts medical treatment for members of Syria's Nusra Front ""The officer responded to complaints voiced by some members of the Druze community in Israel that security forces are assisting the Al-Nusra Front""",haaretz.com,http://www.haaretz.com/news/diplomacy-defense/1.666961?utm_source=dlvr.it&utm_medium=twitter
2015-07-21,05:46:09,3dznd0,155,ISIS Leader Is Delegating His Powers in Case He Is Killed | “ISIS has learned from that and has formed a structure that can survive the losses of leaders by giving midlevel commanders a degree of autonomy.”,nytimes.com,http://www.nytimes.com/2015/07/21/world/middleeast/isis-strategies-include-lines-of-succession-and-deadly-ring-tones.html
2015-07-21,00:33:11,3dyez4,158,"Russia Orders 'Submarine-Killer' Be-200 Amphibious Aircraft For Production By 2020, Official Says",ibtimes.com,http://www.ibtimes.com/russia-orders-submarine-killer-be-200-amphibious-aircraft-production-2020-official-2015061
2015-07-21,00:08:29,3dybne,147,UN Security Council unanimously endorses Iran nuclear deal,ctvnews.ca,http://www.ctvnews.ca/world/un-security-council-unanimously-endorses-iran-nuclear-deal-1.2477642
2015-07-21,22:18:41,3e2h0o,143,"Football Player in Russia Warns of Rampant Racism Ahead of World Cup: ""It happens at almost every match in Russia but the world does not hear about it because they try to keep it quiet""",themoscowtimes.com,http://www.themoscowtimes.com/news/article/football-player-in-russia-warns-of-rampant-racism-ahead-of-world-cup/525878.html
2015-07-21,00:32:39,3dyewd,103,One Turkish soldier killed in clashes with PKK,dailysabah.com,http://www.dailysabah.com/nation/2015/07/20/turkey-one-soldier-killed-in-clash-with-pkk
2015-07-21,08:25:56,3e08yw,98,EU to Israel: Halt forced population transfers,ynetnews.com,"http://www.ynetnews.com/articles/0,7340,L-4682220,00.html"
2015-07-21,03:41:35,3dz5w2,100,Philae comet lander falls silent,bbc.co.uk,http://www.bbc.co.uk/news/science-environment-33596274
2015-07-21,21:25:57,3e2bo6,97,Mexico's consulate is starting to offer displaced migrants a free flight to come home because the California Drought is so bad.,kfbk.com,http://www.kfbk.com/articles/kfbk-news-461777/mexican-consulate-offers-assistance-to-migrant-13778967#ixzz3gWoD4gbI
