2015-11-12,17:45:22,3sioi1,12685,"UK becomes only G7 country to increase fossil fuel subsidies - Tory government is giving billions in ever increasing handouts to oil and gas majors at the same time as cutting support for clean energy, report reveals",theguardian.com,http://www.theguardian.com/environment/2015/nov/12/uk-breaks-pledge-to-become-only-g7-country-increase-fossil-fuel-subsidies
2015-11-12,11:33:58,3shsfw,7947,"Vladimir Putin has ordered an investigation into claims the country's athletes have been part of a systematic doping program. ""The battle must be open,"" he said. ""A sporting contest is only interesting when it is honest.""",bbc.com,http://www.bbc.com/sport/athletics/34794489
2015-11-12,20:36:41,3sj0l8,3757,"ISIS committed genocide against Iraq’s Yazidis, U.S. Holocaust Museum report says",haaretz.com,http://www.haaretz.com/middle-east-news/1.685653
2015-11-12,03:08:40,3sftfe,3710,"Norway says Russian spies are ensnaring its politicians in sex traps - Norwegian authorities say that Russians are blackmailing govt workers, MPs into revealing state secrets by tricking them with duplicitous gifts like vodka and attractive women, a well-known strategy from the Cold War era.",qz.com,http://qz.com/546507/norway-says-russian-spies-are-ensnaring-its-politicians-in-sex-traps/
2015-11-12,23:51:34,3sjmfh,3372,"Pacific trade deal could limit affordable drugs - World Health Chief.""If these agreements open trade yet close the door to affordable medicines we have to ask the question:is this really progress at all,""",trust.org,http://www.trust.org/item/20151112121937-c04sa/?source=leadCarousel
2015-11-12,22:36:20,3sjcqo,2031,Islamic State video threatens attacks in Russia 'very soon': site monitoring group,reuters.com,http://www.reuters.com/article/2015/11/12/us-mideast-crisis-russia-islamicstate-idUSKCN0T11P920151112
2015-11-12,10:28:09,3shkcf,1492,Military Concedes Election to Aung San Suu Kyi in Myanmar,nytimes.com,http://www.nytimes.com/2015/11/12/world/asia/aung-san-suu-kyi-myanmar-elections-military.html
2015-11-12,23:58:43,3sjnfh,1455,Malfunction at North Korea zoo suffocates dozens of animals,upi.com,http://www.upi.com/Top_News/World-News/2015/11/11/Dozens-of-animals-suffocated-in-North-Korea-zoo-source-says/4681447297451/?src=r
2015-11-12,11:16:24,3shqef,1270,"Seven Italian firms probed in olive oil scam - including Bertolli, Sasso and Carapelli, are being investigated over allegations that the firms falsely sold olive oil products as “extra virgin”",thelocal.it,http://www.thelocal.it/20151111/seven-italian-firms-probed-in-olive-oil-scam
2015-11-12,17:59:17,3sipdb,1162,Christians and Muslims fight to protect ancient Christian town against ISIS,christiantoday.com,http://www.christiantoday.com/article/christians.and.muslim.fight.to.protect.ancient.christian.town.against.isis/70286.htm
2015-11-12,01:47:56,3sfh7c,1072,Russia's nuclear torpedo plan to bypass Nato missile shield revealed after broadcaster forgets to blur out secret document,mirror.co.uk,http://www.mirror.co.uk/news/world-news/russias-nuke-torpedo-plan-bypass-6811216
2015-11-12,08:17:57,3sh3n4,1015,"Crickhowell: Welsh town moves 'offshore' to avoid tax on local businesses, using the loopholes used by multinational giants to avoid paying UK tax",independent.co.uk,http://www.independent.co.uk/news/uk/crickhowell-welsh-town-moves-offshore-to-avoid-tax-on-local-business-a6728971.html
2015-11-12,19:22:03,3siuur,907,Underwater Vertical Seaweed Farm Restores Our Oceans While Providing Food and Fuel Source,theguardian.com,http://www.theguardian.com/sustainable-business/2015/oct/22/greenwave-ocean-farming-bren-smith-fuller-challenge-sustainability-climate-change
2015-11-12,09:24:50,3shcfz,596,Female Genital Mutilation: mother and retired nurse guilty of mutilating two sisters in Australia's first prosecution,theguardian.com,http://www.theguardian.com/society/2015/nov/12/fgm-mother-retired-nurse-guilty-mutilating-two-sisters?CMP=soc_567
2015-11-12,02:29:17,3sfnh7,597,David Cameron complains about constituency cuts caused by his own policies in leaked letter.,independent.co.uk,http://www.independent.co.uk/news/uk/politics/david-cameron-clashes-with-conservative-controlled-oxfordshire-council-over-cuts-to-frontline-a6729616.html
2015-11-12,03:17:32,3sfust,504,Sweden to introduce temporary border controls,bigstory.ap.org,http://bigstory.ap.org/article/ec2ea6fbd38d4da6ba2aba8c101cf752/latest-14-migrants-die-sinking-turkish-coast
2015-11-12,23:31:14,3sjjon,423,New Research Shows Electric Cars 50 Percent Cleaner Compared to Gasoline Over Their Lifetime,ucsusa.org,http://www.ucsusa.org/news/press_release/cleaner-cars-cradle-to-grave-6037#.VkSwtbcveUk
2015-11-12,22:29:11,3sjbv9,381,Montreal's Massive Dump (of Raw Sewage into St. Lawrence) Begins,bbc.com,http://www.bbc.com/news/world-us-canada-34793636
2015-11-12,22:43:42,3sjdoc,379,"A small eel photographed by accident on a Caribbean coral reef is the first green fluorescent fish ever recorded, a new study says",news.nationalgeographic.com,http://news.nationalgeographic.com/2015/11/151111-glowing-eels-science-animals-turtles-oceans/
2015-11-12,01:30:00,3sfej5,369,"Johannesburg, South Africa's largest city and economic hub, on Monday imposed emergency water restrictions as supplies deteriorated due to a drought, the worst to ravage the country in three decades.",phys.org,http://phys.org/news/2015-11-johannesburg-limits-drought-worsens.html?
2015-11-12,08:08:00,3sh27n,272,"Two relatives of the wife of President Nicolás Maduro of Venezuela have been arrested on United States federal drug charges in Haiti and are expected to appear in court in Manhattan on Thursday, a person with knowledge of the case said on Wednesday night.",nytimes.com,http://www.nytimes.com/2015/11/12/world/americas/two-from-venezuelan-presidents-family-to-face-drug-charges-in-new-york.html
2015-11-12,05:18:16,3sgdc8,266,"India could push world into climate change danger zone, warn scientists",theguardian.com,http://www.theguardian.com/world/2015/nov/11/india-could-push-world-into-climate-change-danger-zone-warn-scientists
2015-11-12,14:51:41,3sica9,241,"According to the UN, over 50 million people could move from the desertified areas of sub-Saharan Africa towards North Africa and Europe by 2020.",bbc.co.uk,http://www.bbc.co.uk/news/world-africa-34790661
2015-11-12,11:51:11,3shug9,233,Video Shows Mexico Police Violently Attacking Teacher Students,telesurtv.net,http://www.telesurtv.net/english/news/Video-Shows-Mexico-Police-Violently-Attacking-Teacher-Students-20151111-0045.html
2015-11-12,12:07:01,3shwam,186,"The European Union Will Now Explicitly Label Israeli Settlement Goods | EU today approved new guidelines for labelling products from Israeli settlements on occupied land, a move Brussels says is technical but Israel branded ""discriminatory"" and damaging to peace efforts with the Palestinians",news.vice.com,https://news.vice.com/article/the-european-union-will-now-explicitly-label-israeli-settlement-goods
2015-11-12,12:29:11,3shypi,178,David Cameron is willing to commit almost half a billion of the UK's aid budget over the next five years in an effort to stop the flow of migrants and refugees to Europe.,siyasat.pk,"http://www.siyasat.pk/viewtopic,p,14991.html#14991"
2015-11-12,10:22:30,3shjrx,179,Astronomers have identified the most distant object yet in the Solar System. Observations with Japan's Subaru telescope reveal the likely icy body to be some 15.5 billion km from the Sun - about three times further away than even far-flung Pluto.,bbc.com,http://www.bbc.com/news/science-environment-34787422
2015-11-12,19:48:13,3siwpj,177,"Women are twice as likely to die from causes related to pregnancy or childbirth in the United States than in Canada, a new global survey of maternal mortality published by the United Nations and the World Bank showed",reuters.com,http://www.reuters.com/article/2015/11/12/us-health-pregnancy-idUSKCN0T10LO20151112
2015-11-12,02:08:10,3sfk7w,171,New Zealand female MPs thrown out of parliament for allegedly violating Parliamentary rules by disclosing sexual assaults. Women ruled out of order by Speaker for demanding PM John Key apologise for accusing opposition of ‘backing the rapists’.,theguardian.com,http://www.theguardian.com/world/2015/nov/11/new-zealand-female-mps-mass-walkout-pm-rapists-comment
2015-11-12,12:30:37,3shyvs,101,Kurdish Forces launch offensive to retake key town from ISIS,cnn.com,http://www.cnn.com/2015/11/11/middleeast/iraq-free-sinjar-isis/index.html
