2015-10-17,05:18:50,3p17ws,14966,"The Origins of the King James Bible - A handwritten draft of the world's most famous bible has been discovered in England. It contains handwriting of dozens of authors from 1604-1608. That handwriting is a crucial find, because it reveals how they translated & assembled the text.",smithsonianmag.com,http://www.smithsonianmag.com/smart-news/origins-of-the-king-james-bible-180956949/
2015-10-17,01:15:59,3p07mh,11331,China warns Britain not to bring up human rights during Xi Jinping's visit because he would be offended,upi.com,http://www.upi.com/Top_News/World-News/2015/10/16/China-warns-Britain-against-raising-human-rights-ahead-of-Xi-visit/9911445006867/?src=r
2015-10-17,22:51:54,3p40rk,13815,Canada's ruling Conservatives facing criminal investigation over election law violation for the 4th election in a row,thinkpol.ca,http://thinkpol.ca/2015/10/17/conservatives-facing-criminal-investigation-over-election-law-violation-for-the-4th-election-in-a-row/#comments
2015-10-17,19:29:54,3p3jpo,8214,Saudi police try to shift blame onto Indian maid,m.thehindu.com,http://m.thehindu.com/news/international/saudi-police-try-to-shift-blame-on-indian-maid/article7771306.ece
2015-10-17,09:00:48,3p210g,10703,Ebola is now an STD - First case of sexual transmission of the viral disease documented in Liberia.,arstechnica.com,http://arstechnica.com/science/2015/10/ebola-is-now-a-std/
2015-10-17,23:22:51,3p446c,4424,China plans to build 110 nuclear power plants by 2030 with an investment of over $78 billion,firstpost.com,http://www.firstpost.com/world/china-to-invest-78-bn-to-build-110-nuclear-power-plants-by-2030-will-overtake-us-2471414.html
2015-10-17,02:54:47,3p0mcu,3865,"Erdogan slams Nobel prizes as biased, saying:""Someone [Merkel] says, ‘We will receive 30-40,000 refugees,' and then they are nominated for the Nobel [prize]. I wonder how it happens. We are hosting 2.5 million refugees at the moment. Nobody cares about that.""",todayszaman.com,http://www.todayszaman.com/diplomacy_erdogan-slams-nobel-prizes-as-biased-says-turkeys-efforts-on-refugees-ignored_401714.html
2015-10-17,18:41:24,3p3gg0,2567,"Rich nations are spending $250 billion annually subsidizing their agricultural sectors to the detriment of poor farmers as they artificially lower prices for some crops and block market access for growers from poor countries, a new study said.",trust.org,http://www.trust.org/item/20151016173337-r3e1v/?source=jtOtherNews1
2015-10-17,21:40:17,3p3tvq,1265,"A group of Russian hackers infiltrated the servers of Dow Jones & Co., owner of the Wall Street Journal and several other news publications, and stole information to trade on before it became public.The FBI, Secret Service and the Securities and Exchange Commission are leading an investigation.",bloomberg.com,http://www.bloomberg.com/news/articles/2015-10-16/russian-hackers-of-dow-jones-said-to-have-sought-trading-tips
2015-10-17,19:54:48,3p3lee,1006,"Smoking bans in Australian prisons sees packets of cigarettes trade for $320 | Since smoking was banned in August, the price of a pack of cigarettes has sky-rocketed from $28 on the prison buy-ups scheme to $300 on the black market. Matches and papers, once sold for $3 now fetch up to $90",stuff.co.nz,http://www.stuff.co.nz/world/australia/73111016/Smoking-bans-in-Australian-prisons-sees-packets-of-cigarettes-trade-for-320
2015-10-17,20:38:40,3p3ou9,964,"The World Is Not As Hungry As You Might Think: Deaths due to mass famine have plummeted, according to data from the International Food Policy Research Institute, Welthungerhilfe and Concern Worldwide.",npr.org,http://www.npr.org/sections/goatsandsoda/2015/10/16/447157158/the-world-is-not-as-hungry-as-you-might-think
2015-10-17,07:06:28,3p1mvu,601,Germany reportedly bribed FIFA for 2006 World Cup,aljazeera.com,http://www.aljazeera.com/news/2015/10/germany-reportedly-bribed-fifa-2006-world-cup-151016164759212.html
2015-10-17,03:23:44,3p0qsp,565,The richest 1% of Indians own 53% of the country’s wealth while top 10% have 76.3% of the country's wealth,livemint.com,http://www.livemint.com/Money/VL5yuBxydKzZHMetfC97HL/Richest-1-own-53-of-Indias-wealth.html
2015-10-17,08:19:42,3p1wa7,422,"Islam was 'never part of Europe': Hungary's Orban | Hungary's Prime Minister Viktor Orban defended his hardline stance against refugees, the vast majority of whom are Muslim, saying in an interview published Friday that Islam ""has never been part of Europe"".",news.yahoo.com,https://news.yahoo.com/islam-never-part-europe-hungarys-orban-105713024.html
2015-10-17,14:57:29,3p315b,408,"Sleep researchers observed tribal groups living pre-industrial lives. After 1,165 days collecting data,they found the avg sleep time among the tribes was 6.5 hrs a night. In industrial societies, the average is 7.5 hrs a night. They barely suffered insomnia, which is prevalent in 20% of our society.",economist.com,http://www.economist.com/news/science-and-technology/21674491-modern-life-has-not-changed-sleeping-patterns-much-some-believe-now-i-lay-me?fsrc=scn/tw/te/pe/ed/nowilaymedowntosleep
2015-10-17,01:58:00,3p0dxd,396,Europe and Russia planning space mission to assess Moon settlement,bbc.com,http://www.bbc.com/news/science-environment-34504067
2015-10-17,05:56:51,3p1dgl,356,Obama Says Israel Will Only Be Secure With A Two-State Solution,google.com,http://google.com/newsstand/s/CBIwhZfLvyM
2015-10-17,20:46:30,3p3pj6,357,"Cologne mayoral candidate Henriette Reker seriously hurt in knife attack - An independent candidate to be mayor of Cologne has been severely injured in a knife attack. Police said four other people were hurt at the scene, and a suspect was taken into custody.",dw.com,http://www.dw.com/en/cologne-mayoral-candidate-henriette-reker-seriously-hurt-in-knife-attack/a-18788390
2015-10-17,03:04:21,3p0nue,355,U.S. confirms Iran tested nuclear-capable ballistic missile,reuters.com,http://www.reuters.com/article/2015/10/16/us-iran-missiles-usa-idUSKCN0SA20Z20151016?feedType=RSS&feedName=topNews&utm_source=twitter
2015-10-17,07:52:55,3p1srp,305,Politicians panic after law change could leave them open to surveillance,betanews.com,http://betanews.com/2015/10/16/politicians-panic-after-law-change-could-leave-them-open-to-surveillance/
2015-10-17,22:10:31,3p3wp8,309,More than 400 dead in southeast Congo measles outbreak: U.N.,reuters.com,http://www.reuters.com/article/2015/10/16/us-congodemocratic-health-idUSKCN0SA1UR20151016
2015-10-17,22:58:07,3p41ek,305,Migrant crisis: Slovenia braces as Hungary shuts border,bbc.co.uk,http://www.bbc.co.uk/news/world-europe-34559419
2015-10-17,23:35:25,3p45ka,250,"Neanderthals ‘kept our early ancestors out of Europe’ | Ancient teeth found in China suggest Homo sapiens was outwitted by its rivals. The find shows modern humans must have left their African homeland and reached southern China more than 80,000 years ago.",theguardian.com,http://www.theguardian.com/science/2015/oct/17/neanderthals-kept-early-homo-sapiens-out-of-europe
2015-10-17,06:07:56,3p1f09,218,"The Number of Refugees that have Crossed to Greece exceeds 470,000, a number 15 times higher than 2014, says the International Organization for Migration",sputniknews.com,http://sputniknews.com/europe/20151016/1028639826/refugees-greece-iom.html
2015-10-17,01:35:50,3p0apa,121,Indian leader says Muslims should stop eating beef in India.,bbc.co.uk,http://www.bbc.co.uk/news/world-asia-india-34546960
2015-10-17,03:15:15,3p0pgo,112,North Korea Defector: You Clap To Stay Alive,news.sky.com,http://news.sky.com/story/1569320/north-korea-defector-you-clap-to-stay-alive
2015-10-17,11:02:36,3p2eml,109,"""Mysterious"" Poppy Seeds will double Afghanistan's Opium/Heroin Output in 2016 ... ""grow bigger, faster, use less water, and give up to double the amount of opium""",cbsnews.com,http://www.cbsnews.com/news/afghanistan-taliban-double-opium-income-new-strain-high-yield-poppy-seed/
2015-10-17,07:08:26,3p1n54,92,ISIS Shooter Kills Five Shiites in Saudi Arabia,newsweek.com,http://www.newsweek.com/isis-says-it-carried-out-deadly-attack-shiites-saudi-arabia-384459
2015-10-17,01:32:28,3p0a6k,70,Drone War Exposed: Jeremy Scahill on U.S. Kill Program's Secrets & the Whistleblower Who Leaked Them,democracynow.org,http://www.democracynow.org/2015/10/16/drone_war_exposed_jeremy_scahill_on
2015-10-17,01:57:43,3p0dvx,69,Russia Says Military Agreement Near With U.S. on Syria Flights,bloomberg.com,http://www.bloomberg.com/news/articles/2015-10-16/turkish-military-says-it-shot-down-aircraft-on-syria-border
