2015-12-26,05:39:40,3y7w7k,19051,"Anonymous takes credit for massive cyberattack on Turkey. ""The attack left more than 400,000 websites down in Turkey"". The government eventually had to cut off all foreign Internet traffic coming to “.tr” websites, the domain for Turkey, to mitigate the assault",thehill.com,http://thehill.com/policy/cybersecurity/264214-anonymous-takes-credit-for-massive-cyberattack-on-turkey
2015-12-26,23:04:22,3yahc5,7278,"U.S. Pours Millions Into Fighting Poachers in South Africa - The Obama administration is stepping up efforts here to combat wildlife poaching, an expanding criminal enterprise in South Africa that has driven several animal species toward extinction and fueled the growth of international gangs.",nytimes.com,http://www.nytimes.com/2015/12/23/world/africa/us-pours-millions-into-fighting-poachers-in-south-africa.html?_r=0
2015-12-26,17:56:45,3y9u78,6016,Breakaway Muslim rebels kill nine people in southern Philippines on Christmas eve,news.yahoo.com,http://news.yahoo.com/breakaway-muslim-rebels-kill-nine-people-southern-philippines-061005531.html
2015-12-26,00:39:13,3y6yoq,3640,ISIS allows taking organs from a living captive to save a Muslim's life,timesofindia.indiatimes.com,http://timesofindia.indiatimes.com/world/middle-east/Islamic-State-sanctioned-organ-harvesting-in-document-taken-in-US-raid/articleshow/50326036.cms
2015-12-26,21:46:54,3yaabj,3266,"Scientists have developed a new reusable polymer that can remove pollutants from flowing water within seconds, just like air fresheners trap invisible air pollutants in the home and remove unwanted odours.",ndtv.com,http://www.ndtv.com/world-news/new-polymer-could-purify-water-in-seconds-study-1259134
2015-12-26,21:06:38,3ya75o,3250,"Chile is carrying out a feasibility study for the construction of a permanent pier at one of its bases in Antarctica. The move, being explored by the Ministry of Public Works, would facilitate access to the far-flung area for both scientists and tourists.",digitaljournal.com,http://www.digitaljournal.com/news/world/chile-eyes-construction-of-permanent-antarctica-pier/article/453103
2015-12-26,18:26:38,3y9w5x,1867,"The IMF has taken Russia's side and recognized Ukraine's debt as sovereign, meaning Kiev would have to declare default if unable to pay.",sccougar.com,http://sccougar.com/2015/12/25/ukraine-imposes-moratorium-on-yanukovychs-debt-repayment.html
2015-12-26,05:48:54,3y7xa8,1304,French Protesters ransack Muslim prayer hall,france24.com,http://www.france24.com/en/20151225-protesters-ransack-muslim-prayer-hall-corsica-police
2015-12-26,20:32:53,3ya4ow,927,Putin steps up military presence in Arctic in claim for region's oil,dailymail.co.uk,http://www.dailymail.co.uk/news/article-3374539/The-new-Cold-War-Russia-sends-troops-missiles-Arctic-Putin-stakes-claim-region-s-oil-gas-reserves.html
2015-12-26,21:13:11,3ya7md,787,Rome plagued by starlings,dw.com,http://www.dw.com/en/rome-plagued-by-starlings/a-18943038
2015-12-26,13:16:21,3y992i,598,"Iran shocked by high casualty rate, pulling elite forces out of Syria",worldtribune.com,http://www.worldtribune.com/iran-shocked-by-high-casualty-rate-pulling-elite-forces-out-of-syria/
2015-12-26,00:35:55,3y6yaz,546,"Russian Intelligence Spots, Destroys Oil Tankers on Iraq-Turkey Border",almanar.com.lb,http://www.almanar.com.lb/english/adetails.php?eid=246728&cid=22&fromval=1&frid=22&seccatid=45&s1=1
2015-12-26,10:13:36,3y8pph,489,"Record number of gold coins found in 2,000-yr-old Chinese tomb",news.xinhuanet.com,http://news.xinhuanet.com/english/2015-12/25/c_134952777.htm
2015-12-26,01:00:29,3y70xi,481,Bangladesh signs $12.65 billion deal with Russia for nuclear power plants,news.yahoo.com,https://news.yahoo.com/bangladesh-signs-12-65-billion-deal-russia-nuclear-163412099.html
2015-12-26,02:58:24,3y7dtc,455,"Turkish Internet servers are suffering a powerful cyber attack, slowing banking services and fanning fears that it could be a politically motivated attack from abroad",france24.com,http://www.france24.com/en/20151225-turkish-internet-servers-reeling-under-huge-cyber-attack
2015-12-26,01:13:05,3y72bu,411,Iran calls on China to step up contribution to anti-Daesh fight,presstv.ir,http://www.presstv.ir/Detail/2015/12/24/443078/Iran-China-Rezaei-Daesh-Takfiri/
2015-12-26,03:42:52,3y7iml,330,"Earthquake shakes Islamabad, Peshawar measuring 6.9 on richter scale",thenewstribe.com,http://www.thenewstribe.com/2015/12/26/earthquake-shakes-islamabad-peshawar/
2015-12-26,06:07:35,3y7zfj,309,"'German emissions scandal threatens to engulf Mercedes, BMW'...""Amidst this new scrutiny, the German government is maintaining a stony silence. In response to a DW request, the Transport Ministry did not offer any other explanation for the test discrepancies.""",dw.com,http://www.dw.com/en/german-emissions-scandal-threatens-to-engulf-mercedes-bmw/a-18937447
2015-12-26,13:06:43,3y983r,297,Journalists to be tried for 'insulting Erdoğan',todayszaman.com,http://www.todayszaman.com/latest-news_journalists-dumanli-and-ergin-to-be-tried-for-insulting-erdogan_407911.html
2015-12-26,20:58:28,3ya6kg,281,Islamic State conflict: Iraqi forces push deeper into Ramadi,bbc.com,http://www.bbc.com/news/world-middle-east-35181403
2015-12-26,06:46:47,3y83u2,248,"Russian Orthodox church sacks ultra-conservative senior priest: Father Vsevolod Chaplin, who recently referred to Russian intervention in Syria as a holy war, relieved of his duties",theguardian.com,http://www.theguardian.com/world/2015/dec/25/russian-orthodox-church-sacks-father-vsevolod-chaplin
2015-12-26,21:46:51,3yaabd,239,Germany's foreign minister says Europe needs to regain control of its borders,businessinsider.com,http://www.businessinsider.com/r-german-foreign-minister-calls-for-better-control-of-eus-borders-2015-12
2015-12-26,21:20:56,3ya86s,226,UK flood warnings: Homes evacuated amid heavy rain,bbc.com,http://www.bbc.com/news/uk-35181139
2015-12-26,15:14:50,3y9jn9,163,Christmas Wildfire Destroys More Than 100 Homes in Australia,nytimes.com,http://www.nytimes.com/aponline/2015/12/26/world/asia/ap-as-australia-wildfires.html?ref=world
2015-12-26,07:08:28,3y863t,166,Powerful Syrian Rebel Leader Reported Killed in Airstrike,nytimes.com,http://www.nytimes.com/2015/12/26/world/middleeast/zahran-alloush-syria-rebel-leader-reported-killed.html?ref=world
2015-12-26,01:30:47,3y74a6,152,"A Russian airstrike near the Syrian capital, Damascus, on Friday killed top rebel commander Zahran Allouch, who led one of the most powerful groups fighting against President Bashar Assad's government",bigstory.ap.org,http://bigstory.ap.org/article/85d790d0bd0d4ff68695862a87bb0c18/top-syrian-rebel-killed-airstrike-near-damascus
2015-12-26,08:35:28,3y8fcw,143,"Besieged Islamists 'to quit Damascus suburbs' under truce deal - ""Every fighter will be allowed to leave with his family and one suitcase and his personal weapon""",france24.com,http://www.france24.com/en/20151225-nusra-islamic-state-evacuate-damascus-yarmouk-qadam
2015-12-26,23:18:58,3yaiqf,123,"$1.7 Trillion of Sub-Zero Euro Debt Shows ECB Outlook for 2016...""the amount of euro-region government bonds that yield less than zero was at about $1.68 trillion""",bloomberg.com,http://www.bloomberg.com/news/articles/2015-12-26/-1-7-trillion-of-sub-zero-euro-debt-shows-ecb-outlook-for-2016
2015-12-26,21:22:57,3ya8cu,123,Iranian Red Crescent which boasts 2.7 million members gains maximum rank in int’l evaluation,iranfrontpage.com,http://iranfrontpage.com/news/society/healthcare/2015/12/iranian-red-crescent-gains-maximum-rank-in-intl-evaluation/
2015-12-26,08:50:26,3y8gxo,109,"China successfully developed 'Darwin,' a neuromorphic chip based on Spiking Neural Networks",eurekalert.org,http://www.eurekalert.org/pub_releases/2015-12/scp-csd122215.php
