2015-07-18,05:55:58,3do10r,16025,"Sponsor Coca-Cola demands third-party reform of FIFA, possibly starting a trend of sponsors applying pressure to the organisation in order to force reform",bbc.co.uk,http://www.bbc.co.uk/sport/0/football/33575358
2015-07-18,18:05:56,3dpzwg,10418,"More than 200,000 Germans formally left the Catholic Church in 2014, accelerating the downward trend in the Catholic proportion of the country’s population.",catholicculture.org,https://www.catholicculture.org/news/headlines/index.cfm?storyid=25567
2015-07-18,07:13:52,3doatz,15466,Obama praises South Korea for ‘paying teachers the way they pay doctors’,koreatimesus.com,http://www.koreatimesus.com/obama-again-praises-s-korea-for-paying-teachers-the-way-they-pay-doctors/
2015-07-18,19:49:04,3dq5rd,2957,An Australian TV Reality show smuggled a group of participants across the Syrian border to IS territory. They had a narrow escape as they came under heavy artillery fire from IS as filmmakers took them within half a mile of the front line.,digitaljournal.com,http://www.digitaljournal.com/news/world/australian-reality-show-contestants-come-under-is-fire-in-syria/article/438672
2015-07-18,01:53:09,3dn4gy,2549,"Uk's first genital mutilation protection order obtained, stopping 2 girls from being taken abroad",bbc.co.uk,http://www.bbc.co.uk/news/uk-33572428
2015-07-18,21:44:59,3dqd2s,2468,Drone that Pakistan shot down was made in China: Chinese media,hindustantimes.com,http://www.hindustantimes.com/india-news/drone-that-pakistan-shot-down-was-made-in-china-chinese-media/article1-1370591.aspx
2015-07-18,22:19:23,3dqfmn,1617,Security forces in Saudi Arabia arrests 431 suspected members of the Islamic State militant group.,bbc.com,http://www.bbc.com/news/world-middle-east-33581052
2015-07-18,00:08:21,3dmqwf,1285,Indian workers have won a $20m claim against a US company for defrauding and exploiting them while repairing damaged oil rigs after Hurricane Katrina,bbc.com,http://www.bbc.com/news/world-asia-india-33562514
2015-07-18,20:12:57,3dq74t,1248,"China Ends Mystery of Gold Hoard to Top Russia’s Holdings. China ended six years of mystery over how much gold it’s hoarding, revealing a 57% jump in reserves and overtaking Russia to become the country with the 5th-largest stash of the metal.",bloomberg.com,http://www.bloomberg.com/news/articles/2015-07-17/china-increases-gold-reserves-in-first-disclosure-since-2009
2015-07-18,14:14:50,3dpjqn,1188,"Archaeologists Find Assyrian Tablets in Turkey, Some About Women's Rights",aina.org,http://aina.org/news/20150717104824.htm
2015-07-18,10:29:16,3dowu8,1047,"ISIS Has Fired Chemical Mortar Shells, Evidence Indicates",nytimes.com,http://www.nytimes.com/2015/07/18/world/middleeast/islamic-state-isis-chemical-weapons-iraq-syria.html?smid=tw-nytimes&_r=0
2015-07-18,21:24:01,3dqbjp,870,"Spy agency employee found dead, information on hacking program in will: police",english.yonhapnews.co.kr,http://english.yonhapnews.co.kr/news/2015/07/18/0200000000AEN20150718002500320.html
2015-07-18,03:51:21,3dnkh3,826,"'Drop Israel nuke program double standards, get IAEA to supervise' - Arab League",rt.com,http://www.rt.com/news/310095-israel-nuclear-program-double-standard/
2015-07-18,11:07:45,3dp14z,812,"Fed up with the daily blare from mosque loudspeakers calling the faithful to prayer, Indonesian Vice President Jusuf Kalla has set up a team to monitor the volume of cacophony that begins from dawn. Based on data collected in several urban areas will implement measures to regulate mosque speakers.",ajw.asahi.com,http://ajw.asahi.com/article/asia/around_asia/AJ201507180016
2015-07-18,22:48:10,3dqhzs,685,"A South Korean government spy was found dead Saturday in an apparent suicide alongside a note that seemed to comment on the recent revelation that the spy agency had acquired hacking programs capable of intercepting communications on cellphones and computers, police said.",bigstory.ap.org,http://bigstory.ap.org/article/a2dada6bd3a64735a68cabbe49b1c7c8/dead-s-korean-agent-leaves-note-hinting-hacking-scandal
2015-07-18,14:56:14,3dpn6l,507,"Iran lauds Indian assistance during period of Sanctions, promises preferential treatment to Indian investors",thehindu.com,http://www.thehindu.com/news/national/irans-envoy-lauds-indian-assistance/article7435586.ece
2015-07-18,23:30:45,3dqlqr,489,"The Canadian military's new top commander has delivered a clear, tough message, saying bullies and abusers have no place within the ranks and, where they exist, they'll be weeded out.",torontosun.com,http://www.torontosun.com/2015/07/17/new-military-chief-promises-decisive-action-against-sexual-misconduct
2015-07-18,17:29:23,3dpxrb,349,"Chinese-built zero-emissions electric bus prepares for service in London - Fully electric doubledecker bus with new compact battery to launch in autumn, as London prepares for ultra low emission zone, reports China Daily",theguardian.com,http://www.theguardian.com/environment/2015/jul/18/chinese-built-zero-emissions-electric-bus-prepares-for-service-in-london
2015-07-18,02:40:08,3dnax0,272,Israeli PM calls Palestinian President in goodwill gesture marking Muslim holiday of Eid al-Fitr,jpost.com,http://www.jpost.com/Arab-Israeli-Conflict/Netanyahu-calls-Abbas-in-goodwill-gesture-marking-Muslim-holiday-of-Eid-al-Fitr-409347
2015-07-18,01:12:11,3dmz3z,272,International report confirms: 2014 was Earth’s warmest year on record,noaanews.noaa.gov,http://www.noaanews.noaa.gov/stories2015/071615-international-report-confirms-2014-was-earths-warmest-year-on-record.html
2015-07-18,17:24:00,3dpxf9,170,"Khamenei: Deal or no deal, Iran won't stop opposing US, supporting people of Palestine",jpost.com,http://www.jpost.com/Middle-East/Khamenei-Deal-or-no-deal-Iran-wont-stop-opposing-US-supporting-people-of-Palestine-409374
2015-07-18,19:48:09,3dq5pt,161,"UK Mass Surveillance, The power was used in around 16,000 such cases last year to “prevent death or injury in an emergency situation”, the Home Office said.",techdirt.com,https://www.techdirt.com/articles/20150717/15043231673/compliant-uk-press-insist-thousands-lives-risk-if-government-cant-spy-citizens.shtml
2015-07-18,00:23:28,3dmstp,135,Saudi use of cluster bomb in Yemen breaks U.S. rules. Followup on Human Rights Watch report.,pri.org,http://www.pri.org/stories/2015-07-17/yemenis-are-terrorized-weapon-made-america-sold-saudis
2015-07-18,15:13:23,3dpolg,117,China to deport foreign tourists apparently after some of them watched a documentary on Genghis Khan in their hotel room,uk.reuters.com,http://uk.reuters.com/article/2015/07/18/uk-china-tourists-idUKKCN0PR18M20150718
2015-07-18,20:11:42,3dq721,118,France estimates the economic costs of air pollution.The Senate committee estimated the annual cost of air pollution in France at €101.3 billion.,enn.com,http://www.enn.com/environmental_policy/article/48783?utm_source=feedburner&utm_medium=feed&utm_campaign=Feed%3A+EnvironmentalNewsNetwork+%28Environmental+News+Network%29
2015-07-18,16:56:43,3dpvpz,117,60 media workers killed in first half of this year for doing their job .France named as deadliest country for journalists after Charlie Hebdo attack,theguardian.com,http://www.theguardian.com/media/greenslade/2015/jul/15/60-media-workers-killed-in-first-half-of-this-year-for-doing-their-job
2015-07-18,05:17:48,3dnw37,103,Niger army kills 30 suspected Boko Haram insurgents.,reuters.com,http://www.reuters.com/article/2015/07/17/us-nigeria-violence-niger-idUSKCN0PR1K120150717
2015-07-18,11:33:10,3dp3to,101,Obama refuses to stay at Chinese-owned Waldorf Astoria amidst fears it may have been bugged by China,fortune.com,http://fortune.com/2015/07/17/obama-wont-stay-at-chinese-owned-waldorf-astoria/?xid=soc_socialflow_twitter_FORTUNE
2015-07-18,00:29:04,3dmtk3,95,‘Disabled’ undercover cop waits for robbers in Vancouver but only finds kindness,nationalpost.com,http://www.nationalpost.com/m/wp/blog.html?b=news.nationalpost.com//news/canada/disabled-undercover-cop-waits-for-robbers-in-vancouver-but-only-finds-kindness
2015-07-18,07:27:33,3docg1,86,Pipeline Spill In The Heart Of Canada's Tar Sands Industry Leaks 1.3 Million Gallons Of Oily Emulsion,thinkprogress.org,http://thinkprogress.org/climate/2015/07/17/3681738/canadian-pipeline-spill-near-tar-sands/
