2015-03-19,17:09:47,2zkgiv,31591,New Alzheimer’s treatment fully restores memory function - Australian researchers have come up with a non-invasive ultrasound technology that clears the brain of neurotoxic amyloid plaques,sciencealert.com,http://www.sciencealert.com/new-alzheimer-s-treatment-fully-restores-memory-function
2015-03-19,19:07:36,2zknr1,9065,The Pirate Party is now measured as the biggest political party in Iceland,visir.is,http://www.visir.is/the-pirate-party-is-now-measured-as-the-biggest-party-in-iceland/article/2015150318848
2015-03-19,11:15:03,2zjpmy,11028,US removes Iran and Hezbollah from list of terror threats,middleeastmonitor.com,https://www.middleeastmonitor.com/news/americas/17579-us-removes-iran-and-hezbollah-from-list-of-terror-threats
2015-03-19,05:17:25,2zihma,2407,A former ISIS militant has revealed that young Muslim women travelling to Syria to marry jihadists are being passed between men at the rate of one husband a week.,dnaindia.com,http://www.dnaindia.com/world/report-women-being-passed-amid-older-jihadists-at-rate-of-one-a-week-in-syria-2069861
2015-03-19,23:28:37,2zld47,2029,BBC News: Indian students caught 'cheating' in exams - large-scale practice,bbc.com,http://www.bbc.com/news/world-asia-india-31960557
2015-03-19,03:14:08,2zi0bz,1798,"Iran offers to ""reward"" US Oil Companies that position against GOP letter signed by 47 Senators",payvand.com,http://www.payvand.com/news/15/mar/1112.html
2015-03-19,01:40:57,2zhn1j,1254,Russian treaty with South Ossetia breaks international law: NATO,reuters.com,http://www.reuters.com/article/2015/03/18/us-russia-georgia-southossetia-nato-idUSKBN0ME24S20150318
2015-03-19,22:47:34,2zl81d,1126,"UN: Mass Grave Found In Iraq, ISIS Suspected Of Genocide",washington.cbslocal.com,http://washington.cbslocal.com/2015/03/19/un-mass-grave-found-in-iraq-isis-suspected-of-genocide/
2015-03-19,03:50:27,2zi5f0,979,"Pearson, the world’s largest maker of textbooks and academic materials, has admitted “monitoring” the social media use of students using its tests",theguardian.com,http://www.theguardian.com/education/2015/mar/18/pearson-monitoring-students-social-media-tests
2015-03-19,00:29:25,2zhctf,822,"Greece adopts ‘anti-poverty’ law despite alleged EU row: The legislation calls for households that were cut off because they could not pay their bills to be given a capped amount of free electricity. Up to 30,000 households would also get a housing allowance and 300,000 would receive food subsidies.",france24.com,http://www.france24.com/en/20150318-greece-anti-poverty-law-eu-tsipras/
2015-03-19,21:46:25,2zl13u,613,Saudis halt Sweden visas in 'major escalation',thelocal.se,http://www.thelocal.se/20150319/saudis-block-business-visas-in-new-escalation
2015-03-19,18:44:51,2zkm8s,537,Poland says it will match Russia's diplomatic hostility,news.yahoo.com,http://news.yahoo.com/minister-poland-return-russias-diplomatic-hostility-130729481.html
2015-03-19,17:31:02,2zkht4,495,Twitter puts trillions of tweets up for sale to data miners,theguardian.com,http://www.theguardian.com/technology/2015/mar/18/twitter-puts-trillions-tweets-for-sale-data-miners
2015-03-19,03:24:56,2zi1us,451,White House 'Deeply Concerned' About Rhetoric from Netanyahu's Party,nbcnews.com,http://www.nbcnews.com/politics/white-house/white-house-deeply-concerned-about-rhetoric-netanyahus-party-n325886
2015-03-19,06:12:52,2zip2v,406,New York to Cuba: first direct charter flight takes off,theguardian.com,http://www.theguardian.com/travel/2015/mar/18/new-york-to-cuba-first-direct-charter-flight-takes-off
2015-03-19,04:34:14,2zibm0,340,The French parliament has voted overwhelmingly in favour of a law allowing terminally ill patients to cease treatment and enter a “deep sleep” until they die.,theguardian.com,http://www.theguardian.com/world/2015/mar/17/french-parliament-deep-sleep-law-terminally-ill-euthanasia
2015-03-19,23:58:06,2zlgvf,297,"U.S. first lady Michelle Obama and her Japanese counterpart Akie Abe announced plans Thursday to deepen cooperation in helping girls in developing nations finish their educations, vowing to help them attain goals that many in wealthy countries take for granted.",japantoday.com,http://www.japantoday.com/category/national/view/michelle-obama-akie-abe-announce-plans-to-support-girls-education
2015-03-19,23:51:31,2zlg29,214,"As U.S.-led coalition forces confirm they shot down an ISIS drone this week, experts warn the extremists could soon adapt the technology for battle purposes.",thedailybeast.com,http://www.thedailybeast.com/articles/2015/03/18/is-isis-building-a-drone-army.html
2015-03-19,06:26:52,2ziqvn,170,"Obama snubs Netanyahu and criticises Israeli PM's 'divisive rhetoric': President has yet to call Israeli PM to congratulate him on his election victory, as White House says it will have to re-evaluate its approach to peace talks",theguardian.com,http://www.theguardian.com/us-news/2015/mar/18/obama-netanyahu-israel-election-white-house
2015-03-19,21:00:35,2zkwjb,138,"Britain, France, Germany, and Italy have decided, over the objections of the United States, to join the Asia Infrastructure Investment Bank, a new international-development institution, set up by China, that is poised to become a potential rival to the World Bank.",newyorker.com,http://www.newyorker.com/news/john-cassidy/the-biggest-threat-to-americas-future-is-america
2015-03-19,04:01:35,2zi70k,122,Amazon rainforest soaking up less carbon as trees die young,reuters.com,http://www.reuters.com/article/2015/03/18/us-environment-amazon-idUSKBN0ME2EW20150318?feedType=RSS&feedName=environmentNews
2015-03-19,06:12:04,2zioy9,103,"Israeli election still not completely decided - 200,000 ""double envelope"" votes are yet to be counted.",ynetnews.com,"http://www.ynetnews.com/articles/0,7340,L-4638638,00.html"
2015-03-19,12:12:19,2zjvgi,105,"Australia's tobacco plain packaging laws successful, studies show",abc.net.au,http://www.abc.net.au/news/2015-03-19/australias-plain-packaging-laws-are-a-success-studies-show/6331736
2015-03-19,20:07:53,2zks2o,83,"""Ten companies directly responsible for third of Australia's greenhouse gas pollution, Australian Conservation Foundation report finds""",abc.net.au,http://www.abc.net.au/news/2015-03-18/ten-companies-responsible-for-third-of-greenhouse-gas-pollution/6330562
2015-03-19,13:23:21,2zk1rc,76,"Kim Jong-un to attend Victory Day parade in Moscow, Kremlin says - World",cbc.ca,http://www.cbc.ca/news/world/kim-jong-un-to-attend-victory-day-parade-in-moscow-kremlin-says-1.2999367
2015-03-19,15:36:53,2zkb9h,73,Belgium axes prison sentences under a year,deredactie.be,http://deredactie.be/cm/vrtnieuws.english/News/1.2275364
2015-03-19,23:49:21,2zlfsu,70,"​Britain must officially recognize Palestine if Israel drops 2-state solution, says Clegg",rt.com,http://rt.com/uk/242225-clegg-palestine-netanyahu-solution/
2015-03-19,20:07:29,2zks19,71,"US support for Israel at the UN is in jeopardy, says White House",smh.com.au,http://www.smh.com.au/world/us-support-for-israel-at-the-un-is-in-jeopardy-says-white-house-20150319-1m2s41.html
2015-03-19,01:51:12,2zhofr,67,"Show Pornography in Schools, Urges Danish Sexology Professor",newsweek.com,http://www.newsweek.com/show-pornography-schools-urges-danish-sexology-professor-311090
2015-03-19,04:06:49,2zi7qe,61,A Method to Change Leukemia Cells into Cells That Fight Leukemia Has Been Discovered By Stanford Researchers,exile.is,http://exile.is/a-method-to-change-leukemia-cells-into-cells-that-fight-leukemia-has-been-discovered-by-stanford-researchers/2663
