2015-07-27,19:36:45,3er9wy,29412,"Musk, Wozniak and Hawking urge ban on AI and autonomous weapons: Over 1,000 high-profile artificial intelligence experts and leading researchers have signed an open letter warning of a “military artificial intelligence arms race” and calling for a ban on “offensive autonomous weapons”.",theguardian.com,http://www.theguardian.com/technology/2015/jul/27/musk-wozniak-hawking-ban-ai-autonomous-weapons
2015-07-27,11:54:34,3eq86x,14108,Search for 43 missing students in Mexico turns up corpses of at least 129 other people,japantimes.co.jp,http://www.japantimes.co.jp/news/2015/07/27/world/search-43-missing-students-mexico-turns-corpses-least-129-people/#.VbWdNnhL8Ra
2015-07-27,00:32:32,3eo092,8181,More than 1.2 million trees were planted across Australia on Sunday during National Tree Day. This year's tally brings the total number to over 22 million trees planted by more than 3.5 million participants since the annual event began in 1996.,digitaljournal.com,http://www.digitaljournal.com/news/environment/australians-plant-1-2-million-trees-on-national-tree-day/article/439351
2015-07-27,09:05:47,3epoy3,10931,"Marijuana legalization petition hits enough signatures for UK parliament debate - A petition for the full legalization of marijuana in the UK has gathered more than 130,000 signatures in just four days",rt.com,https://www.rt.com/uk/310760-marijuana-petition-uk-legaliziation/
2015-07-27,04:19:13,3eoqpt,9292,"No excuse for female genital mutilation, says Obama",irishtimes.com,http://www.irishtimes.com/news/world/africa/no-excuse-for-female-genital-mutilation-says-obama-1.2297564
2015-07-27,05:59:36,3ep2vx,4481,"A girl aged about 10 has carried out a suicide bombing in north-eastern Nigeria, killing at least 16 people",bbc.com,http://www.bbc.com/news/world-africa-33671203
2015-07-27,01:00:30,3eo36g,3262,Half of Cuba men's hockey team defects,news.yahoo.com,http://news.yahoo.com/half-cuba-mens-hockey-team-defects-080115006.html
2015-07-27,02:37:15,3eoeha,3037,Deputy Speaker of House of Lords resigns after ‘being filmed snorting cocaine with two prostitutes’,news.com.au,http://news.com.au/world/europe/deputy-speaker-of-house-of-lords-resigns-after-being-filmed-snorting-cocaine-with-two-prostitutes/story-fnh81p7g-1227457965932
2015-07-27,04:32:29,3eosd0,1822,Europe just invested over $380 million in an alien-hunting space mission to Jupiter,businessinsider.com,http://www.businessinsider.com/europes-plan-to-reach-jupiter-for-the-first-time-2015-7
2015-07-27,20:07:35,3erc8v,1504,"Medical marijuana to be sold in pharmacies, says Israeli deputy minister of health",israelhayom.com,http://www.israelhayom.com/site/newsletter_article.php?id=27161
2015-07-27,20:28:35,3erdsy,806,"Only 100 tigers left in Bangladesh's famed Sundarbans forest - The population in the mangrove forest is far less than believed, officials say, after a census uses cameras hidden in trees to record numbers",bangkokpost.com,http://www.bangkokpost.com/news/asia/635784/only-100-tigers-left-in-famed-sundarbans-of-bangladesh
2015-07-27,21:46:37,3erkta,733,Renewable energy expense attacked as Australia gifts $41 billion to fossil fuels,smh.com.au,http://smh.com.au/environment/renewable-energy-expense-attacked-as-australia-gifts-41-billion-to-fossil-fuels-20150725-gijsvh
2015-07-27,01:51:08,3eo91f,639,Turkey asks NATO for extraordinary meeting next week,reuters.com,http://www.reuters.com/article/2015/07/26/mideast-crisis-turkey-nato-idUSL5N1060M820150726
2015-07-27,17:02:59,3eqzis,614,"China stocks plunge, suffer biggest one-day loss since February 2007",hongkongfp.com,https://www.hongkongfp.com/2015/07/27/china-stocks-plunge-suffer-biggest-one-day-loss-since-february-2007/
2015-07-27,21:01:31,3ergdw,551,"Victoria shuts down Yellow Giant underground gold mine in northwestern B.C. for spilling pollution on land and into creeks, lakes, and a wetland.",vancouversun.com,http://www.vancouversun.com/Victoria+shuts+down+Yellow+Giant+gold+mine+northwestern+over+pollution+spills/11244628/story.html
2015-07-27,02:30:35,3eodoa,509,"Young Hondurans Lead Unprecedented Anti-Corruption Movement.A Honduran spring is happening, led by young people mobilising over the social networks, who are flooding the streets with weekly torch marches against corruption and impunity.",ipsnews.net,http://www.ipsnews.net/2015/07/young-hondurans-head-unprecedented-anti-corruption-movement/?
2015-07-27,05:48:30,3ep1j9,385,Turkey Drops Bombs on Kurdish Group That Fought Islamic State in Iraq,news.vice.com,https://news.vice.com/article/turkey-drops-bombs-on-kurdish-group-that-has-fought-the-islamic-state-in-iraq
2015-07-27,23:32:51,3erwqr,271,Russia to give away land to populate its far east.,siberiantimes.com,http://siberiantimes.com/business/others/news/n0329-russia-gives-away-one-hectare-of-farmland-and-forest-to-its-citizens/
2015-07-27,07:38:39,3eper7,257,"Leader of Russian neo-Nazi group sentenced to life: Moscow’s highest court sentenced a leader of a militant neo-Nazi group to life in prison Friday after he was convicted of ordering five brutal killings, including that of a prominent human rights lawyer.",salon.com,http://www.salon.com/2015/07/24/leader_of_russian_neo_nazi_group_sentenced_to_life/
2015-07-27,20:13:12,3erco7,247,"The remains of 97 human bodies have been found stuffed into a small 5,000-year-old house in a prehistoric village in northeast China, researchers report in two separate studies.",livescience.com,http://www.livescience.com/51662-100-bodies-found-prehistoric-house.html
2015-07-27,15:33:12,3eqswv,232,1881 document suggests Palestinian ownership of village destroyed by Israel several times,timesofisrael.com,http://www.timesofisrael.com/1881-document-suggests-palestinian-ownership-of-susya/
2015-07-27,00:43:59,3eo1f8,226,IOC urged to reject Beijing’s 2022 Olympic bid amid lawyer crackdown,hongkongfp.com,https://www.hongkongfp.com/2015/07/26/ioc-urged-to-reject-beijings-2022-olympic-bid-amid-lawyer-crackdown/
2015-07-27,19:01:31,3er7ct,154,Radical Israeli Sheikh calls to conquer Temple Mount with violence,israelnationalnews.com,http://www.israelnationalnews.com/News/News.aspx/198683#.VbYBRUKqqko
2015-07-27,01:04:44,3eo3nu,154,"At least 10 people have been killed in a bomb blast which has hit a hotel in Somalia's capital, Mogadishu.",bbc.co.uk,http://www.bbc.co.uk/news/world-africa-33669610
2015-07-27,18:37:58,3er5qd,155,Dawn of deep-sea mining alarms conservationists as UN body issues exploration contracts.Conservationists are warning that the deep ocean’s fragile biodiversity must be protected and not nearly enough is known about the risks of extracting minerals from seabeds.,canadianbusiness.com,http://www.canadianbusiness.com/business-news/dawn-of-deep-sea-mining-alarms-conservationists-as-un-body-issues-exploration-contracts/?
2015-07-27,23:30:02,3erwcn,112,A former detective has claimed Scotland Yard covered up allegations a killer had pushed 18 people to their deaths on the London Underground in the 1970s.,independent.co.uk,http://www.independent.co.uk/news/uk/home-news/police-covered-up-70s-tube-station-murders-for-fear-public-would-panic-says-former-detective-10418291.html
2015-07-27,02:42:17,3eof47,88,"'Jihadi John' allegedly flees Islamic State, fears he too will be beheaded",washingtontimes.com,http://www.washingtontimes.com/news/2015/jul/25/jihadi-john-allegedly-flees-islamic-state-fears-te/
2015-07-27,02:28:18,3eodff,72,Venezuela could run out of beer by next month.,fusion.net,http://fusion.net/story/172856/venezuela-could-run-out-of-beer-by-next-month/
2015-07-27,23:03:15,3ersze,66,Millionaire Jason Buzi Wants To Create A New Country To House All The World's Refugees,huffingtonpost.co.uk,http://www.huffingtonpost.co.uk/2015/07/27/refugee-nation-country-for-refugees-jason-buzi_n_7877662.html
2015-07-27,17:31:23,3er1ep,57,"Britain’s frontline WWII tunnels rediscovered - Hidden tunnel complex opens to public this week after 6 decades buried as a forgotten time capsule. Abandoned in 1950s, filled in 1970s, only a metal cover plate on a cliff gave any clue as to what lay beneath.",news.com.au,http://www.news.com.au/travel/world-travel/britains-frontline-wwii-tunnels-rediscovered/story-e6frfqbr-1227458856235
