2015-09-14,20:49:05,3kwdbg,29214,Malcom Turnbull becomes Prime Minister of Australia after Tony Abbott rejected by Liberal party,m.smh.com.au,http://m.smh.com.au/federal-politics/the-pulse-live/politics-live-september-14-2015-20150913-gjlqy5.html
2015-09-14,01:49:32,3ksthg,12534,El Nino set to be strongest ever. The most powerful weather pattern of its type in the past 65 years will have huge impacts on weather around the globe.,aljazeera.com,http://www.aljazeera.com/news/2015/09/el-nino-set-strongest-150913093902800.html?
2015-09-14,09:05:16,3kuhhr,9769,12 Mexican Tourists and Egyptians Killed After Security Forces Misidentify Them As Terrorists,egyptianstreets.com,http://egyptianstreets.com/2015/09/14/12-mexican-tourists-and-egyptians-killed-after-security-forces-misidentify-them-as-terrorists/
2015-09-14,03:19:34,3kt6d0,4072,Police drop VIP Westminster paedophile ring murder probe over lack of evidence,dailymail.co.uk,http://www.dailymail.co.uk/news/article-3232828/Police-drop-probe-VIP-paedophile-ring-murder-saying-no-evidence-support-claims.html
2015-09-14,02:03:45,3ksvlr,3363,"A Chinese woman suspected of stealing a $300,000 (£195,000) diamond in the Thai capital, Bangkok, has had the jewel surgically removed from her intestines.",bbc.com,http://www.bbc.com/news/world-asia-34239036
2015-09-14,18:43:21,3kw2s2,1935,Australia- A former teacher from one of Australia's most distinguished families of judges has avoided jail after being convicted of filming up the skirts of his students and possessing ( over 9000 images) child abuse material.,abc.net.au,http://www.abc.net.au/news/2015-09-10/robert-emmett-avoids-jail-over-child-abuse-material/6764952
2015-09-14,02:38:22,3kt0ju,1850,"In a remarkable technical feat, researchers have sequenced DNA from fossils in Spain that are about 300,000 to 400,000 years old and have found an ancestor—or close relative—of Neanderthals.",news.sciencemag.org,http://news.sciencemag.org/archaeology/2015/09/dna-neandertal-relative-may-shake-human-family-tree
2015-09-14,02:30:05,3kszel,1667,"Don't return, a Sydney uni student is told after his father 'disappears' in China",theage.com.au,http://www.theage.com.au/world/dont-return-a-sydney-uni-student-is-told-after-his-father-disappears-in-china-20150913-gjlee1.html
2015-09-14,04:40:14,3kthxp,1335,Bolivia proposes commercialization of the coca leaf,lainfo.es,http://lainfo.es/en/2015/09/13/bolivia-proposes-commercialization-of-the-coca-leaf/
2015-09-14,10:20:29,3kuqf8,1274,Japan's Mount Aso volcano erupts,sbs.com.au,http://www.sbs.com.au/news/article/2015/09/14/japans-mount-aso-volcano-erupts
2015-09-14,08:30:21,3kud28,1262,Historian understood to have found first use of word f*** in 1310 English court case,independent.co.uk,http://www.independent.co.uk/news/uk/home-news/historian-understood-to-have-found-first-use-of-word-f-in-1310-english-court-case-concerning-roger-fuckebythenavele-10498958.html
2015-09-14,22:27:37,3kwoiq,1217,Two suspected terrorists linked to Boko Haram are charged with horrendous acid attack on holidaying British teenagers,dailymail.co.uk,http://www.dailymail.co.uk/news/article-3232680/Two-suspected-terrorists-linked-Boko-Haram-charged-horrendous-acid-attack-holidaying-British-teenagers.html
2015-09-14,21:50:09,3kwk5k,765,El Nino could make 2015 'the hottest year on record'... and 2016 will be even hotter. The findings will demolish claims by climate sceptics that the slowdown in the rate of global warming over the past 17 years proves that scientists’ concerns are exaggerated.,independent.co.uk,http://www.independent.co.uk/environment/climate-change/2015-will-be-the-hottest-year-on-record--but-experts-predict-2016-will-be-even-warmer-10499220.html
2015-09-14,09:41:26,3kulup,652,"Goldman Sachs report: Oil headed to $20 a barrel. Economist says it's unlikely because ""There are too many big financial players that have been buying up oil they would just start buying up the companies and shutting down production themselves""",khou.com,http://www.khou.com/story/news/local/2015/09/12/goldman-sachs-report-oil-headed-to-20-a-barrel/72176586/
2015-09-14,04:53:03,3ktjph,607,Iran's President Wishes Jews a Happy Rosh Hashana,time.com,http://time.com/4032762/iran-tweet-rosh-hashana/
2015-09-14,06:34:34,3ktxyr,505,Vivienne Westwood drives tank to David Cameron's house in anti-fracking protest.,independent.co.uk,http://www.independent.co.uk/news/people/vivienne-westwood-drives-tank-to-david-camerons-house-in-antifracking-protest-10496728.html
2015-09-14,03:01:54,3kt3tc,420,"Three critically endangered Javan rhinoceros calves where spotted on camera in an Indonesian national park, much to the excitement of staff and rhino lovers.",bbc.com,http://www.bbc.com/news/world-asia-34194581?OCID=fbasia&ocid=socialflow_facebook
2015-09-14,06:49:38,3ku01a,373,Obama Administration Accused of Ignoring Geneva Conventions in Refusal to Release 74-Pound Guantanamo Detainee,theintercept.com,https://theintercept.com/2015/09/11/obama-administration-accused-ignoring-geneva-convention-refusal-release-74-pound-guantanamo-detainee/
2015-09-14,13:14:54,3kvapw,366,"Taliban storms Afghan jail with suicide bombers, releases over 350 prisoners",rt.com,http://www.rt.com/news/315228-taliban-storms-prison-afghanistan/
2015-09-14,01:44:40,3kssub,336,NASA Launching 4K TV Channel,science.slashdot.org,http://science.slashdot.org/story/15/09/12/0330226/nasa-launching-4k-tv-channel
2015-09-14,06:47:09,3ktzp5,321,The Egyptian army announced it has killed 64 alleged Islamic State (IS) militants in North Sinai Saturday,thecairopost.com,http://www.thecairopost.com/news/167113/news/64-killed-in-6th-day-of-martyrs-right-military-operation-spo
2015-09-14,21:43:51,3kwjeu,242,"Oxfam: Increasing inequality plunging millions more Europeans into poverty.Between 2009 and 2013, the number of Europeans living without enough money to heat their homes or cope with unforeseen expenses, known as “severe material deprivation”, rose by 7.5 million to 50 million people",eureporter.co,http://www.eureporter.co/world/2015/09/14/oxfam-increasing-inequality-plunging-millions-more-europeans-into-poverty/?
2015-09-14,09:34:28,3kukzf,212,Taking in Syrian refugees heightens risk of terrorism: US,zeenews.india.com,http://zeenews.india.com/news/world/taking-in-syrian-refugees-heightens-risk-of-terrorism-us_1795788.html
2015-09-14,02:23:27,3ksyg6,215,Czech PM insists migrant quotas 'won't work',globalpost.com,http://www.globalpost.com/article/6648244/2015/09/13/czech-pm-insists-migrant-quotas-wont-work
2015-09-14,22:37:56,3kwprm,190,"The oldest Egyptian leather manuscript has been found in the shelves of the Egyptian museum in Cairo, where it was stored and forgotten for more than 70 years.",news.discovery.com,http://news.discovery.com/history/archaeology/oldest-and-longest-ancient-egyptian-leather-manuscript-found-150914.htm#mkcpgn=rssnws1
2015-09-14,15:00:39,3kvktq,173,"Thousands of Sex Slaves From India, Nepal and Bangladesh Sold to Middle East and IS Terrorists",newindianexpress.com,http://www.newindianexpress.com/nation/Thousands-of-Sex-Slaves-From-India-Nepal-and-Bangladesh-Sold-to-Middle-East-and-IS-Terrorists/2015/09/14/article3026853.ece
2015-09-14,23:26:35,3kww1w,172,Austria and Slovakia Follow Germany in Introducing Stricter Border Controls,nytimes.com,http://www.nytimes.com/2015/09/15/world/europe/europe-migrants-germany.html?_r=0
2015-09-14,23:26:11,3kww07,153,Nepal rejects reverting back to a Hindu state -- More than two-thirds of lawmakers vote to keep secular system brought in after fall of monarchy in 2008,aljazeera.com,http://www.aljazeera.com/news/2015/09/nepal-rejects-reverting-hindu-state-150914133321948.html
2015-09-14,03:49:19,3ktakx,143,Former FIFA vice president Jack Warner made a profit of around £11million ($17m USD) on World Cup television rights that Sepp Blatter sold him for £389k ($600k),foxsports.com,http://www.foxsports.com/soccer/story/former-fifa-official-jack-warner-made-huge-profit-on-world-cup-television-rights-091315
2015-09-14,08:42:04,3kuekv,135,"Syrian refugees are not wanted in Ireland because they’re Muslim, Irish aid worker claims",irishmirror.ie,http://www.irishmirror.ie/news/irish-news/syrian-refugees-not-wanted-ireland-6430625
