2015-02-23,05:46:23,2wsuiu,32204,"The family of the codebreaker Alan Turing will visit Downing Street on Monday to demand the government pardons 49,000 other men persecuted like him for their homosexuality.",theguardian.com,http://www.theguardian.com/science/2015/feb/22/family-alan-turing-government-petition-pardons-gross-indecency-homosexuality
2015-02-23,20:13:33,2wv4kq,14077,"There's a massive new leak of confidential spy files from MI6, Mossad and the FSB",businessinsider.in,http://www.businessinsider.in/Theres-a-massive-new-leak-of-confidential-spy-files-from-MI6-Mossad-and-the-FSB/articleshow/46343705.cms
2015-02-23,17:07:37,2wute6,10140,China to credit Ukraine for $3.6 bln to reduce dependence on Russian gas,info-news.eu,http://info-news.eu/china-to-credit-ukraine-for-3-6-bln-to-reduce-dependence-on-russian-gas/#sthash.utRs24wR.4XNnyIOq.sfju
2015-02-23,13:05:23,2wuagz,6267,Edward Snowden documentary Citizenfour wins Oscar,theguardian.com,http://www.theguardian.com/film/2015/feb/23/edward-snowden-documentary-citizenfour-wins-oscar
2015-02-23,02:00:07,2ws1c1,8541,Report: ISIS leader gunned down in Mosul.,rudaw.net,http://rudaw.net/english/middleeast/iraq/22022015
2015-02-23,23:27:44,2wvlou,4618,Egypt's President: It's time for an Arab coalition against ISIS,cnn.com,http://www.cnn.com/2015/02/23/middleeast/isis-crisis/
2015-02-23,19:30:44,2wv1u6,1819,Reuters’ bureau chief found dead in Islamabad,tribune.com.pk,http://tribune.com.pk/story/842901/reuters-maria-golovnina-found-dead-in-islamabad/
2015-02-23,20:23:57,2wv58i,1280,Measles kill toddler in Berlin,thelocal.de,http://www.thelocal.de/20150223/measles-cancels-classes-at-berlin-school
2015-02-23,02:39:11,2ws653,1240,"The vice principal of a Turkish high school who raised eyebrows after suggesting the formation of “harassment teams” to prevent female students from wearing short skirts, has been relieved from administrative duty and reappointed to another school as a plain teacher",hurriyetdailynews.com,http://www.hurriyetdailynews.com/turkish-teacher-calling-for-anti-skirt-harassment-teams-removed-from-duty.aspx?pageID=238&nID=78679&NewsCatID=341
2015-02-23,02:35:53,2ws5r2,823,Israel is to purchase 14 F-35 stealth fighters from US aerospace giant Lockheed Martin at a cost of around $110 million each,hurriyetdailynews.com,http://www.hurriyetdailynews.com/israel-to-buy-14-f-35-stealth-fighters-from-us-.aspx?pageID=238&nID=78686&NewsCatID=359
2015-02-23,13:49:48,2wuexq,734,Thirty Jihadis return home to Australia after being foreign fighters,heraldsun.com.au,http://www.heraldsun.com.au/news/thirty-jihadis-return-home-to-australia-after-being-foreign-fighters/story-fni0fiyv-1227234693848
2015-02-23,02:41:25,2ws6ez,734,India’s Largest Bank Commits $12.5 Billion For Renewable Energy Funding,cleantechnica.com,http://cleantechnica.com/2015/02/19/indias-largest-bank-commits-12-5-billion-renewable-energy-funding/
2015-02-23,04:45:01,2wsmfx,722,Homeless Britons Are Turning To The Sikh Community For Food,bbc.com,http://www.bbc.com/news/blogs-magazine-monitor-31557192
2015-02-23,16:00:52,2wup62,594,Grand Imam of Egypt's top Islamic Institution has called for a radical reform of religious teaching to tackle the spread of islamic extremism.,m.bbc.com,http://m.bbc.com/news/world-middle-east-31580130
2015-02-23,16:01:36,2wup83,566,Large Hadron Collider scientists gear up to discover new particle with a recent upgrade--a new particle could be detected this year that is even more exciting than the Higgs boson.,bbc.com,http://www.bbc.com/news/science-environment-31480192
2015-02-23,02:46:41,2ws735,550,Girl as young as seven kills herself and five others in Nigeria suicide bombing by Boko Haram,theguardian.com,http://www.theguardian.com/world/2015/feb/22/girl-as-young-as-seven-kills-herself-and-five-others-in-nigeria-suicide-bombing
2015-02-23,18:41:29,2wuyvx,513,Ukraine's army refuses to start withdrawing heavy weapons. A Ukrainian military spokesman told reporters on Monday that the move will not start before rebel attacks stop completely.,dw.de,http://www.dw.de/ukrainian-army-refuses-to-start-withdrawing-heavy-weapons/a-18274346
2015-02-23,23:31:10,2wvm3r,322,"The leader of an ISIS brigade in Qalamoun was shot dead by a senior official of his own group, in a disagreement over allegiances and relations with the Nusra Front.",dailystar.com.lb,http://www.dailystar.com.lb/News/Lebanon-News/2015/Feb-23/288378-isis-commander-murdered-outside-arsal.ashx
2015-02-23,01:52:19,2ws0cr,304,Putin approved Ukraine invasion before Kiev government collapsed: A Russian newspaper claims to have an official government strategy document outlining the invasion of Ukraine that was prepared weeks before the Ukrainian government collapsed last year,mcclatchydc.com,http://www.mcclatchydc.com/2015/02/21/257386/russian-news-report-ukraine-invasion.html
2015-02-23,05:52:20,2wsvc8,252,ISIS Destroy Virgin Mary Church and Central Library of Mosul,abna24.com,http://www.abna24.com/english/service/middle-east-west-asia/archive/2015/02/22/672623/story.html
2015-02-23,15:43:38,2wuo3d,229,France deployed an aircraft carrier in the Gulf as part of the US-led military campaign against the Islamic State,finance.yahoo.com,http://finance.yahoo.com/news/france-deploys-aircraft-carrier-gulf-fight-070241413.html;_ylt=AwrTWfyA2OpUUnYAkjfQtDMD
2015-02-23,16:52:27,2wusgw,232,Great Britain: Baroness Warsi gave official roles to people with links to extremist groups,tribune.com.pk,http://tribune.com.pk/story/842724/baroness-warsi-gave-official-roles-to-people-with-links-to-extremist-groups/
2015-02-23,21:45:40,2wvbib,146,Israel asks UN to condemn Iran Holocaust cartoon contest,timesofisrael.com,http://www.timesofisrael.com/israel-asks-un-to-condemn-iran-holocaust-cartoon-contest/
2015-02-23,19:21:30,2wv18k,140,Hindus urge Pope Francis to ‘discipline’ Derry priest who warns of risk involved in yoga,derryjournal.com,http://www.derryjournal.com/news/hindus-urge-pope-francis-to-discipline-derry-priest-who-warns-of-risk-involved-in-yoga-1-6592555
2015-02-23,06:45:43,2wt2fa,129,"'Hamas-Fatah rift hindering efforts to rebuild Gaza,' Arab League says",jpost.com,http://www.jpost.com/Middle-East/Hamas-Fatah-rift-hindering-Gaza-Strip-reconstruction-efforts-391854
2015-02-23,05:09:06,2wspij,112,Swiss account secret of HSBC chief Stuart Gulliver revealed,theguardian.com,http://www.theguardian.com/business/2015/feb/22/swiss-account-secret-of-hsbc-chief-stuart-gulliver-revealed
2015-02-23,11:24:21,2wtz9t,108,"The Palestinian president has threatened to stop security coordination with Israel if the country continues to withhold millions of dollars of Palestinian tax revenue, a senior Palestinian official said Sunday.",apnewsarchive.com,http://www.apnewsarchive.com/2015/Palestinians-threaten-to-end-security-ties-with-Israel-over-withheld-tax-revenue/id-20317eccfef84eadbdef17f876063c17
2015-02-23,23:30:19,2wvm03,98,Jerusalem mayor wrestles terrorist to the ground,bbc.co.uk,http://www.bbc.co.uk/news/world-middle-east-31585045
2015-02-23,05:39:53,2wstq1,94,Polish FM: Europe must unite against Russian information war | EU outlines plans for Russian-language TV channel to counter Kremlin media campaign,uatoday.tv,http://uatoday.tv/politics/polish-fm-europe-must-unite-against-russian-information-war-threat-410901.html
2015-02-23,02:12:12,2ws2ug,87,"Turkey launches raid to save Ottoman tomb in Syria: Turkish soldiers launched an overnight raid into neighboring Syria, evacuating dozens of besieged troops guarding an Ottoman tomb and moving the crypt Sunday back to Turkey after ceremonially planting the country's crescent-and-star flag.",cbsnews.com,http://www.cbsnews.com/news/turkey-raid-ottoman-tomb-in-syria/
