2015-09-30,19:26:48,3my73b,15013,"Germany has translated the first 20 articles of the country's constitution, which outline basic rights like freedom of speech, into Arabic for refugees to help them integrate.",reuters.com,http://www.reuters.com/article/2015/09/30/europe-migrants-germany-constitution-idINKCN0RU13020150930?feedType=RSS&feedName=worldNews
2015-09-30,13:00:31,3mxaal,15801,Man Killed by Hindu Mob in India because they suspected he ate Beef.,ndtv.com,http://www.ndtv.com/india-news/man-killed-by-mob-near-delhi-over-beef-rumours-1224514
2015-09-30,17:25:02,3mxxuh,3884,Japan says it must look after its own before allowing in Syrian refugees,theguardian.com,http://www.theguardian.com/world/2015/sep/30/japan-says-it-must-look-after-its-own-before-allowing-syrian-refugees-in
2015-09-30,03:12:54,3mv2b5,3730,Zimbabwe President Robert Mugabe shouts 'We are not gays' during UN address,mashable.com,http://mashable.com/2015/09/29/zimbabwe-president-homophobia/
2015-09-30,20:53:21,3myegz,2596,"Russia has conducted its first airstrike in Syria, near city of Homs, senior U.S. official tells CNN",edition.cnn.com,http://edition.cnn.com/2015/09/30/politics/russia-syria-airstrikes-isis/index.html/
2015-09-30,02:31:05,3muvxj,2374,"A British nursing home offers its residents strippers and prostitutes, sparking a debate over sexual rights of the disabled.",livescience.com,http://www.livescience.com/26669-nursing-home-strippers-prostitutes.html?cmpid=514645_20150929_53197536&adbid=648912632192233473&adbpl=tw&adbpr=15428397
2015-09-30,16:13:09,3mxsmt,2220,"Young New Zealander took his own life while awaiting deportation from Australia, he had lived in Australia since the age of 4. He was placed in indefinite detention in Goulburn jail and denied mental health support. Currently 200 New Zealanders are in indefinite detention awaiting deportation.",au.news.yahoo.com,https://au.news.yahoo.com/thewest/a/29679374/new-zealand-angry-at-australias-convict-deportations/
2015-09-30,05:08:37,3mvjjs,2148,Iron Dome intercepts rocket over Ashdod,jpost.com,http://www.jpost.com/Arab-Israeli-Conflict/Rocket-alert-sirens-sound-in-southern-Israel-419438
2015-09-30,05:29:47,3mvmta,1667,"Tractors, cows take over Canadian Parliament Hill as dairy farmers protest TPP",cbc.ca,http://www.cbc.ca/news/canada/ottawa/trans-pacific-partnership-dairy-farmers-ottawa-protest-1.3248479
2015-09-30,07:18:06,3mw2tm,1594,UK and Saudi Arabia made a 'secret deal' to secure each others' UN Human Rights Council seats,theguardian.com,http://www.theguardian.com/uk-news/2015/sep/29/uk-and-saudi-arabia-in-secret-deal-over-human-rights-council-place
2015-09-30,17:13:04,3mxx28,1512,"The Russian parliament on Wednesday unanimously granted President Vladimir Putin the right to deploy the country's military in Syria, a move a top Kremlin aide said related only to the air force.",reuters.com,http://www.reuters.com/article/2015/09/30/uk-mideast-crisis-russia-syria-idUKKCN0RU0PP20150930
2015-09-30,06:08:18,3mvsje,1470,Montreal to dump 8 billion litres of sewage into St. Lawrence River,cbc.ca,http://www.cbc.ca/news/canada/montreal/st-lawrence-river-sewage-bonaventure-mill-interceptor-1.3248937
2015-09-30,21:01:03,3myf73,1356,US court dismisses 9/11 lawsuit against Saudi Arabia,dw.com,http://www.dw.com/en/us-court-dismisses-9-11-lawsuit-against-saudi-arabia/a-18750317
2015-09-30,00:23:20,3mud1z,971,"Hitachi says it can predict crimes before they happen: called Hitachi Visualization Predictive Crime Analytics, gobbles massive amounts of data—from public transit maps, social media conversations, weather reports, and more—and uses machine learning to find patterns that humans can’t pick out.",qz.com,http://qz.com/513125/hitachi-says-it-can-predict-crimes-before-they-happen/
2015-09-30,20:42:45,3mydht,792,Chinese city hit by multiple explosions at public buildings,theguardian.com,http://www.theguardian.com/world/2015/sep/30/china-explosions-reported-liuzhou-guangxi-public-buildings
2015-09-30,00:01:35,3mu9th,540,China opens terrifying glass-bottomed bridge in Shiniuzhai park,cnn.com,http://www.cnn.com/2015/09/27/travel/china-glass-bridge-shiniuzhai/
2015-09-30,10:10:41,3mwpgw,535,Saudi Arabia insists Assad must go or be overthrown,yahoo.com,https://www.yahoo.com/news/saudi-fm-assad-must-face-military-option-212903639.html
2015-09-30,02:27:22,3muvdj,466,"For the first time ever, there are now more people in Canada age 65 and over than there are under age 15",cbc.ca,http://www.cbc.ca/news/business/statistics-canada-seniors-1.3248295
2015-09-30,11:22:47,3mwyp0,417,A German scientist is revoking the license to his bioinformatics software for researchers working in eight European countries because those countries allow too many immigrants to cross their borders.,news.sciencemag.org,http://news.sciencemag.org/europe/2015/09/scientist-revokes-software-license-protest-immigration-friendly-policies
2015-09-30,04:23:15,3mvcvk,408,"First of its kind study: No serious adverse effects from long-term MMJ use. ""No evidence of harmful effects on cognitive function, or blood tests among cannabis consumers and we observed a significant improvement in their levels of pain, symptom distress, mood and quality of life""",sciencedaily.com,http://www.sciencedaily.com/releases/2015/09/150929112036.htm
2015-09-30,22:56:30,3mysyf,376,Antikythera Shipwreck Yields New Cache of Ancient Treasures,smithsonianmag.com,http://www.smithsonianmag.com/science-nature/antikythera-shipwreck-yields-new-cache-ancient-treasures-180956775/?no-ist
2015-09-30,10:39:05,3mwt67,368,"Norwegian terrorist and mass murderer, Anders Behring Breivik, who killed 77 people in 2011, pledges to hunger strike until death as a protest against prison conditions",thelocal.no,http://www.thelocal.no/20150929/breivik-i-will-hunger-strike-to-death
2015-09-30,10:12:30,3mwpp2,351,"Quebec-based Valeant Pharmaceuticals is suspected of using the same business model as former hedge fund manager Martin Shkreli, as the price of two heart drugs is increased.",cbc.ca,http://www.cbc.ca/news/health/valeant-pharmaceuticals-price-hikes-1.3248265
2015-09-30,12:28:33,3mx6q3,305,"Volkswagen staff acted criminally, says board member",bbc.com,http://www.bbc.com/news/business-34397426
2015-09-30,22:50:35,3mys6s,302,"King Tut's tomb likely has hidden chamber, Egyptian official says",cbc.ca,http://www.cbc.ca/news/technology/king-tut-nefertiti-1.3249990
2015-09-30,00:06:45,3mualp,144,"The Turkish government has perpetrated ""systematic human rights violations"" that ""justify legal action at international level,"" according to a new report.",newsweek.com,http://www.newsweek.com/exiled-turkish-opposition-releases-scathing-report-human-rights-under-erdogan-377629
2015-09-30,02:29:50,3muvrb,127,South Africa 'a country at war' as murder rate soars to nearly 49 a day.,theguardian.com,http://www.theguardian.com/world/2015/sep/29/south-africa-a-country-at-war-as-rate-soars-to-nearly-49-a-day?CMP=twt_a-world_b-gdnworld
2015-09-30,21:48:06,3myke9,107,Labour leader Jeremy Corbyn: Nukes 'Didn't Do USA Much Good On 9/11',news.sky.com,http://news.sky.com/story/1561619/corbyn-nukes-didnt-do-usa-much-good-on-9-11
2015-09-30,03:19:41,3mv3cw,109,"AJ+ spoke to Google to find out what Syrians are searching for and found that, according to search volumes over the past fortnight, people have been searching for their closest hospitals, how to treat burns at home and how to perform mouth-to-mouth resuscitation",aljazeera.com,http://www.aljazeera.com/news/2015/09/top-google-searches-syria-150929151549994.html
2015-09-30,01:41:19,3muod9,101,"China's manufacturing economy in trouble, PMI falls to 49.",chinadaily.com.cn,http://www.chinadaily.com.cn/business/chinadata/2015-09/01/content_21765931.htm
