2015-09-10,04:51:43,3kad6f,23682,National Geographic sold to Fox,nytimes.com,http://www.nytimes.com/aponline/2015/09/09/us/politics/ap-us-national-geographic-fox.html?_r=0
2015-09-10,23:51:25,3keo0r,13176,French court confirms Monsanto guilty of chemical poisoning,reut.rs,http://reut.rs/1Me4vRP
2015-09-10,02:20:47,3k9nyj,7636,Top female student takes on corruption in Egypt after scoring zero on exams,theguardian.com,http://www.theguardian.com/world/2015/sep/09/egypt-zero-schoolgirl-mariam-malak-corruption-final-exams
2015-09-10,17:52:45,3kdfts,10380,"A new species of human ancestor found, Homo naledi, has been found in South Africa",news24.com,http://www.news24.com/SouthAfrica/News/LIVE-Huge-fossil-discovery-to-be-revealed-20150910
2015-09-10,12:14:54,3kcdwp,7398,Female cartoonist could have 12 year prison term extended for shaking her lawyer's hand,independent.co.uk,http://www.independent.co.uk/arts-entertainment/art/news/female-cartoonist-could-have-12-year-prison-term-extended-for-shaking-her-lawyers-hand-10492837.html
2015-09-10,21:26:52,3ke2n5,14184,"Travelling to work 'is work', European court rules",bbc.co.uk,http://www.bbc.co.uk/news/uk-34210002
2015-09-10,13:21:05,3kcn0x,5924,"The Amazon tribe protecting the forest with bows, arrows, GPS and camera traps - With authorities ineffective, the 2,200-strong Ka’apor, in the Brazilian state of Maranhão, are taking on the illegal loggers with technology & direct action",theguardian.com,http://www.theguardian.com/environment/2015/sep/09/amazon-tribe-protecting-forest-bows-arrows-gps-camera-traps
2015-09-10,22:48:32,3kee09,5277,People climbing onto rooftops to stay alive - Japan is experiencing extreme flooding,bbc.com,http://www.bbc.com/news/world-asia-34205873
2015-09-10,23:30:15,3kekjw,5090,Finland to raise taxes on the wealthy to cover refugee costs,trust.org,http://www.trust.org/item/20150910140946-mlxl6/?
2015-09-10,21:51:58,3ke607,2954,The European Commission and Big Tobacco accused of cover-up after heavily redacted documents released.Documents back up fears that TTIP will allow tobacco giants to take legal action against the UK and other European governments who attempt to tighten smoking legislation,independent.co.uk,http://www.independent.co.uk/news/uk/home-news/ttip-controversy-the-european-commission-and-big-tobacco-accused-of-coverup-after-heavily-redacted-documents-released-10473601.html
2015-09-10,16:18:20,3kd6zl,2304,"UK govt calls environmental controls on fracking ""unnecessary red tape"" - Added its weight to a behind-the-scenes lobbying drive by oil & gas firms including BP, Chevron, Shell & ExxonMobil to persuade EU leaders to scrap series of environmental safety measures, according to leaks.",theguardian.com,http://www.theguardian.com/environment/2015/sep/10/uk-backs-bid-by-fossil-fuel-firms-to-kill-new-eu-fracking-controls-letters-reveal
2015-09-10,01:43:48,3k9hn7,1879,"A judge in Iran has started sentencing criminals to buy and read books instead of handing down jail terms to avoid ""irreversible physical and psychological impact on convicts and their families""",bbc.co.uk,http://www.bbc.co.uk/news/blogs-news-from-elsewhere-34200912
2015-09-10,21:56:00,3ke6k1,1456,Thailand introduces first law to protect LGBT people,pinknews.co.uk,http://www.pinknews.co.uk/2015/09/10/thailand-introduces-first-law-to-protect-lgbt-people/
2015-09-10,05:51:19,3kanpl,1012,German Lawmaker: At the Root of Refugee Crisis are Wars Led by the United States in the Middle East,democracynow.org,http://www.democracynow.org/2015/9/9/german_lawmaker_at_the_root_of
2015-09-10,14:28:31,3kcv3x,979,"More Than 1,000 Indian Muslim Clerics Sign Fatwa Against ISIS",huffingtonpost.com,http://www.huffingtonpost.com/entry/more-than-1000-indian-muslim-clerics-sign-fatwa-against-isis_55f06f6ae4b002d5c0779b9e?section=india&adsSiteOverride=in
2015-09-10,19:36:08,3kdpiv,627,Number of Russians Living in Poverty Nears 22 Million,themoscowtimes.com,http://www.themoscowtimes.com/business/business/article/number-of-russians-living-in-poverty-nears-22-million/529769.html
2015-09-10,14:04:17,3kcsg5,623,"China to explore 'dark side' of the moon. China has confirmed it plans to send a spacecraft to land on the moon's ""dark side"" before 2020...",cnn.com,http://www.cnn.com/2015/09/09/asia/china-moon-exploration-dark-side/index.html?sr=cnnitw
2015-09-10,05:10:08,3kag7o,559,ISIS claim to be holding Norwegian and Chinese men hostages,express.co.uk,http://www.express.co.uk/news/world/604127/Islamic-State-ISIS-hostage-Norwegian-Chinese-ransom-behead
2015-09-10,07:33:47,3kb558,379,"Sudan's security forces killed, raped and burned civilians alive, says rights group. Human Rights Watch report catalogues appalling acts carried out by Sudan’s Rapid Support Forces during two military campaigns in Darfur.",theguardian.com,http://www.theguardian.com/global-development/2015/sep/09/sudan-security-forces-killed-raped-burned-civilians-alive-human-rights-watch-report-darfur?CMP=twt_gu
2015-09-10,03:00:20,3k9uny,366,"UN: 96,000 children are starving and close to death in the port city of al-Hodeidah in Yemen",aljazeera.com,http://www.aljazeera.com/news/2015/09/100000-children-starving-yemen-al-hodeidah-150908191310445.html
2015-09-10,16:45:59,3kd9r4,300,Egyptian researchers developed a cost-effective method for cleaning saltwater in just minutes,inhabitat.com,http://inhabitat.com/egyptian-researchers-developed-a-cost-effective-method-for-cleaning-saltwater-in-just-minutes/
2015-09-10,21:09:58,3ke0fq,286,"Non-EU countries Norway, Iceland, Switzerland, and Liechtenstein will have to agree to relocate asylum seekers in the latest EU scheme or face possible penalties",euobserver.com,https://euobserver.com/migration/130186
2015-09-10,03:40:38,3ka18q,219,Russian troops join combat in Syria,reuters.com,http://www.reuters.com/article/2015/09/09/us-mideast-crisis-syria-exclusive-idUSKCN0R91H720150909
2015-09-10,08:05:13,3kbatq,187,Brazil Credit Rating Cut to Junk by Standard & Poor,bloomberg.com,http://www.bloomberg.com/news/articles/2015-09-09/brazil-credit-rating-cut-to-junk-by-s-p-amid-budget-strain
2015-09-10,04:44:48,3kabyy,129,"U.S., allies launch 17 air strikes against Islamic State in Syria, Iraq -statement",reuters.com,http://www.reuters.com/article/2015/09/09/mideast-crisis-airstrikes-idUSL1N11F1ML20150909
2015-09-10,09:34:11,3kbpf8,130,Nazi gold train treasure hunters in Poland discover a mile-long tunnel,dailymail.co.uk,http://www.dailymail.co.uk/news/article-3227540/Mile-long-tunnel-discovered-treasure-hunters-search-Nazi-gold-train-Poland-using-90-year-old-railway-map.html?ito=social-twitter_mailonline
2015-09-10,04:05:49,3ka56j,127,Israel's Arab sector to receive 900 million NIS in aid,israelhayom.com,http://www.israelhayom.com/site/newsletter_article.php?id=27993
2015-09-10,23:11:32,3kehko,125,"Women at Saudi Diplomat's House Spat at Police, Hit Them: Eyewitnesses",ndtv.com,http://www.ndtv.com/india-news/women-at-saudi-diplomats-house-spat-at-police-hit-them-eyewitnesses-1215933
2015-09-10,02:55:26,3k9ttp,116,Russia building major military base near Ukrainian border.,theguardian.com,http://www.theguardian.com/world/2015/sep/09/russia-building-major-military-base-near-ukrainian-border?CMP=twt_b-gdnnews
2015-09-10,21:36:38,3ke3xy,117,Refugees try to walk from Denmark to Sweden,thelocal.se,http://www.thelocal.se/20150907/refugees-threaten-to-walk-from-denmark-to-sweden
