2015-01-23,18:54:04,2te5tv,25644,"Kurds Not Invited to Anti-ISIS Conference in London, Despite Leading the War against the Terrorist Organization",rudaw.net,http://rudaw.net/english/kurdistan/23012015
2015-01-23,07:08:24,2tcb2i,24663,King of Saudi Arabia Has Died At 90,egyptianstreets.com,http://egyptianstreets.com/2015/01/22/king-of-saudi-arabia-has-died-at-90/
2015-01-23,00:42:19,2tavum,2721,"France admits soldiers have deserted to ISIS, including ex-elite special forces and French foreign legionnaires",news.nationalpost.com,http://news.nationalpost.com/2015/01/22/france-admits-soldiers-have-deserted-to-isis-including-ex-elite-special-forces-and-french-foreign-legionnaires/
2015-01-23,23:17:19,2teqxu,2332,Priest sentenced to 13 years in prison for pedophilia in Australia,laprensasa.com,http://www.laprensasa.com/309_america-in-english/2894526_priest-sentenced-to-13-years-in-prison-for-pedophilia-in-australia.html
2015-01-23,21:33:19,2tegk8,2216,Americans Offer to Take 100 Lashes Each for Saudi Blogger,jewishpress.com,http://www.jewishpress.com/news/breaking-news/americans-offer-to-take-100-lashes-each-for-saudi-blogger/2015/01/23/
2015-01-23,01:00:37,2tay52,1626,Egyptian President Abdel-Fattah el-Sisi said Thursday that Muslims need to adapt their religious discourse to the present and eliminate elements of their rhetoric that could foster violence.,huffingtonpost.com,http://www.huffingtonpost.com/2015/01/22/sisi-muslims-adapt_n_6508808.html?utm_hp_ref=tw
2015-01-23,00:35:44,2tav09,1087,"Russia has accused Poland of engaging in a ""mockery of history"" after the Polish foreign minister credited Ukrainian soldiers, rather than the Soviet Red Army, with liberating Auschwitz 70 years ago",bigstory.ap.org,http://bigstory.ap.org/article/3dec620333894a938932c24553d2973d/russia-accuses-poles-mockery-history-over-auschwitz
2015-01-23,03:07:06,2tbeno,864,Obama declines meeting with Netanyahu,bbc.com,http://www.bbc.com/news/world-us-canada-30941090
2015-01-23,04:37:01,2tbqnu,818,"Australian David Hicks, former Guantanamo Bay detainee who was tortured for five years, is innocent, United States government tells lawyer",abc.net.au,http://www.abc.net.au/news/2015-01-23/former-guantanamo-bay-detainee-david-hicks-innocent/6039806
2015-01-23,16:58:01,2tdyui,804,US officials thank Australia for helping kill 6000 Islamic State fighters including half its commanders,news.com.au,http://www.news.com.au/world/us-officials-thank-australia-for-helping-kill-6000-islamic-state-fighters-including-half-its-commanders/story-fndir2ev-1227194558168
2015-01-23,18:47:05,2te5fl,771,China is cracking down on VPNs After censorship system ‘Upgrade’,techcrunch.com,http://techcrunch.com/2015/01/23/china-vpn-crackdown/
2015-01-23,21:23:29,2tefqs,764,Paris Announces Plan to Promote Secular Values,nytimes.com,http://www.nytimes.com/2015/01/23/world/europe/charlie-hebdo-attack-leads-to-changes-in-french-schools.html
2015-01-23,07:49:05,2tcg96,682,"Thousands of protesters have gathered outside Argentina's government palace in Buenos Aires, demanding a full investigation into the death of a prosecutor who was looking into allegations against the country's President.",english.cri.cn,http://english.cri.cn/12394/2015/01/20/3561s862598.htm
2015-01-23,03:44:26,2tbjk6,652,Yemeni Government Collapses as President and Prime Minister Resign,nytimes.com,http://www.nytimes.com/2015/01/23/world/middleeast/yemen-houthi-crisis-sana.html?_r=0
2015-01-23,02:25:20,2tb92c,489,Scientists move doomsday clock closer to midnight,capitalgazette.com,"http://www.capitalgazette.com/news/nation_world/chi-atomic-clock-20150122,0,3802359.story"
2015-01-23,21:52:42,2tei9u,370,France sees as many anti-Muslim acts in Jan as all of 2014,news.yahoo.com,https://news.yahoo.com/france-sees-many-anti-muslim-acts-jan-2014-134231199.html
2015-01-23,14:43:58,2tdpvq,362,"Portugal, which expelled Jews in 1536, are offering descendants of the local Sephardi community the right of return",haaretz.com,http://www.haaretz.com/jewish-world/jewish-world-news/1.638515
2015-01-23,04:21:12,2tbok9,283,Edward Snowden: France’s 'Intrusive' Surveillance Laws Failed to Stop Paris Attacks,nationaljournal.com,http://www.nationaljournal.com/tech/snowden-france-s-intrusive-surveillance-laws-failed-to-stop-paris-attacks-20150121
2015-01-23,09:41:11,2tcu0c,279,Japan pledges $100m to rebuild Gaza.,middleeastmonitor.com,https://www.middleeastmonitor.com/news/48-asia/16481-japan-pledges-100m-to-rebuild-gaza
2015-01-23,23:17:08,2teqx5,273,Peshmerga forces captured several villages around Mosul from ISIS and shelled the city center for the first time,rudaw.net,http://rudaw.net/english/kurdistan/230120151
2015-01-23,03:50:30,2tbke0,271,NATO says detects signs of increased Russian involvement in eastern Ukraine,reuters.com,http://www.reuters.com/article/2015/01/22/us-ukraine-crisis-nato-idUSKBN0KV1EP20150122
2015-01-23,12:36:14,2tddv4,189,"Doomsday clock reaches 3 minutes to midnight. Only other instances of it getting this far were 1984 during the peak of the Coldwar, and 1949 when the Soviet Union tested it's first atomic bomb.",io9.com,http://io9.com/doomsday-clock-now-three-minutes-to-midnight-1681255062
2015-01-23,15:41:46,2tdu44,174,"U.S. officials say 6,000 ISIS fighters killed in battles",edition.cnn.com,http://edition.cnn.com/2015/01/22/politics/us-officials-say-6000-isis-fighters-killed-in-battles/index.html
2015-01-23,01:49:15,2tb4dh,154,Russian Artists Ask Medvedev to Allow Swearing in Films Again,themoscowtimes.com,http://www.themoscowtimes.com/news/article/prominent-film-directors-ask-medvedev-to-amend-russia-s-anti-swearing-law/514695.html
2015-01-23,23:00:03,2teoxb,132,"CNN: No truce with Ukraine, rebel leader says",cnn.it,http://cnn.it/1yRFBhM
2015-01-23,12:57:04,2tdg2w,81,Salvadoran woman sentenced to 30 years in prison for a miscarriage pardoned after 7 years behind bars,fusion.net,http://fusion.net/story/39945/salvadoran-women-who-had-miscarriage-pardoned-after-7-years-in-jail/
2015-01-23,01:10:09,2tazct,79,Russia's Education Watchdog 'Would Ban Wikipedia',themoscowtimes.com,http://www.themoscowtimes.com/news/article/russia-s-education-watchdog-would-ban-wikipedia/514782.html
2015-01-23,00:42:58,2tavxh,79,"Libyan Islamist fighters seized a branch of the country’s central bank, which holds nearly $100 billion in currency reserves",nytimes.com,http://www.nytimes.com/2015/01/23/world/africa/libyan-fighters-seize-benghazi-branch-of-central-bank.html?ref=world&_r=0&gwh=640A00252B3D00CA9061EEAFE3536644&gwt=pay
2015-01-23,05:08:26,2tbusi,61,"Flooded three decades ago, an underwater ghost town in Argentina is resurfacing due to a receding waterline",weburbanist.com,http://weburbanist.com/2015/01/22/lost-found-underwater-ghost-town-resurfaces-25-years-later/
2015-01-23,03:31:59,2tbhxl,57,"Air strikes killed 6,000 ISIS fighters: U.S. ambassador",english.alarabiya.net,http://english.alarabiya.net/en/News/middle-east/2015/01/22/Air-strikes-killed-6-000-ISIS-fighters-U-S-ambassador.html
