2015-06-17,18:26:24,3a58h7,16327,"Wal-Mart Has $76 Billion in Overseas Tax Havens, Report Says",bloomberg.com,http://www.bloomberg.com/news/articles/2015-06-17/wal-mart-has-76-billion-in-overseas-tax-havens-report-says
2015-06-17,09:24:12,3a3s9y,22531,"Pope blasts global warming deniers - ""The poor and the Earth are shouting"".",smh.com.au,http://www.smh.com.au/environment/climate-change/pope-blasts-global-warming-deniers-20150616-ghp52z.html
2015-06-17,09:31:08,3a3t49,8859,"The fight is on to stop an annual Chinese event which is expected to involve the slaughter of more than 10,000 dogs, some of whom are burned or boiled alive.",smh.com.au,http://www.smh.com.au/environment/animals/yulin-dog-meat-festival-of-cruelty-to-slaughter-10000-dogs-20150616-ghouxx
2015-06-17,13:57:22,3a4ng4,4102,"Stop eating Nutella & save the forests, urges French ecology minister - Ségolène Royal says Nutella is made using palm oil, which is contributing to deforestation, & urges Ferrero to make the spread with ""other ingredients""",theguardian.com,http://www.theguardian.com/environment/2015/jun/17/stop-eating-nutella-and-save-the-forests-urges-french-ecology-minister
2015-06-17,03:41:15,3a2hxd,4050,Palestinian government to resign within 24 hours,ynetnews.com,"http://www.ynetnews.com/articles/0,7340,L-4669357,00.html"
2015-06-17,02:13:43,3a24zp,3311,Shock European court decision: Websites are liable for users’ comments,arstechnica.co.uk,http://arstechnica.co.uk/tech-policy/2015/06/shock-european-court-decision-websites-are-liable-for-users-comments/
2015-06-17,03:45:27,3a2ijo,2011,"Robots to 3D-print world's first continuously-extruded steel bridge across a canal in Amsterdam, heralding the dawn of automatic construction sites and structural metal printing for public infrastructure",weburbanist.com,http://weburbanist.com/2015/06/16/cast-in-place-steel-robots-to-3d-print-metal-bridge-in-holland/
2015-06-17,18:12:30,3a57im,1660,"The world’s largest underground aquifers – a source of fresh water for hundreds of millions of people — are being depleted at alarming rates, according to new NASA satellite data that provides the most detailed picture yet of vital water reserves hidden under the Earth’s surface.",independent.co.uk,http://www.independent.co.uk/environment/nasa-data-shows-the-world-is-running-out-of-water-10325188.html
2015-06-17,13:58:08,3a4nj4,1015,Snowden’s lawyer says he witnessed Snowden destroy his copy of NSA documents before leaving Hong Kong; slams Sunday Times story,theglobeandmail.com,http://www.theglobeandmail.com/news/national/snowdens-lawyer-slams-times-story-claiming-leaks-betrayed-british-spies/article24986059/?cmpid=rss1&click=sf_globe&service=mobile
2015-06-17,04:05:53,3a2lia,857,The Dominican Republic is expelling all Dominicans of Haitian descent who can't prove residency.,abcnews.go.com,http://abcnews.go.com/International/wireStory/haitians-scramble-legal-residency-dominican-republic-31784087
2015-06-17,09:37:14,3a3tuk,734,Child sacrifices continue to rise in Uganda; children are reportedly abducted by witch doctors and others who feel sacrifices will bring them wealth,tinyletter.com,http://tinyletter.com/onethingnews/letters/the-one-thing-you-need-to-know-today-is-16-june-2015
2015-06-17,04:53:52,3a2sfe,691,"Hezbollah killed the Leader of the Islamic State for Al Qalamoun, Syria.",dailystar.com.lb,http://dailystar.com.lb/News/Lebanon-News/2015/Jun-16/302310-hezbollah-captures-new-qalamoun-territory.ashx
2015-06-17,06:40:04,3a37lz,494,The Taliban Tells the Islamic State to Get the Hell Out of Afghanistan,news.vice.com,https://news.vice.com/article/the-taliban-tells-the-islamic-state-to-get-the-hell-out-of-afghanistan
2015-06-17,07:15:12,3a3c9e,460,Gay men arrested in Morocco because they 'stood too close to each other',mirror.co.uk,http://www.mirror.co.uk/news/world-news/gay-men-arrested-morocco-because-5892887
2015-06-17,03:27:10,3a2fv8,443,Scientist just created the coldest substance on Earth,businessinsider.com,http://www.businessinsider.com/scientists-create-the-coldest-material-on-earth-2015-6
2015-06-17,18:53:55,3a5af7,407,"Diseased fish confirm damage to Great Barrier Reef ecosystem, say scientists - New research into reef confirms sediment from coastal agriculture & industry development, such as the dredging for ports, is having an adverse effect on fish",theguardian.com,http://www.theguardian.com/environment/2015/jun/17/diseased-fish-confirm-damage-to-great-barrier-reef-ecosystem-say-scientists
2015-06-17,13:00:32,3a4hal,396,New NASA data show how the world is running out of water,washingtonpost.com,http://www.washingtonpost.com/blogs/wonkblog/wp/2015/06/16/new-nasa-studies-show-how-the-world-is-running-out-of-water/
2015-06-17,03:12:45,3a2dpi,306,"Israel makes historic Temple Mount concessions for Ramadan..easing security checks, hundreds of Gaza visitors",israelnationalnews.com,http://www.israelnationalnews.com/News/News.aspx/196833#.VYBm2VWqqko
2015-06-17,01:27:49,3a1ycp,275,"4300 Sikh,Hindu Refugees from Afghanistan & Pakistan Get Indian Citizenship",regionalpost.com,http://regionalpost.com/indian-citizenship/
2015-06-17,02:18:15,3a25p9,213,'Open Your Eyes': Israel Releases Cartoon Mocking Foreign Correspondents,news.vice.com,https://news.vice.com/article/open-your-eyes-israel-releases-cartoon-mocking-foreign-correspondents?utm_source=vicenewstwitter
2015-06-17,18:20:25,3a581n,182,"Half of the world’s new power capacity came from renewables last year, with China leading the way: Last year, the global economy grew by 3% but emissions stayed flat. This was “the first time in at least 40 years that such an outcome has occurred outside economic crisis,” the IEA said",qz.com,http://qz.com/429166/half-of-new-power-generation-came-from-renewables-last-year-with-china-leading-the-way/
2015-06-17,18:49:24,3a5a3t,113,Swiss investigating 53 cases of possible money laundering at Fifa,theguardian.com,http://www.theguardian.com/football/2015/jun/17/fifa-investigation-53-cases-money-laundering-swiss-attorney-general
2015-06-17,18:02:10,3a56tm,95,"Prosecute sexual offenders, says UN panel | Nations whose peacekeeping troops commit sexual abuse should be named and shamed, according to a UN panel. Its report also recommends that flouter nations be barred from contributing troops to UN missions.",dw.de,http://www.dw.de/prosecute-sexual-offenders-says-un-panel/a-18521740
2015-06-17,15:20:06,3a4v3m,88,"Intoxicated Aboriginal Woman taken by Arresting Officer from jail to his home to ""pursue a relationship.""",cbc.ca,http://www.cbc.ca/news/canada/manitoba/mountie-takes-woman-home-from-jail-to-pursue-a-personal-relationship-1.2893487
2015-06-17,10:46:37,3a424m,89,"Federal prosecutors in Brazil have called for the authorities to stop the eviction of at least 2,000 families living in an area of the Amazon jungle where a huge dam is being built.",bbc.co.uk,http://www.bbc.co.uk/news/world-latin-america-33159384?ocid=socialflow_twitter
2015-06-17,05:54:24,3a314u,86,Adult diseases now striking children because of poor diet,m.thestar.com,http://m.thestar.com/#/article/life/health_wellness/2015/06/15/adult-diseases-now-striking-children-because-of-poor-diet-obesity.html
2015-06-17,10:31:42,3a40bl,72,The bloody origins of the Dominican Republic’s ethnic ‘cleansing’ of Haitians - The Washington Post,washingtonpost.com,http://www.washingtonpost.com/blogs/worldviews/wp/2015/06/16/the-bloody-origins-of-the-dominican-republics-ethnic-cleansing-of-haitians/
2015-06-17,19:53:36,3a5epv,76,Brussels to announce measures against corporations' ‘sweetheart’ tax deals. Politically incendiary proposals will set sights on multinationals’ tax planning with EU states – and 30 worst offending havens could be officially blacklisted,theguardian.com,http://www.theguardian.com/business/2015/jun/16/brussels-corporations-tax-deals-eu
2015-06-17,22:34:35,3a5thb,68,"Germany accuses Putin of Cold War reflexes after Moscow beefs up nuclear arsenal ""the old reflexes from this time are evidently more alive than what we thought up until last year. I can only warn against giving in to such reflexes and entering into a rapid spiral of escalation of words & then acts""",reuters.com,http://www.reuters.com/article/2015/06/17/uk-russia-nuclear-putin-germany-idUKKBN0OX1IN20150617
2015-06-17,10:45:56,3a4213,63,Canada’s top general blames male ‘biological wiring’ for sexual misconduct in the military,news.nationalpost.com,http://news.nationalpost.com/news/canada/gen-tom-lawson-biologically-wired-799584?what
