2016-09-22,08:21:43,53w2gd,38412,"In hurry-up mode while Obama is president, 60 nations have agreed to global climate accord",latimes.com,http://www.latimes.com/world/la-na-sej-climate-accord-20160921-snap-story.html
2016-09-22,19:29:44,53yb6d,28248,The United Arab Emirates is going to start taking in Syrian refugees,whatson.ae,http://whatson.ae/dubai/2016/09/uae-syrian-refugees/
2016-09-22,05:56:45,53vdx5,10955,South Korea confirms it has military plan to remove Kim Jong Un,upi.com,http://www.upi.com/Top_News/World-News/2016/09/21/South-Korea-confirms-it-has-military-plan-to-remove-Kim-Jong-Un/2801474464384/
2016-09-22,02:06:25,53u7bm,8629,Obama Warns of “Mass Migrations” If Climate Change Is Not Confronted,scientificamerican.com,http://www.scientificamerican.com/article/obama-warns-of-mass-migrations-if-climate-change-is-not-confronted/
2016-09-22,21:15:07,53yn30,7349,New mayor kills off Rome's bid for 2024 Olympics,reuters.com,http://www.reuters.com/article/us-italy-olympics-rome-decision-idUSKCN11R1WB
2016-09-22,00:54:50,53tu03,6065,Women entitled to end pregnancy regardless of reason: Indian Bombay High Court,economictimes.indiatimes.com,http://economictimes.indiatimes.com/news/politics-and-nation/women-entitled-to-end-pregnancy-regardless-of-reason-high-court/articleshow/54433759.cms
2016-09-22,23:44:47,53za6p,5642,Russia Cancels Election Results After Ballot Stuffing,newsweek.com,http://www.newsweek.com/russia-cancels-election-results-after-ballot-stuffing-501533
2016-09-22,21:39:16,53yqgf,4430,‘It’s a depressing sight’: climate change unleashes ghostly death on Great Barrier Reef | the fact this reef was used in so many films and magazines means it’s a perfect location to see the effects of the recent bleaching event.,theguardian.com,https://www.theguardian.com/environment/2016/sep/22/its-a-depressing-sight-climate-change-unleashes-ghostly-death-on-great-barrier-reef
2016-09-22,02:06:48,53u7e0,2978,A Canadian businessman has been charged with fraudulently misdirecting $694K in government cash meant to buy breakfasts for children at an impoverished northern Ontario First Nation reserve for his personal use.,news.nationalpost.com,http://news.nationalpost.com/news/canada/man-charged-with-keeping-694k-targeted-for-child-breakfast-fund-at-impoverished-first-nation-reserve
2016-09-22,04:00:59,53uswi,2730,"Technology giant Hewlett-Packard is copping an international backlash after thousands of owners of its printers were suddenly blocked from using cheaper, third-party ink cartridges.",smh.com.au,http://www.smh.com.au/business/consumer-affairs/hp-outrages-printer-owners-after-it-blocks-the-use-of-cheap-ink-cartridges-by-stealth-20160921-grl6ea.html
2016-09-22,09:21:31,53wbth,1897,"Women in Iran have been posting photos on social media of themselves riding bicycles, defying a fatwa forbidding them from cycling in public.",bbc.com,http://www.bbc.com/news/world-middle-east-37430493
2016-09-22,01:22:10,53tz41,1723,Teenage Christian boy arrested for sharing 'blasphemous' Facebook post in Pakistan: Pakistani law can see alleged blasphemy punished by death or life imprisonment,independent.co.uk,http://www.independent.co.uk/news/world/asia/teenage-boy-christian-arrested-sharing-blasphemous-facebook-post-in-pakistan-nabeel-chohan-kaaba-a7321156.html
2016-09-22,22:59:23,53z2fh,1187,"Climate change could cross key threshold in a decade, prompting accelerating loss of glaciers, steep declines in water availability, worsening land conflicts and deepening poverty, scientists said this week.",reuters.com,http://www.reuters.com/article/us-climatechange-impacts-conference-idUSKCN11S1FE
2016-09-22,21:36:10,53ypza,1046,Brainwashed ISIS child soldiers reveal horrifying desire for 'martyrdom' and to terrorise Europe when they grow up,mirror.co.uk,http://www.mirror.co.uk/news/world-news/brainwashed-isis-child-soldiers-want-8858773
2016-09-22,22:52:57,53z1gc,1011,Numbers Don’t Lie: Statistics Point To Massive Fraud In Russia’s Duma Vote,rferl.org,http://www.rferl.org/content/statistics-point-to-massive-fraud-russia-state-duma-elections/28002750.html
2016-09-22,11:45:15,53wxxc,690,"""The charred lump of a 2,000-year-old scroll sat in an Israeli archaeologist's storeroom for decades, too brittle to open. Now, new imaging technology has revealed what was written inside: the earliest evidence of a biblical text in its standardized form.""",bigstory.ap.org,http://bigstory.ap.org/article/60785bb2031a478cb71ce9278782c320/scanning-software-deciphers-ancient-biblical-scroll
2016-09-22,15:39:04,53xqgw,645,"Priest jailed for child sex abuse maintains boys were 'out to get him': John Farrell, a defrocked priest from Moree, New South Wales, was imprisoned in May for a minimum of 18 years after committing 62 child sex offences in the 1980s.",independent.co.uk,http://www.independent.co.uk/news/world/australasia/priest-child-sex-abuse-john-farrell-boys-out-to-get-him-new-south-wales-catholic-church-australia-a7320471.html
2016-09-22,00:59:22,53tut2,627,Theresa May committed to introducing 'Alan Turing law' and pardon gay men convicted of 'gross indecency',independent.co.uk,http://www.independent.co.uk/news/uk/politics/theresa-may-committed-to-introducing-alan-turing-law-and-pardon-gay-men-convicted-of-outdated-crimes-a7320851.html
2016-09-22,06:56:54,53voep,464,US probes 'chemical attack' in Iraq,bbc.co.uk,http://www.bbc.co.uk/news/world-middle-east-37436152
2016-09-22,22:51:23,53z189,373,The U.S. Congress unanimously approved the supply of lethal weapons Ukraine,the-newspapers.com,http://the-newspapers.com/2016/09/22/the-u-s-congress-unanimously-approved-the-supply-of-lethal-weapons-ukraine
2016-09-22,18:56:31,53y83d,362,Chinese Lawyer who defended Ai Weiwei jailed for 12 years,bbc.com,http://www.bbc.com/news/world-asia-china-37437812
2016-09-22,04:24:14,53ux42,344,Hunt is on for person(s) who shot last Vietnamese rhino.,bbc.com,http://www.bbc.com/earth/story/20160920-we-know-exactly-how-the-vietnamese-javan-rhino-went-extinct
2016-09-22,05:39:31,53vau5,346,First on CNN: ISIS suspected of mustard attack against US and Iraqi troops,cnn.com,http://www.cnn.com/2016/09/21/politics/mustard-gas-us-troops/
2016-09-22,22:30:06,53yxui,327,"No, North Korea's internet doesn't only have 28 websites, but Reddit did manage to crash them | Users of the social bookmarking website got hold of 28 URLs due to a domain name system configuration error.",ibtimes.co.uk,http://www.ibtimes.co.uk/no-north-koreas-internet-doesnt-only-have-28-websites-reddit-did-manage-crash-them-1582750
2016-09-22,07:36:23,53vv2n,315,"Indigenous Australians most ancient civilisation on Earth, DNA study confirms.",theguardian.com,https://www.theguardian.com/australia-news/2016/sep/21/indigenous-australians-most-ancient-civilisation-on-earth-dna-study-confirms?CMP=share_btn_tw
2016-09-22,17:47:42,53y20w,259,India calls Pakistan a terrorist state in furious response at UN,timesofindia.indiatimes.com,http://timesofindia.indiatimes.com/india/India-calls-Pakistan-a-terrorist-state-in-furious-response-at-UN/articleshow/54460414.cms
2016-09-22,19:24:57,53yapb,233,US considers directly arming Syrian Kurds to take Raqqa from ISIS,aranews.net,http://aranews.net/2016/09/us-considers-directly-arming-syrian-kurds-take-raqqa-isis/
2016-09-22,10:23:34,53wlld,196,"Wal-Mart Stores must face a class-action lawsuit accusing the world's largest retailer of defrauding shareholders by concealing suspected bribery to help it expand faster in Mexico, a U.S. judge said",reuters.com,http://www.reuters.com/article/us-walmart-decision-idUSKCN11R2Z9?il=0
2016-09-22,01:01:16,53tv5f,152,Chinese agents enter Canada on tourist visas to coerce return of fugitive expats,theglobeandmail.com,http://www.theglobeandmail.com/news/politics/chinese-agents-enter-canada-on-tourist-visas-to-coerce-return-of-fugitive-expats/article31981251/
2016-09-22,00:16:26,53tn0r,121,Women should be allowed to end pregnancy even when there is no risk: Bombay High Court,hindustantimes.com,http://hindustantimes.com/mumbai-news/let-women-abort-foetus-irrespective-of-reason-bombay-hc/story-2tIic6kvwPvl7J7q8WfcDI.html
