2016-05-12,13:36:21,4iz19s,29707,"India has slashed prices of 54 essential medicines by up to 55%, including commonly used drugs for cancer, hypertension, diabetes and other heart disorders.",timesofindia.indiatimes.com,http://timesofindia.indiatimes.com/india/Drugs-for-BP-cancer-among-54-to-see-up-to-55-price-cut/articleshow/52230043.cms?mobile=no
2016-05-12,00:07:56,4ivch6,30082,"Rio Olympics could spark 'full blown global health disaster', say Harvard scientists",independent.co.uk,http://www.independent.co.uk/life-style/health-and-families/health-news/rio-olympics-2016-zika-virus-global-health-disaster-a7024146.html
2016-05-12,18:42:41,4izwq2,17337,Brazil's President Dilma Rousseff is to face trial after the Senate voted to impeach and suspend her.,bbc.com,http://www.bbc.com/news/world-latin-america-36273916
2016-05-12,20:25:00,4j07dz,4702,"Saudi officials were 'supporting' 9/11 hijackers, commission member says",theguardian.com,http://www.theguardian.com/us-news/2016/may/12/911-commission-saudi-arabia-hijackers
2016-05-12,04:57:43,4iwspg,3021,"60% of Brazilian Senators Participating in Today’s Impeachment Vote Have Pending Legal Cases Against Them, Watchdog Says.",telesurtv.net,http://www.telesurtv.net/english/news/Brazil-60-of-Senators-Have-Pending-Legal-Cases-Against-Them-20160511-0015.html
2016-05-12,02:51:40,4iw5ze,2628,"Italy says 'yes' to gay civil unions in historic vote, after a long and bitter debate that has pitted the Catholic Church against PM Renzi. Italy is the last major western European country to recognize civil unions for same sex couples.",thelocal.it,http://www.thelocal.it/20160511/breaking-italy-says-yes-to-gay-civil-unions-gay-rights-marriage
2016-05-12,22:59:55,4j0sv9,2399,MP recites explicit Erdogan bestiality poem on live TV,thelocal.de,http://www.thelocal.de/20160512/mp-gaffes-reciting-explicit-erdogan-poem-on-live-tv
2016-05-12,01:06:15,4ivmu9,1648,"Venezuela Unleashes Tanks as 4 Killed, 1,200 Arrested",laht.com,http://www.laht.com/article.asp?ArticleId=2411895&CategoryId=10717&utm_source=feedburner&utm_medium=twitter&utm_campaign=Feed%3A+laht%2Fmailer+%28Latin+American+Herald+Tribune%29
2016-05-12,23:56:13,4j1251,1313,Almost 400 companies listed on the London Stock Exchange with a collective market capitalisation of £225bn are based in offshore havens connected to the UK. Research shows that 389 companies trading their shares in London are registered in British overseas territories or crown protectorates.,theguardian.com,https://www.theguardian.com/business/2016/may/12/london-stock-exchange-listed-companies-tax-havens-uk
2016-05-12,06:08:45,4ix5p0,1242,"A federal judge has sharply rebuked the Pentagon for the process by which it concealed hundreds of Bush-era photos showing US military personnel torturing detainees in Iraq and Afghanistan, suggesting Barack Obama may have to release even more graphic imagery of abuse",theguardian.com,http://www.theguardian.com/us-news/2016/may/11/pentagon-military-torture-photos-george-w-bush-war-on-terror
2016-05-12,20:28:47,4j07tp,953,Catholic Diocese in India Reinstates Priest Who Admitted Child Sex Abuse,blogs.wsj.com,http://blogs.wsj.com/indiarealtime/2016/04/22/catholic-diocese-in-india-reinstates-priest-who-admitted-child-sex-abuse/
2016-05-12,20:38:41,4j08yp,850,"US missile defense site goes live in Romania, angering Russia as NATO bolsters defenses",cbsnews.com,http://www.cbsnews.com/news/us-missile-defense-romania-russia-nato-defenses/
2016-05-12,14:18:56,4iz698,770,Plane Debris Confirmed As Being From MH370,news.sky.com,http://news.sky.com/story/1694590/plane-debris-confirmed-as-being-from-mh370
2016-05-12,09:20:50,4iy0y5,742,US government suspends aid programs in Turkey,hurriyetdailynews.com,http://www.hurriyetdailynews.com/Default.aspx?pageID=238&nID=98977&NewsCatID=352
2016-05-12,15:39:34,4izez9,525,"'Lord of the Rings' Volcano Has Become Active, Warns NZ",time.com,http://time.com/4325907/new-zealand-volcano-mordor/?xid=time_socialflow_facebook
2016-05-12,00:11:27,4ivd1n,492,Tokyo Olympics: €1.3m payment to secret account raises questions over 2020 Games,theguardian.com,https://www.theguardian.com/sport/2016/may/11/tokyo-olympics-payment-diack-2020-games
2016-05-12,05:09:20,4iwutl,446,Islamic State yearly oil revenue halved to $250 million: U.S. official,reuters.com,http://www.reuters.com/article/us-mideast-crisis-islamic-state-revenue-idUSKCN0Y22CW
2016-05-12,23:36:40,4j0yuc,388,"U.S. activates Romanian missile defense site, angering Russia",reuters.com,http://www.reuters.com/article/us-nato-shield-idUSKCN0Y30JX?feedType=RSS&feedName=topNews&utm_source=feedburner&utm_medium=feed&utm_campaign=Feed%3A+reuters%2FtopNews+%28News+%2F+US+%2F+Top+News%29
2016-05-12,21:02:30,4j0by6,332,"Brazil prepares to roll back green laws - Amidst the turmoil of the presidential impeachment process, members of Brazil’s Congress are set to dismantle environmental protection laws.",climatenewsnetwork.net,http://climatenewsnetwork.net/18257-2/?utm_source=Climate+News+Network&utm_campaign=cf92aa3172-Brazil_impeachment5_12_2016&utm_medium=email&utm_term=0_1198ea8936-cf92aa3172-38687953&ct=t(Brazil_impeachment5_12_2016)&mc_cid=cf92aa3172&mc_eid=3f6f7682e0
2016-05-12,07:00:19,4ixeiu,277,"Suspects in the disappearance of 43 Mexican college students have claimed that they were tortured into making confessions, according to court documents obtained by the the U.S. international news agency Associated Press.",telesurtv.net,http://www.telesurtv.net/english/news/Suspects-in-Ayotzinapa-Case-Say-they-Were-Tortured--20160511-0033.html
2016-05-12,10:13:03,4iy8ux,261,"U.S. cities on Mexican border prep for 3,000 Cubans",usatoday.com,http://www.usatoday.com/story/news/nation-now/2016/05/11/cuban-immigration-thru-mexico/84242148/
2016-05-12,04:15:26,4iwkv3,246,Middle East U.N. slams Turkey for ‘alarming’ reports of human rights abuses,washingtonpost.com,https://www.washingtonpost.com/world/middle_east/turkey-under-fire-from-un-for-alarming-reports-of-rights-abuses/2016/05/10/0f9eccb7-45cd-4685-9483-181fdfd2cadf_story.html?tid=ss_tw
2016-05-12,09:20:34,4iy0wr,227,London’s Muslim mayor reaffirms plan for Israel trip,jta.org,http://www.jta.org/2016/05/09/news-opinion/world/londons-muslim-mayor-reaffirms-plan-for-israel-trip
2016-05-12,00:16:36,4ivdxx,190,Brutal ‘justice’ of the mob in Venezuela: Venezuelan Mugger is beaten to the floor and burned alive by lynch mob after stealing from people,dailymail.co.uk,http://www.dailymail.co.uk/news/article-3525921/Brutal-justice-mob-Mugger-beaten-floor-burned-alive-lynch-mob-stealing-people-street-Caracas.html
2016-05-12,18:41:14,4izwkg,185,US to activate missile shield base in Romania,bbc.com,http://www.bbc.com/news/world-europe-36272686
2016-05-12,10:50:30,4iyejb,174,Mexico judge clears 'El Chapo' Guzman extradition to US,bbc.com,http://www.bbc.com/news/world-latin-america-36252710
2016-05-12,08:42:31,4ixv1i,177,Space dust rewrites Earth history,news.com.au,http://www.news.com.au/technology/science/evolution/fossilised-space-dust-offers-startling-insight-into-our-ancient-atmosphere/news-story/9f9922933618eb7d66dc0ee562f6a3bc
2016-05-12,05:44:20,4ix1c2,161,80 killed in Baghdad bombings,yahoo.com,https://www.yahoo.com/news/car-bomb-baghdads-sadr-city-kills-16-sources-074656209.html
2016-05-12,19:55:48,4j0466,85,"Chinese response to royal rudeness row: British media are narcissistic, mannerless barbarians",washingtonpost.com,https://www.washingtonpost.com/news/worldviews/wp/2016/05/12/chinese-response-to-royal-rudeness-row-british-media-are-narcissistic-mannerless-barbarians/?postshare=2571463048496354&tid=ss_tw
2016-05-12,23:21:20,4j0wcl,86,Israeli PM: I am willing to meet Abbas right now,timesofisrael.com,http://www.timesofisrael.com/liveblog_entry/pm-i-am-willing-to-meet-abbas-right-now/
