2016-01-31,04:57:38,43fx2v,11253,"British helicopter pilot, Roger Gower, working for conservation organization in Tanzania dies after poachers open fire on his helicopter, ""fatally wounding"" him.",bbc.com,http://www.bbc.com/news/uk-35450490
2016-01-31,20:39:08,43ix32,10863,Boko Haram burns kids alive in northeast Nigeria: A survivor hidden in a tree says he watched Boko Haram extremists firebomb huts and heard the screams of children among people burned to death in the latest attack by Nigeria’s homegrown Islamic extremists.,washingtonpost.com,https://www.washingtonpost.com/world/africa/boko-haram-burns-kids-alive-in-northeast-nigeria-witness/2016/01/31/f8a4638c-c80e-11e5-b9ab-26591104bb19_story.html
2016-01-31,17:36:30,43iip9,26304,"Switzerland will be the first country in the world to vote on having a national wage of £1,700 a month: If the plans go through, it will become the first country in the world to provide a basic unconditional monthly income, and they are already the first country to vote on the matter.",independent.co.uk,http://www.independent.co.uk/news/world/europe/switzerland-will-be-the-first-country-in-the-world-to-vote-on-having-a-national-wage-of-1700-a-month-a6843666.html
2016-01-31,19:50:40,43iszt,3337,"Group of Brazilian lawyers, activists & scientists asking govt to allow abortions for women with Zika virus, since women are advised not to get pregnant due to risk of birth defects. Abortions are illegal in Brazil, except in emergencies, rape or when big part of brain & skull missing.",bbc.com,http://www.bbc.com/news/world-latin-america-35438404
2016-01-31,09:56:54,43h5ab,3155,China Just Released True Color HD Photos Of The Moon,techcrunch.com,http://techcrunch.com/2016/01/30/china-just-released-true-color-hd-photos-of-the-moon/
2016-01-31,07:44:20,43glj5,2288,"Zika virus has infected 2,100 pregnant Colombians, health officials say - Health",cbc.ca,http://www.cbc.ca/news/health/zika-colombia-numbers-1.3427235
2016-01-31,02:14:23,43f6co,1183,Pirate Party Support Exceeds 40 Percent (Iceland),icelandreview.com,http://icelandreview.com/news/2016/01/28/pirate-party-support-exceeds-40-percent
2016-01-31,23:47:05,43jidi,908,"Russian Fighter Jet Came Within 15 Feet of US Air Force Plane, US Officials Say",abcnews.go.com,http://abcnews.go.com/International/russian-fighter-jet-15-feet-us-air-force/story?id=36601212
2016-01-31,00:21:31,43eon4,871,Turkey says Russia violated airspace,bbc.com,http://www.bbc.com/news/world-europe-35449152
2016-01-31,09:50:28,43h4di,821,Canada to Remove Visa Requirements for Mexican Citizens,latinone.com,http://www.latinone.com/articles/31710/20160130/canada-to-remove-visa-requirements-for-mexican-citizens.htm
2016-01-31,07:28:12,43giz3,814,"UN chief 'alarmed' at Hamas vow to keep building Gaza tunnels, rockets",timesofisrael.com,http://www.timesofisrael.com/un-chief-alarmed-at-hamas-vow-to-keep-building-gaza-tunnels-rockets/
2016-01-31,21:18:56,43j0qs,681,Hamas has officially announced that it is rejecting France’s new initiative to convene an international conference to renew negotiations between Israel and the Palestinians,israelnationalnews.com,http://www.israelnationalnews.com/News/News.aspx/207271
2016-01-31,10:33:09,43haeg,586,"Babylonians used geometry to track Jupiter 1400 years before Europeans: ""Astronomers discovered how to calculate Jupiter's position with geometry between 350 and 50 BC, predating work of European scholars by 14 centuries""",theguardian.com,https://www.theguardian.com/science/2016/jan/28/babylonians-used-geometry-to-track-jupiter-1400-years-before-europeans
2016-01-31,08:27:29,43gs1c,542,"World Heritage-listed forests whose origins pre-date the age of the dinosaurs are being destroyed by raging Australian bushfires, with conservationists increasingly fearful they could be lost forever.",naharnet.com,http://www.naharnet.com/stories/en/200810-australia-bushfires-raze-ancient-world-heritage-listed-forests
2016-01-31,21:24:46,43j1b6,501,​Europe Is Building a ‘Space Data Highway’ With Lasers - It'll transmit data back to Earth about 90 times faster than your typical earthly internet connection.,motherboard.vice.com,http://motherboard.vice.com/read/europe-is-building-a-space-data-highway-with-lasers-esa-edrs-satellite
2016-01-31,04:25:20,43fro0,475,"10,000 refugee children are missing, says Europol",theguardian.com,http://www.theguardian.com/world/2016/jan/30/fears-for-missing-child-refugees?CMP=twt_gu
2016-01-31,02:37:55,43fabl,413,NATO confirms Russian jet violated Turkish airspace,about.hr,https://about.hr/news/europe/nato-confirms-russian-jet-violated-turkish-airspace-8431
2016-01-31,01:08:52,43evvs,408,"Despite abuses, Saudi Arabia aims to recruit 15000 Somali maids",hiiraan.com,http://www.hiiraan.com/news4/2016/Jan/103860/despite_abuses_saudi_arabia_aims_to_recruit_15000_somali_maids.aspx
2016-01-31,00:00:33,43elnx,399,Bribery allegations against Japan's lead TPP negotiator have sparked public concerns that corruption may have influenced the corporate-friendly deal.,telesurtv.net,http://www.telesurtv.net/english/news/TPP-Protesters-Alarmed-by-Corruption-Urge-Leaders-Not-to-Sign-20160129-0029.html
2016-01-31,04:06:53,43fopi,322,"Marshall Islands sue Britain, India and Pakistan over nuclear weapons",theguardian.com,http://www.theguardian.com/world/2016/jan/30/marshall-islands-sue-britain-india-and-pakistan-over-nuclear-weapons
2016-01-31,08:42:09,43gu7c,308,British Mao cult leader who sexually abused followers and kept daughter as a slave is jailed,nydailynews.com,http://www.nydailynews.com/news/world/british-maoist-cult-leader-jailed-abusing-followers-article-1.2514635
2016-01-31,16:26:10,43id49,288,Snow has been falling in Saudi Arabia for the last 2 days. Snowed first time in Kuwait.,emirates247.com,http://www.emirates247.com/news/emirates/uae-weather-it-hit-0º-celcius-cold-mist-fog-and-rough-seas-ahead-2016-01-31-1.618855
2016-01-31,10:30:56,43ha3p,248,Thousands march in Paris rain to protest state of emergency,bigstory.ap.org,http://bigstory.ap.org/article/c23ac901cf6f48f5bd243621c132798c/thousands-march-paris-rain-protest-state-emergency
2016-01-31,23:04:15,43jcsy,228,Israeli Cabinet approves liberal Jewish prayer at holy site,washingtonpost.com,https://www.washingtonpost.com/world/middle_east/israeli-pm-pushing-for-liberal-jewish-prayer-at-holy-site/2016/01/31/fa93d8d8-c801-11e5-b9ab-26591104bb19_story.html
2016-01-31,19:43:25,43isdp,230,"At least 30 people killed in double blast near Shia shrine of Sayyida Zeinab, south of Damascus",bbc.co.uk,http://www.bbc.co.uk/news/world-middle-east-35454359?ns_mchannel=social&ns_campaign=bbc_breaking&ns_source=twitter&ns_linkname=news_central
2016-01-31,18:51:56,43ioc4,195,Canada ex-mafia boss Rocco Zito shot dead in Toronto,bbc.com,http://www.bbc.com/news/world-us-canada-35453625
2016-01-31,04:35:54,43ftgm,169,Thousands rally against legalizing same-sex civil unions in Italy,latimes.com,http://www.latimes.com/world/europe/la-fg-italy-same-sex-unions-20160130-story.html
2016-01-31,01:20:55,43exri,166,UN Secretary-General reacts in horror to sex abuse claims by peacekeepers,csmonitor.com,http://www.csmonitor.com/World/2016/0130/UN-Secretary-General-reacts-in-horror-to-sex-abuse-claims-by-peacekeepers
2016-01-31,20:46:32,43ixpf,91,Senior Hamas official blames Iranian 'liars' for deserting Hamas,jpost.com,http://www.jpost.com/Middle-East/Report-Senior-Hamas-official-blames-Iranian-liars-for-deserting-Hamas-443356
2016-01-31,03:12:09,43ffr6,92,"English police looking for help identifying American or Canadian man found in England, confused possibly with dementia",westmercia.police.uk,https://www.westmercia.police.uk/article/15974/Re-appeal-to-help-find-identity-of-vulnerable-man
