2016-11-13,19:23:00,5cpjyw,34755,"Powerful 7.4 earthquake strikes near Christchurch, New Zealand - BBC News",bbc.co.uk,http://www.bbc.co.uk/news/world-asia-37967178
2016-11-13,09:43:56,5cnq50,33854,"Donald Trump presidency a 'disaster for the planet', warn climate scientists: 'At the heart of his energy and climate thinking is an “America first” policy where “draconian climate rules” are repealed and the US escalates its production of coal, oil and natural gas.'",theguardian.com,https://www.theguardian.com/environment/2016/nov/11/trump-presidency-a-disaster-for-the-planet-climate-change
2016-11-13,10:03:07,5cnsz1,3818,Britain Says It Will Ditch Coal Power By 2025,fastcoexist.com,https://www.fastcoexist.com/3065539/britain-says-it-will-ditch-coal-power-by-2025
2016-11-13,21:20:12,5cpwda,3842,Berlin likely to semi-legalize marijuana,dw.com,http://www.dw.com/en/berlin-likely-to-semi-legalize-marijuana/a-36370376
2016-11-13,16:36:28,5cp50t,1786,Leaked memo reveals UK planning to exploit Donald Trump's inexperience.,independent.co.uk,http://www.independent.co.uk/news/uk/politics/donald-trump-memo-president-britain-planning-to-exploit-is-inexperience-a7414526.html
2016-11-13,17:27:08,5cp9hh,1762,Donald Trump warned by Nato chief that 'going it alone is not an option',theguardian.com,https://www.theguardian.com/us-news/2016/nov/12/going-alone-not-option-nato-chief-jens-stoltenberg-donald-trump
2016-11-13,04:43:54,5cmcpf,1160,Turkey issues warning over travel to U.S. after Trump protests,reuters.com,http://www.reuters.com/article/us-election-turkey-idUSKBN1370MC?il=0
2016-11-13,23:39:04,5cqfin,852,"More than 300,000 people face eviction and could be left homeless as prime waterfront land in Nigeria's biggest city, Lagos, is cleared of shanty towns to make way for luxury redevelopment.",news.trust.org,http://news.trust.org/item/20161111173732-jwg4n/
2016-11-13,22:47:15,5cq7lm,731,South Korean Coast Guard Fires Machine Gun at Violent Chinese Fishing Boats,world.kbs.co.kr,http://world.kbs.co.kr/english/news/news_Dm_detail.htm?No=123200
2016-11-13,15:45:24,5cp0b6,683,"""Russia's biggest oil company, Rosneft, has reported a 77% fall in third-quarter profits as a result of lower oil prices.""",bbc.co.uk,http://www.bbc.co.uk/news/business-37947921
2016-11-13,18:28:43,5cpeyu,513,Tayto firm admits 'gluten-free' crisps had high levels of gluten,independent.ie,http://www.independent.ie/irish-news/courts/tayto-firm-admits-glutenfree-crisps-had-high-levels-of-gluten-35209417.html
2016-11-13,14:43:35,5cotx4,482,Indian Government makes Airbags mandatory for all new cars from October 2017,autoportal.com,https://autoportal.com/news/government-makes-airbags-mandatory-for-all-new-cars-from-october-2017-9429.html
2016-11-13,00:15:29,5cl20b,474,Swedish Nazi group hails Trump in largest demo yet,thelocal.se,http://www.thelocal.se/20161112/swedish-nazis-hail-trump-in-largest-ever-demonstration
2016-11-13,22:49:40,5cq7yo,437,"Satellite images show Myanmar Rohingya villages torched - Northern Rakhine, which is home to the Rohingya minority and borders Bangladesh, has been under military lockdown ever since surprise raids on border posts left nine police dead last month.",france24.com,http://www.france24.com/en/20161113-satellite-images-show-myanmar-rohingya-villages-torched
2016-11-13,18:53:28,5cph6p,343,Jeremy Corbyn calls for borders between Russia and European nations to be 'de-militarised',independent.co.uk,http://www.independent.co.uk/news/uk/politics/jeremy-corbyn-nato-demilitarised-russia-europe-putin-a7414651.html
2016-11-13,00:09:48,5cl12a,325,"After currency demonetization in India, Doctor’s refusal to take payment in old Rs.500 notes results in infant’s death",abplive.in,http://www.abplive.in/india-news/mumbai-doctors-refusal-to-take-payment-in-old-rs-500-notes-results-in-infants-death-444938
2016-11-13,09:32:42,5cnogo,280,"Disgraced former Italian Prime Minister Silvio Berlusconi has said comparisons between himself and US President-elect Donald Trump are ""obvious"".",bbc.com,http://www.bbc.com/news/world-europe-37962988
2016-11-13,21:10:05,5cpv8w,280,Tsunami hits New Zealand after series of strong quakes,geo.tv,https://www.geo.tv/latest/120490-Magnitude-74-earthquake-strikes-near-Christchurch-New-Zealand-USGS
2016-11-13,06:21:20,5cmti4,261,Iraq army crushes child under a tank amidst war crimes allegations,middleeastmonitor.com,https://www.middleeastmonitor.com/20161112-iraq-army-crushes-child-under-a-tank-amidst-war-crimes-allegations/
2016-11-13,20:13:26,5cpp77,255,Austria charges Syrian rebel with 20 murders,thelocal.at,http://www.thelocal.at/20161110/austria-charges-syrian-rebel-with-20-murders
2016-11-13,06:53:50,5cmyud,228,Theresa May could try to overturn Brexit court ruling by claiming Article 50 won't affect UK citizens' rights,independent.co.uk,http://www.independent.co.uk/news/uk/politics/theresa-may-brexit-article-50-court-ruling-overturn-citizens-rights-british-uk-latest-a7412606.html
2016-11-13,18:55:38,5cphcw,219,"""A global conference on tobacco control has pledged to hold the tobacco industry legally liable for health consequences of smoking and protect public health policies from the influence of tobacco companies.""",bigstory.ap.org,http://bigstory.ap.org/article/4e88c6ed19244359850d23333d39f030/global-govts-make-tobacco-firms-liable-smoking-harm
2016-11-13,08:44:55,5cnh41,176,"Clashes break out as thousands rally against Turkey’s Erdogan in Cologne | Between 20,000 and 30,000 people from Kurdish and Alawite communities gathered in the German city of Cologne to protest presidential policies, as well as the Turkish government’s crackdown on opposition and journalists",rt.com,https://www.rt.com/news/366696-germany-erdogan-protest-cologne/
2016-11-13,11:05:48,5co25a,159,Reputed ringleader in $18.7M maple syrup heist found guilty,cbc.ca,http://www.cbc.ca/beta/news/canada/montreal/maple-syrup-heist-quebec-canada-guilty-1.3848431
2016-11-13,23:45:38,5cqgiu,146,One Third of Russians Think Protests Are Useless,themoscowtimes.com,https://themoscowtimes.com/news/one-third-of-russians-think-strikes-are-useless-poll-shows-56110
2016-11-13,09:22:07,5cnmts,142,Philippine President Duterte threatens to suspend writ of habeas corpus,rappler.com,http://www.rappler.com/nation/152167-duterte-suspend-writ-habeas-corpus-warning
2016-11-13,11:22:06,5co4hq,136,German Greens call for wealth tax: The most controversial issue at the Greens party conference was whether Germany should introduce a wealth tax. The party answered in the affirmative - after hours-long debates,dw.com,http://www.dw.com/en/german-greens-call-for-wealth-tax/a-36372581
2016-11-13,14:58:18,5covhk,104,Pro-Russia presidential candidates tipped to win in Bulgaria and Moldova,theguardian.com,https://www.theguardian.com/world/2016/nov/13/pro-russia-presidential-candidates-tipped-to-win-in-bulgaria-and-moldova
2016-11-13,01:40:16,5clg9a,75,Former US ambassador to Moscow banned from entering Russia,theguardian.com,https://www.theguardian.com/world/2016/nov/12/former-us-ambassador-moscow-russia-banned
2016-11-13,14:18:21,5cor5r,71,Germany is building the world’s first wind turbines with built-in hydroelectric batteries,msn.com,http://www.msn.com/en-us/news/technology/germany-is-building-the-world%E2%80%99s-first-wind-turbines-with-built-in-hydroelectric-batteries/ar-AAjFQWO?li=AA4Zoy&ocid=spartanntp
