2016-05-07,20:15:58,4i9ml3,24274,"The EU won't sacrifice its high food safety standards for better US auto market access in a transatlantic trade deal being negotiated, German Agriculture Minister Christian Schmidt said Friday.",thelocal.de,http://www.thelocal.de/20160507/eu-wont-sacrifice-food-safety-for-us-trade-deal-germany
2016-05-07,03:22:04,4i6dx5,21273,London elects its first Muslim mayor.,bbc.co.uk,http://www.bbc.co.uk/news/election-2016-36232392
2016-05-07,00:04:26,4i5h5g,5354,Panama Papers source breaks silence over 'scale of injustices',guardian.co.uk,http://www.guardian.co.uk/news/2016/may/06/panama-papers-source-breaks-silence-over-scale-of-injustices
2016-05-07,02:56:33,4i69ns,5025,"Labatt Breweries Halts Production & Ships 200,000 Cans of Clean Water to Fort McMurray Residents Impacted by Raging Fire",lfpress.com,http://www.lfpress.com/2016/05/06/more-than-200000-cans-of-london-water-shipped-to-fire-ravaged-region-of-alberta
2016-05-07,10:46:45,4i85v5,11523,"Saudi Prince Urges American Voters To ‘Make The Right Choice’ On Donald Trump: “For the life of me, I cannot believe that a country like the United States can afford to have someone as president who simply says, ‘These people are not going to be allowed to come to the United States’”",huffingtonpost.com,http://www.huffingtonpost.com/entry/prince-turki-donald-trump_us_572c1fd2e4b096e9f090e769
2016-05-07,04:45:55,4i6rhz,2440,Egypt official blames ‘Tom and Jerry’ cartoons for violence in the Middle East,washingtonpost.com,https://www.washingtonpost.com/news/worldviews/wp/2016/05/04/egypt-official-blames-tom-and-jerry-cartoons-for-mideast-violence/
2016-05-07,19:54:38,4i9ksk,1776,"ISIS terrorist's wishlist revealed after wife arrested, luggage seized at airport",foreigndesknews.com,http://www.foreigndesknews.com/lisas-desk/isis-terrorist-wishlist-revealed-wife-arrested-luggage-seized/
2016-05-07,05:09:02,4i6v3h,1597,"Islamic State executes a 7-year old boy for ""insulting divinity""",en.abna24.com,http://en.abna24.com/service/middle-east-west-asia/archive/2016/05/06/752400/story.html
2016-05-07,05:01:57,4i6tz3,1331,U.S. reveals troops on the ground in Yemen,militarytimes.com,http://www.militarytimes.com/story/military/2016/05/06/us-reveals-boots-ground-yemen/84024498/
2016-05-07,12:21:15,4i8he8,814,Kazakhstan calls for nuclear free world by 2045,washingtonpost.com,https://www.washingtonpost.com/world/asia_pacific/kazakhstan-calls-for-nuclear-free-world-by-2045/2016/05/06/f17a886c-13da-11e6-a9b5-bf703a5a7191_story.html
2016-05-07,19:37:59,4i9jev,759,Iranian filmmaker sentenced to 233 lashes for documentary about graffiti in Tehran,english.ahram.org.eg,http://english.ahram.org.eg/News/208249.aspx
2016-05-07,10:51:30,4i86f6,590,Australia quietly adds 49 species to threatened and endangered lists,theguardian.com,http://www.theguardian.com/environment/2016/may/07/australia-quietly-adds-49-species-to-threatened-and-endangered-lists
2016-05-07,01:04:09,4i5r3p,484,"'Stop resetting your password so often', says British spy agency",ibtimes.co.uk,http://www.ibtimes.co.uk/stop-resetting-passwords-often-says-british-intelligence-agency-1558567
2016-05-07,11:50:15,4i8dos,437,A New Zealand man has pleaded guilty to possession of extremist Islamic videos and is set to be the first person in the country to be sentenced for such offending.,nzherald.co.nz,http://www.nzherald.co.nz/nz/news/article.cfm?c_id=1&objectid=11634632
2016-05-07,04:39:32,4i6qg1,441,"More than 8 million in UK struggle to put food on table, survey says: 4.7 million thought to be regularly going a day without eating",theguardian.com,http://www.theguardian.com/society/2016/may/06/more-than-8-million-in-uk-struggle-to-put-food-on-table-survey-says
2016-05-07,22:32:57,4i9zqe,377,More than 50 mass graves found in former Isis territories in Iraq as evidence of genocide mounts,independent.co.uk,http://www.independent.co.uk/news/world/middle-east/more-than-50-mass-graves-found-in-former-isis-territories-in-iraq-as-evidence-of-genocide-mounts-a7018131.html
2016-05-07,12:04:25,4i8fcb,355,Leopards have suffered a 75% range loss worldwide,mashable.com,http://mashable.com/2016/05/06/leopards-lost-75-percent-historic-range/#oDO2R5xDeGqg
2016-05-07,21:00:16,4i9qho,309,Bangladesh Sufi Muslim hacked to death in suspected Islamist attack,hindustantimes.com,http://www.hindustantimes.com/world/bangladesh-sufi-muslim-hacked-to-death-in-suspected-islamist-attack/story-YmiU9u35A0a0sMhKxeqQ6M.html
2016-05-07,14:32:02,4i8v00,302,Fort McMurray wildfire before and after satellite images,globalnews.ca,http://globalnews.ca/news/2684778/fort-mcmurray-wildfire-first-clear-satellite-images-show-deserted-streets-burned-homes/
2016-05-07,08:18:54,4i7ng9,268,Man who leaked Panama Papers targets New Zealand Prime Minister in new data dump,nzherald.co.nz,http://www.nzherald.co.nz/business/news/article.cfm?c_id=3&objectid=11635183
2016-05-07,18:09:14,4i9clw,252,Pakistan rejects US conditions attached to sale of F-16s‏,dawn.com,http://www.dawn.com/news/1256894/pakistan-rejects-us-conditions-attached-to-sale-of-f-16s
2016-05-07,20:39:39,4i9omw,204,Canada's Fort McMurray wildfire 'to double in size',bbc.com,http://www.bbc.com/news/world-us-canada-36235175
2016-05-07,21:44:15,4i9ukj,202,Saudi prince: Getting nukes an option if Iran breaks deal,edition.cnn.com,http://edition.cnn.com/2016/05/06/politics/saudi-israel-officials-talk-nuclear-u-s-/
2016-05-07,02:37:56,4i66kz,190,The wildfire that destroyed the Fort McMurray region in Canada's Alberta province is expected to incur the largest insured property losses from a single disaster in Canadian history.,globaltimes.cn,http://www.globaltimes.cn/content/981766.shtml
2016-05-07,06:00:13,4i73go,188,Oil tanker washes up on Liberia beach with no crew or lifeboats,theguardian.com,http://www.theguardian.com/world/2016/may/06/liberia-abandoned-oil-tanker-tamaya-1-washed-ashore?CMP=twt_b-gdnnews
2016-05-07,08:50:40,4i7ris,185,The US military has for the first time publicly acknowledged that US troops are operating inside Yemen to help the country’s government and a Saudi-backed coalition confront al-Qaida affiliated forces.,theguardian.com,http://www.theguardian.com/world/2016/may/06/yemen-al-qaida-us-troops
2016-05-07,19:35:08,4i9j78,88,"There may only be three remaining Saharan Addax antelopes left in the wild, meaning they are on the brink of extinction",bbc.com,http://www.bbc.com/earth/story/20160505-the-last-antelopes-left-of-their-kind
2016-05-07,23:35:58,4ia74y,82,A video has emerged showing the public killing of a woman after her alleged conviction by an informal Taliban court of killing her husband.,bbc.com,http://www.bbc.com/news/world-asia-36236567
2016-05-07,07:36:25,4i7hik,83,"SpaceX has done it again. Launching from Cape Canaveral, Fla., early Friday morning, the company successfully landed part of its Falcon 9 rocket on a floating barge. A second part or ""stage"" continued into space, carrying a communications satellite.",npr.org,http://www.npr.org/sections/thetwo-way/2016/05/06/477025362/spacex-lands-falcon-9-on-a-barge-at-sea-again
2016-05-07,03:19:02,4i6df6,68,"China takes first step in $1 billion pledge to U.N. to fund peace, development",reuters.com,http://www.reuters.com/article/us-china-un-idUSKCN0XX1YI?feedType=RSS&feedName=worldNews&utm_source=feedburner&utm_medium=feed&utm_campaign=Feed%3A+Reuters%2FworldNews+%28Reuters+World+News%29
