2016-10-30,22:20:42,5a67jn,13039,Pirate Party triples seats in Icelandic parliament,bbc.co.uk,http://www.bbc.co.uk/news/world-europe-37813564
2016-10-30,06:49:52,5a34gl,8509,U.S. orders families of consulate workers in Istanbul to leave,pbs.org,http://www.pbs.org/newshour/rundown/consulate-workers-istanbul-leave/
2016-10-30,00:54:47,5a123i,2957,"South Korea's prosecutors raid presidential office, aides' homes in probe over influence-peddling scandal",straitstimes.com,http://www.straitstimes.com/asia/east-asia/south-koreas-prosecutors-raid-homes-offices-of-presidential-aides-in-probe-over
2016-10-30,23:42:05,5a6ksx,2764,India planning to offer $3.1 billion Support for Solar Power Related Industries and Manufactirers,highlandmirror.com,https://www.highlandmirror.com/india-plans-to-offer-3-1-billion-support-for-solar-factories/
2016-10-30,20:20:47,5a5rpm,2530,Russia sending three submarines towards Syria in preparation for major assault on Aleppo,independent.co.uk,http://www.independent.co.uk/news/world/middle-east/russia-syria-submarines-admiral-kuznetzov-aircraft-carrier-vladimir-putin-a7387451.html
2016-10-30,04:31:45,5a2gew,2260,Scientists in Brazil are preparing to release millions of factory-bred mosquitoes in an attempt to wipe out their distant cousins that carry tropical diseases,phys.org,http://phys.org/news/2016-10-brazil-mutant-mosquitoes-diseases.html
2016-10-30,23:43:39,5a6l1u,1903,"With two new executive orders, the Turkish government has inflicted a fatal blow to mostly Kurdish media, shutting down 15 media outlets",turkeytms.com,http://www.turkeytms.com/2016/10/30/next-in-line-turkey-shuts-down-15-kurdish-media-outlets/
2016-10-30,03:04:31,5a20u6,1650,"Indian Army destroys 4 Pakistani posts in massive assault in Keran, Jammu and Kashmir.",indianexpress.com,http://indianexpress.com/article/india/india-news-india/indian-army-kashmir-keran-sector-pakistan-jammu-and-kashmir-3729072/
2016-10-30,07:20:05,5a39ao,1335,Asylum seekers face lifetime ban on entering Australia if they arrive by boat,theguardian.com,https://www.theguardian.com/australia-news/2016/oct/30/asylum-seekers-face-lifetime-ban-on-entering-australia-if-they-arrive-by-boat
2016-10-30,00:06:59,5a0u49,1131,More than one million children starve as Yemen war rages,reuters.com,http://www.reuters.com/article/us-yemen-crisis-hunger-idUSKCN12S204
2016-10-30,21:33:12,5a60la,1009,EU and Canada sign long-delayed free trade deal,bbc.com,http://www.bbc.com/news/world-europe-37814884
2016-10-30,02:35:14,5a1vbj,975,Venezuela’s Maduro Increases Minimum Wage by 40%,venezuelanalysis.com,https://venezuelanalysis.com/news/12755
2016-10-30,22:33:49,5a69j5,932,Largest Swiss railway company turns 1000+ ticket machines into bitcoin ATMs,bravenewcoin.com,http://bravenewcoin.com/news/largest-swiss-railway-company-turns-1000-ticket-machines-into-bitcoin-atms/
2016-10-30,12:30:47,5a4imf,808,Angela Merkel: internet search engines are 'distorting perception' | World news,theguardian.com,http://www.theguardian.com/world/2016/oct/27/angela-merkel-internet-search-engines-are-distorting-our-perception?CMP=Share_AndroidApp_%ED%81%B4%EB%A6%BD%EB%B3%B4%EB%93%9C%EC%97%90_%EB%B3%B5%EC%82%AC
2016-10-30,21:22:51,5a5z9t,809,"U.S., Russian, Japanese astronauts return from ISS, three astronauts landed safely in Kazakhstan on Sunday following a 115-day mission aboard the the International Space Station, including U.S. astronaut Kate Rubins, the first person to sequence DNA in space.",japantoday.com,https://www.japantoday.com/category/technology/view/u-s-russian-japanese-astronauts-return-from-iss
2016-10-30,01:41:43,5a1al1,714,"Brazil saw more violent deaths than civil-war torn Syria in 2015, report says",independent.co.uk,http://www.independent.co.uk/news/world/americas/brazil-deaths-violent-crime-syria-police-brutality-report-brazilian-forum-for-public-security-a7386296.html
2016-10-30,16:57:29,5a58zv,604,"Turkey sacks 10,000 more civil servants, shuts more media in post-coup crackdown",dailymail.co.uk,http://www.dailymail.co.uk/wires/reuters/article-3886708/Turkey-sacks-10-000-civil-servants-shuts-media-post-coup-crackdown.html
2016-10-30,07:14:25,5a38ez,538,Islamic State claims murder of teenager in Hamburg | Germany,bnonews.com,http://bnonews.com/news/index.php/news/id5381
2016-10-30,01:49:04,5a1bw5,495,"Ex-ISIS member says he was told to shoot women, children who tried to flee",foxnews.com,http://www.foxnews.com/world/2016/10/29/ex-isis-member-says-was-told-to-shoot-women-children-who-tried-to-flee.html
2016-10-30,01:18:33,5a16cr,462,"Turkish and Saudi weapons found in Mosul, says Shia leader",muslimpress.com,http://www.muslimpress.com/en/tiny/news-106320
2016-10-30,17:18:58,5a5avh,449,Secret government papers show taxpayers will pick up costs of Hinkley nuclear waste storage,theguardian.com,https://www.theguardian.com/uk-news/2016/oct/30/hinkley-point-nuclear-waste-storage-costs
2016-10-30,05:49:34,5a2tsl,374,Mexico City stages first Day of the Dead parade,bbc.com,http://www.bbc.com/news/world-latin-america-37813562
2016-10-30,02:50:44,5a1y8p,352,"VW’s electric car switch ‘to cost 10,000 jobs’, Volkswagen plans to cut more than 10,000 jobs in coming years as the German auto giant switches its focus to making electric cars.",thelocal.de,https://www.thelocal.de/20161029/vws-electric-car-switch-to-cost-10000-jobs
2016-10-30,09:37:19,5a3unw,232,Iceland Election: Government ousted and anti-establishment Pirate Party may receive 14% of the vote.,icelandmonitor.mbl.is,http://icelandmonitor.mbl.is/news/politics_and_society/2016/10/30/first_results_iceland_s_government_ousted_and_pirat/
2016-10-30,18:20:31,5a5g08,229,'Patriots' take over site earmarked for Greek mosque,aa.com.tr,http://aa.com.tr/en/europe/patriots-take-over-site-earmarked-for-greek-mosque/674511
2016-10-30,01:59:23,5a1oon,211,"Swiss rail travel more expensive than driving, rail transport has been steadily becoming more expensive than driving in Switzerland, according to an investigation conducted by the federal cost oversight office.",swissinfo.ch,http://www.swissinfo.ch/eng/cost-oversight-study_swiss-rail-travel-more-expensive-than-driving/42550922
2016-10-30,09:50:55,5a3wov,173,"Iran's justice minister is looking for an ""effective punishment"" for criminals instead of execution, according to local media. Mostafa Pourmohammadi said he thought the number of capital crimes should be revised",bbc.com,http://www.bbc.com/news/world-middle-east-37810437
2016-10-30,23:34:19,5a6jil,176,‘Russian‘ bomb attacks kill 22 kids in Northern Syria as UK-funded schools are hit,thesun.co.uk,https://www.thesun.co.uk/news/2065039/russian-bomb-attacks-kill-22-kids-in-northern-syria-as-uk-funded-schools-are-hit/
2016-10-30,23:23:11,5a6hle,135,"Moldova votes in showdown between Russia and EU supporters, Ex-Soviet Moldova went to the polls Sunday in its first popular presidential election since the 1990s.",yahoo.com,https://www.yahoo.com/news/moldova-votes-first-presidential-polls-two-decades-022242281.html
2016-10-30,15:34:49,5a5219,118,India's Rooftop Solar Power Capacity Crosses 1 Gigawatt Mark,ndtv.com,http://www.ndtv.com/india-news/indias-rooftop-solar-power-capacity-crosses-1-gigawatt-mark-report-1476264
