2016-05-31,15:31:42,4ltvpv,48487,Every reference to the Great Barrier Reef removed from UN report on impact of climate change after ‘intervention’ from Australian government.,theguardian.com,http://www.theguardian.com/environment/planet-oz/2016/may/30/australias-censorship-of-unesco-climate-report-is-like-a-shakespearean-tragedy
2016-05-31,01:31:32,4lqbjf,28858,"Denmark to stop paying salary to royal family grandchildren: 'Simple mathematics dictate that there needs to be some sort of limit. Otherwise within a few generations there will be several hundred princes and princesses who need an annual salary,' says a ruling party spokesman",independent.co.uk,http://www.independent.co.uk/news/world/europe/denmark-danish-royal-family-queen-margrethe-grandchildren-stop-paying-salary-a7056261.html
2016-05-31,23:03:07,4lvcfb,25253,Mass sexual assault reported at music festival in Germany: The attacks are similar to those reported in Cologne and other cities on New Year's Eve.,independent.co.uk,http://www.independent.co.uk/news/world/europe/germany-sexual-assault-music-festival-cologne-darmstadt-a7057416.html
2016-05-31,09:53:50,4lslqe,5505,North Korea tries and fails to launch missile,straitstimes.com,http://www.straitstimes.com/asia/east-asia/north-korea-tries-and-fails-to-launch-missile-yonhap
2016-05-31,12:34:49,4lt9bg,4063,"In the last 17 months, 2234 Indians get HIV via blood transfusions",thehindu.com,http://www.thehindu.com/news/national/bad-blood-2234-get-hiv-after-transfusion/article8668805.ece
2016-05-31,01:19:41,4lq9hn,2673,"Chinese Official: China has no interest in any form of cold war, nor are we interested in playing a role in a Hollywood movie written and directed by certain US military officials",theguardian.com,http://www.theguardian.com/world/2016/may/30/china-us-white-house-hollywood-cold-war
2016-05-31,05:36:27,4lrhhh,2004,Egypt in shock at first female circumcision death reported in 3 years,gulfnews.com,http://gulfnews.com/news/mena/egypt/egypt-in-shock-at-first-female-circumcision-death-reported-in-3-years-1.1837563
2016-05-31,00:28:04,4lq0t7,1826,France bans work emails outside office hours,miragenews.com,http://www.miragenews.com/france-bans-work-emails-outside-office-hours/
2016-05-31,14:26:10,4lto10,1489,"Australia to lift minimum wage by 2.4%, an increase to $17.70 per hour",theguardian.com,https://www.theguardian.com/business/2016/may/31/fair-work-commission-raises-australias-minimum-wage-by-1580-a-week?CMP=soc_567
2016-05-31,21:37:39,4luzxi,1321,EU court adviser: Employers can ban Muslim headscarf,foxnews.com,http://www.foxnews.com/world/2016/05/31/eu-court-adviser-employers-can-ban-muslim-headscarf.html
2016-05-31,16:34:04,4lu2m8,1157,"Several NSW Police officers have been savaged in court for allegedly grabbing the breasts and neck of an anti-Reclaim Australia protester, then covering their actions up by deleting evidence, making up a false charge against her, lying under oath and attacking her in court.",smh.com.au,http://www.smh.com.au/nsw/protester-awarded-13400-after-police-officer-made-up-charge-at-martin-place-rally-20160531-gp7xih.html
2016-05-31,11:42:29,4lt1nw,795,"Angela Merkel's 'hasty' approach to TTIP trade deal condemned by the German Vice-Chancellor: 'If the Americans hold fast to this position, we don't need the free trade treaty. And TTIP will fail,' says Vice-Chancellor Sigmar Gabriel",independent.co.uk,http://www.independent.co.uk/news/world/europe/ttip-trade-deal-angela-merkel-hasty-approach-condemned-german-vice-chancellor-eu-us-a7056636.html
2016-05-31,01:25:29,4lqaij,675,Egyptian President pledges justice for Christian mother beaten and stripped by mob,ibtimes.co.uk,http://www.ibtimes.co.uk/egyptian-president-pledges-justice-christian-mother-beaten-stripped-by-mob-1562761
2016-05-31,08:35:34,4ls9xb,657,S. Korea detects signs North preparing missile launch,yahoo.com,https://www.yahoo.com/news/korea-detects-signs-north-preparing-missile-launch-131620476.html
2016-05-31,14:09:41,4ltlzp,573,"Nearly 46 Million People Trapped in Modern Slavery, Report Finds",bloomberg.com,http://www.bloomberg.com/news/articles/2016-05-31/nearly-46-million-people-trapped-in-modern-slavery-report-finds
2016-05-31,05:25:10,4lrfmh,548,"A court in Saudi Arabia sentenced a member of an independent human rights organization to eight years in prison in the latest guilty verdict to be issued against the group's members, rights group Amnesty International said",bigstory.ap.org,http://bigstory.ap.org/article/5648ff54594643e49bbeb543154c0080/saudi-human-rights-activist-sentenced-8-years-prison
2016-05-31,22:29:27,4lv7bh,432,"Malaysia just established a one million hectare marine park: off the northern tip of Borneo it's a region containing the second largest concentration of coral reefs in Malaysia as well as other important habitats like mangroves, sea grass beds and productive fishing grounds",theguardian.com,http://www.theguardian.com/world/blog/2016/may/30/malaysia-just-established-a-one-million-hectare-marine-park
2016-05-31,08:52:41,4lsckj,401,Sausage-Wielding Extremists Attack Vegan Cafe In Tbilisi,rferl.mobi,http://www.rferl.mobi/a/georgia-nationalists-attack-vegan-cafe-with-sausages/27766236.html
2016-05-31,22:34:59,4lv85o,323,"Solid gold, diamond-encrusted, $5,000,000 Maltese Eagle stolen in Vancouver",news.nationalpost.com,http://news.nationalpost.com/news/canada/this-solid-gold-diamond-encrusted-5m-eagle-was-stolen-in-a-violent-robbery-in-suburban-vancouver
2016-05-31,11:52:32,4lt35p,279,Sweden struggles with first gender balance shift in 267 years,cbsnews.com,http://www.cbsnews.com/news/gender-balance-shifts-progressive-sweden/
2016-05-31,21:41:49,4lv0hs,270,Migrant crisis is fueling sex trafficking of Nigerian girls to Europe,news.trust.org,http://news.trust.org/item/20160531113102-8rlpa/
2016-05-31,02:45:19,4lqoch,267,ISIS slaughters 12 more Real Madrid fans in Iraq during Champions League final,en.abna24.com,http://en.abna24.com/service/middle-east-west-asia/archive/2016/05/30/757222/story.html
2016-05-31,00:27:08,4lq0oe,272,"G7 nations pledge to end fossil fuel subsidies by 2025: Leaders of the UK, US, Canada, France, Germany, Italy, Japan and the EU urge all countries to join them in eliminating support for coal, oil and gas in a decade",theguardian.com,http://www.theguardian.com/environment/2016/may/27/g7-nations-pledge-to-end-fossil-fuel-subsidies-by-2025
2016-05-31,10:58:47,4lsvdz,246,Hundreds of undamaged Fort McMurray homes declared unsafe due to toxic ash,cbc.ca,http://www.cbc.ca/news/canada/edmonton/hundreds-of-undamaged-fort-mcmurray-homes-declared-unsafe-due-to-toxic-ash-1.3607928
2016-05-31,03:02:01,4lqr5i,238,Thai government plans to man-in-the-middle all encrypted internet traffic,prachatai.com,http://prachatai.com/english/node/6196
2016-05-31,05:31:02,4lrgkb,208,Venezuela: Patients dying as crisis hits hospitals,aljazeera.com,http://www.aljazeera.com/news/2016/05/venezuela-hospitalseconomic-crisis-160530151128000.html
2016-05-31,01:37:13,4lqck2,195,"Financial investigators on the suspected Google tax evasion in France worked for nearly a year with offline computers, Word and the codename Tulip.",washpost.bloomberg.com,http://washpost.bloomberg.com/Story?docId=1376-O7ZJYN6JTSE801-11C8ICCPQI6Q0988S5LTE06678
2016-05-31,09:06:34,4lseno,181,El Niño is over – but it leaves nearly 100 million people short of food,theguardian.com,http://www.theguardian.com/global-development/2016/may/30/el-nino-is-over-but-it-leaves-nearly-100-million-people-short-of-food?CMP=share_btn_tw
2016-05-31,02:16:26,4lqjbd,156,"Indonesian navy fires shots, seizes Chinese fishing boat near disputed South China Sea",scmp.com,http://www.scmp.com/news/asia/southeast-asia/article/1959643/indonesian-navy-fires-shots-seizes-chinese-fishing-boat
2016-05-31,19:41:18,4lult7,125,Gaza Strip: Hamas executes three as death penalty resumes,bbc.com,http://www.bbc.com/news/world-middle-east-36415503
