2016-02-18,07:52:17,46btqo,15021,Colombian prison drain pipes yield over 100 dismembered corpses,japantimes.co.jp,http://www.japantimes.co.jp/news/2016/02/18/world/colombian-prison-drain-pipes-yield-100-dismembered-corpses/#.VsUHZsfidNk
2016-02-18,22:57:01,46f3l4,27574,"Scientists warn of coming global disaster because of water inequality.“We are revealing a global disaster in the making, yet we are seeing very little coordinated response.”",fusion.net,http://fusion.net/story/269668/water-inequality-dry-wet-regions/?utm_source=rss&utm_medium=feed&utm_campaign=/section/news/feed/
2016-02-18,00:55:00,469mj7,4602,Blast hits Ankara military building,bbc.co.uk,http://www.bbc.co.uk/news/world-europe-35599323
2016-02-18,04:58:21,46ay10,4320,ISIS beheads 15-year-old Iraqi boy for listening to pop music,jpost.com,http://www.jpost.com/Middle-East/ISIS-Threat/ISIS-beheads-15-year-old-Iraqi-boy-for-listening-to-pop-music-445280?utm_source=dlvr.it&utm_medium=twitter
2016-02-18,09:06:08,46c5et,3231,N. Korea prepares for terror attacks on S. Korea: intelligence unit,english.yonhapnews.co.kr,http://english.yonhapnews.co.kr/news/2016/02/18/0200000000AEN20160218002800315.html?input=www.tweeter.com
2016-02-18,06:31:07,46bfj6,2586,"Huge explosion hits Turkish Centre, Stockholm, Sweden",dailystar.co.uk,http://www.dailystar.co.uk/news/latest-news/495342/Explosion-Turkish-community-building-Sweden
2016-02-18,20:30:58,46eime,1754,"Fast-growing tumbleweed called hairy panic blows into Australian city - Dry grass piles up around homes in Wangaratta, north-east Victoria – at times reportedly reaching roof height",theguardian.com,http://www.theguardian.com/australia-news/2016/feb/18/fast-growing-tumbleweed-called-hairy-panic-blows-into-australian-city
2016-02-18,10:25:47,46cha5,948,"Obama to travel to Cuba President Barack Obama is planning to travel to Cuba within the next month, becoming the first U.S. president to do so since Calvin Coolidge.",politico.com,http://www.politico.com/story/2016/02/obama-cuba-219412
2016-02-18,21:10:38,46enm6,944,Vatican says abortion is 'illegitimate response' to Zika virus,theguardian.com,http://www.theguardian.com/world/2016/feb/18/vatican-says-abortion-is-illegitimate-response-to-zika-virus
2016-02-18,08:15:46,46bxkq,734,Italy names Turkish president's son in money laundering investigation allegedly connected to political corruption | Europe | News,independent.co.uk,http://www.independent.co.uk/news/world/europe/bilal-erdogan-italy-investigates-turkish-presidents-son-over-money-laundering-allegedly-connected-to-a6879871.html
2016-02-18,22:11:19,46ew4a,609,Syrian rebels say reinforcements get free passage via Turkey,uk.reuters.com,http://uk.reuters.com/article/uk-mideast-crisis-syria-aleppo-idUKKCN0VR0RH
2016-02-18,15:39:35,46dnwc,550,Panasonic to recognize same-sex partnerships in rare step for conservative Japan,theverge.com,http://www.theverge.com/2016/2/18/11044190/panasonic-same-sex-partnerships-japan
2016-02-18,18:46:43,46e7pc,372,Former Dutch PM Balkenende smuggled beer into Arab palace,nltimes.nl,http://www.nltimes.nl/2016/02/18/former-dutch-pm-balkenende-smuggled-beer-into-arab-palace/
2016-02-18,11:39:26,46csh9,357,"Our 1st sex with Neanderthals happened 100,000 yrs ago - It was a 2-way street. Many carry Neanderthal DNA due to cross-species liaisons. Now it seems some Neanderthals carried our DNA too. “1 chunk of modern DNA found in Neanderthals was inside a gene linked to language development.”",newscientist.com,https://www.newscientist.com/article/2077805-our-first-sex-with-neanderthals-happened-100000-years-ago/
2016-02-18,20:03:37,46efmg,338,Six soldiers killed in southeast Turkey bomb attack,in.reuters.com,http://in.reuters.com/article/turkey-blast-diyarbakir-casualties-idINKCN0VR126
2016-02-18,20:58:06,46em3z,283,"Swine flu: Three hospital wards closed in Leicester, UK after 14 cancer patients diagnosed with virus",independent.co.uk,http://www.independent.co.uk/news/uk/home-news/swine-flu-three-hospitals-closed-in-leicester-after-14-cancer-patients-diagnosed-with-virus-a6881321.html
2016-02-18,00:26:22,469gez,251,"Pentagon: North Korean special forces 'highly trained, well-equipped'",cnn.com,http://www.cnn.com/2016/02/12/politics/pentagon-north-korean-special-forces-highly-trained-well-equipped/index.html
2016-02-18,15:15:31,46dl7b,240,"Lockheed Martin ready to manufacture F-16 jets in India, Lockheed supplied six C130J Super Hercules planes to India in 2011 and will be delivering another six helicopters in 2017",economictimes.indiatimes.com,http://economictimes.indiatimes.com/articleshow/51037000.cms?utm_source=contentofinterest&utm_medium=text&utm_campaign=cppst
2016-02-18,17:21:05,46dyft,215,Ankara blast: Turkey PM says Syria Kurds to blame,bbc.com,http://www.bbc.com/news/world-europe-35602288
2016-02-18,10:27:43,46chjo,206,"Venezuela president raises fuel price by 6,000% and devalues bolivar to tackle crisis",theguardian.com,http://www.theguardian.com/world/2016/feb/18/venezuela-president-raises-fuel-price-by-1300-and-devalues-bolivar-to-tackle-crisis
2016-02-18,19:22:07,46eb0d,182,"El Niño has passed peak strength but impacts will continue, UN warns",theguardian.com,http://www.theguardian.com/environment/2016/feb/18/el-nino-has-passed-peak-strength-but-impacts-will-continue-un-warns
2016-02-18,16:28:29,46dsza,172,Explosion hits another Turkish military convoy one day after Ankara attack,theguardian.com,http://www.theguardian.com/world/2016/feb/18/explosion-hits-another-turkish-military-convoy-one-day-after-ankara-attack
2016-02-18,21:56:14,46etxo,155,"Pakistan’s parliament becomes first in world to run entirely on solar power | The seat of the government in the country’s capital, Islamabad, is now wholly powered by the sun",independent.co.uk,http://www.independent.co.uk/news/world/asia/pakistan-s-parliament-becomes-first-in-world-to-run-entirely-on-solar-power-a6873586.html
2016-02-18,01:44:42,469wq9,109,Cash for Life: Guaranteed Annual Income Gaining Steam in Canada,ca.news.yahoo.com,https://ca.news.yahoo.com/blogs/dailybrew/cash-for-life-guaranteed-annual-income-gaining-205504354.html
2016-02-18,20:26:11,46ei4k,104,"China to relocate 9,000 people for huge telescope sensitive enough to detect intelligent life - The 500-metre device will the world's biggest telescope & can reflect signals from distant parts of the universe",independent.co.uk,http://www.independent.co.uk/news/science/china-to-relocate-9000-people-for-huge-telescope-sensitive-enough-to-detect-intelligent-life-aliens-a6876936.html
2016-02-18,04:05:18,46ao15,106,"Human Rights Watch released a report Sunday providing new indications that Saudi Arabia has fired American-made cluster munitions, banned by international treaty, in civilian areas of Yemen, and said their use may also violate United States law.",nytimes.com,http://www.nytimes.com/2016/02/15/world/middleeast/new-report-of-us-made-cluster-bomb-use-by-saudis-in-yemen.html?action=click&contentCollection=Middle%20East&module=RelatedCoverage&region=Marginalia&pgtype=article
2016-02-18,23:26:06,46f8k1,95,One-Third of Oil Companies Could Go Bankrupt this Year,fortune.com,http://fortune.com/2016/02/16/oil-companies-bankrupt/
2016-02-18,18:36:22,46e6o5,77,Vietnam suspends jail guards over death-row pregnancy.,bbc.com,http://www.bbc.com/news/world-asia-35589505
2016-02-18,01:35:57,469uz8,59,Kidnapped Nigerian Girls Get Unexpectedly Hostile Homecoming,news.yahoo.com,http://news.yahoo.com/kidnapped-nigerian-girls-unexpectedly-hostile-homecoming-110248776.html
2016-02-18,05:07:47,46azsd,61,"Apple encryption case risks influencing Russia and China, privacy experts say. Analysts and lawmakers warn, ramifications ‘could snowball around the world’",theguardian.com,http://www.theguardian.com/technology/2016/feb/17/apple-fbi-encryption-san-bernardino-russia-china
