2016-09-28,23:26:23,54wkmk,44963,Iceland's capital Reykjavik to switch off street lights tonight due to a forecast of unusually magnificent northern lights,icelandmonitor.mbl.is,http://icelandmonitor.mbl.is/news/nature_and_travel/2016/09/28/reykjavik_to_switch_off_street_lights_for_northern_/
2016-09-28,09:24:20,54tqbs,43289,"Elon Musk plans to get humans to Mars in six years: SpaceX founder tells meeting of astronautical experts that his only purpose is to ‘make life interplanetary’, revealing plans for reusable ship to Mars",theguardian.com,https://www.theguardian.com/technology/2016/sep/27/elon-musk-spacex-mars-colony
2016-09-28,20:19:22,54vu05,31770,Missile which shot down flight MH17 over Ukraine in 2014 was brought in from Russian territory - investigators,bbc.co.uk,http://www.bbc.co.uk/news/world-europe-37495067?ns_mchannel=social&ns_campaign=bbc_breaking&ns_source=twitter&ns_linkname=news_central
2016-09-28,06:15:49,54svpn,8526,Thousands of women storm Saudi King’s office demanding basic freedoms,bostonjournal.org,http://bostonjournal.org/thousands-of-women-storm-saudi-kings-office-demanding-basic-freedoms/
2016-09-28,21:58:13,54w6q6,3795,Veiled woman kills 2 ISIS militants in Mosul,iraqinews.com,http://www.iraqinews.com/iraq-war/veiled-woman-kills-2-isis-militants-mosul/
2016-09-28,01:45:29,54rhja,3618,Hezbollah chief: Wahhabism is even more evil than Israel,yalibnan.com,http://yalibnan.com/2016/09/27/hezbollah-chief-prefers-israel-over-wahhabism/
2016-09-28,05:44:37,54sq09,2964,"SpaceX unveils the Interplanetary Transport System, a spaceship and rocket to colonize Mars",theverge.com,http://www.theverge.com/2016/9/27/13078230/spacex-mars-interplanetary-rocket-spaceship-video
2016-09-28,22:46:20,54we27,2418,IMF study warns free trade seen as benefiting 'only a fortunate few',theguardian.com,https://www.theguardian.com/business/2016/sep/27/international-monetary-fund-world-economic-outlook-globalisation-free-trade
2016-09-28,16:32:33,54v8s0,2361,Entire state of South Australia without power,news.com.au,http://www.news.com.au/technology/environment/storm-warning-sydney-melbourne-brisbane-hobart-adelaide-to-be-battered/news-story/464829aed96e95286f1fdd16d315d0ce
2016-09-28,21:27:24,54w291,1690,"Scientists just demonstrated internet speeds 1,000 times faster than Google Fibre",sciencealert.com,https://www.sciencealert.com/scientists-just-demonstrated-internet-speeds-1-000-times-faster-than-google-fibre
2016-09-28,23:23:25,54wk3t,862,"A new study finds that Earth is the warmest it's been in the last 120,000 years",businessinsider.com,http://www.businessinsider.com/ap-study-earths-roughly-warmest-in-about-100000-years-2016-9
2016-09-28,08:35:33,54tix4,819,"The countries where the rich are getting richer: These ultra high net worth (UHNW) individuals account for just 0.004% of the world’s adult population​, but control 12 per cent of global wealth.",independent.co.uk,http://www.independent.co.uk/news/world/the-countries-where-the-rich-are-getting-richer-a7332431.html
2016-09-28,08:03:43,54tdxe,628,"Overcrowded bus carrying earthquake survivors slips off mountain road in Nepal, killing 19 and severely injuring others",hindustantimes.com,http://www.hindustantimes.com/world-news/overcrowded-bus-slips-off-mountain-road-in-nepal-killing-14/story-KyigFVu2Iur5UTzoDUFdoI.html
2016-09-28,21:28:31,54w2e3,595,Dutch Parliament Votes to Shut Down All Coal Plants,ecowatch.com,http://www.ecowatch.com/shut-down-coal-plants-netherlands-2017447528.html
2016-09-28,07:10:18,54t5b3,481,U.S to deploy THAAD anti-missile system in South Korea 'as soon as possible',reuters.com,http://www.reuters.com/article/us-usa-northkorea-thaad-idUSKCN11X2KO
2016-09-28,15:10:29,54v0ox,451,Pit Bull Ownership banned in Montreal,dogstoryy.com,http://dogstoryy.com/news/pit-bull-ownership-banned-in-montreal/
2016-09-28,05:38:19,54souo,442,Doctors Without Borders said there was no legitimate reason for attacks on two medical facilities it supported in Yemen that killed 20 people and caused the group to pull out of the country.,cnn.com,http://www.cnn.com/2016/09/27/middleeast/yemen-msf-hospital-attack/
2016-09-28,18:19:06,54vi8p,405,India may revoke a water sharing treaty with Pakistan in order to deter Pakistan from sponsoring terrorism,indianexpress.com,http://indianexpress.com/article/india/india-news-india/indus-water-sharing-treaty-india-pakistan-modi-border-security-underwater-sensor-uri-3051968/
2016-09-28,18:16:03,54vhyv,412,Five arrested on suspicion of forming European Islamic State cell,reuters.com,http://www.reuters.com/article/us-mideast-crisis-arrests-idUSKCN11Y0MG
2016-09-28,01:26:36,54re4g,410,Russia's new education minister wants to mandate Soviet-era farm labor for students,businessinsider.com,http://www.businessinsider.com/russia-education-minister-olga-vasilieva-calls-for-farm-labor-2016-9
2016-09-28,10:33:37,54u0y0,337,Obama names first ambassador to Cuba in five decades,au.news.yahoo.com,https://au.news.yahoo.com/world/a/32746064/obama-names-first-ambassador-to-cuba-in-five-decades/#page1
2016-09-28,06:51:51,54t23b,326,Panama Papers: European parliament opens inquiry,theguardian.com,https://www.theguardian.com/world/2016/sep/27/panama-papers-inquiry-opens-at-european-parliament
2016-09-28,09:32:19,54trl7,263,World's first baby born from new procedure using DNA of three people,theguardian.com,https://www.theguardian.com/science/2016/sep/27/worlds-first-baby-born-using-dna-from-three-parents
2016-09-28,20:17:13,54vtrt,221,Switzerland moves towards nationwide burqa ban as draft law approved in parliament: Proposals approved by just one vote after canton brings in own regional ban,independent.co.uk,http://www.independent.co.uk/news/world/europe/switzerland-burqa-ban-swiss-parliament-national-council-draft-law-vote-latest-muslim-veils-walter-a7334631.htmlFt
2016-09-28,06:19:03,54swag,143,"Brazilian prime minister Michel Temer openly admits former prime minister Dilma Rousseff was impeached over ""opposition to the neoliberal platform [..] demanded by Temer’s party"" instead of the official ""budgetary crimes"" cited during the impeachment. Brazillian media remain utterly silent.",theintercept.com,https://theintercept.com/2016/09/23/brazils-big-media-ignores-temers-confession-except-estadao-columnist-who-falsely-claimed-video-was-altered/
2016-09-28,17:50:15,54vfou,106,Entire South Australia without power as storm hits.,abc.net.au,http://www.abc.net.au/news/2016-09-28/south-australia-without-power-live-blog/7885972
2016-09-28,12:33:53,54uibj,112,The Americas Becomes First Region of World to Eliminate Measles,voanews.com,http://www.voanews.com/a/the-americas-becomes-first-region-of-the-world-to-eliminate-measles/3527386.html
2016-09-28,04:08:15,54s8bh,109,Canada First Nations chief won't join UK royals for 'empty gesture' ceremony,theguardian.com,https://www.theguardian.com/world/2016/sep/26/canada-first-nations-prince-william-kate-middleton-british-columbia?CMP=fb_gu
2016-09-28,22:07:23,54w858,90,Drug resistance - Soaring levels of antibiotic resistance found in supermarket chickens,thebureauinvestigates.com,https://www.thebureauinvestigates.com/2016/09/27/soaring-levels-antibiotic-resistance-found-supermarket-chickens/
2016-09-28,12:56:39,54ul9e,91,"September 2016 as a major milestone for the world’s climate. At a time when atmospheric carbon dioxide is usually at its minimum, the monthly value failed to drop below 400 parts per million.",climatecentral.org,http://www.climatecentral.org/news/world-passes-400-ppm-threshold-permanently-20738
