2016-02-21,00:15:37,46qp2g,33299,Homeopathy found to be effective for 0 out of 68 illnesses: a systematic review concluded the controversial treatment was no more effective than placebo drugs,timesofindia.indiatimes.com,http://timesofindia.indiatimes.com/home/science/Homeopathy-found-to-be-effective-for-0-out-of-68-illnesses/articleshow/51066514.cms?from=mdr
2016-02-21,12:18:41,46tr8l,13500,"Australian government's 'no jab, no pay' law sparks run on vaccines as parents fear missing out on welfare benefits",theage.com.au,http://www.theage.com.au/nsw/federal-governments-no-jab-no-pay-law-sparks-run-on-vaccines-20160219-gmyusd.html
2016-02-21,23:38:31,46vq2y,13656,US authorities have asked the German carmaker Volkswagen to produce electric vehicles in the United States as a way of making up for its rigging of emission tests.,news.com.au,http://www.news.com.au/world/breaking-news/us-asks-vw-for-electric-cars/news-story/7907b5f9c856ec70b6ba9ed71310ef82
2016-02-21,20:11:38,46v1b4,13310,Pope calls for worldwide ban on death penalty,reuters.com,http://www.reuters.com/article/us-pope-capitalpunishment-idUSKCN0VU0GH?feedType=RSS&feedName=topNews&utm_source=twitter
2016-02-21,20:50:14,46v4w8,3496,"Salman Rushdie: Iranian state media renew fatwa on Satanic Verses author with $600,000 bounty",independent.co.uk,http://www.independent.co.uk/news/people/salman-rushdie-iranian-state-media-renew-fatwa-on-satanic-verses-author-with-600000-bounty-a6887141.html
2016-02-21,13:01:39,46twj5,3357,Rip Curl clothes produced in North Korean factory with 'slave-like' conditions,mashable.com,http://mashable.com/2016/02/20/rip-curl-north-korea-factory/
2016-02-21,19:43:01,46uyk4,2579,"3,000-Yr-Old Egyptian Fingerprints found on Coffin Lid",bbc.com,http://www.bbc.com/news/uk-england-cambridgeshire-35606137
2016-02-21,22:29:37,46vg8e,2052,Missing radioactive material found dumped in south Iraq,reuters.com,http://www.reuters.com/article/us-mideast-crisis-iraq-radioactive-idUSKCN0VU0JY
2016-02-21,23:18:50,46vn5r,1773,"ISIS is marketing to Justin Beiber fans, tricking them into viewing ISIS propaganda videos with Beiber hashtags",express.co.uk,http://www.express.co.uk/news/world/645948/ISIS-tries-turn-Beliebers-into-believers-using-Justin-Bieber-spread-hate-messages
2016-02-21,01:32:03,46r183,987,"Banning homosexuality fosters hate crime and homophobia, says UN report",theguardian.com,http://www.theguardian.com/world/2016/feb/18/banning-homosexuality-fosters-hate-and-homophobia-says-un-report
2016-02-21,14:35:03,46u6zb,987,NASA Reveals Astronauts Heard Unexplained Music At The Moon,huffingtonpost.com,http://www.huffingtonpost.com/entry/apollo-10-astronauts-reported-unexplained-music-at-moon_us_56c80662e4b0928f5a6c0679
2016-02-21,23:20:52,46vnfc,889,"London Mayor, Boris Johnson to campaign to leave European Union.",bbc.co.uk,http://www.bbc.co.uk/news/uk-politics-eu-referendum-35626621
2016-02-21,03:19:14,46rigi,883,"Syrian army, allies advance against Islamic State in eastern Aleppo",uk.reuters.com,http://uk.reuters.com/article/uk-mideast-crisis-syria-aleppo-idUKKCN0VT0UN
2016-02-21,18:57:53,46uud7,695,"ISIS Begins ‘Mass Evacuation’: Russia Destroys Another 1,593 Targets in Past Week",jewsnews.co.il,http://www.jewsnews.co.il/2016/02/18/isis-begins-mass-evacuation-russia-destroys-another-1593-targets-in-past-week/
2016-02-21,16:52:37,46ujdk,694,"EU police chief warns that 5,000 jihadists returned from Middle East — and new attack is likely",news.nationalpost.com,http://news.nationalpost.com/news/world/eu-police-chief-warns-that-5000-jihadists-returned-from-training-in-middle-east-and-new-attack-is-likely
2016-02-21,00:52:43,46qutr,616,Explosives found in front of French government buildings in Corsica before a huge demonstration,mobile.english.rfi.fr,http://mobile.english.rfi.fr/sports/20160220-thousands-demonstrate-corsica-support-injured-football-fan
2016-02-21,06:05:08,46s77o,606,US becomes Germany’s top trading partner,arabnews.com,http://www.arabnews.com/economy/news/883576
2016-02-21,23:07:17,46vlia,578,Senior scientists have denounced a potential move to “muzzle” colleagues whose findings are disliked by the government.,theguardian.com,https://www.theguardian.com/science/2016/feb/20/scientists-attack-muzzling-government-state-funded-cabinet-office
2016-02-21,11:36:33,46tleq,557,Late Russian anti-doping agency boss was set to expose true story,reuters.com,http://www.reuters.com/article/us-athletics-corruption-russia-idUSKCN0VU007
2016-02-21,01:36:39,46r1z6,515,"More than 10 million people are in need of food aid in Ethiopia amid a drought worse than the one that triggered the haunting 1984 famine, the U.N. has warned.",nbcnews.com,http://www.nbcnews.com/news/world/el-nino-linked-drought-ethiopia-s-worst-50-years-n520686
2016-02-21,21:44:30,46vao4,476,"Twitter’s Account Suspensions Are Surprisingly Effective Against ISIS - ""Frequent pruning has hobbled terrorists’ ability to get their message out.""",theatlantic.com,http://www.theatlantic.com/technology/archive/2016/02/twitters-account-suspensions-are-surprisingly-effective-against-the-islamic-state/463440/
2016-02-21,17:58:40,46up0f,382,Thousands in Japan rally against U.S. base on Okinawa,reuters.com,http://www.reuters.com/article/us-japan-politics-okinawa-idUSKCN0VU0BG?feedType=RSS&feedName=worldNews
2016-02-21,01:34:59,46r1p4,376,Pentagon: US kept nukes on Okinawa,nhk.or.jp,http://www3.nhk.or.jp/nhkworld/english/news/20160220_21.html
2016-02-21,13:19:04,46tykt,380,Mexican woman with Zika gives birth to healthy child,timesofindia.indiatimes.com,http://timesofindia.indiatimes.com/world/rest-of-world/Mexican-woman-with-Zika-gives-birth-to-healthy-child/articleshow/51070526.cms
2016-02-21,09:26:03,46t1s5,267,Egyptian writer Ahmed Naji sentenced to two years for 'sexually explicit text'.,english.ahram.org.eg,http://english.ahram.org.eg/News/188078.aspx
2016-02-21,22:13:04,46ve19,238,Thousands of protesters formed a human chain around Japan's parliament Sunday in protest at the planned construction of a new US base on the southern island of Okinawa.,news.yahoo.com,http://news.yahoo.com/thousands-surround-japan-parliament-protest-us-plan-135047649.html
2016-02-21,07:52:37,46so91,211,Al Qaeda Has Seized Another City and Now Controls a Swath of Southern Yemen,news.vice.com,https://news.vice.com/article/al-qaeda-has-seized-another-city-and-now-controls-a-swath-of-southern-yemen
2016-02-21,17:50:21,46uoa9,192,Britain and Saudi Arabia lobbied UN to whitewash Bahrain police abuses,theguardian.com,http://www.theguardian.com/politics/2016/feb/21/britain-lobbied-un-bahrain-human-rights-abuses
2016-02-21,07:28:24,46sklj,175,Ukraine demonstrators attack Russian banks | Toronto Star,thestar.com,http://www.thestar.com/news/world/2016/02/20/ukraine-demonstrators-attack-russian-banks.html
2016-02-21,21:01:01,46v5xe,175,"Syria conflict: Homs car bombings kill 46, says monitor",bbc.com,http://www.bbc.com/news/world-middle-east-35624654
