2016-03-30,20:19:33,4ckbod,74996,Hundreds of thousands of leaked emails reveal massively widespread corruption in global oil industry,theage.com.au,http://www.theage.com.au/interactive/2016/the-bribe-factory/day-1/the-company-that-bribed-the-world.html
2016-03-30,21:38:59,4ckkck,27110,"Using Adblock Plus to block ads is legal, rules German court—for the fifth time",arstechnica.co.uk,http://arstechnica.co.uk/business/2016/03/adblocking-and-whitelists-legal-rules-german-court/
2016-03-30,12:28:43,4cj2pd,30095,Apple wants the FBI to reveal how it hacked the San Bernardino killer's iPhone,latimes.com,http://www.latimes.com/business/technology/la-fi-tn-apple-next-steps-20160330-story.html
2016-03-30,18:42:16,4ck2i2,14110,"'War on Drugs' has made no difference to number of users & actively harms public health, major study concludes - Report authors call for ""scientifically grounded"" policies, including regulated markets for cannabis",independent.co.uk,http://www.independent.co.uk/news/science/war-on-drugs-has-made-no-difference-to-number-of-users-and-actively-harms-public-health-major-study-a6956836.html
2016-03-30,23:16:06,4ckxok,8480,Fracking Triggers 90% of Large Quakes in Western Canada,telesurtv.net,http://www.telesurtv.net/english/news/Fracking-Triggers-90-of-Large-Quakes-in-Western-Canada-20160330-0007.html
2016-03-30,00:41:21,4cfzfx,6589,Turkey 'demands deletion' of German video mocking Erdoğan,theguardian.com,http://www.theguardian.com/world/2016/mar/29/turkey-german-video-mocking-president-recep-tayyip-erdogan
2016-03-30,10:41:36,4cinsl,3779,90% of Indigenous in Brazil's Amazon Suffer Mercury Poisoning,telesurtv.net,http://www.telesurtv.net/english/news/90-of-Indigenous-in-Brazils-Amazon-Suffer-Mercury-Poisoning--20160326-0028.html
2016-03-30,20:46:25,4ckecw,3536,Satire spat: Germany tells Turkey free speech not negotiable: A Foreign Ministry spokeswoman says German diplomats told their Turkish counterparts Tuesday there’s no chance the government will intervene over the song “Germany’s position on freedom of the press and expression isn’t negotiable.”,washingtonpost.com,https://www.washingtonpost.com/world/middle_east/satire-spat-germany-tells-turkey-free-speech-not-negotiable/2016/03/30/a1b95674-f66a-11e5-958d-d038dac6e718_story.html
2016-03-30,09:09:17,4ciapn,2944,Chinese government is arresting the families of Chinese critics and journalists abroad.,businessinsider.com,http://www.businessinsider.com/china-targets-families-of-critics-abroad-2016-3
2016-03-30,00:23:17,4cfwc2,2781,"Mass surveillance silences minority opinions, according to study",washingtonpost.com,https://www.washingtonpost.com/news/the-switch/wp/2016/03/28/mass-surveillance-silences-minority-opinions-according-to-study/?tid=pm_business_pop_b
2016-03-30,08:57:32,4ci8xu,1845,BBC Says Russia’s ‘Troll Factory’ Faked a Video Showing a US Soldier Shooting at a Quran,globalvoices.org,https://globalvoices.org/2016/03/23/bbc-says-russias-troll-factory-faked-a-video-showing-a-us-soldier-shooting-at-a-koran/
2016-03-30,18:39:02,4ck279,1550,"Costa Rican men convicted for killing conservationist & raping volunteers - 4 of 7 men sentenced for murder of Jairo Mora, who worked to protect sea turtles with 4 female volunteers. Savagery of attack dealt severe blow to the country’s image as a safe, eco-tourist-friendly destination.",theguardian.com,http://www.theguardian.com/world/2016/mar/29/costa-rico-murder-conviction-environmentalist-jairo-mora-rape-volunteers
2016-03-30,01:19:17,4cg5xf,1159,U.S. orders military families to leave parts of Turkey,reuters.com,http://www.reuters.com/article/us-usa-military-turkey-security-idUSKCN0WV1WO
2016-03-30,09:33:00,4cidz0,1012,"Scientists say a 305 million-year-old fossil is the closest relative to ""true spiders"" ever discovered - but is not itself a spider. Easily pre-dating the dinosaurs, the 1.5cm creature lived alongside the oldest known ancestors of modern spiders but its lineage is now extinct.",bbc.com,http://www.bbc.com/news/science-environment-35918234
2016-03-30,01:03:06,4cg33q,606,The politicians voting to impeach Brazil's president are accused of more corruption than she is,latimes.com,http://www.latimes.com/world/mexico-americas/la-fg-brazil-impeach-20160328-story.html
2016-03-30,17:18:12,4cjvja,605,"Former Canadian minister Jean Lapierre, his wife and three of his siblings killed in plane crash on way to father's funeral",abc.net.au,http://www.abc.net.au/news/2016-03-30/former-canadian-minister-jean-lapierre-killed-in-plane-crash/7285634
2016-03-30,03:38:16,4cgtpr,460,Brazil president closer to impeachment as coalition partner quits,theguardian.com,http://www.theguardian.com/world/2016/mar/29/brazil-president-dilma-rousseff-closer-impeachment-coalition-partner-quits
2016-03-30,14:06:37,4cjehy,397,Saudi authorities reportedly seek death penalty for coming out,washingtonblade.com,http://www.washingtonblade.com/2016/03/28/report-saudi-authorities-seek-death-penalty-for-coming-out/
2016-03-30,14:49:56,4cjivq,352,"Chinese journalist denounces president Xi Jinping in resignation letter: ""I’ve been kneeling so long I can’t bear it. I’d like to change posture""",theguardian.com,http://www.theguardian.com/world/2016/mar/29/chinese-journalist-denounces-xi-jinping-in-resignation-letter
2016-03-30,19:19:16,4ck5wu,326,$600 Million Worth Smuggling Operation Nailed by US and Hong Kong Authorities,60abc.com,http://60abc.com/600-million-worth-smuggling-operation-nailed-by-us-and-hong-kong-authorities/
2016-03-30,21:09:54,4ckgzg,318,Obama administration to allow Atlantic oil prospecting despite threat to marine life,theguardian.com,http://www.theguardian.com/environment/2016/mar/30/atlantic-ocean-oil-gas-prospecting-marine-life-threats-obama
2016-03-30,01:46:22,4cgacj,218,FBI warned Dutch about El Bakraoui brothers week before attacks,reuters.com,http://www.reuters.com/article/us-belgium-blast-netherlands-idUSKCN0WV1ZY?feedType=RSS&feedName=topNews&utm_source=twitter
2016-03-30,10:31:05,4cim8p,201,Several loud explosions followed by heavy gunfire were heard over Tripoli in the early hours of Wednesday,reuters.com,http://www.reuters.com/article/us-libya-security-idUSKCN0WW01A
2016-03-30,03:16:32,4cgpz2,192,"German prosecutor: Hard to convict 'Islamic State' returnees - Germany's top state prosecutor says often nothing can be proven against members of terrorist groups returning from war zones. ""Islamic State"" returnees can rarely be convicted on murder charges.",dw.com,http://www.dw.com/en/german-prosecutor-hard-to-convict-islamic-state-returnees/a-19148842?maca=en-TWITTER-EN-2004-xml-mrss
2016-03-30,21:33:20,4ckjnc,191,"Child labor rises sharply in Gaza: In the past five years, the number of working children between the ages of 10 and 17 has doubled.",news.trust.org,http://news.trust.org/item/20160330100256-unxo7/
2016-03-30,22:31:39,4ckrgj,148,"Associated Press willingly cooperated with the Nazis, new report shows",timesofisrael.com,http://www.timesofisrael.com/associated-press-willingly-cooperated-with-the-nazis-new-report-shows/
2016-03-30,15:33:25,4cjmy2,150,"Who do you think you are?, Erdoğan asks foreign diplomats attending espionage trial",dailysabah.com,http://www.dailysabah.com/politics/2016/03/26/who-do-you-think-you-are-erdogan-asks-foreign-diplomats-attending-espionage-trial
2016-03-30,16:21:30,4cjr3f,135,On Alert: Daesh Sends Mass Text Message to Muslims in Brussels,sputniknews.com,http://sputniknews.com/europe/20160330/1037176637/daesh-text-sms-propanda-brussels.html
2016-03-30,05:08:08,4ch91t,104,"US F-16 fighter jet crashes in Afghanistan, pilot ejects safely",dailysabah.com,http://www.dailysabah.com/asia/2016/03/29/us-f-16-fighter-jet-crashes-in-afghanistan-pilot-ejects-safely
2016-03-30,00:15:25,4cfv2l,104,"South Korea is planning to provide people with lifelong parenting education in the hope that it will prevent child abuse, it's reported.",bbc.com,http://www.bbc.com/news/blogs-news-from-elsewhere-35919014
