2016-03-16,20:13:04,4ani95,25777,"FIFA admits to World Cup hosting bribes, asks U.S. for return of money",usatoday.com,http://www.usatoday.com/story/sports/soccer/2016/03/16/fifa-admits-to-world-cup-hosting-bribes-asks-us-for-cash/81850202/
2016-03-16,20:57:42,4ano6b,11327,President Erdogan wants to change definition of ‘terrorist’ to include journalists and politicians,independent.co.uk,http://www.independent.co.uk/news/world/middle-east/turkey-s-president-erdogan-wants-definition-of-terrorist-to-include-journalists-as-three-academics-a6933881.html
2016-03-16,12:05:32,4am5t7,21339,North Korea Sentences US Tourist to 15 Years in Prison,abcnews.go.com,http://abcnews.go.com/International/wireStory/north-korea-sentences-us-tourist-15-years-prison-37680154
2016-03-16,05:24:56,4akjqo,9290,"The world's first solar airport no longer pays for electricity; 45 acres of panels supply approximately 50,000 kilowatt hours",money.cnn.com,http://money.cnn.com/2016/03/14/technology/india-cochin-solar-powered-airport/index.html?ii
2016-03-16,07:24:44,4al2ek,6131,"Argentina sinks Chinese vessel, cites illegal fishing",edition.cnn.com,http://edition.cnn.com/2016/03/15/americas/argentina-chinese-fishing-vessel/index.html
2016-03-16,21:05:33,4anp61,1976,"Puppy frozen in time for 12,400 years is thawed by scientists in remarkable footage",mirror.co.uk,http://www.mirror.co.uk/news/weird-news/puppy-frozen-time-12400-years-7565134
2016-03-16,22:16:40,4anzpl,1947,"Germany bans neo-Nazi group, carries out sweeping raids",news.yahoo.com,http://news.yahoo.com/germany-bans-neo-nazi-group-carries-sweeping-raids-130556100.html
2016-03-16,23:44:22,4aodp7,1865,"Feel Free To Leave India, Says Government to Monsanto In GM Cotton Row",profit.ndtv.com,http://profit.ndtv.com/news/corporates/article-feel-free-to-leave-india-says-government-to-monsanto-in-gm-cotton-row-1287871
2016-03-16,18:03:54,4an32n,1312,"Denmark world's happiest country, Burundi least: new report shows",feeds.reuters.com,http://feeds.reuters.com/~r/reuters/topNews/~3/38i-IjjjUps/story01.htm
2016-03-16,02:06:48,4ajmwt,1264,Israel seizes 234 hectares of West Bank land,news.yahoo.com,http://news.yahoo.com/israel-seizes-234-hectares-west-bank-land-officials-155125257.html
2016-03-16,20:18:32,4anj22,1160,Netherlands votes to ban weapons exports to Saudi Arabia,independent.co.uk,http://www.independent.co.uk/news/world/europe/netherlands-votes-to-ban-weapons-exports-to-saudi-arabia-a6933996.html
2016-03-16,19:23:11,4anbon,635,"NSW, Australia: Anti-coal seam gas protesters could be jailed for seven years under laws described as a ‘crackdown on democratic rights’",theguardian.com,http://www.theguardian.com/australia-news/2016/mar/16/anti-protest-laws-giving-police-greater-powers-pass-nsw-parliament
2016-03-16,01:36:32,4ajhw3,637,"More than 40 civilians killed in Yemen market by Saudi-led coalition air strike, health officials say",bbc.co.uk,http://www.bbc.co.uk/news/world-middle-east-35816958?ns_mchannel=social&ns_campaign=bbc_breaking&ns_source=twitter&ns_linkname=news_central
2016-03-16,18:06:50,4an3c6,627,"Chinese website publishes, then pulls, explosive letter calling for President Xi’s resignation",washingtonpost.com,https://www.washingtonpost.com/news/worldviews/wp/2016/03/16/government-linked-website-published-then-pulled-call-for-president-xis-resignation/
2016-03-16,23:54:44,4aofay,506,"Coke, Pepsi plan to fight Montreal on a possible plastic water bottle ban",cbc.ca,http://www.cbc.ca/beta/news/canada/montreal/montreal-plastic-water-bottle-ban-coke-pepsi-lobby-1.3493462
2016-03-16,17:09:32,4amylo,496,Rescuers: Female suicide bombers kill 22 at Nigerian mosque,bigstory.ap.org,http://bigstory.ap.org/article/c280ec9291154549b395f67e6ec50ffb/rescuers-female-suicide-bombers-kill-22-nigerian-mosque
2016-03-16,09:26:05,4alkca,428,Pakistan cricket captain Shahid Afridi accused of treason for suggesting his team gets a warmer welcome in India,smh.com.au,http://www.smh.com.au/sport/cricket/pakistan-captain-shahid-afridi-accused-of-treason-20160315-gnjd63.html
2016-03-16,10:34:22,4altxr,383,"Blood Lions documentary exposes controversial canned lion hunting industry in South Africa within which captive-bred, often hand-reared lions are placed in enclosed spaces on private hunting reserves guaranteeing a kill for a trophy hunter for $50,000",worldanimalnews.com,http://www.worldanimalnews.com/content.php?content_ID=677&utm_content=bufferb0a93&utm_medium=social&utm_source=twitter.com&utm_campaign=buffer
2016-03-16,20:04:48,4anh0r,324,"A powerful Syrian Kurdish political party is planning to declare a federal region in northern Syria, a model it hopes can be applied to the entire country",bigstory.ap.org,http://bigstory.ap.org/article/6bfb16dc44214b5bb8fb4bbb204e3589/another-group-russian-planes-leaves-syria-returns-home
2016-03-16,18:25:38,4an4yy,301,Saudi Arabia-led coalition kills 41 civilians in strike on market in Yemen,independent.co.uk,http://www.independent.co.uk/news/world/middle-east/saudi-arabia-coalition-market-yemen-war-crisis-a6932771.html
2016-03-16,21:58:47,4anx16,289,NASA will intentionally start a fire on a cargo ship in space,theverge.com,http://www.theverge.com/2016/3/16/11244364/nasa-saffire-test-fire-orbital-atk-cygnus-iss-resupply-mission
2016-03-16,21:15:54,4anqij,265,Canadian woman who successfully sued province for wrongful sterilization when she was a teen dies.,globalnews.ca,http://globalnews.ca/news/2580660/alberta-woman-who-successfully-sued-province-for-wrongful-sterilization-dies/
2016-03-16,04:16:01,4ak8cp,235,British academic detained in Turkey accused of 'making terrorist propaganda',hurriyetdailynews.com,http://www.hurriyetdailynews.com/british-academic-detained-by-istanbul-police-over-pkk-propaganda-.aspx?pageID=238&nid=96492
2016-03-16,04:42:13,4akcp0,207,Saudi Arabia 'planning Nato-like military alliance of Muslim states',independent.co.uk,http://www.independent.co.uk/news/world/middle-east/saudi-arabia-proposes-nato-like-military-alliance-of-muslim-states-reports-say-a6933056.html
2016-03-16,21:39:13,4antr3,192,Another Member of Berta Caceres’ Group Assassinated in Honduras,telesurtv.net,http://www.telesurtv.net/english/news/Another-Member-of-Berta-Caceres-Group-Assassinated-in-Honduras-20160315-0049.html
2016-03-16,19:55:11,4anfrb,142,FIFA says members sold World Cup votes multiple times,aljazeera.com,http://www.aljazeera.com/news/2016/03/fifa-members-sold-world-cup-votes-multiple-times-160316114324363.html
2016-03-16,02:32:54,4ajr61,116,Saudi-led air strikes kill 41 civilians in Yemen,reuters.com,http://www.reuters.com/article/us-yemen-security-idUSKCN0WH1X2
2016-03-16,02:16:05,4ajoel,115,Toronto police: Attacker said Allah told him to target troops,cnn.com,http://www.cnn.com/2016/03/14/world/toronto-knife-attack-canadian-armed-forces-recruitment-center/index.html
2016-03-16,17:50:43,4an1wp,104,Nigeria: Female Suicide Bombers Kill 22 at Mosque,time.com,http://time.com/4260776/nigeria-suicide-bomber-mosque-maiduguri/?xid=time_socialflow_twitter
2016-03-16,20:19:35,4anj6f,91,China has been building the equivalent of almost one university per week. It is part of a silent revolution that is causing a huge shift in the composition of the world's population of graduates.,bbc.com,http://www.bbc.com/news/business-35776555
