2016-12-08,21:31:22,5h6wr2,84215,Scientists slam Donald Trump's environment chief over climate denial: 'It's like disputing gravity',independent.co.uk,http://www.independent.co.uk/environment/donald-trump-scott-pruitt-climate-change-denial-environmental-protection-agency-epa-aaas-sierra-club-a7463046.html
2016-12-08,06:21:46,5h2zz2,40245,Police will be deployed to a village in Mexico after an invitation to a girl's birthday party went viral and 1.2 million people said they would attend.,bbc.com,http://www.bbc.com/news/world-latin-america-38235093
2016-12-08,11:41:18,5h4phq,3070,German court rules Muslim girls must take part in swimming lessons: Constitutional judges say schoolgirl cannot be excused mixed classes on grounds of Islamic dress codes,theguardian.com,https://www.theguardian.com/world/2016/dec/07/german-court-rules-against-muslim-girl-in-burkini-case
2016-12-08,10:19:23,5h4al4,2401,Giraffes facing 'silent extinction' as population plunges,bbc.com,http://www.bbc.com/news/science-environment-38240760
2016-12-08,21:56:31,5h7121,1823,German firms including BMW pull advertising from Breitbart site. Boycott comes as rightwing website plans to launch new services in France and Germany in time for pivotal 2017 elections.,theguardian.com,https://www.theguardian.com/world/2016/dec/08/breitbart-looks-to-france-and-germany-another-alt-right-victory-steve-bannon?CMP=twt_a-world_b-gdnworld
2016-12-08,18:06:48,5h65xf,1751,Le Pen: No free school for foreigners - French far-right leader Marine Le Pen calls for an end to free education for foreign children.,bbc.com,http://www.bbc.com/news/world-europe-38249570
2016-12-08,03:55:20,5h23hf,1376,Putin to Send Enough Wheat to Venezuela to Stop Food War,telesurtv.net,http://www.telesurtv.net/english/news/Putin-to-Send-Enough-Wheat-to-Venezuela-to-Stop-Food-War-20161206-0021.html
2016-12-08,03:19:55,5h1vr1,1281,"Iran has jailed 12 fashion bloggers and social media models for up to six years for spreading a ""Western-style culture of nudity""",9news.com.au,http://www.9news.com.au/world/2016/12/07/14/24/instagram-models-incarcerated-in-iran
2016-12-08,10:54:55,5h4h5q,1041,Cuba wants to sign accords with U.S. before Obama exit: officials,reuters.com,http://www.reuters.com/article/us-cuba-usa-idUSKBN13X00V
2016-12-08,01:01:52,5h11fc,763,"Police murdered drug-linked mayor in his jail cell, Philippine government investigation reveals",news.nationalpost.com,http://news.nationalpost.com/news/world/police-murdered-drug-linked-mayor-in-his-jail-cell-philippine-government-investigation-reveals
2016-12-08,20:55:12,5h6qxz,546,France's honest tax system crusader convicted for hiding millions of euros,theguardian.com,https://www.theguardian.com/world/2016/dec/08/france-honest-tax-system-crusader-jail-jerome-cahuzac
2016-12-08,11:25:27,5h4mqb,415,Groups Demand Arrest of 'War Mastermind' Kissinger at Nobel Peace Prize Forum: Nobel Peace Prize committee honors Kissinger a second time with speaking engagement at new forum on world peace,commondreams.org,http://www.commondreams.org/news/2016/12/07/groups-demand-arrest-war-mastermind-kissinger-nobel-peace-prize-forum
2016-12-08,04:31:30,5h2bix,374,"Brexit legal challenge: Scotland and Northern Ireland must consent to Article 50, Supreme Court told",independent.co.uk,http://www.independent.co.uk/news/uk/politics/brexit-legal-challenge-scotland-and-northern-ireland-must-consent-to-article-50-supreme-court-told-a7461721.html
2016-12-08,18:29:33,5h68lw,365,"Brexit: Banks in 'advanced talks' over mass move to Paris, says French regulator",independent.co.uk,http://www.independent.co.uk/news/business/news/brexit-banks-london-paris-move-uk-france-exodus-french-regulator-a7462731.html
2016-12-08,22:33:14,5h77g6,324,World Bank cancels $100 million loan for Pakistan,timesofindia.indiatimes.com,http://timesofindia.indiatimes.com/world/pakistan/World-Bank-cancels-100-million-loan-for-Pakistan/articleshow/55873422.cms
2016-12-08,11:00:56,5h4ibv,312,The first pirate politician in power in Iceland,bbc.com,http://www.bbc.com/future/story/20161207-the-first-pirate-politician-in-power
2016-12-08,02:52:33,5h1pi1,293,"Beijing burned through $69 billion in November as its currency came under pressure following Donald Trump's victory in the U.S. presidential election. China's foreign currency war chest fell below $3.1 trillion, the lowest level since March 2011, according to official data released Wednesday.",money.cnn.com,http://money.cnn.com/2016/12/07/investing/china-foreign-exchange-reserves-yuan-trump/index.html
2016-12-08,07:32:35,5h3em5,293,"Canada's 15-year-old students among best global performers in science, math",msn.com,https://www.msn.com/en-ca/news/canada/canadas-15-year-old-students-among-best-global-performers-in-science-math/ar-AAlefLy
2016-12-08,19:37:16,5h6go4,264,EU says member states can start deporting refugees and migrants back to Greece from March,independent.co.uk,http://www.independent.co.uk/news/world/europe/europe-refugees-migrants-greece-march-a7462921.html
2016-12-08,05:12:29,5h2kqk,221,Assange says texts show woman wanted to have sex with him,smh.com.au,http://www.smh.com.au/world/julian-assange-says-text-shows-he-is-entirely-innocent-of-sexual-assault-20161207-gt6dss.html
2016-12-08,20:15:47,5h6llg,217,"UK government distances itself from remarks that Saudi Arabia ""abuses Islam"" and is ""puppeteer in proxy wars""",theguardian.com,https://www.theguardian.com/politics/2016/dec/08/boris-johnsons-remarks-about-saudi-arabia-not-the-governments-view?CMP=Share_AndroidApp_reddit_is_fun
2016-12-08,18:34:23,5h694s,199,Dutch food industry to stop targeting children with cartoon-branded products,dutchnews.nl,http://www.dutchnews.nl/news/archives/2016/12/food-industry-to-stop-promoting-unhealthy-food-using-cartoon-characters/
2016-12-08,03:51:28,5h22p2,180,Italian Prime Minister Matteo Renzi has just submitted his resignation,bbc.com,http://www.bbc.com/news/world-europe-38235254
2016-12-08,19:32:11,5h6g2a,170,"Russia Sells $11 Billion Stake in Rosneft to Glencore, Qatar",bloomberg.com,https://www.bloomberg.com/news/articles/2016-12-07/glencore-qatar-fund-buy-russia-s-rosneft-stake-for-11-billion
2016-12-08,04:09:36,5h26ms,148,Drowning in Information: NSA Revelations From 262 Spy Documents,theintercept.com,https://theintercept.com/2016/12/07/drowning-in-information-nsa-revelations-from-262-spy-documents/
2016-12-08,18:01:41,5h65dm,113,Uganda is worried about the number of Chinese men marrying their women,qz.com,http://qz.com/857156/uganda-is-worried-about-the-number-of-chinese-men-marrying-their-women/
2016-12-08,04:57:51,5h2he6,112,Austrian government plans to jail and fine refugees who lie about nationalities,independent.co.uk,http://www.independent.co.uk/news/world/europe/refugee-crisis-austria-migrants-law-cabinet-jail-fine-prison-asylum-seekers-lying-nationality-syrian-a7460791.html
2016-12-08,17:15:02,5h609u,109,"Philippine President Duterte unveils his Trump impression, complete with profanities",independent.co.uk,http://www.independent.co.uk/news/world/asia/rodrigo-duterte-philippines-president-unveils-donald-trump-impression-a7462576.html
2016-12-08,23:49:44,5h7m7y,105,Canada province wants to give each of its citizens a basic income,independent.co.uk,http://www.independent.co.uk/news/world/americas/canda-universal-basic-income-prince-edward-island-pilot-programme-a7462916.html
2016-12-08,22:09:06,5h739h,102,"Human Rights Watch is calling for an arms embargo on Saudi Arabia over the war in Yemen, and says the United States might be complicit in ""atrocities"" there",abcnews.go.com,http://abcnews.go.com/International/wireStory/rights-group-us-complicit-yemen-atrocities-44058517
