2016-10-16,09:22:29,57ozdp,19878,Turkey legalizes cannabis production for medicinal and scientific purposes in 19 provinces,dailysabah.com,http://www.dailysabah.com/nation/2016/10/14/turkey-legalizes-cannabis-production-in-19-provinces
2016-10-16,00:05:19,57mfgu,33313,Doctors Without Borders refused a donation of one million vaccine doses from Pfizer: The heart of the refusal—which could well imperil children who would have received those vaccines—is a principled stand against the extremely high cost of many vaccines.',theatlantic.com,http://www.theatlantic.com/health/archive/2016/10/doctors-with-borders/503786/
2016-10-16,21:18:44,57r63u,37765,"UAE's Sheikh Mohammed fills his private plane with $354,000 of supplies and sends to Haiti",whatson.ae,http://whatson.ae/dubai/2016/10/sheikh-mohammed-fills-his-private-plane-with-aid-and-sends-it-to-haiti/
2016-10-16,11:03:52,57pe75,5530,Scientists just broke a fusion world record - and it lifts the bar for clean energy potential,sciencealert.com,http://www.sciencealert.com/new-fusion-world-record-lifts-the-bar-for-clean-energy-potential
2016-10-16,08:31:38,57orkp,2925,A giant jade stone weighing 175 tonnes has been uncovered by miners in Myanmar,bbc.com,http://www.bbc.com/news/world-asia-37670305
2016-10-16,05:23:58,57nwz5,2598,U.S. detects failed North Korean missile test: Pentagon,reuters.com,http://www.reuters.com/article/us-korea-north-usa-idUSKBN12F0S2?feedType=RSS&feedName=worldNews&utm_source=feedburner&utm_medium=feed&utm_campaign=Feed%3A+Reuters%2FworldNews+%28Reuters+World+News%29
2016-10-16,08:47:15,57otz7,2089,"Multiple missiles have been fired again at the U.S. Navy destroyer USS Mason while it was in international waters off of Yemen, U.S. officials said. The ship was unharmed by the attack.",abcnews.go.com,http://abcnews.go.com/International/missiles-fired-us-ship-off-yemen/story?id=42832766
2016-10-16,01:26:12,57msil,1653,"ISIS thwarts revolt in Mosul, drowns 58 people ahead of expected liberation battle",iraqinews.com,http://www.iraqinews.com/iraq-war/isis-thwarts-rebellion-plot-mosul-drowns-58-people-ahead-expected-liberation-battle/
2016-10-16,01:39:16,57muol,1362,Russian border patrol opens fire as North Korean fishing vessel crew resists search,rt.com,https://www.rt.com/news/362896-russian-border-patrol-north-korea/
2016-10-16,23:26:20,57rmm7,1207,Theresa May backs passport checks on pregnant women at hospitals in 'maternity tourism' crackdown.,independent.co.uk,http://www.independent.co.uk/news/uk/politics/theresa-may-passport-checks-pregnant-women-hospitals-approval-maternity-tourism-a7357521.html
2016-10-16,02:57:48,57n88e,943,"No extra money for NHS, Theresa May tells health chief despite public's expectation of extra health spending if Britain voted to leave the EU",theguardian.com,https://www.theguardian.com/politics/2016/oct/14/no-extra-money-for-nhs-theresa-may-tells-health-chief
2016-10-16,21:02:14,57r460,895,Putin dismisses U.S. hacking allegations as vote rhetoric,reuters.com,http://www.reuters.com/article/us-russia-usa-cybercrime-idUSKBN12G0H1?il=0
2016-10-16,15:37:38,57qbpi,875,"Physicists just discovered electrons behaving like light in graphene. ""The ability to manipulate electrons in a conducting material like light rays opens up entirely new ways of thinking about electronics""",sciencealert.com,http://www.sciencealert.com/physicists-just-spotted-electrons-in-graphene-behaving-like-light-only-better
2016-10-16,00:01:45,57mew4,838,National push needed in Germany to deport migrants with no right to stay: Merkel,uk.reuters.com,http://uk.reuters.com/article/uk-europe-migrants-germany-merkel-idUKKBN12F0G9
2016-10-16,10:10:01,57p6cy,824,Merkel: No British Access to Single Market Without Free Movement,newsweek.com,http://www.newsweek.com/no-british-access-single-market-without-free-movement-510317
2016-10-16,11:28:59,57phoi,713,France's Solution to Drug Addiction: the government debut Friday a facility where drug addicts can safely take drugs under medical supervision— the first of its kind in the country.,theatlantic.com,http://www.theatlantic.com/news/archive/2016/10/france-drugs/503789/
2016-10-16,18:57:52,57qsti,635,Isis loses 'prophesied' town of Dabiq to Syrian rebels in short battle,independent.co.uk,http://www.independent.co.uk/news/world/middle-east/isis-dabiq-loses-apocalyptic-prophesy-town-of-dabiq-to-syria-rebels-short-battle-a7363931.html
2016-10-16,23:15:28,57rl37,600,"Tens of Thousands Protest TTIP, CETA Across Europe",telesurtv.net,http://www.telesurtv.net/english/news/Tens-of-Thousands-Protest-TTIP-CETA-Across-Europe-20161015-0010.html
2016-10-16,16:52:25,57qid7,379,Over 50 missing warplanes found buried in central Turkey: Report - Fifty of 72 warplanes that went missing 70 years ago have reportedly been found buried under the former airport of the Central Anatolian province of Kayseri.,hurriyetdailynews.com,http://www.hurriyetdailynews.com/Default.aspx?pageID=238&nID=104962&NewsCatID=341
2016-10-16,06:00:13,57o2wk,344,Operation to retake Mosul from ISIS begins,dailysabah.com,http://www.dailysabah.com/mideast/2016/10/15/operation-to-retake-mosul-from-daish-begins-iraqi-media-claims
2016-10-16,07:43:27,57ojp0,312,"Mount Vesuvius eruption risk: Emergency plans to evacuate 700,000 finalised",independent.co.uk,http://www.independent.co.uk/news/world/europe/mount-vesuvius-emergency-evacuation-eruption-plans-finalised-a7360686.html
2016-10-16,23:33:50,57rnpr,258,"Anti-nuclear novice wins Japan election, blow to nuclear restarts",reuters.com,http://www.reuters.com/article/us-japan-nuclear-election-idUSKBN12G0HM
2016-10-16,11:56:13,57pld5,228,India and Russia signed billions of dollars of defense and energy deals on Saturday at a summit that sought to inject new life into a relationship that has been tested by shifting global alliances and conflict in the Middle East.,reuters.com,http://www.reuters.com/article/us-india-russia-idUSKBN12F0BP?feedType=RSS&feedName=topNews
2016-10-16,06:22:30,57o6ls,228,"Russia to the US: If you want a confrontation, 'you'll get one everywhere'",businessinsider.com,http://www.businessinsider.com/russia-us-confrontation-2016-10?utm_source=feedly&utm_medium=webfeeds
2016-10-16,11:55:46,57play,183,China to launch manned space mission Shenzhou 11 on Monday,reuters.com,http://www.reuters.com/article/us-china-space-idUSKBN12G00X
2016-10-16,07:17:55,57oflk,175,Russia's U.N. ambassador said that tensions with the United States are probably the worst since the 1973 Mideast war.,abcnews.go.com,http://abcnews.go.com/US/wireStory/russia-envoy-tensions-us-worst-1973-42822802
2016-10-16,18:12:30,57qp2e,147,"Turkish-backed FSA captures Dabiq, Soran from ISIL",hurriyetdailynews.com,http://www.hurriyetdailynews.com/turkish-backed-fsa-captures-dabiq-soran-from-isil-.aspx?pageID=238&nID=105005&NewsCatID=352
2016-10-16,20:39:47,57r20k,123,Mothers of missing Dagestanis decide to set up public movement - The women-participants of the rally in Khasavyurt have called on all women of the Caucasus to unite against kidnappings and extrajudicial executions of their children and husbands,eng.kavkaz-uzel.eu,http://www.eng.kavkaz-uzel.eu/articles/37219/
2016-10-16,14:36:06,57q5h8,97,This weekend the Schiaparelli lander will begin a dramatic descent to the surface of Mars.,bbc.co.uk,http://www.bbc.co.uk/newsround/37660365
2016-10-16,05:30:28,57ny1q,83,Merkel wants to beef up sanctions against Russia due to its role in Syria,reuters.com,http://www.reuters.com/article/us-ukraine-crisis-russia-sanctions-idUSKBN12F0PM
