2016-06-04,17:00:19,4mheit,17168,Broadband access to be made a legal right in Ireland,siliconrepublic.com,https://www.siliconrepublic.com/comms/national-broadband-plan-right-ireland
2016-06-04,23:02:54,4mif98,26774,Norway becomes first country in the world to commit to zero deforestation,independent.co.uk,http://www.independent.co.uk/news/world/europe/norway-becomes-first-country-in-the-world-to-commit-to-zero-deforestation-a7064056.html
2016-06-04,01:06:07,4mdkxw,8760,"One in three young South Africans victims of sexual abuse, report finds. Boys at higher risk than girls, with few safeguards in place to protect them",theguardian.com,http://www.theguardian.com/world/2016/jun/03/one-in-three-young-south-africans-victims-of-sexual-abuse-study-finds
2016-06-04,21:59:43,4mi7iq,4580,Pope Francis gives Vatican authority to initiate removal of bishops who don't act on sexual abuse cases,ncronline.org,http://ncronline.org/news/accountability/francis-gives-vatican-authority-initiate-removal-bishops-negligent-sexual-abuse
2016-06-04,00:04:37,4mda23,4437,"Jeremy Corbyn: I Would Kill TTIP: In speech campaigning against Brexit, Labour leader vows to reject corporate-friendly EU-U.S. trade deal",commondreams.org,http://www.commondreams.org/news/2016/06/02/jeremy-corbyn-i-would-kill-ttip
2016-06-04,10:28:11,4mg5kc,3320,"Sudden appearance of crater dubbed ‘the Gateway to the Underworld’ in Siberia is a warning to our warming planet: Such slumps have been ‘increasing in extent and intensity’ in the frozen north, scientists say",independent.co.uk,http://www.independent.co.uk/environment/gateway-to-the-underworld-siberia-batagaika-siberia-russia-permafrost-melting-a7063936.html
2016-06-04,17:24:56,4mhgpi,2017,"Democracy is nothing to fear, Taiwan tells China on Tiananmen anniversary",reuters.com,http://www.reuters.com/article/idUSKCN0YQ07Y
2016-06-04,22:45:55,4mid12,1762,"Thai police have charged 22 people, including three Buddhist monks, with wildlife trafficking and removed more dead animals including a bear and a leopard from the infamous Tiger Temple, authorities said on Friday.",businessinsider.com,http://www.businessinsider.com/r-thai-police-charge-22-with-wildlife-trafficking-at-tiger-temple-2016-6
2016-06-04,00:56:34,4mdj78,1057,"The British Government is creating a secret database by stitching together all of its records on the public (including passports and ANPR cameras), and doing so without informing Parliament",theregister.co.uk,http://www.theregister.co.uk/2016/06/03/home_office_mega_database/
2016-06-04,11:01:02,4mg9z2,910,"Former FIFA President Sepp Blatter and two other top officials gave themselves annual raises and World Cup bonuses totaling nearly $80 million over the past five years, according to attorneys working for soccer's governing body.",npr.org,http://www.npr.org/sections/thetwo-way/2016/06/03/480625592/ex-fifa-head-blatter-2-others-allegedly-gave-themselves-80-million
2016-06-04,21:52:44,4mi6pd,730,India's PM Modi inaugurates $290m dam in Afghanistan,tribune.com.pk,http://tribune.com.pk/story/1116222/indias-modi-inaugurates-290-mn-dam-afghanistan/
2016-06-04,21:25:53,4mi3l4,677,"Cancer is entering a ""new era"" of personalised medicine with drugs targeted to the specific weaknesses in each patient's tumour, say doctors.",bbc.com,http://www.bbc.com/news/health-36447289
2016-06-04,01:14:06,4mdmgl,672,US Launches Raids On IS From Aircraft Carrier,news.sky.com,http://news.sky.com/story/1706519/us-launches-raids-on-is-from-aircraft-carrier
2016-06-04,14:52:43,4mh2ev,652,"Philippines police given more than $4,000 for killing drug traffickers — the first such rewards since president-elect Rodrigo Duterte promoted bounties for criminals.",abc.net.au,http://www.abc.net.au/news/2016-06-04/philippines-police-officers-rewarded-with-first-kill-bounties/7477548
2016-06-04,11:19:52,4mgcg7,363,Iran's Top Leader Rules Out Cooperation With US Against ISIS,abcnews.go.com,http://abcnews.go.com/International/wireStory/irans-top-leader-rules-cooperation-us-39579667?cid=abcn_tco
2016-06-04,01:27:59,4mdoxx,299,"Sepp Blatter and Deputies Arranged Huge Payouts After Indictments, FIFA Says: FIFA said three former top officials arranged to pay themselves more than $80 million over the past five years.",nytimes.com,http://www.nytimes.com/2016/06/04/sports/soccer/fifa-corruption-sepp-blatter-jerome-valcke.html
2016-06-04,11:09:36,4mgb2q,280,Activists openly mark Tiananmen crackdown on China’s streets,atimes.com,http://atimes.com/2016/06/activists-openly-mark-tiananmen-crackdown-on-chinas-streets/
2016-06-04,16:41:41,4mhcxb,271,US vows 'actions' if China builds new S. China Sea structures,yahoo.com,https://www.yahoo.com/news/china-risks-great-wall-self-isolation-pentagon-chief-014737996.html
2016-06-04,05:53:15,4mezrk,255,Many gas stations in Canada are experiencing a gas shortage due to the Fort McMurray wildfire continuing to spread,cbc.ca,http://www.cbc.ca/beta/news/canada/calgary/gas-stations-petro-canada-shortage-refinery-1.3614301
2016-06-04,01:01:33,4mdk32,231,"Siberia's tattooed princess revealed: 2,500-year-old mummy to go on public display, but will be draped in fur to hide her modesty",dailymail.co.uk,http://www.dailymail.co.uk/sciencetech/article-3623874/Siberia-s-tattooed-princess-revealed-2-500-year-old-mummy-public-display-draped-fur-hide-modesty.html?ito=social-twitter_mailonline
2016-06-04,16:41:49,4mhcxp,229,Mexican officials exhume 117 corpses from common grave,foxnews.com,http://www.foxnews.com/world/2016/06/03/mexican-officials-exhume-117-corpses-from-common-grave.html
2016-06-04,19:21:39,4mhr74,215,Thousands protest violence against women in Argentina after 3 girls slain,cbc.ca,http://www.cbc.ca/news/world/argentina-niunamenos-protests-violence-women-1.3616373
2016-06-04,22:02:14,4mi7s8,211,U.S. says has information on plans for terrorist attacks in South Africa,reuters.com,http://www.reuters.com/article/us-usa-safrica-idUSKCN0YQ0GU?il=0
2016-06-04,08:32:18,4mfpf7,202,U.S. fails to revive Iraqi army,reuters.com,http://www.reuters.com/article/idUSKCN0YP2DO
2016-06-04,07:01:36,4mfbii,153,Chile Producing So Much Solar Energy It’s Giving Electricity Away for Free,ecowatch.com,https://ecowatch.com/2016/06/03/chile-solar-energy/
2016-06-04,22:54:34,4mie56,140,Erdogan says Armenian genocide charges 'blackmail' of Turkey,thepeninsulaqatar.com,http://www.thepeninsulaqatar.com/news/middle-east/384100/erdogan-says-armenian-genocide-charges-blackmail-of-turkey
2016-06-04,06:27:24,4mf5pp,141,"The battle for Falluja: 'If they lose it, Isis is finished' Tens of thousands of lives – and the future of Iraq – are at stake as the country’s forces and Shia militias fight Isis for the city",theguardian.com,http://www.theguardian.com/world/2016/jun/03/battle-for-falluja-isis-iraq-shia-militias?utm_medium=twitter
2016-06-04,03:41:22,4mecnh,131,Justin Trudeau 'dissatisfied' with how Chinese minister treated journalist,theguardian.com,http://www.theguardian.com/world/2016/jun/03/justin-trudeau-wang-yi-canadian-journalist-amanda-connolly
2016-06-04,09:09:45,4mfus8,128,"Iran's supreme leader says US, 'evil' Britain remain main enemies",zeenews.india.com,http://zeenews.india.com/news/world/irans-supreme-leader-says-us-evil-britain-remain-main-enemies_1891338.html
2016-06-04,15:38:44,4mh75u,122,Scientists discover beginnings of a volcano growing underneath a New Zeland town,theguardian.com,http://www.theguardian.com/world/2016/jun/04/the-new-zealand-town-with-a-volcano-growing-underneath-it
