2016-10-26,04:05:49,59cvti,20421,Canada's largest pharmacy chain formally applies to distribute medical marijuana,cbc.ca,http://www.cbc.ca/news/business/shoppers-drug-mart-medical-marijuana-1.3820131
2016-10-26,20:30:01,59h08k,22361,"Iran's top Quran reciter to face court over child rapes, ""threatened to leak the names of 100 of Iran’s high profile officials also implicated in raping and molesting children""",english.alarabiya.net,http://english.alarabiya.net/en/News/middle-east/2016/10/24/Iran-s-top-Quran-reciter-to-face-court-over-child-rapes.html
2016-10-26,05:04:31,59d7pg,15756,"Dutch unveil giant vacuum to clean outside air. The system is said to be able to suck in air from a 300-metre radius, and from up to 7 kilometres upwards. It can treat some 800,000 cubic metres of air an hour, filtering out 100 percent of fine particles and 95 percent percent of ultra-fine particles",france24.com,http://www.france24.com/en/20161025-dutch-unveil-giant-vacuum-clean-outside-air
2016-10-26,01:52:47,59c42v,16534,Norway welcomes US Marines amid Russian tensions,edition.cnn.com,http://edition.cnn.com/2016/10/18/politics/marines-norway-russia/index.html
2016-10-26,03:12:45,59ckyw,5452,Saddam Hussein's cousin arrested for participating in a terrorist attack that left 90 dead. He was found in an empty water storage tank,en.abna24.com,http://en.abna24.com/service/middle-east-west-asia/archive/2016/10/25/787778/story.html
2016-10-26,19:59:35,59gwgy,2458,"EU drops law to limit cancer-linked chemical in food after industry complaint. Campaigners say leaked documents show ‘undue influence’ by the food industry after plans to limit acrylamide - found in starchy foods such as crisps, cereals and baby foods - are weakened.",theguardian.com,https://www.theguardian.com/environment/2016/oct/26/eu-drops-law-to-limit-cancer-linked-chemical-acrylamide-food-after-industry-complaint
2016-10-26,21:50:22,59hbpo,2125,Spain urged not to allow refuelling of Russian warships - BBC News,bbc.com,http://www.bbc.com/news/world-europe-37773606
2016-10-26,01:58:59,59c5d2,2074,Chinese officials found guilty of falsifying air quality data,en.people.cn,http://en.people.cn/n3/2016/1025/c90000-9132459.html
2016-10-26,07:53:08,59e4vk,1993,Hamburg teenagers walk free after gang-rape conviction: Teens handed suspended sentences despite video evidence of their crimes. The presiding judge said the perpetrators appeared 'repentant.',dw.com,http://www.dw.com/en/hamburg-teenagers-walk-free-after-gang-rape-conviction/a-36142782
2016-10-26,23:32:35,59htq0,1866,"A $100m initiative to listen for signals from alien life is targeting a star with an unusual dimming pattern. The Breakthrough Initiative, backed by Prof Stephen Hawking and Facebook's Mark Zuckerberg, will train a US radio telescope on a target called Tabby's Star.",bbc.com,http://www.bbc.com/news/science-environment-37777731
2016-10-26,06:27:39,59dom0,1676,Hacked: Putin Aide’s Emails Detail Alleged Plot to Destabilize Ukraine,foreignpolicy.com,https://foreignpolicy.com/2016/10/25/hacked-putin-aides-emails-detail-alleged-plot-to-destabilize-kiev-surkov-ukraine-leaks/
2016-10-26,08:53:34,59efuw,1673,WHO cancer agency asked experts to withhold weedkiller documents they were asked to release under United States freedom of information laws,reuters.com,http://www.reuters.com/article/us-health-cancer-iarc-exclusive-idUSKCN12P2FW
2016-10-26,00:08:20,59biv4,1665,"Catholics are forbidden from keeping the ashes of cremated loved ones at home, scattering them, dividing them between family members or turning them into mementoes, the Vatican has ruled.",amp.theguardian.com,https://amp.theguardian.com/world/2016/oct/25/vatican-bans-catholics-cremation-ashes-loved-ones-home
2016-10-26,13:10:57,59fm3b,1235,Australian census outage (costing $30m) could have been prevented by turning router on and off again: IBM,abc.net.au,http://www.abc.net.au/news/2016-10-25/turning-router-off-and-on-could-have-prevented-census-outage/7963916
2016-10-26,23:23:16,59hry0,1022,Rodrigo Duterte Says He Wants All Foreign Troops Out Of Philippines,npr.org,http://www.npr.org/sections/thetwo-way/2016/10/26/499423683/rodrigo-duterte-says-he-wants-all-foreign-troops-out-of-philippines
2016-10-26,01:24:51,59byct,812,"Docs from a hacked email account reportedly belonging to Vladislav Surkov, an aide of Russian President Vladimir Putin, are similar to instructions seized by the Ukrainian Security Service (SBU) agents from organizers of a separatist movement in Zakarpattya, head of the SBU’s personnel department",kyivpost.com,https://www.kyivpost.com/ukraine-politics/sbu-verifies-authenticity-leaked-documents.html
2016-10-26,13:16:50,59fmyx,664,"A third African country, Gambia, says it will leave the International Criminal Court as fears grow of a mass pullout from the body that pursues some of the world's worst atrocities.Gambia accused the court of unfairly targeting Africa and calling it the ""international Caucasian court.""",bigstory.ap.org,http://bigstory.ap.org/article/c597409117b04a2da0d131de9584308f/gambia-says-it-leaving-international-criminal-court
2016-10-26,08:18:45,59e9i2,656,"U.S. State Dept. ""troubled"" by 18-year sentence handed down to U.S. citizen in Iran",foreigndesknews.com,http://www.foreigndesknews.com/world/middle-east/u-s-state-dept-troubled-18-year-sentence-handed-u-s-citizen-iran/
2016-10-26,01:56:45,59c4w5,485,Turkey spying on its citizens using deep packet inspection,forbes.com,http://www.forbes.com/sites/thomasbrewster/2016/10/25/procera-francisco-partners-turkey-surveillance-erdogan/
2016-10-26,09:08:02,59eif8,379,NATO seeks troops to deter Russia on eastern flank | NATO will press allies on Wednesday to contribute to its biggest military build-up on Russia's borders since the Cold War as the alliance prepares for a protracted quarrel with Moscow,reuters.com,http://www.reuters.com/article/us-nato-russia-idUSKCN12P31W
2016-10-26,03:41:22,59cqzj,381,PM says Italy cannot handle rate of migrant arrivals,reuters.com,http://www.reuters.com/article/us-europe-migrants-italy-idUSKCN12P2LH?il=0
2016-10-26,02:05:02,59c6pp,375,"Detainees 'beaten, sexually abused and threatened with rape' after Turkey coup, Human Rights Watch claims",independent.co.uk,http://www.independent.co.uk/news/world/europe/detainees-beaten-sexually-abused-and-threatened-with-rape-after-failed-turkey-coup-gives-blank-check-a7379526.html
2016-10-26,18:05:10,59gk95,326,U.S. Stuck With Nobody Left to Sanction in Russia Over Syria,bloomberg.com,http://www.bloomberg.com/news/articles/2016-10-26/u-s-stuck-with-nobody-left-to-sanction-in-russia-over-syria
2016-10-26,03:01:11,59cigx,314,"A leak at a small nuclear reactor in Norway has been contained, with no injuries sustained and no expected environmental damage outside the facility, the reactor's operator and the country's Radiation Protection Authority (NRPA) said on Tuesday.",in.reuters.com,http://in.reuters.com/article/us-norway-accident-nuclear-idINKCN12P13Y
2016-10-26,11:29:23,59f6eg,258,"Strict speed enforcement detrimental to road safety, study finds",abc.net.au,http://www.abc.net.au/news/2016-10-26/speed-enforcement-detrimental-to-road-safety-study-finds/7965082
2016-10-26,16:48:00,59gcfa,248,Afghanistan’s green-eyed Mona Lisa arrested in Pakistan,en.dailypakistan.com.pk,https://en.dailypakistan.com.pk/pakistan/afghans-green-eyed-mona-lisa-arrested/
2016-10-26,13:10:57,59fm3f,220,NATO will press allies on Wednesday to contribute to its biggest military build-up on Russia's borders since the Cold War as the alliance prepares for a protracted quarrel with Moscow.,mobile.reuters.com,http://mobile.reuters.com/article/amp/idUSKCN12P31W
2016-10-26,18:42:29,59gnye,224,Iran rocked by abuse allegations against top Qur'an reciter. Complainants use banned media outlets to accuse Saeed Toosi of sexually abusing them when they were aged 12 to 13,theguardian.com,https://www.theguardian.com/world/2016/oct/26/iran-abuse-allegations-quran-reciter-saeed-toosi
2016-10-26,02:34:18,59ccwc,151,"58,000 basic income supporters hope to force a parliamentary debate [Netherlands]",dutchnews.nl,http://www.dutchnews.nl/news/archives/2016/10/58000-basic-income-supporters-hope-to-force-a-parliamentary-debate/
2016-10-26,19:25:26,59gsn2,134,The Vatican’s Treasurer Has Been Interviewed by Australian Police Over Child Sex Abuse Claims,time.com,http://time.com/4545789/australia-vatican-treasurer-cardinal-george-pell-child-sex-abuse/?xid=IFT-Section
