2016-09-04,16:33:17,5131pt,12110,"Hundreds of child refugees have vanished since arriving in the UK, prompting trafficking and abuse fears",independent.co.uk,http://www.independent.co.uk/news/uk/home-news/hundreds-of-child-refugees-missing-syria-alan-kurdi-aylan-theresa-may-have-vanished-since-arriving-a7222456.html
2016-09-04,11:22:43,5122lf,7644,China’s leaders have been accused of delivering a calculated diplomatic snub to Barack Obama after the US president was denied a red-carpet welcome during his chaotic arrival in Hangzhou ahead of the start of the G20.,theguardian.com,https://www.theguardian.com/world/2016/sep/04/barack-obama-deliberately-snubbed-by-chinese-in-chaotic-arrival-at-g20?CMP=twt_a-world_b-gdnworld
2016-09-04,00:17:53,50z8k6,4880,"France's Le Pen: If I'm elected, we'll hold vote on leaving EU",thehill.com,http://thehill.com/blogs/blog-briefing-room/news/294399-frances-le-pen-if-im-elected-well-hold-vote-on-leaving-eu
2016-09-04,05:28:43,510mvy,4553,Rio panic over Paralympics as ticket prices slashed to £2.30,theguardian.com,https://www.theguardian.com/sport/2016/sep/03/rio-de-janeiro-paralympics-tickets-slashed
2016-09-04,05:13:13,510kfk,4377,South Africa’s murder rate climbs 4.9 per cent to 51 people killed every day,independent.co.uk,http://www.independent.co.uk/news/world/africa/south-africa-murder-rate-51-killed-every-day-rise-49-per-cent-a7224176.html
2016-09-04,23:16:39,51457c,2303,"Inuit Are Embedding Sensors in the Ice Because It's Getting Dangerously Thin: ...because of climate change, the ice is turning to slush. In many places, it's becoming unsafe. So two Arctic communities are installing high-tech sea ice monitors that can track changes in the ice.",motherboard.vice.com,http://motherboard.vice.com/read/arctic-climate-change-smartice-nain-labrador-pond-inlet
2016-09-04,08:15:10,511cd0,2266,Egypt MP Says Women Must Accept FGM Due to Country’s ‘Sexually Weak’ Men,egyptianstreets.com,http://egyptianstreets.com/2016/09/03/egypt-mp-says-women-must-accept-fgm-due-to-countrys-sexually-weak-men/
2016-09-04,05:58:35,510rnc,2041,"Venezuela's president chased by angry, pot-banging protesters",independent.co.uk,http://www.independent.co.uk/news/world/americas/venezuelas-president-nicholas-maduro-chased-by-angry-pot-banging-protesters-margarita-island-a7224386.html
2016-09-04,04:54:47,510hdl,1475,"Chinese official confronts President Obama's delegation, attempts to disrupt open access to media on airport Tarmac.",mobile.reuters.com,http://mobile.reuters.com/article/idUSKCN1190AT
2016-09-04,05:32:07,510nfm,1105,"ISIS will be wiped out this year, says Prime Minister Abadi",iraqinews.com,http://www.iraqinews.com/iraq-war/isis-will-wiped-out-this-year-says-abadi/
2016-09-04,19:42:31,513i35,985,"The EU's ruling that Apple Inc must pay a huge tax bill to Ireland was clearly based on facts and existing rules and was not a decision aimed against the United States, European Commission President Jean-Claude Juncker said on Sunday.",ibtimes.com,http://www.ibtimes.com/eus-juncker-says-apple-tax-decision-clearly-based-facts-rules-2411283
2016-09-04,09:33:07,511nha,819,Defiant Merkel says refugees not taking away benefits from Germans,yahoo.com,https://www.yahoo.com/news/defiant-merkel-says-refugees-not-taking-away-benefits-112730370.html
2016-09-04,07:56:23,5119lo,667,Britons warned of travel chaos as French lorry drivers vow to strike over Calais 'Jungle' | British holidaymakers are set to face chaos as French lorry drivers get set to stage a defiant protest over the notorious Calais ‘Jungle’ camp warning they are “in it for the long haul”.,express.co.uk,http://www.express.co.uk/news/uk/707027/Calais-Jungle-migrant-camp-french-lorry-drivers-strike-British-travellers
2016-09-04,20:10:47,513kma,595,"In bloodiest day in years, Turkey pounds Kurdish forces near Iraq border",haaretz.com,http://www.haaretz.com/middle-east-news/turkey/1.740122
2016-09-04,17:42:45,5137pw,538,"British warship sent to Libya to target people-smugglers | HMS Diamond, a Type-45 destroyer equipped with a 4.5-inch gun, missiles and fast-firing cannon, will join an EU flotilla, Operation Sophia, tasked with catching smugglers at sea",theguardian.com,http://www.theguardian.com/politics/2016/sep/03/uk-warship-to-tackle-libya-people-smugglers
2016-09-04,22:35:52,513zvg,471,80% of the Australian Public Service will be going on strike this Friday,canberratimes.com.au,http://www.canberratimes.com.au/national/public-service/massive-public-service-strike-looms-20160822-gqy8jz.html
2016-09-04,19:08:52,513f1h,447,EU president: Europe ‘close to limits’ on refugee influx,timesofisrael.com,http://www.timesofisrael.com/eu-president-europe-close-to-limits-on-refugee-influx/
2016-09-04,08:47:53,511h1o,425,"The anti-immigrant Alternative for Deutschland (AfD) party is expected by polls to make huge gains in the Mecklenburg-Vorpommern state election on Sunday, reflecting a growing discontent with Chancellor Angela Merkel and her open-door refugee policy",reuters.com,http://www.reuters.com/article/us-germany-election-idUSKCN1190XG?il=0
2016-09-04,07:18:08,5113wc,364,Hong Kong voters' addresses changed by pro-Beijing organisations without their knowledge,hongkongfp.com,https://www.hongkongfp.com/2016/09/03/voters-addresses-changed-pro-beijing-organisations-without-knowledge/
2016-09-04,08:43:55,511ghg,334,Obama urges China's Xi to respect the South China Sea ruling,newsweek.com,http://www.newsweek.com/obama-urges-jinping-respect-south-china-sea-ruling-495595
2016-09-04,22:21:40,513y2w,293,Mother Teresa declared a saint by Pope Francis,cnn.com,http://www.cnn.com/2016/09/04/europe/mother-teresa-canonization/index.html
2016-09-04,17:57:59,51390d,270,German interior minister floats idea of returning migrants to Greece,dw.com,http://www.dw.com/en/german-interior-minister-floats-idea-of-returning-migrants-to-greece/a-19525482
2016-09-04,00:59:05,50zeub,300,"The first stars in the universe had formed much later than what early observations of the cosmic microwave background led scientists to believe, the European Space Agency has said | A new analysis was carried out using the agency's Planck satellite.",techtimes.com,http://www.techtimes.com/articles/176212/20160903/first-stars-formed-hundreds-of-millions-of-years-later-than-previously-thought-esa.htm
2016-09-04,09:25:39,511mdz,192,Government shuts down internet in Gabon for five days as tensions rise following controversial presidential elections,qz.com,http://qz.com/771996/gabon-is-the-latest-african-country-to-shut-down-its-internet-as-election-protests-grow/
2016-09-04,01:07:50,50zg7i,184,"Thousands of Kurds, including many carrying flags with the image of jailed PKK leader Abdullah Ocalan, demonstrated in the German city of Cologne Saturday against the Turkish government's policies.",abcnews.go.com,http://abcnews.go.com/International/wireStory/thousands-kurds-demonstrate-cologne-germany-41842371
2016-09-04,20:09:40,513kid,148,"British MP, Keith Vaz, found to have paid for two male escorts",bbc.co.uk,http://www.bbc.co.uk/news/uk-politics-37269919
2016-09-04,00:56:38,50zeh5,137,"A Romanian hacker who targeted the Bush family, Colin Powell, and others has been sentenced to more than four years in prison, but will be sent to Romania to serve time on a prison sentence there first | Marcel Lazar, 44, aka Guccifer went on a hacking spree that enveloped roughly 100 victims.",miami.cbslocal.com,http://miami.cbslocal.com/2016/09/03/hacker-who-targeted-clinton-bush-family-gets-4-years-in-prison/
2016-09-04,08:43:11,511gcx,124,Hong Kong votes in first major poll since pro-democracy protests,bbc.com,http://www.bbc.com/news/world-asia-china-37269279?ocid=socialflow_twitter
2016-09-04,03:01:40,50zydn,118,"Turkish tanks roll into Syria, opening new line of attack",reuters.com,http://www.reuters.com/article/us-mideast-crisis-syria-turkey-idUSKCN1190GT
2016-09-04,20:04:35,513k0v,113,Plans to deny surgery to obese patients and smokers put on hold,theguardian.com,https://www.theguardian.com/society/2016/sep/03/vale-of-york-nhs-obesity-smokers-deny-elective-surgery
