2016-02-06,08:56:34,44dw8l,14161,UN Demands Zika-Infected Countries Give Women Access To Abortion And Birth Control,thinkprogress.org,http://thinkprogress.org/health/2016/02/05/3746661/un-birth-control-zika/
2016-02-06,22:12:22,44gc1s,6979,First abortion in Colombia possibly as result of Zika: A woman struggled to find a doctor willing to provide an abortion after it was discovered her fetus suffered from microcephaly.,telesurtv.net,http://www.telesurtv.net/english/news/First-Abortion-in-Colombia-Possibly-as-Result-of-Zika-20160206-0004.html
2016-02-06,20:36:31,44g0yf,8099,"Muslim women ""blocked from seeking office by male Labour councillors"" - Muslim Women's Network say the national Labour party is ""complicit"" in local male Muslim councillors' ""systematic misogyny""",independent.co.uk,http://www.independent.co.uk/news/uk/politics/leading-womens-rights-organisation-says-muslim-women-blocked-from-seeking-office-by-male-labour-a6857096.html
2016-02-06,14:52:37,44f5rq,4476,Pirate Bay Transforms into The World's Biggest Streaming Site,torrentfreak.com,https://torrentfreak.com/pirate-bay-transforms-into-the-worlds-biggest-streaming-site-160205/
2016-02-06,06:20:41,44d7jx,4474,China confirms it's holding three missing Hong Kong booksellers,time.com,http://time.com/4208964/china-hong-kong-booksellers/
2016-02-06,04:52:15,44ct5u,4103,Magnitude 6.7 earthquake hits Tainan in Taiwan – residential block close to collapse,dailystar.co.uk,http://www.dailystar.co.uk/news/latest-news/492794/huge-earthquake-in-Taiwan
2016-02-06,21:02:35,44g3ll,3177,"Ric O'Barry, the star of an Oscar-winning documentary that shows how dolphins are hunted in a Japanese village was deported to the U.S. on Friday after Tokyo airport officials barred his entry and he was held in detention for more than two weeks.",japantoday.com,http://www.japantoday.com/category/national/view/japan-deports-ric-obarry
2016-02-06,04:57:28,44cu38,2685,Cardinal George Pell 'too ill' to travel from Rome for child sex abuse inquiry,abc.net.au,http://www.abc.net.au/news/2016-02-05/cardinal-george-pell-too-ill-to-child-sex-abuse-inquiry-lawyers/7140584
2016-02-06,03:10:49,44cbvh,2383,Russian prosecutors have begun considering whether media coverage of the unexpected friendship between a male tiger and goat at a safari park in the country’s far east counts as gay propaganda.,theguardian.com,http://www.theguardian.com/world/2016/feb/05/russian-lawyers-accuse-unlikely-animal-chums-of-gay-propaganda
2016-02-06,02:34:26,44c5bt,1888,"New Law In London Would Fine Homeless £1,000 For Sleeping Outside Or ""Loitering""",activistpost.com,http://www.activistpost.com/2016/02/new-law-in-london-would-fine-homeless-1000-for-sleeping-outside-or-loitering.html
2016-02-06,21:38:44,44g7sw,1530,NASA Warns That Closest-Ever Asteroid Will Pass Earth Next Month (17000km),yournewswire.com,http://yournewswire.com/nasa-warns-that-closest-ever-asteroid-will-pass-earth-next-month/
2016-02-06,20:47:21,44g21h,1292,"Number of Syrian refugees heading for Turkey border nearly doubles, 35,000 in past 24 hours, Turkish official says",bbc.co.uk,http://www.bbc.co.uk/news/world-middle-east-35512498
2016-02-06,07:47:48,44dlji,622,The British want to come to America — with wiretap orders and search warrants,washingtonpost.com,https://www.washingtonpost.com/world/national-security/the-british-want-to-come-to-america--with-wiretap-orders-and-search-warrants/2016/02/04/b351ce9e-ca86-11e5-a7b2-5a2f824b02c9_story.html
2016-02-06,05:13:25,44cwre,556,Nearly 200 images released by US military depict Bush-era detainee abuse,theguardian.com,http://www.theguardian.com/us-news/2016/feb/05/us-military-bush-era-detainee-abuse-photos-released-pentagon-iraq-afghanistan-guantanamo-bay
2016-02-06,04:47:20,44csbn,549,Julian Assange: 'sweet' victory soured by British and Swedish rejection. No release in sight despite UN panel deciding WikiLeaks founder is being arbitrarily detained at Ecuador embassy.,theguardian.com,http://www.theguardian.com/media/2016/feb/05/julian-assange-sweet-victory-soured-by-british-and-swedish-rejection
2016-02-06,01:26:08,44bth4,450,"Pope to meet leader of Russian Orthodox Church for first time in nearly 1,000 years",nytimes.com,http://www.nytimes.com/2016/02/06/world/europe/pope-francis-cuba-russian-orthodox-church.html
2016-02-06,08:04:15,44do6t,438,Australia guts government climate research,arstechnica.com,http://arstechnica.com/science/2016/02/australia-guts-government-climate-research/
2016-02-06,09:12:14,44dyfl,406,One of America's oldest stock exchanges has just been sold to China: The 134-year-old Chicago Stock Exchange reached a deal on Friday to be acquired by a Chinese-led group of investors.,money.cnn.com,http://money.cnn.com/2016/02/05/investing/china-buys-chicago-stock-exchange/index.html?sr=fbmoney020516china-buys-chicago-stock-exchange0857PMStoryLink&linkId=21023423
2016-02-06,22:18:03,44gcrk,373,"Syria warns Saudis against incursion, says will be resisted",reuters.com,http://www.reuters.com/article/us-mideast-crisis-syria-saudi-idUSKCN0VF0CX
2016-02-06,11:46:25,44eja1,342,"The Pentagon on Friday released 198 photographs linked to allegations of abuse of detainees in Iraq and Afghanistan, many of them showing close-ups of cuts and bruises to arms and legs of prisoners held in U.S. facilities",reuters.com,http://www.reuters.com/article/us-usa-military-abuse-idUSKCN0VE2QG
2016-02-06,20:16:00,44fz19,306,"NATO: Soldiers lives can be saved by renewable energy | Transporting fuel to war zones is extremely risky, often leading to casualties. Around 3000 American soldiers were either killed/wounded in Afghanistan while protecting fuels and water supplying convoys between 2003 and 2007",solarcrunch.org,http://www.solarcrunch.org/2016/02/nato-soldiers-lives-can-be-saved-by.html
2016-02-06,19:28:48,44fup4,298,"Taiwan Warned of Fishery Collapse – Number of species drop 75% in 30 yrs. It's headed for greatest marine ecosystem collapse on planet. Illegal & overfishing, habitat destruction, pollution & invasive species add to drop. Most dominant fish at a nuclear plant now rabbitfish instead of mullet.",ens-newswire.com,http://ens-newswire.com/2016/02/04/taiwan-warned-of-looming-fishery-collapse/
2016-02-06,08:03:17,44do15,221,Brazil Health Researchers Say Zika Virus Is Active in Saliva and Urine.,cnbc.com,http://www.cnbc.com/2016/02/05/brazil-finds-active-zika-virus-in-urine-saliva.html
2016-02-06,01:50:16,44bxle,165,'ISIS leader Abu Bakr al-Baghdadi training Mumbai girls for suicide bombings through online classes',zeenews.india.com,http://zeenews.india.com/news/india/isis-leader-abu-bakr-al-baghdadi-training-mumbai-girls-for-suicide-bombings-through-online-classes_1850748.html
2016-02-06,10:23:47,44e804,163,"While Brazil rejects Israeli envoy, it inaugurates Palestinian embassy",jpost.com,http://www.jpost.com/Israel-News/Politics-And-Diplomacy/While-Brazil-rejects-Israeli-envoy-it-inaugurates-Palestinian-embassy-443960?mob=0
2016-02-06,21:13:08,44g4sn,119,"Don't shrink Australia's ocean sanctuaries, scientists urge ministers - Federal review recommends expanding commercial fishing, which experts say is bad. “If the govt winds back what was already just partial environmental protection... it'd send a terrible message to the world.”",theguardian.com,http://www.theguardian.com/environment/2016/feb/06/dont-shrink-australias-ocean-sanctuaries-scientists-urge-ministers
2016-02-06,12:26:12,44eocj,113,Majority rank human rights above job creation in Saudi arms deal: poll,theglobeandmail.com,http://www.theglobeandmail.com/news/politics/majority-rank-human-rights-above-job-creation-in-saudi-arms-deal-poll/article28588950/
2016-02-06,23:48:07,44gowo,96,Haiti : Armed men in military fatigues marched in the capital,haitilibre.com,http://www.haitilibre.com/en/news-16523-haiti-flash-armed-men-in-military-fatigues-marched-in-the-capital.html
2016-02-06,04:09:49,44clvk,71,North Korea begins fuelling rocket,phys.org,http://phys.org/news/2016-02-north-korea-fuelling-rocket.html?
2016-02-06,06:32:53,44d9hi,68,Colombia links Zika to rare nerve disorder deaths,bbc.com,http://www.bbc.com/news/health-35506726
