2016-05-27,00:48:56,4l5ygd,28856,"Thailand has shut down 10 popular diving sites in a bid to slow a coral bleaching crisis, an official said Thursday, in a rare move to shun tourism profits to protect the environment",france24.com,http://www.france24.com/en/20160526-thailand-closes-dive-sites-over-coral-bleaching-crisis
2016-05-27,10:21:38,4l8jxw,8330,South Korea fires warning shots after boats from North cross sea border,straitstimes.com,http://www.straitstimes.com/asia/east-asia/south-korea-fires-warning-shots-after-boats-from-north-cross-sea-border
2016-05-27,18:34:59,4la09t,5742,Refugees at Nauru who are gay or attempt suicide can no longer be jailed and men are now outlawed from raping their wives after the island republic updated its antiquated criminal code.,smh.com.au,http://www.smh.com.au/federal-politics/political-news/marital-rape-no-longer-allowed-and-suicide-homosexuality-decriminalised-at-nauru-20160527-gp586w.html
2016-05-27,11:18:24,4l8rrr,3923,All references to Australia have been removed from a United Nation report on climate change after the Australian Governments Environment Department expressed concerns it could cause confusion and negatively affect tourism.,abc.net.au,http://www.abc.net.au/news/2016-05-27/australia-removed-from-un-climate-change-report/7450898
2016-05-27,06:46:26,4l7ovw,2851,"The 51C heatwave that's melting India. The impact of the heat has been devastating, and increasingly fatal, particularly for the hundreds of people dying of starvation due to withering crops in their remote fields.",m.nzherald.co.nz,http://m.nzherald.co.nz/environment/news/article.cfm?c_id=39&objectid=11645079&ref=rss
2016-05-27,02:10:09,4l6cud,1680,"""The Right to Disconnect"": Weekend Work Emails Are Now Illegal In France",huffingtonpost.com,http://www.huffingtonpost.com/entry/work-emails-france-labor-law_us_57455130e4b03ede4413515a
2016-05-27,00:14:54,4l5s8r,1583,Sharia courts in UK face Government inquiry over treatment of women: Home Office to examine claims sharia courts – or councils – may be working in a ‘discriminatory and unacceptable way’,independent.co.uk,http://www.independent.co.uk/news/uk/politics/sharia-courts-in-uk-face-government-probe-over-treatment-of-women-a7049826.html
2016-05-27,07:11:09,4l7sso,1520,Australia scrubbed from UN climate change report after govt intervention - All mentions of Australia were removed from the final version of a Unesco report on climate change and world heritage sites after the Australian govt objected on the grounds it could impact on tourism,theguardian.com,http://www.theguardian.com/environment/2016/may/27/australia-scrubbed-from-un-climate-change-report-after-government-intervention
2016-05-27,00:34:54,4l5vv4,935,War on Fat: Chile Bans McDonald's 'Happy Meals' and Kinder Eggs,telesurtv.net,http://www.telesurtv.net/english/news/War-on-Fat-Chile-Bans-McDonalds-Happy-Meals-and-Kinder-Eggs-20160525-0045.html
2016-05-27,19:50:23,4la7bg,909,"New boa constrictor species discovered on remote Caribbean island - Silver snake, with distinctive metallic appearance, discovered in Bahamas & confirmed as previously unknown species",theguardian.com,http://www.theguardian.com/environment/2016/may/27/silver-boa-constrictor-species-discovered-on-remote-caribbean-island
2016-05-27,19:25:00,4la4va,745,"71 years after the first atomic strike, Obama calls for the end of nuclear weapons at Hiroshima",washingtonpost.com,https://www.washingtonpost.com/politics/obama-visits-hiroshima-more-than-seven-decades-after-the-worlds-first-atomic-strike/2016/05/27/c7d0d250-23b6-11e6-8690-f14ca9de2972_story.html
2016-05-27,00:34:54,4l5vv6,717,A French company that was awarded the right to build Australia's $50 billion submarine fleet is tied up in a deadly multi-million dollar bribery scandal.,theage.com.au,http://www.theage.com.au/federal-politics/political-news/contractwinning-french-sub-builder-dcns-tied-up-in-deadly-malaysian-bribery-saga-20160522-gp17ce.html
2016-05-27,15:09:01,4l9h98,566,Caught on camera: US Special Forces on ISIS frontline in Syria,rt.com,https://www.rt.com/usa/344529-special-forces-isis-raqqa/
2016-05-27,11:22:52,4l8sdz,495,Police hunt Brits who Hitler-saluted in concentration camp: Authorities in Germany are searching for two British men who took a picture of themselves performing a Nazi salute in a torture chamber in Buchenwald concentration camp.,thelocal.de,http://www.thelocal.de/20160526/police-hunt-brits-who-hitler-saluted-in-nazi-death-camp
2016-05-27,02:02:16,4l6bga,480,The U.S. aviation lawyer who won compensation for victims of the 1988 Lockerbie aircraft bombing is now seeking $330 million from Russia for the downing of Malaysian Airlines MH17 in 2014,reuters.com,http://www.reuters.com/article/us-australia-mh17-russia-idUSKCN0YE0Y1
2016-05-27,08:50:14,4l87eq,474,"Indian women sold for £4,000 in Saudia Arabia and Bahrain, minister claims",independent.co.uk,http://www.independent.co.uk/news/world/asia/indian-women-sold-for-4000-in-saudia-arabia-and-bahrain-minister-claims-a7049476.html
2016-05-27,23:24:16,4laycn,380,Around 2.8 million people in three Central American countries need food aid after two consecutive years of severe drought decimated crops and exacerbated hunger among the poor.,news.trust.org,http://news.trust.org/item/20160527083536-kuvqd/?source=hpHeadlineStory
2016-05-27,03:06:07,4l6ml7,348,Ukraine bans Gorbachev over support for Crimea annexation,reuters.com,http://www.reuters.com/article/us-ukraine-crimea-gorbachev-idUSKCN0YH1UD
2016-05-27,12:26:27,4l8yeo,269,"Mars emerging from ice age that ended around 370,000 years ago, scientists say | Science | News",independent.co.uk,http://www.independent.co.uk/news/science/mars-emerging-from-ice-age-that-ended-around-370000-years-ago-scientists-say-a7050971.html
2016-05-27,07:02:37,4l7rf7,262,"Photos have emerged of American special operations troops in Syria wearing uniform insignia affiliated with a Kurdish rebel group known as the YPG, whose connection to Turkish terrorists could could fuel tension between the U.S. and a key ally in the Islamic State fight.",militarytimes.com,http://www.militarytimes.com/story/military/war-on-is/2016/05/26/green-berets-syria-kurdish-ypg-insignia/84987596/?=%5B%27recahe%27%5D
2016-05-27,21:24:22,4lahet,255,"Stonehenge, Easter Island, Venice: Climate Change Will Destroy Human History | An international team of scientists, anthropologists, and economists have identified 31 cultural and natural UNESCO World Heritage sites across 29 countries that are directly threatened by climate change.",motherboard.vice.com,http://motherboard.vice.com/en_uk/read/stonehenge-easter-island-venice-climate-change-will-destroy-human-history-unesco
2016-05-27,23:51:54,4lb2th,246,Chinese News Media Censors Taiwan’s Flag,nytimes.com,http://www.nytimes.com/2016/05/28/world/asia/taiwan-china-flag-tsai-ing-wen.html
2016-05-27,16:15:43,4l9nsn,229,An ancient Polish forest is coming down - Poland says a portion of the Bialowieza forest must be logged to curb a bark beetle outbreak but environmentalists disagree.,csmonitor.com,http://www.csmonitor.com/Environment/2016/0526/An-ancient-Polish-forest-is-coming-down.-Why
2016-05-27,23:11:09,4lawbw,216,Last Soviet leader Gorbachev banned from Ukraine,cnn.com,http://www.cnn.com/2016/05/27/europe/gorbachev-ukraine-russia-ban/
2016-05-27,06:20:09,4l7km8,186,Riot police crack down on Paris protests against labour reforms: Thousands of protesters turn out on streets of French capital as refineries and nuclear power stations across the country come to a halt,theguardian.com,http://www.theguardian.com/world/2016/may/26/riot-police-crack-down-on-paris-protests-against-labour-reforms
2016-05-27,14:12:09,4l9b6z,173,Earthquake measuring 6.3 magnitude strikes deep off Tonga,euronews.com,http://www.euronews.com/newswires/3199299-earthquake-measuring-6-point-3-magnitude-strikes-deep-off-tonga-usgs/
2016-05-27,21:21:51,4lah47,96,Norway commits to zero deforestation: The Norwegian parliament has pledged that the government’s public procurement policy will go deforestation-free,news.mongabay.com,https://news.mongabay.com/2016/05/breaking-norway-commits-zero-deforestation/
2016-05-27,17:33:58,4l9v12,91,"Israeli environment minister quits, citing rightist government tilt",yahoo.com,https://www.yahoo.com/news/israeli-environment-minister-quits-citing-rightist-government-tilt-060747734--business.html?nhp=1
2016-05-27,14:01:49,4l99y3,80,Canadian Police Chase Famous Knife-Stealing Crow For Tampering With Crime Scene Evidence,abcnews.go.com,http://abcnews.go.com/International/canadian-police-chase-famous-knife-stealing-crow-tampering/story?id=39408086&cid=abcn_fb
2016-05-27,13:40:20,4l97eb,65,"Christians have a mission to convert all Muslims, says Vatican official: “We have a mission to convert all non-Christian religions’ people except Judaism”",catholicherald.co.uk,http://www.catholicherald.co.uk/news/2016/05/23/christians-have-a-mission-to-convert-all-muslims-says-vatican-official/
