2017-02-21,03:34:19,5v6mmh,11507,Trump doubles down on Sweden claims saying its immigration policy is not 'working out',independent.co.uk,http://www.independent.co.uk/news/world/americas/us-politics/donald-trump-sweden-immigration-a7589946.html
2017-02-21,15:04:18,5va6ix,8811,"Same-sex attraction is OK, boys can cry, girl’s no means no-India's new curriculum",indianexpress.com,http://indianexpress.com/article/india/same-sex-attraction-is-ok-boys-can-cry-girls-no-means-no-health-ministry-sex-education-4535410/
2017-02-21,16:04:52,5vadgm,41194,Donald Trump state visit: MPs of all parties demand 'disgusting' US President's trip be cancelled | Debate in Westminster Hall triggered after a petition to block state visit reaches almost two million signatories,independent.co.uk,http://www.independent.co.uk/news/uk/politics/donald-trump-state-visit-mps-us-president-cancel-westminster-hall-flynn-a7590621.html
2017-02-21,01:46:24,5v5yrf,36931,Trump administration 'had a secret plan to lift Russian sanctions' and cede Ukraine territory to Moscow,independent.co.uk,http://www.independent.co.uk/news/world/americas/us-politics/donald-trump-russia-sanctions-secret-plan-ukraine-michael-cohen-a7590441.html
2017-02-21,20:19:00,5vb6aq,5208,"Iran bans chess grandmaster Dorsa Derakhshani for not wearing hijab, brother for playing with Israeli : FYI, News",indiatoday.intoday.in,http://indiatoday.intoday.in/story/iran-hijab-chess-dorsa-derakhshani/1/887830.html
2017-02-21,00:41:20,5v5jsr,4713,Marine Le Pen's Front National headquarters raided by police,theguardian.com,https://www.theguardian.com/world/2017/feb/20/marine-le-pen-front-national-headquarters-raided-by-police
2017-02-21,01:45:57,5v5ynl,3842,Nasa to host major press conference on 'discovery beyond our solar system,independent.co.uk,http://www.independent.co.uk/news/science/nasa-announcement-press-conference-today-solar-system-exoplanet-sun-planets-news-latest-a7590281.html
2017-02-21,23:19:37,5vc0rt,3580,Vancouver man denied entry into United States after US Customs and Border Patrol officer read his profile on the gay hookup app Scruff,dailyxtra.com,http://www.dailyxtra.com/canada/news-and-ideas/news/us-customs-block-canadian-man-reading-scruff-profile-215531
2017-02-21,10:35:05,5v9127,3127,Low concentrations of airborne radioactive Iodine-131 detected thourghout northern Europe; Source unknown,greenoptimistic.com,https://www.greenoptimistic.com/radiation-northern-europe-20170220/#.WKunJG_hC01
2017-02-21,18:06:52,5vaqxk,3280,French far-right's Le Pen refuses to wear headscarf to meet Lebanon's Grand Mufti,reuters.com,http://www.reuters.com/article/us-france-election-lepen-idUSKBN1600R6
2017-02-21,21:27:01,5vbgnq,2658,Study: Venezuelans lost 19 lbs. on average over past year due to lack of food,foxnews.com,http://www.foxnews.com/world/2017/02/20/study-venezuelans-lost-19-lb-on-average-over-past-year-due-to-lack-food.html
2017-02-21,13:17:39,5v9s2y,1260,"MPs have reacted with incredulity after the boss of Volkswagen told them the company in Europe had done nothing wrong and “misled nobody”, despite having agreed a multibillion-dollar settlement in the US over the emissions-rigging scandal.",amp.theguardian.com,https://amp.theguardian.com/business/2017/feb/21/volkswagen-boss-says-company-misled-nobody-over-emissions-rigging-scandal
2017-02-21,21:48:08,5vbk83,1123,"NATO Intercepts Russian Bombers Above Baltic Twice in One Week: The uptick of Russian approaches to the airspace of Estonia, Latvia and Lithuania since Moscow’s annexation of Crimea in 2014—has unnerved and convinced them that the Kremlin may harbor similar designs for their lands.",newsweek.com,http://www.newsweek.com/nato-intercepts-russian-bombers-above-baltic-twice-week-559096
2017-02-21,09:38:23,5v8qrp,1121,Plane crash on shopping centre in Melbourne,smh.com.au,http://www.smh.com.au/victoria/live-essendon-airport-crash-20170220-guhf2x.html
2017-02-21,01:37:21,5v5woj,1086,Russia UN ambassador Vitaly Churkin dead,edition.cnn.com,http://edition.cnn.com/2017/02/20/europe/russia-un-ambassador-vitaly-churkin-dead/index.html?adkey=bn
2017-02-21,06:09:51,5v7kc0,867,Montreal votes to become a sanctuary city for undocumented immigrants,montreal.ctvnews.ca,http://montreal.ctvnews.ca/montreal-votes-to-become-a-sanctuary-city-for-undocumented-immigrants-1.3292952
2017-02-21,18:35:22,5vatzw,863,"Putin’s holy war: In the former atheist stronghold, a law ‘protecting the feelings’ of religious believers enforces Russian Orthodox Christianity.",politico.eu,http://www.politico.eu/article/putins-holy-war/
2017-02-21,20:04:15,5vb4at,853,Barcelona police shoot at man driving lorry loaded with butane gas tanks at high speed against traffic,independent.co.uk,http://www.independent.co.uk/news/world/europe/truck-barcelona-spain-butane-gas-latest-police-shoot-high-speed-traffic-detain-a7591231.html
2017-02-21,19:27:23,5vazxh,826,74 bodies of migrants wash ashore in Libya,bigstory.ap.org,http://bigstory.ap.org/article/63476a0c834649a0b425f6da5b4c998d/red-crescent-74-bodies-migrants-wash-ashore-libya
2017-02-21,06:49:39,5v7slp,727,Donald Trump: Thousands of protesters across the UK demonstrate against US President as MPs debate state visit,independent.co.uk,http://www.independent.co.uk/news/uk/donald-trump-protests-uk-thousands-protesters-demonstrate-against-us-president-mps-debate-state-a7590651.html
2017-02-21,23:58:47,5vc8ol,649,"British Muslim teacher taken off US-bound flight: I was treated like a criminal - Juhel Miah, 25, calls for explanation for treatment by US officials, which left him feeling angry & humiliated",theguardian.com,https://www.theguardian.com/us-news/2017/feb/21/british-muslim-teacher-taken-off-us-bound-flight-i-was-treated-like-a-criminal
2017-02-21,20:27:03,5vb7dp,569,Germany to check refugees’ phones in identity crackdown,news.cgtn.com,https://news.cgtn.com/news/3d6b7a4d77596a4d/share_p.html?t=1487663536411
2017-02-21,20:48:18,5vbahx,443,Three held for 'planning French attack' - BBC News,bbc.com,http://www.bbc.com/news/world-europe-39042196
2017-02-21,01:46:11,5v5ypb,377,The self-confessed leader of the Davao Death Squad accused Philippines President Rodrigo Duterte of ordering mosque bombings and the murder of a journalist during his time as Davao mayor,cnn.com,http://www.cnn.com/2017/02/20/asia/arturo-lascanas-philippines-death-squad/index.html
2017-02-21,18:30:08,5vatg1,198,Welsh Muslim teacher denied entry to US on school trip from Iceland,bbc.co.uk,http://www.bbc.co.uk/news/uk-wales-south-west-wales-39032062
2017-02-21,21:35:42,5vbi3m,195,"Africa's Other Elephant Is Fading Fast: In a supposedly safe national park, poachers have slaughtered 80% of these elusive animals in just ten years.",theatlantic.com,https://www.theatlantic.com/science/archive/2017/02/forest-elephant-extinction-minkebe-gabon-ivory-poaching/517266/
2017-02-21,06:18:30,5v7m3h,128,"After seven years of bailouts, Greeks sink yet deeper in poverty",reuters.com,http://www.reuters.com/article/us-eurozone-greece-poverty-idUSKBN15Z1NM
2017-02-21,22:59:38,5vbwx4,122,Dutch MPs vote in favour of regulated marijuana cultivation,dutchnews.nl,http://www.dutchnews.nl/news/archives/2017/02/dutch-mps-vote-in-favour-of-regulated-marijuana-cultivation/
2017-02-21,09:18:04,5v8mu7,118,"The last 300 members of the Revolutionary Armed Forces of Colombia, also known as FARC, began disarming on Sunday in a transition zone arranged as part of a peace agreement last year.",pbs.org,http://www.pbs.org/newshour/rundown/50-years-war-last-farc-rebels-lay-arms/
2017-02-21,18:15:18,5varwm,89,Heterosexual couple lose civil partnership challenge - BBC News,bbc.co.uk,http://www.bbc.co.uk/news/uk-39039146?ocid=socialflow_twitter&#38;ns_mchannel=social&#38;ns_campaign=bbcnews&#38;ns_source=twitter
