2017-02-22,00:37:24,5vch60,46978,"""We Won't Block Pirate Bay,"" Swedish Telecoms Giant Says",torrentfreak.com,https://torrentfreak.com/wont-block-pirate-bay-swedish-telecoms-giant-says-170221/
2017-02-22,21:14:56,5vilb9,37982,Worst-ever coral bleaching event goes into unprecedented 4th year: Sea surface temperatures are so high that Australia divers are already reporting new bleaching in the part of the Great Barrier Reef where last yr 1/2 of corals died.,newscientist.com,https://www.newscientist.com/article/2122016-worst-ever-coral-bleaching-event-continues-into-fourth-year/
2017-02-22,09:46:16,5vft41,51931,Donald Trump's claims his team had no contact with Russia during campaign contradicted by Moscow officials,independent.co.uk,http://www.independent.co.uk/news/world/americas/us-politics/donald-trump-russia-michael-flynn-2016-election-campaign-us-security-services-a7592526.html
2017-02-22,00:22:37,5vcdz0,10778,Trump's lawyer has told 4 different stories about the Russia-Ukraine 'peace plan' debacle,businessinsider.com,http://www.businessinsider.com/trump-lawyer-michael-cohen-russia-ukraine-peace-plan-2017-2
2017-02-22,19:28:14,5vi5x2,7533,"The German state of Bavaria has announced plans to ban the full-face veil in government workplaces, schools, universities and while driving.",bbc.co.uk,http://www.bbc.co.uk/news/world-europe-39050718?ocid=socialflow_twitter
2017-02-22,22:34:33,5viz3y,13066,Sweden’s official Twitter account debunks Donald Trump claims line by line,independent.co.uk,http://www.independent.co.uk/news/world/americas/sweden-donald-trump-official-twitter-refugee-rape-attack-claims-debunk-immigration-a7592821.html
2017-02-22,23:14:07,5vj73x,5879,"Donald Trump has made the world a 'darker, unstable place', says Amnesty International",independent.co.uk,http://www.independent.co.uk/news/world/americas/amnesty-international-donald-trump-world-darker-unstable-place-viktor-orban-recep-tayyip-erdogan-a7593386.html
2017-02-22,03:30:03,5vdk94,4065,Riots erupt in Swedish capital,edition.cnn.com,http://edition.cnn.com/2017/02/21/europe/sweden-stockholm-riots/index.html
2017-02-22,21:27:12,5vinb3,3060,"Thula Thula Rhino Orphanage in South Africa attacked, baby rhino/s killed, care-givers savagely beaten and a young woman sexually assaulted.",africageographic.com,http://africageographic.com/blog/rhino-orphanage-attacked-please-help/
2017-02-22,21:29:59,5vinrf,2736,$1.8 Billion Of India’s Coal Tax Invested In Renewable Energy So Far,cleantechnica.com,https://cleantechnica.com/2017/02/21/1-8-billion-indias-coal-tax-invested-renewable-energy-far/
2017-02-22,16:11:28,5vhimi,1993,"7,000 Railway Stations In India To Go Solar",cleantechnica.com,https://cleantechnica.com/2017/02/21/7000-railways-stations-india-go-solar/
2017-02-22,12:57:32,5vgrig,1533,U.S. extradition OK'd for Ukrainian billionaire indicted in Chicago and linked to Trump,chicagotribune.com,http://www.chicagotribune.com/news/nationworld/ct-dymitro-firtash-ukrainian-oligarch-austria-extradition-20170221-story.html
2017-02-22,02:04:45,5vd0kc,1440,"Clear evidence Russia interfered in 2015 UK election, says former Labour minister",independent.co.uk,http://www.independent.co.uk/news/uk/home-news/chris-bryant-russia-interfered-uk-election-former-labour-minister-2015-vladimir-putin-cyber-attack-a7592226.html
2017-02-22,13:42:03,5vgyj7,1194,"Kim Jong-nam's body targeted in morgue break-in, say police",theguardian.com,https://www.theguardian.com/world/2017/feb/22/kim-jong-nams-body-targeted-in-morgue-break-in
2017-02-22,22:26:30,5vixnf,757,Kuwaiti hospital ‘will refuse to treat migrant labourers’. First new public hospital in more than three decades will not treat Gulf state’s huge foreign-born worker population in latest step targeting foreigners,independent.co.uk,http://www.independent.co.uk/news/world/middle-east/kuwait-city-migrant-workers-discrimination-new-hospital-a7593406.html
2017-02-22,14:29:10,5vh5ju,692,Corbett Tiger Reserve gets nod to kill poachers,thehindu.com,http://www.thehindu.com/news/national/other-states/Corbett-gets-nod-to-kill-poachers/article17343271.ece1
2017-02-22,22:36:12,5vizf8,618,Geert Wilders: Far-right Dutch PM frontrunner says 'Islam and freedom are not compatible',independent.co.uk,http://www.independent.co.uk/news/world/europe/geert-wilders-dutch-pm-frontrunner-far-right-islamophobic-freedom-a7593466.html
2017-02-22,16:51:59,5vhn7d,566,Iodine-131 spikes seen across Europe after unknown event.,independent.co.uk,http://www.independent.co.uk/life-style/gadgets-and-tech/news/radiation-europe-russian-missile-strike-radioactive-material-france-norway-iodine-131-irsn-a7591886.html
2017-02-22,04:23:37,5vdws9,548,Mysterious radiation spreading across Europe as US deploys Constant Phoenix 'nuclear sniffer' aircraft,belfasttelegraph.co.uk,http://www.belfasttelegraph.co.uk/technology/mysterious-radiation-spreading-across-europe-as-us-deploys-constant-phoenix-nuclear-sniffer-aircraft-35470288.html
2017-02-22,12:38:50,5vgohv,481,Australian Federal Government has approved the sale of medical marijuana,abc.net.au,http://www.abc.net.au/news/2017-02-22/government-approves-sale-of-medicinal-marijuana/8291884
2017-02-22,20:29:50,5vie5y,467,Mexican man kills himself just after being deported from US - He was shouting he did not want to return to Mexico & was in severe distress when he jumped off bridge near border crossing point. A plastic bag like US Customs put migrants' belongings in was next to him.,bbc.com,http://www.bbc.com/news/world-latin-america-39049670
2017-02-22,00:39:15,5vchk1,422,‘No Jews’: Toronto police investigate anti-semitic notes left on doorsteps,independent.co.uk,http://www.independent.co.uk/news/world/americas/no-jews-anti-semitism-toronto-police-investigate-doorsteps-canada-racism-hate-justin-trudeau-john-a7591996.html
2017-02-22,06:34:12,5vepyw,427,Trudeau says Canada won't halt illegal border crossing despite opposition,newsweek.com,http://www.newsweek.com/justin-trudeau-canada-immigration-border-border-crossing-559340
2017-02-22,10:04:03,5vfwi0,367,"Canada to spend $28 million to give asylum to 1,200 more Yazidi refugees fleeing ISIL",nationalpost.com,http://www.nationalpost.com/m/wp/news/canada/blog.html?b=news.nationalpost.com/news/canada/canada-to-give-asylum-to-1200-primarily-yazidi-refugees-by-year-end
2017-02-22,01:46:42,5vcwho,317,"In Mexican cave system, scientists discover life trapped in crystals",beta.theglobeandmail.com,https://beta.theglobeandmail.com/news/world/in-mexican-cave-system-scientists-discover-life-trapped-in-crystals/article34083466/?ref=http://www.theglobeandmail.com&click=sf_globefb&service=mobile
2017-02-22,03:37:53,5vdm3v,292,Trump to exclude U.S. 'dreamer' migrants from crackdown,reuters.com,http://www.reuters.com/article/us-usa-immigration-border-idUSKBN1601XE?utm_source=twitter&utm_medium=Social
2017-02-22,17:35:38,5vhsa5,238,"Article 50 is actually reversible, author of the Brexit treaty clause says - Lord Kerr ridiculed the UK Government's claims",independent.co.uk,http://www.independent.co.uk/news/uk/politics/article-50-brexit-reversible-lord-kerr-a7592241.html
2017-02-22,10:00:43,5vfvus,230,"Life expectancy to break 90 barrier by 2030 - South Korean women will be the first in the world to have an average life expectancy above 90, a study suggests",bbc.com,http://www.bbc.com/news/health-39040146
2017-02-22,23:10:00,5vj67e,226,A ban on female army officers in Turkey wearing the Muslim headscarf has been lifted by the government. The military is the last Turkish institution to see the ban removed. It has long been seen as the guardian of Turkey's secular constitution.,bbc.com,http://www.bbc.com/news/world-europe-39053064
2017-02-22,05:38:55,5vedth,192,NYC medical examiner says more study needed in death of Russian diplomat,cbsnews.com,http://www.cbsnews.com/news/nyc-medical-examiner-says-more-study-needed-in-death-of-russian-diplomat/
